gemlite/configs/5090.json
{"GEMV": {}, "GEMV_REVSPLITK": {"(1, 4096, 4096, 64, 8, 104)": {"BLOCK_SIZE_M": 1, "BLOCK_SIZE_N": 256, "BLOCK_SIZE_K": 16, "A_load_order": 1, "dot_prod_mode": 0, "num_warps": 2, "num_ctas": 1, "num_stages": 1, "num_buffers_warp_spec": 0, "num_consumer_groups": 0, "reg_dec_producer": 0, "reg_inc_consumer": 0}, "(1, 1024, 4096, 64, 8, 104)": {"BLOCK_SIZE_M": 1, "BLOCK_SIZE_N": 64, "BLOCK_SIZE_K": 16, "A_load_order": 0, "dot_prod_mode": 0, "num_warps": 1, "num_ctas": 1, "num_stages": 2, "num_buffers_warp_spec": 0, "num_consumer_groups": 0, "reg_dec_producer": 0, "reg_inc_consumer": 0}, "(1, 14336, 4096, 64, 8, 104)": {"BLOCK_SIZE_M": 1, "BLOCK_SIZE_N": 512, "BLOCK_SIZE_K": 32, "A_load_order": 1, "dot_prod_mode": 0, "num_warps": 4, "num_ctas": 1, "num_stages": 1, "num_buffers_warp_spec": 0, "num_consumer_groups": 0, "reg_dec_producer": 0, "reg_inc_consumer": 0}, "(1, 4096, 14336, 64, 8, 104)": {"BLOCK_SIZE_M": 1, "BLOCK_SIZE_N": 256, "BLOCK_SIZE_K": 8, "A_load_order": 1, "dot_prod_mode": 0, "num_warps": 4, "num_ctas": 1, "num_stages": 1, "num_buffers_warp_spec": 0, "num_consumer_groups": 0, "reg_dec_producer": 0, "reg_inc_consumer": 0}, "(1, 6144, 4096, 64, 8, 104)": {"BLOCK_SIZE_M": 1, "BLOCK_SIZE_N": 512, "BLOCK_SIZE_K": 16, "A_load_order": 1, "dot_prod_mode": 0, "num_warps": 4, "num_ctas": 1, "num_stages": 1, "num_buffers_warp_spec": 0, "num_consumer_groups": 0, "reg_dec_producer": 0, "reg_inc_consumer": 0}, "(1, 28672, 4096, 64, 8, 104)": {"BLOCK_SIZE_M": 1, "BLOCK_SIZE_N": 128, "BLOCK_SIZE_K": 8, "A_load_order": 0, "dot_prod_mode": 0, "num_warps": 1, "num_ctas": 1, "num_stages": 2, "num_buffers_warp_spec": 0, "num_consumer_groups": 0, "reg_dec_producer": 0, "reg_inc_consumer": 0}, "(1, 3584, 3584, 64, 8, 104)": {"BLOCK_SIZE_M": 1, "BLOCK_SIZE_N": 128, "BLOCK_SIZE_K": 16, "A_load_order": 0, "dot_prod_mode": 0, "num_warps": 1, "num_ctas": 1, "num_stages": 1, "num_buffers_warp_spec": 0, "num_consumer_groups": 0, "reg_dec_producer": 0, "reg_inc_consumer": 0}, "(1, 4608, 3584, 64, 8, 104)": {"BLOCK_SIZE_M": 1, "BLOCK_SIZE_N": 512, "BLOCK_SIZE_K": 16, "A_load_order": 0, "dot_prod_mode": 0, "num_warps": 4, "num_ctas": 1, "num_stages": 2, "num_buffers_warp_spec": 0, "num_consumer_groups": 0, "reg_dec_producer": 0, "reg_inc_consumer": 0}, "(1, 3584, 18944, 64, 8, 104)": {"BLOCK_SIZE_M": 1, "BLOCK_SIZE_N": 256, "BLOCK_SIZE_K": 8, "A_load_order": 0, "dot_prod_mode": 0, "num_warps": 4, "num_ctas": 1, "num_stages": 2, "num_buffers_warp_spec": 0, "num_consumer_groups": 0, "reg_dec_producer": 0, "reg_inc_consumer": 0}, "(1, 37888, 3584, 64, 8, 104)": {"BLOCK_SIZE_M": 1, "BLOCK_SIZE_N": 128, "BLOCK_SIZE_K": 8, "A_load_order": 1, "dot_prod_mode": 0, "num_warps": 1, "num_ctas": 1, "num_stages": 1, "num_buffers_warp_spec": 0, "num_consumer_groups": 0, "reg_dec_producer": 0, "reg_inc_consumer": 0}, "(1, 4096, 4096, 128, 8, 104)": {"BLOCK_SIZE_M": 1, "BLOCK_SIZE_N": 512, "BLOCK_SIZE_K": 16, "A_load_order": 0, "dot_prod_mode": 0, "num_warps": 4, "num_ctas": 1, "num_stages": 2, "num_buffers_warp_spec": 0, "num_consumer_groups": 0, "reg_dec_producer": 0, "reg_inc_consumer": 0}, "(1, 1024, 4096, 128, 8, 104)": {"BLOCK_SIZE_M": 1, "BLOCK_SIZE_N": 64, "BLOCK_SIZE_K": 16, "A_load_order": 1, "dot_prod_mode": 0, "num_warps": 1, "num_ctas": 1, "num_stages": 2, "num_buffers_warp_spec": 0, "num_consumer_groups": 0, "reg_dec_producer": 0, "reg_inc_consumer": 0}, "(1, 14336, 4096, 128, 8, 104)": {"BLOCK_SIZE_M": 1, "BLOCK_SIZE_N": 512, "BLOCK_SIZE_K": 8, "A_load_order": 0, "dot_prod_mode": 0, "num_warps": 4, "num_ctas": 1, "num_stages": 2, "num_buffers_warp_spec": 0, "num_consumer_groups": 0, "reg_dec_producer": 0, "reg_inc_consumer": 0}, "(1, 4096, 14336, 128, 8, 104)": {"BLOCK_SIZE_M": 1, "BLOCK_SIZE_N": 512, "BLOCK_SIZE_K": 64, "A_load_order": 1, "dot_prod_mode": 0, "num_warps": 4, "num_ctas": 1, "num_stages": 1, "num_buffers_warp_spec": 0, "num_consumer_groups": 0, "reg_dec_producer": 0, "reg_inc_consumer": 0}, "(1, 128256, 4096, 128, 8, 104)": {"BLOCK_SIZE_M": 1, "BLOCK_SIZE_N": 256, "BLOCK_SIZE_K": 16, "A_load_order": 0, "dot_prod_mode": 0, "num_warps": 2, "num_ctas": 1, "num_stages": 2, "num_buffers_warp_spec": 0, "num_consumer_groups": 0, "reg_dec_producer": 0, "reg_inc_consumer": 0}, "(1, 8192, 5120, 128, 8, 104)": {"BLOCK_SIZE_M": 1, "BLOCK_SIZE_N": 128, "BLOCK_SIZE_K": 64, "A_load_order": 0, "dot_prod_mode": 0, "num_warps": 1, "num_ctas": 1, "num_stages": 2, "num_buffers_warp_spec": 0, "num_consumer_groups": 0, "reg_dec_producer": 0, "reg_inc_consumer": 0}, "(1, 1024, 5120, 128, 8, 104)": {"BLOCK_SIZE_M": 1, "BLOCK_SIZE_N": 512, "BLOCK_SIZE_K": 32, "A_load_order": 0, "dot_prod_mode": 0, "num_warps": 4, "num_ctas": 1, "num_stages": 1, "num_buffers_warp_spec": 0, "num_consumer_groups": 0, "reg_dec_producer": 0, "reg_inc_consumer": 0}, "(1, 5120, 8192, 128, 8, 104)": {"BLOCK_SIZE_M": 1, "BLOCK_SIZE_N": 256, "BLOCK_SIZE_K": 32, "A_load_order": 1, "dot_prod_mode": 0, "num_warps": 2, "num_ctas": 1, "num_stages": 2, "num_buffers_warp_spec": 0, "num_consumer_groups": 0, "reg_dec_producer": 0, "reg_inc_consumer": 0}, "(1, 25600, 5120, 128, 8, 104)": {"BLOCK_SIZE_M": 1, "BLOCK_SIZE_N": 512, "BLOCK_SIZE_K": 8, "A_load_order": 0, "dot_prod_mode": 0, "num_warps": 4, "num_ctas": 1, "num_stages": 1, "num_buffers_warp_spec": 0, "num_consumer_groups": 0, "reg_dec_producer": 0, "reg_inc_consumer": 0}, "(1, 5120, 25600, 128, 8, 104)": {"BLOCK_SIZE_M": 1, "BLOCK_SIZE_N": 512, "BLOCK_SIZE_K": 16, "A_load_order": 1, "dot_prod_mode": 0, "num_warps": 4, "num_ctas": 1, "num_stages": 2, "num_buffers_warp_spec": 0, "num_consumer_groups": 0, "reg_dec_producer": 0, "reg_inc_consumer": 0}, "(1, 151936, 5120, 128, 8, 104)": {"BLOCK_SIZE_M": 1, "BLOCK_SIZE_N": 256, "BLOCK_SIZE_K": 16, "A_load_order": 0, "dot_prod_mode": 0, "num_warps": 2, "num_ctas": 1, "num_stages": 2, "num_buffers_warp_spec": 0, "num_consumer_groups": 0, "reg_dec_producer": 0, "reg_inc_consumer": 0}, "(1, 3072, 3072, 64, 8, 104)": {"BLOCK_SIZE_M": 1, "BLOCK_SIZE_N": 128, "BLOCK_SIZE_K": 16, "A_load_order": 0, "dot_prod_mode": 0, "num_warps": 1, "num_ctas": 1, "num_stages": 2, "num_buffers_warp_spec": 0, "num_consumer_groups": 0, "reg_dec_producer": 0, "reg_inc_consumer": 0}, "(1, 5120, 3072, 64, 8, 104)": {"BLOCK_SIZE_M": 1, "BLOCK_SIZE_N": 256, "BLOCK_SIZE_K": 32, "A_load_order": 0, "dot_prod_mode": 0, "num_warps": 2, "num_ctas": 1, "num_stages": 1, "num_buffers_warp_spec": 0, "num_consumer_groups": 0, "reg_dec_producer": 0, "reg_inc_consumer": 0}, "(1, 3072, 8192, 64, 8, 104)": {"BLOCK_SIZE_M": 1, "BLOCK_SIZE_N": 128, "BLOCK_SIZE_K": 32, "A_load_order": 0, "dot_prod_mode": 0, "num_warps": 1, "num_ctas": 1, "num_stages": 2, "num_buffers_warp_spec": 0, "num_consumer_groups": 0, "reg_dec_producer": 0, "reg_inc_consumer": 0}, "(1, 16384, 3072, 64, 8, 104)": {"BLOCK_SIZE_M": 1, "BLOCK_SIZE_N": 512, "BLOCK_SIZE_K": 32, "A_load_order": 1, "dot_prod_mode": 0, "num_warps": 4, "num_ctas": 1, "num_stages": 2, "num_buffers_warp_spec": 0, "num_consumer_groups": 0, "reg_dec_producer": 0, "reg_inc_consumer": 0}}, "GEMV_SPLITK": {"(1, 4096, 4096, 4096, 1, 408)": {"BLOCK_SIZE_M": 1, "BLOCK_SIZE_N": 4, "BLOCK_SIZE_K": 1024, "GROUP_SIZE_M": 8, "SPLIT_K": 1, "A_load_order": 0, "dot_prod_mode": 0, "num_warps": 4, "num_ctas": 1, "num_stages": 2, "num_buffers_warp_spec": 0, "num_consumer_groups": 0, "reg_dec_producer": 0, "reg_inc_consumer": 0}, "(1, 1024, 4096, 4096, 1, 408)": {"BLOCK_SIZE_M": 1, "BLOCK_SIZE_N": 1, "BLOCK_SIZE_K": 1024, "GROUP_SIZE_M": 8, "SPLIT_K": 1, "A_load_order": 1, "dot_prod_mode": 0, "num_warps": 4, "num_ctas": 1, "num_stages": 1, "num_buffers_warp_spec": 0, "num_consumer_groups": 0, "reg_dec_producer": 0, "reg_inc_consumer": 0}, "(1, 14336, 4096, 4096, 1, 408)": {"BLOCK_SIZE_M": 1, "BLOCK_SIZE_N": 1, "BLOCK_SIZE_K": 1024, "GROUP_SIZE_M": 8, "SPLIT_K": 1, "A_load_order": 1, "dot_prod_mode": 0, "num_warps": 4, "num_ctas": 1, "num_stages": 1, "num_buffers_warp_spec": 0, "num_consumer_groups": 0, "reg_dec_producer": 0, "reg_inc_consumer": 0}, "(1, 4096, 14336, 14336, 1, 408)": {"BLOCK_SIZE_M": 1, "BLOCK_SIZE_N": 4, "BLOCK_SIZE_K": 2048, "GROUP_SIZE_M": 8, "SPLIT_K": 1, "A_load_order": 1, "dot_prod_mode": 0, "num_warps": 4, "num_ctas": 1, "num_stages": 1, "num_buffers_warp_spec": 0, "num_consumer_groups": 0, "reg_dec_producer": 0, "reg_inc_consumer": 0}, "(1, 128256, 4096, 4096, 1, 408)": {"BLOCK_SIZE_M": 1, "BLOCK_SIZE_N": 1, "BLOCK_SIZE_K": 1024, "GROUP_SIZE_M": 8, "SPLIT_K": 1, "A_load_order": 1, "dot_prod_mode": 0, "num_warps": 4, "num_ctas": 1, "num_stages": 2, "num_buffers_warp_spec": 0, "num_consumer_groups": 0, "reg_dec_producer": 0, "reg_inc_consumer": 0}, "(1, 6144, 4096, 4096, 1, 408)": {"BLOCK_SIZE_M": 1, "BLOCK_SIZE_N": 4, "BLOCK_SIZE_K": 512, "GROUP_SIZE_M": 8, "SPLIT_K": 1, "A_load_order": 0, "dot_prod_mode": 0, "num_warps": 4, "num_ctas": 1, "num_stages": 1, "num_buffers_warp_spec": 0, "num_consumer_groups": 0, "reg_dec_producer": 0, "reg_inc_consumer": 0}, "(1, 28672, 4096, 4096, 1, 408)": {"BLOCK_SIZE_M": 1, "BLOCK_SIZE_N": 64, "BLOCK_SIZE_K": 128, "GROUP_SIZE_M": 8, "SPLIT_K": 1, "A_load_order": 0, "dot_prod_mode": 0, "num_warps": 4, "num_ctas": 1, "num_stages": 1, "num_buffers_warp_spec": 0, "num_consumer_groups": 0, "reg_dec_producer": 0, "reg_inc_consumer": 0}, "(1, 3584, 3584, 3584, 1, 408)": {"BLOCK_SIZE_M": 1, "BLOCK_SIZE_N": 2, "BLOCK_SIZE_K": 512, "GROUP_SIZE_M": 8, "SPLIT_K": 1, "A_load_order": 0, "dot_prod_mode": 0, "num_warps": 4, "num_ctas": 1, "num_stages": 1, "num_buffers_warp_spec": 0, "num_consumer_groups": 0, "reg_dec_producer": 0, "reg_inc_consumer": 0}, "(1, 4608, 3584, 3584, 1, 408)": {"BLOCK_SIZE_M": 1, "BLOCK_SIZE_N": 4, "BLOCK_SIZE_K": 512, "GROUP_SIZE_M": 8, "SPLIT_K": 1, "A_load_order": 0, "dot_prod_mode": 0, "num_warps": 4, "num_ctas": 1, "num_stages": 1, "num_buffers_warp_spec": 0, "num_consumer_groups": 0, "reg_dec_producer": 0, "reg_inc_consumer": 0}, "(1, 3584, 18944, 18944, 1, 408)": {"BLOCK_SIZE_M": 1, "BLOCK_SIZE_N": 4, "BLOCK_SIZE_K": 512, "GROUP_SIZE_M": 8, "SPLIT_K": 1, "A_load_order": 0, "dot_prod_mode": 0, "num_warps": 4, "num_ctas": 1, "num_stages": 1, "num_buffers_warp_spec": 0, "num_consumer_groups": 0, "reg_dec_producer": 0, "reg_inc_consumer": 0}, "(1, 37888, 3584, 3584, 1, 408)": {"BLOCK_SIZE_M": 1, "BLOCK_SIZE_N": 64, "BLOCK_SIZE_K": 128, "GROUP_SIZE_M": 8, "SPLIT_K": 1, "A_load_order": 0, "dot_prod_mode": 0, "num_warps": 4, "num_ctas": 1, "num_stages": 2, "num_buffers_warp_spec": 0, "num_consumer_groups": 0, "reg_dec_producer": 0, "reg_inc_consumer": 0}, "(1, 3072, 3072, 3072, 1, 408)": {"BLOCK_SIZE_M": 1, "BLOCK_SIZE_N": 2, "BLOCK_SIZE_K": 1024, "GROUP_SIZE_M": 8, "SPLIT_K": 1, "A_load_order": 0, "dot_prod_mode": 0, "num_warps": 4, "num_ctas": 1, "num_stages": 1, "num_buffers_warp_spec": 0, "num_consumer_groups": 0, "reg_dec_producer": 0, "reg_inc_consumer": 0}, "(1, 5120, 3072, 3072, 1, 408)": {"BLOCK_SIZE_M": 1, "BLOCK_SIZE_N": 4, "BLOCK_SIZE_K": 1024, "GROUP_SIZE_M": 8, "SPLIT_K": 1, "A_load_order": 0, "dot_prod_mode": 0, "num_warps": 4, "num_ctas": 1, "num_stages": 1, "num_buffers_warp_spec": 0, "num_consumer_groups": 0, "reg_dec_producer": 0, "reg_inc_consumer": 0}, "(1, 3072, 8192, 8192, 1, 408)": {"BLOCK_SIZE_M": 1, "BLOCK_SIZE_N": 1, "BLOCK_SIZE_K": 2048, "GROUP_SIZE_M": 8, "SPLIT_K": 1, "A_load_order": 0, "dot_prod_mode": 0, "num_warps": 8, "num_ctas": 1, "num_stages": 2, "num_buffers_warp_spec": 0, "num_consumer_groups": 0, "reg_dec_producer": 0, "reg_inc_consumer": 0}, "(1, 3072, 256, 256, 1, 108)": {"BLOCK_SIZE_M": 1, "BLOCK_SIZE_N": 32, "BLOCK_SIZE_K": 256, "GROUP_SIZE_M": 8, "SPLIT_K": 1, "A_load_order": 0, "dot_prod_mode": 0, "num_warps": 4, "num_ctas": 1, "num_stages": 1, "num_buffers_warp_spec": 0, "num_consumer_groups": 0, "reg_dec_producer": 0, "reg_inc_consumer": 0}, "(1, 3072, 3072, 3072, 1, 108)": {"BLOCK_SIZE_M": 1, "BLOCK_SIZE_N": 4, "BLOCK_SIZE_K": 1024, "GROUP_SIZE_M": 8, "SPLIT_K": 1, "A_load_order": 0, "dot_prod_mode": 0, "num_warps": 4, "num_ctas": 1, "num_stages": 2, "num_buffers_warp_spec": 0, "num_consumer_groups": 0, "reg_dec_producer": 0, "reg_inc_consumer": 0}, "(1, 3072, 768, 768, 1, 108)": {"BLOCK_SIZE_M": 1, "BLOCK_SIZE_N": 16, "BLOCK_SIZE_K": 64, "GROUP_SIZE_M": 8, "SPLIT_K": 1, "A_load_order": 0, "dot_prod_mode": 0, "num_warps": 8, "num_ctas": 1, "num_stages": 1, "num_buffers_warp_spec": 0, "num_consumer_groups": 0, "reg_dec_producer": 0, "reg_inc_consumer": 0}, "(1, 18432, 3072, 3072, 1, 108)": {"BLOCK_SIZE_M": 1, "BLOCK_SIZE_N": 16, "BLOCK_SIZE_K": 256, "GROUP_SIZE_M": 8, "SPLIT_K": 1, "A_load_order": 0, "dot_prod_mode": 0, "num_warps": 4, "num_ctas": 1, "num_stages": 2, "num_buffers_warp_spec": 0, "num_consumer_groups": 0, "reg_dec_producer": 0, "reg_inc_consumer": 0}, "(1, 9216, 3072, 3072, 1, 108)": {"BLOCK_SIZE_M": 1, "BLOCK_SIZE_N": 16, "BLOCK_SIZE_K": 512, "GROUP_SIZE_M": 8, "SPLIT_K": 1, "A_load_order": 0, "dot_prod_mode": 0, "num_warps": 8, "num_ctas": 1, "num_stages": 1, "num_buffers_warp_spec": 0, "num_consumer_groups": 0, "reg_dec_producer": 0, "reg_inc_consumer": 0}, "(1, 6144, 3072, 3072, 1, 108)": {"BLOCK_SIZE_M": 1, "BLOCK_SIZE_N": 8, "BLOCK_SIZE_K": 1024, "GROUP_SIZE_M": 8, "SPLIT_K": 1, "A_load_order": 0, "dot_prod_mode": 0, "num_warps": 4, "num_ctas": 1, "num_stages": 1, "num_buffers_warp_spec": 0, "num_consumer_groups": 0, "reg_dec_producer": 0, "reg_inc_consumer": 0}, "(1, 3072, 256, 256, 1, 408)": {"BLOCK_SIZE_M": 1, "BLOCK_SIZE_N": 8, "BLOCK_SIZE_K": 256, "GROUP_SIZE_M": 8, "SPLIT_K": 1, "A_load_order": 0, "dot_prod_mode": 0, "num_warps": 4, "num_ctas": 1, "num_stages": 1, "num_buffers_warp_spec": 0, "num_consumer_groups": 0, "reg_dec_producer": 0, "reg_inc_consumer": 0}, "(1, 3072, 768, 768, 1, 408)": {"BLOCK_SIZE_M": 1, "BLOCK_SIZE_N": 4, "BLOCK_SIZE_K": 256, "GROUP_SIZE_M": 8, "SPLIT_K": 1, "A_load_order": 0, "dot_prod_mode": 0, "num_warps": 4, "num_ctas": 1, "num_stages": 1, "num_buffers_warp_spec": 0, "num_consumer_groups": 0, "reg_dec_producer": 0, "reg_inc_consumer": 0}, "(1, 18432, 3072, 3072, 1, 408)": {"BLOCK_SIZE_M": 1, "BLOCK_SIZE_N": 4, "BLOCK_SIZE_K": 1024, "GROUP_SIZE_M": 8, "SPLIT_K": 1, "A_load_order": 0, "dot_prod_mode": 0, "num_warps": 8, "num_ctas": 1, "num_stages": 1, "num_buffers_warp_spec": 0, "num_consumer_groups": 0, "reg_dec_producer": 0, "reg_inc_consumer": 0}, "(1, 9216, 3072, 3072, 1, 408)": {"BLOCK_SIZE_M": 1, "BLOCK_SIZE_N": 16, "BLOCK_SIZE_K": 512, "GROUP_SIZE_M": 8, "SPLIT_K": 1, "A_load_order": 0, "dot_prod_mode": 0, "num_warps": 4, "num_ctas": 1, "num_stages": 2, "num_buffers_warp_spec": 0, "num_consumer_groups": 0, "reg_dec_producer": 0, "reg_inc_consumer": 0}, "(1, 6144, 3072, 3072, 1, 408)": {"BLOCK_SIZE_M": 1, "BLOCK_SIZE_N": 4, "BLOCK_SIZE_K": 512, "GROUP_SIZE_M": 8, "SPLIT_K": 1, "A_load_order": 0, "dot_prod_mode": 0, "num_warps": 4, "num_ctas": 1, "num_stages": 1, "num_buffers_warp_spec": 0, "num_consumer_groups": 0, "reg_dec_producer": 0, "reg_inc_consumer": 0}}, "GEMM_SPLITK": {"(48, 4096, 4096, 64, 8, 104)": {"BLOCK_SIZE_M": 64, "BLOCK_SIZE_N": 64, "BLOCK_SIZE_K": 64, "GROUP_SIZE_M": 8, "SPLIT_K": 8, "A_load_order": 2, "num_warps": 4, "num_ctas": 1, "num_stages": 1, "num_buffers_warp_spec": 0, "num_consumer_groups": 0, "reg_dec_producer": 0, "reg_inc_consumer": 0}, "(48, 1024, 4096, 64, 8, 104)": {"BLOCK_SIZE_M": 64, "BLOCK_SIZE_N": 64, "BLOCK_SIZE_K": 64, "GROUP_SIZE_M": 8, "SPLIT_K": 8, "A_load_order": 2, "num_warps": 4, "num_ctas": 1, "num_stages": 3, "num_buffers_warp_spec": 0, "num_consumer_groups": 0, "reg_dec_producer": 0, "reg_inc_consumer": 0}, "(48, 14336, 4096, 64, 8, 104)": {"BLOCK_SIZE_M": 64, "BLOCK_SIZE_N": 64, "BLOCK_SIZE_K": 64, "GROUP_SIZE_M": 8, "SPLIT_K": 8, "A_load_order": 2, "num_warps": 4, "num_ctas": 1, "num_stages": 1, "num_buffers_warp_spec": 0, "num_consumer_groups": 0, "reg_dec_producer": 0, "reg_inc_consumer": 0}, "(48, 4096, 14336, 64, 8, 104)": {"BLOCK_SIZE_M": 64, "BLOCK_SIZE_N": 64, "BLOCK_SIZE_K": 64, "GROUP_SIZE_M": 8, "SPLIT_K": 8, "A_load_order": 2, "num_warps": 4, "num_ctas": 1, "num_stages": 1, "num_buffers_warp_spec": 0, "num_consumer_groups": 0, "reg_dec_producer": 0, "reg_inc_consumer": 0}, "(48, 4096, 4096, 4096, 1, 408)": {"BLOCK_SIZE_M": 32, "BLOCK_SIZE_N": 64, "BLOCK_SIZE_K": 256, "GROUP_SIZE_M": 8, "SPLIT_K": 1, "A_load_order": 0, "num_warps": 4, "num_ctas": 1, "num_stages": 4, "num_buffers_warp_spec": 0, "num_consumer_groups": 0, "reg_dec_producer": 0, "reg_inc_consumer": 0}, "(48, 1024, 4096, 4096, 1, 408)": {"BLOCK_SIZE_M": 32, "BLOCK_SIZE_N": 32, "BLOCK_SIZE_K": 128, "GROUP_SIZE_M": 8, "SPLIT_K": 8, "A_load_order": 0, "num_warps": 4, "num_ctas": 1, "num_stages": 4, "num_buffers_warp_spec": 0, "num_consumer_groups": 0, "reg_dec_producer": 0, "reg_inc_consumer": 0}, "(48, 14336, 4096, 4096, 1, 408)": {"BLOCK_SIZE_M": 32, "BLOCK_SIZE_N": 64, "BLOCK_SIZE_K": 256, "GROUP_SIZE_M": 8, "SPLIT_K": 1, "A_load_order": 2, "num_warps": 4, "num_ctas": 1, "num_stages": 2, "num_buffers_warp_spec": 0, "num_consumer_groups": 0, "reg_dec_producer": 0, "reg_inc_consumer": 0}, "(48, 4096, 14336, 14336, 1, 408)": {"BLOCK_SIZE_M": 32, "BLOCK_SIZE_N": 64, "BLOCK_SIZE_K": 256, "GROUP_SIZE_M": 8, "SPLIT_K": 1, "A_load_order": 0, "num_warps": 4, "num_ctas": 1, "num_stages": 4, "num_buffers_warp_spec": 0, "num_consumer_groups": 0, "reg_dec_producer": 0, "reg_inc_consumer": 0}, "(48, 128256, 4096, 4096, 1, 408)": {"BLOCK_SIZE_M": 64, "BLOCK_SIZE_N": 256, "BLOCK_SIZE_K": 256, "GROUP_SIZE_M": 8, "SPLIT_K": 1, "A_load_order": 2, "num_warps": 8, "num_ctas": 1, "num_stages": 1, "num_buffers_warp_spec": 0, "num_consumer_groups": 0, "reg_dec_producer": 0, "reg_inc_consumer": 0}, "(4, 4096, 4096, 64, 8, 104)": {"BLOCK_SIZE_M": 16, "BLOCK_SIZE_N": 128, "BLOCK_SIZE_K": 64, "GROUP_SIZE_M": 8, "SPLIT_K": 16, "A_load_order": 0, "num_warps": 4, "num_ctas": 1, "num_stages": 1, "num_buffers_warp_spec": 0, "num_consumer_groups": 0, "reg_dec_producer": 0, "reg_inc_consumer": 0}, "(8, 4096, 4096, 64, 8, 104)": {"BLOCK_SIZE_M": 16, "BLOCK_SIZE_N": 128, "BLOCK_SIZE_K": 64, "GROUP_SIZE_M": 8, "SPLIT_K": 16, "A_load_order": 0, "num_warps": 4, "num_ctas": 1, "num_stages": 1, "num_buffers_warp_spec": 0, "num_consumer_groups": 0, "reg_dec_producer": 0, "reg_inc_consumer": 0}, "(16, 4096, 4096, 64, 8, 104)": {"BLOCK_SIZE_M": 16, "BLOCK_SIZE_N": 128, "BLOCK_SIZE_K": 64, "GROUP_SIZE_M": 8, "SPLIT_K": 16, "A_load_order": 0, "num_warps": 4, "num_ctas": 1, "num_stages": 1, "num_buffers_warp_spec": 0, "num_consumer_groups": 0, "reg_dec_producer": 0, "reg_inc_consumer": 0}, "(32, 4096, 4096, 64, 8, 104)": {"BLOCK_SIZE_M": 32, "BLOCK_SIZE_N": 64, "BLOCK_SIZE_K": 64, "GROUP_SIZE_M": 8, "SPLIT_K": 8, "A_load_order": 2, "num_warps": 4, "num_ctas": 1, "num_stages": 1, "num_buffers_warp_spec": 0, "num_consumer_groups": 0, "reg_dec_producer": 0, "reg_inc_consumer": 0}, "(64, 4096, 4096, 64, 8, 104)": {"BLOCK_SIZE_M": 64, "BLOCK_SIZE_N": 128, "BLOCK_SIZE_K": 64, "GROUP_SIZE_M": 8, "SPLIT_K": 8, "A_load_order": 2, "num_warps": 8, "num_ctas": 1, "num_stages": 1, "num_buffers_warp_spec": 0, "num_consumer_groups": 0, "reg_dec_producer": 0, "reg_inc_consumer": 0}, "(4, 6144, 4096, 64, 8, 104)": {"BLOCK_SIZE_M": 16, "BLOCK_SIZE_N": 128, "BLOCK_SIZE_K": 32, "GROUP_SIZE_M": 8, "SPLIT_K": 16, "A_load_order": 2, "num_warps": 8, "num_ctas": 1, "num_stages": 1, "num_buffers_warp_spec": 0, "num_consumer_groups": 0, "reg_dec_producer": 0, "reg_inc_consumer": 0}, "(8, 6144, 4096, 64, 8, 104)": {"BLOCK_SIZE_M": 16, "BLOCK_SIZE_N": 128, "BLOCK_SIZE_K": 32, "GROUP_SIZE_M": 8, "SPLIT_K": 16, "A_load_order": 2, "num_warps": 8, "num_ctas": 1, "num_stages": 1, "num_buffers_warp_spec": 0, "num_consumer_groups": 0, "reg_dec_producer": 0, "reg_inc_consumer": 0}, "(16, 6144, 4096, 64, 8, 104)": {"BLOCK_SIZE_M": 16, "BLOCK_SIZE_N": 128, "BLOCK_SIZE_K": 32, "GROUP_SIZE_M": 8, "SPLIT_K": 16, "A_load_order": 2, "num_warps": 8, "num_ctas": 1, "num_stages": 1, "num_buffers_warp_spec": 0, "num_consumer_groups": 0, "reg_dec_producer": 0, "reg_inc_consumer": 0}, "(32, 6144, 4096, 64, 8, 104)": {"BLOCK_SIZE_M": 32, "BLOCK_SIZE_N": 64, "BLOCK_SIZE_K": 64, "GROUP_SIZE_M": 8, "SPLIT_K": 8, "A_load_order": 2, "num_warps": 4, "num_ctas": 1, "num_stages": 1, "num_buffers_warp_spec": 0, "num_consumer_groups": 0, "reg_dec_producer": 0, "reg_inc_consumer": 0}, "(64, 6144, 4096, 64, 8, 104)": {"BLOCK_SIZE_M": 64, "BLOCK_SIZE_N": 64, "BLOCK_SIZE_K": 64, "GROUP_SIZE_M": 8, "SPLIT_K": 8, "A_load_order": 0, "num_warps": 4, "num_ctas": 1, "num_stages": 1, "num_buffers_warp_spec": 0, "num_consumer_groups": 0, "reg_dec_producer": 0, "reg_inc_consumer": 0}, "(4, 4096, 14336, 64, 8, 104)": {"BLOCK_SIZE_M": 16, "BLOCK_SIZE_N": 128, "BLOCK_SIZE_K": 64, "GROUP_SIZE_M": 8, "SPLIT_K": 16, "A_load_order": 0, "num_warps": 4, "num_ctas": 1, "num_stages": 1, "num_buffers_warp_spec": 0, "num_consumer_groups": 0, "reg_dec_producer": 0, "reg_inc_consumer": 0}, "(8, 4096, 14336, 64, 8, 104)": {"BLOCK_SIZE_M": 16, "BLOCK_SIZE_N": 128, "BLOCK_SIZE_K": 64, "GROUP_SIZE_M": 8, "SPLIT_K": 16, "A_load_order": 0, "num_warps": 4, "num_ctas": 1, "num_stages": 1, "num_buffers_warp_spec": 0, "num_consumer_groups": 0, "reg_dec_producer": 0, "reg_inc_consumer": 0}, "(16, 4096, 14336, 64, 8, 104)": {"BLOCK_SIZE_M": 16, "BLOCK_SIZE_N": 128, "BLOCK_SIZE_K": 64, "GROUP_SIZE_M": 8, "SPLIT_K": 16, "A_load_order": 0, "num_warps": 4, "num_ctas": 1, "num_stages": 1, "num_buffers_warp_spec": 0, "num_consumer_groups": 0, "reg_dec_producer": 0, "reg_inc_consumer": 0}, "(32, 4096, 14336, 64, 8, 104)": {"BLOCK_SIZE_M": 32, "BLOCK_SIZE_N": 64, "BLOCK_SIZE_K": 64, "GROUP_SIZE_M": 8, "SPLIT_K": 8, "A_load_order": 2, "num_warps": 4, "num_ctas": 1, "num_stages": 1, "num_buffers_warp_spec": 0, "num_consumer_groups": 0, "reg_dec_producer": 0, "reg_inc_consumer": 0}, "(64, 4096, 14336, 64, 8, 104)": {"BLOCK_SIZE_M": 64, "BLOCK_SIZE_N": 128, "BLOCK_SIZE_K": 64, "GROUP_SIZE_M": 8, "SPLIT_K": 8, "A_load_order": 2, "num_warps": 8, "num_ctas": 1, "num_stages": 1, "num_buffers_warp_spec": 0, "num_consumer_groups": 0, "reg_dec_producer": 0, "reg_inc_consumer": 0}, "(4, 28672, 4096, 64, 8, 104)": {"BLOCK_SIZE_M": 16, "BLOCK_SIZE_N": 512, "BLOCK_SIZE_K": 32, "GROUP_SIZE_M": 8, "SPLIT_K": 16, "A_load_order": 0, "num_warps": 4, "num_ctas": 1, "num_stages": 1, "num_buffers_warp_spec": 0, "num_consumer_groups": 0, "reg_dec_producer": 0, "reg_inc_consumer": 0}, "(8, 28672, 4096, 64, 8, 104)": {"BLOCK_SIZE_M": 16, "BLOCK_SIZE_N": 512, "BLOCK_SIZE_K": 32, "GROUP_SIZE_M": 8, "SPLIT_K": 16, "A_load_order": 0, "num_warps": 4, "num_ctas": 1, "num_stages": 1, "num_buffers_warp_spec": 0, "num_consumer_groups": 0, "reg_dec_producer": 0, "reg_inc_consumer": 0}, "(16, 28672, 4096, 64, 8, 104)": {"BLOCK_SIZE_M": 16, "BLOCK_SIZE_N": 512, "BLOCK_SIZE_K": 32, "GROUP_SIZE_M": 8, "SPLIT_K": 16, "A_load_order": 0, "num_warps": 4, "num_ctas": 1, "num_stages": 1, "num_buffers_warp_spec": 0, "num_consumer_groups": 0, "reg_dec_producer": 0, "reg_inc_consumer": 0}, "(32, 28672, 4096, 64, 8, 104)": {"BLOCK_SIZE_M": 32, "BLOCK_SIZE_N": 128, "BLOCK_SIZE_K": 64, "GROUP_SIZE_M": 8, "SPLIT_K": 8, "A_load_order": 0, "num_warps": 4, "num_ctas": 1, "num_stages": 1, "num_buffers_warp_spec": 0, "num_consumer_groups": 0, "reg_dec_producer": 0, "reg_inc_consumer": 0}, "(64, 28672, 4096, 64, 8, 104)": {"BLOCK_SIZE_M": 64, "BLOCK_SIZE_N": 64, "BLOCK_SIZE_K": 64, "GROUP_SIZE_M": 8, "SPLIT_K": 8, "A_load_order": 2, "num_warps": 4, "num_ctas": 1, "num_stages": 1, "num_buffers_warp_spec": 0, "num_consumer_groups": 0, "reg_dec_producer": 0, "reg_inc_consumer": 0}, "(4, 3584, 3584, 64, 8, 104)": {"BLOCK_SIZE_M": 16, "BLOCK_SIZE_N": 64, "BLOCK_SIZE_K": 32, "GROUP_SIZE_M": 8, "SPLIT_K": 16, "A_load_order": 2, "num_warps": 8, "num_ctas": 1, "num_stages": 1, "num_buffers_warp_spec": 0, "num_consumer_groups": 0, "reg_dec_producer": 0, "reg_inc_consumer": 0}, "(8, 3584, 3584, 64, 8, 104)": {"BLOCK_SIZE_M": 16, "BLOCK_SIZE_N": 64, "BLOCK_SIZE_K": 32, "GROUP_SIZE_M": 8, "SPLIT_K": 16, "A_load_order": 0, "num_warps": 8, "num_ctas": 1, "num_stages": 1, "num_buffers_warp_spec": 0, "num_consumer_groups": 0, "reg_dec_producer": 0, "reg_inc_consumer": 0}, "(16, 3584, 3584, 64, 8, 104)": {"BLOCK_SIZE_M": 16, "BLOCK_SIZE_N": 64, "BLOCK_SIZE_K": 32, "GROUP_SIZE_M": 8, "SPLIT_K": 16, "A_load_order": 2, "num_warps": 8, "num_ctas": 1, "num_stages": 1, "num_buffers_warp_spec": 0, "num_consumer_groups": 0, "reg_dec_producer": 0, "reg_inc_consumer": 0}, "(32, 3584, 3584, 64, 8, 104)": {"BLOCK_SIZE_M": 32, "BLOCK_SIZE_N": 64, "BLOCK_SIZE_K": 64, "GROUP_SIZE_M": 8, "SPLIT_K": 8, "A_load_order": 2, "num_warps": 4, "num_ctas": 1, "num_stages": 1, "num_buffers_warp_spec": 0, "num_consumer_groups": 0, "reg_dec_producer": 0, "reg_inc_consumer": 0}, "(64, 3584, 3584, 64, 8, 104)": {"BLOCK_SIZE_M": 64, "BLOCK_SIZE_N": 64, "BLOCK_SIZE_K": 64, "GROUP_SIZE_M": 8, "SPLIT_K": 8, "A_load_order": 2, "num_warps": 8, "num_ctas": 1, "num_stages": 1, "num_buffers_warp_spec": 0, "num_consumer_groups": 0, "reg_dec_producer": 0, "reg_inc_consumer": 0}, "(4, 4608, 3584, 64, 8, 104)": {"BLOCK_SIZE_M": 16, "BLOCK_SIZE_N": 64, "BLOCK_SIZE_K": 32, "GROUP_SIZE_M": 8, "SPLIT_K": 16, "A_load_order": 0, "num_warps": 4, "num_ctas": 1, "num_stages": 1, "num_buffers_warp_spec": 0, "num_consumer_groups": 0, "reg_dec_producer": 0, "reg_inc_consumer": 0}, "(8, 4608, 3584, 64, 8, 104)": {"BLOCK_SIZE_M": 16, "BLOCK_SIZE_N": 128, "BLOCK_SIZE_K": 32, "GROUP_SIZE_M": 8, "SPLIT_K": 16, "A_load_order": 2, "num_warps": 8, "num_ctas": 1, "num_stages": 1, "num_buffers_warp_spec": 0, "num_consumer_groups": 0, "reg_dec_producer": 0, "reg_inc_consumer": 0}, "(16, 4608, 3584, 64, 8, 104)": {"BLOCK_SIZE_M": 16, "BLOCK_SIZE_N": 128, "BLOCK_SIZE_K": 32, "GROUP_SIZE_M": 8, "SPLIT_K": 16, "A_load_order": 2, "num_warps": 8, "num_ctas": 1, "num_stages": 1, "num_buffers_warp_spec": 0, "num_consumer_groups": 0, "reg_dec_producer": 0, "reg_inc_consumer": 0}, "(32, 4608, 3584, 64, 8, 104)": {"BLOCK_SIZE_M": 32, "BLOCK_SIZE_N": 64, "BLOCK_SIZE_K": 64, "GROUP_SIZE_M": 8, "SPLIT_K": 8, "A_load_order": 2, "num_warps": 4, "num_ctas": 1, "num_stages": 1, "num_buffers_warp_spec": 0, "num_consumer_groups": 0, "reg_dec_producer": 0, "reg_inc_consumer": 0}, "(64, 4608, 3584, 64, 8, 104)": {"BLOCK_SIZE_M": 64, "BLOCK_SIZE_N": 128, "BLOCK_SIZE_K": 64, "GROUP_SIZE_M": 8, "SPLIT_K": 8, "A_load_order": 2, "num_warps": 8, "num_ctas": 1, "num_stages": 1, "num_buffers_warp_spec": 0, "num_consumer_groups": 0, "reg_dec_producer": 0, "reg_inc_consumer": 0}, "(4, 3584, 18944, 64, 8, 104)": {"BLOCK_SIZE_M": 16, "BLOCK_SIZE_N": 64, "BLOCK_SIZE_K": 32, "GROUP_SIZE_M": 8, "SPLIT_K": 16, "A_load_order": 0, "num_warps": 8, "num_ctas": 1, "num_stages": 1, "num_buffers_warp_spec": 0, "num_consumer_groups": 0, "reg_dec_producer": 0, "reg_inc_consumer": 0}, "(8, 3584, 18944, 64, 8, 104)": {"BLOCK_SIZE_M": 16, "BLOCK_SIZE_N": 64, "BLOCK_SIZE_K": 32, "GROUP_SIZE_M": 8, "SPLIT_K": 16, "A_load_order": 2, "num_warps": 8, "num_ctas": 1, "num_stages": 1, "num_buffers_warp_spec": 0, "num_consumer_groups": 0, "reg_dec_producer": 0, "reg_inc_consumer": 0}, "(16, 3584, 18944, 64, 8, 104)": {"BLOCK_SIZE_M": 16, "BLOCK_SIZE_N": 64, "BLOCK_SIZE_K": 32, "GROUP_SIZE_M": 8, "SPLIT_K": 16, "A_load_order": 2, "num_warps": 8, "num_ctas": 1, "num_stages": 1, "num_buffers_warp_spec": 0, "num_consumer_groups": 0, "reg_dec_producer": 0, "reg_inc_consumer": 0}, "(32, 3584, 18944, 64, 8, 104)": {"BLOCK_SIZE_M": 32, "BLOCK_SIZE_N": 64, "BLOCK_SIZE_K": 64, "GROUP_SIZE_M": 8, "SPLIT_K": 8, "A_load_order": 2, "num_warps": 4, "num_ctas": 1, "num_stages": 1, "num_buffers_warp_spec": 0, "num_consumer_groups": 0, "reg_dec_producer": 0, "reg_inc_consumer": 0}, "(64, 3584, 18944, 64, 8, 104)": {"BLOCK_SIZE_M": 64, "BLOCK_SIZE_N": 64, "BLOCK_SIZE_K": 64, "GROUP_SIZE_M": 8, "SPLIT_K": 8, "A_load_order": 2, "num_warps": 8, "num_ctas": 1, "num_stages": 1, "num_buffers_warp_spec": 0, "num_consumer_groups": 0, "reg_dec_producer": 0, "reg_inc_consumer": 0}, "(4, 37888, 3584, 64, 8, 104)": {"BLOCK_SIZE_M": 16, "BLOCK_SIZE_N": 512, "BLOCK_SIZE_K": 32, "GROUP_SIZE_M": 8, "SPLIT_K": 4, "A_load_order": 0, "num_warps": 4, "num_ctas": 1, "num_stages": 1, "num_buffers_warp_spec": 0, "num_consumer_groups": 0, "reg_dec_producer": 0, "reg_inc_consumer": 0}, "(8, 37888, 3584, 64, 8, 104)": {"BLOCK_SIZE_M": 16, "BLOCK_SIZE_N": 512, "BLOCK_SIZE_K": 32, "GROUP_SIZE_M": 8, "SPLIT_K": 4, "A_load_order": 0, "num_warps": 4, "num_ctas": 1, "num_stages": 1, "num_buffers_warp_spec": 0, "num_consumer_groups": 0, "reg_dec_producer": 0, "reg_inc_consumer": 0}, "(16, 37888, 3584, 64, 8, 104)": {"BLOCK_SIZE_M": 16, "BLOCK_SIZE_N": 512, "BLOCK_SIZE_K": 32, "GROUP_SIZE_M": 8, "SPLIT_K": 4, "A_load_order": 0, "num_warps": 4, "num_ctas": 1, "num_stages": 1, "num_buffers_warp_spec": 0, "num_consumer_groups": 0, "reg_dec_producer": 0, "reg_inc_consumer": 0}, "(32, 37888, 3584, 64, 8, 104)": {"BLOCK_SIZE_M": 32, "BLOCK_SIZE_N": 64, "BLOCK_SIZE_K": 64, "GROUP_SIZE_M": 8, "SPLIT_K": 8, "A_load_order": 2, "num_warps": 4, "num_ctas": 1, "num_stages": 1, "num_buffers_warp_spec": 0, "num_consumer_groups": 0, "reg_dec_producer": 0, "reg_inc_consumer": 0}, "(64, 37888, 3584, 64, 8, 104)": {"BLOCK_SIZE_M": 64, "BLOCK_SIZE_N": 64, "BLOCK_SIZE_K": 64, "GROUP_SIZE_M": 8, "SPLIT_K": 8, "A_load_order": 2, "num_warps": 4, "num_ctas": 1, "num_stages": 1, "num_buffers_warp_spec": 0, "num_consumer_groups": 0, "reg_dec_producer": 0, "reg_inc_consumer": 0}, "(48, 4096, 4096, 128, 8, 104)": {"BLOCK_SIZE_M": 64, "BLOCK_SIZE_N": 128, "BLOCK_SIZE_K": 64, "GROUP_SIZE_M": 8, "SPLIT_K": 8, "A_load_order": 2, "num_warps": 8, "num_ctas": 1, "num_stages": 1, "num_buffers_warp_spec": 0, "num_consumer_groups": 0, "reg_dec_producer": 0, "reg_inc_consumer": 0}, "(48, 1024, 4096, 128, 8, 104)": {"BLOCK_SIZE_M": 64, "BLOCK_SIZE_N": 32, "BLOCK_SIZE_K": 128, "GROUP_SIZE_M": 8, "SPLIT_K": 8, "A_load_order": 2, "num_warps": 8, "num_ctas": 1, "num_stages": 1, "num_buffers_warp_spec": 0, "num_consumer_groups": 0, "reg_dec_producer": 0, "reg_inc_consumer": 0}, "(48, 14336, 4096, 128, 8, 104)": {"BLOCK_SIZE_M": 64, "BLOCK_SIZE_N": 128, "BLOCK_SIZE_K": 64, "GROUP_SIZE_M": 8, "SPLIT_K": 4, "A_load_order": 0, "num_warps": 4, "num_ctas": 1, "num_stages": 1, "num_buffers_warp_spec": 0, "num_consumer_groups": 0, "reg_dec_producer": 0, "reg_inc_consumer": 0}, "(48, 4096, 14336, 128, 8, 104)": {"BLOCK_SIZE_M": 64, "BLOCK_SIZE_N": 64, "BLOCK_SIZE_K": 64, "GROUP_SIZE_M": 8, "SPLIT_K": 8, "A_load_order": 2, "num_warps": 4, "num_ctas": 1, "num_stages": 1, "num_buffers_warp_spec": 0, "num_consumer_groups": 0, "reg_dec_producer": 0, "reg_inc_consumer": 0}, "(48, 128256, 4096, 128, 8, 104)": {"BLOCK_SIZE_M": 64, "BLOCK_SIZE_N": 128, "BLOCK_SIZE_K": 64, "GROUP_SIZE_M": 8, "SPLIT_K": 1, "A_load_order": 0, "num_warps": 4, "num_ctas": 1, "num_stages": 1, "num_buffers_warp_spec": 0, "num_consumer_groups": 0, "reg_dec_producer": 0, "reg_inc_consumer": 0}, "(4, 3072, 3072, 64, 8, 104)": {"BLOCK_SIZE_M": 16, "BLOCK_SIZE_N": 64, "BLOCK_SIZE_K": 64, "GROUP_SIZE_M": 8, "SPLIT_K": 16, "A_load_order": 0, "num_warps": 4, "num_ctas": 1, "num_stages": 1, "num_buffers_warp_spec": 0, "num_consumer_groups": 0, "reg_dec_producer": 0, "reg_inc_consumer": 0}, "(8, 3072, 3072, 64, 8, 104)": {"BLOCK_SIZE_M": 16, "BLOCK_SIZE_N": 32, "BLOCK_SIZE_K": 64, "GROUP_SIZE_M": 8, "SPLIT_K": 16, "A_load_order": 0, "num_warps": 4, "num_ctas": 1, "num_stages": 1, "num_buffers_warp_spec": 0, "num_consumer_groups": 0, "reg_dec_producer": 0, "reg_inc_consumer": 0}, "(16, 3072, 3072, 64, 8, 104)": {"BLOCK_SIZE_M": 16, "BLOCK_SIZE_N": 128, "BLOCK_SIZE_K": 64, "GROUP_SIZE_M": 8, "SPLIT_K": 16, "A_load_order": 0, "num_warps": 4, "num_ctas": 1, "num_stages": 1, "num_buffers_warp_spec": 0, "num_consumer_groups": 0, "reg_dec_producer": 0, "reg_inc_consumer": 0}, "(32, 3072, 3072, 64, 8, 104)": {"BLOCK_SIZE_M": 32, "BLOCK_SIZE_N": 32, "BLOCK_SIZE_K": 64, "GROUP_SIZE_M": 8, "SPLIT_K": 8, "A_load_order": 0, "num_warps": 4, "num_ctas": 1, "num_stages": 1, "num_buffers_warp_spec": 0, "num_consumer_groups": 0, "reg_dec_producer": 0, "reg_inc_consumer": 0}, "(64, 3072, 3072, 64, 8, 104)": {"BLOCK_SIZE_M": 64, "BLOCK_SIZE_N": 64, "BLOCK_SIZE_K": 64, "GROUP_SIZE_M": 8, "SPLIT_K": 8, "A_load_order": 2, "num_warps": 4, "num_ctas": 1, "num_stages": 1, "num_buffers_warp_spec": 0, "num_consumer_groups": 0, "reg_dec_producer": 0, "reg_inc_consumer": 0}, "(4, 5120, 3072, 64, 8, 104)": {"BLOCK_SIZE_M": 16, "BLOCK_SIZE_N": 128, "BLOCK_SIZE_K": 64, "GROUP_SIZE_M": 8, "SPLIT_K": 16, "A_load_order": 0, "num_warps": 4, "num_ctas": 1, "num_stages": 1, "num_buffers_warp_spec": 0, "num_consumer_groups": 0, "reg_dec_producer": 0, "reg_inc_consumer": 0}, "(8, 5120, 3072, 64, 8, 104)": {"BLOCK_SIZE_M": 16, "BLOCK_SIZE_N": 128, "BLOCK_SIZE_K": 64, "GROUP_SIZE_M": 8, "SPLIT_K": 16, "A_load_order": 0, "num_warps": 4, "num_ctas": 1, "num_stages": 1, "num_buffers_warp_spec": 0, "num_consumer_groups": 0, "reg_dec_producer": 0, "reg_inc_consumer": 0}, "(16, 5120, 3072, 64, 8, 104)": {"BLOCK_SIZE_M": 16, "BLOCK_SIZE_N": 128, "BLOCK_SIZE_K": 64, "GROUP_SIZE_M": 8, "SPLIT_K": 16, "A_load_order": 0, "num_warps": 4, "num_ctas": 1, "num_stages": 1, "num_buffers_warp_spec": 0, "num_consumer_groups": 0, "reg_dec_producer": 0, "reg_inc_consumer": 0}, "(32, 5120, 3072, 64, 8, 104)": {"BLOCK_SIZE_M": 32, "BLOCK_SIZE_N": 64, "BLOCK_SIZE_K": 64, "GROUP_SIZE_M": 8, "SPLIT_K": 8, "A_load_order": 2, "num_warps": 4, "num_ctas": 1, "num_stages": 1, "num_buffers_warp_spec": 0, "num_consumer_groups": 0, "reg_dec_producer": 0, "reg_inc_consumer": 0}, "(64, 5120, 3072, 64, 8, 104)": {"BLOCK_SIZE_M": 64, "BLOCK_SIZE_N": 128, "BLOCK_SIZE_K": 64, "GROUP_SIZE_M": 8, "SPLIT_K": 8, "A_load_order": 2, "num_warps": 8, "num_ctas": 1, "num_stages": 1, "num_buffers_warp_spec": 0, "num_consumer_groups": 0, "reg_dec_producer": 0, "reg_inc_consumer": 0}, "(4, 3072, 8192, 64, 8, 104)": {"BLOCK_SIZE_M": 16, "BLOCK_SIZE_N": 32, "BLOCK_SIZE_K": 64, "GROUP_SIZE_M": 8, "SPLIT_K": 16, "A_load_order": 0, "num_warps": 4, "num_ctas": 1, "num_stages": 1, "num_buffers_warp_spec": 0, "num_consumer_groups": 0, "reg_dec_producer": 0, "reg_inc_consumer": 0}, "(8, 3072, 8192, 64, 8, 104)": {"BLOCK_SIZE_M": 16, "BLOCK_SIZE_N": 32, "BLOCK_SIZE_K": 64, "GROUP_SIZE_M": 8, "SPLIT_K": 16, "A_load_order": 0, "num_warps": 4, "num_ctas": 1, "num_stages": 1, "num_buffers_warp_spec": 0, "num_consumer_groups": 0, "reg_dec_producer": 0, "reg_inc_consumer": 0}, "(16, 3072, 8192, 64, 8, 104)": {"BLOCK_SIZE_M": 16, "BLOCK_SIZE_N": 128, "BLOCK_SIZE_K": 64, "GROUP_SIZE_M": 8, "SPLIT_K": 16, "A_load_order": 0, "num_warps": 4, "num_ctas": 1, "num_stages": 1, "num_buffers_warp_spec": 0, "num_consumer_groups": 0, "reg_dec_producer": 0, "reg_inc_consumer": 0}, "(32, 3072, 8192, 64, 8, 104)": {"BLOCK_SIZE_M": 32, "BLOCK_SIZE_N": 64, "BLOCK_SIZE_K": 64, "GROUP_SIZE_M": 8, "SPLIT_K": 8, "A_load_order": 2, "num_warps": 4, "num_ctas": 1, "num_stages": 1, "num_buffers_warp_spec": 0, "num_consumer_groups": 0, "reg_dec_producer": 0, "reg_inc_consumer": 0}, "(64, 3072, 8192, 64, 8, 104)": {"BLOCK_SIZE_M": 64, "BLOCK_SIZE_N": 64, "BLOCK_SIZE_K": 64, "GROUP_SIZE_M": 8, "SPLIT_K": 8, "A_load_order": 2, "num_warps": 4, "num_ctas": 1, "num_stages": 1, "num_buffers_warp_spec": 0, "num_consumer_groups": 0, "reg_dec_producer": 0, "reg_inc_consumer": 0}, "(4, 16384, 3072, 64, 8, 104)": {"BLOCK_SIZE_M": 16, "BLOCK_SIZE_N": 512, "BLOCK_SIZE_K": 32, "GROUP_SIZE_M": 8, "SPLIT_K": 8, "A_load_order": 0, "num_warps": 4, "num_ctas": 1, "num_stages": 1, "num_buffers_warp_spec": 0, "num_consumer_groups": 0, "reg_dec_producer": 0, "reg_inc_consumer": 0}, "(8, 16384, 3072, 64, 8, 104)": {"BLOCK_SIZE_M": 16, "BLOCK_SIZE_N": 512, "BLOCK_SIZE_K": 32, "GROUP_SIZE_M": 8, "SPLIT_K": 8, "A_load_order": 0, "num_warps": 4, "num_ctas": 1, "num_stages": 1, "num_buffers_warp_spec": 0, "num_consumer_groups": 0, "reg_dec_producer": 0, "reg_inc_consumer": 0}, "(16, 16384, 3072, 64, 8, 104)": {"BLOCK_SIZE_M": 16, "BLOCK_SIZE_N": 512, "BLOCK_SIZE_K": 32, "GROUP_SIZE_M": 8, "SPLIT_K": 8, "A_load_order": 0, "num_warps": 4, "num_ctas": 1, "num_stages": 1, "num_buffers_warp_spec": 0, "num_consumer_groups": 0, "reg_dec_producer": 0, "reg_inc_consumer": 0}, "(32, 16384, 3072, 64, 8, 104)": {"BLOCK_SIZE_M": 32, "BLOCK_SIZE_N": 128, "BLOCK_SIZE_K": 64, "GROUP_SIZE_M": 8, "SPLIT_K": 4, "A_load_order": 0, "num_warps": 4, "num_ctas": 1, "num_stages": 1, "num_buffers_warp_spec": 0, "num_consumer_groups": 0, "reg_dec_producer": 0, "reg_inc_consumer": 0}, "(64, 16384, 3072, 64, 8, 104)": {"BLOCK_SIZE_M": 64, "BLOCK_SIZE_N": 64, "BLOCK_SIZE_K": 64, "GROUP_SIZE_M": 8, "SPLIT_K": 8, "A_load_order": 2, "num_warps": 4, "num_ctas": 1, "num_stages": 1, "num_buffers_warp_spec": 0, "num_consumer_groups": 0, "reg_dec_producer": 0, "reg_inc_consumer": 0}, "(24, 4096, 4096, 64, 8, 104)": {"BLOCK_SIZE_M": 32, "BLOCK_SIZE_N": 128, "BLOCK_SIZE_K": 64, "GROUP_SIZE_M": 8, "SPLIT_K": 16, "A_load_order": 0, "num_warps": 4, "num_ctas": 1, "num_stages": 1, "num_buffers_warp_spec": 0, "num_consumer_groups": 0, "reg_dec_producer": 0, "reg_inc_consumer": 0}, "(24, 6144, 4096, 64, 8, 104)": {"BLOCK_SIZE_M": 32, "BLOCK_SIZE_N": 64, "BLOCK_SIZE_K": 64, "GROUP_SIZE_M": 8, "SPLIT_K": 8, "A_load_order": 2, "num_warps": 4, "num_ctas": 1, "num_stages": 1, "num_buffers_warp_spec": 0, "num_consumer_groups": 0, "reg_dec_producer": 0, "reg_inc_consumer": 0}, "(24, 4096, 14336, 64, 8, 104)": {"BLOCK_SIZE_M": 32, "BLOCK_SIZE_N": 128, "BLOCK_SIZE_K": 64, "GROUP_SIZE_M": 8, "SPLIT_K": 16, "A_load_order": 0, "num_warps": 4, "num_ctas": 1, "num_stages": 1, "num_buffers_warp_spec": 0, "num_consumer_groups": 0, "reg_dec_producer": 0, "reg_inc_consumer": 0}, "(24, 28672, 4096, 64, 8, 104)": {"BLOCK_SIZE_M": 32, "BLOCK_SIZE_N": 64, "BLOCK_SIZE_K": 64, "GROUP_SIZE_M": 8, "SPLIT_K": 16, "A_load_order": 2, "num_warps": 4, "num_ctas": 1, "num_stages": 1, "num_buffers_warp_spec": 0, "num_consumer_groups": 0, "reg_dec_producer": 0, "reg_inc_consumer": 0}, "(24, 3584, 3584, 64, 8, 104)": {"BLOCK_SIZE_M": 32, "BLOCK_SIZE_N": 128, "BLOCK_SIZE_K": 32, "GROUP_SIZE_M": 8, "SPLIT_K": 16, "A_load_order": 0, "num_warps": 8, "num_ctas": 1, "num_stages": 1, "num_buffers_warp_spec": 0, "num_consumer_groups": 0, "reg_dec_producer": 0, "reg_inc_consumer": 0}, "(24, 4608, 3584, 64, 8, 104)": {"BLOCK_SIZE_M": 32, "BLOCK_SIZE_N": 128, "BLOCK_SIZE_K": 32, "GROUP_SIZE_M": 8, "SPLIT_K": 16, "A_load_order": 0, "num_warps": 8, "num_ctas": 1, "num_stages": 1, "num_buffers_warp_spec": 0, "num_consumer_groups": 0, "reg_dec_producer": 0, "reg_inc_consumer": 0}, "(24, 3584, 18944, 64, 8, 104)": {"BLOCK_SIZE_M": 32, "BLOCK_SIZE_N": 64, "BLOCK_SIZE_K": 64, "GROUP_SIZE_M": 8, "SPLIT_K": 8, "A_load_order": 2, "num_warps": 4, "num_ctas": 1, "num_stages": 1, "num_buffers_warp_spec": 0, "num_consumer_groups": 0, "reg_dec_producer": 0, "reg_inc_consumer": 0}, "(24, 37888, 3584, 64, 8, 104)": {"BLOCK_SIZE_M": 32, "BLOCK_SIZE_N": 64, "BLOCK_SIZE_K": 64, "GROUP_SIZE_M": 8, "SPLIT_K": 8, "A_load_order": 2, "num_warps": 4, "num_ctas": 1, "num_stages": 1, "num_buffers_warp_spec": 0, "num_consumer_groups": 0, "reg_dec_producer": 0, "reg_inc_consumer": 0}, "(24, 3072, 3072, 64, 8, 104)": {"BLOCK_SIZE_M": 32, "BLOCK_SIZE_N": 64, "BLOCK_SIZE_K": 64, "GROUP_SIZE_M": 8, "SPLIT_K": 16, "A_load_order": 2, "num_warps": 4, "num_ctas": 1, "num_stages": 1, "num_buffers_warp_spec": 0, "num_consumer_groups": 0, "reg_dec_producer": 0, "reg_inc_consumer": 0}, "(24, 5120, 3072, 64, 8, 104)": {"BLOCK_SIZE_M": 32, "BLOCK_SIZE_N": 128, "BLOCK_SIZE_K": 64, "GROUP_SIZE_M": 8, "SPLIT_K": 16, "A_load_order": 0, "num_warps": 4, "num_ctas": 1, "num_stages": 1, "num_buffers_warp_spec": 0, "num_consumer_groups": 0, "reg_dec_producer": 0, "reg_inc_consumer": 0}, "(24, 3072, 8192, 64, 8, 104)": {"BLOCK_SIZE_M": 32, "BLOCK_SIZE_N": 64, "BLOCK_SIZE_K": 64, "GROUP_SIZE_M": 8, "SPLIT_K": 16, "A_load_order": 2, "num_warps": 4, "num_ctas": 1, "num_stages": 1, "num_buffers_warp_spec": 0, "num_consumer_groups": 0, "reg_dec_producer": 0, "reg_inc_consumer": 0}, "(24, 16384, 3072, 64, 8, 104)": {"BLOCK_SIZE_M": 32, "BLOCK_SIZE_N": 64, "BLOCK_SIZE_K": 64, "GROUP_SIZE_M": 8, "SPLIT_K": 16, "A_load_order": 2, "num_warps": 4, "num_ctas": 1, "num_stages": 1, "num_buffers_warp_spec": 0, "num_consumer_groups": 0, "reg_dec_producer": 0, "reg_inc_consumer": 0}, "(24, 4096, 4096, 128, 8, 104)": {"BLOCK_SIZE_M": 32, "BLOCK_SIZE_N": 128, "BLOCK_SIZE_K": 64, "GROUP_SIZE_M": 8, "SPLIT_K": 16, "A_load_order": 0, "num_warps": 4, "num_ctas": 1, "num_stages": 1, "num_buffers_warp_spec": 0, "num_consumer_groups": 0, "reg_dec_producer": 0, "reg_inc_consumer": 0}, "(24, 6144, 4096, 128, 8, 104)": {"BLOCK_SIZE_M": 32, "BLOCK_SIZE_N": 64, "BLOCK_SIZE_K": 64, "GROUP_SIZE_M": 8, "SPLIT_K": 8, "A_load_order": 2, "num_warps": 4, "num_ctas": 1, "num_stages": 1, "num_buffers_warp_spec": 0, "num_consumer_groups": 0, "reg_dec_producer": 0, "reg_inc_consumer": 0}, "(24, 4096, 14336, 128, 8, 104)": {"BLOCK_SIZE_M": 32, "BLOCK_SIZE_N": 128, "BLOCK_SIZE_K": 64, "GROUP_SIZE_M": 8, "SPLIT_K": 16, "A_load_order": 0, "num_warps": 4, "num_ctas": 1, "num_stages": 1, "num_buffers_warp_spec": 0, "num_consumer_groups": 0, "reg_dec_producer": 0, "reg_inc_consumer": 0}, "(24, 28672, 4096, 128, 8, 104)": {"BLOCK_SIZE_M": 32, "BLOCK_SIZE_N": 64, "BLOCK_SIZE_K": 128, "GROUP_SIZE_M": 8, "SPLIT_K": 1, "A_load_order": 2, "num_warps": 4, "num_ctas": 1, "num_stages": 1, "num_buffers_warp_spec": 0, "num_consumer_groups": 0, "reg_dec_producer": 0, "reg_inc_consumer": 0}, "(24, 3584, 3584, 128, 8, 104)": {"BLOCK_SIZE_M": 32, "BLOCK_SIZE_N": 32, "BLOCK_SIZE_K": 64, "GROUP_SIZE_M": 8, "SPLIT_K": 8, "A_load_order": 2, "num_warps": 8, "num_ctas": 1, "num_stages": 1, "num_buffers_warp_spec": 0, "num_consumer_groups": 0, "reg_dec_producer": 0, "reg_inc_consumer": 0}, "(24, 4608, 3584, 128, 8, 104)": {"BLOCK_SIZE_M": 32, "BLOCK_SIZE_N": 64, "BLOCK_SIZE_K": 64, "GROUP_SIZE_M": 8, "SPLIT_K": 8, "A_load_order": 0, "num_warps": 8, "num_ctas": 1, "num_stages": 1, "num_buffers_warp_spec": 0, "num_consumer_groups": 0, "reg_dec_producer": 0, "reg_inc_consumer": 0}, "(24, 3584, 18944, 128, 8, 104)": {"BLOCK_SIZE_M": 32, "BLOCK_SIZE_N": 64, "BLOCK_SIZE_K": 64, "GROUP_SIZE_M": 8, "SPLIT_K": 8, "A_load_order": 2, "num_warps": 4, "num_ctas": 1, "num_stages": 1, "num_buffers_warp_spec": 0, "num_consumer_groups": 0, "reg_dec_producer": 0, "reg_inc_consumer": 0}, "(24, 37888, 3584, 128, 8, 104)": {"BLOCK_SIZE_M": 32, "BLOCK_SIZE_N": 64, "BLOCK_SIZE_K": 64, "GROUP_SIZE_M": 8, "SPLIT_K": 8, "A_load_order": 2, "num_warps": 4, "num_ctas": 1, "num_stages": 1, "num_buffers_warp_spec": 0, "num_consumer_groups": 0, "reg_dec_producer": 0, "reg_inc_consumer": 0}, "(24, 3072, 3072, 128, 8, 104)": {"BLOCK_SIZE_M": 32, "BLOCK_SIZE_N": 64, "BLOCK_SIZE_K": 64, "GROUP_SIZE_M": 8, "SPLIT_K": 16, "A_load_order": 2, "num_warps": 4, "num_ctas": 1, "num_stages": 1, "num_buffers_warp_spec": 0, "num_consumer_groups": 0, "reg_dec_producer": 0, "reg_inc_consumer": 0}, "(24, 5120, 3072, 128, 8, 104)": {"BLOCK_SIZE_M": 32, "BLOCK_SIZE_N": 128, "BLOCK_SIZE_K": 64, "GROUP_SIZE_M": 8, "SPLIT_K": 16, "A_load_order": 0, "num_warps": 4, "num_ctas": 1, "num_stages": 1, "num_buffers_warp_spec": 0, "num_consumer_groups": 0, "reg_dec_producer": 0, "reg_inc_consumer": 0}, "(24, 3072, 8192, 128, 8, 104)": {"BLOCK_SIZE_M": 32, "BLOCK_SIZE_N": 64, "BLOCK_SIZE_K": 64, "GROUP_SIZE_M": 8, "SPLIT_K": 16, "A_load_order": 2, "num_warps": 4, "num_ctas": 1, "num_stages": 1, "num_buffers_warp_spec": 0, "num_consumer_groups": 0, "reg_dec_producer": 0, "reg_inc_consumer": 0}, "(24, 16384, 3072, 128, 8, 104)": {"BLOCK_SIZE_M": 32, "BLOCK_SIZE_N": 64, "BLOCK_SIZE_K": 128, "GROUP_SIZE_M": 8, "SPLIT_K": 8, "A_load_order": 2, "num_warps": 4, "num_ctas": 1, "num_stages": 1, "num_buffers_warp_spec": 0, "num_consumer_groups": 0, "reg_dec_producer": 0, "reg_inc_consumer": 0}, "(4, 4096, 4096, 4096, 1, 408)": {"BLOCK_SIZE_M": 16, "BLOCK_SIZE_N": 32, "BLOCK_SIZE_K": 256, "GROUP_SIZE_M": 8, "SPLIT_K": 1, "A_load_order": 2, "num_warps": 4, "num_ctas": 1, "num_stages": 4, "num_buffers_warp_spec": 0, "num_consumer_groups": 0, "reg_dec_producer": 0, "reg_inc_consumer": 0}, "(8, 4096, 4096, 4096, 1, 408)": {"BLOCK_SIZE_M": 16, "BLOCK_SIZE_N": 64, "BLOCK_SIZE_K": 256, "GROUP_SIZE_M": 8, "SPLIT_K": 1, "A_load_order": 0, "num_warps": 8, "num_ctas": 1, "num_stages": 4, "num_buffers_warp_spec": 0, "num_consumer_groups": 0, "reg_dec_producer": 0, "reg_inc_consumer": 0}, "(16, 4096, 4096, 4096, 1, 408)": {"BLOCK_SIZE_M": 16, "BLOCK_SIZE_N": 32, "BLOCK_SIZE_K": 512, "GROUP_SIZE_M": 8, "SPLIT_K": 1, "A_load_order": 2, "num_warps": 4, "num_ctas": 1, "num_stages": 4, "num_buffers_warp_spec": 0, "num_consumer_groups": 0, "reg_dec_producer": 0, "reg_inc_consumer": 0}, "(32, 4096, 4096, 4096, 1, 408)": {"BLOCK_SIZE_M": 16, "BLOCK_SIZE_N": 64, "BLOCK_SIZE_K": 256, "GROUP_SIZE_M": 8, "SPLIT_K": 1, "A_load_order": 0, "num_warps": 8, "num_ctas": 1, "num_stages": 4, "num_buffers_warp_spec": 0, "num_consumer_groups": 0, "reg_dec_producer": 0, "reg_inc_consumer": 0}, "(64, 4096, 4096, 4096, 1, 408)": {"BLOCK_SIZE_M": 32, "BLOCK_SIZE_N": 64, "BLOCK_SIZE_K": 256, "GROUP_SIZE_M": 8, "SPLIT_K": 1, "A_load_order": 2, "num_warps": 8, "num_ctas": 1, "num_stages": 4, "num_buffers_warp_spec": 0, "num_consumer_groups": 0, "reg_dec_producer": 0, "reg_inc_consumer": 0}, "(4, 6144, 4096, 4096, 1, 408)": {"BLOCK_SIZE_M": 16, "BLOCK_SIZE_N": 64, "BLOCK_SIZE_K": 256, "GROUP_SIZE_M": 8, "SPLIT_K": 1, "A_load_order": 0, "num_warps": 4, "num_ctas": 1, "num_stages": 4, "num_buffers_warp_spec": 0, "num_consumer_groups": 0, "reg_dec_producer": 0, "reg_inc_consumer": 0}, "(8, 6144, 4096, 4096, 1, 408)": {"BLOCK_SIZE_M": 16, "BLOCK_SIZE_N": 32, "BLOCK_SIZE_K": 256, "GROUP_SIZE_M": 8, "SPLIT_K": 1, "A_load_order": 2, "num_warps": 4, "num_ctas": 1, "num_stages": 4, "num_buffers_warp_spec": 0, "num_consumer_groups": 0, "reg_dec_producer": 0, "reg_inc_consumer": 0}, "(16, 6144, 4096, 4096, 1, 408)": {"BLOCK_SIZE_M": 16, "BLOCK_SIZE_N": 64, "BLOCK_SIZE_K": 256, "GROUP_SIZE_M": 8, "SPLIT_K": 1, "A_load_order": 0, "num_warps": 4, "num_ctas": 1, "num_stages": 4, "num_buffers_warp_spec": 0, "num_consumer_groups": 0, "reg_dec_producer": 0, "reg_inc_consumer": 0}, "(32, 6144, 4096, 4096, 1, 408)": {"BLOCK_SIZE_M": 16, "BLOCK_SIZE_N": 128, "BLOCK_SIZE_K": 128, "GROUP_SIZE_M": 8, "SPLIT_K": 1, "A_load_order": 0, "num_warps": 8, "num_ctas": 1, "num_stages": 4, "num_buffers_warp_spec": 0, "num_consumer_groups": 0, "reg_dec_producer": 0, "reg_inc_consumer": 0}, "(64, 6144, 4096, 4096, 1, 408)": {"BLOCK_SIZE_M": 32, "BLOCK_SIZE_N": 128, "BLOCK_SIZE_K": 128, "GROUP_SIZE_M": 8, "SPLIT_K": 1, "A_load_order": 0, "num_warps": 4, "num_ctas": 1, "num_stages": 4, "num_buffers_warp_spec": 0, "num_consumer_groups": 0, "reg_dec_producer": 0, "reg_inc_consumer": 0}, "(4, 4096, 14336, 14336, 1, 408)": {"BLOCK_SIZE_M": 16, "BLOCK_SIZE_N": 32, "BLOCK_SIZE_K": 512, "GROUP_SIZE_M": 8, "SPLIT_K": 1, "A_load_order": 2, "num_warps": 8, "num_ctas": 1, "num_stages": 4, "num_buffers_warp_spec": 0, "num_consumer_groups": 0, "reg_dec_producer": 0, "reg_inc_consumer": 0}, "(8, 4096, 14336, 14336, 1, 408)": {"BLOCK_SIZE_M": 16, "BLOCK_SIZE_N": 32, "BLOCK_SIZE_K": 512, "GROUP_SIZE_M": 8, "SPLIT_K": 1, "A_load_order": 2, "num_warps": 4, "num_ctas": 1, "num_stages": 4, "num_buffers_warp_spec": 0, "num_consumer_groups": 0, "reg_dec_producer": 0, "reg_inc_consumer": 0}, "(16, 4096, 14336, 14336, 1, 408)": {"BLOCK_SIZE_M": 16, "BLOCK_SIZE_N": 32, "BLOCK_SIZE_K": 512, "GROUP_SIZE_M": 8, "SPLIT_K": 1, "A_load_order": 0, "num_warps": 4, "num_ctas": 1, "num_stages": 4, "num_buffers_warp_spec": 0, "num_consumer_groups": 0, "reg_dec_producer": 0, "reg_inc_consumer": 0}, "(32, 4096, 14336, 14336, 1, 408)": {"BLOCK_SIZE_M": 16, "BLOCK_SIZE_N": 64, "BLOCK_SIZE_K": 256, "GROUP_SIZE_M": 8, "SPLIT_K": 1, "A_load_order": 2, "num_warps": 4, "num_ctas": 1, "num_stages": 4, "num_buffers_warp_spec": 0, "num_consumer_groups": 0, "reg_dec_producer": 0, "reg_inc_consumer": 0}, "(64, 4096, 14336, 14336, 1, 408)": {"BLOCK_SIZE_M": 32, "BLOCK_SIZE_N": 64, "BLOCK_SIZE_K": 256, "GROUP_SIZE_M": 8, "SPLIT_K": 1, "A_load_order": 2, "num_warps": 4, "num_ctas": 1, "num_stages": 4, "num_buffers_warp_spec": 0, "num_consumer_groups": 0, "reg_dec_producer": 0, "reg_inc_consumer": 0}, "(4, 28672, 4096, 4096, 1, 408)": {"BLOCK_SIZE_M": 16, "BLOCK_SIZE_N": 64, "BLOCK_SIZE_K": 128, "GROUP_SIZE_M": 8, "SPLIT_K": 1, "A_load_order": 2, "num_warps": 8, "num_ctas": 1, "num_stages": 4, "num_buffers_warp_spec": 0, "num_consumer_groups": 0, "reg_dec_producer": 0, "reg_inc_consumer": 0}, "(8, 28672, 4096, 4096, 1, 408)": {"BLOCK_SIZE_M": 16, "BLOCK_SIZE_N": 64, "BLOCK_SIZE_K": 128, "GROUP_SIZE_M": 8, "SPLIT_K": 1, "A_load_order": 2, "num_warps": 4, "num_ctas": 1, "num_stages": 2, "num_buffers_warp_spec": 0, "num_consumer_groups": 0, "reg_dec_producer": 0, "reg_inc_consumer": 0}, "(16, 28672, 4096, 4096, 1, 408)": {"BLOCK_SIZE_M": 16, "BLOCK_SIZE_N": 128, "BLOCK_SIZE_K": 128, "GROUP_SIZE_M": 8, "SPLIT_K": 1, "A_load_order": 2, "num_warps": 4, "num_ctas": 1, "num_stages": 2, "num_buffers_warp_spec": 0, "num_consumer_groups": 0, "reg_dec_producer": 0, "reg_inc_consumer": 0}, "(32, 28672, 4096, 4096, 1, 408)": {"BLOCK_SIZE_M": 32, "BLOCK_SIZE_N": 128, "BLOCK_SIZE_K": 128, "GROUP_SIZE_M": 8, "SPLIT_K": 1, "A_load_order": 2, "num_warps": 8, "num_ctas": 1, "num_stages": 2, "num_buffers_warp_spec": 0, "num_consumer_groups": 0, "reg_dec_producer": 0, "reg_inc_consumer": 0}, "(64, 28672, 4096, 4096, 1, 408)": {"BLOCK_SIZE_M": 32, "BLOCK_SIZE_N": 256, "BLOCK_SIZE_K": 128, "GROUP_SIZE_M": 8, "SPLIT_K": 1, "A_load_order": 2, "num_warps": 8, "num_ctas": 1, "num_stages": 2, "num_buffers_warp_spec": 0, "num_consumer_groups": 0, "reg_dec_producer": 0, "reg_inc_consumer": 0}, "(4, 3584, 3584, 3584, 1, 408)": {"BLOCK_SIZE_M": 16, "BLOCK_SIZE_N": 32, "BLOCK_SIZE_K": 512, "GROUP_SIZE_M": 8, "SPLIT_K": 1, "A_load_order": 2, "num_warps": 4, "num_ctas": 1, "num_stages": 4, "num_buffers_warp_spec": 0, "num_consumer_groups": 0, "reg_dec_producer": 0, "reg_inc_consumer": 0}, "(8, 3584, 3584, 3584, 1, 408)": {"BLOCK_SIZE_M": 16, "BLOCK_SIZE_N": 32, "BLOCK_SIZE_K": 512, "GROUP_SIZE_M": 8, "SPLIT_K": 1, "A_load_order": 0, "num_warps": 4, "num_ctas": 1, "num_stages": 4, "num_buffers_warp_spec": 0, "num_consumer_groups": 0, "reg_dec_producer": 0, "reg_inc_consumer": 0}, "(16, 3584, 3584, 3584, 1, 408)": {"BLOCK_SIZE_M": 16, "BLOCK_SIZE_N": 32, "BLOCK_SIZE_K": 512, "GROUP_SIZE_M": 8, "SPLIT_K": 1, "A_load_order": 2, "num_warps": 4, "num_ctas": 1, "num_stages": 4, "num_buffers_warp_spec": 0, "num_consumer_groups": 0, "reg_dec_producer": 0, "reg_inc_consumer": 0}, "(32, 3584, 3584, 3584, 1, 408)": {"BLOCK_SIZE_M": 16, "BLOCK_SIZE_N": 32, "BLOCK_SIZE_K": 256, "GROUP_SIZE_M": 8, "SPLIT_K": 1, "A_load_order": 0, "num_warps": 4, "num_ctas": 1, "num_stages": 4, "num_buffers_warp_spec": 0, "num_consumer_groups": 0, "reg_dec_producer": 0, "reg_inc_consumer": 0}, "(64, 3584, 3584, 3584, 1, 408)": {"BLOCK_SIZE_M": 32, "BLOCK_SIZE_N": 64, "BLOCK_SIZE_K": 256, "GROUP_SIZE_M": 8, "SPLIT_K": 1, "A_load_order": 0, "num_warps": 8, "num_ctas": 1, "num_stages": 4, "num_buffers_warp_spec": 0, "num_consumer_groups": 0, "reg_dec_producer": 0, "reg_inc_consumer": 0}, "(4, 4608, 3584, 3584, 1, 408)": {"BLOCK_SIZE_M": 16, "BLOCK_SIZE_N": 32, "BLOCK_SIZE_K": 256, "GROUP_SIZE_M": 8, "SPLIT_K": 1, "A_load_order": 2, "num_warps": 4, "num_ctas": 1, "num_stages": 4, "num_buffers_warp_spec": 0, "num_consumer_groups": 0, "reg_dec_producer": 0, "reg_inc_consumer": 0}, "(8, 4608, 3584, 3584, 1, 408)": {"BLOCK_SIZE_M": 16, "BLOCK_SIZE_N": 32, "BLOCK_SIZE_K": 256, "GROUP_SIZE_M": 8, "SPLIT_K": 1, "A_load_order": 0, "num_warps": 8, "num_ctas": 1, "num_stages": 4, "num_buffers_warp_spec": 0, "num_consumer_groups": 0, "reg_dec_producer": 0, "reg_inc_consumer": 0}, "(16, 4608, 3584, 3584, 1, 408)": {"BLOCK_SIZE_M": 16, "BLOCK_SIZE_N": 32, "BLOCK_SIZE_K": 512, "GROUP_SIZE_M": 8, "SPLIT_K": 1, "A_load_order": 0, "num_warps": 8, "num_ctas": 1, "num_stages": 4, "num_buffers_warp_spec": 0, "num_consumer_groups": 0, "reg_dec_producer": 0, "reg_inc_consumer": 0}, "(32, 4608, 3584, 3584, 1, 408)": {"BLOCK_SIZE_M": 16, "BLOCK_SIZE_N": 64, "BLOCK_SIZE_K": 256, "GROUP_SIZE_M": 8, "SPLIT_K": 1, "A_load_order": 2, "num_warps": 8, "num_ctas": 1, "num_stages": 4, "num_buffers_warp_spec": 0, "num_consumer_groups": 0, "reg_dec_producer": 0, "reg_inc_consumer": 0}, "(64, 4608, 3584, 3584, 1, 408)": {"BLOCK_SIZE_M": 32, "BLOCK_SIZE_N": 64, "BLOCK_SIZE_K": 256, "GROUP_SIZE_M": 8, "SPLIT_K": 1, "A_load_order": 0, "num_warps": 8, "num_ctas": 1, "num_stages": 4, "num_buffers_warp_spec": 0, "num_consumer_groups": 0, "reg_dec_producer": 0, "reg_inc_consumer": 0}, "(4, 3584, 18944, 18944, 1, 408)": {"BLOCK_SIZE_M": 16, "BLOCK_SIZE_N": 32, "BLOCK_SIZE_K": 512, "GROUP_SIZE_M": 8, "SPLIT_K": 1, "A_load_order": 0, "num_warps": 4, "num_ctas": 1, "num_stages": 4, "num_buffers_warp_spec": 0, "num_consumer_groups": 0, "reg_dec_producer": 0, "reg_inc_consumer": 0}, "(8, 3584, 18944, 18944, 1, 408)": {"BLOCK_SIZE_M": 16, "BLOCK_SIZE_N": 32, "BLOCK_SIZE_K": 512, "GROUP_SIZE_M": 8, "SPLIT_K": 1, "A_load_order": 0, "num_warps": 4, "num_ctas": 1, "num_stages": 4, "num_buffers_warp_spec": 0, "num_consumer_groups": 0, "reg_dec_producer": 0, "reg_inc_consumer": 0}, "(16, 3584, 18944, 18944, 1, 408)": {"BLOCK_SIZE_M": 16, "BLOCK_SIZE_N": 32, "BLOCK_SIZE_K": 512, "GROUP_SIZE_M": 8, "SPLIT_K": 1, "A_load_order": 0, "num_warps": 8, "num_ctas": 1, "num_stages": 4, "num_buffers_warp_spec": 0, "num_consumer_groups": 0, "reg_dec_producer": 0, "reg_inc_consumer": 0}, "(32, 3584, 18944, 18944, 1, 408)": {"BLOCK_SIZE_M": 16, "BLOCK_SIZE_N": 64, "BLOCK_SIZE_K": 256, "GROUP_SIZE_M": 8, "SPLIT_K": 1, "A_load_order": 0, "num_warps": 8, "num_ctas": 1, "num_stages": 4, "num_buffers_warp_spec": 0, "num_consumer_groups": 0, "reg_dec_producer": 0, "reg_inc_consumer": 0}, "(64, 3584, 18944, 18944, 1, 408)": {"BLOCK_SIZE_M": 32, "BLOCK_SIZE_N": 64, "BLOCK_SIZE_K": 256, "GROUP_SIZE_M": 8, "SPLIT_K": 1, "A_load_order": 0, "num_warps": 8, "num_ctas": 1, "num_stages": 4, "num_buffers_warp_spec": 0, "num_consumer_groups": 0, "reg_dec_producer": 0, "reg_inc_consumer": 0}, "(4, 37888, 3584, 3584, 1, 408)": {"BLOCK_SIZE_M": 16, "BLOCK_SIZE_N": 128, "BLOCK_SIZE_K": 256, "GROUP_SIZE_M": 8, "SPLIT_K": 1, "A_load_order": 2, "num_warps": 8, "num_ctas": 1, "num_stages": 2, "num_buffers_warp_spec": 0, "num_consumer_groups": 0, "reg_dec_producer": 0, "reg_inc_consumer": 0}, "(8, 37888, 3584, 3584, 1, 408)": {"BLOCK_SIZE_M": 16, "BLOCK_SIZE_N": 128, "BLOCK_SIZE_K": 256, "GROUP_SIZE_M": 8, "SPLIT_K": 1, "A_load_order": 2, "num_warps": 8, "num_ctas": 1, "num_stages": 2, "num_buffers_warp_spec": 0, "num_consumer_groups": 0, "reg_dec_producer": 0, "reg_inc_consumer": 0}, "(16, 37888, 3584, 3584, 1, 408)": {"BLOCK_SIZE_M": 16, "BLOCK_SIZE_N": 128, "BLOCK_SIZE_K": 256, "GROUP_SIZE_M": 8, "SPLIT_K": 1, "A_load_order": 0, "num_warps": 8, "num_ctas": 1, "num_stages": 2, "num_buffers_warp_spec": 0, "num_consumer_groups": 0, "reg_dec_producer": 0, "reg_inc_consumer": 0}, "(32, 37888, 3584, 3584, 1, 408)": {"BLOCK_SIZE_M": 32, "BLOCK_SIZE_N": 128, "BLOCK_SIZE_K": 256, "GROUP_SIZE_M": 8, "SPLIT_K": 1, "A_load_order": 2, "num_warps": 8, "num_ctas": 1, "num_stages": 2, "num_buffers_warp_spec": 0, "num_consumer_groups": 0, "reg_dec_producer": 0, "reg_inc_consumer": 0}, "(64, 37888, 3584, 3584, 1, 408)": {"BLOCK_SIZE_M": 64, "BLOCK_SIZE_N": 128, "BLOCK_SIZE_K": 256, "GROUP_SIZE_M": 8, "SPLIT_K": 1, "A_load_order": 2, "num_warps": 8, "num_ctas": 1, "num_stages": 2, "num_buffers_warp_spec": 0, "num_consumer_groups": 0, "reg_dec_producer": 0, "reg_inc_consumer": 0}, "(4, 3072, 3072, 3072, 1, 408)": {"BLOCK_SIZE_M": 16, "BLOCK_SIZE_N": 32, "BLOCK_SIZE_K": 512, "GROUP_SIZE_M": 8, "SPLIT_K": 1, "A_load_order": 2, "num_warps": 4, "num_ctas": 1, "num_stages": 4, "num_buffers_warp_spec": 0, "num_consumer_groups": 0, "reg_dec_producer": 0, "reg_inc_consumer": 0}, "(8, 3072, 3072, 3072, 1, 408)": {"BLOCK_SIZE_M": 16, "BLOCK_SIZE_N": 64, "BLOCK_SIZE_K": 256, "GROUP_SIZE_M": 8, "SPLIT_K": 1, "A_load_order": 2, "num_warps": 8, "num_ctas": 1, "num_stages": 4, "num_buffers_warp_spec": 0, "num_consumer_groups": 0, "reg_dec_producer": 0, "reg_inc_consumer": 0}, "(16, 3072, 3072, 3072, 1, 408)": {"BLOCK_SIZE_M": 16, "BLOCK_SIZE_N": 32, "BLOCK_SIZE_K": 512, "GROUP_SIZE_M": 8, "SPLIT_K": 1, "A_load_order": 2, "num_warps": 4, "num_ctas": 1, "num_stages": 4, "num_buffers_warp_spec": 0, "num_consumer_groups": 0, "reg_dec_producer": 0, "reg_inc_consumer": 0}, "(32, 3072, 3072, 3072, 1, 408)": {"BLOCK_SIZE_M": 16, "BLOCK_SIZE_N": 64, "BLOCK_SIZE_K": 256, "GROUP_SIZE_M": 8, "SPLIT_K": 1, "A_load_order": 0, "num_warps": 8, "num_ctas": 1, "num_stages": 4, "num_buffers_warp_spec": 0, "num_consumer_groups": 0, "reg_dec_producer": 0, "reg_inc_consumer": 0}, "(64, 3072, 3072, 3072, 1, 408)": {"BLOCK_SIZE_M": 32, "BLOCK_SIZE_N": 64, "BLOCK_SIZE_K": 256, "GROUP_SIZE_M": 8, "SPLIT_K": 1, "A_load_order": 0, "num_warps": 8, "num_ctas": 1, "num_stages": 4, "num_buffers_warp_spec": 0, "num_consumer_groups": 0, "reg_dec_producer": 0, "reg_inc_consumer": 0}, "(4, 5120, 3072, 3072, 1, 408)": {"BLOCK_SIZE_M": 16, "BLOCK_SIZE_N": 32, "BLOCK_SIZE_K": 256, "GROUP_SIZE_M": 8, "SPLIT_K": 1, "A_load_order": 0, "num_warps": 4, "num_ctas": 1, "num_stages": 4, "num_buffers_warp_spec": 0, "num_consumer_groups": 0, "reg_dec_producer": 0, "reg_inc_consumer": 0}, "(8, 5120, 3072, 3072, 1, 408)": {"BLOCK_SIZE_M": 16, "BLOCK_SIZE_N": 32, "BLOCK_SIZE_K": 256, "GROUP_SIZE_M": 8, "SPLIT_K": 1, "A_load_order": 0, "num_warps": 8, "num_ctas": 1, "num_stages": 4, "num_buffers_warp_spec": 0, "num_consumer_groups": 0, "reg_dec_producer": 0, "reg_inc_consumer": 0}, "(16, 5120, 3072, 3072, 1, 408)": {"BLOCK_SIZE_M": 16, "BLOCK_SIZE_N": 32, "BLOCK_SIZE_K": 512, "GROUP_SIZE_M": 8, "SPLIT_K": 1, "A_load_order": 2, "num_warps": 8, "num_ctas": 1, "num_stages": 4, "num_buffers_warp_spec": 0, "num_consumer_groups": 0, "reg_dec_producer": 0, "reg_inc_consumer": 0}, "(32, 5120, 3072, 3072, 1, 408)": {"BLOCK_SIZE_M": 16, "BLOCK_SIZE_N": 32, "BLOCK_SIZE_K": 256, "GROUP_SIZE_M": 8, "SPLIT_K": 1, "A_load_order": 2, "num_warps": 4, "num_ctas": 1, "num_stages": 4, "num_buffers_warp_spec": 0, "num_consumer_groups": 0, "reg_dec_producer": 0, "reg_inc_consumer": 0}, "(64, 5120, 3072, 3072, 1, 408)": {"BLOCK_SIZE_M": 32, "BLOCK_SIZE_N": 64, "BLOCK_SIZE_K": 256, "GROUP_SIZE_M": 8, "SPLIT_K": 1, "A_load_order": 0, "num_warps": 4, "num_ctas": 1, "num_stages": 4, "num_buffers_warp_spec": 0, "num_consumer_groups": 0, "reg_dec_producer": 0, "reg_inc_consumer": 0}}, "GEMM": {"(128, 4096, 4096, 64, 8, 104)": {"BLOCK_SIZE_M": 128, "BLOCK_SIZE_N": 32, "BLOCK_SIZE_K": 64, "GROUP_SIZE_M": 8, "A_load_order": 0, "num_warps": 4, "num_ctas": 1, "num_stages": 3, "num_buffers_warp_spec": 0, "num_consumer_groups": 0, "reg_dec_producer": 0, "reg_inc_consumer": 0}, "(256, 4096, 4096, 64, 8, 104)": {"BLOCK_SIZE_M": 128, "BLOCK_SIZE_N": 64, "BLOCK_SIZE_K": 32, "GROUP_SIZE_M": 8, "A_load_order": 0, "num_warps": 8, "num_ctas": 1, "num_stages": 4, "num_buffers_warp_spec": 0, "num_consumer_groups": 0, "reg_dec_producer": 0, "reg_inc_consumer": 0}, "(512, 4096, 4096, 64, 8, 104)": {"BLOCK_SIZE_M": 128, "BLOCK_SIZE_N": 64, "BLOCK_SIZE_K": 64, "GROUP_SIZE_M": 8, "A_load_order": 2, "num_warps": 8, "num_ctas": 1, "num_stages": 1, "num_buffers_warp_spec": 0, "num_consumer_groups": 0, "reg_dec_producer": 0, "reg_inc_consumer": 0}, "(128, 6144, 4096, 64, 8, 104)": {"BLOCK_SIZE_M": 128, "BLOCK_SIZE_N": 64, "BLOCK_SIZE_K": 32, "GROUP_SIZE_M": 8, "A_load_order": 0, "num_warps": 8, "num_ctas": 1, "num_stages": 4, "num_buffers_warp_spec": 0, "num_consumer_groups": 0, "reg_dec_producer": 0, "reg_inc_consumer": 0}, "(256, 6144, 4096, 64, 8, 104)": {"BLOCK_SIZE_M": 64, "BLOCK_SIZE_N": 64, "BLOCK_SIZE_K": 64, "GROUP_SIZE_M": 8, "A_load_order": 2, "num_warps": 8, "num_ctas": 1, "num_stages": 1, "num_buffers_warp_spec": 0, "num_consumer_groups": 0, "reg_dec_producer": 0, "reg_inc_consumer": 0}, "(512, 6144, 4096, 64, 8, 104)": {"BLOCK_SIZE_M": 64, "BLOCK_SIZE_N": 64, "BLOCK_SIZE_K": 64, "GROUP_SIZE_M": 8, "A_load_order": 0, "num_warps": 4, "num_ctas": 1, "num_stages": 1, "num_buffers_warp_spec": 0, "num_consumer_groups": 0, "reg_dec_producer": 0, "reg_inc_consumer": 0}, "(128, 4096, 14336, 64, 8, 104)": {"BLOCK_SIZE_M": 64, "BLOCK_SIZE_N": 64, "BLOCK_SIZE_K": 64, "GROUP_SIZE_M": 8, "A_load_order": 0, "num_warps": 4, "num_ctas": 1, "num_stages": 3, "num_buffers_warp_spec": 0, "num_consumer_groups": 0, "reg_dec_producer": 0, "reg_inc_consumer": 0}, "(256, 4096, 14336, 64, 8, 104)": {"BLOCK_SIZE_M": 128, "BLOCK_SIZE_N": 64, "BLOCK_SIZE_K": 32, "GROUP_SIZE_M": 8, "A_load_order": 0, "num_warps": 8, "num_ctas": 1, "num_stages": 4, "num_buffers_warp_spec": 0, "num_consumer_groups": 0, "reg_dec_producer": 0, "reg_inc_consumer": 0}, "(512, 4096, 14336, 64, 8, 104)": {"BLOCK_SIZE_M": 128, "BLOCK_SIZE_N": 64, "BLOCK_SIZE_K": 64, "GROUP_SIZE_M": 8, "A_load_order": 2, "num_warps": 8, "num_ctas": 1, "num_stages": 1, "num_buffers_warp_spec": 0, "num_consumer_groups": 0, "reg_dec_producer": 0, "reg_inc_consumer": 0}, "(128, 28672, 4096, 64, 8, 104)": {"BLOCK_SIZE_M": 128, "BLOCK_SIZE_N": 64, "BLOCK_SIZE_K": 64, "GROUP_SIZE_M": 8, "A_load_order": 0, "num_warps": 8, "num_ctas": 1, "num_stages": 1, "num_buffers_warp_spec": 0, "num_consumer_groups": 0, "reg_dec_producer": 0, "reg_inc_consumer": 0}, "(256, 28672, 4096, 64, 8, 104)": {"BLOCK_SIZE_M": 64, "BLOCK_SIZE_N": 256, "BLOCK_SIZE_K": 32, "GROUP_SIZE_M": 8, "A_load_order": 0, "num_warps": 4, "num_ctas": 1, "num_stages": 1, "num_buffers_warp_spec": 0, "num_consumer_groups": 0, "reg_dec_producer": 0, "reg_inc_consumer": 0}, "(512, 28672, 4096, 64, 8, 104)": {"BLOCK_SIZE_M": 128, "BLOCK_SIZE_N": 128, "BLOCK_SIZE_K": 64, "GROUP_SIZE_M": 8, "A_load_order": 0, "num_warps": 8, "num_ctas": 1, "num_stages": 1, "num_buffers_warp_spec": 0, "num_consumer_groups": 0, "reg_dec_producer": 0, "reg_inc_consumer": 0}, "(128, 3584, 3584, 64, 8, 104)": {"BLOCK_SIZE_M": 128, "BLOCK_SIZE_N": 32, "BLOCK_SIZE_K": 64, "GROUP_SIZE_M": 8, "A_load_order": 0, "num_warps": 4, "num_ctas": 1, "num_stages": 3, "num_buffers_warp_spec": 0, "num_consumer_groups": 0, "reg_dec_producer": 0, "reg_inc_consumer": 0}, "(256, 3584, 3584, 64, 8, 104)": {"BLOCK_SIZE_M": 128, "BLOCK_SIZE_N": 64, "BLOCK_SIZE_K": 32, "GROUP_SIZE_M": 8, "A_load_order": 0, "num_warps": 8, "num_ctas": 1, "num_stages": 4, "num_buffers_warp_spec": 0, "num_consumer_groups": 0, "reg_dec_producer": 0, "reg_inc_consumer": 0}, "(512, 3584, 3584, 64, 8, 104)": {"BLOCK_SIZE_M": 64, "BLOCK_SIZE_N": 64, "BLOCK_SIZE_K": 64, "GROUP_SIZE_M": 8, "A_load_order": 2, "num_warps": 8, "num_ctas": 1, "num_stages": 1, "num_buffers_warp_spec": 0, "num_consumer_groups": 0, "reg_dec_producer": 0, "reg_inc_consumer": 0}, "(128, 4608, 3584, 64, 8, 104)": {"BLOCK_SIZE_M": 64, "BLOCK_SIZE_N": 64, "BLOCK_SIZE_K": 64, "GROUP_SIZE_M": 8, "A_load_order": 0, "num_warps": 8, "num_ctas": 1, "num_stages": 3, "num_buffers_warp_spec": 0, "num_consumer_groups": 0, "reg_dec_producer": 0, "reg_inc_consumer": 0}, "(256, 4608, 3584, 64, 8, 104)": {"BLOCK_SIZE_M": 128, "BLOCK_SIZE_N": 64, "BLOCK_SIZE_K": 32, "GROUP_SIZE_M": 8, "A_load_order": 0, "num_warps": 8, "num_ctas": 1, "num_stages": 4, "num_buffers_warp_spec": 0, "num_consumer_groups": 0, "reg_dec_producer": 0, "reg_inc_consumer": 0}, "(512, 4608, 3584, 64, 8, 104)": {"BLOCK_SIZE_M": 128, "BLOCK_SIZE_N": 64, "BLOCK_SIZE_K": 64, "GROUP_SIZE_M": 8, "A_load_order": 2, "num_warps": 8, "num_ctas": 1, "num_stages": 1, "num_buffers_warp_spec": 0, "num_consumer_groups": 0, "reg_dec_producer": 0, "reg_inc_consumer": 0}, "(128, 3584, 18944, 64, 8, 104)": {"BLOCK_SIZE_M": 64, "BLOCK_SIZE_N": 64, "BLOCK_SIZE_K": 64, "GROUP_SIZE_M": 8, "A_load_order": 0, "num_warps": 8, "num_ctas": 1, "num_stages": 3, "num_buffers_warp_spec": 0, "num_consumer_groups": 0, "reg_dec_producer": 0, "reg_inc_consumer": 0}, "(256, 3584, 18944, 64, 8, 104)": {"BLOCK_SIZE_M": 128, "BLOCK_SIZE_N": 64, "BLOCK_SIZE_K": 32, "GROUP_SIZE_M": 8, "A_load_order": 0, "num_warps": 8, "num_ctas": 1, "num_stages": 4, "num_buffers_warp_spec": 0, "num_consumer_groups": 0, "reg_dec_producer": 0, "reg_inc_consumer": 0}, "(512, 3584, 18944, 64, 8, 104)": {"BLOCK_SIZE_M": 64, "BLOCK_SIZE_N": 64, "BLOCK_SIZE_K": 64, "GROUP_SIZE_M": 8, "A_load_order": 2, "num_warps": 4, "num_ctas": 1, "num_stages": 1, "num_buffers_warp_spec": 0, "num_consumer_groups": 0, "reg_dec_producer": 0, "reg_inc_consumer": 0}, "(128, 37888, 3584, 64, 8, 104)": {"BLOCK_SIZE_M": 128, "BLOCK_SIZE_N": 128, "BLOCK_SIZE_K": 64, "GROUP_SIZE_M": 8, "A_load_order": 0, "num_warps": 8, "num_ctas": 1, "num_stages": 1, "num_buffers_warp_spec": 0, "num_consumer_groups": 0, "reg_dec_producer": 0, "reg_inc_consumer": 0}, "(256, 37888, 3584, 64, 8, 104)": {"BLOCK_SIZE_M": 128, "BLOCK_SIZE_N": 256, "BLOCK_SIZE_K": 32, "GROUP_SIZE_M": 8, "A_load_order": 0, "num_warps": 4, "num_ctas": 1, "num_stages": 1, "num_buffers_warp_spec": 0, "num_consumer_groups": 0, "reg_dec_producer": 0, "reg_inc_consumer": 0}, "(512, 37888, 3584, 64, 8, 104)": {"BLOCK_SIZE_M": 128, "BLOCK_SIZE_N": 256, "BLOCK_SIZE_K": 32, "GROUP_SIZE_M": 8, "A_load_order": 0, "num_warps": 4, "num_ctas": 1, "num_stages": 1, "num_buffers_warp_spec": 0, "num_consumer_groups": 0, "reg_dec_producer": 0, "reg_inc_consumer": 0}, "(128, 3072, 3072, 64, 8, 104)": {"BLOCK_SIZE_M": 64, "BLOCK_SIZE_N": 64, "BLOCK_SIZE_K": 64, "GROUP_SIZE_M": 8, "A_load_order": 0, "num_warps": 8, "num_ctas": 1, "num_stages": 3, "num_buffers_warp_spec": 0, "num_consumer_groups": 0, "reg_dec_producer": 0, "reg_inc_consumer": 0}, "(256, 3072, 3072, 64, 8, 104)": {"BLOCK_SIZE_M": 128, "BLOCK_SIZE_N": 64, "BLOCK_SIZE_K": 32, "GROUP_SIZE_M": 8, "A_load_order": 0, "num_warps": 8, "num_ctas": 1, "num_stages": 4, "num_buffers_warp_spec": 0, "num_consumer_groups": 0, "reg_dec_producer": 0, "reg_inc_consumer": 0}, "(512, 3072, 3072, 64, 8, 104)": {"BLOCK_SIZE_M": 64, "BLOCK_SIZE_N": 64, "BLOCK_SIZE_K": 64, "GROUP_SIZE_M": 8, "A_load_order": 2, "num_warps": 8, "num_ctas": 1, "num_stages": 1, "num_buffers_warp_spec": 0, "num_consumer_groups": 0, "reg_dec_producer": 0, "reg_inc_consumer": 0}, "(128, 5120, 3072, 64, 8, 104)": {"BLOCK_SIZE_M": 64, "BLOCK_SIZE_N": 64, "BLOCK_SIZE_K": 64, "GROUP_SIZE_M": 8, "A_load_order": 0, "num_warps": 8, "num_ctas": 1, "num_stages": 3, "num_buffers_warp_spec": 0, "num_consumer_groups": 0, "reg_dec_producer": 0, "reg_inc_consumer": 0}, "(256, 5120, 3072, 64, 8, 104)": {"BLOCK_SIZE_M": 64, "BLOCK_SIZE_N": 64, "BLOCK_SIZE_K": 64, "GROUP_SIZE_M": 8, "A_load_order": 2, "num_warps": 8, "num_ctas": 1, "num_stages": 1, "num_buffers_warp_spec": 0, "num_consumer_groups": 0, "reg_dec_producer": 0, "reg_inc_consumer": 0}, "(512, 5120, 3072, 64, 8, 104)": {"BLOCK_SIZE_M": 64, "BLOCK_SIZE_N": 128, "BLOCK_SIZE_K": 64, "GROUP_SIZE_M": 8, "A_load_order": 2, "num_warps": 8, "num_ctas": 1, "num_stages": 1, "num_buffers_warp_spec": 0, "num_consumer_groups": 0, "reg_dec_producer": 0, "reg_inc_consumer": 0}, "(128, 3072, 8192, 64, 8, 104)": {"BLOCK_SIZE_M": 128, "BLOCK_SIZE_N": 32, "BLOCK_SIZE_K": 64, "GROUP_SIZE_M": 8, "A_load_order": 0, "num_warps": 4, "num_ctas": 1, "num_stages": 3, "num_buffers_warp_spec": 0, "num_consumer_groups": 0, "reg_dec_producer": 0, "reg_inc_consumer": 0}, "(256, 3072, 8192, 64, 8, 104)": {"BLOCK_SIZE_M": 256, "BLOCK_SIZE_N": 32, "BLOCK_SIZE_K": 32, "GROUP_SIZE_M": 8, "A_load_order": 0, "num_warps": 8, "num_ctas": 1, "num_stages": 4, "num_buffers_warp_spec": 0, "num_consumer_groups": 0, "reg_dec_producer": 0, "reg_inc_consumer": 0}, "(512, 3072, 8192, 64, 8, 104)": {"BLOCK_SIZE_M": 64, "BLOCK_SIZE_N": 64, "BLOCK_SIZE_K": 64, "GROUP_SIZE_M": 8, "A_load_order": 2, "num_warps": 4, "num_ctas": 1, "num_stages": 1, "num_buffers_warp_spec": 0, "num_consumer_groups": 0, "reg_dec_producer": 0, "reg_inc_consumer": 0}, "(128, 16384, 3072, 64, 8, 104)": {"BLOCK_SIZE_M": 64, "BLOCK_SIZE_N": 64, "BLOCK_SIZE_K": 64, "GROUP_SIZE_M": 8, "A_load_order": 2, "num_warps": 4, "num_ctas": 1, "num_stages": 1, "num_buffers_warp_spec": 0, "num_consumer_groups": 0, "reg_dec_producer": 0, "reg_inc_consumer": 0}, "(256, 16384, 3072, 64, 8, 104)": {"BLOCK_SIZE_M": 128, "BLOCK_SIZE_N": 128, "BLOCK_SIZE_K": 64, "GROUP_SIZE_M": 8, "A_load_order": 0, "num_warps": 8, "num_ctas": 1, "num_stages": 1, "num_buffers_warp_spec": 0, "num_consumer_groups": 0, "reg_dec_producer": 0, "reg_inc_consumer": 0}, "(512, 16384, 3072, 64, 8, 104)": {"BLOCK_SIZE_M": 128, "BLOCK_SIZE_N": 128, "BLOCK_SIZE_K": 64, "GROUP_SIZE_M": 8, "A_load_order": 0, "num_warps": 8, "num_ctas": 1, "num_stages": 1, "num_buffers_warp_spec": 0, "num_consumer_groups": 0, "reg_dec_producer": 0, "reg_inc_consumer": 0}, "(128, 4096, 4096, 4096, 1, 408)": {"BLOCK_SIZE_M": 64, "BLOCK_SIZE_N": 64, "BLOCK_SIZE_K": 256, "GROUP_SIZE_M": 8, "A_load_order": 0, "num_warps": 8, "num_ctas": 1, "num_stages": 3, "num_buffers_warp_spec": 0, "num_consumer_groups": 0, "reg_dec_producer": 0, "reg_inc_consumer": 0}, "(256, 4096, 4096, 4096, 1, 408)": {"BLOCK_SIZE_M": 64, "BLOCK_SIZE_N": 64, "BLOCK_SIZE_K": 128, "GROUP_SIZE_M": 8, "A_load_order": 0, "num_warps": 4, "num_ctas": 1, "num_stages": 4, "num_buffers_warp_spec": 0, "num_consumer_groups": 0, "reg_dec_producer": 0, "reg_inc_consumer": 0}, "(512, 4096, 4096, 4096, 1, 408)": {"BLOCK_SIZE_M": 128, "BLOCK_SIZE_N": 128, "BLOCK_SIZE_K": 128, "GROUP_SIZE_M": 8, "A_load_order": 2, "num_warps": 4, "num_ctas": 1, "num_stages": 3, "num_buffers_warp_spec": 0, "num_consumer_groups": 0, "reg_dec_producer": 0, "reg_inc_consumer": 0}, "(128, 6144, 4096, 4096, 1, 408)": {"BLOCK_SIZE_M": 64, "BLOCK_SIZE_N": 128, "BLOCK_SIZE_K": 128, "GROUP_SIZE_M": 8, "A_load_order": 0, "num_warps": 8, "num_ctas": 1, "num_stages": 4, "num_buffers_warp_spec": 0, "num_consumer_groups": 0, "reg_dec_producer": 0, "reg_inc_consumer": 0}, "(256, 6144, 4096, 4096, 1, 408)": {"BLOCK_SIZE_M": 128, "BLOCK_SIZE_N": 128, "BLOCK_SIZE_K": 128, "GROUP_SIZE_M": 8, "A_load_order": 2, "num_warps": 4, "num_ctas": 1, "num_stages": 3, "num_buffers_warp_spec": 0, "num_consumer_groups": 0, "reg_dec_producer": 0, "reg_inc_consumer": 0}, "(512, 6144, 4096, 4096, 1, 408)": {"BLOCK_SIZE_M": 64, "BLOCK_SIZE_N": 128, "BLOCK_SIZE_K": 128, "GROUP_SIZE_M": 8, "A_load_order": 2, "num_warps": 4, "num_ctas": 1, "num_stages": 2, "num_buffers_warp_spec": 0, "num_consumer_groups": 0, "reg_dec_producer": 0, "reg_inc_consumer": 0}, "(128, 4096, 14336, 14336, 1, 408)": {"BLOCK_SIZE_M": 64, "BLOCK_SIZE_N": 64, "BLOCK_SIZE_K": 256, "GROUP_SIZE_M": 8, "A_load_order": 0, "num_warps": 8, "num_ctas": 1, "num_stages": 3, "num_buffers_warp_spec": 0, "num_consumer_groups": 0, "reg_dec_producer": 0, "reg_inc_consumer": 0}, "(256, 4096, 14336, 14336, 1, 408)": {"BLOCK_SIZE_M": 64, "BLOCK_SIZE_N": 128, "BLOCK_SIZE_K": 128, "GROUP_SIZE_M": 8, "A_load_order": 0, "num_warps": 8, "num_ctas": 1, "num_stages": 4, "num_buffers_warp_spec": 0, "num_consumer_groups": 0, "reg_dec_producer": 0, "reg_inc_consumer": 0}, "(512, 4096, 14336, 14336, 1, 408)": {"BLOCK_SIZE_M": 128, "BLOCK_SIZE_N": 128, "BLOCK_SIZE_K": 128, "GROUP_SIZE_M": 8, "A_load_order": 2, "num_warps": 4, "num_ctas": 1, "num_stages": 3, "num_buffers_warp_spec": 0, "num_consumer_groups": 0, "reg_dec_producer": 0, "reg_inc_consumer": 0}, "(128, 28672, 4096, 4096, 1, 408)": {"BLOCK_SIZE_M": 64, "BLOCK_SIZE_N": 128, "BLOCK_SIZE_K": 128, "GROUP_SIZE_M": 8, "A_load_order": 2, "num_warps": 4, "num_ctas": 1, "num_stages": 2, "num_buffers_warp_spec": 0, "num_consumer_groups": 0, "reg_dec_producer": 0, "reg_inc_consumer": 0}, "(256, 28672, 4096, 4096, 1, 408)": {"BLOCK_SIZE_M": 128, "BLOCK_SIZE_N": 128, "BLOCK_SIZE_K": 128, "GROUP_SIZE_M": 8, "A_load_order": 2, "num_warps": 4, "num_ctas": 1, "num_stages": 3, "num_buffers_warp_spec": 0, "num_consumer_groups": 0, "reg_dec_producer": 0, "reg_inc_consumer": 0}, "(512, 28672, 4096, 4096, 1, 408)": {"BLOCK_SIZE_M": 256, "BLOCK_SIZE_N": 128, "BLOCK_SIZE_K": 64, "GROUP_SIZE_M": 8, "A_load_order": 0, "num_warps": 8, "num_ctas": 1, "num_stages": 4, "num_buffers_warp_spec": 0, "num_consumer_groups": 0, "reg_dec_producer": 0, "reg_inc_consumer": 0}, "(128, 3584, 3584, 3584, 1, 408)": {"BLOCK_SIZE_M": 64, "BLOCK_SIZE_N": 64, "BLOCK_SIZE_K": 256, "GROUP_SIZE_M": 8, "A_load_order": 0, "num_warps": 8, "num_ctas": 1, "num_stages": 3, "num_buffers_warp_spec": 0, "num_consumer_groups": 0, "reg_dec_producer": 0, "reg_inc_consumer": 0}, "(256, 3584, 3584, 3584, 1, 408)": {"BLOCK_SIZE_M": 64, "BLOCK_SIZE_N": 128, "BLOCK_SIZE_K": 128, "GROUP_SIZE_M": 8, "A_load_order": 0, "num_warps": 8, "num_ctas": 1, "num_stages": 4, "num_buffers_warp_spec": 0, "num_consumer_groups": 0, "reg_dec_producer": 0, "reg_inc_consumer": 0}, "(512, 3584, 3584, 3584, 1, 408)": {"BLOCK_SIZE_M": 64, "BLOCK_SIZE_N": 128, "BLOCK_SIZE_K": 256, "GROUP_SIZE_M": 8, "A_load_order": 0, "num_warps": 4, "num_ctas": 1, "num_stages": 2, "num_buffers_warp_spec": 0, "num_consumer_groups": 0, "reg_dec_producer": 0, "reg_inc_consumer": 0}, "(128, 4608, 3584, 3584, 1, 408)": {"BLOCK_SIZE_M": 64, "BLOCK_SIZE_N": 64, "BLOCK_SIZE_K": 256, "GROUP_SIZE_M": 8, "A_load_order": 0, "num_warps": 8, "num_ctas": 1, "num_stages": 3, "num_buffers_warp_spec": 0, "num_consumer_groups": 0, "reg_dec_producer": 0, "reg_inc_consumer": 0}, "(256, 4608, 3584, 3584, 1, 408)": {"BLOCK_SIZE_M": 64, "BLOCK_SIZE_N": 64, "BLOCK_SIZE_K": 128, "GROUP_SIZE_M": 8, "A_load_order": 0, "num_warps": 8, "num_ctas": 1, "num_stages": 4, "num_buffers_warp_spec": 0, "num_consumer_groups": 0, "reg_dec_producer": 0, "reg_inc_consumer": 0}, "(512, 4608, 3584, 3584, 1, 408)": {"BLOCK_SIZE_M": 128, "BLOCK_SIZE_N": 128, "BLOCK_SIZE_K": 128, "GROUP_SIZE_M": 8, "A_load_order": 2, "num_warps": 4, "num_ctas": 1, "num_stages": 3, "num_buffers_warp_spec": 0, "num_consumer_groups": 0, "reg_dec_producer": 0, "reg_inc_consumer": 0}, "(128, 3584, 18944, 18944, 1, 408)": {"BLOCK_SIZE_M": 64, "BLOCK_SIZE_N": 64, "BLOCK_SIZE_K": 256, "GROUP_SIZE_M": 8, "A_load_order": 0, "num_warps": 8, "num_ctas": 1, "num_stages": 3, "num_buffers_warp_spec": 0, "num_consumer_groups": 0, "reg_dec_producer": 0, "reg_inc_consumer": 0}, "(256, 3584, 18944, 18944, 1, 408)": {"BLOCK_SIZE_M": 64, "BLOCK_SIZE_N": 128, "BLOCK_SIZE_K": 128, "GROUP_SIZE_M": 8, "A_load_order": 0, "num_warps": 8, "num_ctas": 1, "num_stages": 4, "num_buffers_warp_spec": 0, "num_consumer_groups": 0, "reg_dec_producer": 0, "reg_inc_consumer": 0}, "(512, 3584, 18944, 18944, 1, 408)": {"BLOCK_SIZE_M": 128, "BLOCK_SIZE_N": 128, "BLOCK_SIZE_K": 128, "GROUP_SIZE_M": 8, "A_load_order": 2, "num_warps": 4, "num_ctas": 1, "num_stages": 3, "num_buffers_warp_spec": 0, "num_consumer_groups": 0, "reg_dec_producer": 0, "reg_inc_consumer": 0}, "(128, 37888, 3584, 3584, 1, 408)": {"BLOCK_SIZE_M": 64, "BLOCK_SIZE_N": 256, "BLOCK_SIZE_K": 128, "GROUP_SIZE_M": 8, "A_load_order": 2, "num_warps": 4, "num_ctas": 1, "num_stages": 2, "num_buffers_warp_spec": 0, "num_consumer_groups": 0, "reg_dec_producer": 0, "reg_inc_consumer": 0}, "(256, 37888, 3584, 3584, 1, 408)": {"BLOCK_SIZE_M": 128, "BLOCK_SIZE_N": 128, "BLOCK_SIZE_K": 128, "GROUP_SIZE_M": 8, "A_load_order": 0, "num_warps": 4, "num_ctas": 1, "num_stages": 2, "num_buffers_warp_spec": 0, "num_consumer_groups": 0, "reg_dec_producer": 0, "reg_inc_consumer": 0}, "(512, 37888, 3584, 3584, 1, 408)": {"BLOCK_SIZE_M": 128, "BLOCK_SIZE_N": 128, "BLOCK_SIZE_K": 128, "GROUP_SIZE_M": 8, "A_load_order": 0, "num_warps": 4, "num_ctas": 1, "num_stages": 2, "num_buffers_warp_spec": 0, "num_consumer_groups": 0, "reg_dec_producer": 0, "reg_inc_consumer": 0}, "(128, 3072, 3072, 3072, 1, 408)": {"BLOCK_SIZE_M": 64, "BLOCK_SIZE_N": 64, "BLOCK_SIZE_K": 256, "GROUP_SIZE_M": 8, "A_load_order": 2, "num_warps": 8, "num_ctas": 1, "num_stages": 3, "num_buffers_warp_spec": 0, "num_consumer_groups": 0, "reg_dec_producer": 0, "reg_inc_consumer": 0}, "(256, 3072, 3072, 3072, 1, 408)": {"BLOCK_SIZE_M": 64, "BLOCK_SIZE_N": 64, "BLOCK_SIZE_K": 128, "GROUP_SIZE_M": 8, "A_load_order": 0, "num_warps": 4, "num_ctas": 1, "num_stages": 4, "num_buffers_warp_spec": 0, "num_consumer_groups": 0, "reg_dec_producer": 0, "reg_inc_consumer": 0}, "(512, 3072, 3072, 3072, 1, 408)": {"BLOCK_SIZE_M": 128, "BLOCK_SIZE_N": 128, "BLOCK_SIZE_K": 128, "GROUP_SIZE_M": 8, "A_load_order": 0, "num_warps": 4, "num_ctas": 1, "num_stages": 3, "num_buffers_warp_spec": 0, "num_consumer_groups": 0, "reg_dec_producer": 0, "reg_inc_consumer": 0}, "(128, 5120, 3072, 3072, 1, 408)": {"BLOCK_SIZE_M": 64, "BLOCK_SIZE_N": 64, "BLOCK_SIZE_K": 256, "GROUP_SIZE_M": 8, "A_load_order": 0, "num_warps": 8, "num_ctas": 1, "num_stages": 3, "num_buffers_warp_spec": 0, "num_consumer_groups": 0, "reg_dec_producer": 0, "reg_inc_consumer": 0}, "(256, 5120, 3072, 3072, 1, 408)": {"BLOCK_SIZE_M": 64, "BLOCK_SIZE_N": 64, "BLOCK_SIZE_K": 128, "GROUP_SIZE_M": 8, "A_load_order": 2, "num_warps": 8, "num_ctas": 1, "num_stages": 4, "num_buffers_warp_spec": 0, "num_consumer_groups": 0, "reg_dec_producer": 0, "reg_inc_consumer": 0}, "(512, 5120, 3072, 3072, 1, 408)": {"BLOCK_SIZE_M": 128, "BLOCK_SIZE_N": 128, "BLOCK_SIZE_K": 128, "GROUP_SIZE_M": 8, "A_load_order": 0, "num_warps": 8, "num_ctas": 1, "num_stages": 3, "num_buffers_warp_spec": 0, "num_consumer_groups": 0, "reg_dec_producer": 0, "reg_inc_consumer": 0}, "(4096, 3072, 64, 64, 1, 108)": {"BLOCK_SIZE_M": 64, "BLOCK_SIZE_N": 64, "BLOCK_SIZE_K": 64, "GROUP_SIZE_M": 8, "A_load_order": 2, "num_warps": 4, "num_ctas": 1, "num_stages": 2, "num_buffers_warp_spec": 0, "num_consumer_groups": 0, "reg_dec_producer": 0, "reg_inc_consumer": 0}, "(512, 3072, 4096, 4096, 1, 108)": {"BLOCK_SIZE_M": 64, "BLOCK_SIZE_N": 64, "BLOCK_SIZE_K": 128, "GROUP_SIZE_M": 8, "A_load_order": 2, "num_warps": 4, "num_ctas": 1, "num_stages": 2, "num_buffers_warp_spec": 0, "num_consumer_groups": 0, "reg_dec_producer": 0, "reg_inc_consumer": 0}, "(512, 3072, 3072, 3072, 1, 108)": {"BLOCK_SIZE_M": 64, "BLOCK_SIZE_N": 64, "BLOCK_SIZE_K": 128, "GROUP_SIZE_M": 8, "A_load_order": 2, "num_warps": 4, "num_ctas": 1, "num_stages": 2, "num_buffers_warp_spec": 0, "num_consumer_groups": 0, "reg_dec_producer": 0, "reg_inc_consumer": 0}, "(4096, 3072, 3072, 3072, 1, 108)": {"BLOCK_SIZE_M": 128, "BLOCK_SIZE_N": 128, "BLOCK_SIZE_K": 64, "GROUP_SIZE_M": 8, "A_load_order": 2, "num_warps": 8, "num_ctas": 1, "num_stages": 4, "num_buffers_warp_spec": 0, "num_consumer_groups": 0, "reg_dec_producer": 0, "reg_inc_consumer": 0}, "(4096, 12288, 3072, 3072, 1, 108)": {"BLOCK_SIZE_M": 256, "BLOCK_SIZE_N": 128, "BLOCK_SIZE_K": 64, "GROUP_SIZE_M": 8, "A_load_order": 2, "num_warps": 8, "num_ctas": 1, "num_stages": 2, "num_buffers_warp_spec": 0, "num_consumer_groups": 0, "reg_dec_producer": 0, "reg_inc_consumer": 0}, "(4096, 3072, 12288, 12288, 1, 108)": {"BLOCK_SIZE_M": 128, "BLOCK_SIZE_N": 128, "BLOCK_SIZE_K": 64, "GROUP_SIZE_M": 8, "A_load_order": 2, "num_warps": 8, "num_ctas": 1, "num_stages": 4, "num_buffers_warp_spec": 0, "num_consumer_groups": 0, "reg_dec_producer": 0, "reg_inc_consumer": 0}, "(512, 12288, 3072, 3072, 1, 108)": {"BLOCK_SIZE_M": 64, "BLOCK_SIZE_N": 128, "BLOCK_SIZE_K": 128, "GROUP_SIZE_M": 8, "A_load_order": 2, "num_warps": 8, "num_ctas": 1, "num_stages": 3, "num_buffers_warp_spec": 0, "num_consumer_groups": 0, "reg_dec_producer": 0, "reg_inc_consumer": 0}, "(512, 3072, 12288, 12288, 1, 108)": {"BLOCK_SIZE_M": 64, "BLOCK_SIZE_N": 64, "BLOCK_SIZE_K": 128, "GROUP_SIZE_M": 8, "A_load_order": 2, "num_warps": 4, "num_ctas": 1, "num_stages": 2, "num_buffers_warp_spec": 0, "num_consumer_groups": 0, "reg_dec_producer": 0, "reg_inc_consumer": 0}, "(4096, 3072, 15360, 15360, 1, 108)": {"BLOCK_SIZE_M": 256, "BLOCK_SIZE_N": 128, "BLOCK_SIZE_K": 64, "GROUP_SIZE_M": 8, "A_load_order": 2, "num_warps": 8, "num_ctas": 1, "num_stages": 2, "num_buffers_warp_spec": 0, "num_consumer_groups": 0, "reg_dec_producer": 0, "reg_inc_consumer": 0}, "(4096, 64, 3072, 3072, 1, 108)": {"BLOCK_SIZE_M": 64, "BLOCK_SIZE_N": 32, "BLOCK_SIZE_K": 128, "GROUP_SIZE_M": 8, "A_load_order": 2, "num_warps": 8, "num_ctas": 1, "num_stages": 4, "num_buffers_warp_spec": 0, "num_consumer_groups": 0, "reg_dec_producer": 0, "reg_inc_consumer": 0}, "(4096, 3072, 64, 64, 1, 408)": {"BLOCK_SIZE_M": 64, "BLOCK_SIZE_N": 128, "BLOCK_SIZE_K": 64, "GROUP_SIZE_M": 8, "A_load_order": 2, "num_warps": 8, "num_ctas": 1, "num_stages": 2, "num_buffers_warp_spec": 0, "num_consumer_groups": 0, "reg_dec_producer": 0, "reg_inc_consumer": 0}, "(512, 3072, 4096, 4096, 1, 408)": {"BLOCK_SIZE_M": 128, "BLOCK_SIZE_N": 128, "BLOCK_SIZE_K": 128, "GROUP_SIZE_M": 8, "A_load_order": 2, "num_warps": 8, "num_ctas": 1, "num_stages": 3, "num_buffers_warp_spec": 0, "num_consumer_groups": 0, "reg_dec_producer": 0, "reg_inc_consumer": 0}, "(4096, 3072, 3072, 3072, 1, 408)": {"BLOCK_SIZE_M": 128, "BLOCK_SIZE_N": 128, "BLOCK_SIZE_K": 64, "GROUP_SIZE_M": 8, "A_load_order": 2, "num_warps": 4, "num_ctas": 1, "num_stages": 4, "num_buffers_warp_spec": 0, "num_consumer_groups": 0, "reg_dec_producer": 0, "reg_inc_consumer": 0}, "(4096, 12288, 3072, 3072, 1, 408)": {"BLOCK_SIZE_M": 128, "BLOCK_SIZE_N": 128, "BLOCK_SIZE_K": 64, "GROUP_SIZE_M": 8, "A_load_order": 2, "num_warps": 4, "num_ctas": 1, "num_stages": 4, "num_buffers_warp_spec": 0, "num_consumer_groups": 0, "reg_dec_producer": 0, "reg_inc_consumer": 0}, "(4096, 3072, 12288, 12288, 1, 408)": {"BLOCK_SIZE_M": 128, "BLOCK_SIZE_N": 128, "BLOCK_SIZE_K": 64, "GROUP_SIZE_M": 8, "A_load_order": 2, "num_warps": 4, "num_ctas": 1, "num_stages": 4, "num_buffers_warp_spec": 0, "num_consumer_groups": 0, "reg_dec_producer": 0, "reg_inc_consumer": 0}, "(512, 12288, 3072, 3072, 1, 408)": {"BLOCK_SIZE_M": 128, "BLOCK_SIZE_N": 128, "BLOCK_SIZE_K": 64, "GROUP_SIZE_M": 8, "A_load_order": 0, "num_warps": 4, "num_ctas": 1, "num_stages": 4, "num_buffers_warp_spec": 0, "num_consumer_groups": 0, "reg_dec_producer": 0, "reg_inc_consumer": 0}, "(512, 3072, 12288, 12288, 1, 408)": {"BLOCK_SIZE_M": 128, "BLOCK_SIZE_N": 128, "BLOCK_SIZE_K": 128, "GROUP_SIZE_M": 8, "A_load_order": 2, "num_warps": 4, "num_ctas": 1, "num_stages": 3, "num_buffers_warp_spec": 0, "num_consumer_groups": 0, "reg_dec_producer": 0, "reg_inc_consumer": 0}, "(4096, 3072, 15360, 15360, 1, 408)": {"BLOCK_SIZE_M": 128, "BLOCK_SIZE_N": 256, "BLOCK_SIZE_K": 64, "GROUP_SIZE_M": 8, "A_load_order": 2, "num_warps": 8, "num_ctas": 1, "num_stages": 4, "num_buffers_warp_spec": 0, "num_consumer_groups": 0, "reg_dec_producer": 0, "reg_inc_consumer": 0}, "(4096, 64, 3072, 3072, 1, 408)": {"BLOCK_SIZE_M": 64, "BLOCK_SIZE_N": 32, "BLOCK_SIZE_K": 256, "GROUP_SIZE_M": 8, "A_load_order": 2, "num_warps": 8, "num_ctas": 1, "num_stages": 4, "num_buffers_warp_spec": 0, "num_consumer_groups": 0, "reg_dec_producer": 0, "reg_inc_consumer": 0}}}