gemlite/configs/a40.json
{"GEMV": {}, "GEMV_REVSPLITK": {"(1, 2560, 2048, 64, 8)": {"BLOCK_SIZE_M": 1, "BLOCK_SIZE_N": 256, "BLOCK_SIZE_K": 16, "A_load_order": 0, "meta_evict_policy": "", "atomic_mode": "relaxed", "dot_prod_mode": 0, "num_warps": 2, "num_ctas": 1, "num_stages": 1, "num_buffers_warp_spec": 0, "num_consumer_groups": 0, "reg_dec_producer": 0, "reg_inc_consumer": 0}, "(1, 2048, 2048, 64, 8)": {"BLOCK_SIZE_M": 1, "BLOCK_SIZE_N": 256, "BLOCK_SIZE_K": 16, "A_load_order": 0, "meta_evict_policy": "", "atomic_mode": "relaxed", "dot_prod_mode": 0, "num_warps": 2, "num_ctas": 1, "num_stages": 2, "num_buffers_warp_spec": 0, "num_consumer_groups": 0, "reg_dec_producer": 0, "reg_inc_consumer": 0}, "(1, 22016, 2048, 64, 8)": {"BLOCK_SIZE_M": 1, "BLOCK_SIZE_N": 128, "BLOCK_SIZE_K": 16, "A_load_order": 1, "meta_evict_policy": "", "atomic_mode": "relaxed", "dot_prod_mode": 0, "num_warps": 2, "num_ctas": 1, "num_stages": 1, "num_buffers_warp_spec": 0, "num_consumer_groups": 0, "reg_dec_producer": 0, "reg_inc_consumer": 0}, "(1, 2048, 11008, 64, 8)": {"BLOCK_SIZE_M": 1, "BLOCK_SIZE_N": 128, "BLOCK_SIZE_K": 32, "A_load_order": 0, "meta_evict_policy": "", "atomic_mode": "relaxed", "dot_prod_mode": 0, "num_warps": 2, "num_ctas": 1, "num_stages": 1, "num_buffers_warp_spec": 0, "num_consumer_groups": 0, "reg_dec_producer": 0, "reg_inc_consumer": 0}, "(1, 4608, 3584, 64, 8)": {"BLOCK_SIZE_M": 1, "BLOCK_SIZE_N": 128, "BLOCK_SIZE_K": 32, "A_load_order": 0, "meta_evict_policy": "", "atomic_mode": "relaxed", "dot_prod_mode": 0, "num_warps": 2, "num_ctas": 1, "num_stages": 1, "num_buffers_warp_spec": 0, "num_consumer_groups": 0, "reg_dec_producer": 0, "reg_inc_consumer": 0}, "(1, 3584, 3584, 64, 8)": {"BLOCK_SIZE_M": 1, "BLOCK_SIZE_N": 256, "BLOCK_SIZE_K": 8, "A_load_order": 0, "meta_evict_policy": "", "atomic_mode": "relaxed", "dot_prod_mode": 0, "num_warps": 2, "num_ctas": 1, "num_stages": 1, "num_buffers_warp_spec": 0, "num_consumer_groups": 0, "reg_dec_producer": 0, "reg_inc_consumer": 0}, "(1, 37888, 3584, 64, 8)": {"BLOCK_SIZE_M": 1, "BLOCK_SIZE_N": 128, "BLOCK_SIZE_K": 16, "A_load_order": 1, "meta_evict_policy": "", "atomic_mode": "relaxed", "dot_prod_mode": 0, "num_warps": 2, "num_ctas": 1, "num_stages": 1, "num_buffers_warp_spec": 0, "num_consumer_groups": 0, "reg_dec_producer": 0, "reg_inc_consumer": 0}, "(1, 3584, 18944, 64, 8)": {"BLOCK_SIZE_M": 1, "BLOCK_SIZE_N": 128, "BLOCK_SIZE_K": 32, "A_load_order": 0, "meta_evict_policy": "", "atomic_mode": "relaxed", "dot_prod_mode": 0, "num_warps": 2, "num_ctas": 1, "num_stages": 1, "num_buffers_warp_spec": 0, "num_consumer_groups": 0, "reg_dec_producer": 0, "reg_inc_consumer": 0}, "(1, 2048, 1536, 64, 8)": {"BLOCK_SIZE_M": 1, "BLOCK_SIZE_N": 128, "BLOCK_SIZE_K": 16, "A_load_order": 0, "meta_evict_policy": "", "atomic_mode": "relaxed", "dot_prod_mode": 0, "num_warps": 2, "num_ctas": 1, "num_stages": 1, "num_buffers_warp_spec": 0, "num_consumer_groups": 0, "reg_dec_producer": 0, "reg_inc_consumer": 0}, "(1, 1536, 1536, 64, 8)": {"BLOCK_SIZE_M": 1, "BLOCK_SIZE_N": 128, "BLOCK_SIZE_K": 16, "A_load_order": 1, "meta_evict_policy": "", "atomic_mode": "relaxed", "dot_prod_mode": 0, "num_warps": 2, "num_ctas": 1, "num_stages": 2, "num_buffers_warp_spec": 0, "num_consumer_groups": 0, "reg_dec_producer": 0, "reg_inc_consumer": 0}, "(1, 17920, 1536, 64, 8)": {"BLOCK_SIZE_M": 1, "BLOCK_SIZE_N": 128, "BLOCK_SIZE_K": 32, "A_load_order": 0, "meta_evict_policy": "", "atomic_mode": "relaxed", "dot_prod_mode": 0, "num_warps": 2, "num_ctas": 1, "num_stages": 1, "num_buffers_warp_spec": 0, "num_consumer_groups": 0, "reg_dec_producer": 0, "reg_inc_consumer": 0}, "(1, 1536, 8960, 64, 8)": {"BLOCK_SIZE_M": 1, "BLOCK_SIZE_N": 128, "BLOCK_SIZE_K": 16, "A_load_order": 0, "meta_evict_policy": "", "atomic_mode": "relaxed", "dot_prod_mode": 0, "num_warps": 2, "num_ctas": 1, "num_stages": 1, "num_buffers_warp_spec": 0, "num_consumer_groups": 0, "reg_dec_producer": 0, "reg_inc_consumer": 0}, "(1, 6144, 4096, 64, 8)": {"BLOCK_SIZE_M": 1, "BLOCK_SIZE_N": 128, "BLOCK_SIZE_K": 32, "A_load_order": 0, "meta_evict_policy": "", "atomic_mode": "relaxed", "dot_prod_mode": 0, "num_warps": 2, "num_ctas": 1, "num_stages": 1, "num_buffers_warp_spec": 0, "num_consumer_groups": 0, "reg_dec_producer": 0, "reg_inc_consumer": 0}, "(1, 4096, 4096, 64, 8)": {"BLOCK_SIZE_M": 1, "BLOCK_SIZE_N": 128, "BLOCK_SIZE_K": 32, "A_load_order": 0, "meta_evict_policy": "", "atomic_mode": "relaxed", "dot_prod_mode": 0, "num_warps": 2, "num_ctas": 1, "num_stages": 2, "num_buffers_warp_spec": 0, "num_consumer_groups": 0, "reg_dec_producer": 0, "reg_inc_consumer": 0}, "(1, 28672, 4096, 64, 8)": {"BLOCK_SIZE_M": 1, "BLOCK_SIZE_N": 128, "BLOCK_SIZE_K": 32, "A_load_order": 0, "meta_evict_policy": "", "atomic_mode": "relaxed", "dot_prod_mode": 0, "num_warps": 2, "num_ctas": 1, "num_stages": 1, "num_buffers_warp_spec": 0, "num_consumer_groups": 0, "reg_dec_producer": 0, "reg_inc_consumer": 0}, "(1, 4096, 14336, 64, 8)": {"BLOCK_SIZE_M": 1, "BLOCK_SIZE_N": 128, "BLOCK_SIZE_K": 32, "A_load_order": 0, "meta_evict_policy": "", "atomic_mode": "relaxed", "dot_prod_mode": 0, "num_warps": 2, "num_ctas": 1, "num_stages": 1, "num_buffers_warp_spec": 0, "num_consumer_groups": 0, "reg_dec_producer": 0, "reg_inc_consumer": 0}, "(1, 6144, 4096, 128, 8)": {"BLOCK_SIZE_M": 1, "BLOCK_SIZE_N": 128, "BLOCK_SIZE_K": 32, "A_load_order": 0, "meta_evict_policy": "", "atomic_mode": "relaxed", "dot_prod_mode": 0, "num_warps": 2, "num_ctas": 1, "num_stages": 1, "num_buffers_warp_spec": 0, "num_consumer_groups": 0, "reg_dec_producer": 0, "reg_inc_consumer": 0}, "(1, 4096, 4096, 128, 8)": {"BLOCK_SIZE_M": 1, "BLOCK_SIZE_N": 128, "BLOCK_SIZE_K": 32, "A_load_order": 1, "meta_evict_policy": "", "atomic_mode": "relaxed", "dot_prod_mode": 0, "num_warps": 2, "num_ctas": 1, "num_stages": 2, "num_buffers_warp_spec": 0, "num_consumer_groups": 0, "reg_dec_producer": 0, "reg_inc_consumer": 0}, "(1, 28672, 4096, 128, 8)": {"BLOCK_SIZE_M": 1, "BLOCK_SIZE_N": 128, "BLOCK_SIZE_K": 32, "A_load_order": 0, "meta_evict_policy": "", "atomic_mode": "relaxed", "dot_prod_mode": 0, "num_warps": 2, "num_ctas": 1, "num_stages": 1, "num_buffers_warp_spec": 0, "num_consumer_groups": 0, "reg_dec_producer": 0, "reg_inc_consumer": 0}, "(1, 4096, 14336, 128, 8)": {"BLOCK_SIZE_M": 1, "BLOCK_SIZE_N": 128, "BLOCK_SIZE_K": 32, "A_load_order": 0, "meta_evict_policy": "", "atomic_mode": "relaxed", "dot_prod_mode": 0, "num_warps": 2, "num_ctas": 1, "num_stages": 1, "num_buffers_warp_spec": 0, "num_consumer_groups": 0, "reg_dec_producer": 0, "reg_inc_consumer": 0}, "(1, 2560, 2048, 128, 8)": {"BLOCK_SIZE_M": 1, "BLOCK_SIZE_N": 256, "BLOCK_SIZE_K": 16, "A_load_order": 0, "meta_evict_policy": "", "atomic_mode": "relaxed", "dot_prod_mode": 0, "num_warps": 2, "num_ctas": 1, "num_stages": 1, "num_buffers_warp_spec": 0, "num_consumer_groups": 0, "reg_dec_producer": 0, "reg_inc_consumer": 0}, "(1, 2048, 2048, 128, 8)": {"BLOCK_SIZE_M": 1, "BLOCK_SIZE_N": 128, "BLOCK_SIZE_K": 16, "A_load_order": 1, "meta_evict_policy": "", "atomic_mode": "relaxed", "dot_prod_mode": 0, "num_warps": 2, "num_ctas": 1, "num_stages": 2, "num_buffers_warp_spec": 0, "num_consumer_groups": 0, "reg_dec_producer": 0, "reg_inc_consumer": 0}, "(1, 22016, 2048, 128, 8)": {"BLOCK_SIZE_M": 1, "BLOCK_SIZE_N": 128, "BLOCK_SIZE_K": 32, "A_load_order": 0, "meta_evict_policy": "", "atomic_mode": "relaxed", "dot_prod_mode": 0, "num_warps": 2, "num_ctas": 1, "num_stages": 1, "num_buffers_warp_spec": 0, "num_consumer_groups": 0, "reg_dec_producer": 0, "reg_inc_consumer": 0}, "(1, 2048, 11008, 128, 8)": {"BLOCK_SIZE_M": 1, "BLOCK_SIZE_N": 128, "BLOCK_SIZE_K": 32, "A_load_order": 0, "meta_evict_policy": "", "atomic_mode": "relaxed", "dot_prod_mode": 0, "num_warps": 2, "num_ctas": 1, "num_stages": 1, "num_buffers_warp_spec": 0, "num_consumer_groups": 0, "reg_dec_producer": 0, "reg_inc_consumer": 0}, "(1, 2048, 1536, 128, 8)": {"BLOCK_SIZE_M": 1, "BLOCK_SIZE_N": 128, "BLOCK_SIZE_K": 16, "A_load_order": 0, "meta_evict_policy": "", "atomic_mode": "relaxed", "dot_prod_mode": 0, "num_warps": 2, "num_ctas": 1, "num_stages": 1, "num_buffers_warp_spec": 0, "num_consumer_groups": 0, "reg_dec_producer": 0, "reg_inc_consumer": 0}, "(1, 1536, 1536, 128, 8)": {"BLOCK_SIZE_M": 1, "BLOCK_SIZE_N": 128, "BLOCK_SIZE_K": 16, "A_load_order": 1, "meta_evict_policy": "", "atomic_mode": "relaxed", "dot_prod_mode": 0, "num_warps": 2, "num_ctas": 1, "num_stages": 2, "num_buffers_warp_spec": 0, "num_consumer_groups": 0, "reg_dec_producer": 0, "reg_inc_consumer": 0}, "(1, 17920, 1536, 128, 8)": {"BLOCK_SIZE_M": 1, "BLOCK_SIZE_N": 128, "BLOCK_SIZE_K": 32, "A_load_order": 0, "meta_evict_policy": "", "atomic_mode": "relaxed", "dot_prod_mode": 0, "num_warps": 2, "num_ctas": 1, "num_stages": 1, "num_buffers_warp_spec": 0, "num_consumer_groups": 0, "reg_dec_producer": 0, "reg_inc_consumer": 0}, "(1, 1536, 8960, 128, 8)": {"BLOCK_SIZE_M": 1, "BLOCK_SIZE_N": 128, "BLOCK_SIZE_K": 32, "A_load_order": 0, "meta_evict_policy": "", "atomic_mode": "relaxed", "dot_prod_mode": 0, "num_warps": 2, "num_ctas": 1, "num_stages": 1, "num_buffers_warp_spec": 0, "num_consumer_groups": 0, "reg_dec_producer": 0, "reg_inc_consumer": 0}, "(1, 4608, 3584, 128, 8)": {"BLOCK_SIZE_M": 1, "BLOCK_SIZE_N": 256, "BLOCK_SIZE_K": 8, "A_load_order": 0, "meta_evict_policy": "", "atomic_mode": "relaxed", "dot_prod_mode": 0, "num_warps": 2, "num_ctas": 1, "num_stages": 1, "num_buffers_warp_spec": 0, "num_consumer_groups": 0, "reg_dec_producer": 0, "reg_inc_consumer": 0}, "(1, 3584, 3584, 128, 8)": {"BLOCK_SIZE_M": 1, "BLOCK_SIZE_N": 256, "BLOCK_SIZE_K": 8, "A_load_order": 1, "meta_evict_policy": "", "atomic_mode": "relaxed", "dot_prod_mode": 0, "num_warps": 2, "num_ctas": 1, "num_stages": 1, "num_buffers_warp_spec": 0, "num_consumer_groups": 0, "reg_dec_producer": 0, "reg_inc_consumer": 0}, "(1, 37888, 3584, 128, 8)": {"BLOCK_SIZE_M": 1, "BLOCK_SIZE_N": 128, "BLOCK_SIZE_K": 32, "A_load_order": 0, "meta_evict_policy": "", "atomic_mode": "relaxed", "dot_prod_mode": 0, "num_warps": 2, "num_ctas": 1, "num_stages": 1, "num_buffers_warp_spec": 0, "num_consumer_groups": 0, "reg_dec_producer": 0, "reg_inc_consumer": 0}, "(1, 3584, 18944, 128, 8)": {"BLOCK_SIZE_M": 1, "BLOCK_SIZE_N": 128, "BLOCK_SIZE_K": 32, "A_load_order": 0, "meta_evict_policy": "", "atomic_mode": "relaxed", "dot_prod_mode": 0, "num_warps": 2, "num_ctas": 1, "num_stages": 1, "num_buffers_warp_spec": 0, "num_consumer_groups": 0, "reg_dec_producer": 0, "reg_inc_consumer": 0}}, "GEMV_SPLITK": {"(1, 2560, 2048, 2048, 1)": {"BLOCK_SIZE_M": 1, "BLOCK_SIZE_N": 1, "BLOCK_SIZE_K": 1024, "GROUP_SIZE_M": 8, "SPLIT_K": 1, "A_load_order": 0, "meta_evict_policy": "", "atomic_mode": "relaxed", "dot_prod_mode": 0, "num_warps": 4, "num_ctas": 1, "num_stages": 2, "num_buffers_warp_spec": 0, "num_consumer_groups": 0, "reg_dec_producer": 0, "reg_inc_consumer": 0}, "(1, 2048, 2048, 2048, 1)": {"BLOCK_SIZE_M": 1, "BLOCK_SIZE_N": 1, "BLOCK_SIZE_K": 1024, "GROUP_SIZE_M": 8, "SPLIT_K": 1, "A_load_order": 0, "meta_evict_policy": "", "atomic_mode": "relaxed", "dot_prod_mode": 0, "num_warps": 4, "num_ctas": 1, "num_stages": 2, "num_buffers_warp_spec": 0, "num_consumer_groups": 0, "reg_dec_producer": 0, "reg_inc_consumer": 0}, "(1, 22016, 2048, 2048, 1)": {"BLOCK_SIZE_M": 1, "BLOCK_SIZE_N": 1, "BLOCK_SIZE_K": 2048, "GROUP_SIZE_M": 8, "SPLIT_K": 1, "A_load_order": 0, "meta_evict_policy": "", "atomic_mode": "relaxed", "dot_prod_mode": 0, "num_warps": 4, "num_ctas": 1, "num_stages": 1, "num_buffers_warp_spec": 0, "num_consumer_groups": 0, "reg_dec_producer": 0, "reg_inc_consumer": 0}, "(1, 2048, 11008, 11008, 1)": {"BLOCK_SIZE_M": 1, "BLOCK_SIZE_N": 16, "BLOCK_SIZE_K": 256, "GROUP_SIZE_M": 8, "SPLIT_K": 1, "A_load_order": 0, "meta_evict_policy": "", "atomic_mode": "relaxed", "dot_prod_mode": 0, "num_warps": 4, "num_ctas": 1, "num_stages": 2, "num_buffers_warp_spec": 0, "num_consumer_groups": 0, "reg_dec_producer": 0, "reg_inc_consumer": 0}, "(1, 4608, 3584, 3584, 1)": {"BLOCK_SIZE_M": 1, "BLOCK_SIZE_N": 2, "BLOCK_SIZE_K": 512, "GROUP_SIZE_M": 8, "SPLIT_K": 1, "A_load_order": 0, "meta_evict_policy": "", "atomic_mode": "relaxed", "dot_prod_mode": 0, "num_warps": 8, "num_ctas": 1, "num_stages": 1, "num_buffers_warp_spec": 0, "num_consumer_groups": 0, "reg_dec_producer": 0, "reg_inc_consumer": 0}, "(1, 3584, 3584, 3584, 1)": {"BLOCK_SIZE_M": 1, "BLOCK_SIZE_N": 64, "BLOCK_SIZE_K": 256, "GROUP_SIZE_M": 8, "SPLIT_K": 1, "A_load_order": 0, "meta_evict_policy": "", "atomic_mode": "relaxed", "dot_prod_mode": 0, "num_warps": 4, "num_ctas": 1, "num_stages": 1, "num_buffers_warp_spec": 0, "num_consumer_groups": 0, "reg_dec_producer": 0, "reg_inc_consumer": 0}, "(1, 37888, 3584, 3584, 1)": {"BLOCK_SIZE_M": 1, "BLOCK_SIZE_N": 2, "BLOCK_SIZE_K": 512, "GROUP_SIZE_M": 8, "SPLIT_K": 1, "A_load_order": 0, "meta_evict_policy": "", "atomic_mode": "relaxed", "dot_prod_mode": 0, "num_warps": 8, "num_ctas": 1, "num_stages": 1, "num_buffers_warp_spec": 0, "num_consumer_groups": 0, "reg_dec_producer": 0, "reg_inc_consumer": 0}, "(1, 3584, 18944, 18944, 1)": {"BLOCK_SIZE_M": 1, "BLOCK_SIZE_N": 64, "BLOCK_SIZE_K": 256, "GROUP_SIZE_M": 8, "SPLIT_K": 1, "A_load_order": 0, "meta_evict_policy": "", "atomic_mode": "relaxed", "dot_prod_mode": 0, "num_warps": 4, "num_ctas": 1, "num_stages": 2, "num_buffers_warp_spec": 0, "num_consumer_groups": 0, "reg_dec_producer": 0, "reg_inc_consumer": 0}, "(1, 2048, 1536, 1536, 1)": {"BLOCK_SIZE_M": 1, "BLOCK_SIZE_N": 4, "BLOCK_SIZE_K": 256, "GROUP_SIZE_M": 8, "SPLIT_K": 1, "A_load_order": 0, "meta_evict_policy": "", "atomic_mode": "relaxed", "dot_prod_mode": 0, "num_warps": 4, "num_ctas": 1, "num_stages": 1, "num_buffers_warp_spec": 0, "num_consumer_groups": 0, "reg_dec_producer": 0, "reg_inc_consumer": 0}, "(1, 1536, 1536, 1536, 1)": {"BLOCK_SIZE_M": 1, "BLOCK_SIZE_N": 4, "BLOCK_SIZE_K": 256, "GROUP_SIZE_M": 8, "SPLIT_K": 1, "A_load_order": 0, "meta_evict_policy": "", "atomic_mode": "relaxed", "dot_prod_mode": 0, "num_warps": 4, "num_ctas": 1, "num_stages": 1, "num_buffers_warp_spec": 0, "num_consumer_groups": 0, "reg_dec_producer": 0, "reg_inc_consumer": 0}, "(1, 17920, 1536, 1536, 1)": {"BLOCK_SIZE_M": 1, "BLOCK_SIZE_N": 2, "BLOCK_SIZE_K": 512, "GROUP_SIZE_M": 8, "SPLIT_K": 1, "A_load_order": 0, "meta_evict_policy": "", "atomic_mode": "relaxed", "dot_prod_mode": 0, "num_warps": 8, "num_ctas": 1, "num_stages": 1, "num_buffers_warp_spec": 0, "num_consumer_groups": 0, "reg_dec_producer": 0, "reg_inc_consumer": 0}, "(1, 1536, 8960, 8960, 1)": {"BLOCK_SIZE_M": 1, "BLOCK_SIZE_N": 4, "BLOCK_SIZE_K": 256, "GROUP_SIZE_M": 8, "SPLIT_K": 1, "A_load_order": 0, "meta_evict_policy": "", "atomic_mode": "relaxed", "dot_prod_mode": 0, "num_warps": 8, "num_ctas": 1, "num_stages": 2, "num_buffers_warp_spec": 0, "num_consumer_groups": 0, "reg_dec_producer": 0, "reg_inc_consumer": 0}, "(1, 6144, 4096, 4096, 1)": {"BLOCK_SIZE_M": 1, "BLOCK_SIZE_N": 1, "BLOCK_SIZE_K": 1024, "GROUP_SIZE_M": 8, "SPLIT_K": 1, "A_load_order": 0, "meta_evict_policy": "", "atomic_mode": "relaxed", "dot_prod_mode": 0, "num_warps": 8, "num_ctas": 1, "num_stages": 1, "num_buffers_warp_spec": 0, "num_consumer_groups": 0, "reg_dec_producer": 0, "reg_inc_consumer": 0}, "(1, 4096, 4096, 4096, 1)": {"BLOCK_SIZE_M": 1, "BLOCK_SIZE_N": 1, "BLOCK_SIZE_K": 1024, "GROUP_SIZE_M": 8, "SPLIT_K": 1, "A_load_order": 0, "meta_evict_policy": "", "atomic_mode": "relaxed", "dot_prod_mode": 0, "num_warps": 4, "num_ctas": 1, "num_stages": 1, "num_buffers_warp_spec": 0, "num_consumer_groups": 0, "reg_dec_producer": 0, "reg_inc_consumer": 0}, "(1, 28672, 4096, 4096, 1)": {"BLOCK_SIZE_M": 1, "BLOCK_SIZE_N": 1, "BLOCK_SIZE_K": 2048, "GROUP_SIZE_M": 8, "SPLIT_K": 1, "A_load_order": 0, "meta_evict_policy": "", "atomic_mode": "relaxed", "dot_prod_mode": 0, "num_warps": 8, "num_ctas": 1, "num_stages": 1, "num_buffers_warp_spec": 0, "num_consumer_groups": 0, "reg_dec_producer": 0, "reg_inc_consumer": 0}, "(1, 4096, 14336, 14336, 1)": {"BLOCK_SIZE_M": 1, "BLOCK_SIZE_N": 1, "BLOCK_SIZE_K": 1024, "GROUP_SIZE_M": 8, "SPLIT_K": 1, "A_load_order": 0, "meta_evict_policy": "", "atomic_mode": "relaxed", "dot_prod_mode": 0, "num_warps": 4, "num_ctas": 1, "num_stages": 2, "num_buffers_warp_spec": 0, "num_consumer_groups": 0, "reg_dec_producer": 0, "reg_inc_consumer": 0}}, "GEMM_SPLITK": {"(64, 2560, 2048, 64, 8)": {"BLOCK_SIZE_M": 32, "BLOCK_SIZE_N": 64, "BLOCK_SIZE_K": 64, "GROUP_SIZE_M": 8, "SPLIT_K": 4, "A_load_order": 2, "meta_evict_policy": "", "atomic_mode": "relaxed", "num_warps": 4, "num_ctas": 1, "num_stages": 1, "num_buffers_warp_spec": 0, "num_consumer_groups": 0, "reg_dec_producer": 0, "reg_inc_consumer": 0}, "(64, 2048, 2048, 64, 8)": {"BLOCK_SIZE_M": 32, "BLOCK_SIZE_N": 64, "BLOCK_SIZE_K": 64, "GROUP_SIZE_M": 8, "SPLIT_K": 4, "A_load_order": 2, "meta_evict_policy": "", "atomic_mode": "relaxed", "num_warps": 4, "num_ctas": 1, "num_stages": 1, "num_buffers_warp_spec": 0, "num_consumer_groups": 0, "reg_dec_producer": 0, "reg_inc_consumer": 0}, "(64, 22016, 2048, 64, 8)": {"BLOCK_SIZE_M": 32, "BLOCK_SIZE_N": 64, "BLOCK_SIZE_K": 64, "GROUP_SIZE_M": 8, "SPLIT_K": 1, "A_load_order": 2, "meta_evict_policy": "", "atomic_mode": "relaxed", "num_warps": 4, "num_ctas": 1, "num_stages": 1, "num_buffers_warp_spec": 0, "num_consumer_groups": 0, "reg_dec_producer": 0, "reg_inc_consumer": 0}, "(64, 2048, 11008, 64, 8)": {"BLOCK_SIZE_M": 32, "BLOCK_SIZE_N": 64, "BLOCK_SIZE_K": 32, "GROUP_SIZE_M": 8, "SPLIT_K": 8, "A_load_order": 2, "meta_evict_policy": "", "atomic_mode": "relaxed", "num_warps": 4, "num_ctas": 1, "num_stages": 1, "num_buffers_warp_spec": 0, "num_consumer_groups": 0, "reg_dec_producer": 0, "reg_inc_consumer": 0}, "(32, 2560, 2048, 64, 8)": {"BLOCK_SIZE_M": 32, "BLOCK_SIZE_N": 64, "BLOCK_SIZE_K": 64, "GROUP_SIZE_M": 8, "SPLIT_K": 8, "A_load_order": 2, "meta_evict_policy": "", "atomic_mode": "relaxed", "num_warps": 4, "num_ctas": 1, "num_stages": 1, "num_buffers_warp_spec": 0, "num_consumer_groups": 0, "reg_dec_producer": 0, "reg_inc_consumer": 0}, "(32, 2048, 2048, 64, 8)": {"BLOCK_SIZE_M": 32, "BLOCK_SIZE_N": 64, "BLOCK_SIZE_K": 64, "GROUP_SIZE_M": 8, "SPLIT_K": 8, "A_load_order": 2, "meta_evict_policy": "", "atomic_mode": "relaxed", "num_warps": 4, "num_ctas": 1, "num_stages": 1, "num_buffers_warp_spec": 0, "num_consumer_groups": 0, "reg_dec_producer": 0, "reg_inc_consumer": 0}, "(32, 22016, 2048, 64, 8)": {"BLOCK_SIZE_M": 32, "BLOCK_SIZE_N": 64, "BLOCK_SIZE_K": 64, "GROUP_SIZE_M": 8, "SPLIT_K": 1, "A_load_order": 2, "meta_evict_policy": "", "atomic_mode": "relaxed", "num_warps": 4, "num_ctas": 1, "num_stages": 1, "num_buffers_warp_spec": 0, "num_consumer_groups": 0, "reg_dec_producer": 0, "reg_inc_consumer": 0}, "(32, 2048, 11008, 64, 8)": {"BLOCK_SIZE_M": 32, "BLOCK_SIZE_N": 64, "BLOCK_SIZE_K": 32, "GROUP_SIZE_M": 8, "SPLIT_K": 8, "A_load_order": 2, "meta_evict_policy": "", "atomic_mode": "relaxed", "num_warps": 8, "num_ctas": 1, "num_stages": 1, "num_buffers_warp_spec": 0, "num_consumer_groups": 0, "reg_dec_producer": 0, "reg_inc_consumer": 0}, "(16, 2560, 2048, 64, 8)": {"BLOCK_SIZE_M": 16, "BLOCK_SIZE_N": 64, "BLOCK_SIZE_K": 32, "GROUP_SIZE_M": 8, "SPLIT_K": 8, "A_load_order": 2, "meta_evict_policy": "", "atomic_mode": "relaxed", "num_warps": 8, "num_ctas": 1, "num_stages": 1, "num_buffers_warp_spec": 0, "num_consumer_groups": 0, "reg_dec_producer": 0, "reg_inc_consumer": 0}, "(16, 2048, 2048, 64, 8)": {"BLOCK_SIZE_M": 16, "BLOCK_SIZE_N": 64, "BLOCK_SIZE_K": 64, "GROUP_SIZE_M": 8, "SPLIT_K": 16, "A_load_order": 2, "meta_evict_policy": "", "atomic_mode": "relaxed", "num_warps": 4, "num_ctas": 1, "num_stages": 1, "num_buffers_warp_spec": 0, "num_consumer_groups": 0, "reg_dec_producer": 0, "reg_inc_consumer": 0}, "(16, 22016, 2048, 64, 8)": {"BLOCK_SIZE_M": 16, "BLOCK_SIZE_N": 64, "BLOCK_SIZE_K": 64, "GROUP_SIZE_M": 8, "SPLIT_K": 8, "A_load_order": 2, "meta_evict_policy": "", "atomic_mode": "relaxed", "num_warps": 4, "num_ctas": 1, "num_stages": 1, "num_buffers_warp_spec": 0, "num_consumer_groups": 0, "reg_dec_producer": 0, "reg_inc_consumer": 0}, "(16, 2048, 11008, 64, 8)": {"BLOCK_SIZE_M": 16, "BLOCK_SIZE_N": 32, "BLOCK_SIZE_K": 32, "GROUP_SIZE_M": 8, "SPLIT_K": 8, "A_load_order": 2, "meta_evict_policy": "", "atomic_mode": "relaxed", "num_warps": 4, "num_ctas": 1, "num_stages": 1, "num_buffers_warp_spec": 0, "num_consumer_groups": 0, "reg_dec_producer": 0, "reg_inc_consumer": 0}, "(8, 2560, 2048, 64, 8)": {"BLOCK_SIZE_M": 16, "BLOCK_SIZE_N": 64, "BLOCK_SIZE_K": 64, "GROUP_SIZE_M": 8, "SPLIT_K": 16, "A_load_order": 2, "meta_evict_policy": "", "atomic_mode": "relaxed", "num_warps": 4, "num_ctas": 1, "num_stages": 1, "num_buffers_warp_spec": 0, "num_consumer_groups": 0, "reg_dec_producer": 0, "reg_inc_consumer": 0}, "(8, 2048, 2048, 64, 8)": {"BLOCK_SIZE_M": 16, "BLOCK_SIZE_N": 64, "BLOCK_SIZE_K": 64, "GROUP_SIZE_M": 8, "SPLIT_K": 16, "A_load_order": 2, "meta_evict_policy": "", "atomic_mode": "relaxed", "num_warps": 4, "num_ctas": 1, "num_stages": 1, "num_buffers_warp_spec": 0, "num_consumer_groups": 0, "reg_dec_producer": 0, "reg_inc_consumer": 0}, "(8, 22016, 2048, 64, 8)": {"BLOCK_SIZE_M": 16, "BLOCK_SIZE_N": 64, "BLOCK_SIZE_K": 64, "GROUP_SIZE_M": 8, "SPLIT_K": 16, "A_load_order": 2, "meta_evict_policy": "", "atomic_mode": "relaxed", "num_warps": 4, "num_ctas": 1, "num_stages": 1, "num_buffers_warp_spec": 0, "num_consumer_groups": 0, "reg_dec_producer": 0, "reg_inc_consumer": 0}, "(8, 2048, 11008, 64, 8)": {"BLOCK_SIZE_M": 16, "BLOCK_SIZE_N": 32, "BLOCK_SIZE_K": 32, "GROUP_SIZE_M": 8, "SPLIT_K": 8, "A_load_order": 2, "meta_evict_policy": "", "atomic_mode": "relaxed", "num_warps": 4, "num_ctas": 1, "num_stages": 1, "num_buffers_warp_spec": 0, "num_consumer_groups": 0, "reg_dec_producer": 0, "reg_inc_consumer": 0}, "(4, 2560, 2048, 64, 8)": {"BLOCK_SIZE_M": 16, "BLOCK_SIZE_N": 64, "BLOCK_SIZE_K": 32, "GROUP_SIZE_M": 8, "SPLIT_K": 16, "A_load_order": 2, "meta_evict_policy": "", "atomic_mode": "relaxed", "num_warps": 4, "num_ctas": 1, "num_stages": 1, "num_buffers_warp_spec": 0, "num_consumer_groups": 0, "reg_dec_producer": 0, "reg_inc_consumer": 0}, "(4, 2048, 2048, 64, 8)": {"BLOCK_SIZE_M": 16, "BLOCK_SIZE_N": 64, "BLOCK_SIZE_K": 64, "GROUP_SIZE_M": 8, "SPLIT_K": 16, "A_load_order": 2, "meta_evict_policy": "", "atomic_mode": "relaxed", "num_warps": 4, "num_ctas": 1, "num_stages": 1, "num_buffers_warp_spec": 0, "num_consumer_groups": 0, "reg_dec_producer": 0, "reg_inc_consumer": 0}, "(4, 22016, 2048, 64, 8)": {"BLOCK_SIZE_M": 16, "BLOCK_SIZE_N": 64, "BLOCK_SIZE_K": 64, "GROUP_SIZE_M": 8, "SPLIT_K": 16, "A_load_order": 2, "meta_evict_policy": "", "atomic_mode": "relaxed", "num_warps": 4, "num_ctas": 1, "num_stages": 1, "num_buffers_warp_spec": 0, "num_consumer_groups": 0, "reg_dec_producer": 0, "reg_inc_consumer": 0}, "(4, 2048, 11008, 64, 8)": {"BLOCK_SIZE_M": 16, "BLOCK_SIZE_N": 32, "BLOCK_SIZE_K": 32, "GROUP_SIZE_M": 8, "SPLIT_K": 8, "A_load_order": 2, "meta_evict_policy": "", "atomic_mode": "relaxed", "num_warps": 4, "num_ctas": 1, "num_stages": 1, "num_buffers_warp_spec": 0, "num_consumer_groups": 0, "reg_dec_producer": 0, "reg_inc_consumer": 0}, "(2, 2560, 2048, 64, 8)": {"BLOCK_SIZE_M": 16, "BLOCK_SIZE_N": 64, "BLOCK_SIZE_K": 32, "GROUP_SIZE_M": 8, "SPLIT_K": 16, "A_load_order": 2, "meta_evict_policy": "", "atomic_mode": "relaxed", "num_warps": 4, "num_ctas": 1, "num_stages": 1, "num_buffers_warp_spec": 0, "num_consumer_groups": 0, "reg_dec_producer": 0, "reg_inc_consumer": 0}, "(2, 2048, 2048, 64, 8)": {"BLOCK_SIZE_M": 16, "BLOCK_SIZE_N": 64, "BLOCK_SIZE_K": 64, "GROUP_SIZE_M": 8, "SPLIT_K": 16, "A_load_order": 2, "meta_evict_policy": "", "atomic_mode": "relaxed", "num_warps": 4, "num_ctas": 1, "num_stages": 1, "num_buffers_warp_spec": 0, "num_consumer_groups": 0, "reg_dec_producer": 0, "reg_inc_consumer": 0}, "(2, 22016, 2048, 64, 8)": {"BLOCK_SIZE_M": 16, "BLOCK_SIZE_N": 64, "BLOCK_SIZE_K": 64, "GROUP_SIZE_M": 8, "SPLIT_K": 16, "A_load_order": 2, "meta_evict_policy": "", "atomic_mode": "relaxed", "num_warps": 4, "num_ctas": 1, "num_stages": 1, "num_buffers_warp_spec": 0, "num_consumer_groups": 0, "reg_dec_producer": 0, "reg_inc_consumer": 0}, "(2, 2048, 11008, 64, 8)": {"BLOCK_SIZE_M": 16, "BLOCK_SIZE_N": 32, "BLOCK_SIZE_K": 32, "GROUP_SIZE_M": 8, "SPLIT_K": 8, "A_load_order": 2, "meta_evict_policy": "", "atomic_mode": "relaxed", "num_warps": 4, "num_ctas": 1, "num_stages": 1, "num_buffers_warp_spec": 0, "num_consumer_groups": 0, "reg_dec_producer": 0, "reg_inc_consumer": 0}, "(64, 2560, 2048, 2048, 1)": {"BLOCK_SIZE_M": 32, "BLOCK_SIZE_N": 32, "BLOCK_SIZE_K": 256, "GROUP_SIZE_M": 8, "SPLIT_K": 1, "A_load_order": 0, "meta_evict_policy": "", "atomic_mode": "relaxed", "num_warps": 4, "num_ctas": 1, "num_stages": 2, "num_buffers_warp_spec": 0, "num_consumer_groups": 0, "reg_dec_producer": 0, "reg_inc_consumer": 0}, "(64, 2048, 2048, 2048, 1)": {"BLOCK_SIZE_M": 32, "BLOCK_SIZE_N": 64, "BLOCK_SIZE_K": 128, "GROUP_SIZE_M": 8, "SPLIT_K": 1, "A_load_order": 2, "meta_evict_policy": "", "atomic_mode": "relaxed", "num_warps": 4, "num_ctas": 1, "num_stages": 4, "num_buffers_warp_spec": 0, "num_consumer_groups": 0, "reg_dec_producer": 0, "reg_inc_consumer": 0}, "(64, 22016, 2048, 2048, 1)": {"BLOCK_SIZE_M": 32, "BLOCK_SIZE_N": 64, "BLOCK_SIZE_K": 256, "GROUP_SIZE_M": 8, "SPLIT_K": 1, "A_load_order": 0, "meta_evict_policy": "", "atomic_mode": "relaxed", "num_warps": 4, "num_ctas": 1, "num_stages": 4, "num_buffers_warp_spec": 0, "num_consumer_groups": 0, "reg_dec_producer": 0, "reg_inc_consumer": 0}, "(64, 2048, 11008, 11008, 1)": {"BLOCK_SIZE_M": 32, "BLOCK_SIZE_N": 64, "BLOCK_SIZE_K": 256, "GROUP_SIZE_M": 8, "SPLIT_K": 1, "A_load_order": 2, "meta_evict_policy": "", "atomic_mode": "relaxed", "num_warps": 4, "num_ctas": 1, "num_stages": 4, "num_buffers_warp_spec": 0, "num_consumer_groups": 0, "reg_dec_producer": 0, "reg_inc_consumer": 0}, "(32, 2560, 2048, 2048, 1)": {"BLOCK_SIZE_M": 16, "BLOCK_SIZE_N": 64, "BLOCK_SIZE_K": 256, "GROUP_SIZE_M": 8, "SPLIT_K": 1, "A_load_order": 2, "meta_evict_policy": "", "atomic_mode": "relaxed", "num_warps": 4, "num_ctas": 1, "num_stages": 4, "num_buffers_warp_spec": 0, "num_consumer_groups": 0, "reg_dec_producer": 0, "reg_inc_consumer": 0}, "(32, 2048, 2048, 2048, 1)": {"BLOCK_SIZE_M": 16, "BLOCK_SIZE_N": 32, "BLOCK_SIZE_K": 256, "GROUP_SIZE_M": 8, "SPLIT_K": 1, "A_load_order": 0, "meta_evict_policy": "", "atomic_mode": "relaxed", "num_warps": 4, "num_ctas": 1, "num_stages": 4, "num_buffers_warp_spec": 0, "num_consumer_groups": 0, "reg_dec_producer": 0, "reg_inc_consumer": 0}, "(32, 22016, 2048, 2048, 1)": {"BLOCK_SIZE_M": 32, "BLOCK_SIZE_N": 32, "BLOCK_SIZE_K": 256, "GROUP_SIZE_M": 8, "SPLIT_K": 1, "A_load_order": 2, "meta_evict_policy": "", "atomic_mode": "relaxed", "num_warps": 4, "num_ctas": 1, "num_stages": 2, "num_buffers_warp_spec": 0, "num_consumer_groups": 0, "reg_dec_producer": 0, "reg_inc_consumer": 0}, "(32, 2048, 11008, 11008, 1)": {"BLOCK_SIZE_M": 16, "BLOCK_SIZE_N": 32, "BLOCK_SIZE_K": 256, "GROUP_SIZE_M": 8, "SPLIT_K": 1, "A_load_order": 0, "meta_evict_policy": "", "atomic_mode": "relaxed", "num_warps": 4, "num_ctas": 1, "num_stages": 4, "num_buffers_warp_spec": 0, "num_consumer_groups": 0, "reg_dec_producer": 0, "reg_inc_consumer": 0}, "(16, 2560, 2048, 2048, 1)": {"BLOCK_SIZE_M": 16, "BLOCK_SIZE_N": 32, "BLOCK_SIZE_K": 256, "GROUP_SIZE_M": 8, "SPLIT_K": 1, "A_load_order": 0, "meta_evict_policy": "", "atomic_mode": "relaxed", "num_warps": 4, "num_ctas": 1, "num_stages": 2, "num_buffers_warp_spec": 0, "num_consumer_groups": 0, "reg_dec_producer": 0, "reg_inc_consumer": 0}, "(16, 2048, 2048, 2048, 1)": {"BLOCK_SIZE_M": 16, "BLOCK_SIZE_N": 32, "BLOCK_SIZE_K": 256, "GROUP_SIZE_M": 8, "SPLIT_K": 1, "A_load_order": 0, "meta_evict_policy": "", "atomic_mode": "relaxed", "num_warps": 4, "num_ctas": 1, "num_stages": 2, "num_buffers_warp_spec": 0, "num_consumer_groups": 0, "reg_dec_producer": 0, "reg_inc_consumer": 0}, "(16, 22016, 2048, 2048, 1)": {"BLOCK_SIZE_M": 16, "BLOCK_SIZE_N": 32, "BLOCK_SIZE_K": 256, "GROUP_SIZE_M": 8, "SPLIT_K": 1, "A_load_order": 0, "meta_evict_policy": "", "atomic_mode": "relaxed", "num_warps": 4, "num_ctas": 1, "num_stages": 2, "num_buffers_warp_spec": 0, "num_consumer_groups": 0, "reg_dec_producer": 0, "reg_inc_consumer": 0}, "(16, 2048, 11008, 11008, 1)": {"BLOCK_SIZE_M": 16, "BLOCK_SIZE_N": 32, "BLOCK_SIZE_K": 256, "GROUP_SIZE_M": 8, "SPLIT_K": 1, "A_load_order": 0, "meta_evict_policy": "", "atomic_mode": "relaxed", "num_warps": 4, "num_ctas": 1, "num_stages": 4, "num_buffers_warp_spec": 0, "num_consumer_groups": 0, "reg_dec_producer": 0, "reg_inc_consumer": 0}, "(8, 2560, 2048, 2048, 1)": {"BLOCK_SIZE_M": 16, "BLOCK_SIZE_N": 32, "BLOCK_SIZE_K": 256, "GROUP_SIZE_M": 8, "SPLIT_K": 1, "A_load_order": 2, "meta_evict_policy": "", "atomic_mode": "relaxed", "num_warps": 4, "num_ctas": 1, "num_stages": 2, "num_buffers_warp_spec": 0, "num_consumer_groups": 0, "reg_dec_producer": 0, "reg_inc_consumer": 0}, "(8, 2048, 2048, 2048, 1)": {"BLOCK_SIZE_M": 16, "BLOCK_SIZE_N": 32, "BLOCK_SIZE_K": 128, "GROUP_SIZE_M": 8, "SPLIT_K": 1, "A_load_order": 2, "meta_evict_policy": "", "atomic_mode": "relaxed", "num_warps": 4, "num_ctas": 1, "num_stages": 4, "num_buffers_warp_spec": 0, "num_consumer_groups": 0, "reg_dec_producer": 0, "reg_inc_consumer": 0}, "(8, 22016, 2048, 2048, 1)": {"BLOCK_SIZE_M": 16, "BLOCK_SIZE_N": 32, "BLOCK_SIZE_K": 256, "GROUP_SIZE_M": 8, "SPLIT_K": 1, "A_load_order": 2, "meta_evict_policy": "", "atomic_mode": "relaxed", "num_warps": 4, "num_ctas": 1, "num_stages": 2, "num_buffers_warp_spec": 0, "num_consumer_groups": 0, "reg_dec_producer": 0, "reg_inc_consumer": 0}, "(8, 2048, 11008, 11008, 1)": {"BLOCK_SIZE_M": 16, "BLOCK_SIZE_N": 32, "BLOCK_SIZE_K": 256, "GROUP_SIZE_M": 8, "SPLIT_K": 1, "A_load_order": 0, "meta_evict_policy": "", "atomic_mode": "relaxed", "num_warps": 4, "num_ctas": 1, "num_stages": 4, "num_buffers_warp_spec": 0, "num_consumer_groups": 0, "reg_dec_producer": 0, "reg_inc_consumer": 0}, "(4, 2560, 2048, 2048, 1)": {"BLOCK_SIZE_M": 16, "BLOCK_SIZE_N": 32, "BLOCK_SIZE_K": 256, "GROUP_SIZE_M": 8, "SPLIT_K": 1, "A_load_order": 0, "meta_evict_policy": "", "atomic_mode": "relaxed", "num_warps": 4, "num_ctas": 1, "num_stages": 2, "num_buffers_warp_spec": 0, "num_consumer_groups": 0, "reg_dec_producer": 0, "reg_inc_consumer": 0}, "(4, 2048, 2048, 2048, 1)": {"BLOCK_SIZE_M": 16, "BLOCK_SIZE_N": 32, "BLOCK_SIZE_K": 128, "GROUP_SIZE_M": 8, "SPLIT_K": 1, "A_load_order": 0, "meta_evict_policy": "", "atomic_mode": "relaxed", "num_warps": 4, "num_ctas": 1, "num_stages": 4, "num_buffers_warp_spec": 0, "num_consumer_groups": 0, "reg_dec_producer": 0, "reg_inc_consumer": 0}, "(4, 22016, 2048, 2048, 1)": {"BLOCK_SIZE_M": 16, "BLOCK_SIZE_N": 32, "BLOCK_SIZE_K": 256, "GROUP_SIZE_M": 8, "SPLIT_K": 1, "A_load_order": 2, "meta_evict_policy": "", "atomic_mode": "relaxed", "num_warps": 4, "num_ctas": 1, "num_stages": 2, "num_buffers_warp_spec": 0, "num_consumer_groups": 0, "reg_dec_producer": 0, "reg_inc_consumer": 0}, "(4, 2048, 11008, 11008, 1)": {"BLOCK_SIZE_M": 16, "BLOCK_SIZE_N": 32, "BLOCK_SIZE_K": 256, "GROUP_SIZE_M": 8, "SPLIT_K": 1, "A_load_order": 0, "meta_evict_policy": "", "atomic_mode": "relaxed", "num_warps": 4, "num_ctas": 1, "num_stages": 4, "num_buffers_warp_spec": 0, "num_consumer_groups": 0, "reg_dec_producer": 0, "reg_inc_consumer": 0}, "(2, 2560, 2048, 2048, 1)": {"BLOCK_SIZE_M": 16, "BLOCK_SIZE_N": 32, "BLOCK_SIZE_K": 256, "GROUP_SIZE_M": 8, "SPLIT_K": 1, "A_load_order": 2, "meta_evict_policy": "", "atomic_mode": "relaxed", "num_warps": 4, "num_ctas": 1, "num_stages": 2, "num_buffers_warp_spec": 0, "num_consumer_groups": 0, "reg_dec_producer": 0, "reg_inc_consumer": 0}, "(2, 2048, 2048, 2048, 1)": {"BLOCK_SIZE_M": 16, "BLOCK_SIZE_N": 32, "BLOCK_SIZE_K": 128, "GROUP_SIZE_M": 8, "SPLIT_K": 1, "A_load_order": 2, "meta_evict_policy": "", "atomic_mode": "relaxed", "num_warps": 4, "num_ctas": 1, "num_stages": 4, "num_buffers_warp_spec": 0, "num_consumer_groups": 0, "reg_dec_producer": 0, "reg_inc_consumer": 0}, "(2, 22016, 2048, 2048, 1)": {"BLOCK_SIZE_M": 16, "BLOCK_SIZE_N": 32, "BLOCK_SIZE_K": 256, "GROUP_SIZE_M": 8, "SPLIT_K": 1, "A_load_order": 0, "meta_evict_policy": "", "atomic_mode": "relaxed", "num_warps": 4, "num_ctas": 1, "num_stages": 2, "num_buffers_warp_spec": 0, "num_consumer_groups": 0, "reg_dec_producer": 0, "reg_inc_consumer": 0}, "(2, 2048, 11008, 11008, 1)": {"BLOCK_SIZE_M": 16, "BLOCK_SIZE_N": 32, "BLOCK_SIZE_K": 256, "GROUP_SIZE_M": 8, "SPLIT_K": 1, "A_load_order": 2, "meta_evict_policy": "", "atomic_mode": "relaxed", "num_warps": 4, "num_ctas": 1, "num_stages": 4, "num_buffers_warp_spec": 0, "num_consumer_groups": 0, "reg_dec_producer": 0, "reg_inc_consumer": 0}, "(64, 4608, 3584, 3584, 1)": {"BLOCK_SIZE_M": 32, "BLOCK_SIZE_N": 64, "BLOCK_SIZE_K": 256, "GROUP_SIZE_M": 8, "SPLIT_K": 1, "A_load_order": 0, "meta_evict_policy": "", "atomic_mode": "relaxed", "num_warps": 4, "num_ctas": 1, "num_stages": 2, "num_buffers_warp_spec": 0, "num_consumer_groups": 0, "reg_dec_producer": 0, "reg_inc_consumer": 0}, "(64, 3584, 3584, 3584, 1)": {"BLOCK_SIZE_M": 32, "BLOCK_SIZE_N": 64, "BLOCK_SIZE_K": 256, "GROUP_SIZE_M": 8, "SPLIT_K": 1, "A_load_order": 0, "meta_evict_policy": "", "atomic_mode": "relaxed", "num_warps": 4, "num_ctas": 1, "num_stages": 2, "num_buffers_warp_spec": 0, "num_consumer_groups": 0, "reg_dec_producer": 0, "reg_inc_consumer": 0}, "(64, 37888, 3584, 3584, 1)": {"BLOCK_SIZE_M": 32, "BLOCK_SIZE_N": 64, "BLOCK_SIZE_K": 256, "GROUP_SIZE_M": 8, "SPLIT_K": 1, "A_load_order": 0, "meta_evict_policy": "", "atomic_mode": "relaxed", "num_warps": 4, "num_ctas": 1, "num_stages": 2, "num_buffers_warp_spec": 0, "num_consumer_groups": 0, "reg_dec_producer": 0, "reg_inc_consumer": 0}, "(64, 3584, 18944, 18944, 1)": {"BLOCK_SIZE_M": 32, "BLOCK_SIZE_N": 64, "BLOCK_SIZE_K": 256, "GROUP_SIZE_M": 8, "SPLIT_K": 1, "A_load_order": 0, "meta_evict_policy": "", "atomic_mode": "relaxed", "num_warps": 4, "num_ctas": 1, "num_stages": 2, "num_buffers_warp_spec": 0, "num_consumer_groups": 0, "reg_dec_producer": 0, "reg_inc_consumer": 0}, "(32, 4608, 3584, 3584, 1)": {"BLOCK_SIZE_M": 16, "BLOCK_SIZE_N": 64, "BLOCK_SIZE_K": 256, "GROUP_SIZE_M": 8, "SPLIT_K": 1, "A_load_order": 2, "meta_evict_policy": "", "atomic_mode": "relaxed", "num_warps": 4, "num_ctas": 1, "num_stages": 2, "num_buffers_warp_spec": 0, "num_consumer_groups": 0, "reg_dec_producer": 0, "reg_inc_consumer": 0}, "(32, 3584, 3584, 3584, 1)": {"BLOCK_SIZE_M": 32, "BLOCK_SIZE_N": 32, "BLOCK_SIZE_K": 256, "GROUP_SIZE_M": 8, "SPLIT_K": 1, "A_load_order": 0, "meta_evict_policy": "", "atomic_mode": "relaxed", "num_warps": 4, "num_ctas": 1, "num_stages": 2, "num_buffers_warp_spec": 0, "num_consumer_groups": 0, "reg_dec_producer": 0, "reg_inc_consumer": 0}, "(32, 37888, 3584, 3584, 1)": {"BLOCK_SIZE_M": 32, "BLOCK_SIZE_N": 32, "BLOCK_SIZE_K": 256, "GROUP_SIZE_M": 8, "SPLIT_K": 1, "A_load_order": 2, "meta_evict_policy": "", "atomic_mode": "relaxed", "num_warps": 4, "num_ctas": 1, "num_stages": 2, "num_buffers_warp_spec": 0, "num_consumer_groups": 0, "reg_dec_producer": 0, "reg_inc_consumer": 0}, "(32, 3584, 18944, 18944, 1)": {"BLOCK_SIZE_M": 32, "BLOCK_SIZE_N": 32, "BLOCK_SIZE_K": 256, "GROUP_SIZE_M": 8, "SPLIT_K": 1, "A_load_order": 0, "meta_evict_policy": "", "atomic_mode": "relaxed", "num_warps": 4, "num_ctas": 1, "num_stages": 4, "num_buffers_warp_spec": 0, "num_consumer_groups": 0, "reg_dec_producer": 0, "reg_inc_consumer": 0}, "(16, 4608, 3584, 3584, 1)": {"BLOCK_SIZE_M": 16, "BLOCK_SIZE_N": 32, "BLOCK_SIZE_K": 256, "GROUP_SIZE_M": 8, "SPLIT_K": 1, "A_load_order": 0, "meta_evict_policy": "", "atomic_mode": "relaxed", "num_warps": 4, "num_ctas": 1, "num_stages": 2, "num_buffers_warp_spec": 0, "num_consumer_groups": 0, "reg_dec_producer": 0, "reg_inc_consumer": 0}, "(16, 3584, 3584, 3584, 1)": {"BLOCK_SIZE_M": 16, "BLOCK_SIZE_N": 32, "BLOCK_SIZE_K": 256, "GROUP_SIZE_M": 8, "SPLIT_K": 1, "A_load_order": 0, "meta_evict_policy": "", "atomic_mode": "relaxed", "num_warps": 4, "num_ctas": 1, "num_stages": 2, "num_buffers_warp_spec": 0, "num_consumer_groups": 0, "reg_dec_producer": 0, "reg_inc_consumer": 0}, "(16, 37888, 3584, 3584, 1)": {"BLOCK_SIZE_M": 16, "BLOCK_SIZE_N": 64, "BLOCK_SIZE_K": 256, "GROUP_SIZE_M": 8, "SPLIT_K": 1, "A_load_order": 0, "meta_evict_policy": "", "atomic_mode": "relaxed", "num_warps": 4, "num_ctas": 1, "num_stages": 2, "num_buffers_warp_spec": 0, "num_consumer_groups": 0, "reg_dec_producer": 0, "reg_inc_consumer": 0}, "(16, 3584, 18944, 18944, 1)": {"BLOCK_SIZE_M": 16, "BLOCK_SIZE_N": 64, "BLOCK_SIZE_K": 256, "GROUP_SIZE_M": 8, "SPLIT_K": 1, "A_load_order": 2, "meta_evict_policy": "", "atomic_mode": "relaxed", "num_warps": 4, "num_ctas": 1, "num_stages": 4, "num_buffers_warp_spec": 0, "num_consumer_groups": 0, "reg_dec_producer": 0, "reg_inc_consumer": 0}, "(8, 4608, 3584, 3584, 1)": {"BLOCK_SIZE_M": 16, "BLOCK_SIZE_N": 64, "BLOCK_SIZE_K": 256, "GROUP_SIZE_M": 8, "SPLIT_K": 1, "A_load_order": 2, "meta_evict_policy": "", "atomic_mode": "relaxed", "num_warps": 4, "num_ctas": 1, "num_stages": 4, "num_buffers_warp_spec": 0, "num_consumer_groups": 0, "reg_dec_producer": 0, "reg_inc_consumer": 0}, "(8, 3584, 3584, 3584, 1)": {"BLOCK_SIZE_M": 16, "BLOCK_SIZE_N": 32, "BLOCK_SIZE_K": 256, "GROUP_SIZE_M": 8, "SPLIT_K": 1, "A_load_order": 0, "meta_evict_policy": "", "atomic_mode": "relaxed", "num_warps": 4, "num_ctas": 1, "num_stages": 2, "num_buffers_warp_spec": 0, "num_consumer_groups": 0, "reg_dec_producer": 0, "reg_inc_consumer": 0}, "(8, 37888, 3584, 3584, 1)": {"BLOCK_SIZE_M": 16, "BLOCK_SIZE_N": 64, "BLOCK_SIZE_K": 256, "GROUP_SIZE_M": 8, "SPLIT_K": 1, "A_load_order": 0, "meta_evict_policy": "", "atomic_mode": "relaxed", "num_warps": 4, "num_ctas": 1, "num_stages": 2, "num_buffers_warp_spec": 0, "num_consumer_groups": 0, "reg_dec_producer": 0, "reg_inc_consumer": 0}, "(8, 3584, 18944, 18944, 1)": {"BLOCK_SIZE_M": 16, "BLOCK_SIZE_N": 64, "BLOCK_SIZE_K": 256, "GROUP_SIZE_M": 8, "SPLIT_K": 1, "A_load_order": 0, "meta_evict_policy": "", "atomic_mode": "relaxed", "num_warps": 4, "num_ctas": 1, "num_stages": 4, "num_buffers_warp_spec": 0, "num_consumer_groups": 0, "reg_dec_producer": 0, "reg_inc_consumer": 0}, "(4, 4608, 3584, 3584, 1)": {"BLOCK_SIZE_M": 16, "BLOCK_SIZE_N": 64, "BLOCK_SIZE_K": 256, "GROUP_SIZE_M": 8, "SPLIT_K": 1, "A_load_order": 0, "meta_evict_policy": "", "atomic_mode": "relaxed", "num_warps": 4, "num_ctas": 1, "num_stages": 2, "num_buffers_warp_spec": 0, "num_consumer_groups": 0, "reg_dec_producer": 0, "reg_inc_consumer": 0}, "(4, 3584, 3584, 3584, 1)": {"BLOCK_SIZE_M": 16, "BLOCK_SIZE_N": 32, "BLOCK_SIZE_K": 256, "GROUP_SIZE_M": 8, "SPLIT_K": 1, "A_load_order": 0, "meta_evict_policy": "", "atomic_mode": "relaxed", "num_warps": 4, "num_ctas": 1, "num_stages": 2, "num_buffers_warp_spec": 0, "num_consumer_groups": 0, "reg_dec_producer": 0, "reg_inc_consumer": 0}, "(4, 37888, 3584, 3584, 1)": {"BLOCK_SIZE_M": 16, "BLOCK_SIZE_N": 64, "BLOCK_SIZE_K": 256, "GROUP_SIZE_M": 8, "SPLIT_K": 1, "A_load_order": 0, "meta_evict_policy": "", "atomic_mode": "relaxed", "num_warps": 4, "num_ctas": 1, "num_stages": 2, "num_buffers_warp_spec": 0, "num_consumer_groups": 0, "reg_dec_producer": 0, "reg_inc_consumer": 0}, "(4, 3584, 18944, 18944, 1)": {"BLOCK_SIZE_M": 16, "BLOCK_SIZE_N": 32, "BLOCK_SIZE_K": 256, "GROUP_SIZE_M": 8, "SPLIT_K": 1, "A_load_order": 0, "meta_evict_policy": "", "atomic_mode": "relaxed", "num_warps": 4, "num_ctas": 1, "num_stages": 4, "num_buffers_warp_spec": 0, "num_consumer_groups": 0, "reg_dec_producer": 0, "reg_inc_consumer": 0}, "(2, 4608, 3584, 3584, 1)": {"BLOCK_SIZE_M": 16, "BLOCK_SIZE_N": 32, "BLOCK_SIZE_K": 256, "GROUP_SIZE_M": 8, "SPLIT_K": 1, "A_load_order": 2, "meta_evict_policy": "", "atomic_mode": "relaxed", "num_warps": 4, "num_ctas": 1, "num_stages": 4, "num_buffers_warp_spec": 0, "num_consumer_groups": 0, "reg_dec_producer": 0, "reg_inc_consumer": 0}, "(2, 3584, 3584, 3584, 1)": {"BLOCK_SIZE_M": 16, "BLOCK_SIZE_N": 32, "BLOCK_SIZE_K": 256, "GROUP_SIZE_M": 8, "SPLIT_K": 1, "A_load_order": 0, "meta_evict_policy": "", "atomic_mode": "relaxed", "num_warps": 4, "num_ctas": 1, "num_stages": 2, "num_buffers_warp_spec": 0, "num_consumer_groups": 0, "reg_dec_producer": 0, "reg_inc_consumer": 0}, "(2, 37888, 3584, 3584, 1)": {"BLOCK_SIZE_M": 16, "BLOCK_SIZE_N": 64, "BLOCK_SIZE_K": 256, "GROUP_SIZE_M": 8, "SPLIT_K": 1, "A_load_order": 0, "meta_evict_policy": "", "atomic_mode": "relaxed", "num_warps": 4, "num_ctas": 1, "num_stages": 2, "num_buffers_warp_spec": 0, "num_consumer_groups": 0, "reg_dec_producer": 0, "reg_inc_consumer": 0}, "(2, 3584, 18944, 18944, 1)": {"BLOCK_SIZE_M": 16, "BLOCK_SIZE_N": 64, "BLOCK_SIZE_K": 256, "GROUP_SIZE_M": 8, "SPLIT_K": 1, "A_load_order": 2, "meta_evict_policy": "", "atomic_mode": "relaxed", "num_warps": 4, "num_ctas": 1, "num_stages": 4, "num_buffers_warp_spec": 0, "num_consumer_groups": 0, "reg_dec_producer": 0, "reg_inc_consumer": 0}, "(64, 4608, 3584, 64, 8)": {"BLOCK_SIZE_M": 32, "BLOCK_SIZE_N": 64, "BLOCK_SIZE_K": 64, "GROUP_SIZE_M": 8, "SPLIT_K": 4, "A_load_order": 0, "meta_evict_policy": "", "atomic_mode": "relaxed", "num_warps": 4, "num_ctas": 1, "num_stages": 1, "num_buffers_warp_spec": 0, "num_consumer_groups": 0, "reg_dec_producer": 0, "reg_inc_consumer": 0}, "(64, 3584, 3584, 64, 8)": {"BLOCK_SIZE_M": 32, "BLOCK_SIZE_N": 64, "BLOCK_SIZE_K": 64, "GROUP_SIZE_M": 8, "SPLIT_K": 4, "A_load_order": 0, "meta_evict_policy": "", "atomic_mode": "relaxed", "num_warps": 4, "num_ctas": 1, "num_stages": 1, "num_buffers_warp_spec": 0, "num_consumer_groups": 0, "reg_dec_producer": 0, "reg_inc_consumer": 0}, "(64, 37888, 3584, 64, 8)": {"BLOCK_SIZE_M": 32, "BLOCK_SIZE_N": 64, "BLOCK_SIZE_K": 64, "GROUP_SIZE_M": 8, "SPLIT_K": 1, "A_load_order": 2, "meta_evict_policy": "", "atomic_mode": "relaxed", "num_warps": 4, "num_ctas": 1, "num_stages": 1, "num_buffers_warp_spec": 0, "num_consumer_groups": 0, "reg_dec_producer": 0, "reg_inc_consumer": 0}, "(64, 3584, 18944, 64, 8)": {"BLOCK_SIZE_M": 32, "BLOCK_SIZE_N": 64, "BLOCK_SIZE_K": 64, "GROUP_SIZE_M": 8, "SPLIT_K": 8, "A_load_order": 0, "meta_evict_policy": "", "atomic_mode": "relaxed", "num_warps": 4, "num_ctas": 1, "num_stages": 1, "num_buffers_warp_spec": 0, "num_consumer_groups": 0, "reg_dec_producer": 0, "reg_inc_consumer": 0}, "(32, 4608, 3584, 64, 8)": {"BLOCK_SIZE_M": 32, "BLOCK_SIZE_N": 64, "BLOCK_SIZE_K": 64, "GROUP_SIZE_M": 8, "SPLIT_K": 8, "A_load_order": 0, "meta_evict_policy": "", "atomic_mode": "relaxed", "num_warps": 4, "num_ctas": 1, "num_stages": 1, "num_buffers_warp_spec": 0, "num_consumer_groups": 0, "reg_dec_producer": 0, "reg_inc_consumer": 0}, "(32, 3584, 3584, 64, 8)": {"BLOCK_SIZE_M": 32, "BLOCK_SIZE_N": 64, "BLOCK_SIZE_K": 64, "GROUP_SIZE_M": 8, "SPLIT_K": 8, "A_load_order": 0, "meta_evict_policy": "", "atomic_mode": "relaxed", "num_warps": 4, "num_ctas": 1, "num_stages": 1, "num_buffers_warp_spec": 0, "num_consumer_groups": 0, "reg_dec_producer": 0, "reg_inc_consumer": 0}, "(32, 37888, 3584, 64, 8)": {"BLOCK_SIZE_M": 32, "BLOCK_SIZE_N": 64, "BLOCK_SIZE_K": 64, "GROUP_SIZE_M": 8, "SPLIT_K": 4, "A_load_order": 2, "meta_evict_policy": "", "atomic_mode": "relaxed", "num_warps": 4, "num_ctas": 1, "num_stages": 1, "num_buffers_warp_spec": 0, "num_consumer_groups": 0, "reg_dec_producer": 0, "reg_inc_consumer": 0}, "(32, 3584, 18944, 64, 8)": {"BLOCK_SIZE_M": 32, "BLOCK_SIZE_N": 64, "BLOCK_SIZE_K": 64, "GROUP_SIZE_M": 8, "SPLIT_K": 8, "A_load_order": 0, "meta_evict_policy": "", "atomic_mode": "relaxed", "num_warps": 4, "num_ctas": 1, "num_stages": 1, "num_buffers_warp_spec": 0, "num_consumer_groups": 0, "reg_dec_producer": 0, "reg_inc_consumer": 0}, "(16, 4608, 3584, 64, 8)": {"BLOCK_SIZE_M": 16, "BLOCK_SIZE_N": 64, "BLOCK_SIZE_K": 64, "GROUP_SIZE_M": 8, "SPLIT_K": 8, "A_load_order": 2, "meta_evict_policy": "", "atomic_mode": "relaxed", "num_warps": 4, "num_ctas": 1, "num_stages": 1, "num_buffers_warp_spec": 0, "num_consumer_groups": 0, "reg_dec_producer": 0, "reg_inc_consumer": 0}, "(16, 3584, 3584, 64, 8)": {"BLOCK_SIZE_M": 16, "BLOCK_SIZE_N": 64, "BLOCK_SIZE_K": 64, "GROUP_SIZE_M": 8, "SPLIT_K": 8, "A_load_order": 2, "meta_evict_policy": "", "atomic_mode": "relaxed", "num_warps": 4, "num_ctas": 1, "num_stages": 1, "num_buffers_warp_spec": 0, "num_consumer_groups": 0, "reg_dec_producer": 0, "reg_inc_consumer": 0}, "(16, 37888, 3584, 64, 8)": {"BLOCK_SIZE_M": 16, "BLOCK_SIZE_N": 64, "BLOCK_SIZE_K": 64, "GROUP_SIZE_M": 8, "SPLIT_K": 8, "A_load_order": 2, "meta_evict_policy": "", "atomic_mode": "relaxed", "num_warps": 4, "num_ctas": 1, "num_stages": 1, "num_buffers_warp_spec": 0, "num_consumer_groups": 0, "reg_dec_producer": 0, "reg_inc_consumer": 0}, "(16, 3584, 18944, 64, 8)": {"BLOCK_SIZE_M": 16, "BLOCK_SIZE_N": 64, "BLOCK_SIZE_K": 64, "GROUP_SIZE_M": 8, "SPLIT_K": 8, "A_load_order": 2, "meta_evict_policy": "", "atomic_mode": "relaxed", "num_warps": 4, "num_ctas": 1, "num_stages": 1, "num_buffers_warp_spec": 0, "num_consumer_groups": 0, "reg_dec_producer": 0, "reg_inc_consumer": 0}, "(8, 4608, 3584, 64, 8)": {"BLOCK_SIZE_M": 16, "BLOCK_SIZE_N": 64, "BLOCK_SIZE_K": 64, "GROUP_SIZE_M": 8, "SPLIT_K": 8, "A_load_order": 2, "meta_evict_policy": "", "atomic_mode": "relaxed", "num_warps": 4, "num_ctas": 1, "num_stages": 1, "num_buffers_warp_spec": 0, "num_consumer_groups": 0, "reg_dec_producer": 0, "reg_inc_consumer": 0}, "(8, 3584, 3584, 64, 8)": {"BLOCK_SIZE_M": 16, "BLOCK_SIZE_N": 64, "BLOCK_SIZE_K": 64, "GROUP_SIZE_M": 8, "SPLIT_K": 8, "A_load_order": 2, "meta_evict_policy": "", "atomic_mode": "relaxed", "num_warps": 4, "num_ctas": 1, "num_stages": 1, "num_buffers_warp_spec": 0, "num_consumer_groups": 0, "reg_dec_producer": 0, "reg_inc_consumer": 0}, "(8, 37888, 3584, 64, 8)": {"BLOCK_SIZE_M": 16, "BLOCK_SIZE_N": 64, "BLOCK_SIZE_K": 64, "GROUP_SIZE_M": 8, "SPLIT_K": 8, "A_load_order": 2, "meta_evict_policy": "", "atomic_mode": "relaxed", "num_warps": 4, "num_ctas": 1, "num_stages": 1, "num_buffers_warp_spec": 0, "num_consumer_groups": 0, "reg_dec_producer": 0, "reg_inc_consumer": 0}, "(8, 3584, 18944, 64, 8)": {"BLOCK_SIZE_M": 16, "BLOCK_SIZE_N": 128, "BLOCK_SIZE_K": 32, "GROUP_SIZE_M": 8, "SPLIT_K": 16, "A_load_order": 2, "meta_evict_policy": "", "atomic_mode": "relaxed", "num_warps": 8, "num_ctas": 1, "num_stages": 1, "num_buffers_warp_spec": 0, "num_consumer_groups": 0, "reg_dec_producer": 0, "reg_inc_consumer": 0}, "(4, 4608, 3584, 64, 8)": {"BLOCK_SIZE_M": 16, "BLOCK_SIZE_N": 64, "BLOCK_SIZE_K": 64, "GROUP_SIZE_M": 8, "SPLIT_K": 8, "A_load_order": 2, "meta_evict_policy": "", "atomic_mode": "relaxed", "num_warps": 4, "num_ctas": 1, "num_stages": 1, "num_buffers_warp_spec": 0, "num_consumer_groups": 0, "reg_dec_producer": 0, "reg_inc_consumer": 0}, "(4, 3584, 3584, 64, 8)": {"BLOCK_SIZE_M": 16, "BLOCK_SIZE_N": 64, "BLOCK_SIZE_K": 64, "GROUP_SIZE_M": 8, "SPLIT_K": 8, "A_load_order": 2, "meta_evict_policy": "", "atomic_mode": "relaxed", "num_warps": 4, "num_ctas": 1, "num_stages": 1, "num_buffers_warp_spec": 0, "num_consumer_groups": 0, "reg_dec_producer": 0, "reg_inc_consumer": 0}, "(4, 37888, 3584, 64, 8)": {"BLOCK_SIZE_M": 16, "BLOCK_SIZE_N": 64, "BLOCK_SIZE_K": 64, "GROUP_SIZE_M": 8, "SPLIT_K": 8, "A_load_order": 2, "meta_evict_policy": "", "atomic_mode": "relaxed", "num_warps": 4, "num_ctas": 1, "num_stages": 1, "num_buffers_warp_spec": 0, "num_consumer_groups": 0, "reg_dec_producer": 0, "reg_inc_consumer": 0}, "(4, 3584, 18944, 64, 8)": {"BLOCK_SIZE_M": 16, "BLOCK_SIZE_N": 128, "BLOCK_SIZE_K": 32, "GROUP_SIZE_M": 8, "SPLIT_K": 16, "A_load_order": 2, "meta_evict_policy": "", "atomic_mode": "relaxed", "num_warps": 8, "num_ctas": 1, "num_stages": 1, "num_buffers_warp_spec": 0, "num_consumer_groups": 0, "reg_dec_producer": 0, "reg_inc_consumer": 0}, "(2, 4608, 3584, 64, 8)": {"BLOCK_SIZE_M": 16, "BLOCK_SIZE_N": 64, "BLOCK_SIZE_K": 64, "GROUP_SIZE_M": 8, "SPLIT_K": 8, "A_load_order": 2, "meta_evict_policy": "", "atomic_mode": "relaxed", "num_warps": 4, "num_ctas": 1, "num_stages": 1, "num_buffers_warp_spec": 0, "num_consumer_groups": 0, "reg_dec_producer": 0, "reg_inc_consumer": 0}, "(2, 3584, 3584, 64, 8)": {"BLOCK_SIZE_M": 16, "BLOCK_SIZE_N": 64, "BLOCK_SIZE_K": 64, "GROUP_SIZE_M": 8, "SPLIT_K": 8, "A_load_order": 2, "meta_evict_policy": "", "atomic_mode": "relaxed", "num_warps": 4, "num_ctas": 1, "num_stages": 1, "num_buffers_warp_spec": 0, "num_consumer_groups": 0, "reg_dec_producer": 0, "reg_inc_consumer": 0}, "(2, 37888, 3584, 64, 8)": {"BLOCK_SIZE_M": 16, "BLOCK_SIZE_N": 64, "BLOCK_SIZE_K": 64, "GROUP_SIZE_M": 8, "SPLIT_K": 8, "A_load_order": 2, "meta_evict_policy": "", "atomic_mode": "relaxed", "num_warps": 4, "num_ctas": 1, "num_stages": 1, "num_buffers_warp_spec": 0, "num_consumer_groups": 0, "reg_dec_producer": 0, "reg_inc_consumer": 0}, "(2, 3584, 18944, 64, 8)": {"BLOCK_SIZE_M": 16, "BLOCK_SIZE_N": 128, "BLOCK_SIZE_K": 32, "GROUP_SIZE_M": 8, "SPLIT_K": 16, "A_load_order": 2, "meta_evict_policy": "", "atomic_mode": "relaxed", "num_warps": 8, "num_ctas": 1, "num_stages": 1, "num_buffers_warp_spec": 0, "num_consumer_groups": 0, "reg_dec_producer": 0, "reg_inc_consumer": 0}, "(64, 2048, 1536, 64, 8)": {"BLOCK_SIZE_M": 32, "BLOCK_SIZE_N": 64, "BLOCK_SIZE_K": 64, "GROUP_SIZE_M": 8, "SPLIT_K": 4, "A_load_order": 2, "meta_evict_policy": "", "atomic_mode": "relaxed", "num_warps": 4, "num_ctas": 1, "num_stages": 1, "num_buffers_warp_spec": 0, "num_consumer_groups": 0, "reg_dec_producer": 0, "reg_inc_consumer": 0}, "(64, 1536, 1536, 64, 8)": {"BLOCK_SIZE_M": 32, "BLOCK_SIZE_N": 64, "BLOCK_SIZE_K": 64, "GROUP_SIZE_M": 8, "SPLIT_K": 8, "A_load_order": 2, "meta_evict_policy": "", "atomic_mode": "relaxed", "num_warps": 4, "num_ctas": 1, "num_stages": 1, "num_buffers_warp_spec": 0, "num_consumer_groups": 0, "reg_dec_producer": 0, "reg_inc_consumer": 0}, "(64, 17920, 1536, 64, 8)": {"BLOCK_SIZE_M": 32, "BLOCK_SIZE_N": 64, "BLOCK_SIZE_K": 32, "GROUP_SIZE_M": 8, "SPLIT_K": 1, "A_load_order": 2, "meta_evict_policy": "", "atomic_mode": "relaxed", "num_warps": 4, "num_ctas": 1, "num_stages": 1, "num_buffers_warp_spec": 0, "num_consumer_groups": 0, "reg_dec_producer": 0, "reg_inc_consumer": 0}, "(64, 1536, 8960, 64, 8)": {"BLOCK_SIZE_M": 32, "BLOCK_SIZE_N": 64, "BLOCK_SIZE_K": 32, "GROUP_SIZE_M": 8, "SPLIT_K": 8, "A_load_order": 2, "meta_evict_policy": "", "atomic_mode": "relaxed", "num_warps": 8, "num_ctas": 1, "num_stages": 1, "num_buffers_warp_spec": 0, "num_consumer_groups": 0, "reg_dec_producer": 0, "reg_inc_consumer": 0}, "(32, 2048, 1536, 64, 8)": {"BLOCK_SIZE_M": 32, "BLOCK_SIZE_N": 64, "BLOCK_SIZE_K": 64, "GROUP_SIZE_M": 8, "SPLIT_K": 8, "A_load_order": 2, "meta_evict_policy": "", "atomic_mode": "relaxed", "num_warps": 4, "num_ctas": 1, "num_stages": 1, "num_buffers_warp_spec": 0, "num_consumer_groups": 0, "reg_dec_producer": 0, "reg_inc_consumer": 0}, "(32, 1536, 1536, 64, 8)": {"BLOCK_SIZE_M": 32, "BLOCK_SIZE_N": 64, "BLOCK_SIZE_K": 64, "GROUP_SIZE_M": 8, "SPLIT_K": 8, "A_load_order": 2, "meta_evict_policy": "", "atomic_mode": "relaxed", "num_warps": 4, "num_ctas": 1, "num_stages": 1, "num_buffers_warp_spec": 0, "num_consumer_groups": 0, "reg_dec_producer": 0, "reg_inc_consumer": 0}, "(32, 17920, 1536, 64, 8)": {"BLOCK_SIZE_M": 32, "BLOCK_SIZE_N": 64, "BLOCK_SIZE_K": 64, "GROUP_SIZE_M": 8, "SPLIT_K": 1, "A_load_order": 2, "meta_evict_policy": "", "atomic_mode": "relaxed", "num_warps": 4, "num_ctas": 1, "num_stages": 1, "num_buffers_warp_spec": 0, "num_consumer_groups": 0, "reg_dec_producer": 0, "reg_inc_consumer": 0}, "(32, 1536, 8960, 64, 8)": {"BLOCK_SIZE_M": 32, "BLOCK_SIZE_N": 64, "BLOCK_SIZE_K": 32, "GROUP_SIZE_M": 8, "SPLIT_K": 8, "A_load_order": 2, "meta_evict_policy": "", "atomic_mode": "relaxed", "num_warps": 8, "num_ctas": 1, "num_stages": 1, "num_buffers_warp_spec": 0, "num_consumer_groups": 0, "reg_dec_producer": 0, "reg_inc_consumer": 0}, "(16, 2048, 1536, 64, 8)": {"BLOCK_SIZE_M": 16, "BLOCK_SIZE_N": 64, "BLOCK_SIZE_K": 32, "GROUP_SIZE_M": 8, "SPLIT_K": 8, "A_load_order": 2, "meta_evict_policy": "", "atomic_mode": "relaxed", "num_warps": 8, "num_ctas": 1, "num_stages": 1, "num_buffers_warp_spec": 0, "num_consumer_groups": 0, "reg_dec_producer": 0, "reg_inc_consumer": 0}, "(16, 1536, 1536, 64, 8)": {"BLOCK_SIZE_M": 16, "BLOCK_SIZE_N": 64, "BLOCK_SIZE_K": 32, "GROUP_SIZE_M": 8, "SPLIT_K": 16, "A_load_order": 2, "meta_evict_policy": "", "atomic_mode": "relaxed", "num_warps": 8, "num_ctas": 1, "num_stages": 1, "num_buffers_warp_spec": 0, "num_consumer_groups": 0, "reg_dec_producer": 0, "reg_inc_consumer": 0}, "(16, 17920, 1536, 64, 8)": {"BLOCK_SIZE_M": 16, "BLOCK_SIZE_N": 64, "BLOCK_SIZE_K": 64, "GROUP_SIZE_M": 8, "SPLIT_K": 2, "A_load_order": 2, "meta_evict_policy": "", "atomic_mode": "relaxed", "num_warps": 4, "num_ctas": 1, "num_stages": 1, "num_buffers_warp_spec": 0, "num_consumer_groups": 0, "reg_dec_producer": 0, "reg_inc_consumer": 0}, "(16, 1536, 8960, 64, 8)": {"BLOCK_SIZE_M": 16, "BLOCK_SIZE_N": 32, "BLOCK_SIZE_K": 32, "GROUP_SIZE_M": 8, "SPLIT_K": 8, "A_load_order": 2, "meta_evict_policy": "", "atomic_mode": "relaxed", "num_warps": 4, "num_ctas": 1, "num_stages": 1, "num_buffers_warp_spec": 0, "num_consumer_groups": 0, "reg_dec_producer": 0, "reg_inc_consumer": 0}, "(8, 2048, 1536, 64, 8)": {"BLOCK_SIZE_M": 16, "BLOCK_SIZE_N": 64, "BLOCK_SIZE_K": 64, "GROUP_SIZE_M": 8, "SPLIT_K": 8, "A_load_order": 2, "meta_evict_policy": "", "atomic_mode": "relaxed", "num_warps": 4, "num_ctas": 1, "num_stages": 1, "num_buffers_warp_spec": 0, "num_consumer_groups": 0, "reg_dec_producer": 0, "reg_inc_consumer": 0}, "(8, 1536, 1536, 64, 8)": {"BLOCK_SIZE_M": 16, "BLOCK_SIZE_N": 32, "BLOCK_SIZE_K": 32, "GROUP_SIZE_M": 8, "SPLIT_K": 16, "A_load_order": 2, "meta_evict_policy": "", "atomic_mode": "relaxed", "num_warps": 4, "num_ctas": 1, "num_stages": 1, "num_buffers_warp_spec": 0, "num_consumer_groups": 0, "reg_dec_producer": 0, "reg_inc_consumer": 0}, "(8, 17920, 1536, 64, 8)": {"BLOCK_SIZE_M": 16, "BLOCK_SIZE_N": 64, "BLOCK_SIZE_K": 64, "GROUP_SIZE_M": 8, "SPLIT_K": 2, "A_load_order": 2, "meta_evict_policy": "", "atomic_mode": "relaxed", "num_warps": 4, "num_ctas": 1, "num_stages": 1, "num_buffers_warp_spec": 0, "num_consumer_groups": 0, "reg_dec_producer": 0, "reg_inc_consumer": 0}, "(8, 1536, 8960, 64, 8)": {"BLOCK_SIZE_M": 16, "BLOCK_SIZE_N": 32, "BLOCK_SIZE_K": 32, "GROUP_SIZE_M": 8, "SPLIT_K": 8, "A_load_order": 2, "meta_evict_policy": "", "atomic_mode": "relaxed", "num_warps": 4, "num_ctas": 1, "num_stages": 1, "num_buffers_warp_spec": 0, "num_consumer_groups": 0, "reg_dec_producer": 0, "reg_inc_consumer": 0}, "(4, 2048, 1536, 64, 8)": {"BLOCK_SIZE_M": 16, "BLOCK_SIZE_N": 64, "BLOCK_SIZE_K": 32, "GROUP_SIZE_M": 8, "SPLIT_K": 16, "A_load_order": 0, "meta_evict_policy": "", "atomic_mode": "relaxed", "num_warps": 4, "num_ctas": 1, "num_stages": 1, "num_buffers_warp_spec": 0, "num_consumer_groups": 0, "reg_dec_producer": 0, "reg_inc_consumer": 0}, "(4, 1536, 1536, 64, 8)": {"BLOCK_SIZE_M": 16, "BLOCK_SIZE_N": 32, "BLOCK_SIZE_K": 32, "GROUP_SIZE_M": 8, "SPLIT_K": 16, "A_load_order": 0, "meta_evict_policy": "", "atomic_mode": "relaxed", "num_warps": 4, "num_ctas": 1, "num_stages": 1, "num_buffers_warp_spec": 0, "num_consumer_groups": 0, "reg_dec_producer": 0, "reg_inc_consumer": 0}, "(4, 17920, 1536, 64, 8)": {"BLOCK_SIZE_M": 16, "BLOCK_SIZE_N": 64, "BLOCK_SIZE_K": 64, "GROUP_SIZE_M": 8, "SPLIT_K": 2, "A_load_order": 2, "meta_evict_policy": "", "atomic_mode": "relaxed", "num_warps": 4, "num_ctas": 1, "num_stages": 1, "num_buffers_warp_spec": 0, "num_consumer_groups": 0, "reg_dec_producer": 0, "reg_inc_consumer": 0}, "(4, 1536, 8960, 64, 8)": {"BLOCK_SIZE_M": 16, "BLOCK_SIZE_N": 32, "BLOCK_SIZE_K": 32, "GROUP_SIZE_M": 8, "SPLIT_K": 8, "A_load_order": 2, "meta_evict_policy": "", "atomic_mode": "relaxed", "num_warps": 4, "num_ctas": 1, "num_stages": 1, "num_buffers_warp_spec": 0, "num_consumer_groups": 0, "reg_dec_producer": 0, "reg_inc_consumer": 0}, "(2, 2048, 1536, 64, 8)": {"BLOCK_SIZE_M": 16, "BLOCK_SIZE_N": 32, "BLOCK_SIZE_K": 32, "GROUP_SIZE_M": 8, "SPLIT_K": 8, "A_load_order": 2, "meta_evict_policy": "", "atomic_mode": "relaxed", "num_warps": 4, "num_ctas": 1, "num_stages": 1, "num_buffers_warp_spec": 0, "num_consumer_groups": 0, "reg_dec_producer": 0, "reg_inc_consumer": 0}, "(2, 1536, 1536, 64, 8)": {"BLOCK_SIZE_M": 16, "BLOCK_SIZE_N": 32, "BLOCK_SIZE_K": 32, "GROUP_SIZE_M": 8, "SPLIT_K": 16, "A_load_order": 0, "meta_evict_policy": "", "atomic_mode": "relaxed", "num_warps": 4, "num_ctas": 1, "num_stages": 1, "num_buffers_warp_spec": 0, "num_consumer_groups": 0, "reg_dec_producer": 0, "reg_inc_consumer": 0}, "(2, 17920, 1536, 64, 8)": {"BLOCK_SIZE_M": 16, "BLOCK_SIZE_N": 64, "BLOCK_SIZE_K": 64, "GROUP_SIZE_M": 8, "SPLIT_K": 2, "A_load_order": 2, "meta_evict_policy": "", "atomic_mode": "relaxed", "num_warps": 4, "num_ctas": 1, "num_stages": 1, "num_buffers_warp_spec": 0, "num_consumer_groups": 0, "reg_dec_producer": 0, "reg_inc_consumer": 0}, "(2, 1536, 8960, 64, 8)": {"BLOCK_SIZE_M": 16, "BLOCK_SIZE_N": 32, "BLOCK_SIZE_K": 32, "GROUP_SIZE_M": 8, "SPLIT_K": 8, "A_load_order": 2, "meta_evict_policy": "", "atomic_mode": "relaxed", "num_warps": 4, "num_ctas": 1, "num_stages": 1, "num_buffers_warp_spec": 0, "num_consumer_groups": 0, "reg_dec_producer": 0, "reg_inc_consumer": 0}, "(64, 2048, 1536, 1536, 1)": {"BLOCK_SIZE_M": 32, "BLOCK_SIZE_N": 64, "BLOCK_SIZE_K": 64, "GROUP_SIZE_M": 8, "SPLIT_K": 1, "A_load_order": 0, "meta_evict_policy": "", "atomic_mode": "relaxed", "num_warps": 4, "num_ctas": 1, "num_stages": 4, "num_buffers_warp_spec": 0, "num_consumer_groups": 0, "reg_dec_producer": 0, "reg_inc_consumer": 0}, "(64, 1536, 1536, 1536, 1)": {"BLOCK_SIZE_M": 32, "BLOCK_SIZE_N": 64, "BLOCK_SIZE_K": 128, "GROUP_SIZE_M": 8, "SPLIT_K": 1, "A_load_order": 0, "meta_evict_policy": "", "atomic_mode": "relaxed", "num_warps": 4, "num_ctas": 1, "num_stages": 4, "num_buffers_warp_spec": 0, "num_consumer_groups": 0, "reg_dec_producer": 0, "reg_inc_consumer": 0}, "(64, 17920, 1536, 1536, 1)": {"BLOCK_SIZE_M": 32, "BLOCK_SIZE_N": 32, "BLOCK_SIZE_K": 256, "GROUP_SIZE_M": 8, "SPLIT_K": 1, "A_load_order": 0, "meta_evict_policy": "", "atomic_mode": "relaxed", "num_warps": 4, "num_ctas": 1, "num_stages": 2, "num_buffers_warp_spec": 0, "num_consumer_groups": 0, "reg_dec_producer": 0, "reg_inc_consumer": 0}, "(64, 1536, 8960, 8960, 1)": {"BLOCK_SIZE_M": 32, "BLOCK_SIZE_N": 64, "BLOCK_SIZE_K": 256, "GROUP_SIZE_M": 8, "SPLIT_K": 1, "A_load_order": 2, "meta_evict_policy": "", "atomic_mode": "relaxed", "num_warps": 4, "num_ctas": 1, "num_stages": 4, "num_buffers_warp_spec": 0, "num_consumer_groups": 0, "reg_dec_producer": 0, "reg_inc_consumer": 0}, "(32, 2048, 1536, 1536, 1)": {"BLOCK_SIZE_M": 16, "BLOCK_SIZE_N": 32, "BLOCK_SIZE_K": 128, "GROUP_SIZE_M": 8, "SPLIT_K": 1, "A_load_order": 0, "meta_evict_policy": "", "atomic_mode": "relaxed", "num_warps": 4, "num_ctas": 1, "num_stages": 4, "num_buffers_warp_spec": 0, "num_consumer_groups": 0, "reg_dec_producer": 0, "reg_inc_consumer": 0}, "(32, 1536, 1536, 1536, 1)": {"BLOCK_SIZE_M": 32, "BLOCK_SIZE_N": 32, "BLOCK_SIZE_K": 256, "GROUP_SIZE_M": 8, "SPLIT_K": 1, "A_load_order": 0, "meta_evict_policy": "", "atomic_mode": "relaxed", "num_warps": 4, "num_ctas": 1, "num_stages": 4, "num_buffers_warp_spec": 0, "num_consumer_groups": 0, "reg_dec_producer": 0, "reg_inc_consumer": 0}, "(32, 17920, 1536, 1536, 1)": {"BLOCK_SIZE_M": 32, "BLOCK_SIZE_N": 64, "BLOCK_SIZE_K": 256, "GROUP_SIZE_M": 8, "SPLIT_K": 1, "A_load_order": 0, "meta_evict_policy": "", "atomic_mode": "relaxed", "num_warps": 4, "num_ctas": 1, "num_stages": 2, "num_buffers_warp_spec": 0, "num_consumer_groups": 0, "reg_dec_producer": 0, "reg_inc_consumer": 0}, "(32, 1536, 8960, 8960, 1)": {"BLOCK_SIZE_M": 32, "BLOCK_SIZE_N": 32, "BLOCK_SIZE_K": 256, "GROUP_SIZE_M": 8, "SPLIT_K": 1, "A_load_order": 0, "meta_evict_policy": "", "atomic_mode": "relaxed", "num_warps": 4, "num_ctas": 1, "num_stages": 4, "num_buffers_warp_spec": 0, "num_consumer_groups": 0, "reg_dec_producer": 0, "reg_inc_consumer": 0}, "(16, 2048, 1536, 1536, 1)": {"BLOCK_SIZE_M": 16, "BLOCK_SIZE_N": 32, "BLOCK_SIZE_K": 128, "GROUP_SIZE_M": 8, "SPLIT_K": 1, "A_load_order": 0, "meta_evict_policy": "", "atomic_mode": "relaxed", "num_warps": 4, "num_ctas": 1, "num_stages": 4, "num_buffers_warp_spec": 0, "num_consumer_groups": 0, "reg_dec_producer": 0, "reg_inc_consumer": 0}, "(16, 1536, 1536, 1536, 1)": {"BLOCK_SIZE_M": 16, "BLOCK_SIZE_N": 64, "BLOCK_SIZE_K": 128, "GROUP_SIZE_M": 8, "SPLIT_K": 1, "A_load_order": 0, "meta_evict_policy": "", "atomic_mode": "relaxed", "num_warps": 4, "num_ctas": 1, "num_stages": 4, "num_buffers_warp_spec": 0, "num_consumer_groups": 0, "reg_dec_producer": 0, "reg_inc_consumer": 0}, "(16, 17920, 1536, 1536, 1)": {"BLOCK_SIZE_M": 16, "BLOCK_SIZE_N": 64, "BLOCK_SIZE_K": 256, "GROUP_SIZE_M": 8, "SPLIT_K": 1, "A_load_order": 0, "meta_evict_policy": "", "atomic_mode": "relaxed", "num_warps": 4, "num_ctas": 1, "num_stages": 2, "num_buffers_warp_spec": 0, "num_consumer_groups": 0, "reg_dec_producer": 0, "reg_inc_consumer": 0}, "(16, 1536, 8960, 8960, 1)": {"BLOCK_SIZE_M": 16, "BLOCK_SIZE_N": 32, "BLOCK_SIZE_K": 256, "GROUP_SIZE_M": 8, "SPLIT_K": 1, "A_load_order": 2, "meta_evict_policy": "", "atomic_mode": "relaxed", "num_warps": 4, "num_ctas": 1, "num_stages": 4, "num_buffers_warp_spec": 0, "num_consumer_groups": 0, "reg_dec_producer": 0, "reg_inc_consumer": 0}, "(8, 2048, 1536, 1536, 1)": {"BLOCK_SIZE_M": 16, "BLOCK_SIZE_N": 32, "BLOCK_SIZE_K": 256, "GROUP_SIZE_M": 8, "SPLIT_K": 1, "A_load_order": 0, "meta_evict_policy": "", "atomic_mode": "relaxed", "num_warps": 4, "num_ctas": 1, "num_stages": 2, "num_buffers_warp_spec": 0, "num_consumer_groups": 0, "reg_dec_producer": 0, "reg_inc_consumer": 0}, "(8, 1536, 1536, 1536, 1)": {"BLOCK_SIZE_M": 16, "BLOCK_SIZE_N": 32, "BLOCK_SIZE_K": 256, "GROUP_SIZE_M": 8, "SPLIT_K": 1, "A_load_order": 0, "meta_evict_policy": "", "atomic_mode": "relaxed", "num_warps": 4, "num_ctas": 1, "num_stages": 4, "num_buffers_warp_spec": 0, "num_consumer_groups": 0, "reg_dec_producer": 0, "reg_inc_consumer": 0}, "(8, 17920, 1536, 1536, 1)": {"BLOCK_SIZE_M": 16, "BLOCK_SIZE_N": 32, "BLOCK_SIZE_K": 256, "GROUP_SIZE_M": 8, "SPLIT_K": 1, "A_load_order": 2, "meta_evict_policy": "", "atomic_mode": "relaxed", "num_warps": 4, "num_ctas": 1, "num_stages": 2, "num_buffers_warp_spec": 0, "num_consumer_groups": 0, "reg_dec_producer": 0, "reg_inc_consumer": 0}, "(8, 1536, 8960, 8960, 1)": {"BLOCK_SIZE_M": 16, "BLOCK_SIZE_N": 32, "BLOCK_SIZE_K": 256, "GROUP_SIZE_M": 8, "SPLIT_K": 1, "A_load_order": 0, "meta_evict_policy": "", "atomic_mode": "relaxed", "num_warps": 4, "num_ctas": 1, "num_stages": 4, "num_buffers_warp_spec": 0, "num_consumer_groups": 0, "reg_dec_producer": 0, "reg_inc_consumer": 0}, "(4, 2048, 1536, 1536, 1)": {"BLOCK_SIZE_M": 16, "BLOCK_SIZE_N": 32, "BLOCK_SIZE_K": 128, "GROUP_SIZE_M": 8, "SPLIT_K": 1, "A_load_order": 0, "meta_evict_policy": "", "atomic_mode": "relaxed", "num_warps": 4, "num_ctas": 1, "num_stages": 4, "num_buffers_warp_spec": 0, "num_consumer_groups": 0, "reg_dec_producer": 0, "reg_inc_consumer": 0}, "(4, 1536, 1536, 1536, 1)": {"BLOCK_SIZE_M": 16, "BLOCK_SIZE_N": 32, "BLOCK_SIZE_K": 128, "GROUP_SIZE_M": 8, "SPLIT_K": 1, "A_load_order": 0, "meta_evict_policy": "", "atomic_mode": "relaxed", "num_warps": 4, "num_ctas": 1, "num_stages": 4, "num_buffers_warp_spec": 0, "num_consumer_groups": 0, "reg_dec_producer": 0, "reg_inc_consumer": 0}, "(4, 17920, 1536, 1536, 1)": {"BLOCK_SIZE_M": 16, "BLOCK_SIZE_N": 32, "BLOCK_SIZE_K": 256, "GROUP_SIZE_M": 8, "SPLIT_K": 1, "A_load_order": 0, "meta_evict_policy": "", "atomic_mode": "relaxed", "num_warps": 4, "num_ctas": 1, "num_stages": 2, "num_buffers_warp_spec": 0, "num_consumer_groups": 0, "reg_dec_producer": 0, "reg_inc_consumer": 0}, "(4, 1536, 8960, 8960, 1)": {"BLOCK_SIZE_M": 16, "BLOCK_SIZE_N": 32, "BLOCK_SIZE_K": 256, "GROUP_SIZE_M": 8, "SPLIT_K": 1, "A_load_order": 2, "meta_evict_policy": "", "atomic_mode": "relaxed", "num_warps": 4, "num_ctas": 1, "num_stages": 4, "num_buffers_warp_spec": 0, "num_consumer_groups": 0, "reg_dec_producer": 0, "reg_inc_consumer": 0}, "(2, 2048, 1536, 1536, 1)": {"BLOCK_SIZE_M": 16, "BLOCK_SIZE_N": 32, "BLOCK_SIZE_K": 64, "GROUP_SIZE_M": 8, "SPLIT_K": 1, "A_load_order": 2, "meta_evict_policy": "", "atomic_mode": "relaxed", "num_warps": 4, "num_ctas": 1, "num_stages": 4, "num_buffers_warp_spec": 0, "num_consumer_groups": 0, "reg_dec_producer": 0, "reg_inc_consumer": 0}, "(2, 1536, 1536, 1536, 1)": {"BLOCK_SIZE_M": 16, "BLOCK_SIZE_N": 32, "BLOCK_SIZE_K": 128, "GROUP_SIZE_M": 8, "SPLIT_K": 1, "A_load_order": 0, "meta_evict_policy": "", "atomic_mode": "relaxed", "num_warps": 4, "num_ctas": 1, "num_stages": 4, "num_buffers_warp_spec": 0, "num_consumer_groups": 0, "reg_dec_producer": 0, "reg_inc_consumer": 0}, "(2, 17920, 1536, 1536, 1)": {"BLOCK_SIZE_M": 16, "BLOCK_SIZE_N": 32, "BLOCK_SIZE_K": 256, "GROUP_SIZE_M": 8, "SPLIT_K": 1, "A_load_order": 0, "meta_evict_policy": "", "atomic_mode": "relaxed", "num_warps": 4, "num_ctas": 1, "num_stages": 2, "num_buffers_warp_spec": 0, "num_consumer_groups": 0, "reg_dec_producer": 0, "reg_inc_consumer": 0}, "(2, 1536, 8960, 8960, 1)": {"BLOCK_SIZE_M": 16, "BLOCK_SIZE_N": 32, "BLOCK_SIZE_K": 256, "GROUP_SIZE_M": 8, "SPLIT_K": 1, "A_load_order": 0, "meta_evict_policy": "", "atomic_mode": "relaxed", "num_warps": 4, "num_ctas": 1, "num_stages": 4, "num_buffers_warp_spec": 0, "num_consumer_groups": 0, "reg_dec_producer": 0, "reg_inc_consumer": 0}, "(64, 6144, 4096, 64, 8)": {"BLOCK_SIZE_M": 32, "BLOCK_SIZE_N": 64, "BLOCK_SIZE_K": 64, "GROUP_SIZE_M": 8, "SPLIT_K": 8, "A_load_order": 2, "meta_evict_policy": "", "atomic_mode": "relaxed", "num_warps": 4, "num_ctas": 1, "num_stages": 1, "num_buffers_warp_spec": 0, "num_consumer_groups": 0, "reg_dec_producer": 0, "reg_inc_consumer": 0}, "(64, 4096, 4096, 64, 8)": {"BLOCK_SIZE_M": 32, "BLOCK_SIZE_N": 64, "BLOCK_SIZE_K": 64, "GROUP_SIZE_M": 8, "SPLIT_K": 8, "A_load_order": 0, "meta_evict_policy": "", "atomic_mode": "relaxed", "num_warps": 4, "num_ctas": 1, "num_stages": 1, "num_buffers_warp_spec": 0, "num_consumer_groups": 0, "reg_dec_producer": 0, "reg_inc_consumer": 0}, "(64, 28672, 4096, 64, 8)": {"BLOCK_SIZE_M": 32, "BLOCK_SIZE_N": 64, "BLOCK_SIZE_K": 64, "GROUP_SIZE_M": 8, "SPLIT_K": 1, "A_load_order": 0, "meta_evict_policy": "", "atomic_mode": "relaxed", "num_warps": 4, "num_ctas": 1, "num_stages": 1, "num_buffers_warp_spec": 0, "num_consumer_groups": 0, "reg_dec_producer": 0, "reg_inc_consumer": 0}, "(64, 4096, 14336, 64, 8)": {"BLOCK_SIZE_M": 32, "BLOCK_SIZE_N": 64, "BLOCK_SIZE_K": 64, "GROUP_SIZE_M": 8, "SPLIT_K": 8, "A_load_order": 0, "meta_evict_policy": "", "atomic_mode": "relaxed", "num_warps": 4, "num_ctas": 1, "num_stages": 1, "num_buffers_warp_spec": 0, "num_consumer_groups": 0, "reg_dec_producer": 0, "reg_inc_consumer": 0}, "(32, 6144, 4096, 64, 8)": {"BLOCK_SIZE_M": 32, "BLOCK_SIZE_N": 64, "BLOCK_SIZE_K": 64, "GROUP_SIZE_M": 8, "SPLIT_K": 4, "A_load_order": 2, "meta_evict_policy": "", "atomic_mode": "relaxed", "num_warps": 4, "num_ctas": 1, "num_stages": 1, "num_buffers_warp_spec": 0, "num_consumer_groups": 0, "reg_dec_producer": 0, "reg_inc_consumer": 0}, "(32, 4096, 4096, 64, 8)": {"BLOCK_SIZE_M": 32, "BLOCK_SIZE_N": 64, "BLOCK_SIZE_K": 64, "GROUP_SIZE_M": 8, "SPLIT_K": 8, "A_load_order": 0, "meta_evict_policy": "", "atomic_mode": "relaxed", "num_warps": 4, "num_ctas": 1, "num_stages": 1, "num_buffers_warp_spec": 0, "num_consumer_groups": 0, "reg_dec_producer": 0, "reg_inc_consumer": 0}, "(32, 28672, 4096, 64, 8)": {"BLOCK_SIZE_M": 32, "BLOCK_SIZE_N": 64, "BLOCK_SIZE_K": 64, "GROUP_SIZE_M": 8, "SPLIT_K": 4, "A_load_order": 2, "meta_evict_policy": "", "atomic_mode": "relaxed", "num_warps": 4, "num_ctas": 1, "num_stages": 1, "num_buffers_warp_spec": 0, "num_consumer_groups": 0, "reg_dec_producer": 0, "reg_inc_consumer": 0}, "(32, 4096, 14336, 64, 8)": {"BLOCK_SIZE_M": 32, "BLOCK_SIZE_N": 64, "BLOCK_SIZE_K": 64, "GROUP_SIZE_M": 8, "SPLIT_K": 8, "A_load_order": 0, "meta_evict_policy": "", "atomic_mode": "relaxed", "num_warps": 4, "num_ctas": 1, "num_stages": 1, "num_buffers_warp_spec": 0, "num_consumer_groups": 0, "reg_dec_producer": 0, "reg_inc_consumer": 0}, "(16, 6144, 4096, 64, 8)": {"BLOCK_SIZE_M": 16, "BLOCK_SIZE_N": 64, "BLOCK_SIZE_K": 32, "GROUP_SIZE_M": 8, "SPLIT_K": 8, "A_load_order": 2, "meta_evict_policy": "", "atomic_mode": "relaxed", "num_warps": 4, "num_ctas": 1, "num_stages": 1, "num_buffers_warp_spec": 0, "num_consumer_groups": 0, "reg_dec_producer": 0, "reg_inc_consumer": 0}, "(16, 4096, 4096, 64, 8)": {"BLOCK_SIZE_M": 16, "BLOCK_SIZE_N": 64, "BLOCK_SIZE_K": 64, "GROUP_SIZE_M": 8, "SPLIT_K": 8, "A_load_order": 2, "meta_evict_policy": "", "atomic_mode": "relaxed", "num_warps": 4, "num_ctas": 1, "num_stages": 1, "num_buffers_warp_spec": 0, "num_consumer_groups": 0, "reg_dec_producer": 0, "reg_inc_consumer": 0}, "(16, 28672, 4096, 64, 8)": {"BLOCK_SIZE_M": 16, "BLOCK_SIZE_N": 64, "BLOCK_SIZE_K": 64, "GROUP_SIZE_M": 8, "SPLIT_K": 8, "A_load_order": 2, "meta_evict_policy": "", "atomic_mode": "relaxed", "num_warps": 4, "num_ctas": 1, "num_stages": 1, "num_buffers_warp_spec": 0, "num_consumer_groups": 0, "reg_dec_producer": 0, "reg_inc_consumer": 0}, "(16, 4096, 14336, 64, 8)": {"BLOCK_SIZE_M": 16, "BLOCK_SIZE_N": 64, "BLOCK_SIZE_K": 64, "GROUP_SIZE_M": 8, "SPLIT_K": 8, "A_load_order": 2, "meta_evict_policy": "", "atomic_mode": "relaxed", "num_warps": 4, "num_ctas": 1, "num_stages": 1, "num_buffers_warp_spec": 0, "num_consumer_groups": 0, "reg_dec_producer": 0, "reg_inc_consumer": 0}, "(8, 6144, 4096, 64, 8)": {"BLOCK_SIZE_M": 16, "BLOCK_SIZE_N": 64, "BLOCK_SIZE_K": 32, "GROUP_SIZE_M": 8, "SPLIT_K": 8, "A_load_order": 2, "meta_evict_policy": "", "atomic_mode": "relaxed", "num_warps": 4, "num_ctas": 1, "num_stages": 1, "num_buffers_warp_spec": 0, "num_consumer_groups": 0, "reg_dec_producer": 0, "reg_inc_consumer": 0}, "(8, 4096, 4096, 64, 8)": {"BLOCK_SIZE_M": 16, "BLOCK_SIZE_N": 64, "BLOCK_SIZE_K": 64, "GROUP_SIZE_M": 8, "SPLIT_K": 8, "A_load_order": 2, "meta_evict_policy": "", "atomic_mode": "relaxed", "num_warps": 4, "num_ctas": 1, "num_stages": 1, "num_buffers_warp_spec": 0, "num_consumer_groups": 0, "reg_dec_producer": 0, "reg_inc_consumer": 0}, "(8, 28672, 4096, 64, 8)": {"BLOCK_SIZE_M": 16, "BLOCK_SIZE_N": 64, "BLOCK_SIZE_K": 64, "GROUP_SIZE_M": 8, "SPLIT_K": 16, "A_load_order": 2, "meta_evict_policy": "", "atomic_mode": "relaxed", "num_warps": 4, "num_ctas": 1, "num_stages": 1, "num_buffers_warp_spec": 0, "num_consumer_groups": 0, "reg_dec_producer": 0, "reg_inc_consumer": 0}, "(8, 4096, 14336, 64, 8)": {"BLOCK_SIZE_M": 16, "BLOCK_SIZE_N": 64, "BLOCK_SIZE_K": 64, "GROUP_SIZE_M": 8, "SPLIT_K": 8, "A_load_order": 2, "meta_evict_policy": "", "atomic_mode": "relaxed", "num_warps": 4, "num_ctas": 1, "num_stages": 1, "num_buffers_warp_spec": 0, "num_consumer_groups": 0, "reg_dec_producer": 0, "reg_inc_consumer": 0}, "(4, 6144, 4096, 64, 8)": {"BLOCK_SIZE_M": 16, "BLOCK_SIZE_N": 64, "BLOCK_SIZE_K": 32, "GROUP_SIZE_M": 8, "SPLIT_K": 8, "A_load_order": 2, "meta_evict_policy": "", "atomic_mode": "relaxed", "num_warps": 4, "num_ctas": 1, "num_stages": 1, "num_buffers_warp_spec": 0, "num_consumer_groups": 0, "reg_dec_producer": 0, "reg_inc_consumer": 0}, "(4, 4096, 4096, 64, 8)": {"BLOCK_SIZE_M": 16, "BLOCK_SIZE_N": 64, "BLOCK_SIZE_K": 64, "GROUP_SIZE_M": 8, "SPLIT_K": 8, "A_load_order": 2, "meta_evict_policy": "", "atomic_mode": "relaxed", "num_warps": 4, "num_ctas": 1, "num_stages": 1, "num_buffers_warp_spec": 0, "num_consumer_groups": 0, "reg_dec_producer": 0, "reg_inc_consumer": 0}, "(4, 28672, 4096, 64, 8)": {"BLOCK_SIZE_M": 16, "BLOCK_SIZE_N": 64, "BLOCK_SIZE_K": 64, "GROUP_SIZE_M": 8, "SPLIT_K": 16, "A_load_order": 2, "meta_evict_policy": "", "atomic_mode": "relaxed", "num_warps": 4, "num_ctas": 1, "num_stages": 1, "num_buffers_warp_spec": 0, "num_consumer_groups": 0, "reg_dec_producer": 0, "reg_inc_consumer": 0}, "(4, 4096, 14336, 64, 8)": {"BLOCK_SIZE_M": 16, "BLOCK_SIZE_N": 64, "BLOCK_SIZE_K": 64, "GROUP_SIZE_M": 8, "SPLIT_K": 8, "A_load_order": 2, "meta_evict_policy": "", "atomic_mode": "relaxed", "num_warps": 4, "num_ctas": 1, "num_stages": 1, "num_buffers_warp_spec": 0, "num_consumer_groups": 0, "reg_dec_producer": 0, "reg_inc_consumer": 0}, "(2, 6144, 4096, 64, 8)": {"BLOCK_SIZE_M": 16, "BLOCK_SIZE_N": 64, "BLOCK_SIZE_K": 32, "GROUP_SIZE_M": 8, "SPLIT_K": 8, "A_load_order": 2, "meta_evict_policy": "", "atomic_mode": "relaxed", "num_warps": 4, "num_ctas": 1, "num_stages": 1, "num_buffers_warp_spec": 0, "num_consumer_groups": 0, "reg_dec_producer": 0, "reg_inc_consumer": 0}, "(2, 4096, 4096, 64, 8)": {"BLOCK_SIZE_M": 16, "BLOCK_SIZE_N": 64, "BLOCK_SIZE_K": 64, "GROUP_SIZE_M": 8, "SPLIT_K": 8, "A_load_order": 2, "meta_evict_policy": "", "atomic_mode": "relaxed", "num_warps": 4, "num_ctas": 1, "num_stages": 1, "num_buffers_warp_spec": 0, "num_consumer_groups": 0, "reg_dec_producer": 0, "reg_inc_consumer": 0}, "(2, 28672, 4096, 64, 8)": {"BLOCK_SIZE_M": 16, "BLOCK_SIZE_N": 64, "BLOCK_SIZE_K": 64, "GROUP_SIZE_M": 8, "SPLIT_K": 16, "A_load_order": 2, "meta_evict_policy": "", "atomic_mode": "relaxed", "num_warps": 4, "num_ctas": 1, "num_stages": 1, "num_buffers_warp_spec": 0, "num_consumer_groups": 0, "reg_dec_producer": 0, "reg_inc_consumer": 0}, "(2, 4096, 14336, 64, 8)": {"BLOCK_SIZE_M": 16, "BLOCK_SIZE_N": 64, "BLOCK_SIZE_K": 64, "GROUP_SIZE_M": 8, "SPLIT_K": 8, "A_load_order": 2, "meta_evict_policy": "", "atomic_mode": "relaxed", "num_warps": 4, "num_ctas": 1, "num_stages": 1, "num_buffers_warp_spec": 0, "num_consumer_groups": 0, "reg_dec_producer": 0, "reg_inc_consumer": 0}, "(64, 6144, 4096, 4096, 1)": {"BLOCK_SIZE_M": 32, "BLOCK_SIZE_N": 64, "BLOCK_SIZE_K": 256, "GROUP_SIZE_M": 8, "SPLIT_K": 1, "A_load_order": 0, "meta_evict_policy": "", "atomic_mode": "relaxed", "num_warps": 4, "num_ctas": 1, "num_stages": 2, "num_buffers_warp_spec": 0, "num_consumer_groups": 0, "reg_dec_producer": 0, "reg_inc_consumer": 0}, "(64, 4096, 4096, 4096, 1)": {"BLOCK_SIZE_M": 32, "BLOCK_SIZE_N": 64, "BLOCK_SIZE_K": 256, "GROUP_SIZE_M": 8, "SPLIT_K": 1, "A_load_order": 0, "meta_evict_policy": "", "atomic_mode": "relaxed", "num_warps": 4, "num_ctas": 1, "num_stages": 2, "num_buffers_warp_spec": 0, "num_consumer_groups": 0, "reg_dec_producer": 0, "reg_inc_consumer": 0}, "(64, 28672, 4096, 4096, 1)": {"BLOCK_SIZE_M": 32, "BLOCK_SIZE_N": 64, "BLOCK_SIZE_K": 256, "GROUP_SIZE_M": 8, "SPLIT_K": 1, "A_load_order": 0, "meta_evict_policy": "", "atomic_mode": "relaxed", "num_warps": 4, "num_ctas": 1, "num_stages": 2, "num_buffers_warp_spec": 0, "num_consumer_groups": 0, "reg_dec_producer": 0, "reg_inc_consumer": 0}, "(64, 4096, 14336, 14336, 1)": {"BLOCK_SIZE_M": 32, "BLOCK_SIZE_N": 128, "BLOCK_SIZE_K": 256, "GROUP_SIZE_M": 8, "SPLIT_K": 1, "A_load_order": 0, "meta_evict_policy": "", "atomic_mode": "relaxed", "num_warps": 4, "num_ctas": 1, "num_stages": 2, "num_buffers_warp_spec": 0, "num_consumer_groups": 0, "reg_dec_producer": 0, "reg_inc_consumer": 0}, "(32, 6144, 4096, 4096, 1)": {"BLOCK_SIZE_M": 32, "BLOCK_SIZE_N": 32, "BLOCK_SIZE_K": 256, "GROUP_SIZE_M": 8, "SPLIT_K": 1, "A_load_order": 2, "meta_evict_policy": "", "atomic_mode": "relaxed", "num_warps": 4, "num_ctas": 1, "num_stages": 2, "num_buffers_warp_spec": 0, "num_consumer_groups": 0, "reg_dec_producer": 0, "reg_inc_consumer": 0}, "(32, 4096, 4096, 4096, 1)": {"BLOCK_SIZE_M": 16, "BLOCK_SIZE_N": 64, "BLOCK_SIZE_K": 256, "GROUP_SIZE_M": 8, "SPLIT_K": 1, "A_load_order": 0, "meta_evict_policy": "", "atomic_mode": "relaxed", "num_warps": 4, "num_ctas": 1, "num_stages": 2, "num_buffers_warp_spec": 0, "num_consumer_groups": 0, "reg_dec_producer": 0, "reg_inc_consumer": 0}, "(32, 28672, 4096, 4096, 1)": {"BLOCK_SIZE_M": 32, "BLOCK_SIZE_N": 64, "BLOCK_SIZE_K": 256, "GROUP_SIZE_M": 8, "SPLIT_K": 1, "A_load_order": 0, "meta_evict_policy": "", "atomic_mode": "relaxed", "num_warps": 4, "num_ctas": 1, "num_stages": 2, "num_buffers_warp_spec": 0, "num_consumer_groups": 0, "reg_dec_producer": 0, "reg_inc_consumer": 0}, "(32, 4096, 14336, 14336, 1)": {"BLOCK_SIZE_M": 32, "BLOCK_SIZE_N": 32, "BLOCK_SIZE_K": 256, "GROUP_SIZE_M": 8, "SPLIT_K": 1, "A_load_order": 0, "meta_evict_policy": "", "atomic_mode": "relaxed", "num_warps": 4, "num_ctas": 1, "num_stages": 4, "num_buffers_warp_spec": 0, "num_consumer_groups": 0, "reg_dec_producer": 0, "reg_inc_consumer": 0}, "(16, 6144, 4096, 4096, 1)": {"BLOCK_SIZE_M": 16, "BLOCK_SIZE_N": 32, "BLOCK_SIZE_K": 256, "GROUP_SIZE_M": 8, "SPLIT_K": 1, "A_load_order": 0, "meta_evict_policy": "", "atomic_mode": "relaxed", "num_warps": 4, "num_ctas": 1, "num_stages": 2, "num_buffers_warp_spec": 0, "num_consumer_groups": 0, "reg_dec_producer": 0, "reg_inc_consumer": 0}, "(16, 4096, 4096, 4096, 1)": {"BLOCK_SIZE_M": 16, "BLOCK_SIZE_N": 32, "BLOCK_SIZE_K": 256, "GROUP_SIZE_M": 8, "SPLIT_K": 1, "A_load_order": 0, "meta_evict_policy": "", "atomic_mode": "relaxed", "num_warps": 4, "num_ctas": 1, "num_stages": 2, "num_buffers_warp_spec": 0, "num_consumer_groups": 0, "reg_dec_producer": 0, "reg_inc_consumer": 0}, "(16, 28672, 4096, 4096, 1)": {"BLOCK_SIZE_M": 16, "BLOCK_SIZE_N": 32, "BLOCK_SIZE_K": 256, "GROUP_SIZE_M": 8, "SPLIT_K": 1, "A_load_order": 2, "meta_evict_policy": "", "atomic_mode": "relaxed", "num_warps": 4, "num_ctas": 1, "num_stages": 4, "num_buffers_warp_spec": 0, "num_consumer_groups": 0, "reg_dec_producer": 0, "reg_inc_consumer": 0}, "(16, 4096, 14336, 14336, 1)": {"BLOCK_SIZE_M": 16, "BLOCK_SIZE_N": 32, "BLOCK_SIZE_K": 256, "GROUP_SIZE_M": 8, "SPLIT_K": 1, "A_load_order": 2, "meta_evict_policy": "", "atomic_mode": "relaxed", "num_warps": 4, "num_ctas": 1, "num_stages": 4, "num_buffers_warp_spec": 0, "num_consumer_groups": 0, "reg_dec_producer": 0, "reg_inc_consumer": 0}, "(8, 6144, 4096, 4096, 1)": {"BLOCK_SIZE_M": 16, "BLOCK_SIZE_N": 32, "BLOCK_SIZE_K": 256, "GROUP_SIZE_M": 8, "SPLIT_K": 1, "A_load_order": 0, "meta_evict_policy": "", "atomic_mode": "relaxed", "num_warps": 4, "num_ctas": 1, "num_stages": 2, "num_buffers_warp_spec": 0, "num_consumer_groups": 0, "reg_dec_producer": 0, "reg_inc_consumer": 0}, "(8, 4096, 4096, 4096, 1)": {"BLOCK_SIZE_M": 16, "BLOCK_SIZE_N": 64, "BLOCK_SIZE_K": 256, "GROUP_SIZE_M": 8, "SPLIT_K": 1, "A_load_order": 0, "meta_evict_policy": "", "atomic_mode": "relaxed", "num_warps": 4, "num_ctas": 1, "num_stages": 4, "num_buffers_warp_spec": 0, "num_consumer_groups": 0, "reg_dec_producer": 0, "reg_inc_consumer": 0}, "(8, 28672, 4096, 4096, 1)": {"BLOCK_SIZE_M": 16, "BLOCK_SIZE_N": 32, "BLOCK_SIZE_K": 256, "GROUP_SIZE_M": 8, "SPLIT_K": 1, "A_load_order": 0, "meta_evict_policy": "", "atomic_mode": "relaxed", "num_warps": 4, "num_ctas": 1, "num_stages": 4, "num_buffers_warp_spec": 0, "num_consumer_groups": 0, "reg_dec_producer": 0, "reg_inc_consumer": 0}, "(8, 4096, 14336, 14336, 1)": {"BLOCK_SIZE_M": 16, "BLOCK_SIZE_N": 32, "BLOCK_SIZE_K": 256, "GROUP_SIZE_M": 8, "SPLIT_K": 1, "A_load_order": 2, "meta_evict_policy": "", "atomic_mode": "relaxed", "num_warps": 4, "num_ctas": 1, "num_stages": 4, "num_buffers_warp_spec": 0, "num_consumer_groups": 0, "reg_dec_producer": 0, "reg_inc_consumer": 0}, "(4, 6144, 4096, 4096, 1)": {"BLOCK_SIZE_M": 16, "BLOCK_SIZE_N": 32, "BLOCK_SIZE_K": 256, "GROUP_SIZE_M": 8, "SPLIT_K": 1, "A_load_order": 0, "meta_evict_policy": "", "atomic_mode": "relaxed", "num_warps": 4, "num_ctas": 1, "num_stages": 2, "num_buffers_warp_spec": 0, "num_consumer_groups": 0, "reg_dec_producer": 0, "reg_inc_consumer": 0}, "(4, 4096, 4096, 4096, 1)": {"BLOCK_SIZE_M": 16, "BLOCK_SIZE_N": 64, "BLOCK_SIZE_K": 256, "GROUP_SIZE_M": 8, "SPLIT_K": 1, "A_load_order": 0, "meta_evict_policy": "", "atomic_mode": "relaxed", "num_warps": 4, "num_ctas": 1, "num_stages": 2, "num_buffers_warp_spec": 0, "num_consumer_groups": 0, "reg_dec_producer": 0, "reg_inc_consumer": 0}, "(4, 28672, 4096, 4096, 1)": {"BLOCK_SIZE_M": 16, "BLOCK_SIZE_N": 32, "BLOCK_SIZE_K": 256, "GROUP_SIZE_M": 8, "SPLIT_K": 1, "A_load_order": 2, "meta_evict_policy": "", "atomic_mode": "relaxed", "num_warps": 4, "num_ctas": 1, "num_stages": 4, "num_buffers_warp_spec": 0, "num_consumer_groups": 0, "reg_dec_producer": 0, "reg_inc_consumer": 0}, "(4, 4096, 14336, 14336, 1)": {"BLOCK_SIZE_M": 16, "BLOCK_SIZE_N": 32, "BLOCK_SIZE_K": 256, "GROUP_SIZE_M": 8, "SPLIT_K": 1, "A_load_order": 0, "meta_evict_policy": "", "atomic_mode": "relaxed", "num_warps": 4, "num_ctas": 1, "num_stages": 4, "num_buffers_warp_spec": 0, "num_consumer_groups": 0, "reg_dec_producer": 0, "reg_inc_consumer": 0}, "(2, 6144, 4096, 4096, 1)": {"BLOCK_SIZE_M": 16, "BLOCK_SIZE_N": 32, "BLOCK_SIZE_K": 256, "GROUP_SIZE_M": 8, "SPLIT_K": 1, "A_load_order": 0, "meta_evict_policy": "", "atomic_mode": "relaxed", "num_warps": 4, "num_ctas": 1, "num_stages": 2, "num_buffers_warp_spec": 0, "num_consumer_groups": 0, "reg_dec_producer": 0, "reg_inc_consumer": 0}, "(2, 4096, 4096, 4096, 1)": {"BLOCK_SIZE_M": 16, "BLOCK_SIZE_N": 64, "BLOCK_SIZE_K": 256, "GROUP_SIZE_M": 8, "SPLIT_K": 1, "A_load_order": 2, "meta_evict_policy": "", "atomic_mode": "relaxed", "num_warps": 4, "num_ctas": 1, "num_stages": 2, "num_buffers_warp_spec": 0, "num_consumer_groups": 0, "reg_dec_producer": 0, "reg_inc_consumer": 0}, "(2, 28672, 4096, 4096, 1)": {"BLOCK_SIZE_M": 16, "BLOCK_SIZE_N": 32, "BLOCK_SIZE_K": 256, "GROUP_SIZE_M": 8, "SPLIT_K": 1, "A_load_order": 2, "meta_evict_policy": "", "atomic_mode": "relaxed", "num_warps": 4, "num_ctas": 1, "num_stages": 4, "num_buffers_warp_spec": 0, "num_consumer_groups": 0, "reg_dec_producer": 0, "reg_inc_consumer": 0}, "(2, 4096, 14336, 14336, 1)": {"BLOCK_SIZE_M": 16, "BLOCK_SIZE_N": 32, "BLOCK_SIZE_K": 256, "GROUP_SIZE_M": 8, "SPLIT_K": 1, "A_load_order": 0, "meta_evict_policy": "", "atomic_mode": "relaxed", "num_warps": 4, "num_ctas": 1, "num_stages": 4, "num_buffers_warp_spec": 0, "num_consumer_groups": 0, "reg_dec_producer": 0, "reg_inc_consumer": 0}, "(64, 6144, 4096, 128, 8)": {"BLOCK_SIZE_M": 32, "BLOCK_SIZE_N": 64, "BLOCK_SIZE_K": 64, "GROUP_SIZE_M": 8, "SPLIT_K": 8, "A_load_order": 2, "meta_evict_policy": "", "atomic_mode": "relaxed", "num_warps": 4, "num_ctas": 1, "num_stages": 1, "num_buffers_warp_spec": 0, "num_consumer_groups": 0, "reg_dec_producer": 0, "reg_inc_consumer": 0}, "(64, 4096, 4096, 128, 8)": {"BLOCK_SIZE_M": 32, "BLOCK_SIZE_N": 64, "BLOCK_SIZE_K": 64, "GROUP_SIZE_M": 8, "SPLIT_K": 8, "A_load_order": 0, "meta_evict_policy": "", "atomic_mode": "relaxed", "num_warps": 4, "num_ctas": 1, "num_stages": 1, "num_buffers_warp_spec": 0, "num_consumer_groups": 0, "reg_dec_producer": 0, "reg_inc_consumer": 0}, "(64, 28672, 4096, 128, 8)": {"BLOCK_SIZE_M": 32, "BLOCK_SIZE_N": 64, "BLOCK_SIZE_K": 128, "GROUP_SIZE_M": 8, "SPLIT_K": 1, "A_load_order": 2, "meta_evict_policy": "", "atomic_mode": "relaxed", "num_warps": 4, "num_ctas": 1, "num_stages": 1, "num_buffers_warp_spec": 0, "num_consumer_groups": 0, "reg_dec_producer": 0, "reg_inc_consumer": 0}, "(64, 4096, 14336, 128, 8)": {"BLOCK_SIZE_M": 32, "BLOCK_SIZE_N": 64, "BLOCK_SIZE_K": 64, "GROUP_SIZE_M": 8, "SPLIT_K": 8, "A_load_order": 0, "meta_evict_policy": "", "atomic_mode": "relaxed", "num_warps": 4, "num_ctas": 1, "num_stages": 1, "num_buffers_warp_spec": 0, "num_consumer_groups": 0, "reg_dec_producer": 0, "reg_inc_consumer": 0}, "(32, 6144, 4096, 128, 8)": {"BLOCK_SIZE_M": 32, "BLOCK_SIZE_N": 64, "BLOCK_SIZE_K": 64, "GROUP_SIZE_M": 8, "SPLIT_K": 4, "A_load_order": 2, "meta_evict_policy": "", "atomic_mode": "relaxed", "num_warps": 4, "num_ctas": 1, "num_stages": 1, "num_buffers_warp_spec": 0, "num_consumer_groups": 0, "reg_dec_producer": 0, "reg_inc_consumer": 0}, "(32, 4096, 4096, 128, 8)": {"BLOCK_SIZE_M": 32, "BLOCK_SIZE_N": 64, "BLOCK_SIZE_K": 64, "GROUP_SIZE_M": 8, "SPLIT_K": 8, "A_load_order": 0, "meta_evict_policy": "", "atomic_mode": "relaxed", "num_warps": 4, "num_ctas": 1, "num_stages": 1, "num_buffers_warp_spec": 0, "num_consumer_groups": 0, "reg_dec_producer": 0, "reg_inc_consumer": 0}, "(32, 28672, 4096, 128, 8)": {"BLOCK_SIZE_M": 32, "BLOCK_SIZE_N": 64, "BLOCK_SIZE_K": 64, "GROUP_SIZE_M": 8, "SPLIT_K": 4, "A_load_order": 2, "meta_evict_policy": "", "atomic_mode": "relaxed", "num_warps": 4, "num_ctas": 1, "num_stages": 1, "num_buffers_warp_spec": 0, "num_consumer_groups": 0, "reg_dec_producer": 0, "reg_inc_consumer": 0}, "(32, 4096, 14336, 128, 8)": {"BLOCK_SIZE_M": 32, "BLOCK_SIZE_N": 64, "BLOCK_SIZE_K": 64, "GROUP_SIZE_M": 8, "SPLIT_K": 8, "A_load_order": 0, "meta_evict_policy": "", "atomic_mode": "relaxed", "num_warps": 4, "num_ctas": 1, "num_stages": 1, "num_buffers_warp_spec": 0, "num_consumer_groups": 0, "reg_dec_producer": 0, "reg_inc_consumer": 0}, "(16, 6144, 4096, 128, 8)": {"BLOCK_SIZE_M": 16, "BLOCK_SIZE_N": 64, "BLOCK_SIZE_K": 32, "GROUP_SIZE_M": 8, "SPLIT_K": 8, "A_load_order": 2, "meta_evict_policy": "", "atomic_mode": "relaxed", "num_warps": 4, "num_ctas": 1, "num_stages": 1, "num_buffers_warp_spec": 0, "num_consumer_groups": 0, "reg_dec_producer": 0, "reg_inc_consumer": 0}, "(16, 4096, 4096, 128, 8)": {"BLOCK_SIZE_M": 16, "BLOCK_SIZE_N": 64, "BLOCK_SIZE_K": 64, "GROUP_SIZE_M": 8, "SPLIT_K": 8, "A_load_order": 2, "meta_evict_policy": "", "atomic_mode": "relaxed", "num_warps": 4, "num_ctas": 1, "num_stages": 1, "num_buffers_warp_spec": 0, "num_consumer_groups": 0, "reg_dec_producer": 0, "reg_inc_consumer": 0}, "(16, 28672, 4096, 128, 8)": {"BLOCK_SIZE_M": 16, "BLOCK_SIZE_N": 64, "BLOCK_SIZE_K": 64, "GROUP_SIZE_M": 8, "SPLIT_K": 8, "A_load_order": 2, "meta_evict_policy": "", "atomic_mode": "relaxed", "num_warps": 4, "num_ctas": 1, "num_stages": 1, "num_buffers_warp_spec": 0, "num_consumer_groups": 0, "reg_dec_producer": 0, "reg_inc_consumer": 0}, "(16, 4096, 14336, 128, 8)": {"BLOCK_SIZE_M": 16, "BLOCK_SIZE_N": 64, "BLOCK_SIZE_K": 64, "GROUP_SIZE_M": 8, "SPLIT_K": 8, "A_load_order": 2, "meta_evict_policy": "", "atomic_mode": "relaxed", "num_warps": 4, "num_ctas": 1, "num_stages": 1, "num_buffers_warp_spec": 0, "num_consumer_groups": 0, "reg_dec_producer": 0, "reg_inc_consumer": 0}, "(8, 6144, 4096, 128, 8)": {"BLOCK_SIZE_M": 16, "BLOCK_SIZE_N": 64, "BLOCK_SIZE_K": 32, "GROUP_SIZE_M": 8, "SPLIT_K": 8, "A_load_order": 2, "meta_evict_policy": "", "atomic_mode": "relaxed", "num_warps": 4, "num_ctas": 1, "num_stages": 1, "num_buffers_warp_spec": 0, "num_consumer_groups": 0, "reg_dec_producer": 0, "reg_inc_consumer": 0}, "(8, 4096, 4096, 128, 8)": {"BLOCK_SIZE_M": 16, "BLOCK_SIZE_N": 64, "BLOCK_SIZE_K": 64, "GROUP_SIZE_M": 8, "SPLIT_K": 8, "A_load_order": 2, "meta_evict_policy": "", "atomic_mode": "relaxed", "num_warps": 4, "num_ctas": 1, "num_stages": 1, "num_buffers_warp_spec": 0, "num_consumer_groups": 0, "reg_dec_producer": 0, "reg_inc_consumer": 0}, "(8, 28672, 4096, 128, 8)": {"BLOCK_SIZE_M": 16, "BLOCK_SIZE_N": 64, "BLOCK_SIZE_K": 64, "GROUP_SIZE_M": 8, "SPLIT_K": 16, "A_load_order": 2, "meta_evict_policy": "", "atomic_mode": "relaxed", "num_warps": 4, "num_ctas": 1, "num_stages": 1, "num_buffers_warp_spec": 0, "num_consumer_groups": 0, "reg_dec_producer": 0, "reg_inc_consumer": 0}, "(8, 4096, 14336, 128, 8)": {"BLOCK_SIZE_M": 16, "BLOCK_SIZE_N": 64, "BLOCK_SIZE_K": 64, "GROUP_SIZE_M": 8, "SPLIT_K": 8, "A_load_order": 2, "meta_evict_policy": "", "atomic_mode": "relaxed", "num_warps": 4, "num_ctas": 1, "num_stages": 1, "num_buffers_warp_spec": 0, "num_consumer_groups": 0, "reg_dec_producer": 0, "reg_inc_consumer": 0}, "(4, 6144, 4096, 128, 8)": {"BLOCK_SIZE_M": 16, "BLOCK_SIZE_N": 64, "BLOCK_SIZE_K": 32, "GROUP_SIZE_M": 8, "SPLIT_K": 8, "A_load_order": 2, "meta_evict_policy": "", "atomic_mode": "relaxed", "num_warps": 4, "num_ctas": 1, "num_stages": 1, "num_buffers_warp_spec": 0, "num_consumer_groups": 0, "reg_dec_producer": 0, "reg_inc_consumer": 0}, "(4, 4096, 4096, 128, 8)": {"BLOCK_SIZE_M": 16, "BLOCK_SIZE_N": 64, "BLOCK_SIZE_K": 64, "GROUP_SIZE_M": 8, "SPLIT_K": 8, "A_load_order": 2, "meta_evict_policy": "", "atomic_mode": "relaxed", "num_warps": 4, "num_ctas": 1, "num_stages": 1, "num_buffers_warp_spec": 0, "num_consumer_groups": 0, "reg_dec_producer": 0, "reg_inc_consumer": 0}, "(4, 28672, 4096, 128, 8)": {"BLOCK_SIZE_M": 16, "BLOCK_SIZE_N": 64, "BLOCK_SIZE_K": 64, "GROUP_SIZE_M": 8, "SPLIT_K": 16, "A_load_order": 2, "meta_evict_policy": "", "atomic_mode": "relaxed", "num_warps": 4, "num_ctas": 1, "num_stages": 1, "num_buffers_warp_spec": 0, "num_consumer_groups": 0, "reg_dec_producer": 0, "reg_inc_consumer": 0}, "(4, 4096, 14336, 128, 8)": {"BLOCK_SIZE_M": 16, "BLOCK_SIZE_N": 64, "BLOCK_SIZE_K": 64, "GROUP_SIZE_M": 8, "SPLIT_K": 8, "A_load_order": 2, "meta_evict_policy": "", "atomic_mode": "relaxed", "num_warps": 4, "num_ctas": 1, "num_stages": 1, "num_buffers_warp_spec": 0, "num_consumer_groups": 0, "reg_dec_producer": 0, "reg_inc_consumer": 0}, "(2, 6144, 4096, 128, 8)": {"BLOCK_SIZE_M": 16, "BLOCK_SIZE_N": 64, "BLOCK_SIZE_K": 32, "GROUP_SIZE_M": 8, "SPLIT_K": 8, "A_load_order": 2, "meta_evict_policy": "", "atomic_mode": "relaxed", "num_warps": 4, "num_ctas": 1, "num_stages": 1, "num_buffers_warp_spec": 0, "num_consumer_groups": 0, "reg_dec_producer": 0, "reg_inc_consumer": 0}, "(2, 4096, 4096, 128, 8)": {"BLOCK_SIZE_M": 16, "BLOCK_SIZE_N": 64, "BLOCK_SIZE_K": 64, "GROUP_SIZE_M": 8, "SPLIT_K": 8, "A_load_order": 2, "meta_evict_policy": "", "atomic_mode": "relaxed", "num_warps": 4, "num_ctas": 1, "num_stages": 1, "num_buffers_warp_spec": 0, "num_consumer_groups": 0, "reg_dec_producer": 0, "reg_inc_consumer": 0}, "(2, 28672, 4096, 128, 8)": {"BLOCK_SIZE_M": 16, "BLOCK_SIZE_N": 64, "BLOCK_SIZE_K": 64, "GROUP_SIZE_M": 8, "SPLIT_K": 16, "A_load_order": 2, "meta_evict_policy": "", "atomic_mode": "relaxed", "num_warps": 4, "num_ctas": 1, "num_stages": 1, "num_buffers_warp_spec": 0, "num_consumer_groups": 0, "reg_dec_producer": 0, "reg_inc_consumer": 0}, "(2, 4096, 14336, 128, 8)": {"BLOCK_SIZE_M": 16, "BLOCK_SIZE_N": 64, "BLOCK_SIZE_K": 64, "GROUP_SIZE_M": 8, "SPLIT_K": 8, "A_load_order": 2, "meta_evict_policy": "", "atomic_mode": "relaxed", "num_warps": 4, "num_ctas": 1, "num_stages": 1, "num_buffers_warp_spec": 0, "num_consumer_groups": 0, "reg_dec_producer": 0, "reg_inc_consumer": 0}, "(64, 2560, 2048, 128, 8)": {"BLOCK_SIZE_M": 32, "BLOCK_SIZE_N": 64, "BLOCK_SIZE_K": 64, "GROUP_SIZE_M": 8, "SPLIT_K": 4, "A_load_order": 2, "meta_evict_policy": "", "atomic_mode": "relaxed", "num_warps": 4, "num_ctas": 1, "num_stages": 1, "num_buffers_warp_spec": 0, "num_consumer_groups": 0, "reg_dec_producer": 0, "reg_inc_consumer": 0}, "(64, 2048, 2048, 128, 8)": {"BLOCK_SIZE_M": 32, "BLOCK_SIZE_N": 64, "BLOCK_SIZE_K": 64, "GROUP_SIZE_M": 8, "SPLIT_K": 4, "A_load_order": 2, "meta_evict_policy": "", "atomic_mode": "relaxed", "num_warps": 4, "num_ctas": 1, "num_stages": 1, "num_buffers_warp_spec": 0, "num_consumer_groups": 0, "reg_dec_producer": 0, "reg_inc_consumer": 0}, "(64, 22016, 2048, 128, 8)": {"BLOCK_SIZE_M": 32, "BLOCK_SIZE_N": 64, "BLOCK_SIZE_K": 64, "GROUP_SIZE_M": 8, "SPLIT_K": 1, "A_load_order": 2, "meta_evict_policy": "", "atomic_mode": "relaxed", "num_warps": 4, "num_ctas": 1, "num_stages": 1, "num_buffers_warp_spec": 0, "num_consumer_groups": 0, "reg_dec_producer": 0, "reg_inc_consumer": 0}, "(64, 2048, 11008, 128, 8)": {"BLOCK_SIZE_M": 32, "BLOCK_SIZE_N": 64, "BLOCK_SIZE_K": 32, "GROUP_SIZE_M": 8, "SPLIT_K": 8, "A_load_order": 2, "meta_evict_policy": "", "atomic_mode": "relaxed", "num_warps": 4, "num_ctas": 1, "num_stages": 1, "num_buffers_warp_spec": 0, "num_consumer_groups": 0, "reg_dec_producer": 0, "reg_inc_consumer": 0}, "(32, 2560, 2048, 128, 8)": {"BLOCK_SIZE_M": 32, "BLOCK_SIZE_N": 32, "BLOCK_SIZE_K": 128, "GROUP_SIZE_M": 8, "SPLIT_K": 4, "A_load_order": 2, "meta_evict_policy": "", "atomic_mode": "relaxed", "num_warps": 4, "num_ctas": 1, "num_stages": 1, "num_buffers_warp_spec": 0, "num_consumer_groups": 0, "reg_dec_producer": 0, "reg_inc_consumer": 0}, "(32, 2048, 2048, 128, 8)": {"BLOCK_SIZE_M": 32, "BLOCK_SIZE_N": 64, "BLOCK_SIZE_K": 64, "GROUP_SIZE_M": 8, "SPLIT_K": 8, "A_load_order": 2, "meta_evict_policy": "", "atomic_mode": "relaxed", "num_warps": 4, "num_ctas": 1, "num_stages": 1, "num_buffers_warp_spec": 0, "num_consumer_groups": 0, "reg_dec_producer": 0, "reg_inc_consumer": 0}, "(32, 22016, 2048, 128, 8)": {"BLOCK_SIZE_M": 32, "BLOCK_SIZE_N": 64, "BLOCK_SIZE_K": 64, "GROUP_SIZE_M": 8, "SPLIT_K": 1, "A_load_order": 2, "meta_evict_policy": "", "atomic_mode": "relaxed", "num_warps": 4, "num_ctas": 1, "num_stages": 1, "num_buffers_warp_spec": 0, "num_consumer_groups": 0, "reg_dec_producer": 0, "reg_inc_consumer": 0}, "(32, 2048, 11008, 128, 8)": {"BLOCK_SIZE_M": 32, "BLOCK_SIZE_N": 64, "BLOCK_SIZE_K": 32, "GROUP_SIZE_M": 8, "SPLIT_K": 8, "A_load_order": 2, "meta_evict_policy": "", "atomic_mode": "relaxed", "num_warps": 8, "num_ctas": 1, "num_stages": 1, "num_buffers_warp_spec": 0, "num_consumer_groups": 0, "reg_dec_producer": 0, "reg_inc_consumer": 0}, "(16, 2560, 2048, 128, 8)": {"BLOCK_SIZE_M": 16, "BLOCK_SIZE_N": 64, "BLOCK_SIZE_K": 32, "GROUP_SIZE_M": 8, "SPLIT_K": 8, "A_load_order": 2, "meta_evict_policy": "", "atomic_mode": "relaxed", "num_warps": 8, "num_ctas": 1, "num_stages": 1, "num_buffers_warp_spec": 0, "num_consumer_groups": 0, "reg_dec_producer": 0, "reg_inc_consumer": 0}, "(16, 2048, 2048, 128, 8)": {"BLOCK_SIZE_M": 16, "BLOCK_SIZE_N": 64, "BLOCK_SIZE_K": 64, "GROUP_SIZE_M": 8, "SPLIT_K": 8, "A_load_order": 2, "meta_evict_policy": "", "atomic_mode": "relaxed", "num_warps": 4, "num_ctas": 1, "num_stages": 1, "num_buffers_warp_spec": 0, "num_consumer_groups": 0, "reg_dec_producer": 0, "reg_inc_consumer": 0}, "(16, 22016, 2048, 128, 8)": {"BLOCK_SIZE_M": 16, "BLOCK_SIZE_N": 64, "BLOCK_SIZE_K": 64, "GROUP_SIZE_M": 8, "SPLIT_K": 8, "A_load_order": 2, "meta_evict_policy": "", "atomic_mode": "relaxed", "num_warps": 4, "num_ctas": 1, "num_stages": 1, "num_buffers_warp_spec": 0, "num_consumer_groups": 0, "reg_dec_producer": 0, "reg_inc_consumer": 0}, "(16, 2048, 11008, 128, 8)": {"BLOCK_SIZE_M": 16, "BLOCK_SIZE_N": 32, "BLOCK_SIZE_K": 32, "GROUP_SIZE_M": 8, "SPLIT_K": 8, "A_load_order": 2, "meta_evict_policy": "", "atomic_mode": "relaxed", "num_warps": 4, "num_ctas": 1, "num_stages": 1, "num_buffers_warp_spec": 0, "num_consumer_groups": 0, "reg_dec_producer": 0, "reg_inc_consumer": 0}, "(8, 2560, 2048, 128, 8)": {"BLOCK_SIZE_M": 16, "BLOCK_SIZE_N": 64, "BLOCK_SIZE_K": 64, "GROUP_SIZE_M": 8, "SPLIT_K": 16, "A_load_order": 2, "meta_evict_policy": "", "atomic_mode": "relaxed", "num_warps": 4, "num_ctas": 1, "num_stages": 1, "num_buffers_warp_spec": 0, "num_consumer_groups": 0, "reg_dec_producer": 0, "reg_inc_consumer": 0}, "(8, 2048, 2048, 128, 8)": {"BLOCK_SIZE_M": 16, "BLOCK_SIZE_N": 64, "BLOCK_SIZE_K": 64, "GROUP_SIZE_M": 8, "SPLIT_K": 16, "A_load_order": 0, "meta_evict_policy": "", "atomic_mode": "relaxed", "num_warps": 4, "num_ctas": 1, "num_stages": 1, "num_buffers_warp_spec": 0, "num_consumer_groups": 0, "reg_dec_producer": 0, "reg_inc_consumer": 0}, "(8, 22016, 2048, 128, 8)": {"BLOCK_SIZE_M": 16, "BLOCK_SIZE_N": 64, "BLOCK_SIZE_K": 64, "GROUP_SIZE_M": 8, "SPLIT_K": 8, "A_load_order": 2, "meta_evict_policy": "", "atomic_mode": "relaxed", "num_warps": 4, "num_ctas": 1, "num_stages": 1, "num_buffers_warp_spec": 0, "num_consumer_groups": 0, "reg_dec_producer": 0, "reg_inc_consumer": 0}, "(8, 2048, 11008, 128, 8)": {"BLOCK_SIZE_M": 16, "BLOCK_SIZE_N": 32, "BLOCK_SIZE_K": 32, "GROUP_SIZE_M": 8, "SPLIT_K": 8, "A_load_order": 2, "meta_evict_policy": "", "atomic_mode": "relaxed", "num_warps": 4, "num_ctas": 1, "num_stages": 1, "num_buffers_warp_spec": 0, "num_consumer_groups": 0, "reg_dec_producer": 0, "reg_inc_consumer": 0}, "(4, 2560, 2048, 128, 8)": {"BLOCK_SIZE_M": 16, "BLOCK_SIZE_N": 64, "BLOCK_SIZE_K": 64, "GROUP_SIZE_M": 8, "SPLIT_K": 16, "A_load_order": 2, "meta_evict_policy": "", "atomic_mode": "relaxed", "num_warps": 4, "num_ctas": 1, "num_stages": 1, "num_buffers_warp_spec": 0, "num_consumer_groups": 0, "reg_dec_producer": 0, "reg_inc_consumer": 0}, "(4, 2048, 2048, 128, 8)": {"BLOCK_SIZE_M": 16, "BLOCK_SIZE_N": 64, "BLOCK_SIZE_K": 64, "GROUP_SIZE_M": 8, "SPLIT_K": 16, "A_load_order": 2, "meta_evict_policy": "", "atomic_mode": "relaxed", "num_warps": 4, "num_ctas": 1, "num_stages": 1, "num_buffers_warp_spec": 0, "num_consumer_groups": 0, "reg_dec_producer": 0, "reg_inc_consumer": 0}, "(4, 22016, 2048, 128, 8)": {"BLOCK_SIZE_M": 16, "BLOCK_SIZE_N": 64, "BLOCK_SIZE_K": 64, "GROUP_SIZE_M": 8, "SPLIT_K": 16, "A_load_order": 2, "meta_evict_policy": "", "atomic_mode": "relaxed", "num_warps": 4, "num_ctas": 1, "num_stages": 1, "num_buffers_warp_spec": 0, "num_consumer_groups": 0, "reg_dec_producer": 0, "reg_inc_consumer": 0}, "(4, 2048, 11008, 128, 8)": {"BLOCK_SIZE_M": 16, "BLOCK_SIZE_N": 32, "BLOCK_SIZE_K": 32, "GROUP_SIZE_M": 8, "SPLIT_K": 8, "A_load_order": 2, "meta_evict_policy": "", "atomic_mode": "relaxed", "num_warps": 4, "num_ctas": 1, "num_stages": 1, "num_buffers_warp_spec": 0, "num_consumer_groups": 0, "reg_dec_producer": 0, "reg_inc_consumer": 0}, "(2, 2560, 2048, 128, 8)": {"BLOCK_SIZE_M": 16, "BLOCK_SIZE_N": 64, "BLOCK_SIZE_K": 64, "GROUP_SIZE_M": 8, "SPLIT_K": 16, "A_load_order": 2, "meta_evict_policy": "", "atomic_mode": "relaxed", "num_warps": 4, "num_ctas": 1, "num_stages": 1, "num_buffers_warp_spec": 0, "num_consumer_groups": 0, "reg_dec_producer": 0, "reg_inc_consumer": 0}, "(2, 2048, 2048, 128, 8)": {"BLOCK_SIZE_M": 16, "BLOCK_SIZE_N": 64, "BLOCK_SIZE_K": 64, "GROUP_SIZE_M": 8, "SPLIT_K": 16, "A_load_order": 2, "meta_evict_policy": "", "atomic_mode": "relaxed", "num_warps": 4, "num_ctas": 1, "num_stages": 1, "num_buffers_warp_spec": 0, "num_consumer_groups": 0, "reg_dec_producer": 0, "reg_inc_consumer": 0}, "(2, 22016, 2048, 128, 8)": {"BLOCK_SIZE_M": 16, "BLOCK_SIZE_N": 64, "BLOCK_SIZE_K": 64, "GROUP_SIZE_M": 8, "SPLIT_K": 8, "A_load_order": 2, "meta_evict_policy": "", "atomic_mode": "relaxed", "num_warps": 4, "num_ctas": 1, "num_stages": 1, "num_buffers_warp_spec": 0, "num_consumer_groups": 0, "reg_dec_producer": 0, "reg_inc_consumer": 0}, "(2, 2048, 11008, 128, 8)": {"BLOCK_SIZE_M": 16, "BLOCK_SIZE_N": 32, "BLOCK_SIZE_K": 32, "GROUP_SIZE_M": 8, "SPLIT_K": 8, "A_load_order": 2, "meta_evict_policy": "", "atomic_mode": "relaxed", "num_warps": 4, "num_ctas": 1, "num_stages": 1, "num_buffers_warp_spec": 0, "num_consumer_groups": 0, "reg_dec_producer": 0, "reg_inc_consumer": 0}, "(64, 2048, 1536, 128, 8)": {"BLOCK_SIZE_M": 32, "BLOCK_SIZE_N": 64, "BLOCK_SIZE_K": 64, "GROUP_SIZE_M": 8, "SPLIT_K": 4, "A_load_order": 2, "meta_evict_policy": "", "atomic_mode": "relaxed", "num_warps": 4, "num_ctas": 1, "num_stages": 1, "num_buffers_warp_spec": 0, "num_consumer_groups": 0, "reg_dec_producer": 0, "reg_inc_consumer": 0}, "(64, 1536, 1536, 128, 8)": {"BLOCK_SIZE_M": 32, "BLOCK_SIZE_N": 64, "BLOCK_SIZE_K": 64, "GROUP_SIZE_M": 8, "SPLIT_K": 8, "A_load_order": 2, "meta_evict_policy": "", "atomic_mode": "relaxed", "num_warps": 4, "num_ctas": 1, "num_stages": 1, "num_buffers_warp_spec": 0, "num_consumer_groups": 0, "reg_dec_producer": 0, "reg_inc_consumer": 0}, "(64, 17920, 1536, 128, 8)": {"BLOCK_SIZE_M": 32, "BLOCK_SIZE_N": 64, "BLOCK_SIZE_K": 32, "GROUP_SIZE_M": 8, "SPLIT_K": 1, "A_load_order": 2, "meta_evict_policy": "", "atomic_mode": "relaxed", "num_warps": 4, "num_ctas": 1, "num_stages": 1, "num_buffers_warp_spec": 0, "num_consumer_groups": 0, "reg_dec_producer": 0, "reg_inc_consumer": 0}, "(64, 1536, 8960, 128, 8)": {"BLOCK_SIZE_M": 32, "BLOCK_SIZE_N": 64, "BLOCK_SIZE_K": 32, "GROUP_SIZE_M": 8, "SPLIT_K": 8, "A_load_order": 2, "meta_evict_policy": "", "atomic_mode": "relaxed", "num_warps": 4, "num_ctas": 1, "num_stages": 1, "num_buffers_warp_spec": 0, "num_consumer_groups": 0, "reg_dec_producer": 0, "reg_inc_consumer": 0}, "(32, 2048, 1536, 128, 8)": {"BLOCK_SIZE_M": 32, "BLOCK_SIZE_N": 64, "BLOCK_SIZE_K": 64, "GROUP_SIZE_M": 8, "SPLIT_K": 8, "A_load_order": 2, "meta_evict_policy": "", "atomic_mode": "relaxed", "num_warps": 4, "num_ctas": 1, "num_stages": 1, "num_buffers_warp_spec": 0, "num_consumer_groups": 0, "reg_dec_producer": 0, "reg_inc_consumer": 0}, "(32, 1536, 1536, 128, 8)": {"BLOCK_SIZE_M": 32, "BLOCK_SIZE_N": 32, "BLOCK_SIZE_K": 64, "GROUP_SIZE_M": 8, "SPLIT_K": 8, "A_load_order": 0, "meta_evict_policy": "", "atomic_mode": "relaxed", "num_warps": 8, "num_ctas": 1, "num_stages": 1, "num_buffers_warp_spec": 0, "num_consumer_groups": 0, "reg_dec_producer": 0, "reg_inc_consumer": 0}, "(32, 17920, 1536, 128, 8)": {"BLOCK_SIZE_M": 32, "BLOCK_SIZE_N": 64, "BLOCK_SIZE_K": 64, "GROUP_SIZE_M": 8, "SPLIT_K": 1, "A_load_order": 2, "meta_evict_policy": "", "atomic_mode": "relaxed", "num_warps": 4, "num_ctas": 1, "num_stages": 1, "num_buffers_warp_spec": 0, "num_consumer_groups": 0, "reg_dec_producer": 0, "reg_inc_consumer": 0}, "(32, 1536, 8960, 128, 8)": {"BLOCK_SIZE_M": 32, "BLOCK_SIZE_N": 64, "BLOCK_SIZE_K": 32, "GROUP_SIZE_M": 8, "SPLIT_K": 8, "A_load_order": 2, "meta_evict_policy": "", "atomic_mode": "relaxed", "num_warps": 8, "num_ctas": 1, "num_stages": 1, "num_buffers_warp_spec": 0, "num_consumer_groups": 0, "reg_dec_producer": 0, "reg_inc_consumer": 0}, "(16, 2048, 1536, 128, 8)": {"BLOCK_SIZE_M": 16, "BLOCK_SIZE_N": 64, "BLOCK_SIZE_K": 64, "GROUP_SIZE_M": 8, "SPLIT_K": 8, "A_load_order": 2, "meta_evict_policy": "", "atomic_mode": "relaxed", "num_warps": 4, "num_ctas": 1, "num_stages": 1, "num_buffers_warp_spec": 0, "num_consumer_groups": 0, "reg_dec_producer": 0, "reg_inc_consumer": 0}, "(16, 1536, 1536, 128, 8)": {"BLOCK_SIZE_M": 16, "BLOCK_SIZE_N": 64, "BLOCK_SIZE_K": 32, "GROUP_SIZE_M": 8, "SPLIT_K": 16, "A_load_order": 2, "meta_evict_policy": "", "atomic_mode": "relaxed", "num_warps": 8, "num_ctas": 1, "num_stages": 1, "num_buffers_warp_spec": 0, "num_consumer_groups": 0, "reg_dec_producer": 0, "reg_inc_consumer": 0}, "(16, 17920, 1536, 128, 8)": {"BLOCK_SIZE_M": 16, "BLOCK_SIZE_N": 64, "BLOCK_SIZE_K": 64, "GROUP_SIZE_M": 8, "SPLIT_K": 2, "A_load_order": 2, "meta_evict_policy": "", "atomic_mode": "relaxed", "num_warps": 4, "num_ctas": 1, "num_stages": 1, "num_buffers_warp_spec": 0, "num_consumer_groups": 0, "reg_dec_producer": 0, "reg_inc_consumer": 0}, "(16, 1536, 8960, 128, 8)": {"BLOCK_SIZE_M": 16, "BLOCK_SIZE_N": 32, "BLOCK_SIZE_K": 32, "GROUP_SIZE_M": 8, "SPLIT_K": 8, "A_load_order": 2, "meta_evict_policy": "", "atomic_mode": "relaxed", "num_warps": 4, "num_ctas": 1, "num_stages": 1, "num_buffers_warp_spec": 0, "num_consumer_groups": 0, "reg_dec_producer": 0, "reg_inc_consumer": 0}, "(8, 2048, 1536, 128, 8)": {"BLOCK_SIZE_M": 16, "BLOCK_SIZE_N": 64, "BLOCK_SIZE_K": 64, "GROUP_SIZE_M": 8, "SPLIT_K": 8, "A_load_order": 2, "meta_evict_policy": "", "atomic_mode": "relaxed", "num_warps": 4, "num_ctas": 1, "num_stages": 1, "num_buffers_warp_spec": 0, "num_consumer_groups": 0, "reg_dec_producer": 0, "reg_inc_consumer": 0}, "(8, 1536, 1536, 128, 8)": {"BLOCK_SIZE_M": 16, "BLOCK_SIZE_N": 64, "BLOCK_SIZE_K": 32, "GROUP_SIZE_M": 8, "SPLIT_K": 16, "A_load_order": 0, "meta_evict_policy": "", "atomic_mode": "relaxed", "num_warps": 8, "num_ctas": 1, "num_stages": 1, "num_buffers_warp_spec": 0, "num_consumer_groups": 0, "reg_dec_producer": 0, "reg_inc_consumer": 0}, "(8, 17920, 1536, 128, 8)": {"BLOCK_SIZE_M": 16, "BLOCK_SIZE_N": 64, "BLOCK_SIZE_K": 64, "GROUP_SIZE_M": 8, "SPLIT_K": 2, "A_load_order": 2, "meta_evict_policy": "", "atomic_mode": "relaxed", "num_warps": 4, "num_ctas": 1, "num_stages": 1, "num_buffers_warp_spec": 0, "num_consumer_groups": 0, "reg_dec_producer": 0, "reg_inc_consumer": 0}, "(8, 1536, 8960, 128, 8)": {"BLOCK_SIZE_M": 16, "BLOCK_SIZE_N": 32, "BLOCK_SIZE_K": 32, "GROUP_SIZE_M": 8, "SPLIT_K": 8, "A_load_order": 2, "meta_evict_policy": "", "atomic_mode": "relaxed", "num_warps": 4, "num_ctas": 1, "num_stages": 1, "num_buffers_warp_spec": 0, "num_consumer_groups": 0, "reg_dec_producer": 0, "reg_inc_consumer": 0}, "(4, 2048, 1536, 128, 8)": {"BLOCK_SIZE_M": 16, "BLOCK_SIZE_N": 64, "BLOCK_SIZE_K": 32, "GROUP_SIZE_M": 8, "SPLIT_K": 16, "A_load_order": 0, "meta_evict_policy": "", "atomic_mode": "relaxed", "num_warps": 4, "num_ctas": 1, "num_stages": 1, "num_buffers_warp_spec": 0, "num_consumer_groups": 0, "reg_dec_producer": 0, "reg_inc_consumer": 0}, "(4, 1536, 1536, 128, 8)": {"BLOCK_SIZE_M": 16, "BLOCK_SIZE_N": 32, "BLOCK_SIZE_K": 32, "GROUP_SIZE_M": 8, "SPLIT_K": 16, "A_load_order": 0, "meta_evict_policy": "", "atomic_mode": "relaxed", "num_warps": 4, "num_ctas": 1, "num_stages": 1, "num_buffers_warp_spec": 0, "num_consumer_groups": 0, "reg_dec_producer": 0, "reg_inc_consumer": 0}, "(4, 17920, 1536, 128, 8)": {"BLOCK_SIZE_M": 16, "BLOCK_SIZE_N": 64, "BLOCK_SIZE_K": 64, "GROUP_SIZE_M": 8, "SPLIT_K": 2, "A_load_order": 2, "meta_evict_policy": "", "atomic_mode": "relaxed", "num_warps": 4, "num_ctas": 1, "num_stages": 1, "num_buffers_warp_spec": 0, "num_consumer_groups": 0, "reg_dec_producer": 0, "reg_inc_consumer": 0}, "(4, 1536, 8960, 128, 8)": {"BLOCK_SIZE_M": 16, "BLOCK_SIZE_N": 32, "BLOCK_SIZE_K": 32, "GROUP_SIZE_M": 8, "SPLIT_K": 8, "A_load_order": 2, "meta_evict_policy": "", "atomic_mode": "relaxed", "num_warps": 4, "num_ctas": 1, "num_stages": 1, "num_buffers_warp_spec": 0, "num_consumer_groups": 0, "reg_dec_producer": 0, "reg_inc_consumer": 0}, "(2, 2048, 1536, 128, 8)": {"BLOCK_SIZE_M": 16, "BLOCK_SIZE_N": 64, "BLOCK_SIZE_K": 32, "GROUP_SIZE_M": 8, "SPLIT_K": 16, "A_load_order": 0, "meta_evict_policy": "", "atomic_mode": "relaxed", "num_warps": 4, "num_ctas": 1, "num_stages": 1, "num_buffers_warp_spec": 0, "num_consumer_groups": 0, "reg_dec_producer": 0, "reg_inc_consumer": 0}, "(2, 1536, 1536, 128, 8)": {"BLOCK_SIZE_M": 16, "BLOCK_SIZE_N": 32, "BLOCK_SIZE_K": 32, "GROUP_SIZE_M": 8, "SPLIT_K": 16, "A_load_order": 0, "meta_evict_policy": "", "atomic_mode": "relaxed", "num_warps": 4, "num_ctas": 1, "num_stages": 1, "num_buffers_warp_spec": 0, "num_consumer_groups": 0, "reg_dec_producer": 0, "reg_inc_consumer": 0}, "(2, 17920, 1536, 128, 8)": {"BLOCK_SIZE_M": 16, "BLOCK_SIZE_N": 64, "BLOCK_SIZE_K": 64, "GROUP_SIZE_M": 8, "SPLIT_K": 2, "A_load_order": 2, "meta_evict_policy": "", "atomic_mode": "relaxed", "num_warps": 4, "num_ctas": 1, "num_stages": 1, "num_buffers_warp_spec": 0, "num_consumer_groups": 0, "reg_dec_producer": 0, "reg_inc_consumer": 0}, "(2, 1536, 8960, 128, 8)": {"BLOCK_SIZE_M": 16, "BLOCK_SIZE_N": 32, "BLOCK_SIZE_K": 32, "GROUP_SIZE_M": 8, "SPLIT_K": 8, "A_load_order": 2, "meta_evict_policy": "", "atomic_mode": "relaxed", "num_warps": 4, "num_ctas": 1, "num_stages": 1, "num_buffers_warp_spec": 0, "num_consumer_groups": 0, "reg_dec_producer": 0, "reg_inc_consumer": 0}, "(64, 4608, 3584, 128, 8)": {"BLOCK_SIZE_M": 32, "BLOCK_SIZE_N": 64, "BLOCK_SIZE_K": 64, "GROUP_SIZE_M": 8, "SPLIT_K": 4, "A_load_order": 0, "meta_evict_policy": "", "atomic_mode": "relaxed", "num_warps": 4, "num_ctas": 1, "num_stages": 1, "num_buffers_warp_spec": 0, "num_consumer_groups": 0, "reg_dec_producer": 0, "reg_inc_consumer": 0}, "(64, 3584, 3584, 128, 8)": {"BLOCK_SIZE_M": 32, "BLOCK_SIZE_N": 64, "BLOCK_SIZE_K": 64, "GROUP_SIZE_M": 8, "SPLIT_K": 4, "A_load_order": 0, "meta_evict_policy": "", "atomic_mode": "relaxed", "num_warps": 4, "num_ctas": 1, "num_stages": 1, "num_buffers_warp_spec": 0, "num_consumer_groups": 0, "reg_dec_producer": 0, "reg_inc_consumer": 0}, "(64, 37888, 3584, 128, 8)": {"BLOCK_SIZE_M": 32, "BLOCK_SIZE_N": 64, "BLOCK_SIZE_K": 64, "GROUP_SIZE_M": 8, "SPLIT_K": 1, "A_load_order": 2, "meta_evict_policy": "", "atomic_mode": "relaxed", "num_warps": 4, "num_ctas": 1, "num_stages": 1, "num_buffers_warp_spec": 0, "num_consumer_groups": 0, "reg_dec_producer": 0, "reg_inc_consumer": 0}, "(64, 3584, 18944, 128, 8)": {"BLOCK_SIZE_M": 32, "BLOCK_SIZE_N": 64, "BLOCK_SIZE_K": 64, "GROUP_SIZE_M": 8, "SPLIT_K": 8, "A_load_order": 0, "meta_evict_policy": "", "atomic_mode": "relaxed", "num_warps": 4, "num_ctas": 1, "num_stages": 1, "num_buffers_warp_spec": 0, "num_consumer_groups": 0, "reg_dec_producer": 0, "reg_inc_consumer": 0}, "(32, 4608, 3584, 128, 8)": {"BLOCK_SIZE_M": 32, "BLOCK_SIZE_N": 64, "BLOCK_SIZE_K": 64, "GROUP_SIZE_M": 8, "SPLIT_K": 8, "A_load_order": 0, "meta_evict_policy": "", "atomic_mode": "relaxed", "num_warps": 4, "num_ctas": 1, "num_stages": 1, "num_buffers_warp_spec": 0, "num_consumer_groups": 0, "reg_dec_producer": 0, "reg_inc_consumer": 0}, "(32, 3584, 3584, 128, 8)": {"BLOCK_SIZE_M": 32, "BLOCK_SIZE_N": 64, "BLOCK_SIZE_K": 64, "GROUP_SIZE_M": 8, "SPLIT_K": 8, "A_load_order": 0, "meta_evict_policy": "", "atomic_mode": "relaxed", "num_warps": 4, "num_ctas": 1, "num_stages": 1, "num_buffers_warp_spec": 0, "num_consumer_groups": 0, "reg_dec_producer": 0, "reg_inc_consumer": 0}, "(32, 37888, 3584, 128, 8)": {"BLOCK_SIZE_M": 32, "BLOCK_SIZE_N": 64, "BLOCK_SIZE_K": 64, "GROUP_SIZE_M": 8, "SPLIT_K": 4, "A_load_order": 2, "meta_evict_policy": "", "atomic_mode": "relaxed", "num_warps": 4, "num_ctas": 1, "num_stages": 1, "num_buffers_warp_spec": 0, "num_consumer_groups": 0, "reg_dec_producer": 0, "reg_inc_consumer": 0}, "(32, 3584, 18944, 128, 8)": {"BLOCK_SIZE_M": 32, "BLOCK_SIZE_N": 64, "BLOCK_SIZE_K": 64, "GROUP_SIZE_M": 8, "SPLIT_K": 8, "A_load_order": 0, "meta_evict_policy": "", "atomic_mode": "relaxed", "num_warps": 4, "num_ctas": 1, "num_stages": 1, "num_buffers_warp_spec": 0, "num_consumer_groups": 0, "reg_dec_producer": 0, "reg_inc_consumer": 0}, "(16, 4608, 3584, 128, 8)": {"BLOCK_SIZE_M": 16, "BLOCK_SIZE_N": 64, "BLOCK_SIZE_K": 64, "GROUP_SIZE_M": 8, "SPLIT_K": 8, "A_load_order": 2, "meta_evict_policy": "", "atomic_mode": "relaxed", "num_warps": 4, "num_ctas": 1, "num_stages": 1, "num_buffers_warp_spec": 0, "num_consumer_groups": 0, "reg_dec_producer": 0, "reg_inc_consumer": 0}, "(16, 3584, 3584, 128, 8)": {"BLOCK_SIZE_M": 16, "BLOCK_SIZE_N": 64, "BLOCK_SIZE_K": 64, "GROUP_SIZE_M": 8, "SPLIT_K": 8, "A_load_order": 2, "meta_evict_policy": "", "atomic_mode": "relaxed", "num_warps": 4, "num_ctas": 1, "num_stages": 1, "num_buffers_warp_spec": 0, "num_consumer_groups": 0, "reg_dec_producer": 0, "reg_inc_consumer": 0}, "(16, 37888, 3584, 128, 8)": {"BLOCK_SIZE_M": 16, "BLOCK_SIZE_N": 64, "BLOCK_SIZE_K": 64, "GROUP_SIZE_M": 8, "SPLIT_K": 1, "A_load_order": 2, "meta_evict_policy": "", "atomic_mode": "relaxed", "num_warps": 4, "num_ctas": 1, "num_stages": 1, "num_buffers_warp_spec": 0, "num_consumer_groups": 0, "reg_dec_producer": 0, "reg_inc_consumer": 0}, "(16, 3584, 18944, 128, 8)": {"BLOCK_SIZE_M": 16, "BLOCK_SIZE_N": 64, "BLOCK_SIZE_K": 64, "GROUP_SIZE_M": 8, "SPLIT_K": 8, "A_load_order": 2, "meta_evict_policy": "", "atomic_mode": "relaxed", "num_warps": 4, "num_ctas": 1, "num_stages": 1, "num_buffers_warp_spec": 0, "num_consumer_groups": 0, "reg_dec_producer": 0, "reg_inc_consumer": 0}, "(8, 4608, 3584, 128, 8)": {"BLOCK_SIZE_M": 16, "BLOCK_SIZE_N": 64, "BLOCK_SIZE_K": 64, "GROUP_SIZE_M": 8, "SPLIT_K": 8, "A_load_order": 2, "meta_evict_policy": "", "atomic_mode": "relaxed", "num_warps": 4, "num_ctas": 1, "num_stages": 1, "num_buffers_warp_spec": 0, "num_consumer_groups": 0, "reg_dec_producer": 0, "reg_inc_consumer": 0}, "(8, 3584, 3584, 128, 8)": {"BLOCK_SIZE_M": 16, "BLOCK_SIZE_N": 64, "BLOCK_SIZE_K": 64, "GROUP_SIZE_M": 8, "SPLIT_K": 8, "A_load_order": 2, "meta_evict_policy": "", "atomic_mode": "relaxed", "num_warps": 4, "num_ctas": 1, "num_stages": 1, "num_buffers_warp_spec": 0, "num_consumer_groups": 0, "reg_dec_producer": 0, "reg_inc_consumer": 0}, "(8, 37888, 3584, 128, 8)": {"BLOCK_SIZE_M": 16, "BLOCK_SIZE_N": 64, "BLOCK_SIZE_K": 64, "GROUP_SIZE_M": 8, "SPLIT_K": 8, "A_load_order": 2, "meta_evict_policy": "", "atomic_mode": "relaxed", "num_warps": 4, "num_ctas": 1, "num_stages": 1, "num_buffers_warp_spec": 0, "num_consumer_groups": 0, "reg_dec_producer": 0, "reg_inc_consumer": 0}, "(8, 3584, 18944, 128, 8)": {"BLOCK_SIZE_M": 16, "BLOCK_SIZE_N": 128, "BLOCK_SIZE_K": 32, "GROUP_SIZE_M": 8, "SPLIT_K": 16, "A_load_order": 2, "meta_evict_policy": "", "atomic_mode": "relaxed", "num_warps": 8, "num_ctas": 1, "num_stages": 1, "num_buffers_warp_spec": 0, "num_consumer_groups": 0, "reg_dec_producer": 0, "reg_inc_consumer": 0}, "(4, 4608, 3584, 128, 8)": {"BLOCK_SIZE_M": 16, "BLOCK_SIZE_N": 64, "BLOCK_SIZE_K": 64, "GROUP_SIZE_M": 8, "SPLIT_K": 8, "A_load_order": 2, "meta_evict_policy": "", "atomic_mode": "relaxed", "num_warps": 4, "num_ctas": 1, "num_stages": 1, "num_buffers_warp_spec": 0, "num_consumer_groups": 0, "reg_dec_producer": 0, "reg_inc_consumer": 0}, "(4, 3584, 3584, 128, 8)": {"BLOCK_SIZE_M": 16, "BLOCK_SIZE_N": 64, "BLOCK_SIZE_K": 64, "GROUP_SIZE_M": 8, "SPLIT_K": 8, "A_load_order": 2, "meta_evict_policy": "", "atomic_mode": "relaxed", "num_warps": 4, "num_ctas": 1, "num_stages": 1, "num_buffers_warp_spec": 0, "num_consumer_groups": 0, "reg_dec_producer": 0, "reg_inc_consumer": 0}, "(4, 37888, 3584, 128, 8)": {"BLOCK_SIZE_M": 16, "BLOCK_SIZE_N": 64, "BLOCK_SIZE_K": 64, "GROUP_SIZE_M": 8, "SPLIT_K": 8, "A_load_order": 2, "meta_evict_policy": "", "atomic_mode": "relaxed", "num_warps": 4, "num_ctas": 1, "num_stages": 1, "num_buffers_warp_spec": 0, "num_consumer_groups": 0, "reg_dec_producer": 0, "reg_inc_consumer": 0}, "(4, 3584, 18944, 128, 8)": {"BLOCK_SIZE_M": 16, "BLOCK_SIZE_N": 128, "BLOCK_SIZE_K": 32, "GROUP_SIZE_M": 8, "SPLIT_K": 16, "A_load_order": 2, "meta_evict_policy": "", "atomic_mode": "relaxed", "num_warps": 8, "num_ctas": 1, "num_stages": 1, "num_buffers_warp_spec": 0, "num_consumer_groups": 0, "reg_dec_producer": 0, "reg_inc_consumer": 0}, "(2, 4608, 3584, 128, 8)": {"BLOCK_SIZE_M": 16, "BLOCK_SIZE_N": 64, "BLOCK_SIZE_K": 64, "GROUP_SIZE_M": 8, "SPLIT_K": 8, "A_load_order": 2, "meta_evict_policy": "", "atomic_mode": "relaxed", "num_warps": 4, "num_ctas": 1, "num_stages": 1, "num_buffers_warp_spec": 0, "num_consumer_groups": 0, "reg_dec_producer": 0, "reg_inc_consumer": 0}, "(2, 3584, 3584, 128, 8)": {"BLOCK_SIZE_M": 16, "BLOCK_SIZE_N": 64, "BLOCK_SIZE_K": 64, "GROUP_SIZE_M": 8, "SPLIT_K": 8, "A_load_order": 2, "meta_evict_policy": "", "atomic_mode": "relaxed", "num_warps": 4, "num_ctas": 1, "num_stages": 1, "num_buffers_warp_spec": 0, "num_consumer_groups": 0, "reg_dec_producer": 0, "reg_inc_consumer": 0}, "(2, 37888, 3584, 128, 8)": {"BLOCK_SIZE_M": 16, "BLOCK_SIZE_N": 64, "BLOCK_SIZE_K": 64, "GROUP_SIZE_M": 8, "SPLIT_K": 8, "A_load_order": 2, "meta_evict_policy": "", "atomic_mode": "relaxed", "num_warps": 4, "num_ctas": 1, "num_stages": 1, "num_buffers_warp_spec": 0, "num_consumer_groups": 0, "reg_dec_producer": 0, "reg_inc_consumer": 0}, "(2, 3584, 18944, 128, 8)": {"BLOCK_SIZE_M": 16, "BLOCK_SIZE_N": 128, "BLOCK_SIZE_K": 32, "GROUP_SIZE_M": 8, "SPLIT_K": 16, "A_load_order": 2, "meta_evict_policy": "", "atomic_mode": "relaxed", "num_warps": 8, "num_ctas": 1, "num_stages": 1, "num_buffers_warp_spec": 0, "num_consumer_groups": 0, "reg_dec_producer": 0, "reg_inc_consumer": 0}}, "GEMM": {"(1024, 2560, 2048, 64, 8)": {"BLOCK_SIZE_M": 64, "BLOCK_SIZE_N": 128, "BLOCK_SIZE_K": 32, "GROUP_SIZE_M": 8, "A_load_order": 2, "meta_evict_policy": "", "num_warps": 8, "num_ctas": 1, "num_stages": 1, "num_buffers_warp_spec": 0, "num_consumer_groups": 0, "reg_dec_producer": 0, "reg_inc_consumer": 0}, "(1024, 2048, 2048, 64, 8)": {"BLOCK_SIZE_M": 64, "BLOCK_SIZE_N": 128, "BLOCK_SIZE_K": 32, "GROUP_SIZE_M": 8, "A_load_order": 2, "meta_evict_policy": "", "num_warps": 8, "num_ctas": 1, "num_stages": 1, "num_buffers_warp_spec": 0, "num_consumer_groups": 0, "reg_dec_producer": 0, "reg_inc_consumer": 0}, "(1024, 22016, 2048, 64, 8)": {"BLOCK_SIZE_M": 64, "BLOCK_SIZE_N": 128, "BLOCK_SIZE_K": 32, "GROUP_SIZE_M": 8, "A_load_order": 2, "meta_evict_policy": "", "num_warps": 8, "num_ctas": 1, "num_stages": 1, "num_buffers_warp_spec": 0, "num_consumer_groups": 0, "reg_dec_producer": 0, "reg_inc_consumer": 0}, "(1024, 2048, 11008, 64, 8)": {"BLOCK_SIZE_M": 64, "BLOCK_SIZE_N": 128, "BLOCK_SIZE_K": 32, "GROUP_SIZE_M": 8, "A_load_order": 2, "meta_evict_policy": "", "num_warps": 8, "num_ctas": 1, "num_stages": 1, "num_buffers_warp_spec": 0, "num_consumer_groups": 0, "reg_dec_producer": 0, "reg_inc_consumer": 0}, "(256, 2560, 2048, 64, 8)": {"BLOCK_SIZE_M": 64, "BLOCK_SIZE_N": 64, "BLOCK_SIZE_K": 64, "GROUP_SIZE_M": 8, "A_load_order": 2, "meta_evict_policy": "", "num_warps": 8, "num_ctas": 1, "num_stages": 1, "num_buffers_warp_spec": 0, "num_consumer_groups": 0, "reg_dec_producer": 0, "reg_inc_consumer": 0}, "(256, 2048, 2048, 64, 8)": {"BLOCK_SIZE_M": 64, "BLOCK_SIZE_N": 64, "BLOCK_SIZE_K": 64, "GROUP_SIZE_M": 8, "A_load_order": 2, "meta_evict_policy": "", "num_warps": 8, "num_ctas": 1, "num_stages": 1, "num_buffers_warp_spec": 0, "num_consumer_groups": 0, "reg_dec_producer": 0, "reg_inc_consumer": 0}, "(256, 22016, 2048, 64, 8)": {"BLOCK_SIZE_M": 64, "BLOCK_SIZE_N": 64, "BLOCK_SIZE_K": 32, "GROUP_SIZE_M": 8, "A_load_order": 0, "meta_evict_policy": "", "num_warps": 4, "num_ctas": 1, "num_stages": 1, "num_buffers_warp_spec": 0, "num_consumer_groups": 0, "reg_dec_producer": 0, "reg_inc_consumer": 0}, "(256, 2048, 11008, 64, 8)": {"BLOCK_SIZE_M": 64, "BLOCK_SIZE_N": 64, "BLOCK_SIZE_K": 64, "GROUP_SIZE_M": 8, "A_load_order": 2, "meta_evict_policy": "", "num_warps": 8, "num_ctas": 1, "num_stages": 1, "num_buffers_warp_spec": 0, "num_consumer_groups": 0, "reg_dec_producer": 0, "reg_inc_consumer": 0}, "(128, 2560, 2048, 64, 8)": {"BLOCK_SIZE_M": 64, "BLOCK_SIZE_N": 32, "BLOCK_SIZE_K": 64, "GROUP_SIZE_M": 8, "A_load_order": 2, "meta_evict_policy": "", "num_warps": 8, "num_ctas": 1, "num_stages": 1, "num_buffers_warp_spec": 0, "num_consumer_groups": 0, "reg_dec_producer": 0, "reg_inc_consumer": 0}, "(128, 2048, 2048, 64, 8)": {"BLOCK_SIZE_M": 64, "BLOCK_SIZE_N": 32, "BLOCK_SIZE_K": 64, "GROUP_SIZE_M": 8, "A_load_order": 2, "meta_evict_policy": "", "num_warps": 8, "num_ctas": 1, "num_stages": 1, "num_buffers_warp_spec": 0, "num_consumer_groups": 0, "reg_dec_producer": 0, "reg_inc_consumer": 0}, "(128, 22016, 2048, 64, 8)": {"BLOCK_SIZE_M": 64, "BLOCK_SIZE_N": 64, "BLOCK_SIZE_K": 64, "GROUP_SIZE_M": 8, "A_load_order": 2, "meta_evict_policy": "", "num_warps": 4, "num_ctas": 1, "num_stages": 1, "num_buffers_warp_spec": 0, "num_consumer_groups": 0, "reg_dec_producer": 0, "reg_inc_consumer": 0}, "(128, 2048, 11008, 64, 8)": {"BLOCK_SIZE_M": 64, "BLOCK_SIZE_N": 32, "BLOCK_SIZE_K": 64, "GROUP_SIZE_M": 8, "A_load_order": 2, "meta_evict_policy": "", "num_warps": 8, "num_ctas": 1, "num_stages": 1, "num_buffers_warp_spec": 0, "num_consumer_groups": 0, "reg_dec_producer": 0, "reg_inc_consumer": 0}, "(512, 2560, 2048, 64, 8)": {"BLOCK_SIZE_M": 64, "BLOCK_SIZE_N": 64, "BLOCK_SIZE_K": 64, "GROUP_SIZE_M": 8, "A_load_order": 2, "meta_evict_policy": "", "num_warps": 4, "num_ctas": 1, "num_stages": 1, "num_buffers_warp_spec": 0, "num_consumer_groups": 0, "reg_dec_producer": 0, "reg_inc_consumer": 0}, "(512, 2048, 2048, 64, 8)": {"BLOCK_SIZE_M": 64, "BLOCK_SIZE_N": 64, "BLOCK_SIZE_K": 64, "GROUP_SIZE_M": 8, "A_load_order": 2, "meta_evict_policy": "", "num_warps": 8, "num_ctas": 1, "num_stages": 1, "num_buffers_warp_spec": 0, "num_consumer_groups": 0, "reg_dec_producer": 0, "reg_inc_consumer": 0}, "(512, 22016, 2048, 64, 8)": {"BLOCK_SIZE_M": 64, "BLOCK_SIZE_N": 128, "BLOCK_SIZE_K": 32, "GROUP_SIZE_M": 8, "A_load_order": 2, "meta_evict_policy": "", "num_warps": 8, "num_ctas": 1, "num_stages": 1, "num_buffers_warp_spec": 0, "num_consumer_groups": 0, "reg_dec_producer": 0, "reg_inc_consumer": 0}, "(512, 2048, 11008, 64, 8)": {"BLOCK_SIZE_M": 64, "BLOCK_SIZE_N": 64, "BLOCK_SIZE_K": 64, "GROUP_SIZE_M": 8, "A_load_order": 2, "meta_evict_policy": "", "num_warps": 8, "num_ctas": 1, "num_stages": 1, "num_buffers_warp_spec": 0, "num_consumer_groups": 0, "reg_dec_producer": 0, "reg_inc_consumer": 0}, "(1024, 2560, 2048, 2048, 1)": {"BLOCK_SIZE_M": 64, "BLOCK_SIZE_N": 256, "BLOCK_SIZE_K": 64, "GROUP_SIZE_M": 8, "A_load_order": 0, "meta_evict_policy": "", "num_warps": 4, "num_ctas": 1, "num_stages": 4, "num_buffers_warp_spec": 0, "num_consumer_groups": 0, "reg_dec_producer": 0, "reg_inc_consumer": 0}, "(1024, 2048, 2048, 2048, 1)": {"BLOCK_SIZE_M": 64, "BLOCK_SIZE_N": 256, "BLOCK_SIZE_K": 64, "GROUP_SIZE_M": 8, "A_load_order": 0, "meta_evict_policy": "", "num_warps": 4, "num_ctas": 1, "num_stages": 4, "num_buffers_warp_spec": 0, "num_consumer_groups": 0, "reg_dec_producer": 0, "reg_inc_consumer": 0}, "(1024, 22016, 2048, 2048, 1)": {"BLOCK_SIZE_M": 64, "BLOCK_SIZE_N": 256, "BLOCK_SIZE_K": 64, "GROUP_SIZE_M": 8, "A_load_order": 2, "meta_evict_policy": "", "num_warps": 4, "num_ctas": 1, "num_stages": 4, "num_buffers_warp_spec": 0, "num_consumer_groups": 0, "reg_dec_producer": 0, "reg_inc_consumer": 0}, "(1024, 2048, 11008, 11008, 1)": {"BLOCK_SIZE_M": 64, "BLOCK_SIZE_N": 256, "BLOCK_SIZE_K": 64, "GROUP_SIZE_M": 8, "A_load_order": 0, "meta_evict_policy": "", "num_warps": 4, "num_ctas": 1, "num_stages": 4, "num_buffers_warp_spec": 0, "num_consumer_groups": 0, "reg_dec_producer": 0, "reg_inc_consumer": 0}, "(256, 2560, 2048, 2048, 1)": {"BLOCK_SIZE_M": 64, "BLOCK_SIZE_N": 128, "BLOCK_SIZE_K": 128, "GROUP_SIZE_M": 8, "A_load_order": 0, "meta_evict_policy": "", "num_warps": 4, "num_ctas": 1, "num_stages": 4, "num_buffers_warp_spec": 0, "num_consumer_groups": 0, "reg_dec_producer": 0, "reg_inc_consumer": 0}, "(256, 2048, 2048, 2048, 1)": {"BLOCK_SIZE_M": 64, "BLOCK_SIZE_N": 128, "BLOCK_SIZE_K": 64, "GROUP_SIZE_M": 8, "A_load_order": 0, "meta_evict_policy": "", "num_warps": 4, "num_ctas": 1, "num_stages": 4, "num_buffers_warp_spec": 0, "num_consumer_groups": 0, "reg_dec_producer": 0, "reg_inc_consumer": 0}, "(256, 22016, 2048, 2048, 1)": {"BLOCK_SIZE_M": 64, "BLOCK_SIZE_N": 128, "BLOCK_SIZE_K": 64, "GROUP_SIZE_M": 8, "A_load_order": 0, "meta_evict_policy": "", "num_warps": 4, "num_ctas": 1, "num_stages": 4, "num_buffers_warp_spec": 0, "num_consumer_groups": 0, "reg_dec_producer": 0, "reg_inc_consumer": 0}, "(256, 2048, 11008, 11008, 1)": {"BLOCK_SIZE_M": 64, "BLOCK_SIZE_N": 128, "BLOCK_SIZE_K": 128, "GROUP_SIZE_M": 8, "A_load_order": 0, "meta_evict_policy": "", "num_warps": 4, "num_ctas": 1, "num_stages": 4, "num_buffers_warp_spec": 0, "num_consumer_groups": 0, "reg_dec_producer": 0, "reg_inc_consumer": 0}, "(128, 2560, 2048, 2048, 1)": {"BLOCK_SIZE_M": 64, "BLOCK_SIZE_N": 64, "BLOCK_SIZE_K": 128, "GROUP_SIZE_M": 8, "A_load_order": 0, "meta_evict_policy": "", "num_warps": 4, "num_ctas": 1, "num_stages": 4, "num_buffers_warp_spec": 0, "num_consumer_groups": 0, "reg_dec_producer": 0, "reg_inc_consumer": 0}, "(128, 2048, 2048, 2048, 1)": {"BLOCK_SIZE_M": 64, "BLOCK_SIZE_N": 64, "BLOCK_SIZE_K": 128, "GROUP_SIZE_M": 8, "A_load_order": 0, "meta_evict_policy": "", "num_warps": 4, "num_ctas": 1, "num_stages": 4, "num_buffers_warp_spec": 0, "num_consumer_groups": 0, "reg_dec_producer": 0, "reg_inc_consumer": 0}, "(128, 22016, 2048, 2048, 1)": {"BLOCK_SIZE_M": 64, "BLOCK_SIZE_N": 64, "BLOCK_SIZE_K": 256, "GROUP_SIZE_M": 8, "A_load_order": 0, "meta_evict_policy": "", "num_warps": 4, "num_ctas": 1, "num_stages": 2, "num_buffers_warp_spec": 0, "num_consumer_groups": 0, "reg_dec_producer": 0, "reg_inc_consumer": 0}, "(128, 2048, 11008, 11008, 1)": {"BLOCK_SIZE_M": 64, "BLOCK_SIZE_N": 64, "BLOCK_SIZE_K": 256, "GROUP_SIZE_M": 8, "A_load_order": 0, "meta_evict_policy": "", "num_warps": 4, "num_ctas": 1, "num_stages": 4, "num_buffers_warp_spec": 0, "num_consumer_groups": 0, "reg_dec_producer": 0, "reg_inc_consumer": 0}, "(512, 2560, 2048, 2048, 1)": {"BLOCK_SIZE_M": 64, "BLOCK_SIZE_N": 128, "BLOCK_SIZE_K": 64, "GROUP_SIZE_M": 8, "A_load_order": 2, "meta_evict_policy": "", "num_warps": 4, "num_ctas": 1, "num_stages": 4, "num_buffers_warp_spec": 0, "num_consumer_groups": 0, "reg_dec_producer": 0, "reg_inc_consumer": 0}, "(512, 2048, 2048, 2048, 1)": {"BLOCK_SIZE_M": 64, "BLOCK_SIZE_N": 128, "BLOCK_SIZE_K": 64, "GROUP_SIZE_M": 8, "A_load_order": 0, "meta_evict_policy": "", "num_warps": 4, "num_ctas": 1, "num_stages": 4, "num_buffers_warp_spec": 0, "num_consumer_groups": 0, "reg_dec_producer": 0, "reg_inc_consumer": 0}, "(512, 22016, 2048, 2048, 1)": {"BLOCK_SIZE_M": 64, "BLOCK_SIZE_N": 128, "BLOCK_SIZE_K": 64, "GROUP_SIZE_M": 8, "A_load_order": 2, "meta_evict_policy": "", "num_warps": 4, "num_ctas": 1, "num_stages": 4, "num_buffers_warp_spec": 0, "num_consumer_groups": 0, "reg_dec_producer": 0, "reg_inc_consumer": 0}, "(512, 2048, 11008, 11008, 1)": {"BLOCK_SIZE_M": 64, "BLOCK_SIZE_N": 128, "BLOCK_SIZE_K": 128, "GROUP_SIZE_M": 8, "A_load_order": 0, "meta_evict_policy": "", "num_warps": 4, "num_ctas": 1, "num_stages": 4, "num_buffers_warp_spec": 0, "num_consumer_groups": 0, "reg_dec_producer": 0, "reg_inc_consumer": 0}, "(1024, 4608, 3584, 3584, 1)": {"BLOCK_SIZE_M": 64, "BLOCK_SIZE_N": 256, "BLOCK_SIZE_K": 64, "GROUP_SIZE_M": 8, "A_load_order": 0, "meta_evict_policy": "", "num_warps": 4, "num_ctas": 1, "num_stages": 4, "num_buffers_warp_spec": 0, "num_consumer_groups": 0, "reg_dec_producer": 0, "reg_inc_consumer": 0}, "(1024, 3584, 3584, 3584, 1)": {"BLOCK_SIZE_M": 64, "BLOCK_SIZE_N": 256, "BLOCK_SIZE_K": 64, "GROUP_SIZE_M": 8, "A_load_order": 0, "meta_evict_policy": "", "num_warps": 4, "num_ctas": 1, "num_stages": 4, "num_buffers_warp_spec": 0, "num_consumer_groups": 0, "reg_dec_producer": 0, "reg_inc_consumer": 0}, "(1024, 37888, 3584, 3584, 1)": {"BLOCK_SIZE_M": 64, "BLOCK_SIZE_N": 256, "BLOCK_SIZE_K": 64, "GROUP_SIZE_M": 8, "A_load_order": 0, "meta_evict_policy": "", "num_warps": 4, "num_ctas": 1, "num_stages": 4, "num_buffers_warp_spec": 0, "num_consumer_groups": 0, "reg_dec_producer": 0, "reg_inc_consumer": 0}, "(1024, 3584, 18944, 18944, 1)": {"BLOCK_SIZE_M": 64, "BLOCK_SIZE_N": 256, "BLOCK_SIZE_K": 64, "GROUP_SIZE_M": 8, "A_load_order": 2, "meta_evict_policy": "", "num_warps": 4, "num_ctas": 1, "num_stages": 4, "num_buffers_warp_spec": 0, "num_consumer_groups": 0, "reg_dec_producer": 0, "reg_inc_consumer": 0}, "(256, 4608, 3584, 3584, 1)": {"BLOCK_SIZE_M": 64, "BLOCK_SIZE_N": 256, "BLOCK_SIZE_K": 64, "GROUP_SIZE_M": 8, "A_load_order": 0, "meta_evict_policy": "", "num_warps": 4, "num_ctas": 1, "num_stages": 4, "num_buffers_warp_spec": 0, "num_consumer_groups": 0, "reg_dec_producer": 0, "reg_inc_consumer": 0}, "(256, 3584, 3584, 3584, 1)": {"BLOCK_SIZE_M": 64, "BLOCK_SIZE_N": 128, "BLOCK_SIZE_K": 64, "GROUP_SIZE_M": 8, "A_load_order": 2, "meta_evict_policy": "", "num_warps": 4, "num_ctas": 1, "num_stages": 4, "num_buffers_warp_spec": 0, "num_consumer_groups": 0, "reg_dec_producer": 0, "reg_inc_consumer": 0}, "(256, 37888, 3584, 3584, 1)": {"BLOCK_SIZE_M": 64, "BLOCK_SIZE_N": 256, "BLOCK_SIZE_K": 64, "GROUP_SIZE_M": 8, "A_load_order": 0, "meta_evict_policy": "", "num_warps": 8, "num_ctas": 1, "num_stages": 4, "num_buffers_warp_spec": 0, "num_consumer_groups": 0, "reg_dec_producer": 0, "reg_inc_consumer": 0}, "(256, 3584, 18944, 18944, 1)": {"BLOCK_SIZE_M": 64, "BLOCK_SIZE_N": 256, "BLOCK_SIZE_K": 64, "GROUP_SIZE_M": 8, "A_load_order": 0, "meta_evict_policy": "", "num_warps": 4, "num_ctas": 1, "num_stages": 4, "num_buffers_warp_spec": 0, "num_consumer_groups": 0, "reg_dec_producer": 0, "reg_inc_consumer": 0}, "(128, 4608, 3584, 3584, 1)": {"BLOCK_SIZE_M": 64, "BLOCK_SIZE_N": 64, "BLOCK_SIZE_K": 128, "GROUP_SIZE_M": 8, "A_load_order": 0, "meta_evict_policy": "", "num_warps": 4, "num_ctas": 1, "num_stages": 4, "num_buffers_warp_spec": 0, "num_consumer_groups": 0, "reg_dec_producer": 0, "reg_inc_consumer": 0}, "(128, 3584, 3584, 3584, 1)": {"BLOCK_SIZE_M": 64, "BLOCK_SIZE_N": 128, "BLOCK_SIZE_K": 128, "GROUP_SIZE_M": 8, "A_load_order": 0, "meta_evict_policy": "", "num_warps": 4, "num_ctas": 1, "num_stages": 4, "num_buffers_warp_spec": 0, "num_consumer_groups": 0, "reg_dec_producer": 0, "reg_inc_consumer": 0}, "(128, 37888, 3584, 3584, 1)": {"BLOCK_SIZE_M": 64, "BLOCK_SIZE_N": 64, "BLOCK_SIZE_K": 256, "GROUP_SIZE_M": 8, "A_load_order": 0, "meta_evict_policy": "", "num_warps": 4, "num_ctas": 1, "num_stages": 2, "num_buffers_warp_spec": 0, "num_consumer_groups": 0, "reg_dec_producer": 0, "reg_inc_consumer": 0}, "(128, 3584, 18944, 18944, 1)": {"BLOCK_SIZE_M": 64, "BLOCK_SIZE_N": 128, "BLOCK_SIZE_K": 128, "GROUP_SIZE_M": 8, "A_load_order": 0, "meta_evict_policy": "", "num_warps": 4, "num_ctas": 1, "num_stages": 4, "num_buffers_warp_spec": 0, "num_consumer_groups": 0, "reg_dec_producer": 0, "reg_inc_consumer": 0}, "(512, 4608, 3584, 3584, 1)": {"BLOCK_SIZE_M": 64, "BLOCK_SIZE_N": 128, "BLOCK_SIZE_K": 64, "GROUP_SIZE_M": 8, "A_load_order": 0, "meta_evict_policy": "", "num_warps": 4, "num_ctas": 1, "num_stages": 2, "num_buffers_warp_spec": 0, "num_consumer_groups": 0, "reg_dec_producer": 0, "reg_inc_consumer": 0}, "(512, 3584, 3584, 3584, 1)": {"BLOCK_SIZE_M": 64, "BLOCK_SIZE_N": 256, "BLOCK_SIZE_K": 64, "GROUP_SIZE_M": 8, "A_load_order": 0, "meta_evict_policy": "", "num_warps": 4, "num_ctas": 1, "num_stages": 4, "num_buffers_warp_spec": 0, "num_consumer_groups": 0, "reg_dec_producer": 0, "reg_inc_consumer": 0}, "(512, 37888, 3584, 3584, 1)": {"BLOCK_SIZE_M": 64, "BLOCK_SIZE_N": 256, "BLOCK_SIZE_K": 64, "GROUP_SIZE_M": 8, "A_load_order": 2, "meta_evict_policy": "", "num_warps": 4, "num_ctas": 1, "num_stages": 4, "num_buffers_warp_spec": 0, "num_consumer_groups": 0, "reg_dec_producer": 0, "reg_inc_consumer": 0}, "(512, 3584, 18944, 18944, 1)": {"BLOCK_SIZE_M": 64, "BLOCK_SIZE_N": 256, "BLOCK_SIZE_K": 64, "GROUP_SIZE_M": 8, "A_load_order": 2, "meta_evict_policy": "", "num_warps": 4, "num_ctas": 1, "num_stages": 4, "num_buffers_warp_spec": 0, "num_consumer_groups": 0, "reg_dec_producer": 0, "reg_inc_consumer": 0}, "(1024, 4608, 3584, 64, 8)": {"BLOCK_SIZE_M": 64, "BLOCK_SIZE_N": 128, "BLOCK_SIZE_K": 32, "GROUP_SIZE_M": 8, "A_load_order": 2, "meta_evict_policy": "", "num_warps": 8, "num_ctas": 1, "num_stages": 1, "num_buffers_warp_spec": 0, "num_consumer_groups": 0, "reg_dec_producer": 0, "reg_inc_consumer": 0}, "(1024, 3584, 3584, 64, 8)": {"BLOCK_SIZE_M": 64, "BLOCK_SIZE_N": 128, "BLOCK_SIZE_K": 32, "GROUP_SIZE_M": 8, "A_load_order": 2, "meta_evict_policy": "", "num_warps": 8, "num_ctas": 1, "num_stages": 1, "num_buffers_warp_spec": 0, "num_consumer_groups": 0, "reg_dec_producer": 0, "reg_inc_consumer": 0}, "(1024, 37888, 3584, 64, 8)": {"BLOCK_SIZE_M": 64, "BLOCK_SIZE_N": 128, "BLOCK_SIZE_K": 32, "GROUP_SIZE_M": 8, "A_load_order": 2, "meta_evict_policy": "", "num_warps": 8, "num_ctas": 1, "num_stages": 1, "num_buffers_warp_spec": 0, "num_consumer_groups": 0, "reg_dec_producer": 0, "reg_inc_consumer": 0}, "(1024, 3584, 18944, 64, 8)": {"BLOCK_SIZE_M": 64, "BLOCK_SIZE_N": 256, "BLOCK_SIZE_K": 32, "GROUP_SIZE_M": 8, "A_load_order": 0, "meta_evict_policy": "", "num_warps": 4, "num_ctas": 1, "num_stages": 1, "num_buffers_warp_spec": 0, "num_consumer_groups": 0, "reg_dec_producer": 0, "reg_inc_consumer": 0}, "(256, 4608, 3584, 64, 8)": {"BLOCK_SIZE_M": 64, "BLOCK_SIZE_N": 128, "BLOCK_SIZE_K": 64, "GROUP_SIZE_M": 8, "A_load_order": 2, "meta_evict_policy": "", "num_warps": 8, "num_ctas": 1, "num_stages": 1, "num_buffers_warp_spec": 0, "num_consumer_groups": 0, "reg_dec_producer": 0, "reg_inc_consumer": 0}, "(256, 3584, 3584, 64, 8)": {"BLOCK_SIZE_M": 64, "BLOCK_SIZE_N": 64, "BLOCK_SIZE_K": 64, "GROUP_SIZE_M": 8, "A_load_order": 2, "meta_evict_policy": "", "num_warps": 4, "num_ctas": 1, "num_stages": 1, "num_buffers_warp_spec": 0, "num_consumer_groups": 0, "reg_dec_producer": 0, "reg_inc_consumer": 0}, "(256, 37888, 3584, 64, 8)": {"BLOCK_SIZE_M": 64, "BLOCK_SIZE_N": 128, "BLOCK_SIZE_K": 32, "GROUP_SIZE_M": 8, "A_load_order": 2, "meta_evict_policy": "", "num_warps": 8, "num_ctas": 1, "num_stages": 1, "num_buffers_warp_spec": 0, "num_consumer_groups": 0, "reg_dec_producer": 0, "reg_inc_consumer": 0}, "(256, 3584, 18944, 64, 8)": {"BLOCK_SIZE_M": 64, "BLOCK_SIZE_N": 64, "BLOCK_SIZE_K": 64, "GROUP_SIZE_M": 8, "A_load_order": 2, "meta_evict_policy": "", "num_warps": 4, "num_ctas": 1, "num_stages": 1, "num_buffers_warp_spec": 0, "num_consumer_groups": 0, "reg_dec_producer": 0, "reg_inc_consumer": 0}, "(128, 4608, 3584, 64, 8)": {"BLOCK_SIZE_M": 64, "BLOCK_SIZE_N": 64, "BLOCK_SIZE_K": 64, "GROUP_SIZE_M": 8, "A_load_order": 2, "meta_evict_policy": "", "num_warps": 8, "num_ctas": 1, "num_stages": 1, "num_buffers_warp_spec": 0, "num_consumer_groups": 0, "reg_dec_producer": 0, "reg_inc_consumer": 0}, "(128, 3584, 3584, 64, 8)": {"BLOCK_SIZE_M": 64, "BLOCK_SIZE_N": 32, "BLOCK_SIZE_K": 64, "GROUP_SIZE_M": 8, "A_load_order": 2, "meta_evict_policy": "", "num_warps": 8, "num_ctas": 1, "num_stages": 1, "num_buffers_warp_spec": 0, "num_consumer_groups": 0, "reg_dec_producer": 0, "reg_inc_consumer": 0}, "(128, 37888, 3584, 64, 8)": {"BLOCK_SIZE_M": 64, "BLOCK_SIZE_N": 128, "BLOCK_SIZE_K": 32, "GROUP_SIZE_M": 8, "A_load_order": 2, "meta_evict_policy": "", "num_warps": 8, "num_ctas": 1, "num_stages": 1, "num_buffers_warp_spec": 0, "num_consumer_groups": 0, "reg_dec_producer": 0, "reg_inc_consumer": 0}, "(128, 3584, 18944, 64, 8)": {"BLOCK_SIZE_M": 64, "BLOCK_SIZE_N": 64, "BLOCK_SIZE_K": 64, "GROUP_SIZE_M": 8, "A_load_order": 2, "meta_evict_policy": "", "num_warps": 8, "num_ctas": 1, "num_stages": 1, "num_buffers_warp_spec": 0, "num_consumer_groups": 0, "reg_dec_producer": 0, "reg_inc_consumer": 0}, "(512, 4608, 3584, 64, 8)": {"BLOCK_SIZE_M": 64, "BLOCK_SIZE_N": 64, "BLOCK_SIZE_K": 32, "GROUP_SIZE_M": 8, "A_load_order": 0, "meta_evict_policy": "", "num_warps": 4, "num_ctas": 1, "num_stages": 1, "num_buffers_warp_spec": 0, "num_consumer_groups": 0, "reg_dec_producer": 0, "reg_inc_consumer": 0}, "(512, 3584, 3584, 64, 8)": {"BLOCK_SIZE_M": 64, "BLOCK_SIZE_N": 128, "BLOCK_SIZE_K": 64, "GROUP_SIZE_M": 8, "A_load_order": 2, "meta_evict_policy": "", "num_warps": 8, "num_ctas": 1, "num_stages": 1, "num_buffers_warp_spec": 0, "num_consumer_groups": 0, "reg_dec_producer": 0, "reg_inc_consumer": 0}, "(512, 37888, 3584, 64, 8)": {"BLOCK_SIZE_M": 64, "BLOCK_SIZE_N": 128, "BLOCK_SIZE_K": 32, "GROUP_SIZE_M": 8, "A_load_order": 2, "meta_evict_policy": "", "num_warps": 8, "num_ctas": 1, "num_stages": 1, "num_buffers_warp_spec": 0, "num_consumer_groups": 0, "reg_dec_producer": 0, "reg_inc_consumer": 0}, "(512, 3584, 18944, 64, 8)": {"BLOCK_SIZE_M": 64, "BLOCK_SIZE_N": 128, "BLOCK_SIZE_K": 64, "GROUP_SIZE_M": 8, "A_load_order": 2, "meta_evict_policy": "", "num_warps": 8, "num_ctas": 1, "num_stages": 1, "num_buffers_warp_spec": 0, "num_consumer_groups": 0, "reg_dec_producer": 0, "reg_inc_consumer": 0}, "(1024, 2048, 1536, 64, 8)": {"BLOCK_SIZE_M": 64, "BLOCK_SIZE_N": 128, "BLOCK_SIZE_K": 32, "GROUP_SIZE_M": 8, "A_load_order": 2, "meta_evict_policy": "", "num_warps": 8, "num_ctas": 1, "num_stages": 1, "num_buffers_warp_spec": 0, "num_consumer_groups": 0, "reg_dec_producer": 0, "reg_inc_consumer": 0}, "(1024, 1536, 1536, 64, 8)": {"BLOCK_SIZE_M": 64, "BLOCK_SIZE_N": 128, "BLOCK_SIZE_K": 32, "GROUP_SIZE_M": 8, "A_load_order": 2, "meta_evict_policy": "", "num_warps": 8, "num_ctas": 1, "num_stages": 1, "num_buffers_warp_spec": 0, "num_consumer_groups": 0, "reg_dec_producer": 0, "reg_inc_consumer": 0}, "(1024, 17920, 1536, 64, 8)": {"BLOCK_SIZE_M": 64, "BLOCK_SIZE_N": 128, "BLOCK_SIZE_K": 32, "GROUP_SIZE_M": 8, "A_load_order": 2, "meta_evict_policy": "", "num_warps": 8, "num_ctas": 1, "num_stages": 1, "num_buffers_warp_spec": 0, "num_consumer_groups": 0, "reg_dec_producer": 0, "reg_inc_consumer": 0}, "(1024, 1536, 8960, 64, 8)": {"BLOCK_SIZE_M": 64, "BLOCK_SIZE_N": 128, "BLOCK_SIZE_K": 32, "GROUP_SIZE_M": 8, "A_load_order": 2, "meta_evict_policy": "", "num_warps": 8, "num_ctas": 1, "num_stages": 1, "num_buffers_warp_spec": 0, "num_consumer_groups": 0, "reg_dec_producer": 0, "reg_inc_consumer": 0}, "(256, 2048, 1536, 64, 8)": {"BLOCK_SIZE_M": 64, "BLOCK_SIZE_N": 64, "BLOCK_SIZE_K": 64, "GROUP_SIZE_M": 8, "A_load_order": 2, "meta_evict_policy": "", "num_warps": 8, "num_ctas": 1, "num_stages": 1, "num_buffers_warp_spec": 0, "num_consumer_groups": 0, "reg_dec_producer": 0, "reg_inc_consumer": 0}, "(256, 1536, 1536, 64, 8)": {"BLOCK_SIZE_M": 64, "BLOCK_SIZE_N": 32, "BLOCK_SIZE_K": 64, "GROUP_SIZE_M": 8, "A_load_order": 2, "meta_evict_policy": "", "num_warps": 8, "num_ctas": 1, "num_stages": 1, "num_buffers_warp_spec": 0, "num_consumer_groups": 0, "reg_dec_producer": 0, "reg_inc_consumer": 0}, "(256, 17920, 1536, 64, 8)": {"BLOCK_SIZE_M": 64, "BLOCK_SIZE_N": 128, "BLOCK_SIZE_K": 32, "GROUP_SIZE_M": 8, "A_load_order": 2, "meta_evict_policy": "", "num_warps": 8, "num_ctas": 1, "num_stages": 1, "num_buffers_warp_spec": 0, "num_consumer_groups": 0, "reg_dec_producer": 0, "reg_inc_consumer": 0}, "(256, 1536, 8960, 64, 8)": {"BLOCK_SIZE_M": 64, "BLOCK_SIZE_N": 32, "BLOCK_SIZE_K": 64, "GROUP_SIZE_M": 8, "A_load_order": 2, "meta_evict_policy": "", "num_warps": 4, "num_ctas": 1, "num_stages": 1, "num_buffers_warp_spec": 0, "num_consumer_groups": 0, "reg_dec_producer": 0, "reg_inc_consumer": 0}, "(128, 2048, 1536, 64, 8)": {"BLOCK_SIZE_M": 64, "BLOCK_SIZE_N": 32, "BLOCK_SIZE_K": 64, "GROUP_SIZE_M": 8, "A_load_order": 2, "meta_evict_policy": "", "num_warps": 8, "num_ctas": 1, "num_stages": 1, "num_buffers_warp_spec": 0, "num_consumer_groups": 0, "reg_dec_producer": 0, "reg_inc_consumer": 0}, "(128, 1536, 1536, 64, 8)": {"BLOCK_SIZE_M": 64, "BLOCK_SIZE_N": 32, "BLOCK_SIZE_K": 64, "GROUP_SIZE_M": 8, "A_load_order": 2, "meta_evict_policy": "", "num_warps": 8, "num_ctas": 1, "num_stages": 1, "num_buffers_warp_spec": 0, "num_consumer_groups": 0, "reg_dec_producer": 0, "reg_inc_consumer": 0}, "(128, 17920, 1536, 64, 8)": {"BLOCK_SIZE_M": 64, "BLOCK_SIZE_N": 64, "BLOCK_SIZE_K": 32, "GROUP_SIZE_M": 8, "A_load_order": 2, "meta_evict_policy": "", "num_warps": 4, "num_ctas": 1, "num_stages": 1, "num_buffers_warp_spec": 0, "num_consumer_groups": 0, "reg_dec_producer": 0, "reg_inc_consumer": 0}, "(128, 1536, 8960, 64, 8)": {"BLOCK_SIZE_M": 64, "BLOCK_SIZE_N": 32, "BLOCK_SIZE_K": 64, "GROUP_SIZE_M": 8, "A_load_order": 2, "meta_evict_policy": "", "num_warps": 8, "num_ctas": 1, "num_stages": 1, "num_buffers_warp_spec": 0, "num_consumer_groups": 0, "reg_dec_producer": 0, "reg_inc_consumer": 0}, "(512, 2048, 1536, 64, 8)": {"BLOCK_SIZE_M": 64, "BLOCK_SIZE_N": 64, "BLOCK_SIZE_K": 64, "GROUP_SIZE_M": 8, "A_load_order": 2, "meta_evict_policy": "", "num_warps": 8, "num_ctas": 1, "num_stages": 1, "num_buffers_warp_spec": 0, "num_consumer_groups": 0, "reg_dec_producer": 0, "reg_inc_consumer": 0}, "(512, 1536, 1536, 64, 8)": {"BLOCK_SIZE_M": 64, "BLOCK_SIZE_N": 32, "BLOCK_SIZE_K": 64, "GROUP_SIZE_M": 8, "A_load_order": 2, "meta_evict_policy": "", "num_warps": 4, "num_ctas": 1, "num_stages": 1, "num_buffers_warp_spec": 0, "num_consumer_groups": 0, "reg_dec_producer": 0, "reg_inc_consumer": 0}, "(512, 17920, 1536, 64, 8)": {"BLOCK_SIZE_M": 64, "BLOCK_SIZE_N": 128, "BLOCK_SIZE_K": 32, "GROUP_SIZE_M": 8, "A_load_order": 2, "meta_evict_policy": "", "num_warps": 8, "num_ctas": 1, "num_stages": 1, "num_buffers_warp_spec": 0, "num_consumer_groups": 0, "reg_dec_producer": 0, "reg_inc_consumer": 0}, "(512, 1536, 8960, 64, 8)": {"BLOCK_SIZE_M": 64, "BLOCK_SIZE_N": 32, "BLOCK_SIZE_K": 64, "GROUP_SIZE_M": 8, "A_load_order": 2, "meta_evict_policy": "", "num_warps": 4, "num_ctas": 1, "num_stages": 1, "num_buffers_warp_spec": 0, "num_consumer_groups": 0, "reg_dec_producer": 0, "reg_inc_consumer": 0}, "(1024, 2048, 1536, 1536, 1)": {"BLOCK_SIZE_M": 64, "BLOCK_SIZE_N": 256, "BLOCK_SIZE_K": 64, "GROUP_SIZE_M": 8, "A_load_order": 0, "meta_evict_policy": "", "num_warps": 4, "num_ctas": 1, "num_stages": 4, "num_buffers_warp_spec": 0, "num_consumer_groups": 0, "reg_dec_producer": 0, "reg_inc_consumer": 0}, "(1024, 1536, 1536, 1536, 1)": {"BLOCK_SIZE_M": 64, "BLOCK_SIZE_N": 256, "BLOCK_SIZE_K": 64, "GROUP_SIZE_M": 8, "A_load_order": 0, "meta_evict_policy": "", "num_warps": 4, "num_ctas": 1, "num_stages": 4, "num_buffers_warp_spec": 0, "num_consumer_groups": 0, "reg_dec_producer": 0, "reg_inc_consumer": 0}, "(1024, 17920, 1536, 1536, 1)": {"BLOCK_SIZE_M": 64, "BLOCK_SIZE_N": 256, "BLOCK_SIZE_K": 64, "GROUP_SIZE_M": 8, "A_load_order": 2, "meta_evict_policy": "", "num_warps": 4, "num_ctas": 1, "num_stages": 4, "num_buffers_warp_spec": 0, "num_consumer_groups": 0, "reg_dec_producer": 0, "reg_inc_consumer": 0}, "(1024, 1536, 8960, 8960, 1)": {"BLOCK_SIZE_M": 64, "BLOCK_SIZE_N": 256, "BLOCK_SIZE_K": 64, "GROUP_SIZE_M": 8, "A_load_order": 2, "meta_evict_policy": "", "num_warps": 4, "num_ctas": 1, "num_stages": 4, "num_buffers_warp_spec": 0, "num_consumer_groups": 0, "reg_dec_producer": 0, "reg_inc_consumer": 0}, "(256, 2048, 1536, 1536, 1)": {"BLOCK_SIZE_M": 64, "BLOCK_SIZE_N": 128, "BLOCK_SIZE_K": 64, "GROUP_SIZE_M": 8, "A_load_order": 0, "meta_evict_policy": "", "num_warps": 4, "num_ctas": 1, "num_stages": 4, "num_buffers_warp_spec": 0, "num_consumer_groups": 0, "reg_dec_producer": 0, "reg_inc_consumer": 0}, "(256, 1536, 1536, 1536, 1)": {"BLOCK_SIZE_M": 64, "BLOCK_SIZE_N": 128, "BLOCK_SIZE_K": 64, "GROUP_SIZE_M": 8, "A_load_order": 0, "meta_evict_policy": "", "num_warps": 4, "num_ctas": 1, "num_stages": 4, "num_buffers_warp_spec": 0, "num_consumer_groups": 0, "reg_dec_producer": 0, "reg_inc_consumer": 0}, "(256, 17920, 1536, 1536, 1)": {"BLOCK_SIZE_M": 64, "BLOCK_SIZE_N": 128, "BLOCK_SIZE_K": 64, "GROUP_SIZE_M": 8, "A_load_order": 0, "meta_evict_policy": "", "num_warps": 4, "num_ctas": 1, "num_stages": 4, "num_buffers_warp_spec": 0, "num_consumer_groups": 0, "reg_dec_producer": 0, "reg_inc_consumer": 0}, "(256, 1536, 8960, 8960, 1)": {"BLOCK_SIZE_M": 64, "BLOCK_SIZE_N": 128, "BLOCK_SIZE_K": 128, "GROUP_SIZE_M": 8, "A_load_order": 0, "meta_evict_policy": "", "num_warps": 4, "num_ctas": 1, "num_stages": 4, "num_buffers_warp_spec": 0, "num_consumer_groups": 0, "reg_dec_producer": 0, "reg_inc_consumer": 0}, "(128, 2048, 1536, 1536, 1)": {"BLOCK_SIZE_M": 64, "BLOCK_SIZE_N": 64, "BLOCK_SIZE_K": 128, "GROUP_SIZE_M": 8, "A_load_order": 0, "meta_evict_policy": "", "num_warps": 4, "num_ctas": 1, "num_stages": 4, "num_buffers_warp_spec": 0, "num_consumer_groups": 0, "reg_dec_producer": 0, "reg_inc_consumer": 0}, "(128, 1536, 1536, 1536, 1)": {"BLOCK_SIZE_M": 64, "BLOCK_SIZE_N": 64, "BLOCK_SIZE_K": 64, "GROUP_SIZE_M": 8, "A_load_order": 0, "meta_evict_policy": "", "num_warps": 4, "num_ctas": 1, "num_stages": 4, "num_buffers_warp_spec": 0, "num_consumer_groups": 0, "reg_dec_producer": 0, "reg_inc_consumer": 0}, "(128, 17920, 1536, 1536, 1)": {"BLOCK_SIZE_M": 64, "BLOCK_SIZE_N": 256, "BLOCK_SIZE_K": 64, "GROUP_SIZE_M": 8, "A_load_order": 0, "meta_evict_policy": "", "num_warps": 4, "num_ctas": 1, "num_stages": 2, "num_buffers_warp_spec": 0, "num_consumer_groups": 0, "reg_dec_producer": 0, "reg_inc_consumer": 0}, "(128, 1536, 8960, 8960, 1)": {"BLOCK_SIZE_M": 64, "BLOCK_SIZE_N": 64, "BLOCK_SIZE_K": 256, "GROUP_SIZE_M": 8, "A_load_order": 0, "meta_evict_policy": "", "num_warps": 8, "num_ctas": 1, "num_stages": 4, "num_buffers_warp_spec": 0, "num_consumer_groups": 0, "reg_dec_producer": 0, "reg_inc_consumer": 0}, "(512, 2048, 1536, 1536, 1)": {"BLOCK_SIZE_M": 64, "BLOCK_SIZE_N": 128, "BLOCK_SIZE_K": 64, "GROUP_SIZE_M": 8, "A_load_order": 0, "meta_evict_policy": "", "num_warps": 4, "num_ctas": 1, "num_stages": 4, "num_buffers_warp_spec": 0, "num_consumer_groups": 0, "reg_dec_producer": 0, "reg_inc_consumer": 0}, "(512, 1536, 1536, 1536, 1)": {"BLOCK_SIZE_M": 64, "BLOCK_SIZE_N": 128, "BLOCK_SIZE_K": 64, "GROUP_SIZE_M": 8, "A_load_order": 2, "meta_evict_policy": "", "num_warps": 4, "num_ctas": 1, "num_stages": 4, "num_buffers_warp_spec": 0, "num_consumer_groups": 0, "reg_dec_producer": 0, "reg_inc_consumer": 0}, "(512, 17920, 1536, 1536, 1)": {"BLOCK_SIZE_M": 64, "BLOCK_SIZE_N": 128, "BLOCK_SIZE_K": 64, "GROUP_SIZE_M": 8, "A_load_order": 0, "meta_evict_policy": "", "num_warps": 4, "num_ctas": 1, "num_stages": 4, "num_buffers_warp_spec": 0, "num_consumer_groups": 0, "reg_dec_producer": 0, "reg_inc_consumer": 0}, "(512, 1536, 8960, 8960, 1)": {"BLOCK_SIZE_M": 64, "BLOCK_SIZE_N": 128, "BLOCK_SIZE_K": 128, "GROUP_SIZE_M": 8, "A_load_order": 0, "meta_evict_policy": "", "num_warps": 4, "num_ctas": 1, "num_stages": 4, "num_buffers_warp_spec": 0, "num_consumer_groups": 0, "reg_dec_producer": 0, "reg_inc_consumer": 0}, "(1024, 6144, 4096, 64, 8)": {"BLOCK_SIZE_M": 64, "BLOCK_SIZE_N": 128, "BLOCK_SIZE_K": 32, "GROUP_SIZE_M": 8, "A_load_order": 2, "meta_evict_policy": "", "num_warps": 8, "num_ctas": 1, "num_stages": 1, "num_buffers_warp_spec": 0, "num_consumer_groups": 0, "reg_dec_producer": 0, "reg_inc_consumer": 0}, "(1024, 4096, 4096, 64, 8)": {"BLOCK_SIZE_M": 64, "BLOCK_SIZE_N": 128, "BLOCK_SIZE_K": 32, "GROUP_SIZE_M": 8, "A_load_order": 2, "meta_evict_policy": "", "num_warps": 8, "num_ctas": 1, "num_stages": 1, "num_buffers_warp_spec": 0, "num_consumer_groups": 0, "reg_dec_producer": 0, "reg_inc_consumer": 0}, "(1024, 28672, 4096, 64, 8)": {"BLOCK_SIZE_M": 64, "BLOCK_SIZE_N": 128, "BLOCK_SIZE_K": 32, "GROUP_SIZE_M": 8, "A_load_order": 2, "meta_evict_policy": "", "num_warps": 8, "num_ctas": 1, "num_stages": 1, "num_buffers_warp_spec": 0, "num_consumer_groups": 0, "reg_dec_producer": 0, "reg_inc_consumer": 0}, "(1024, 4096, 14336, 64, 8)": {"BLOCK_SIZE_M": 64, "BLOCK_SIZE_N": 128, "BLOCK_SIZE_K": 32, "GROUP_SIZE_M": 8, "A_load_order": 2, "meta_evict_policy": "", "num_warps": 8, "num_ctas": 1, "num_stages": 1, "num_buffers_warp_spec": 0, "num_consumer_groups": 0, "reg_dec_producer": 0, "reg_inc_consumer": 0}, "(256, 6144, 4096, 64, 8)": {"BLOCK_SIZE_M": 64, "BLOCK_SIZE_N": 64, "BLOCK_SIZE_K": 32, "GROUP_SIZE_M": 8, "A_load_order": 0, "meta_evict_policy": "", "num_warps": 4, "num_ctas": 1, "num_stages": 1, "num_buffers_warp_spec": 0, "num_consumer_groups": 0, "reg_dec_producer": 0, "reg_inc_consumer": 0}, "(256, 4096, 4096, 64, 8)": {"BLOCK_SIZE_M": 64, "BLOCK_SIZE_N": 128, "BLOCK_SIZE_K": 64, "GROUP_SIZE_M": 8, "A_load_order": 2, "meta_evict_policy": "", "num_warps": 8, "num_ctas": 1, "num_stages": 1, "num_buffers_warp_spec": 0, "num_consumer_groups": 0, "reg_dec_producer": 0, "reg_inc_consumer": 0}, "(256, 28672, 4096, 64, 8)": {"BLOCK_SIZE_M": 64, "BLOCK_SIZE_N": 128, "BLOCK_SIZE_K": 32, "GROUP_SIZE_M": 8, "A_load_order": 2, "meta_evict_policy": "", "num_warps": 8, "num_ctas": 1, "num_stages": 1, "num_buffers_warp_spec": 0, "num_consumer_groups": 0, "reg_dec_producer": 0, "reg_inc_consumer": 0}, "(256, 4096, 14336, 64, 8)": {"BLOCK_SIZE_M": 64, "BLOCK_SIZE_N": 128, "BLOCK_SIZE_K": 64, "GROUP_SIZE_M": 8, "A_load_order": 2, "meta_evict_policy": "", "num_warps": 8, "num_ctas": 1, "num_stages": 1, "num_buffers_warp_spec": 0, "num_consumer_groups": 0, "reg_dec_producer": 0, "reg_inc_consumer": 0}, "(128, 6144, 4096, 64, 8)": {"BLOCK_SIZE_M": 64, "BLOCK_SIZE_N": 64, "BLOCK_SIZE_K": 64, "GROUP_SIZE_M": 8, "A_load_order": 2, "meta_evict_policy": "", "num_warps": 4, "num_ctas": 1, "num_stages": 1, "num_buffers_warp_spec": 0, "num_consumer_groups": 0, "reg_dec_producer": 0, "reg_inc_consumer": 0}, "(128, 4096, 4096, 64, 8)": {"BLOCK_SIZE_M": 64, "BLOCK_SIZE_N": 64, "BLOCK_SIZE_K": 64, "GROUP_SIZE_M": 8, "A_load_order": 2, "meta_evict_policy": "", "num_warps": 8, "num_ctas": 1, "num_stages": 1, "num_buffers_warp_spec": 0, "num_consumer_groups": 0, "reg_dec_producer": 0, "reg_inc_consumer": 0}, "(128, 28672, 4096, 64, 8)": {"BLOCK_SIZE_M": 64, "BLOCK_SIZE_N": 64, "BLOCK_SIZE_K": 32, "GROUP_SIZE_M": 8, "A_load_order": 0, "meta_evict_policy": "", "num_warps": 4, "num_ctas": 1, "num_stages": 1, "num_buffers_warp_spec": 0, "num_consumer_groups": 0, "reg_dec_producer": 0, "reg_inc_consumer": 0}, "(128, 4096, 14336, 64, 8)": {"BLOCK_SIZE_M": 64, "BLOCK_SIZE_N": 64, "BLOCK_SIZE_K": 64, "GROUP_SIZE_M": 8, "A_load_order": 2, "meta_evict_policy": "", "num_warps": 8, "num_ctas": 1, "num_stages": 1, "num_buffers_warp_spec": 0, "num_consumer_groups": 0, "reg_dec_producer": 0, "reg_inc_consumer": 0}, "(512, 6144, 4096, 64, 8)": {"BLOCK_SIZE_M": 64, "BLOCK_SIZE_N": 128, "BLOCK_SIZE_K": 32, "GROUP_SIZE_M": 8, "A_load_order": 2, "meta_evict_policy": "", "num_warps": 8, "num_ctas": 1, "num_stages": 1, "num_buffers_warp_spec": 0, "num_consumer_groups": 0, "reg_dec_producer": 0, "reg_inc_consumer": 0}, "(512, 4096, 4096, 64, 8)": {"BLOCK_SIZE_M": 64, "BLOCK_SIZE_N": 128, "BLOCK_SIZE_K": 64, "GROUP_SIZE_M": 8, "A_load_order": 2, "meta_evict_policy": "", "num_warps": 8, "num_ctas": 1, "num_stages": 1, "num_buffers_warp_spec": 0, "num_consumer_groups": 0, "reg_dec_producer": 0, "reg_inc_consumer": 0}, "(512, 28672, 4096, 64, 8)": {"BLOCK_SIZE_M": 64, "BLOCK_SIZE_N": 128, "BLOCK_SIZE_K": 32, "GROUP_SIZE_M": 8, "A_load_order": 2, "meta_evict_policy": "", "num_warps": 8, "num_ctas": 1, "num_stages": 1, "num_buffers_warp_spec": 0, "num_consumer_groups": 0, "reg_dec_producer": 0, "reg_inc_consumer": 0}, "(512, 4096, 14336, 64, 8)": {"BLOCK_SIZE_M": 64, "BLOCK_SIZE_N": 128, "BLOCK_SIZE_K": 64, "GROUP_SIZE_M": 8, "A_load_order": 2, "meta_evict_policy": "", "num_warps": 8, "num_ctas": 1, "num_stages": 1, "num_buffers_warp_spec": 0, "num_consumer_groups": 0, "reg_dec_producer": 0, "reg_inc_consumer": 0}, "(1024, 6144, 4096, 4096, 1)": {"BLOCK_SIZE_M": 64, "BLOCK_SIZE_N": 256, "BLOCK_SIZE_K": 64, "GROUP_SIZE_M": 8, "A_load_order": 2, "meta_evict_policy": "", "num_warps": 4, "num_ctas": 1, "num_stages": 4, "num_buffers_warp_spec": 0, "num_consumer_groups": 0, "reg_dec_producer": 0, "reg_inc_consumer": 0}, "(1024, 4096, 4096, 4096, 1)": {"BLOCK_SIZE_M": 64, "BLOCK_SIZE_N": 256, "BLOCK_SIZE_K": 64, "GROUP_SIZE_M": 8, "A_load_order": 0, "meta_evict_policy": "", "num_warps": 4, "num_ctas": 1, "num_stages": 4, "num_buffers_warp_spec": 0, "num_consumer_groups": 0, "reg_dec_producer": 0, "reg_inc_consumer": 0}, "(1024, 28672, 4096, 4096, 1)": {"BLOCK_SIZE_M": 64, "BLOCK_SIZE_N": 256, "BLOCK_SIZE_K": 64, "GROUP_SIZE_M": 8, "A_load_order": 2, "meta_evict_policy": "", "num_warps": 4, "num_ctas": 1, "num_stages": 4, "num_buffers_warp_spec": 0, "num_consumer_groups": 0, "reg_dec_producer": 0, "reg_inc_consumer": 0}, "(1024, 4096, 14336, 14336, 1)": {"BLOCK_SIZE_M": 64, "BLOCK_SIZE_N": 256, "BLOCK_SIZE_K": 64, "GROUP_SIZE_M": 8, "A_load_order": 2, "meta_evict_policy": "", "num_warps": 4, "num_ctas": 1, "num_stages": 4, "num_buffers_warp_spec": 0, "num_consumer_groups": 0, "reg_dec_producer": 0, "reg_inc_consumer": 0}, "(256, 6144, 4096, 4096, 1)": {"BLOCK_SIZE_M": 64, "BLOCK_SIZE_N": 128, "BLOCK_SIZE_K": 64, "GROUP_SIZE_M": 8, "A_load_order": 0, "meta_evict_policy": "", "num_warps": 4, "num_ctas": 1, "num_stages": 2, "num_buffers_warp_spec": 0, "num_consumer_groups": 0, "reg_dec_producer": 0, "reg_inc_consumer": 0}, "(256, 4096, 4096, 4096, 1)": {"BLOCK_SIZE_M": 64, "BLOCK_SIZE_N": 256, "BLOCK_SIZE_K": 64, "GROUP_SIZE_M": 8, "A_load_order": 0, "meta_evict_policy": "", "num_warps": 4, "num_ctas": 1, "num_stages": 4, "num_buffers_warp_spec": 0, "num_consumer_groups": 0, "reg_dec_producer": 0, "reg_inc_consumer": 0}, "(256, 28672, 4096, 4096, 1)": {"BLOCK_SIZE_M": 64, "BLOCK_SIZE_N": 256, "BLOCK_SIZE_K": 64, "GROUP_SIZE_M": 8, "A_load_order": 2, "meta_evict_policy": "", "num_warps": 4, "num_ctas": 1, "num_stages": 4, "num_buffers_warp_spec": 0, "num_consumer_groups": 0, "reg_dec_producer": 0, "reg_inc_consumer": 0}, "(256, 4096, 14336, 14336, 1)": {"BLOCK_SIZE_M": 64, "BLOCK_SIZE_N": 256, "BLOCK_SIZE_K": 64, "GROUP_SIZE_M": 8, "A_load_order": 0, "meta_evict_policy": "", "num_warps": 4, "num_ctas": 1, "num_stages": 4, "num_buffers_warp_spec": 0, "num_consumer_groups": 0, "reg_dec_producer": 0, "reg_inc_consumer": 0}, "(128, 6144, 4096, 4096, 1)": {"BLOCK_SIZE_M": 64, "BLOCK_SIZE_N": 64, "BLOCK_SIZE_K": 256, "GROUP_SIZE_M": 8, "A_load_order": 0, "meta_evict_policy": "", "num_warps": 4, "num_ctas": 1, "num_stages": 2, "num_buffers_warp_spec": 0, "num_consumer_groups": 0, "reg_dec_producer": 0, "reg_inc_consumer": 0}, "(128, 4096, 4096, 4096, 1)": {"BLOCK_SIZE_M": 64, "BLOCK_SIZE_N": 64, "BLOCK_SIZE_K": 256, "GROUP_SIZE_M": 8, "A_load_order": 0, "meta_evict_policy": "", "num_warps": 8, "num_ctas": 1, "num_stages": 2, "num_buffers_warp_spec": 0, "num_consumer_groups": 0, "reg_dec_producer": 0, "reg_inc_consumer": 0}, "(128, 28672, 4096, 4096, 1)": {"BLOCK_SIZE_M": 64, "BLOCK_SIZE_N": 64, "BLOCK_SIZE_K": 256, "GROUP_SIZE_M": 8, "A_load_order": 2, "meta_evict_policy": "", "num_warps": 4, "num_ctas": 1, "num_stages": 2, "num_buffers_warp_spec": 0, "num_consumer_groups": 0, "reg_dec_producer": 0, "reg_inc_consumer": 0}, "(128, 4096, 14336, 14336, 1)": {"BLOCK_SIZE_M": 64, "BLOCK_SIZE_N": 128, "BLOCK_SIZE_K": 128, "GROUP_SIZE_M": 8, "A_load_order": 0, "meta_evict_policy": "", "num_warps": 4, "num_ctas": 1, "num_stages": 4, "num_buffers_warp_spec": 0, "num_consumer_groups": 0, "reg_dec_producer": 0, "reg_inc_consumer": 0}, "(512, 6144, 4096, 4096, 1)": {"BLOCK_SIZE_M": 64, "BLOCK_SIZE_N": 128, "BLOCK_SIZE_K": 64, "GROUP_SIZE_M": 8, "A_load_order": 0, "meta_evict_policy": "", "num_warps": 4, "num_ctas": 1, "num_stages": 4, "num_buffers_warp_spec": 0, "num_consumer_groups": 0, "reg_dec_producer": 0, "reg_inc_consumer": 0}, "(512, 4096, 4096, 4096, 1)": {"BLOCK_SIZE_M": 64, "BLOCK_SIZE_N": 256, "BLOCK_SIZE_K": 64, "GROUP_SIZE_M": 8, "A_load_order": 2, "meta_evict_policy": "", "num_warps": 4, "num_ctas": 1, "num_stages": 4, "num_buffers_warp_spec": 0, "num_consumer_groups": 0, "reg_dec_producer": 0, "reg_inc_consumer": 0}, "(512, 28672, 4096, 4096, 1)": {"BLOCK_SIZE_M": 64, "BLOCK_SIZE_N": 256, "BLOCK_SIZE_K": 64, "GROUP_SIZE_M": 8, "A_load_order": 2, "meta_evict_policy": "", "num_warps": 4, "num_ctas": 1, "num_stages": 4, "num_buffers_warp_spec": 0, "num_consumer_groups": 0, "reg_dec_producer": 0, "reg_inc_consumer": 0}, "(512, 4096, 14336, 14336, 1)": {"BLOCK_SIZE_M": 64, "BLOCK_SIZE_N": 256, "BLOCK_SIZE_K": 64, "GROUP_SIZE_M": 8, "A_load_order": 2, "meta_evict_policy": "", "num_warps": 4, "num_ctas": 1, "num_stages": 4, "num_buffers_warp_spec": 0, "num_consumer_groups": 0, "reg_dec_producer": 0, "reg_inc_consumer": 0}, "(1024, 6144, 4096, 128, 8)": {"BLOCK_SIZE_M": 64, "BLOCK_SIZE_N": 128, "BLOCK_SIZE_K": 32, "GROUP_SIZE_M": 8, "A_load_order": 2, "meta_evict_policy": "", "num_warps": 8, "num_ctas": 1, "num_stages": 1, "num_buffers_warp_spec": 0, "num_consumer_groups": 0, "reg_dec_producer": 0, "reg_inc_consumer": 0}, "(1024, 4096, 4096, 128, 8)": {"BLOCK_SIZE_M": 64, "BLOCK_SIZE_N": 128, "BLOCK_SIZE_K": 32, "GROUP_SIZE_M": 8, "A_load_order": 2, "meta_evict_policy": "", "num_warps": 8, "num_ctas": 1, "num_stages": 1, "num_buffers_warp_spec": 0, "num_consumer_groups": 0, "reg_dec_producer": 0, "reg_inc_consumer": 0}, "(1024, 28672, 4096, 128, 8)": {"BLOCK_SIZE_M": 64, "BLOCK_SIZE_N": 128, "BLOCK_SIZE_K": 32, "GROUP_SIZE_M": 8, "A_load_order": 2, "meta_evict_policy": "", "num_warps": 8, "num_ctas": 1, "num_stages": 1, "num_buffers_warp_spec": 0, "num_consumer_groups": 0, "reg_dec_producer": 0, "reg_inc_consumer": 0}, "(1024, 4096, 14336, 128, 8)": {"BLOCK_SIZE_M": 64, "BLOCK_SIZE_N": 128, "BLOCK_SIZE_K": 32, "GROUP_SIZE_M": 8, "A_load_order": 2, "meta_evict_policy": "", "num_warps": 8, "num_ctas": 1, "num_stages": 1, "num_buffers_warp_spec": 0, "num_consumer_groups": 0, "reg_dec_producer": 0, "reg_inc_consumer": 0}, "(256, 6144, 4096, 128, 8)": {"BLOCK_SIZE_M": 64, "BLOCK_SIZE_N": 64, "BLOCK_SIZE_K": 32, "GROUP_SIZE_M": 8, "A_load_order": 0, "meta_evict_policy": "", "num_warps": 4, "num_ctas": 1, "num_stages": 1, "num_buffers_warp_spec": 0, "num_consumer_groups": 0, "reg_dec_producer": 0, "reg_inc_consumer": 0}, "(256, 4096, 4096, 128, 8)": {"BLOCK_SIZE_M": 64, "BLOCK_SIZE_N": 64, "BLOCK_SIZE_K": 64, "GROUP_SIZE_M": 8, "A_load_order": 2, "meta_evict_policy": "", "num_warps": 4, "num_ctas": 1, "num_stages": 1, "num_buffers_warp_spec": 0, "num_consumer_groups": 0, "reg_dec_producer": 0, "reg_inc_consumer": 0}, "(256, 28672, 4096, 128, 8)": {"BLOCK_SIZE_M": 64, "BLOCK_SIZE_N": 128, "BLOCK_SIZE_K": 32, "GROUP_SIZE_M": 8, "A_load_order": 2, "meta_evict_policy": "", "num_warps": 8, "num_ctas": 1, "num_stages": 1, "num_buffers_warp_spec": 0, "num_consumer_groups": 0, "reg_dec_producer": 0, "reg_inc_consumer": 0}, "(256, 4096, 14336, 128, 8)": {"BLOCK_SIZE_M": 64, "BLOCK_SIZE_N": 128, "BLOCK_SIZE_K": 128, "GROUP_SIZE_M": 8, "A_load_order": 0, "meta_evict_policy": "", "num_warps": 8, "num_ctas": 1, "num_stages": 1, "num_buffers_warp_spec": 0, "num_consumer_groups": 0, "reg_dec_producer": 0, "reg_inc_consumer": 0}, "(128, 6144, 4096, 128, 8)": {"BLOCK_SIZE_M": 64, "BLOCK_SIZE_N": 64, "BLOCK_SIZE_K": 64, "GROUP_SIZE_M": 8, "A_load_order": 2, "meta_evict_policy": "", "num_warps": 4, "num_ctas": 1, "num_stages": 1, "num_buffers_warp_spec": 0, "num_consumer_groups": 0, "reg_dec_producer": 0, "reg_inc_consumer": 0}, "(128, 4096, 4096, 128, 8)": {"BLOCK_SIZE_M": 64, "BLOCK_SIZE_N": 64, "BLOCK_SIZE_K": 128, "GROUP_SIZE_M": 8, "A_load_order": 2, "meta_evict_policy": "", "num_warps": 8, "num_ctas": 1, "num_stages": 1, "num_buffers_warp_spec": 0, "num_consumer_groups": 0, "reg_dec_producer": 0, "reg_inc_consumer": 0}, "(128, 28672, 4096, 128, 8)": {"BLOCK_SIZE_M": 64, "BLOCK_SIZE_N": 64, "BLOCK_SIZE_K": 32, "GROUP_SIZE_M": 8, "A_load_order": 0, "meta_evict_policy": "", "num_warps": 4, "num_ctas": 1, "num_stages": 1, "num_buffers_warp_spec": 0, "num_consumer_groups": 0, "reg_dec_producer": 0, "reg_inc_consumer": 0}, "(128, 4096, 14336, 128, 8)": {"BLOCK_SIZE_M": 64, "BLOCK_SIZE_N": 64, "BLOCK_SIZE_K": 128, "GROUP_SIZE_M": 8, "A_load_order": 2, "meta_evict_policy": "", "num_warps": 4, "num_ctas": 1, "num_stages": 1, "num_buffers_warp_spec": 0, "num_consumer_groups": 0, "reg_dec_producer": 0, "reg_inc_consumer": 0}, "(512, 6144, 4096, 128, 8)": {"BLOCK_SIZE_M": 64, "BLOCK_SIZE_N": 128, "BLOCK_SIZE_K": 32, "GROUP_SIZE_M": 8, "A_load_order": 2, "meta_evict_policy": "", "num_warps": 8, "num_ctas": 1, "num_stages": 1, "num_buffers_warp_spec": 0, "num_consumer_groups": 0, "reg_dec_producer": 0, "reg_inc_consumer": 0}, "(512, 4096, 4096, 128, 8)": {"BLOCK_SIZE_M": 64, "BLOCK_SIZE_N": 128, "BLOCK_SIZE_K": 128, "GROUP_SIZE_M": 8, "A_load_order": 0, "meta_evict_policy": "", "num_warps": 8, "num_ctas": 1, "num_stages": 1, "num_buffers_warp_spec": 0, "num_consumer_groups": 0, "reg_dec_producer": 0, "reg_inc_consumer": 0}, "(512, 28672, 4096, 128, 8)": {"BLOCK_SIZE_M": 64, "BLOCK_SIZE_N": 128, "BLOCK_SIZE_K": 32, "GROUP_SIZE_M": 8, "A_load_order": 2, "meta_evict_policy": "", "num_warps": 8, "num_ctas": 1, "num_stages": 1, "num_buffers_warp_spec": 0, "num_consumer_groups": 0, "reg_dec_producer": 0, "reg_inc_consumer": 0}, "(512, 4096, 14336, 128, 8)": {"BLOCK_SIZE_M": 64, "BLOCK_SIZE_N": 128, "BLOCK_SIZE_K": 128, "GROUP_SIZE_M": 8, "A_load_order": 0, "meta_evict_policy": "", "num_warps": 8, "num_ctas": 1, "num_stages": 1, "num_buffers_warp_spec": 0, "num_consumer_groups": 0, "reg_dec_producer": 0, "reg_inc_consumer": 0}, "(1024, 2560, 2048, 128, 8)": {"BLOCK_SIZE_M": 64, "BLOCK_SIZE_N": 128, "BLOCK_SIZE_K": 32, "GROUP_SIZE_M": 8, "A_load_order": 2, "meta_evict_policy": "", "num_warps": 8, "num_ctas": 1, "num_stages": 1, "num_buffers_warp_spec": 0, "num_consumer_groups": 0, "reg_dec_producer": 0, "reg_inc_consumer": 0}, "(1024, 2048, 2048, 128, 8)": {"BLOCK_SIZE_M": 64, "BLOCK_SIZE_N": 128, "BLOCK_SIZE_K": 32, "GROUP_SIZE_M": 8, "A_load_order": 2, "meta_evict_policy": "", "num_warps": 8, "num_ctas": 1, "num_stages": 1, "num_buffers_warp_spec": 0, "num_consumer_groups": 0, "reg_dec_producer": 0, "reg_inc_consumer": 0}, "(1024, 22016, 2048, 128, 8)": {"BLOCK_SIZE_M": 64, "BLOCK_SIZE_N": 128, "BLOCK_SIZE_K": 32, "GROUP_SIZE_M": 8, "A_load_order": 2, "meta_evict_policy": "", "num_warps": 8, "num_ctas": 1, "num_stages": 1, "num_buffers_warp_spec": 0, "num_consumer_groups": 0, "reg_dec_producer": 0, "reg_inc_consumer": 0}, "(1024, 2048, 11008, 128, 8)": {"BLOCK_SIZE_M": 64, "BLOCK_SIZE_N": 128, "BLOCK_SIZE_K": 32, "GROUP_SIZE_M": 8, "A_load_order": 2, "meta_evict_policy": "", "num_warps": 8, "num_ctas": 1, "num_stages": 1, "num_buffers_warp_spec": 0, "num_consumer_groups": 0, "reg_dec_producer": 0, "reg_inc_consumer": 0}, "(256, 2560, 2048, 128, 8)": {"BLOCK_SIZE_M": 64, "BLOCK_SIZE_N": 64, "BLOCK_SIZE_K": 128, "GROUP_SIZE_M": 8, "A_load_order": 2, "meta_evict_policy": "", "num_warps": 8, "num_ctas": 1, "num_stages": 1, "num_buffers_warp_spec": 0, "num_consumer_groups": 0, "reg_dec_producer": 0, "reg_inc_consumer": 0}, "(256, 2048, 2048, 128, 8)": {"BLOCK_SIZE_M": 64, "BLOCK_SIZE_N": 64, "BLOCK_SIZE_K": 128, "GROUP_SIZE_M": 8, "A_load_order": 2, "meta_evict_policy": "", "num_warps": 8, "num_ctas": 1, "num_stages": 1, "num_buffers_warp_spec": 0, "num_consumer_groups": 0, "reg_dec_producer": 0, "reg_inc_consumer": 0}, "(256, 22016, 2048, 128, 8)": {"BLOCK_SIZE_M": 64, "BLOCK_SIZE_N": 64, "BLOCK_SIZE_K": 32, "GROUP_SIZE_M": 8, "A_load_order": 0, "meta_evict_policy": "", "num_warps": 4, "num_ctas": 1, "num_stages": 1, "num_buffers_warp_spec": 0, "num_consumer_groups": 0, "reg_dec_producer": 0, "reg_inc_consumer": 0}, "(256, 2048, 11008, 128, 8)": {"BLOCK_SIZE_M": 64, "BLOCK_SIZE_N": 64, "BLOCK_SIZE_K": 64, "GROUP_SIZE_M": 8, "A_load_order": 2, "meta_evict_policy": "", "num_warps": 8, "num_ctas": 1, "num_stages": 1, "num_buffers_warp_spec": 0, "num_consumer_groups": 0, "reg_dec_producer": 0, "reg_inc_consumer": 0}, "(128, 2560, 2048, 128, 8)": {"BLOCK_SIZE_M": 64, "BLOCK_SIZE_N": 32, "BLOCK_SIZE_K": 128, "GROUP_SIZE_M": 8, "A_load_order": 2, "meta_evict_policy": "", "num_warps": 8, "num_ctas": 1, "num_stages": 1, "num_buffers_warp_spec": 0, "num_consumer_groups": 0, "reg_dec_producer": 0, "reg_inc_consumer": 0}, "(128, 2048, 2048, 128, 8)": {"BLOCK_SIZE_M": 64, "BLOCK_SIZE_N": 32, "BLOCK_SIZE_K": 128, "GROUP_SIZE_M": 8, "A_load_order": 2, "meta_evict_policy": "", "num_warps": 8, "num_ctas": 1, "num_stages": 1, "num_buffers_warp_spec": 0, "num_consumer_groups": 0, "reg_dec_producer": 0, "reg_inc_consumer": 0}, "(128, 22016, 2048, 128, 8)": {"BLOCK_SIZE_M": 64, "BLOCK_SIZE_N": 64, "BLOCK_SIZE_K": 128, "GROUP_SIZE_M": 8, "A_load_order": 0, "meta_evict_policy": "", "num_warps": 4, "num_ctas": 1, "num_stages": 1, "num_buffers_warp_spec": 0, "num_consumer_groups": 0, "reg_dec_producer": 0, "reg_inc_consumer": 0}, "(128, 2048, 11008, 128, 8)": {"BLOCK_SIZE_M": 64, "BLOCK_SIZE_N": 32, "BLOCK_SIZE_K": 128, "GROUP_SIZE_M": 8, "A_load_order": 2, "meta_evict_policy": "", "num_warps": 8, "num_ctas": 1, "num_stages": 1, "num_buffers_warp_spec": 0, "num_consumer_groups": 0, "reg_dec_producer": 0, "reg_inc_consumer": 0}, "(512, 2560, 2048, 128, 8)": {"BLOCK_SIZE_M": 64, "BLOCK_SIZE_N": 64, "BLOCK_SIZE_K": 64, "GROUP_SIZE_M": 8, "A_load_order": 2, "meta_evict_policy": "", "num_warps": 4, "num_ctas": 1, "num_stages": 1, "num_buffers_warp_spec": 0, "num_consumer_groups": 0, "reg_dec_producer": 0, "reg_inc_consumer": 0}, "(512, 2048, 2048, 128, 8)": {"BLOCK_SIZE_M": 64, "BLOCK_SIZE_N": 64, "BLOCK_SIZE_K": 128, "GROUP_SIZE_M": 8, "A_load_order": 2, "meta_evict_policy": "", "num_warps": 4, "num_ctas": 1, "num_stages": 1, "num_buffers_warp_spec": 0, "num_consumer_groups": 0, "reg_dec_producer": 0, "reg_inc_consumer": 0}, "(512, 22016, 2048, 128, 8)": {"BLOCK_SIZE_M": 64, "BLOCK_SIZE_N": 128, "BLOCK_SIZE_K": 32, "GROUP_SIZE_M": 8, "A_load_order": 2, "meta_evict_policy": "", "num_warps": 8, "num_ctas": 1, "num_stages": 1, "num_buffers_warp_spec": 0, "num_consumer_groups": 0, "reg_dec_producer": 0, "reg_inc_consumer": 0}, "(512, 2048, 11008, 128, 8)": {"BLOCK_SIZE_M": 64, "BLOCK_SIZE_N": 64, "BLOCK_SIZE_K": 128, "GROUP_SIZE_M": 8, "A_load_order": 2, "meta_evict_policy": "", "num_warps": 4, "num_ctas": 1, "num_stages": 1, "num_buffers_warp_spec": 0, "num_consumer_groups": 0, "reg_dec_producer": 0, "reg_inc_consumer": 0}, "(1024, 2048, 1536, 128, 8)": {"BLOCK_SIZE_M": 64, "BLOCK_SIZE_N": 128, "BLOCK_SIZE_K": 32, "GROUP_SIZE_M": 8, "A_load_order": 2, "meta_evict_policy": "", "num_warps": 8, "num_ctas": 1, "num_stages": 1, "num_buffers_warp_spec": 0, "num_consumer_groups": 0, "reg_dec_producer": 0, "reg_inc_consumer": 0}, "(1024, 1536, 1536, 128, 8)": {"BLOCK_SIZE_M": 64, "BLOCK_SIZE_N": 128, "BLOCK_SIZE_K": 32, "GROUP_SIZE_M": 8, "A_load_order": 2, "meta_evict_policy": "", "num_warps": 8, "num_ctas": 1, "num_stages": 1, "num_buffers_warp_spec": 0, "num_consumer_groups": 0, "reg_dec_producer": 0, "reg_inc_consumer": 0}, "(1024, 17920, 1536, 128, 8)": {"BLOCK_SIZE_M": 64, "BLOCK_SIZE_N": 128, "BLOCK_SIZE_K": 32, "GROUP_SIZE_M": 8, "A_load_order": 2, "meta_evict_policy": "", "num_warps": 8, "num_ctas": 1, "num_stages": 1, "num_buffers_warp_spec": 0, "num_consumer_groups": 0, "reg_dec_producer": 0, "reg_inc_consumer": 0}, "(1024, 1536, 8960, 128, 8)": {"BLOCK_SIZE_M": 64, "BLOCK_SIZE_N": 128, "BLOCK_SIZE_K": 32, "GROUP_SIZE_M": 8, "A_load_order": 2, "meta_evict_policy": "", "num_warps": 8, "num_ctas": 1, "num_stages": 1, "num_buffers_warp_spec": 0, "num_consumer_groups": 0, "reg_dec_producer": 0, "reg_inc_consumer": 0}, "(256, 2048, 1536, 128, 8)": {"BLOCK_SIZE_M": 64, "BLOCK_SIZE_N": 64, "BLOCK_SIZE_K": 128, "GROUP_SIZE_M": 8, "A_load_order": 2, "meta_evict_policy": "", "num_warps": 8, "num_ctas": 1, "num_stages": 1, "num_buffers_warp_spec": 0, "num_consumer_groups": 0, "reg_dec_producer": 0, "reg_inc_consumer": 0}, "(256, 1536, 1536, 128, 8)": {"BLOCK_SIZE_M": 64, "BLOCK_SIZE_N": 64, "BLOCK_SIZE_K": 128, "GROUP_SIZE_M": 8, "A_load_order": 2, "meta_evict_policy": "", "num_warps": 8, "num_ctas": 1, "num_stages": 1, "num_buffers_warp_spec": 0, "num_consumer_groups": 0, "reg_dec_producer": 0, "reg_inc_consumer": 0}, "(256, 17920, 1536, 128, 8)": {"BLOCK_SIZE_M": 64, "BLOCK_SIZE_N": 128, "BLOCK_SIZE_K": 32, "GROUP_SIZE_M": 8, "A_load_order": 2, "meta_evict_policy": "", "num_warps": 8, "num_ctas": 1, "num_stages": 1, "num_buffers_warp_spec": 0, "num_consumer_groups": 0, "reg_dec_producer": 0, "reg_inc_consumer": 0}, "(256, 1536, 8960, 128, 8)": {"BLOCK_SIZE_M": 64, "BLOCK_SIZE_N": 32, "BLOCK_SIZE_K": 64, "GROUP_SIZE_M": 8, "A_load_order": 2, "meta_evict_policy": "", "num_warps": 4, "num_ctas": 1, "num_stages": 1, "num_buffers_warp_spec": 0, "num_consumer_groups": 0, "reg_dec_producer": 0, "reg_inc_consumer": 0}, "(128, 2048, 1536, 128, 8)": {"BLOCK_SIZE_M": 64, "BLOCK_SIZE_N": 32, "BLOCK_SIZE_K": 128, "GROUP_SIZE_M": 8, "A_load_order": 2, "meta_evict_policy": "", "num_warps": 8, "num_ctas": 1, "num_stages": 1, "num_buffers_warp_spec": 0, "num_consumer_groups": 0, "reg_dec_producer": 0, "reg_inc_consumer": 0}, "(128, 1536, 1536, 128, 8)": {"BLOCK_SIZE_M": 64, "BLOCK_SIZE_N": 32, "BLOCK_SIZE_K": 128, "GROUP_SIZE_M": 8, "A_load_order": 2, "meta_evict_policy": "", "num_warps": 8, "num_ctas": 1, "num_stages": 1, "num_buffers_warp_spec": 0, "num_consumer_groups": 0, "reg_dec_producer": 0, "reg_inc_consumer": 0}, "(128, 17920, 1536, 128, 8)": {"BLOCK_SIZE_M": 64, "BLOCK_SIZE_N": 64, "BLOCK_SIZE_K": 32, "GROUP_SIZE_M": 8, "A_load_order": 2, "meta_evict_policy": "", "num_warps": 4, "num_ctas": 1, "num_stages": 1, "num_buffers_warp_spec": 0, "num_consumer_groups": 0, "reg_dec_producer": 0, "reg_inc_consumer": 0}, "(128, 1536, 8960, 128, 8)": {"BLOCK_SIZE_M": 64, "BLOCK_SIZE_N": 32, "BLOCK_SIZE_K": 128, "GROUP_SIZE_M": 8, "A_load_order": 2, "meta_evict_policy": "", "num_warps": 8, "num_ctas": 1, "num_stages": 1, "num_buffers_warp_spec": 0, "num_consumer_groups": 0, "reg_dec_producer": 0, "reg_inc_consumer": 0}, "(512, 2048, 1536, 128, 8)": {"BLOCK_SIZE_M": 64, "BLOCK_SIZE_N": 64, "BLOCK_SIZE_K": 64, "GROUP_SIZE_M": 8, "A_load_order": 2, "meta_evict_policy": "", "num_warps": 8, "num_ctas": 1, "num_stages": 1, "num_buffers_warp_spec": 0, "num_consumer_groups": 0, "reg_dec_producer": 0, "reg_inc_consumer": 0}, "(512, 1536, 1536, 128, 8)": {"BLOCK_SIZE_M": 64, "BLOCK_SIZE_N": 32, "BLOCK_SIZE_K": 64, "GROUP_SIZE_M": 8, "A_load_order": 2, "meta_evict_policy": "", "num_warps": 4, "num_ctas": 1, "num_stages": 1, "num_buffers_warp_spec": 0, "num_consumer_groups": 0, "reg_dec_producer": 0, "reg_inc_consumer": 0}, "(512, 17920, 1536, 128, 8)": {"BLOCK_SIZE_M": 64, "BLOCK_SIZE_N": 64, "BLOCK_SIZE_K": 32, "GROUP_SIZE_M": 8, "A_load_order": 0, "meta_evict_policy": "", "num_warps": 4, "num_ctas": 1, "num_stages": 1, "num_buffers_warp_spec": 0, "num_consumer_groups": 0, "reg_dec_producer": 0, "reg_inc_consumer": 0}, "(512, 1536, 8960, 128, 8)": {"BLOCK_SIZE_M": 64, "BLOCK_SIZE_N": 32, "BLOCK_SIZE_K": 128, "GROUP_SIZE_M": 8, "A_load_order": 2, "meta_evict_policy": "", "num_warps": 4, "num_ctas": 1, "num_stages": 1, "num_buffers_warp_spec": 0, "num_consumer_groups": 0, "reg_dec_producer": 0, "reg_inc_consumer": 0}, "(1024, 4608, 3584, 128, 8)": {"BLOCK_SIZE_M": 64, "BLOCK_SIZE_N": 128, "BLOCK_SIZE_K": 32, "GROUP_SIZE_M": 8, "A_load_order": 2, "meta_evict_policy": "", "num_warps": 8, "num_ctas": 1, "num_stages": 1, "num_buffers_warp_spec": 0, "num_consumer_groups": 0, "reg_dec_producer": 0, "reg_inc_consumer": 0}, "(1024, 3584, 3584, 128, 8)": {"BLOCK_SIZE_M": 64, "BLOCK_SIZE_N": 128, "BLOCK_SIZE_K": 32, "GROUP_SIZE_M": 8, "A_load_order": 2, "meta_evict_policy": "", "num_warps": 8, "num_ctas": 1, "num_stages": 1, "num_buffers_warp_spec": 0, "num_consumer_groups": 0, "reg_dec_producer": 0, "reg_inc_consumer": 0}, "(1024, 37888, 3584, 128, 8)": {"BLOCK_SIZE_M": 64, "BLOCK_SIZE_N": 128, "BLOCK_SIZE_K": 32, "GROUP_SIZE_M": 8, "A_load_order": 2, "meta_evict_policy": "", "num_warps": 8, "num_ctas": 1, "num_stages": 1, "num_buffers_warp_spec": 0, "num_consumer_groups": 0, "reg_dec_producer": 0, "reg_inc_consumer": 0}, "(1024, 3584, 18944, 128, 8)": {"BLOCK_SIZE_M": 64, "BLOCK_SIZE_N": 256, "BLOCK_SIZE_K": 32, "GROUP_SIZE_M": 8, "A_load_order": 2, "meta_evict_policy": "", "num_warps": 4, "num_ctas": 1, "num_stages": 1, "num_buffers_warp_spec": 0, "num_consumer_groups": 0, "reg_dec_producer": 0, "reg_inc_consumer": 0}, "(256, 4608, 3584, 128, 8)": {"BLOCK_SIZE_M": 64, "BLOCK_SIZE_N": 128, "BLOCK_SIZE_K": 128, "GROUP_SIZE_M": 8, "A_load_order": 0, "meta_evict_policy": "", "num_warps": 8, "num_ctas": 1, "num_stages": 1, "num_buffers_warp_spec": 0, "num_consumer_groups": 0, "reg_dec_producer": 0, "reg_inc_consumer": 0}, "(256, 3584, 3584, 128, 8)": {"BLOCK_SIZE_M": 64, "BLOCK_SIZE_N": 64, "BLOCK_SIZE_K": 64, "GROUP_SIZE_M": 8, "A_load_order": 2, "meta_evict_policy": "", "num_warps": 4, "num_ctas": 1, "num_stages": 1, "num_buffers_warp_spec": 0, "num_consumer_groups": 0, "reg_dec_producer": 0, "reg_inc_consumer": 0}, "(256, 37888, 3584, 128, 8)": {"BLOCK_SIZE_M": 64, "BLOCK_SIZE_N": 128, "BLOCK_SIZE_K": 32, "GROUP_SIZE_M": 8, "A_load_order": 2, "meta_evict_policy": "", "num_warps": 8, "num_ctas": 1, "num_stages": 1, "num_buffers_warp_spec": 0, "num_consumer_groups": 0, "reg_dec_producer": 0, "reg_inc_consumer": 0}, "(256, 3584, 18944, 128, 8)": {"BLOCK_SIZE_M": 64, "BLOCK_SIZE_N": 64, "BLOCK_SIZE_K": 64, "GROUP_SIZE_M": 8, "A_load_order": 2, "meta_evict_policy": "", "num_warps": 4, "num_ctas": 1, "num_stages": 1, "num_buffers_warp_spec": 0, "num_consumer_groups": 0, "reg_dec_producer": 0, "reg_inc_consumer": 0}, "(128, 4608, 3584, 128, 8)": {"BLOCK_SIZE_M": 64, "BLOCK_SIZE_N": 64, "BLOCK_SIZE_K": 128, "GROUP_SIZE_M": 8, "A_load_order": 2, "meta_evict_policy": "", "num_warps": 8, "num_ctas": 1, "num_stages": 1, "num_buffers_warp_spec": 0, "num_consumer_groups": 0, "reg_dec_producer": 0, "reg_inc_consumer": 0}, "(128, 3584, 3584, 128, 8)": {"BLOCK_SIZE_M": 64, "BLOCK_SIZE_N": 64, "BLOCK_SIZE_K": 128, "GROUP_SIZE_M": 8, "A_load_order": 2, "meta_evict_policy": "", "num_warps": 8, "num_ctas": 1, "num_stages": 1, "num_buffers_warp_spec": 0, "num_consumer_groups": 0, "reg_dec_producer": 0, "reg_inc_consumer": 0}, "(128, 37888, 3584, 128, 8)": {"BLOCK_SIZE_M": 64, "BLOCK_SIZE_N": 128, "BLOCK_SIZE_K": 32, "GROUP_SIZE_M": 8, "A_load_order": 2, "meta_evict_policy": "", "num_warps": 8, "num_ctas": 1, "num_stages": 1, "num_buffers_warp_spec": 0, "num_consumer_groups": 0, "reg_dec_producer": 0, "reg_inc_consumer": 0}, "(128, 3584, 18944, 128, 8)": {"BLOCK_SIZE_M": 64, "BLOCK_SIZE_N": 64, "BLOCK_SIZE_K": 128, "GROUP_SIZE_M": 8, "A_load_order": 2, "meta_evict_policy": "", "num_warps": 4, "num_ctas": 1, "num_stages": 1, "num_buffers_warp_spec": 0, "num_consumer_groups": 0, "reg_dec_producer": 0, "reg_inc_consumer": 0}, "(512, 4608, 3584, 128, 8)": {"BLOCK_SIZE_M": 64, "BLOCK_SIZE_N": 64, "BLOCK_SIZE_K": 32, "GROUP_SIZE_M": 8, "A_load_order": 0, "meta_evict_policy": "", "num_warps": 4, "num_ctas": 1, "num_stages": 1, "num_buffers_warp_spec": 0, "num_consumer_groups": 0, "reg_dec_producer": 0, "reg_inc_consumer": 0}, "(512, 3584, 3584, 128, 8)": {"BLOCK_SIZE_M": 64, "BLOCK_SIZE_N": 128, "BLOCK_SIZE_K": 128, "GROUP_SIZE_M": 8, "A_load_order": 0, "meta_evict_policy": "", "num_warps": 8, "num_ctas": 1, "num_stages": 1, "num_buffers_warp_spec": 0, "num_consumer_groups": 0, "reg_dec_producer": 0, "reg_inc_consumer": 0}, "(512, 37888, 3584, 128, 8)": {"BLOCK_SIZE_M": 64, "BLOCK_SIZE_N": 128, "BLOCK_SIZE_K": 32, "GROUP_SIZE_M": 8, "A_load_order": 2, "meta_evict_policy": "", "num_warps": 8, "num_ctas": 1, "num_stages": 1, "num_buffers_warp_spec": 0, "num_consumer_groups": 0, "reg_dec_producer": 0, "reg_inc_consumer": 0}, "(512, 3584, 18944, 128, 8)": {"BLOCK_SIZE_M": 64, "BLOCK_SIZE_N": 128, "BLOCK_SIZE_K": 128, "GROUP_SIZE_M": 8, "A_load_order": 0, "meta_evict_policy": "", "num_warps": 8, "num_ctas": 1, "num_stages": 1, "num_buffers_warp_spec": 0, "num_consumer_groups": 0, "reg_dec_producer": 0, "reg_inc_consumer": 0}}}