gemlite/configs/h100.json
{"GEMV": {}, "GEMV_REVSPLITK": {"(1, 6144, 4096, 64, 8)": {"BLOCK_SIZE_M": 1, "BLOCK_SIZE_N": 256, "BLOCK_SIZE_K": 8, "A_load_order": 0, "meta_evict_policy": "", "atomic_mode": "relaxed", "dot_prod_mode": 0, "num_warps": 2, "num_ctas": 1, "num_stages": 1}, "(1, 4096, 4096, 64, 8)": {"BLOCK_SIZE_M": 1, "BLOCK_SIZE_N": 256, "BLOCK_SIZE_K": 16, "A_load_order": 1, "meta_evict_policy": "", "atomic_mode": "relaxed", "dot_prod_mode": 0, "num_warps": 2, "num_ctas": 1, "num_stages": 2}, "(1, 28672, 4096, 64, 8)": {"BLOCK_SIZE_M": 1, "BLOCK_SIZE_N": 256, "BLOCK_SIZE_K": 8, "A_load_order": 1, "meta_evict_policy": "", "atomic_mode": "relaxed", "dot_prod_mode": 0, "num_warps": 2, "num_ctas": 1, "num_stages": 2}, "(1, 4096, 14336, 64, 8)": {"BLOCK_SIZE_M": 1, "BLOCK_SIZE_N": 512, "BLOCK_SIZE_K": 8, "A_load_order": 0, "meta_evict_policy": "", "atomic_mode": "relaxed", "dot_prod_mode": 0, "num_warps": 4, "num_ctas": 1, "num_stages": 2}, "(1, 6144, 4096, 64, 2)": {"BLOCK_SIZE_M": 1, "BLOCK_SIZE_N": 128, "BLOCK_SIZE_K": 32, "A_load_order": 0, "meta_evict_policy": "", "atomic_mode": "relaxed", "dot_prod_mode": 0, "num_warps": 2, "num_ctas": 1, "num_stages": 1}, "(1, 4096, 4096, 64, 2)": {"BLOCK_SIZE_M": 1, "BLOCK_SIZE_N": 256, "BLOCK_SIZE_K": 32, "A_load_order": 1, "meta_evict_policy": "", "atomic_mode": "relaxed", "dot_prod_mode": 0, "num_warps": 2, "num_ctas": 1, "num_stages": 1}, "(1, 28672, 4096, 64, 2)": {"BLOCK_SIZE_M": 1, "BLOCK_SIZE_N": 256, "BLOCK_SIZE_K": 32, "A_load_order": 1, "meta_evict_policy": "", "atomic_mode": "relaxed", "dot_prod_mode": 0, "num_warps": 2, "num_ctas": 1, "num_stages": 2}, "(1, 4096, 14336, 64, 2)": {"BLOCK_SIZE_M": 1, "BLOCK_SIZE_N": 128, "BLOCK_SIZE_K": 32, "A_load_order": 1, "meta_evict_policy": "", "atomic_mode": "relaxed", "dot_prod_mode": 0, "num_warps": 2, "num_ctas": 1, "num_stages": 1}, "(1, 4608, 3584, 64, 8)": {"BLOCK_SIZE_M": 1, "BLOCK_SIZE_N": 256, "BLOCK_SIZE_K": 16, "A_load_order": 0, "meta_evict_policy": "", "atomic_mode": "relaxed", "dot_prod_mode": 0, "num_warps": 2, "num_ctas": 1, "num_stages": 1}, "(1, 3584, 3584, 64, 8)": {"BLOCK_SIZE_M": 1, "BLOCK_SIZE_N": 256, "BLOCK_SIZE_K": 16, "A_load_order": 0, "meta_evict_policy": "", "atomic_mode": "relaxed", "dot_prod_mode": 0, "num_warps": 2, "num_ctas": 1, "num_stages": 2}, "(1, 37888, 3584, 64, 8)": {"BLOCK_SIZE_M": 1, "BLOCK_SIZE_N": 256, "BLOCK_SIZE_K": 8, "A_load_order": 0, "meta_evict_policy": "", "atomic_mode": "relaxed", "dot_prod_mode": 0, "num_warps": 2, "num_ctas": 1, "num_stages": 2}, "(1, 3584, 18944, 64, 8)": {"BLOCK_SIZE_M": 1, "BLOCK_SIZE_N": 256, "BLOCK_SIZE_K": 16, "A_load_order": 1, "meta_evict_policy": "", "atomic_mode": "relaxed", "dot_prod_mode": 0, "num_warps": 2, "num_ctas": 1, "num_stages": 2}, "(1, 4608, 3584, 64, 2)": {"BLOCK_SIZE_M": 1, "BLOCK_SIZE_N": 256, "BLOCK_SIZE_K": 32, "A_load_order": 1, "meta_evict_policy": "", "atomic_mode": "relaxed", "dot_prod_mode": 0, "num_warps": 2, "num_ctas": 1, "num_stages": 1}, "(1, 3584, 3584, 64, 2)": {"BLOCK_SIZE_M": 1, "BLOCK_SIZE_N": 128, "BLOCK_SIZE_K": 32, "A_load_order": 0, "meta_evict_policy": "", "atomic_mode": "relaxed", "dot_prod_mode": 0, "num_warps": 2, "num_ctas": 1, "num_stages": 1}, "(1, 37888, 3584, 64, 2)": {"BLOCK_SIZE_M": 1, "BLOCK_SIZE_N": 256, "BLOCK_SIZE_K": 32, "A_load_order": 0, "meta_evict_policy": "", "atomic_mode": "relaxed", "dot_prod_mode": 0, "num_warps": 2, "num_ctas": 1, "num_stages": 1}, "(1, 3584, 18944, 64, 2)": {"BLOCK_SIZE_M": 1, "BLOCK_SIZE_N": 256, "BLOCK_SIZE_K": 32, "A_load_order": 0, "meta_evict_policy": "", "atomic_mode": "relaxed", "dot_prod_mode": 0, "num_warps": 2, "num_ctas": 1, "num_stages": 1}, "(1, 6144, 2048, 64, 8)": {"BLOCK_SIZE_M": 1, "BLOCK_SIZE_N": 512, "BLOCK_SIZE_K": 8, "A_load_order": 0, "meta_evict_policy": "", "atomic_mode": "relaxed", "dot_prod_mode": 0, "num_warps": 4, "num_ctas": 1, "num_stages": 2}, "(1, 2048, 2048, 64, 8)": {"BLOCK_SIZE_M": 1, "BLOCK_SIZE_N": 256, "BLOCK_SIZE_K": 16, "A_load_order": 0, "meta_evict_policy": "", "atomic_mode": "relaxed", "dot_prod_mode": 0, "num_warps": 2, "num_ctas": 1, "num_stages": 1}, "(1, 11264, 2048, 64, 8)": {"BLOCK_SIZE_M": 1, "BLOCK_SIZE_N": 256, "BLOCK_SIZE_K": 8, "A_load_order": 0, "meta_evict_policy": "", "atomic_mode": "relaxed", "dot_prod_mode": 0, "num_warps": 2, "num_ctas": 1, "num_stages": 1}, "(1, 2048, 5632, 64, 8)": {"BLOCK_SIZE_M": 1, "BLOCK_SIZE_N": 256, "BLOCK_SIZE_K": 16, "A_load_order": 0, "meta_evict_policy": "", "atomic_mode": "relaxed", "dot_prod_mode": 0, "num_warps": 2, "num_ctas": 1, "num_stages": 1}, "(1, 3072, 4096, 64, 8)": {"BLOCK_SIZE_M": 1, "BLOCK_SIZE_N": 256, "BLOCK_SIZE_K": 16, "A_load_order": 1, "meta_evict_policy": "", "atomic_mode": "relaxed", "dot_prod_mode": 0, "num_warps": 2, "num_ctas": 1, "num_stages": 2}, "(1, 4096, 2048, 64, 8)": {"BLOCK_SIZE_M": 1, "BLOCK_SIZE_N": 256, "BLOCK_SIZE_K": 16, "A_load_order": 1, "meta_evict_policy": "", "atomic_mode": "relaxed", "dot_prod_mode": 0, "num_warps": 2, "num_ctas": 1, "num_stages": 2}, "(1, 14336, 4096, 64, 8)": {"BLOCK_SIZE_M": 1, "BLOCK_SIZE_N": 512, "BLOCK_SIZE_K": 8, "A_load_order": 1, "meta_evict_policy": "", "atomic_mode": "relaxed", "dot_prod_mode": 0, "num_warps": 4, "num_ctas": 1, "num_stages": 2}, "(1, 4096, 7168, 64, 8)": {"BLOCK_SIZE_M": 1, "BLOCK_SIZE_N": 256, "BLOCK_SIZE_K": 16, "A_load_order": 0, "meta_evict_policy": "", "atomic_mode": "relaxed", "dot_prod_mode": 0, "num_warps": 2, "num_ctas": 1, "num_stages": 2}, "(1, 1536, 4096, 64, 8)": {"BLOCK_SIZE_M": 1, "BLOCK_SIZE_N": 128, "BLOCK_SIZE_K": 16, "A_load_order": 1, "meta_evict_policy": "", "atomic_mode": "relaxed", "dot_prod_mode": 0, "num_warps": 2, "num_ctas": 1, "num_stages": 1}, "(1, 4096, 1024, 64, 8)": {"BLOCK_SIZE_M": 1, "BLOCK_SIZE_N": 256, "BLOCK_SIZE_K": 16, "A_load_order": 1, "meta_evict_policy": "", "atomic_mode": "relaxed", "dot_prod_mode": 0, "num_warps": 2, "num_ctas": 1, "num_stages": 1}, "(1, 7168, 4096, 64, 8)": {"BLOCK_SIZE_M": 1, "BLOCK_SIZE_N": 256, "BLOCK_SIZE_K": 8, "A_load_order": 1, "meta_evict_policy": "", "atomic_mode": "relaxed", "dot_prod_mode": 0, "num_warps": 2, "num_ctas": 1, "num_stages": 1}, "(1, 4096, 3584, 64, 8)": {"BLOCK_SIZE_M": 1, "BLOCK_SIZE_N": 256, "BLOCK_SIZE_K": 16, "A_load_order": 0, "meta_evict_policy": "", "atomic_mode": "relaxed", "dot_prod_mode": 0, "num_warps": 2, "num_ctas": 1, "num_stages": 1}, "(1, 1024, 4096, 64, 8)": {"BLOCK_SIZE_M": 1, "BLOCK_SIZE_N": 128, "BLOCK_SIZE_K": 16, "A_load_order": 0, "meta_evict_policy": "", "atomic_mode": "relaxed", "dot_prod_mode": 0, "num_warps": 2, "num_ctas": 1, "num_stages": 1}, "(1, 3072, 3072, 64, 8)": {"BLOCK_SIZE_M": 1, "BLOCK_SIZE_N": 128, "BLOCK_SIZE_K": 32, "A_load_order": 0, "meta_evict_policy": "", "atomic_mode": "relaxed", "dot_prod_mode": 0, "num_warps": 2, "num_ctas": 1, "num_stages": 1}, "(1, 1024, 3072, 64, 8)": {"BLOCK_SIZE_M": 1, "BLOCK_SIZE_N": 128, "BLOCK_SIZE_K": 16, "A_load_order": 1, "meta_evict_policy": "", "atomic_mode": "relaxed", "dot_prod_mode": 0, "num_warps": 2, "num_ctas": 1, "num_stages": 2}, "(1, 8192, 3072, 64, 8)": {"BLOCK_SIZE_M": 1, "BLOCK_SIZE_N": 256, "BLOCK_SIZE_K": 8, "A_load_order": 1, "meta_evict_policy": "", "atomic_mode": "relaxed", "dot_prod_mode": 0, "num_warps": 2, "num_ctas": 1, "num_stages": 1}, "(1, 3072, 8192, 64, 8)": {"BLOCK_SIZE_M": 1, "BLOCK_SIZE_N": 256, "BLOCK_SIZE_K": 16, "A_load_order": 1, "meta_evict_policy": "", "atomic_mode": "relaxed", "dot_prod_mode": 0, "num_warps": 2, "num_ctas": 1, "num_stages": 1}, "(1, 4096, 4096, 128, 8)": {"BLOCK_SIZE_M": 1, "BLOCK_SIZE_N": 512, "BLOCK_SIZE_K": 16, "A_load_order": 0, "meta_evict_policy": "", "atomic_mode": "relaxed", "dot_prod_mode": 0, "num_warps": 4, "num_ctas": 1, "num_stages": 2}, "(1, 1024, 4096, 128, 8)": {"BLOCK_SIZE_M": 1, "BLOCK_SIZE_N": 128, "BLOCK_SIZE_K": 16, "A_load_order": 0, "meta_evict_policy": "", "atomic_mode": "relaxed", "dot_prod_mode": 0, "num_warps": 2, "num_ctas": 1, "num_stages": 1}, "(1, 14336, 4096, 128, 8)": {"BLOCK_SIZE_M": 1, "BLOCK_SIZE_N": 256, "BLOCK_SIZE_K": 8, "A_load_order": 0, "meta_evict_policy": "", "atomic_mode": "relaxed", "dot_prod_mode": 0, "num_warps": 2, "num_ctas": 1, "num_stages": 2}, "(1, 4096, 14336, 128, 8)": {"BLOCK_SIZE_M": 1, "BLOCK_SIZE_N": 512, "BLOCK_SIZE_K": 8, "A_load_order": 1, "meta_evict_policy": "", "atomic_mode": "relaxed", "dot_prod_mode": 0, "num_warps": 4, "num_ctas": 1, "num_stages": 1}, "(1, 512, 3584, 64, 8)": {"BLOCK_SIZE_M": 1, "BLOCK_SIZE_N": 128, "BLOCK_SIZE_K": 16, "A_load_order": 0, "meta_evict_policy": "", "atomic_mode": "relaxed", "dot_prod_mode": 0, "num_warps": 2, "num_ctas": 1, "num_stages": 1}, "(1, 18944, 3584, 64, 8)": {"BLOCK_SIZE_M": 1, "BLOCK_SIZE_N": 256, "BLOCK_SIZE_K": 8, "A_load_order": 0, "meta_evict_policy": "", "atomic_mode": "relaxed", "dot_prod_mode": 0, "num_warps": 2, "num_ctas": 1, "num_stages": 2}, "(1, 256, 2048, 64, 8)": {"BLOCK_SIZE_M": 1, "BLOCK_SIZE_N": 128, "BLOCK_SIZE_K": 8, "A_load_order": 1, "meta_evict_policy": "", "atomic_mode": "relaxed", "dot_prod_mode": 0, "num_warps": 2, "num_ctas": 1, "num_stages": 1}, "(1, 11008, 2048, 64, 8)": {"BLOCK_SIZE_M": 1, "BLOCK_SIZE_N": 256, "BLOCK_SIZE_K": 8, "A_load_order": 1, "meta_evict_policy": "", "atomic_mode": "relaxed", "dot_prod_mode": 0, "num_warps": 2, "num_ctas": 1, "num_stages": 2}, "(1, 2048, 11008, 64, 8)": {"BLOCK_SIZE_M": 1, "BLOCK_SIZE_N": 128, "BLOCK_SIZE_K": 32, "A_load_order": 1, "meta_evict_policy": "", "atomic_mode": "relaxed", "dot_prod_mode": 0, "num_warps": 2, "num_ctas": 1, "num_stages": 2}}, "GEMV_SPLITK": {"(1, 6144, 4096, 4096, 1)": {"BLOCK_SIZE_M": 1, "BLOCK_SIZE_N": 8, "BLOCK_SIZE_K": 512, "GROUP_SIZE_M": 8, "SPLIT_K": 1, "A_load_order": 0, "meta_evict_policy": "", "atomic_mode": "relaxed", "dot_prod_mode": 0, "num_warps": 4, "num_ctas": 1, "num_stages": 1}, "(1, 4096, 4096, 4096, 1)": {"BLOCK_SIZE_M": 1, "BLOCK_SIZE_N": 8, "BLOCK_SIZE_K": 1024, "GROUP_SIZE_M": 8, "SPLIT_K": 1, "A_load_order": 0, "meta_evict_policy": "", "atomic_mode": "relaxed", "dot_prod_mode": 0, "num_warps": 4, "num_ctas": 1, "num_stages": 2}, "(1, 28672, 4096, 4096, 1)": {"BLOCK_SIZE_M": 1, "BLOCK_SIZE_N": 16, "BLOCK_SIZE_K": 256, "GROUP_SIZE_M": 8, "SPLIT_K": 1, "A_load_order": 0, "meta_evict_policy": "", "atomic_mode": "relaxed", "dot_prod_mode": 0, "num_warps": 4, "num_ctas": 1, "num_stages": 1}, "(1, 4096, 14336, 14336, 1)": {"BLOCK_SIZE_M": 1, "BLOCK_SIZE_N": 16, "BLOCK_SIZE_K": 1024, "GROUP_SIZE_M": 8, "SPLIT_K": 1, "A_load_order": 0, "meta_evict_policy": "", "atomic_mode": "relaxed", "dot_prod_mode": 0, "num_warps": 8, "num_ctas": 1, "num_stages": 2}, "(1, 4608, 3584, 3584, 1)": {"BLOCK_SIZE_M": 1, "BLOCK_SIZE_N": 16, "BLOCK_SIZE_K": 512, "GROUP_SIZE_M": 8, "SPLIT_K": 1, "A_load_order": 0, "meta_evict_policy": "", "atomic_mode": "relaxed", "dot_prod_mode": 0, "num_warps": 4, "num_ctas": 1, "num_stages": 1}, "(1, 3584, 3584, 3584, 1)": {"BLOCK_SIZE_M": 1, "BLOCK_SIZE_N": 2, "BLOCK_SIZE_K": 512, "GROUP_SIZE_M": 8, "SPLIT_K": 1, "A_load_order": 0, "meta_evict_policy": "", "atomic_mode": "relaxed", "dot_prod_mode": 0, "num_warps": 4, "num_ctas": 1, "num_stages": 2}, "(1, 37888, 3584, 3584, 1)": {"BLOCK_SIZE_M": 1, "BLOCK_SIZE_N": 16, "BLOCK_SIZE_K": 512, "GROUP_SIZE_M": 8, "SPLIT_K": 1, "A_load_order": 0, "meta_evict_policy": "", "atomic_mode": "relaxed", "dot_prod_mode": 0, "num_warps": 4, "num_ctas": 1, "num_stages": 2}, "(1, 3584, 18944, 18944, 1)": {"BLOCK_SIZE_M": 1, "BLOCK_SIZE_N": 2, "BLOCK_SIZE_K": 512, "GROUP_SIZE_M": 8, "SPLIT_K": 1, "A_load_order": 0, "meta_evict_policy": "", "atomic_mode": "relaxed", "dot_prod_mode": 0, "num_warps": 4, "num_ctas": 1, "num_stages": 1}, "(1, 5120, 3072, 3072, 1)": {"BLOCK_SIZE_M": 1, "BLOCK_SIZE_N": 8, "BLOCK_SIZE_K": 512, "GROUP_SIZE_M": 8, "SPLIT_K": 1, "A_load_order": 0, "meta_evict_policy": "", "atomic_mode": "relaxed", "dot_prod_mode": 0, "num_warps": 4, "num_ctas": 1, "num_stages": 2}, "(1, 3072, 3072, 3072, 1)": {"BLOCK_SIZE_M": 1, "BLOCK_SIZE_N": 8, "BLOCK_SIZE_K": 1024, "GROUP_SIZE_M": 8, "SPLIT_K": 1, "A_load_order": 0, "meta_evict_policy": "", "atomic_mode": "relaxed", "dot_prod_mode": 0, "num_warps": 4, "num_ctas": 1, "num_stages": 1}, "(1, 16384, 3072, 3072, 1)": {"BLOCK_SIZE_M": 1, "BLOCK_SIZE_N": 16, "BLOCK_SIZE_K": 512, "GROUP_SIZE_M": 8, "SPLIT_K": 1, "A_load_order": 0, "meta_evict_policy": "", "atomic_mode": "relaxed", "dot_prod_mode": 0, "num_warps": 4, "num_ctas": 1, "num_stages": 1}, "(1, 3072, 8192, 8192, 1)": {"BLOCK_SIZE_M": 1, "BLOCK_SIZE_N": 16, "BLOCK_SIZE_K": 1024, "GROUP_SIZE_M": 8, "SPLIT_K": 1, "A_load_order": 0, "meta_evict_policy": "", "atomic_mode": "relaxed", "dot_prod_mode": 0, "num_warps": 8, "num_ctas": 1, "num_stages": 1}}, "GEMM_SPLITK": {"(2, 6144, 4096, 64, 8)": {"BLOCK_SIZE_M": 16, "BLOCK_SIZE_N": 128, "BLOCK_SIZE_K": 64, "GROUP_SIZE_M": 8, "SPLIT_K": 8, "A_load_order": 0, "meta_evict_policy": "", "atomic_mode": "relaxed", "num_warps": 8, "num_ctas": 1, "num_stages": 1}, "(2, 4096, 4096, 64, 8)": {"BLOCK_SIZE_M": 16, "BLOCK_SIZE_N": 128, "BLOCK_SIZE_K": 32, "GROUP_SIZE_M": 8, "SPLIT_K": 16, "A_load_order": 0, "meta_evict_policy": "", "atomic_mode": "relaxed", "num_warps": 8, "num_ctas": 1, "num_stages": 1}, "(2, 28672, 4096, 64, 8)": {"BLOCK_SIZE_M": 16, "BLOCK_SIZE_N": 128, "BLOCK_SIZE_K": 32, "GROUP_SIZE_M": 8, "SPLIT_K": 16, "A_load_order": 0, "meta_evict_policy": "", "atomic_mode": "relaxed", "num_warps": 8, "num_ctas": 1, "num_stages": 1}, "(2, 4096, 14336, 64, 8)": {"BLOCK_SIZE_M": 16, "BLOCK_SIZE_N": 128, "BLOCK_SIZE_K": 32, "GROUP_SIZE_M": 8, "SPLIT_K": 16, "A_load_order": 0, "meta_evict_policy": "", "atomic_mode": "relaxed", "num_warps": 8, "num_ctas": 1, "num_stages": 1}, "(4, 6144, 4096, 64, 8)": {"BLOCK_SIZE_M": 16, "BLOCK_SIZE_N": 128, "BLOCK_SIZE_K": 64, "GROUP_SIZE_M": 8, "SPLIT_K": 8, "A_load_order": 0, "meta_evict_policy": "", "atomic_mode": "relaxed", "num_warps": 8, "num_ctas": 1, "num_stages": 1}, "(4, 4096, 4096, 64, 8)": {"BLOCK_SIZE_M": 16, "BLOCK_SIZE_N": 128, "BLOCK_SIZE_K": 32, "GROUP_SIZE_M": 8, "SPLIT_K": 16, "A_load_order": 0, "meta_evict_policy": "", "atomic_mode": "relaxed", "num_warps": 8, "num_ctas": 1, "num_stages": 1}, "(4, 28672, 4096, 64, 8)": {"BLOCK_SIZE_M": 16, "BLOCK_SIZE_N": 128, "BLOCK_SIZE_K": 32, "GROUP_SIZE_M": 8, "SPLIT_K": 16, "A_load_order": 0, "meta_evict_policy": "", "atomic_mode": "relaxed", "num_warps": 8, "num_ctas": 1, "num_stages": 1}, "(4, 4096, 14336, 64, 8)": {"BLOCK_SIZE_M": 16, "BLOCK_SIZE_N": 128, "BLOCK_SIZE_K": 32, "GROUP_SIZE_M": 8, "SPLIT_K": 16, "A_load_order": 0, "meta_evict_policy": "", "atomic_mode": "relaxed", "num_warps": 8, "num_ctas": 1, "num_stages": 1}, "(8, 6144, 4096, 64, 8)": {"BLOCK_SIZE_M": 16, "BLOCK_SIZE_N": 128, "BLOCK_SIZE_K": 64, "GROUP_SIZE_M": 8, "SPLIT_K": 8, "A_load_order": 0, "meta_evict_policy": "", "atomic_mode": "relaxed", "num_warps": 8, "num_ctas": 1, "num_stages": 1}, "(8, 4096, 4096, 64, 8)": {"BLOCK_SIZE_M": 16, "BLOCK_SIZE_N": 128, "BLOCK_SIZE_K": 32, "GROUP_SIZE_M": 8, "SPLIT_K": 16, "A_load_order": 0, "meta_evict_policy": "", "atomic_mode": "relaxed", "num_warps": 8, "num_ctas": 1, "num_stages": 1}, "(8, 28672, 4096, 64, 8)": {"BLOCK_SIZE_M": 16, "BLOCK_SIZE_N": 128, "BLOCK_SIZE_K": 32, "GROUP_SIZE_M": 8, "SPLIT_K": 8, "A_load_order": 0, "meta_evict_policy": "", "atomic_mode": "relaxed", "num_warps": 8, "num_ctas": 1, "num_stages": 1}, "(8, 4096, 14336, 64, 8)": {"BLOCK_SIZE_M": 16, "BLOCK_SIZE_N": 128, "BLOCK_SIZE_K": 32, "GROUP_SIZE_M": 8, "SPLIT_K": 16, "A_load_order": 0, "meta_evict_policy": "", "atomic_mode": "relaxed", "num_warps": 8, "num_ctas": 1, "num_stages": 1}, "(16, 6144, 4096, 64, 8)": {"BLOCK_SIZE_M": 16, "BLOCK_SIZE_N": 128, "BLOCK_SIZE_K": 64, "GROUP_SIZE_M": 8, "SPLIT_K": 8, "A_load_order": 0, "meta_evict_policy": "", "atomic_mode": "relaxed", "num_warps": 8, "num_ctas": 1, "num_stages": 1}, "(16, 4096, 4096, 64, 8)": {"BLOCK_SIZE_M": 16, "BLOCK_SIZE_N": 128, "BLOCK_SIZE_K": 32, "GROUP_SIZE_M": 8, "SPLIT_K": 16, "A_load_order": 0, "meta_evict_policy": "", "atomic_mode": "relaxed", "num_warps": 8, "num_ctas": 1, "num_stages": 1}, "(16, 28672, 4096, 64, 8)": {"BLOCK_SIZE_M": 16, "BLOCK_SIZE_N": 128, "BLOCK_SIZE_K": 32, "GROUP_SIZE_M": 8, "SPLIT_K": 8, "A_load_order": 0, "meta_evict_policy": "", "atomic_mode": "relaxed", "num_warps": 8, "num_ctas": 1, "num_stages": 1}, "(16, 4096, 14336, 64, 8)": {"BLOCK_SIZE_M": 16, "BLOCK_SIZE_N": 128, "BLOCK_SIZE_K": 32, "GROUP_SIZE_M": 8, "SPLIT_K": 16, "A_load_order": 0, "meta_evict_policy": "", "atomic_mode": "relaxed", "num_warps": 8, "num_ctas": 1, "num_stages": 1}, "(24, 6144, 4096, 64, 8)": {"BLOCK_SIZE_M": 32, "BLOCK_SIZE_N": 32, "BLOCK_SIZE_K": 64, "GROUP_SIZE_M": 8, "SPLIT_K": 4, "A_load_order": 2, "meta_evict_policy": "", "atomic_mode": "relaxed", "num_warps": 4, "num_ctas": 1, "num_stages": 1}, "(24, 4096, 4096, 64, 8)": {"BLOCK_SIZE_M": 32, "BLOCK_SIZE_N": 64, "BLOCK_SIZE_K": 64, "GROUP_SIZE_M": 8, "SPLIT_K": 8, "A_load_order": 0, "meta_evict_policy": "", "atomic_mode": "relaxed", "num_warps": 8, "num_ctas": 1, "num_stages": 1}, "(24, 28672, 4096, 64, 8)": {"BLOCK_SIZE_M": 32, "BLOCK_SIZE_N": 64, "BLOCK_SIZE_K": 64, "GROUP_SIZE_M": 8, "SPLIT_K": 4, "A_load_order": 2, "meta_evict_policy": "", "atomic_mode": "relaxed", "num_warps": 4, "num_ctas": 1, "num_stages": 1}, "(24, 4096, 14336, 64, 8)": {"BLOCK_SIZE_M": 32, "BLOCK_SIZE_N": 64, "BLOCK_SIZE_K": 64, "GROUP_SIZE_M": 8, "SPLIT_K": 8, "A_load_order": 2, "meta_evict_policy": "", "atomic_mode": "relaxed", "num_warps": 4, "num_ctas": 1, "num_stages": 1}, "(32, 6144, 4096, 64, 8)": {"BLOCK_SIZE_M": 32, "BLOCK_SIZE_N": 32, "BLOCK_SIZE_K": 64, "GROUP_SIZE_M": 8, "SPLIT_K": 4, "A_load_order": 2, "meta_evict_policy": "", "atomic_mode": "relaxed", "num_warps": 4, "num_ctas": 1, "num_stages": 1}, "(32, 4096, 4096, 64, 8)": {"BLOCK_SIZE_M": 32, "BLOCK_SIZE_N": 64, "BLOCK_SIZE_K": 64, "GROUP_SIZE_M": 8, "SPLIT_K": 8, "A_load_order": 0, "meta_evict_policy": "", "atomic_mode": "relaxed", "num_warps": 8, "num_ctas": 1, "num_stages": 1}, "(32, 28672, 4096, 64, 8)": {"BLOCK_SIZE_M": 32, "BLOCK_SIZE_N": 64, "BLOCK_SIZE_K": 64, "GROUP_SIZE_M": 8, "SPLIT_K": 4, "A_load_order": 2, "meta_evict_policy": "", "atomic_mode": "relaxed", "num_warps": 4, "num_ctas": 1, "num_stages": 1}, "(32, 4096, 14336, 64, 8)": {"BLOCK_SIZE_M": 32, "BLOCK_SIZE_N": 64, "BLOCK_SIZE_K": 64, "GROUP_SIZE_M": 8, "SPLIT_K": 8, "A_load_order": 2, "meta_evict_policy": "", "atomic_mode": "relaxed", "num_warps": 4, "num_ctas": 1, "num_stages": 1}, "(40, 6144, 4096, 64, 8)": {"BLOCK_SIZE_M": 32, "BLOCK_SIZE_N": 64, "BLOCK_SIZE_K": 64, "GROUP_SIZE_M": 8, "SPLIT_K": 8, "A_load_order": 2, "meta_evict_policy": "", "atomic_mode": "relaxed", "num_warps": 4, "num_ctas": 1, "num_stages": 1}, "(40, 4096, 4096, 64, 8)": {"BLOCK_SIZE_M": 32, "BLOCK_SIZE_N": 64, "BLOCK_SIZE_K": 64, "GROUP_SIZE_M": 8, "SPLIT_K": 4, "A_load_order": 2, "meta_evict_policy": "", "atomic_mode": "relaxed", "num_warps": 4, "num_ctas": 1, "num_stages": 1}, "(40, 28672, 4096, 64, 8)": {"BLOCK_SIZE_M": 32, "BLOCK_SIZE_N": 64, "BLOCK_SIZE_K": 64, "GROUP_SIZE_M": 8, "SPLIT_K": 1, "A_load_order": 2, "meta_evict_policy": "", "atomic_mode": "relaxed", "num_warps": 4, "num_ctas": 1, "num_stages": 1}, "(40, 4096, 14336, 64, 8)": {"BLOCK_SIZE_M": 32, "BLOCK_SIZE_N": 64, "BLOCK_SIZE_K": 64, "GROUP_SIZE_M": 8, "SPLIT_K": 8, "A_load_order": 2, "meta_evict_policy": "", "atomic_mode": "relaxed", "num_warps": 4, "num_ctas": 1, "num_stages": 1}, "(48, 6144, 4096, 64, 8)": {"BLOCK_SIZE_M": 32, "BLOCK_SIZE_N": 64, "BLOCK_SIZE_K": 64, "GROUP_SIZE_M": 8, "SPLIT_K": 8, "A_load_order": 2, "meta_evict_policy": "", "atomic_mode": "relaxed", "num_warps": 4, "num_ctas": 1, "num_stages": 1}, "(48, 4096, 4096, 64, 8)": {"BLOCK_SIZE_M": 32, "BLOCK_SIZE_N": 64, "BLOCK_SIZE_K": 64, "GROUP_SIZE_M": 8, "SPLIT_K": 4, "A_load_order": 2, "meta_evict_policy": "", "atomic_mode": "relaxed", "num_warps": 4, "num_ctas": 1, "num_stages": 1}, "(48, 28672, 4096, 64, 8)": {"BLOCK_SIZE_M": 32, "BLOCK_SIZE_N": 64, "BLOCK_SIZE_K": 64, "GROUP_SIZE_M": 8, "SPLIT_K": 1, "A_load_order": 2, "meta_evict_policy": "", "atomic_mode": "relaxed", "num_warps": 4, "num_ctas": 1, "num_stages": 1}, "(48, 4096, 14336, 64, 8)": {"BLOCK_SIZE_M": 32, "BLOCK_SIZE_N": 64, "BLOCK_SIZE_K": 64, "GROUP_SIZE_M": 8, "SPLIT_K": 8, "A_load_order": 2, "meta_evict_policy": "", "atomic_mode": "relaxed", "num_warps": 4, "num_ctas": 1, "num_stages": 1}, "(56, 6144, 4096, 64, 8)": {"BLOCK_SIZE_M": 32, "BLOCK_SIZE_N": 64, "BLOCK_SIZE_K": 64, "GROUP_SIZE_M": 8, "SPLIT_K": 8, "A_load_order": 2, "meta_evict_policy": "", "atomic_mode": "relaxed", "num_warps": 4, "num_ctas": 1, "num_stages": 1}, "(56, 4096, 4096, 64, 8)": {"BLOCK_SIZE_M": 32, "BLOCK_SIZE_N": 64, "BLOCK_SIZE_K": 64, "GROUP_SIZE_M": 8, "SPLIT_K": 4, "A_load_order": 2, "meta_evict_policy": "", "atomic_mode": "relaxed", "num_warps": 4, "num_ctas": 1, "num_stages": 1}, "(56, 28672, 4096, 64, 8)": {"BLOCK_SIZE_M": 32, "BLOCK_SIZE_N": 64, "BLOCK_SIZE_K": 64, "GROUP_SIZE_M": 8, "SPLIT_K": 1, "A_load_order": 2, "meta_evict_policy": "", "atomic_mode": "relaxed", "num_warps": 4, "num_ctas": 1, "num_stages": 1}, "(56, 4096, 14336, 64, 8)": {"BLOCK_SIZE_M": 32, "BLOCK_SIZE_N": 64, "BLOCK_SIZE_K": 64, "GROUP_SIZE_M": 8, "SPLIT_K": 8, "A_load_order": 2, "meta_evict_policy": "", "atomic_mode": "relaxed", "num_warps": 4, "num_ctas": 1, "num_stages": 1}, "(64, 6144, 4096, 64, 8)": {"BLOCK_SIZE_M": 32, "BLOCK_SIZE_N": 64, "BLOCK_SIZE_K": 64, "GROUP_SIZE_M": 8, "SPLIT_K": 8, "A_load_order": 2, "meta_evict_policy": "", "atomic_mode": "relaxed", "num_warps": 4, "num_ctas": 1, "num_stages": 1}, "(64, 4096, 4096, 64, 8)": {"BLOCK_SIZE_M": 32, "BLOCK_SIZE_N": 64, "BLOCK_SIZE_K": 64, "GROUP_SIZE_M": 8, "SPLIT_K": 4, "A_load_order": 2, "meta_evict_policy": "", "atomic_mode": "relaxed", "num_warps": 4, "num_ctas": 1, "num_stages": 1}, "(64, 28672, 4096, 64, 8)": {"BLOCK_SIZE_M": 32, "BLOCK_SIZE_N": 64, "BLOCK_SIZE_K": 64, "GROUP_SIZE_M": 8, "SPLIT_K": 1, "A_load_order": 2, "meta_evict_policy": "", "atomic_mode": "relaxed", "num_warps": 4, "num_ctas": 1, "num_stages": 1}, "(64, 4096, 14336, 64, 8)": {"BLOCK_SIZE_M": 32, "BLOCK_SIZE_N": 64, "BLOCK_SIZE_K": 64, "GROUP_SIZE_M": 8, "SPLIT_K": 8, "A_load_order": 2, "meta_evict_policy": "", "atomic_mode": "relaxed", "num_warps": 4, "num_ctas": 1, "num_stages": 1}, "(2, 6144, 4096, 64, 2)": {"BLOCK_SIZE_M": 16, "BLOCK_SIZE_N": 256, "BLOCK_SIZE_K": 64, "GROUP_SIZE_M": 8, "SPLIT_K": 16, "A_load_order": 0, "meta_evict_policy": "", "atomic_mode": "relaxed", "num_warps": 4, "num_ctas": 1, "num_stages": 2}, "(2, 4096, 4096, 64, 2)": {"BLOCK_SIZE_M": 16, "BLOCK_SIZE_N": 64, "BLOCK_SIZE_K": 32, "GROUP_SIZE_M": 8, "SPLIT_K": 16, "A_load_order": 0, "meta_evict_policy": "", "atomic_mode": "relaxed", "num_warps": 4, "num_ctas": 1, "num_stages": 1}, "(2, 28672, 4096, 64, 2)": {"BLOCK_SIZE_M": 16, "BLOCK_SIZE_N": 256, "BLOCK_SIZE_K": 32, "GROUP_SIZE_M": 8, "SPLIT_K": 8, "A_load_order": 2, "meta_evict_policy": "", "atomic_mode": "relaxed", "num_warps": 4, "num_ctas": 1, "num_stages": 4}, "(2, 4096, 14336, 64, 2)": {"BLOCK_SIZE_M": 16, "BLOCK_SIZE_N": 256, "BLOCK_SIZE_K": 64, "GROUP_SIZE_M": 8, "SPLIT_K": 16, "A_load_order": 2, "meta_evict_policy": "", "atomic_mode": "relaxed", "num_warps": 4, "num_ctas": 1, "num_stages": 4}, "(4, 6144, 4096, 64, 2)": {"BLOCK_SIZE_M": 16, "BLOCK_SIZE_N": 256, "BLOCK_SIZE_K": 64, "GROUP_SIZE_M": 8, "SPLIT_K": 16, "A_load_order": 2, "meta_evict_policy": "", "atomic_mode": "relaxed", "num_warps": 4, "num_ctas": 1, "num_stages": 2}, "(4, 4096, 4096, 64, 2)": {"BLOCK_SIZE_M": 16, "BLOCK_SIZE_N": 64, "BLOCK_SIZE_K": 32, "GROUP_SIZE_M": 8, "SPLIT_K": 16, "A_load_order": 0, "meta_evict_policy": "", "atomic_mode": "relaxed", "num_warps": 4, "num_ctas": 1, "num_stages": 1}, "(4, 28672, 4096, 64, 2)": {"BLOCK_SIZE_M": 16, "BLOCK_SIZE_N": 256, "BLOCK_SIZE_K": 32, "GROUP_SIZE_M": 8, "SPLIT_K": 8, "A_load_order": 2, "meta_evict_policy": "", "atomic_mode": "relaxed", "num_warps": 4, "num_ctas": 1, "num_stages": 4}, "(4, 4096, 14336, 64, 2)": {"BLOCK_SIZE_M": 16, "BLOCK_SIZE_N": 256, "BLOCK_SIZE_K": 64, "GROUP_SIZE_M": 8, "SPLIT_K": 16, "A_load_order": 2, "meta_evict_policy": "", "atomic_mode": "relaxed", "num_warps": 4, "num_ctas": 1, "num_stages": 4}, "(8, 6144, 4096, 64, 2)": {"BLOCK_SIZE_M": 16, "BLOCK_SIZE_N": 256, "BLOCK_SIZE_K": 64, "GROUP_SIZE_M": 8, "SPLIT_K": 16, "A_load_order": 0, "meta_evict_policy": "", "atomic_mode": "relaxed", "num_warps": 4, "num_ctas": 1, "num_stages": 2}, "(8, 4096, 4096, 64, 2)": {"BLOCK_SIZE_M": 16, "BLOCK_SIZE_N": 64, "BLOCK_SIZE_K": 32, "GROUP_SIZE_M": 8, "SPLIT_K": 16, "A_load_order": 0, "meta_evict_policy": "", "atomic_mode": "relaxed", "num_warps": 4, "num_ctas": 1, "num_stages": 1}, "(8, 28672, 4096, 64, 2)": {"BLOCK_SIZE_M": 16, "BLOCK_SIZE_N": 256, "BLOCK_SIZE_K": 32, "GROUP_SIZE_M": 8, "SPLIT_K": 8, "A_load_order": 2, "meta_evict_policy": "", "atomic_mode": "relaxed", "num_warps": 4, "num_ctas": 1, "num_stages": 4}, "(8, 4096, 14336, 64, 2)": {"BLOCK_SIZE_M": 16, "BLOCK_SIZE_N": 256, "BLOCK_SIZE_K": 64, "GROUP_SIZE_M": 8, "SPLIT_K": 16, "A_load_order": 2, "meta_evict_policy": "", "atomic_mode": "relaxed", "num_warps": 4, "num_ctas": 1, "num_stages": 4}, "(16, 6144, 4096, 64, 2)": {"BLOCK_SIZE_M": 16, "BLOCK_SIZE_N": 64, "BLOCK_SIZE_K": 64, "GROUP_SIZE_M": 8, "SPLIT_K": 8, "A_load_order": 0, "meta_evict_policy": "", "atomic_mode": "relaxed", "num_warps": 4, "num_ctas": 1, "num_stages": 1}, "(16, 4096, 4096, 64, 2)": {"BLOCK_SIZE_M": 16, "BLOCK_SIZE_N": 64, "BLOCK_SIZE_K": 32, "GROUP_SIZE_M": 8, "SPLIT_K": 16, "A_load_order": 0, "meta_evict_policy": "", "atomic_mode": "relaxed", "num_warps": 4, "num_ctas": 1, "num_stages": 1}, "(16, 28672, 4096, 64, 2)": {"BLOCK_SIZE_M": 16, "BLOCK_SIZE_N": 256, "BLOCK_SIZE_K": 32, "GROUP_SIZE_M": 8, "SPLIT_K": 8, "A_load_order": 2, "meta_evict_policy": "", "atomic_mode": "relaxed", "num_warps": 4, "num_ctas": 1, "num_stages": 4}, "(16, 4096, 14336, 64, 2)": {"BLOCK_SIZE_M": 16, "BLOCK_SIZE_N": 256, "BLOCK_SIZE_K": 64, "GROUP_SIZE_M": 8, "SPLIT_K": 16, "A_load_order": 2, "meta_evict_policy": "", "atomic_mode": "relaxed", "num_warps": 4, "num_ctas": 1, "num_stages": 4}, "(24, 6144, 4096, 64, 2)": {"BLOCK_SIZE_M": 32, "BLOCK_SIZE_N": 64, "BLOCK_SIZE_K": 64, "GROUP_SIZE_M": 8, "SPLIT_K": 8, "A_load_order": 0, "meta_evict_policy": "", "atomic_mode": "relaxed", "num_warps": 4, "num_ctas": 1, "num_stages": 1}, "(24, 4096, 4096, 64, 2)": {"BLOCK_SIZE_M": 32, "BLOCK_SIZE_N": 64, "BLOCK_SIZE_K": 64, "GROUP_SIZE_M": 8, "SPLIT_K": 8, "A_load_order": 0, "meta_evict_policy": "", "atomic_mode": "relaxed", "num_warps": 8, "num_ctas": 1, "num_stages": 1}, "(24, 28672, 4096, 64, 2)": {"BLOCK_SIZE_M": 32, "BLOCK_SIZE_N": 256, "BLOCK_SIZE_K": 32, "GROUP_SIZE_M": 8, "SPLIT_K": 8, "A_load_order": 0, "meta_evict_policy": "", "atomic_mode": "relaxed", "num_warps": 4, "num_ctas": 1, "num_stages": 5}, "(24, 4096, 14336, 64, 2)": {"BLOCK_SIZE_M": 32, "BLOCK_SIZE_N": 64, "BLOCK_SIZE_K": 64, "GROUP_SIZE_M": 8, "SPLIT_K": 8, "A_load_order": 0, "meta_evict_policy": "", "atomic_mode": "relaxed", "num_warps": 8, "num_ctas": 1, "num_stages": 1}, "(32, 6144, 4096, 64, 2)": {"BLOCK_SIZE_M": 32, "BLOCK_SIZE_N": 64, "BLOCK_SIZE_K": 64, "GROUP_SIZE_M": 8, "SPLIT_K": 8, "A_load_order": 0, "meta_evict_policy": "", "atomic_mode": "relaxed", "num_warps": 4, "num_ctas": 1, "num_stages": 1}, "(32, 4096, 4096, 64, 2)": {"BLOCK_SIZE_M": 32, "BLOCK_SIZE_N": 64, "BLOCK_SIZE_K": 64, "GROUP_SIZE_M": 8, "SPLIT_K": 8, "A_load_order": 0, "meta_evict_policy": "", "atomic_mode": "relaxed", "num_warps": 8, "num_ctas": 1, "num_stages": 1}, "(32, 28672, 4096, 64, 2)": {"BLOCK_SIZE_M": 32, "BLOCK_SIZE_N": 256, "BLOCK_SIZE_K": 64, "GROUP_SIZE_M": 8, "SPLIT_K": 2, "A_load_order": 2, "meta_evict_policy": "", "atomic_mode": "relaxed", "num_warps": 4, "num_ctas": 1, "num_stages": 4}, "(32, 4096, 14336, 64, 2)": {"BLOCK_SIZE_M": 32, "BLOCK_SIZE_N": 64, "BLOCK_SIZE_K": 64, "GROUP_SIZE_M": 8, "SPLIT_K": 8, "A_load_order": 0, "meta_evict_policy": "", "atomic_mode": "relaxed", "num_warps": 8, "num_ctas": 1, "num_stages": 1}, "(40, 6144, 4096, 64, 2)": {"BLOCK_SIZE_M": 32, "BLOCK_SIZE_N": 256, "BLOCK_SIZE_K": 32, "GROUP_SIZE_M": 8, "SPLIT_K": 8, "A_load_order": 0, "meta_evict_policy": "", "atomic_mode": "relaxed", "num_warps": 4, "num_ctas": 1, "num_stages": 5}, "(40, 4096, 4096, 64, 2)": {"BLOCK_SIZE_M": 32, "BLOCK_SIZE_N": 256, "BLOCK_SIZE_K": 64, "GROUP_SIZE_M": 8, "SPLIT_K": 8, "A_load_order": 2, "meta_evict_policy": "", "atomic_mode": "relaxed", "num_warps": 4, "num_ctas": 1, "num_stages": 4}, "(40, 28672, 4096, 64, 2)": {"BLOCK_SIZE_M": 32, "BLOCK_SIZE_N": 256, "BLOCK_SIZE_K": 32, "GROUP_SIZE_M": 8, "SPLIT_K": 4, "A_load_order": 2, "meta_evict_policy": "", "atomic_mode": "relaxed", "num_warps": 4, "num_ctas": 1, "num_stages": 5}, "(40, 4096, 14336, 64, 2)": {"BLOCK_SIZE_M": 32, "BLOCK_SIZE_N": 256, "BLOCK_SIZE_K": 64, "GROUP_SIZE_M": 8, "SPLIT_K": 8, "A_load_order": 2, "meta_evict_policy": "", "atomic_mode": "relaxed", "num_warps": 4, "num_ctas": 1, "num_stages": 4}, "(48, 6144, 4096, 64, 2)": {"BLOCK_SIZE_M": 32, "BLOCK_SIZE_N": 256, "BLOCK_SIZE_K": 32, "GROUP_SIZE_M": 8, "SPLIT_K": 8, "A_load_order": 0, "meta_evict_policy": "", "atomic_mode": "relaxed", "num_warps": 4, "num_ctas": 1, "num_stages": 5}, "(48, 4096, 4096, 64, 2)": {"BLOCK_SIZE_M": 32, "BLOCK_SIZE_N": 256, "BLOCK_SIZE_K": 64, "GROUP_SIZE_M": 8, "SPLIT_K": 8, "A_load_order": 2, "meta_evict_policy": "", "atomic_mode": "relaxed", "num_warps": 4, "num_ctas": 1, "num_stages": 4}, "(48, 28672, 4096, 64, 2)": {"BLOCK_SIZE_M": 32, "BLOCK_SIZE_N": 256, "BLOCK_SIZE_K": 32, "GROUP_SIZE_M": 8, "SPLIT_K": 4, "A_load_order": 0, "meta_evict_policy": "", "atomic_mode": "relaxed", "num_warps": 4, "num_ctas": 1, "num_stages": 4}, "(48, 4096, 14336, 64, 2)": {"BLOCK_SIZE_M": 32, "BLOCK_SIZE_N": 256, "BLOCK_SIZE_K": 64, "GROUP_SIZE_M": 8, "SPLIT_K": 8, "A_load_order": 2, "meta_evict_policy": "", "atomic_mode": "relaxed", "num_warps": 4, "num_ctas": 1, "num_stages": 4}, "(56, 6144, 4096, 64, 2)": {"BLOCK_SIZE_M": 32, "BLOCK_SIZE_N": 256, "BLOCK_SIZE_K": 32, "GROUP_SIZE_M": 8, "SPLIT_K": 8, "A_load_order": 0, "meta_evict_policy": "", "atomic_mode": "relaxed", "num_warps": 4, "num_ctas": 1, "num_stages": 5}, "(56, 4096, 4096, 64, 2)": {"BLOCK_SIZE_M": 32, "BLOCK_SIZE_N": 256, "BLOCK_SIZE_K": 64, "GROUP_SIZE_M": 8, "SPLIT_K": 8, "A_load_order": 2, "meta_evict_policy": "", "atomic_mode": "relaxed", "num_warps": 4, "num_ctas": 1, "num_stages": 4}, "(56, 28672, 4096, 64, 2)": {"BLOCK_SIZE_M": 32, "BLOCK_SIZE_N": 256, "BLOCK_SIZE_K": 32, "GROUP_SIZE_M": 8, "SPLIT_K": 4, "A_load_order": 0, "meta_evict_policy": "", "atomic_mode": "relaxed", "num_warps": 4, "num_ctas": 1, "num_stages": 4}, "(56, 4096, 14336, 64, 2)": {"BLOCK_SIZE_M": 32, "BLOCK_SIZE_N": 256, "BLOCK_SIZE_K": 64, "GROUP_SIZE_M": 8, "SPLIT_K": 8, "A_load_order": 2, "meta_evict_policy": "", "atomic_mode": "relaxed", "num_warps": 4, "num_ctas": 1, "num_stages": 4}, "(64, 6144, 4096, 64, 2)": {"BLOCK_SIZE_M": 32, "BLOCK_SIZE_N": 256, "BLOCK_SIZE_K": 32, "GROUP_SIZE_M": 8, "SPLIT_K": 8, "A_load_order": 0, "meta_evict_policy": "", "atomic_mode": "relaxed", "num_warps": 4, "num_ctas": 1, "num_stages": 5}, "(64, 4096, 4096, 64, 2)": {"BLOCK_SIZE_M": 32, "BLOCK_SIZE_N": 256, "BLOCK_SIZE_K": 64, "GROUP_SIZE_M": 8, "SPLIT_K": 8, "A_load_order": 2, "meta_evict_policy": "", "atomic_mode": "relaxed", "num_warps": 4, "num_ctas": 1, "num_stages": 4}, "(64, 28672, 4096, 64, 2)": {"BLOCK_SIZE_M": 32, "BLOCK_SIZE_N": 256, "BLOCK_SIZE_K": 32, "GROUP_SIZE_M": 8, "SPLIT_K": 4, "A_load_order": 0, "meta_evict_policy": "", "atomic_mode": "relaxed", "num_warps": 4, "num_ctas": 1, "num_stages": 4}, "(64, 4096, 14336, 64, 2)": {"BLOCK_SIZE_M": 32, "BLOCK_SIZE_N": 256, "BLOCK_SIZE_K": 64, "GROUP_SIZE_M": 8, "SPLIT_K": 8, "A_load_order": 2, "meta_evict_policy": "", "atomic_mode": "relaxed", "num_warps": 4, "num_ctas": 1, "num_stages": 4}, "(2, 4608, 3584, 64, 8)": {"BLOCK_SIZE_M": 16, "BLOCK_SIZE_N": 64, "BLOCK_SIZE_K": 32, "GROUP_SIZE_M": 8, "SPLIT_K": 16, "A_load_order": 2, "meta_evict_policy": "", "atomic_mode": "relaxed", "num_warps": 4, "num_ctas": 1, "num_stages": 1}, "(2, 3584, 3584, 64, 8)": {"BLOCK_SIZE_M": 16, "BLOCK_SIZE_N": 64, "BLOCK_SIZE_K": 32, "GROUP_SIZE_M": 8, "SPLIT_K": 16, "A_load_order": 2, "meta_evict_policy": "", "atomic_mode": "relaxed", "num_warps": 4, "num_ctas": 1, "num_stages": 1}, "(2, 37888, 3584, 64, 8)": {"BLOCK_SIZE_M": 16, "BLOCK_SIZE_N": 64, "BLOCK_SIZE_K": 32, "GROUP_SIZE_M": 8, "SPLIT_K": 2, "A_load_order": 2, "meta_evict_policy": "", "atomic_mode": "relaxed", "num_warps": 4, "num_ctas": 1, "num_stages": 1}, "(2, 3584, 18944, 64, 8)": {"BLOCK_SIZE_M": 16, "BLOCK_SIZE_N": 64, "BLOCK_SIZE_K": 32, "GROUP_SIZE_M": 8, "SPLIT_K": 16, "A_load_order": 2, "meta_evict_policy": "", "atomic_mode": "relaxed", "num_warps": 4, "num_ctas": 1, "num_stages": 1}, "(4, 4608, 3584, 64, 8)": {"BLOCK_SIZE_M": 16, "BLOCK_SIZE_N": 64, "BLOCK_SIZE_K": 32, "GROUP_SIZE_M": 8, "SPLIT_K": 16, "A_load_order": 2, "meta_evict_policy": "", "atomic_mode": "relaxed", "num_warps": 4, "num_ctas": 1, "num_stages": 1}, "(4, 3584, 3584, 64, 8)": {"BLOCK_SIZE_M": 16, "BLOCK_SIZE_N": 128, "BLOCK_SIZE_K": 32, "GROUP_SIZE_M": 8, "SPLIT_K": 16, "A_load_order": 0, "meta_evict_policy": "", "atomic_mode": "relaxed", "num_warps": 8, "num_ctas": 1, "num_stages": 1}, "(4, 37888, 3584, 64, 8)": {"BLOCK_SIZE_M": 16, "BLOCK_SIZE_N": 64, "BLOCK_SIZE_K": 32, "GROUP_SIZE_M": 8, "SPLIT_K": 2, "A_load_order": 2, "meta_evict_policy": "", "atomic_mode": "relaxed", "num_warps": 4, "num_ctas": 1, "num_stages": 1}, "(4, 3584, 18944, 64, 8)": {"BLOCK_SIZE_M": 16, "BLOCK_SIZE_N": 64, "BLOCK_SIZE_K": 32, "GROUP_SIZE_M": 8, "SPLIT_K": 16, "A_load_order": 2, "meta_evict_policy": "", "atomic_mode": "relaxed", "num_warps": 4, "num_ctas": 1, "num_stages": 1}, "(8, 4608, 3584, 64, 8)": {"BLOCK_SIZE_M": 16, "BLOCK_SIZE_N": 64, "BLOCK_SIZE_K": 32, "GROUP_SIZE_M": 8, "SPLIT_K": 16, "A_load_order": 2, "meta_evict_policy": "", "atomic_mode": "relaxed", "num_warps": 4, "num_ctas": 1, "num_stages": 1}, "(8, 3584, 3584, 64, 8)": {"BLOCK_SIZE_M": 16, "BLOCK_SIZE_N": 64, "BLOCK_SIZE_K": 32, "GROUP_SIZE_M": 8, "SPLIT_K": 16, "A_load_order": 2, "meta_evict_policy": "", "atomic_mode": "relaxed", "num_warps": 4, "num_ctas": 1, "num_stages": 1}, "(8, 37888, 3584, 64, 8)": {"BLOCK_SIZE_M": 16, "BLOCK_SIZE_N": 64, "BLOCK_SIZE_K": 32, "GROUP_SIZE_M": 8, "SPLIT_K": 2, "A_load_order": 2, "meta_evict_policy": "", "atomic_mode": "relaxed", "num_warps": 4, "num_ctas": 1, "num_stages": 1}, "(8, 3584, 18944, 64, 8)": {"BLOCK_SIZE_M": 16, "BLOCK_SIZE_N": 64, "BLOCK_SIZE_K": 32, "GROUP_SIZE_M": 8, "SPLIT_K": 16, "A_load_order": 2, "meta_evict_policy": "", "atomic_mode": "relaxed", "num_warps": 4, "num_ctas": 1, "num_stages": 1}, "(16, 4608, 3584, 64, 8)": {"BLOCK_SIZE_M": 16, "BLOCK_SIZE_N": 64, "BLOCK_SIZE_K": 32, "GROUP_SIZE_M": 8, "SPLIT_K": 16, "A_load_order": 2, "meta_evict_policy": "", "atomic_mode": "relaxed", "num_warps": 4, "num_ctas": 1, "num_stages": 1}, "(16, 3584, 3584, 64, 8)": {"BLOCK_SIZE_M": 16, "BLOCK_SIZE_N": 128, "BLOCK_SIZE_K": 32, "GROUP_SIZE_M": 8, "SPLIT_K": 16, "A_load_order": 0, "meta_evict_policy": "", "atomic_mode": "relaxed", "num_warps": 8, "num_ctas": 1, "num_stages": 1}, "(16, 37888, 3584, 64, 8)": {"BLOCK_SIZE_M": 16, "BLOCK_SIZE_N": 64, "BLOCK_SIZE_K": 32, "GROUP_SIZE_M": 8, "SPLIT_K": 2, "A_load_order": 2, "meta_evict_policy": "", "atomic_mode": "relaxed", "num_warps": 4, "num_ctas": 1, "num_stages": 1}, "(16, 3584, 18944, 64, 8)": {"BLOCK_SIZE_M": 16, "BLOCK_SIZE_N": 64, "BLOCK_SIZE_K": 32, "GROUP_SIZE_M": 8, "SPLIT_K": 16, "A_load_order": 2, "meta_evict_policy": "", "atomic_mode": "relaxed", "num_warps": 4, "num_ctas": 1, "num_stages": 1}, "(24, 4608, 3584, 64, 8)": {"BLOCK_SIZE_M": 32, "BLOCK_SIZE_N": 32, "BLOCK_SIZE_K": 64, "GROUP_SIZE_M": 8, "SPLIT_K": 8, "A_load_order": 0, "meta_evict_policy": "", "atomic_mode": "relaxed", "num_warps": 4, "num_ctas": 1, "num_stages": 1}, "(24, 3584, 3584, 64, 8)": {"BLOCK_SIZE_M": 32, "BLOCK_SIZE_N": 32, "BLOCK_SIZE_K": 64, "GROUP_SIZE_M": 8, "SPLIT_K": 8, "A_load_order": 2, "meta_evict_policy": "", "atomic_mode": "relaxed", "num_warps": 4, "num_ctas": 1, "num_stages": 1}, "(24, 37888, 3584, 64, 8)": {"BLOCK_SIZE_M": 32, "BLOCK_SIZE_N": 64, "BLOCK_SIZE_K": 64, "GROUP_SIZE_M": 8, "SPLIT_K": 4, "A_load_order": 2, "meta_evict_policy": "", "atomic_mode": "relaxed", "num_warps": 4, "num_ctas": 1, "num_stages": 1}, "(24, 3584, 18944, 64, 8)": {"BLOCK_SIZE_M": 32, "BLOCK_SIZE_N": 32, "BLOCK_SIZE_K": 64, "GROUP_SIZE_M": 8, "SPLIT_K": 8, "A_load_order": 2, "meta_evict_policy": "", "atomic_mode": "relaxed", "num_warps": 4, "num_ctas": 1, "num_stages": 1}, "(32, 4608, 3584, 64, 8)": {"BLOCK_SIZE_M": 32, "BLOCK_SIZE_N": 32, "BLOCK_SIZE_K": 64, "GROUP_SIZE_M": 8, "SPLIT_K": 8, "A_load_order": 0, "meta_evict_policy": "", "atomic_mode": "relaxed", "num_warps": 4, "num_ctas": 1, "num_stages": 1}, "(32, 3584, 3584, 64, 8)": {"BLOCK_SIZE_M": 32, "BLOCK_SIZE_N": 32, "BLOCK_SIZE_K": 64, "GROUP_SIZE_M": 8, "SPLIT_K": 8, "A_load_order": 2, "meta_evict_policy": "", "atomic_mode": "relaxed", "num_warps": 4, "num_ctas": 1, "num_stages": 1}, "(32, 37888, 3584, 64, 8)": {"BLOCK_SIZE_M": 32, "BLOCK_SIZE_N": 64, "BLOCK_SIZE_K": 64, "GROUP_SIZE_M": 8, "SPLIT_K": 4, "A_load_order": 2, "meta_evict_policy": "", "atomic_mode": "relaxed", "num_warps": 4, "num_ctas": 1, "num_stages": 1}, "(32, 3584, 18944, 64, 8)": {"BLOCK_SIZE_M": 32, "BLOCK_SIZE_N": 32, "BLOCK_SIZE_K": 64, "GROUP_SIZE_M": 8, "SPLIT_K": 8, "A_load_order": 2, "meta_evict_policy": "", "atomic_mode": "relaxed", "num_warps": 4, "num_ctas": 1, "num_stages": 1}, "(40, 4608, 3584, 64, 8)": {"BLOCK_SIZE_M": 32, "BLOCK_SIZE_N": 32, "BLOCK_SIZE_K": 64, "GROUP_SIZE_M": 8, "SPLIT_K": 4, "A_load_order": 0, "meta_evict_policy": "", "atomic_mode": "relaxed", "num_warps": 4, "num_ctas": 1, "num_stages": 1}, "(40, 3584, 3584, 64, 8)": {"BLOCK_SIZE_M": 32, "BLOCK_SIZE_N": 32, "BLOCK_SIZE_K": 64, "GROUP_SIZE_M": 8, "SPLIT_K": 4, "A_load_order": 2, "meta_evict_policy": "", "atomic_mode": "relaxed", "num_warps": 4, "num_ctas": 1, "num_stages": 1}, "(40, 37888, 3584, 64, 8)": {"BLOCK_SIZE_M": 32, "BLOCK_SIZE_N": 64, "BLOCK_SIZE_K": 64, "GROUP_SIZE_M": 8, "SPLIT_K": 4, "A_load_order": 2, "meta_evict_policy": "", "atomic_mode": "relaxed", "num_warps": 4, "num_ctas": 1, "num_stages": 1}, "(40, 3584, 18944, 64, 8)": {"BLOCK_SIZE_M": 32, "BLOCK_SIZE_N": 64, "BLOCK_SIZE_K": 64, "GROUP_SIZE_M": 8, "SPLIT_K": 8, "A_load_order": 0, "meta_evict_policy": "", "atomic_mode": "relaxed", "num_warps": 8, "num_ctas": 1, "num_stages": 1}, "(48, 4608, 3584, 64, 8)": {"BLOCK_SIZE_M": 32, "BLOCK_SIZE_N": 32, "BLOCK_SIZE_K": 64, "GROUP_SIZE_M": 8, "SPLIT_K": 4, "A_load_order": 0, "meta_evict_policy": "", "atomic_mode": "relaxed", "num_warps": 4, "num_ctas": 1, "num_stages": 1}, "(48, 3584, 3584, 64, 8)": {"BLOCK_SIZE_M": 32, "BLOCK_SIZE_N": 32, "BLOCK_SIZE_K": 64, "GROUP_SIZE_M": 8, "SPLIT_K": 4, "A_load_order": 2, "meta_evict_policy": "", "atomic_mode": "relaxed", "num_warps": 4, "num_ctas": 1, "num_stages": 1}, "(48, 37888, 3584, 64, 8)": {"BLOCK_SIZE_M": 32, "BLOCK_SIZE_N": 64, "BLOCK_SIZE_K": 64, "GROUP_SIZE_M": 8, "SPLIT_K": 4, "A_load_order": 2, "meta_evict_policy": "", "atomic_mode": "relaxed", "num_warps": 4, "num_ctas": 1, "num_stages": 1}, "(48, 3584, 18944, 64, 8)": {"BLOCK_SIZE_M": 32, "BLOCK_SIZE_N": 64, "BLOCK_SIZE_K": 64, "GROUP_SIZE_M": 8, "SPLIT_K": 8, "A_load_order": 0, "meta_evict_policy": "", "atomic_mode": "relaxed", "num_warps": 8, "num_ctas": 1, "num_stages": 1}, "(56, 4608, 3584, 64, 8)": {"BLOCK_SIZE_M": 32, "BLOCK_SIZE_N": 32, "BLOCK_SIZE_K": 64, "GROUP_SIZE_M": 8, "SPLIT_K": 4, "A_load_order": 0, "meta_evict_policy": "", "atomic_mode": "relaxed", "num_warps": 4, "num_ctas": 1, "num_stages": 1}, "(56, 3584, 3584, 64, 8)": {"BLOCK_SIZE_M": 32, "BLOCK_SIZE_N": 32, "BLOCK_SIZE_K": 64, "GROUP_SIZE_M": 8, "SPLIT_K": 4, "A_load_order": 2, "meta_evict_policy": "", "atomic_mode": "relaxed", "num_warps": 4, "num_ctas": 1, "num_stages": 1}, "(56, 37888, 3584, 64, 8)": {"BLOCK_SIZE_M": 32, "BLOCK_SIZE_N": 64, "BLOCK_SIZE_K": 64, "GROUP_SIZE_M": 8, "SPLIT_K": 4, "A_load_order": 2, "meta_evict_policy": "", "atomic_mode": "relaxed", "num_warps": 4, "num_ctas": 1, "num_stages": 1}, "(56, 3584, 18944, 64, 8)": {"BLOCK_SIZE_M": 32, "BLOCK_SIZE_N": 64, "BLOCK_SIZE_K": 64, "GROUP_SIZE_M": 8, "SPLIT_K": 8, "A_load_order": 0, "meta_evict_policy": "", "atomic_mode": "relaxed", "num_warps": 8, "num_ctas": 1, "num_stages": 1}, "(64, 4608, 3584, 64, 8)": {"BLOCK_SIZE_M": 32, "BLOCK_SIZE_N": 32, "BLOCK_SIZE_K": 64, "GROUP_SIZE_M": 8, "SPLIT_K": 4, "A_load_order": 0, "meta_evict_policy": "", "atomic_mode": "relaxed", "num_warps": 4, "num_ctas": 1, "num_stages": 1}, "(64, 3584, 3584, 64, 8)": {"BLOCK_SIZE_M": 32, "BLOCK_SIZE_N": 32, "BLOCK_SIZE_K": 64, "GROUP_SIZE_M": 8, "SPLIT_K": 4, "A_load_order": 2, "meta_evict_policy": "", "atomic_mode": "relaxed", "num_warps": 4, "num_ctas": 1, "num_stages": 1}, "(64, 37888, 3584, 64, 8)": {"BLOCK_SIZE_M": 32, "BLOCK_SIZE_N": 64, "BLOCK_SIZE_K": 64, "GROUP_SIZE_M": 8, "SPLIT_K": 4, "A_load_order": 2, "meta_evict_policy": "", "atomic_mode": "relaxed", "num_warps": 4, "num_ctas": 1, "num_stages": 1}, "(64, 3584, 18944, 64, 8)": {"BLOCK_SIZE_M": 32, "BLOCK_SIZE_N": 64, "BLOCK_SIZE_K": 64, "GROUP_SIZE_M": 8, "SPLIT_K": 8, "A_load_order": 0, "meta_evict_policy": "", "atomic_mode": "relaxed", "num_warps": 8, "num_ctas": 1, "num_stages": 1}, "(2, 4608, 3584, 64, 2)": {"BLOCK_SIZE_M": 16, "BLOCK_SIZE_N": 64, "BLOCK_SIZE_K": 32, "GROUP_SIZE_M": 8, "SPLIT_K": 16, "A_load_order": 0, "meta_evict_policy": "", "atomic_mode": "relaxed", "num_warps": 4, "num_ctas": 1, "num_stages": 1}, "(2, 3584, 3584, 64, 2)": {"BLOCK_SIZE_M": 16, "BLOCK_SIZE_N": 64, "BLOCK_SIZE_K": 32, "GROUP_SIZE_M": 8, "SPLIT_K": 16, "A_load_order": 0, "meta_evict_policy": "", "atomic_mode": "relaxed", "num_warps": 4, "num_ctas": 1, "num_stages": 1}, "(2, 37888, 3584, 64, 2)": {"BLOCK_SIZE_M": 16, "BLOCK_SIZE_N": 256, "BLOCK_SIZE_K": 32, "GROUP_SIZE_M": 8, "SPLIT_K": 8, "A_load_order": 2, "meta_evict_policy": "", "atomic_mode": "relaxed", "num_warps": 4, "num_ctas": 1, "num_stages": 4}, "(2, 3584, 18944, 64, 2)": {"BLOCK_SIZE_M": 16, "BLOCK_SIZE_N": 64, "BLOCK_SIZE_K": 32, "GROUP_SIZE_M": 8, "SPLIT_K": 16, "A_load_order": 0, "meta_evict_policy": "", "atomic_mode": "relaxed", "num_warps": 4, "num_ctas": 1, "num_stages": 1}, "(4, 4608, 3584, 64, 2)": {"BLOCK_SIZE_M": 16, "BLOCK_SIZE_N": 64, "BLOCK_SIZE_K": 32, "GROUP_SIZE_M": 8, "SPLIT_K": 16, "A_load_order": 0, "meta_evict_policy": "", "atomic_mode": "relaxed", "num_warps": 4, "num_ctas": 1, "num_stages": 1}, "(4, 3584, 3584, 64, 2)": {"BLOCK_SIZE_M": 16, "BLOCK_SIZE_N": 64, "BLOCK_SIZE_K": 32, "GROUP_SIZE_M": 8, "SPLIT_K": 16, "A_load_order": 0, "meta_evict_policy": "", "atomic_mode": "relaxed", "num_warps": 4, "num_ctas": 1, "num_stages": 1}, "(4, 37888, 3584, 64, 2)": {"BLOCK_SIZE_M": 16, "BLOCK_SIZE_N": 256, "BLOCK_SIZE_K": 32, "GROUP_SIZE_M": 8, "SPLIT_K": 8, "A_load_order": 2, "meta_evict_policy": "", "atomic_mode": "relaxed", "num_warps": 4, "num_ctas": 1, "num_stages": 4}, "(4, 3584, 18944, 64, 2)": {"BLOCK_SIZE_M": 16, "BLOCK_SIZE_N": 64, "BLOCK_SIZE_K": 32, "GROUP_SIZE_M": 8, "SPLIT_K": 16, "A_load_order": 0, "meta_evict_policy": "", "atomic_mode": "relaxed", "num_warps": 4, "num_ctas": 1, "num_stages": 1}, "(8, 4608, 3584, 64, 2)": {"BLOCK_SIZE_M": 16, "BLOCK_SIZE_N": 64, "BLOCK_SIZE_K": 32, "GROUP_SIZE_M": 8, "SPLIT_K": 16, "A_load_order": 0, "meta_evict_policy": "", "atomic_mode": "relaxed", "num_warps": 4, "num_ctas": 1, "num_stages": 1}, "(8, 3584, 3584, 64, 2)": {"BLOCK_SIZE_M": 16, "BLOCK_SIZE_N": 64, "BLOCK_SIZE_K": 32, "GROUP_SIZE_M": 8, "SPLIT_K": 16, "A_load_order": 0, "meta_evict_policy": "", "atomic_mode": "relaxed", "num_warps": 4, "num_ctas": 1, "num_stages": 1}, "(8, 37888, 3584, 64, 2)": {"BLOCK_SIZE_M": 16, "BLOCK_SIZE_N": 256, "BLOCK_SIZE_K": 32, "GROUP_SIZE_M": 8, "SPLIT_K": 8, "A_load_order": 2, "meta_evict_policy": "", "atomic_mode": "relaxed", "num_warps": 4, "num_ctas": 1, "num_stages": 4}, "(8, 3584, 18944, 64, 2)": {"BLOCK_SIZE_M": 16, "BLOCK_SIZE_N": 64, "BLOCK_SIZE_K": 32, "GROUP_SIZE_M": 8, "SPLIT_K": 16, "A_load_order": 0, "meta_evict_policy": "", "atomic_mode": "relaxed", "num_warps": 4, "num_ctas": 1, "num_stages": 1}, "(16, 4608, 3584, 64, 2)": {"BLOCK_SIZE_M": 16, "BLOCK_SIZE_N": 64, "BLOCK_SIZE_K": 64, "GROUP_SIZE_M": 8, "SPLIT_K": 8, "A_load_order": 0, "meta_evict_policy": "", "atomic_mode": "relaxed", "num_warps": 4, "num_ctas": 1, "num_stages": 1}, "(16, 3584, 3584, 64, 2)": {"BLOCK_SIZE_M": 16, "BLOCK_SIZE_N": 64, "BLOCK_SIZE_K": 32, "GROUP_SIZE_M": 8, "SPLIT_K": 16, "A_load_order": 0, "meta_evict_policy": "", "atomic_mode": "relaxed", "num_warps": 4, "num_ctas": 1, "num_stages": 1}, "(16, 37888, 3584, 64, 2)": {"BLOCK_SIZE_M": 16, "BLOCK_SIZE_N": 256, "BLOCK_SIZE_K": 32, "GROUP_SIZE_M": 8, "SPLIT_K": 8, "A_load_order": 2, "meta_evict_policy": "", "atomic_mode": "relaxed", "num_warps": 4, "num_ctas": 1, "num_stages": 4}, "(16, 3584, 18944, 64, 2)": {"BLOCK_SIZE_M": 16, "BLOCK_SIZE_N": 64, "BLOCK_SIZE_K": 32, "GROUP_SIZE_M": 8, "SPLIT_K": 16, "A_load_order": 0, "meta_evict_policy": "", "atomic_mode": "relaxed", "num_warps": 4, "num_ctas": 1, "num_stages": 1}, "(24, 4608, 3584, 64, 2)": {"BLOCK_SIZE_M": 32, "BLOCK_SIZE_N": 64, "BLOCK_SIZE_K": 64, "GROUP_SIZE_M": 8, "SPLIT_K": 8, "A_load_order": 0, "meta_evict_policy": "", "atomic_mode": "relaxed", "num_warps": 4, "num_ctas": 1, "num_stages": 1}, "(24, 3584, 3584, 64, 2)": {"BLOCK_SIZE_M": 32, "BLOCK_SIZE_N": 64, "BLOCK_SIZE_K": 64, "GROUP_SIZE_M": 8, "SPLIT_K": 8, "A_load_order": 0, "meta_evict_policy": "", "atomic_mode": "relaxed", "num_warps": 8, "num_ctas": 1, "num_stages": 1}, "(24, 37888, 3584, 64, 2)": {"BLOCK_SIZE_M": 32, "BLOCK_SIZE_N": 256, "BLOCK_SIZE_K": 32, "GROUP_SIZE_M": 8, "SPLIT_K": 8, "A_load_order": 0, "meta_evict_policy": "", "atomic_mode": "relaxed", "num_warps": 4, "num_ctas": 1, "num_stages": 4}, "(24, 3584, 18944, 64, 2)": {"BLOCK_SIZE_M": 32, "BLOCK_SIZE_N": 32, "BLOCK_SIZE_K": 64, "GROUP_SIZE_M": 8, "SPLIT_K": 8, "A_load_order": 0, "meta_evict_policy": "", "atomic_mode": "relaxed", "num_warps": 4, "num_ctas": 1, "num_stages": 1}, "(32, 4608, 3584, 64, 2)": {"BLOCK_SIZE_M": 32, "BLOCK_SIZE_N": 64, "BLOCK_SIZE_K": 64, "GROUP_SIZE_M": 8, "SPLIT_K": 8, "A_load_order": 0, "meta_evict_policy": "", "atomic_mode": "relaxed", "num_warps": 4, "num_ctas": 1, "num_stages": 1}, "(32, 3584, 3584, 64, 2)": {"BLOCK_SIZE_M": 32, "BLOCK_SIZE_N": 64, "BLOCK_SIZE_K": 64, "GROUP_SIZE_M": 8, "SPLIT_K": 8, "A_load_order": 0, "meta_evict_policy": "", "atomic_mode": "relaxed", "num_warps": 8, "num_ctas": 1, "num_stages": 1}, "(32, 37888, 3584, 64, 2)": {"BLOCK_SIZE_M": 32, "BLOCK_SIZE_N": 256, "BLOCK_SIZE_K": 32, "GROUP_SIZE_M": 8, "SPLIT_K": 8, "A_load_order": 0, "meta_evict_policy": "", "atomic_mode": "relaxed", "num_warps": 4, "num_ctas": 1, "num_stages": 4}, "(32, 3584, 18944, 64, 2)": {"BLOCK_SIZE_M": 32, "BLOCK_SIZE_N": 32, "BLOCK_SIZE_K": 64, "GROUP_SIZE_M": 8, "SPLIT_K": 8, "A_load_order": 0, "meta_evict_policy": "", "atomic_mode": "relaxed", "num_warps": 4, "num_ctas": 1, "num_stages": 1}, "(40, 4608, 3584, 64, 2)": {"BLOCK_SIZE_M": 32, "BLOCK_SIZE_N": 64, "BLOCK_SIZE_K": 64, "GROUP_SIZE_M": 8, "SPLIT_K": 4, "A_load_order": 2, "meta_evict_policy": "", "atomic_mode": "relaxed", "num_warps": 4, "num_ctas": 1, "num_stages": 4}, "(40, 3584, 3584, 64, 2)": {"BLOCK_SIZE_M": 32, "BLOCK_SIZE_N": 64, "BLOCK_SIZE_K": 32, "GROUP_SIZE_M": 8, "SPLIT_K": 8, "A_load_order": 0, "meta_evict_policy": "", "atomic_mode": "relaxed", "num_warps": 4, "num_ctas": 1, "num_stages": 1}, "(40, 37888, 3584, 64, 2)": {"BLOCK_SIZE_M": 32, "BLOCK_SIZE_N": 256, "BLOCK_SIZE_K": 32, "GROUP_SIZE_M": 8, "SPLIT_K": 4, "A_load_order": 0, "meta_evict_policy": "", "atomic_mode": "relaxed", "num_warps": 4, "num_ctas": 1, "num_stages": 4}, "(40, 3584, 18944, 64, 2)": {"BLOCK_SIZE_M": 32, "BLOCK_SIZE_N": 256, "BLOCK_SIZE_K": 64, "GROUP_SIZE_M": 8, "SPLIT_K": 8, "A_load_order": 0, "meta_evict_policy": "", "atomic_mode": "relaxed", "num_warps": 4, "num_ctas": 1, "num_stages": 5}, "(48, 4608, 3584, 64, 2)": {"BLOCK_SIZE_M": 32, "BLOCK_SIZE_N": 64, "BLOCK_SIZE_K": 64, "GROUP_SIZE_M": 8, "SPLIT_K": 4, "A_load_order": 2, "meta_evict_policy": "", "atomic_mode": "relaxed", "num_warps": 4, "num_ctas": 1, "num_stages": 4}, "(48, 3584, 3584, 64, 2)": {"BLOCK_SIZE_M": 32, "BLOCK_SIZE_N": 64, "BLOCK_SIZE_K": 32, "GROUP_SIZE_M": 8, "SPLIT_K": 8, "A_load_order": 0, "meta_evict_policy": "", "atomic_mode": "relaxed", "num_warps": 4, "num_ctas": 1, "num_stages": 1}, "(48, 37888, 3584, 64, 2)": {"BLOCK_SIZE_M": 32, "BLOCK_SIZE_N": 256, "BLOCK_SIZE_K": 32, "GROUP_SIZE_M": 8, "SPLIT_K": 4, "A_load_order": 0, "meta_evict_policy": "", "atomic_mode": "relaxed", "num_warps": 4, "num_ctas": 1, "num_stages": 4}, "(48, 3584, 18944, 64, 2)": {"BLOCK_SIZE_M": 32, "BLOCK_SIZE_N": 256, "BLOCK_SIZE_K": 64, "GROUP_SIZE_M": 8, "SPLIT_K": 8, "A_load_order": 0, "meta_evict_policy": "", "atomic_mode": "relaxed", "num_warps": 4, "num_ctas": 1, "num_stages": 4}, "(56, 4608, 3584, 64, 2)": {"BLOCK_SIZE_M": 32, "BLOCK_SIZE_N": 64, "BLOCK_SIZE_K": 64, "GROUP_SIZE_M": 8, "SPLIT_K": 4, "A_load_order": 2, "meta_evict_policy": "", "atomic_mode": "relaxed", "num_warps": 4, "num_ctas": 1, "num_stages": 4}, "(56, 3584, 3584, 64, 2)": {"BLOCK_SIZE_M": 32, "BLOCK_SIZE_N": 256, "BLOCK_SIZE_K": 64, "GROUP_SIZE_M": 8, "SPLIT_K": 8, "A_load_order": 2, "meta_evict_policy": "", "atomic_mode": "relaxed", "num_warps": 4, "num_ctas": 1, "num_stages": 4}, "(56, 37888, 3584, 64, 2)": {"BLOCK_SIZE_M": 32, "BLOCK_SIZE_N": 256, "BLOCK_SIZE_K": 32, "GROUP_SIZE_M": 8, "SPLIT_K": 4, "A_load_order": 0, "meta_evict_policy": "", "atomic_mode": "relaxed", "num_warps": 4, "num_ctas": 1, "num_stages": 4}, "(56, 3584, 18944, 64, 2)": {"BLOCK_SIZE_M": 32, "BLOCK_SIZE_N": 256, "BLOCK_SIZE_K": 64, "GROUP_SIZE_M": 8, "SPLIT_K": 8, "A_load_order": 0, "meta_evict_policy": "", "atomic_mode": "relaxed", "num_warps": 4, "num_ctas": 1, "num_stages": 5}, "(64, 4608, 3584, 64, 2)": {"BLOCK_SIZE_M": 32, "BLOCK_SIZE_N": 64, "BLOCK_SIZE_K": 64, "GROUP_SIZE_M": 8, "SPLIT_K": 4, "A_load_order": 0, "meta_evict_policy": "", "atomic_mode": "relaxed", "num_warps": 4, "num_ctas": 1, "num_stages": 4}, "(64, 3584, 3584, 64, 2)": {"BLOCK_SIZE_M": 32, "BLOCK_SIZE_N": 256, "BLOCK_SIZE_K": 64, "GROUP_SIZE_M": 8, "SPLIT_K": 8, "A_load_order": 0, "meta_evict_policy": "", "atomic_mode": "relaxed", "num_warps": 4, "num_ctas": 1, "num_stages": 4}, "(64, 37888, 3584, 64, 2)": {"BLOCK_SIZE_M": 32, "BLOCK_SIZE_N": 256, "BLOCK_SIZE_K": 32, "GROUP_SIZE_M": 8, "SPLIT_K": 4, "A_load_order": 0, "meta_evict_policy": "", "atomic_mode": "relaxed", "num_warps": 4, "num_ctas": 1, "num_stages": 5}, "(64, 3584, 18944, 64, 2)": {"BLOCK_SIZE_M": 32, "BLOCK_SIZE_N": 256, "BLOCK_SIZE_K": 64, "GROUP_SIZE_M": 8, "SPLIT_K": 8, "A_load_order": 2, "meta_evict_policy": "", "atomic_mode": "relaxed", "num_warps": 4, "num_ctas": 1, "num_stages": 4}, "(2, 6144, 2048, 64, 8)": {"BLOCK_SIZE_M": 16, "BLOCK_SIZE_N": 128, "BLOCK_SIZE_K": 32, "GROUP_SIZE_M": 8, "SPLIT_K": 8, "A_load_order": 0, "meta_evict_policy": "", "atomic_mode": "relaxed", "num_warps": 8, "num_ctas": 1, "num_stages": 1}, "(2, 2048, 2048, 64, 8)": {"BLOCK_SIZE_M": 16, "BLOCK_SIZE_N": 32, "BLOCK_SIZE_K": 64, "GROUP_SIZE_M": 8, "SPLIT_K": 16, "A_load_order": 0, "meta_evict_policy": "", "atomic_mode": "relaxed", "num_warps": 4, "num_ctas": 1, "num_stages": 1}, "(2, 11264, 2048, 64, 8)": {"BLOCK_SIZE_M": 16, "BLOCK_SIZE_N": 64, "BLOCK_SIZE_K": 32, "GROUP_SIZE_M": 8, "SPLIT_K": 16, "A_load_order": 2, "meta_evict_policy": "", "atomic_mode": "relaxed", "num_warps": 4, "num_ctas": 1, "num_stages": 1}, "(2, 2048, 5632, 64, 8)": {"BLOCK_SIZE_M": 16, "BLOCK_SIZE_N": 32, "BLOCK_SIZE_K": 32, "GROUP_SIZE_M": 8, "SPLIT_K": 16, "A_load_order": 0, "meta_evict_policy": "", "atomic_mode": "relaxed", "num_warps": 4, "num_ctas": 1, "num_stages": 1}, "(4, 6144, 2048, 64, 8)": {"BLOCK_SIZE_M": 16, "BLOCK_SIZE_N": 128, "BLOCK_SIZE_K": 32, "GROUP_SIZE_M": 8, "SPLIT_K": 8, "A_load_order": 0, "meta_evict_policy": "", "atomic_mode": "relaxed", "num_warps": 8, "num_ctas": 1, "num_stages": 1}, "(4, 2048, 2048, 64, 8)": {"BLOCK_SIZE_M": 16, "BLOCK_SIZE_N": 32, "BLOCK_SIZE_K": 64, "GROUP_SIZE_M": 8, "SPLIT_K": 16, "A_load_order": 0, "meta_evict_policy": "", "atomic_mode": "relaxed", "num_warps": 4, "num_ctas": 1, "num_stages": 1}, "(4, 11264, 2048, 64, 8)": {"BLOCK_SIZE_M": 16, "BLOCK_SIZE_N": 64, "BLOCK_SIZE_K": 32, "GROUP_SIZE_M": 8, "SPLIT_K": 16, "A_load_order": 2, "meta_evict_policy": "", "atomic_mode": "relaxed", "num_warps": 4, "num_ctas": 1, "num_stages": 1}, "(4, 2048, 5632, 64, 8)": {"BLOCK_SIZE_M": 16, "BLOCK_SIZE_N": 32, "BLOCK_SIZE_K": 32, "GROUP_SIZE_M": 8, "SPLIT_K": 16, "A_load_order": 0, "meta_evict_policy": "", "atomic_mode": "relaxed", "num_warps": 4, "num_ctas": 1, "num_stages": 1}, "(8, 6144, 2048, 64, 8)": {"BLOCK_SIZE_M": 16, "BLOCK_SIZE_N": 128, "BLOCK_SIZE_K": 32, "GROUP_SIZE_M": 8, "SPLIT_K": 8, "A_load_order": 0, "meta_evict_policy": "", "atomic_mode": "relaxed", "num_warps": 8, "num_ctas": 1, "num_stages": 1}, "(8, 2048, 2048, 64, 8)": {"BLOCK_SIZE_M": 16, "BLOCK_SIZE_N": 32, "BLOCK_SIZE_K": 64, "GROUP_SIZE_M": 8, "SPLIT_K": 16, "A_load_order": 2, "meta_evict_policy": "", "atomic_mode": "relaxed", "num_warps": 4, "num_ctas": 1, "num_stages": 1}, "(8, 11264, 2048, 64, 8)": {"BLOCK_SIZE_M": 16, "BLOCK_SIZE_N": 64, "BLOCK_SIZE_K": 32, "GROUP_SIZE_M": 8, "SPLIT_K": 16, "A_load_order": 2, "meta_evict_policy": "", "atomic_mode": "relaxed", "num_warps": 4, "num_ctas": 1, "num_stages": 1}, "(8, 2048, 5632, 64, 8)": {"BLOCK_SIZE_M": 16, "BLOCK_SIZE_N": 32, "BLOCK_SIZE_K": 32, "GROUP_SIZE_M": 8, "SPLIT_K": 16, "A_load_order": 0, "meta_evict_policy": "", "atomic_mode": "relaxed", "num_warps": 4, "num_ctas": 1, "num_stages": 1}, "(16, 6144, 2048, 64, 8)": {"BLOCK_SIZE_M": 16, "BLOCK_SIZE_N": 128, "BLOCK_SIZE_K": 32, "GROUP_SIZE_M": 8, "SPLIT_K": 8, "A_load_order": 0, "meta_evict_policy": "", "atomic_mode": "relaxed", "num_warps": 8, "num_ctas": 1, "num_stages": 1}, "(16, 2048, 2048, 64, 8)": {"BLOCK_SIZE_M": 16, "BLOCK_SIZE_N": 32, "BLOCK_SIZE_K": 64, "GROUP_SIZE_M": 8, "SPLIT_K": 16, "A_load_order": 2, "meta_evict_policy": "", "atomic_mode": "relaxed", "num_warps": 4, "num_ctas": 1, "num_stages": 1}, "(16, 11264, 2048, 64, 8)": {"BLOCK_SIZE_M": 16, "BLOCK_SIZE_N": 128, "BLOCK_SIZE_K": 32, "GROUP_SIZE_M": 8, "SPLIT_K": 8, "A_load_order": 0, "meta_evict_policy": "", "atomic_mode": "relaxed", "num_warps": 8, "num_ctas": 1, "num_stages": 1}, "(16, 2048, 5632, 64, 8)": {"BLOCK_SIZE_M": 16, "BLOCK_SIZE_N": 32, "BLOCK_SIZE_K": 32, "GROUP_SIZE_M": 8, "SPLIT_K": 16, "A_load_order": 0, "meta_evict_policy": "", "atomic_mode": "relaxed", "num_warps": 4, "num_ctas": 1, "num_stages": 1}, "(24, 6144, 2048, 64, 8)": {"BLOCK_SIZE_M": 32, "BLOCK_SIZE_N": 32, "BLOCK_SIZE_K": 64, "GROUP_SIZE_M": 8, "SPLIT_K": 4, "A_load_order": 2, "meta_evict_policy": "", "atomic_mode": "relaxed", "num_warps": 4, "num_ctas": 1, "num_stages": 1}, "(24, 2048, 2048, 64, 8)": {"BLOCK_SIZE_M": 32, "BLOCK_SIZE_N": 32, "BLOCK_SIZE_K": 64, "GROUP_SIZE_M": 8, "SPLIT_K": 8, "A_load_order": 2, "meta_evict_policy": "", "atomic_mode": "relaxed", "num_warps": 4, "num_ctas": 1, "num_stages": 1}, "(24, 11264, 2048, 64, 8)": {"BLOCK_SIZE_M": 32, "BLOCK_SIZE_N": 32, "BLOCK_SIZE_K": 64, "GROUP_SIZE_M": 8, "SPLIT_K": 4, "A_load_order": 2, "meta_evict_policy": "", "atomic_mode": "relaxed", "num_warps": 4, "num_ctas": 1, "num_stages": 1}, "(24, 2048, 5632, 64, 8)": {"BLOCK_SIZE_M": 32, "BLOCK_SIZE_N": 32, "BLOCK_SIZE_K": 64, "GROUP_SIZE_M": 8, "SPLIT_K": 8, "A_load_order": 2, "meta_evict_policy": "", "atomic_mode": "relaxed", "num_warps": 4, "num_ctas": 1, "num_stages": 1}, "(32, 6144, 2048, 64, 8)": {"BLOCK_SIZE_M": 32, "BLOCK_SIZE_N": 32, "BLOCK_SIZE_K": 64, "GROUP_SIZE_M": 8, "SPLIT_K": 4, "A_load_order": 2, "meta_evict_policy": "", "atomic_mode": "relaxed", "num_warps": 4, "num_ctas": 1, "num_stages": 1}, "(32, 2048, 2048, 64, 8)": {"BLOCK_SIZE_M": 32, "BLOCK_SIZE_N": 32, "BLOCK_SIZE_K": 64, "GROUP_SIZE_M": 8, "SPLIT_K": 8, "A_load_order": 2, "meta_evict_policy": "", "atomic_mode": "relaxed", "num_warps": 4, "num_ctas": 1, "num_stages": 1}, "(32, 11264, 2048, 64, 8)": {"BLOCK_SIZE_M": 32, "BLOCK_SIZE_N": 32, "BLOCK_SIZE_K": 64, "GROUP_SIZE_M": 8, "SPLIT_K": 4, "A_load_order": 2, "meta_evict_policy": "", "atomic_mode": "relaxed", "num_warps": 4, "num_ctas": 1, "num_stages": 1}, "(32, 2048, 5632, 64, 8)": {"BLOCK_SIZE_M": 32, "BLOCK_SIZE_N": 32, "BLOCK_SIZE_K": 64, "GROUP_SIZE_M": 8, "SPLIT_K": 8, "A_load_order": 2, "meta_evict_policy": "", "atomic_mode": "relaxed", "num_warps": 4, "num_ctas": 1, "num_stages": 1}, "(40, 6144, 2048, 64, 8)": {"BLOCK_SIZE_M": 32, "BLOCK_SIZE_N": 64, "BLOCK_SIZE_K": 64, "GROUP_SIZE_M": 8, "SPLIT_K": 2, "A_load_order": 2, "meta_evict_policy": "", "atomic_mode": "relaxed", "num_warps": 4, "num_ctas": 1, "num_stages": 1}, "(40, 2048, 2048, 64, 8)": {"BLOCK_SIZE_M": 32, "BLOCK_SIZE_N": 32, "BLOCK_SIZE_K": 64, "GROUP_SIZE_M": 8, "SPLIT_K": 4, "A_load_order": 2, "meta_evict_policy": "", "atomic_mode": "relaxed", "num_warps": 4, "num_ctas": 1, "num_stages": 1}, "(40, 11264, 2048, 64, 8)": {"BLOCK_SIZE_M": 32, "BLOCK_SIZE_N": 64, "BLOCK_SIZE_K": 64, "GROUP_SIZE_M": 8, "SPLIT_K": 1, "A_load_order": 2, "meta_evict_policy": "", "atomic_mode": "relaxed", "num_warps": 4, "num_ctas": 1, "num_stages": 1}, "(40, 2048, 5632, 64, 8)": {"BLOCK_SIZE_M": 32, "BLOCK_SIZE_N": 32, "BLOCK_SIZE_K": 64, "GROUP_SIZE_M": 8, "SPLIT_K": 8, "A_load_order": 0, "meta_evict_policy": "", "atomic_mode": "relaxed", "num_warps": 4, "num_ctas": 1, "num_stages": 1}, "(48, 6144, 2048, 64, 8)": {"BLOCK_SIZE_M": 32, "BLOCK_SIZE_N": 64, "BLOCK_SIZE_K": 64, "GROUP_SIZE_M": 8, "SPLIT_K": 2, "A_load_order": 2, "meta_evict_policy": "", "atomic_mode": "relaxed", "num_warps": 4, "num_ctas": 1, "num_stages": 1}, "(48, 2048, 2048, 64, 8)": {"BLOCK_SIZE_M": 32, "BLOCK_SIZE_N": 32, "BLOCK_SIZE_K": 64, "GROUP_SIZE_M": 8, "SPLIT_K": 4, "A_load_order": 2, "meta_evict_policy": "", "atomic_mode": "relaxed", "num_warps": 4, "num_ctas": 1, "num_stages": 1}, "(48, 11264, 2048, 64, 8)": {"BLOCK_SIZE_M": 32, "BLOCK_SIZE_N": 64, "BLOCK_SIZE_K": 64, "GROUP_SIZE_M": 8, "SPLIT_K": 1, "A_load_order": 2, "meta_evict_policy": "", "atomic_mode": "relaxed", "num_warps": 4, "num_ctas": 1, "num_stages": 1}, "(48, 2048, 5632, 64, 8)": {"BLOCK_SIZE_M": 32, "BLOCK_SIZE_N": 32, "BLOCK_SIZE_K": 64, "GROUP_SIZE_M": 8, "SPLIT_K": 8, "A_load_order": 0, "meta_evict_policy": "", "atomic_mode": "relaxed", "num_warps": 4, "num_ctas": 1, "num_stages": 1}, "(56, 6144, 2048, 64, 8)": {"BLOCK_SIZE_M": 32, "BLOCK_SIZE_N": 64, "BLOCK_SIZE_K": 64, "GROUP_SIZE_M": 8, "SPLIT_K": 2, "A_load_order": 2, "meta_evict_policy": "", "atomic_mode": "relaxed", "num_warps": 4, "num_ctas": 1, "num_stages": 1}, "(56, 2048, 2048, 64, 8)": {"BLOCK_SIZE_M": 32, "BLOCK_SIZE_N": 32, "BLOCK_SIZE_K": 64, "GROUP_SIZE_M": 8, "SPLIT_K": 4, "A_load_order": 2, "meta_evict_policy": "", "atomic_mode": "relaxed", "num_warps": 4, "num_ctas": 1, "num_stages": 1}, "(56, 11264, 2048, 64, 8)": {"BLOCK_SIZE_M": 32, "BLOCK_SIZE_N": 64, "BLOCK_SIZE_K": 64, "GROUP_SIZE_M": 8, "SPLIT_K": 1, "A_load_order": 2, "meta_evict_policy": "", "atomic_mode": "relaxed", "num_warps": 4, "num_ctas": 1, "num_stages": 1}, "(56, 2048, 5632, 64, 8)": {"BLOCK_SIZE_M": 32, "BLOCK_SIZE_N": 32, "BLOCK_SIZE_K": 64, "GROUP_SIZE_M": 8, "SPLIT_K": 8, "A_load_order": 0, "meta_evict_policy": "", "atomic_mode": "relaxed", "num_warps": 4, "num_ctas": 1, "num_stages": 1}, "(64, 6144, 2048, 64, 8)": {"BLOCK_SIZE_M": 32, "BLOCK_SIZE_N": 64, "BLOCK_SIZE_K": 64, "GROUP_SIZE_M": 8, "SPLIT_K": 2, "A_load_order": 2, "meta_evict_policy": "", "atomic_mode": "relaxed", "num_warps": 4, "num_ctas": 1, "num_stages": 1}, "(64, 2048, 2048, 64, 8)": {"BLOCK_SIZE_M": 32, "BLOCK_SIZE_N": 32, "BLOCK_SIZE_K": 64, "GROUP_SIZE_M": 8, "SPLIT_K": 4, "A_load_order": 2, "meta_evict_policy": "", "atomic_mode": "relaxed", "num_warps": 4, "num_ctas": 1, "num_stages": 1}, "(64, 11264, 2048, 64, 8)": {"BLOCK_SIZE_M": 32, "BLOCK_SIZE_N": 64, "BLOCK_SIZE_K": 64, "GROUP_SIZE_M": 8, "SPLIT_K": 1, "A_load_order": 2, "meta_evict_policy": "", "atomic_mode": "relaxed", "num_warps": 4, "num_ctas": 1, "num_stages": 1}, "(64, 2048, 5632, 64, 8)": {"BLOCK_SIZE_M": 32, "BLOCK_SIZE_N": 32, "BLOCK_SIZE_K": 64, "GROUP_SIZE_M": 8, "SPLIT_K": 8, "A_load_order": 0, "meta_evict_policy": "", "atomic_mode": "relaxed", "num_warps": 4, "num_ctas": 1, "num_stages": 1}, "(2, 3072, 4096, 64, 8)": {"BLOCK_SIZE_M": 16, "BLOCK_SIZE_N": 64, "BLOCK_SIZE_K": 64, "GROUP_SIZE_M": 8, "SPLIT_K": 16, "A_load_order": 0, "meta_evict_policy": "", "atomic_mode": "relaxed", "num_warps": 4, "num_ctas": 1, "num_stages": 1}, "(2, 4096, 2048, 64, 8)": {"BLOCK_SIZE_M": 16, "BLOCK_SIZE_N": 64, "BLOCK_SIZE_K": 32, "GROUP_SIZE_M": 8, "SPLIT_K": 16, "A_load_order": 2, "meta_evict_policy": "", "atomic_mode": "relaxed", "num_warps": 4, "num_ctas": 1, "num_stages": 1}, "(2, 14336, 4096, 64, 8)": {"BLOCK_SIZE_M": 16, "BLOCK_SIZE_N": 64, "BLOCK_SIZE_K": 64, "GROUP_SIZE_M": 8, "SPLIT_K": 4, "A_load_order": 0, "meta_evict_policy": "", "atomic_mode": "relaxed", "num_warps": 4, "num_ctas": 1, "num_stages": 1}, "(2, 4096, 7168, 64, 8)": {"BLOCK_SIZE_M": 16, "BLOCK_SIZE_N": 64, "BLOCK_SIZE_K": 32, "GROUP_SIZE_M": 8, "SPLIT_K": 16, "A_load_order": 2, "meta_evict_policy": "", "atomic_mode": "relaxed", "num_warps": 4, "num_ctas": 1, "num_stages": 1}, "(4, 3072, 4096, 64, 8)": {"BLOCK_SIZE_M": 16, "BLOCK_SIZE_N": 64, "BLOCK_SIZE_K": 64, "GROUP_SIZE_M": 8, "SPLIT_K": 16, "A_load_order": 0, "meta_evict_policy": "", "atomic_mode": "relaxed", "num_warps": 4, "num_ctas": 1, "num_stages": 1}, "(4, 4096, 2048, 64, 8)": {"BLOCK_SIZE_M": 16, "BLOCK_SIZE_N": 64, "BLOCK_SIZE_K": 32, "GROUP_SIZE_M": 8, "SPLIT_K": 16, "A_load_order": 2, "meta_evict_policy": "", "atomic_mode": "relaxed", "num_warps": 4, "num_ctas": 1, "num_stages": 1}, "(4, 14336, 4096, 64, 8)": {"BLOCK_SIZE_M": 16, "BLOCK_SIZE_N": 64, "BLOCK_SIZE_K": 64, "GROUP_SIZE_M": 8, "SPLIT_K": 4, "A_load_order": 0, "meta_evict_policy": "", "atomic_mode": "relaxed", "num_warps": 4, "num_ctas": 1, "num_stages": 1}, "(4, 4096, 7168, 64, 8)": {"BLOCK_SIZE_M": 16, "BLOCK_SIZE_N": 64, "BLOCK_SIZE_K": 32, "GROUP_SIZE_M": 8, "SPLIT_K": 16, "A_load_order": 2, "meta_evict_policy": "", "atomic_mode": "relaxed", "num_warps": 4, "num_ctas": 1, "num_stages": 1}, "(8, 3072, 4096, 64, 8)": {"BLOCK_SIZE_M": 16, "BLOCK_SIZE_N": 64, "BLOCK_SIZE_K": 64, "GROUP_SIZE_M": 8, "SPLIT_K": 16, "A_load_order": 0, "meta_evict_policy": "", "atomic_mode": "relaxed", "num_warps": 4, "num_ctas": 1, "num_stages": 1}, "(8, 4096, 2048, 64, 8)": {"BLOCK_SIZE_M": 16, "BLOCK_SIZE_N": 64, "BLOCK_SIZE_K": 32, "GROUP_SIZE_M": 8, "SPLIT_K": 16, "A_load_order": 2, "meta_evict_policy": "", "atomic_mode": "relaxed", "num_warps": 4, "num_ctas": 1, "num_stages": 1}, "(8, 14336, 4096, 64, 8)": {"BLOCK_SIZE_M": 16, "BLOCK_SIZE_N": 64, "BLOCK_SIZE_K": 64, "GROUP_SIZE_M": 8, "SPLIT_K": 4, "A_load_order": 0, "meta_evict_policy": "", "atomic_mode": "relaxed", "num_warps": 4, "num_ctas": 1, "num_stages": 1}, "(8, 4096, 7168, 64, 8)": {"BLOCK_SIZE_M": 16, "BLOCK_SIZE_N": 64, "BLOCK_SIZE_K": 32, "GROUP_SIZE_M": 8, "SPLIT_K": 16, "A_load_order": 2, "meta_evict_policy": "", "atomic_mode": "relaxed", "num_warps": 4, "num_ctas": 1, "num_stages": 1}, "(16, 3072, 4096, 64, 8)": {"BLOCK_SIZE_M": 16, "BLOCK_SIZE_N": 64, "BLOCK_SIZE_K": 64, "GROUP_SIZE_M": 8, "SPLIT_K": 16, "A_load_order": 0, "meta_evict_policy": "", "atomic_mode": "relaxed", "num_warps": 4, "num_ctas": 1, "num_stages": 1}, "(16, 4096, 2048, 64, 8)": {"BLOCK_SIZE_M": 16, "BLOCK_SIZE_N": 64, "BLOCK_SIZE_K": 64, "GROUP_SIZE_M": 8, "SPLIT_K": 8, "A_load_order": 2, "meta_evict_policy": "", "atomic_mode": "relaxed", "num_warps": 8, "num_ctas": 1, "num_stages": 1}, "(16, 14336, 4096, 64, 8)": {"BLOCK_SIZE_M": 16, "BLOCK_SIZE_N": 64, "BLOCK_SIZE_K": 64, "GROUP_SIZE_M": 8, "SPLIT_K": 4, "A_load_order": 0, "meta_evict_policy": "", "atomic_mode": "relaxed", "num_warps": 4, "num_ctas": 1, "num_stages": 1}, "(16, 4096, 7168, 64, 8)": {"BLOCK_SIZE_M": 16, "BLOCK_SIZE_N": 64, "BLOCK_SIZE_K": 32, "GROUP_SIZE_M": 8, "SPLIT_K": 16, "A_load_order": 2, "meta_evict_policy": "", "atomic_mode": "relaxed", "num_warps": 4, "num_ctas": 1, "num_stages": 1}, "(24, 3072, 4096, 64, 8)": {"BLOCK_SIZE_M": 32, "BLOCK_SIZE_N": 64, "BLOCK_SIZE_K": 64, "GROUP_SIZE_M": 8, "SPLIT_K": 8, "A_load_order": 2, "meta_evict_policy": "", "atomic_mode": "relaxed", "num_warps": 4, "num_ctas": 1, "num_stages": 1}, "(24, 4096, 2048, 64, 8)": {"BLOCK_SIZE_M": 32, "BLOCK_SIZE_N": 64, "BLOCK_SIZE_K": 64, "GROUP_SIZE_M": 8, "SPLIT_K": 8, "A_load_order": 2, "meta_evict_policy": "", "atomic_mode": "relaxed", "num_warps": 4, "num_ctas": 1, "num_stages": 1}, "(24, 14336, 4096, 64, 8)": {"BLOCK_SIZE_M": 32, "BLOCK_SIZE_N": 64, "BLOCK_SIZE_K": 64, "GROUP_SIZE_M": 8, "SPLIT_K": 4, "A_load_order": 2, "meta_evict_policy": "", "atomic_mode": "relaxed", "num_warps": 4, "num_ctas": 1, "num_stages": 1}, "(24, 4096, 7168, 64, 8)": {"BLOCK_SIZE_M": 32, "BLOCK_SIZE_N": 64, "BLOCK_SIZE_K": 64, "GROUP_SIZE_M": 8, "SPLIT_K": 8, "A_load_order": 2, "meta_evict_policy": "", "atomic_mode": "relaxed", "num_warps": 4, "num_ctas": 1, "num_stages": 1}, "(32, 3072, 4096, 64, 8)": {"BLOCK_SIZE_M": 32, "BLOCK_SIZE_N": 64, "BLOCK_SIZE_K": 64, "GROUP_SIZE_M": 8, "SPLIT_K": 8, "A_load_order": 2, "meta_evict_policy": "", "atomic_mode": "relaxed", "num_warps": 4, "num_ctas": 1, "num_stages": 1}, "(32, 4096, 2048, 64, 8)": {"BLOCK_SIZE_M": 32, "BLOCK_SIZE_N": 64, "BLOCK_SIZE_K": 64, "GROUP_SIZE_M": 8, "SPLIT_K": 8, "A_load_order": 2, "meta_evict_policy": "", "atomic_mode": "relaxed", "num_warps": 4, "num_ctas": 1, "num_stages": 1}, "(32, 14336, 4096, 64, 8)": {"BLOCK_SIZE_M": 32, "BLOCK_SIZE_N": 64, "BLOCK_SIZE_K": 64, "GROUP_SIZE_M": 8, "SPLIT_K": 4, "A_load_order": 2, "meta_evict_policy": "", "atomic_mode": "relaxed", "num_warps": 4, "num_ctas": 1, "num_stages": 1}, "(32, 4096, 7168, 64, 8)": {"BLOCK_SIZE_M": 32, "BLOCK_SIZE_N": 64, "BLOCK_SIZE_K": 64, "GROUP_SIZE_M": 8, "SPLIT_K": 8, "A_load_order": 2, "meta_evict_policy": "", "atomic_mode": "relaxed", "num_warps": 4, "num_ctas": 1, "num_stages": 1}, "(40, 3072, 4096, 64, 8)": {"BLOCK_SIZE_M": 32, "BLOCK_SIZE_N": 64, "BLOCK_SIZE_K": 64, "GROUP_SIZE_M": 8, "SPLIT_K": 4, "A_load_order": 2, "meta_evict_policy": "", "atomic_mode": "relaxed", "num_warps": 4, "num_ctas": 1, "num_stages": 1}, "(40, 4096, 2048, 64, 8)": {"BLOCK_SIZE_M": 32, "BLOCK_SIZE_N": 64, "BLOCK_SIZE_K": 64, "GROUP_SIZE_M": 8, "SPLIT_K": 4, "A_load_order": 2, "meta_evict_policy": "", "atomic_mode": "relaxed", "num_warps": 4, "num_ctas": 1, "num_stages": 1}, "(40, 14336, 4096, 64, 8)": {"BLOCK_SIZE_M": 32, "BLOCK_SIZE_N": 64, "BLOCK_SIZE_K": 64, "GROUP_SIZE_M": 8, "SPLIT_K": 8, "A_load_order": 2, "meta_evict_policy": "", "atomic_mode": "relaxed", "num_warps": 4, "num_ctas": 1, "num_stages": 1}, "(40, 4096, 7168, 64, 8)": {"BLOCK_SIZE_M": 32, "BLOCK_SIZE_N": 64, "BLOCK_SIZE_K": 64, "GROUP_SIZE_M": 8, "SPLIT_K": 4, "A_load_order": 2, "meta_evict_policy": "", "atomic_mode": "relaxed", "num_warps": 4, "num_ctas": 1, "num_stages": 1}, "(48, 3072, 4096, 64, 8)": {"BLOCK_SIZE_M": 32, "BLOCK_SIZE_N": 64, "BLOCK_SIZE_K": 64, "GROUP_SIZE_M": 8, "SPLIT_K": 4, "A_load_order": 2, "meta_evict_policy": "", "atomic_mode": "relaxed", "num_warps": 4, "num_ctas": 1, "num_stages": 1}, "(48, 4096, 2048, 64, 8)": {"BLOCK_SIZE_M": 32, "BLOCK_SIZE_N": 64, "BLOCK_SIZE_K": 64, "GROUP_SIZE_M": 8, "SPLIT_K": 4, "A_load_order": 2, "meta_evict_policy": "", "atomic_mode": "relaxed", "num_warps": 4, "num_ctas": 1, "num_stages": 1}, "(48, 14336, 4096, 64, 8)": {"BLOCK_SIZE_M": 32, "BLOCK_SIZE_N": 64, "BLOCK_SIZE_K": 64, "GROUP_SIZE_M": 8, "SPLIT_K": 8, "A_load_order": 2, "meta_evict_policy": "", "atomic_mode": "relaxed", "num_warps": 4, "num_ctas": 1, "num_stages": 1}, "(48, 4096, 7168, 64, 8)": {"BLOCK_SIZE_M": 32, "BLOCK_SIZE_N": 64, "BLOCK_SIZE_K": 64, "GROUP_SIZE_M": 8, "SPLIT_K": 4, "A_load_order": 2, "meta_evict_policy": "", "atomic_mode": "relaxed", "num_warps": 4, "num_ctas": 1, "num_stages": 1}, "(56, 3072, 4096, 64, 8)": {"BLOCK_SIZE_M": 32, "BLOCK_SIZE_N": 64, "BLOCK_SIZE_K": 64, "GROUP_SIZE_M": 8, "SPLIT_K": 4, "A_load_order": 2, "meta_evict_policy": "", "atomic_mode": "relaxed", "num_warps": 4, "num_ctas": 1, "num_stages": 1}, "(56, 4096, 2048, 64, 8)": {"BLOCK_SIZE_M": 32, "BLOCK_SIZE_N": 64, "BLOCK_SIZE_K": 64, "GROUP_SIZE_M": 8, "SPLIT_K": 4, "A_load_order": 2, "meta_evict_policy": "", "atomic_mode": "relaxed", "num_warps": 4, "num_ctas": 1, "num_stages": 1}, "(56, 14336, 4096, 64, 8)": {"BLOCK_SIZE_M": 32, "BLOCK_SIZE_N": 64, "BLOCK_SIZE_K": 64, "GROUP_SIZE_M": 8, "SPLIT_K": 8, "A_load_order": 2, "meta_evict_policy": "", "atomic_mode": "relaxed", "num_warps": 4, "num_ctas": 1, "num_stages": 1}, "(56, 4096, 7168, 64, 8)": {"BLOCK_SIZE_M": 32, "BLOCK_SIZE_N": 64, "BLOCK_SIZE_K": 64, "GROUP_SIZE_M": 8, "SPLIT_K": 4, "A_load_order": 2, "meta_evict_policy": "", "atomic_mode": "relaxed", "num_warps": 4, "num_ctas": 1, "num_stages": 1}, "(64, 3072, 4096, 64, 8)": {"BLOCK_SIZE_M": 32, "BLOCK_SIZE_N": 64, "BLOCK_SIZE_K": 64, "GROUP_SIZE_M": 8, "SPLIT_K": 4, "A_load_order": 2, "meta_evict_policy": "", "atomic_mode": "relaxed", "num_warps": 4, "num_ctas": 1, "num_stages": 1}, "(64, 4096, 2048, 64, 8)": {"BLOCK_SIZE_M": 32, "BLOCK_SIZE_N": 64, "BLOCK_SIZE_K": 64, "GROUP_SIZE_M": 8, "SPLIT_K": 4, "A_load_order": 2, "meta_evict_policy": "", "atomic_mode": "relaxed", "num_warps": 4, "num_ctas": 1, "num_stages": 1}, "(64, 14336, 4096, 64, 8)": {"BLOCK_SIZE_M": 32, "BLOCK_SIZE_N": 64, "BLOCK_SIZE_K": 64, "GROUP_SIZE_M": 8, "SPLIT_K": 8, "A_load_order": 2, "meta_evict_policy": "", "atomic_mode": "relaxed", "num_warps": 4, "num_ctas": 1, "num_stages": 1}, "(64, 4096, 7168, 64, 8)": {"BLOCK_SIZE_M": 32, "BLOCK_SIZE_N": 64, "BLOCK_SIZE_K": 64, "GROUP_SIZE_M": 8, "SPLIT_K": 4, "A_load_order": 2, "meta_evict_policy": "", "atomic_mode": "relaxed", "num_warps": 4, "num_ctas": 1, "num_stages": 1}, "(2, 1536, 4096, 64, 8)": {"BLOCK_SIZE_M": 16, "BLOCK_SIZE_N": 32, "BLOCK_SIZE_K": 64, "GROUP_SIZE_M": 8, "SPLIT_K": 16, "A_load_order": 0, "meta_evict_policy": "", "atomic_mode": "relaxed", "num_warps": 4, "num_ctas": 1, "num_stages": 1}, "(2, 4096, 1024, 64, 8)": {"BLOCK_SIZE_M": 16, "BLOCK_SIZE_N": 64, "BLOCK_SIZE_K": 32, "GROUP_SIZE_M": 8, "SPLIT_K": 16, "A_load_order": 2, "meta_evict_policy": "", "atomic_mode": "relaxed", "num_warps": 4, "num_ctas": 1, "num_stages": 1}, "(2, 7168, 4096, 64, 8)": {"BLOCK_SIZE_M": 16, "BLOCK_SIZE_N": 64, "BLOCK_SIZE_K": 64, "GROUP_SIZE_M": 8, "SPLIT_K": 8, "A_load_order": 0, "meta_evict_policy": "", "atomic_mode": "relaxed", "num_warps": 4, "num_ctas": 1, "num_stages": 1}, "(2, 4096, 3584, 64, 8)": {"BLOCK_SIZE_M": 16, "BLOCK_SIZE_N": 64, "BLOCK_SIZE_K": 32, "GROUP_SIZE_M": 8, "SPLIT_K": 16, "A_load_order": 2, "meta_evict_policy": "", "atomic_mode": "relaxed", "num_warps": 4, "num_ctas": 1, "num_stages": 1}, "(4, 1536, 4096, 64, 8)": {"BLOCK_SIZE_M": 16, "BLOCK_SIZE_N": 32, "BLOCK_SIZE_K": 64, "GROUP_SIZE_M": 8, "SPLIT_K": 16, "A_load_order": 0, "meta_evict_policy": "", "atomic_mode": "relaxed", "num_warps": 4, "num_ctas": 1, "num_stages": 1}, "(4, 4096, 1024, 64, 8)": {"BLOCK_SIZE_M": 16, "BLOCK_SIZE_N": 64, "BLOCK_SIZE_K": 32, "GROUP_SIZE_M": 8, "SPLIT_K": 16, "A_load_order": 2, "meta_evict_policy": "", "atomic_mode": "relaxed", "num_warps": 4, "num_ctas": 1, "num_stages": 1}, "(4, 7168, 4096, 64, 8)": {"BLOCK_SIZE_M": 16, "BLOCK_SIZE_N": 64, "BLOCK_SIZE_K": 64, "GROUP_SIZE_M": 8, "SPLIT_K": 8, "A_load_order": 0, "meta_evict_policy": "", "atomic_mode": "relaxed", "num_warps": 4, "num_ctas": 1, "num_stages": 1}, "(4, 4096, 3584, 64, 8)": {"BLOCK_SIZE_M": 16, "BLOCK_SIZE_N": 64, "BLOCK_SIZE_K": 32, "GROUP_SIZE_M": 8, "SPLIT_K": 16, "A_load_order": 2, "meta_evict_policy": "", "atomic_mode": "relaxed", "num_warps": 4, "num_ctas": 1, "num_stages": 1}, "(8, 1536, 4096, 64, 8)": {"BLOCK_SIZE_M": 16, "BLOCK_SIZE_N": 64, "BLOCK_SIZE_K": 64, "GROUP_SIZE_M": 8, "SPLIT_K": 16, "A_load_order": 2, "meta_evict_policy": "", "atomic_mode": "relaxed", "num_warps": 8, "num_ctas": 1, "num_stages": 1}, "(8, 4096, 1024, 64, 8)": {"BLOCK_SIZE_M": 16, "BLOCK_SIZE_N": 64, "BLOCK_SIZE_K": 64, "GROUP_SIZE_M": 8, "SPLIT_K": 8, "A_load_order": 2, "meta_evict_policy": "", "atomic_mode": "relaxed", "num_warps": 8, "num_ctas": 1, "num_stages": 1}, "(8, 7168, 4096, 64, 8)": {"BLOCK_SIZE_M": 16, "BLOCK_SIZE_N": 64, "BLOCK_SIZE_K": 64, "GROUP_SIZE_M": 8, "SPLIT_K": 8, "A_load_order": 0, "meta_evict_policy": "", "atomic_mode": "relaxed", "num_warps": 4, "num_ctas": 1, "num_stages": 1}, "(8, 4096, 3584, 64, 8)": {"BLOCK_SIZE_M": 16, "BLOCK_SIZE_N": 64, "BLOCK_SIZE_K": 32, "GROUP_SIZE_M": 8, "SPLIT_K": 16, "A_load_order": 2, "meta_evict_policy": "", "atomic_mode": "relaxed", "num_warps": 4, "num_ctas": 1, "num_stages": 1}, "(16, 1536, 4096, 64, 8)": {"BLOCK_SIZE_M": 16, "BLOCK_SIZE_N": 64, "BLOCK_SIZE_K": 64, "GROUP_SIZE_M": 8, "SPLIT_K": 16, "A_load_order": 2, "meta_evict_policy": "", "atomic_mode": "relaxed", "num_warps": 8, "num_ctas": 1, "num_stages": 1}, "(16, 4096, 1024, 64, 8)": {"BLOCK_SIZE_M": 16, "BLOCK_SIZE_N": 64, "BLOCK_SIZE_K": 64, "GROUP_SIZE_M": 8, "SPLIT_K": 8, "A_load_order": 2, "meta_evict_policy": "", "atomic_mode": "relaxed", "num_warps": 8, "num_ctas": 1, "num_stages": 1}, "(16, 7168, 4096, 64, 8)": {"BLOCK_SIZE_M": 16, "BLOCK_SIZE_N": 64, "BLOCK_SIZE_K": 64, "GROUP_SIZE_M": 8, "SPLIT_K": 8, "A_load_order": 0, "meta_evict_policy": "", "atomic_mode": "relaxed", "num_warps": 4, "num_ctas": 1, "num_stages": 1}, "(16, 4096, 3584, 64, 8)": {"BLOCK_SIZE_M": 16, "BLOCK_SIZE_N": 64, "BLOCK_SIZE_K": 32, "GROUP_SIZE_M": 8, "SPLIT_K": 16, "A_load_order": 2, "meta_evict_policy": "", "atomic_mode": "relaxed", "num_warps": 4, "num_ctas": 1, "num_stages": 1}, "(24, 1536, 4096, 64, 8)": {"BLOCK_SIZE_M": 32, "BLOCK_SIZE_N": 32, "BLOCK_SIZE_K": 64, "GROUP_SIZE_M": 8, "SPLIT_K": 8, "A_load_order": 2, "meta_evict_policy": "", "atomic_mode": "relaxed", "num_warps": 4, "num_ctas": 1, "num_stages": 1}, "(24, 4096, 1024, 64, 8)": {"BLOCK_SIZE_M": 32, "BLOCK_SIZE_N": 64, "BLOCK_SIZE_K": 64, "GROUP_SIZE_M": 8, "SPLIT_K": 8, "A_load_order": 2, "meta_evict_policy": "", "atomic_mode": "relaxed", "num_warps": 4, "num_ctas": 1, "num_stages": 1}, "(24, 7168, 4096, 64, 8)": {"BLOCK_SIZE_M": 32, "BLOCK_SIZE_N": 64, "BLOCK_SIZE_K": 64, "GROUP_SIZE_M": 8, "SPLIT_K": 4, "A_load_order": 2, "meta_evict_policy": "", "atomic_mode": "relaxed", "num_warps": 4, "num_ctas": 1, "num_stages": 1}, "(24, 4096, 3584, 64, 8)": {"BLOCK_SIZE_M": 32, "BLOCK_SIZE_N": 64, "BLOCK_SIZE_K": 64, "GROUP_SIZE_M": 8, "SPLIT_K": 8, "A_load_order": 2, "meta_evict_policy": "", "atomic_mode": "relaxed", "num_warps": 4, "num_ctas": 1, "num_stages": 1}, "(32, 1536, 4096, 64, 8)": {"BLOCK_SIZE_M": 32, "BLOCK_SIZE_N": 32, "BLOCK_SIZE_K": 64, "GROUP_SIZE_M": 8, "SPLIT_K": 8, "A_load_order": 2, "meta_evict_policy": "", "atomic_mode": "relaxed", "num_warps": 4, "num_ctas": 1, "num_stages": 1}, "(32, 4096, 1024, 64, 8)": {"BLOCK_SIZE_M": 32, "BLOCK_SIZE_N": 32, "BLOCK_SIZE_K": 64, "GROUP_SIZE_M": 8, "SPLIT_K": 4, "A_load_order": 2, "meta_evict_policy": "", "atomic_mode": "relaxed", "num_warps": 4, "num_ctas": 1, "num_stages": 1}, "(32, 7168, 4096, 64, 8)": {"BLOCK_SIZE_M": 32, "BLOCK_SIZE_N": 64, "BLOCK_SIZE_K": 64, "GROUP_SIZE_M": 8, "SPLIT_K": 4, "A_load_order": 2, "meta_evict_policy": "", "atomic_mode": "relaxed", "num_warps": 4, "num_ctas": 1, "num_stages": 1}, "(32, 4096, 3584, 64, 8)": {"BLOCK_SIZE_M": 32, "BLOCK_SIZE_N": 64, "BLOCK_SIZE_K": 64, "GROUP_SIZE_M": 8, "SPLIT_K": 8, "A_load_order": 2, "meta_evict_policy": "", "atomic_mode": "relaxed", "num_warps": 4, "num_ctas": 1, "num_stages": 1}, "(40, 1536, 4096, 64, 8)": {"BLOCK_SIZE_M": 32, "BLOCK_SIZE_N": 64, "BLOCK_SIZE_K": 64, "GROUP_SIZE_M": 8, "SPLIT_K": 8, "A_load_order": 2, "meta_evict_policy": "", "atomic_mode": "relaxed", "num_warps": 4, "num_ctas": 1, "num_stages": 1}, "(40, 4096, 1024, 64, 8)": {"BLOCK_SIZE_M": 32, "BLOCK_SIZE_N": 64, "BLOCK_SIZE_K": 64, "GROUP_SIZE_M": 8, "SPLIT_K": 4, "A_load_order": 2, "meta_evict_policy": "", "atomic_mode": "relaxed", "num_warps": 4, "num_ctas": 1, "num_stages": 1}, "(40, 7168, 4096, 64, 8)": {"BLOCK_SIZE_M": 32, "BLOCK_SIZE_N": 64, "BLOCK_SIZE_K": 64, "GROUP_SIZE_M": 8, "SPLIT_K": 4, "A_load_order": 2, "meta_evict_policy": "", "atomic_mode": "relaxed", "num_warps": 4, "num_ctas": 1, "num_stages": 1}, "(40, 4096, 3584, 64, 8)": {"BLOCK_SIZE_M": 32, "BLOCK_SIZE_N": 64, "BLOCK_SIZE_K": 64, "GROUP_SIZE_M": 8, "SPLIT_K": 4, "A_load_order": 2, "meta_evict_policy": "", "atomic_mode": "relaxed", "num_warps": 4, "num_ctas": 1, "num_stages": 1}, "(48, 1536, 4096, 64, 8)": {"BLOCK_SIZE_M": 32, "BLOCK_SIZE_N": 64, "BLOCK_SIZE_K": 64, "GROUP_SIZE_M": 8, "SPLIT_K": 8, "A_load_order": 2, "meta_evict_policy": "", "atomic_mode": "relaxed", "num_warps": 4, "num_ctas": 1, "num_stages": 1}, "(48, 4096, 1024, 64, 8)": {"BLOCK_SIZE_M": 32, "BLOCK_SIZE_N": 64, "BLOCK_SIZE_K": 64, "GROUP_SIZE_M": 8, "SPLIT_K": 4, "A_load_order": 2, "meta_evict_policy": "", "atomic_mode": "relaxed", "num_warps": 4, "num_ctas": 1, "num_stages": 1}, "(48, 7168, 4096, 64, 8)": {"BLOCK_SIZE_M": 32, "BLOCK_SIZE_N": 64, "BLOCK_SIZE_K": 64, "GROUP_SIZE_M": 8, "SPLIT_K": 4, "A_load_order": 2, "meta_evict_policy": "", "atomic_mode": "relaxed", "num_warps": 4, "num_ctas": 1, "num_stages": 1}, "(48, 4096, 3584, 64, 8)": {"BLOCK_SIZE_M": 32, "BLOCK_SIZE_N": 64, "BLOCK_SIZE_K": 64, "GROUP_SIZE_M": 8, "SPLIT_K": 4, "A_load_order": 2, "meta_evict_policy": "", "atomic_mode": "relaxed", "num_warps": 4, "num_ctas": 1, "num_stages": 1}, "(56, 1536, 4096, 64, 8)": {"BLOCK_SIZE_M": 32, "BLOCK_SIZE_N": 64, "BLOCK_SIZE_K": 64, "GROUP_SIZE_M": 8, "SPLIT_K": 8, "A_load_order": 2, "meta_evict_policy": "", "atomic_mode": "relaxed", "num_warps": 4, "num_ctas": 1, "num_stages": 1}, "(56, 4096, 1024, 64, 8)": {"BLOCK_SIZE_M": 32, "BLOCK_SIZE_N": 64, "BLOCK_SIZE_K": 64, "GROUP_SIZE_M": 8, "SPLIT_K": 4, "A_load_order": 2, "meta_evict_policy": "", "atomic_mode": "relaxed", "num_warps": 4, "num_ctas": 1, "num_stages": 1}, "(56, 7168, 4096, 64, 8)": {"BLOCK_SIZE_M": 32, "BLOCK_SIZE_N": 64, "BLOCK_SIZE_K": 64, "GROUP_SIZE_M": 8, "SPLIT_K": 4, "A_load_order": 2, "meta_evict_policy": "", "atomic_mode": "relaxed", "num_warps": 4, "num_ctas": 1, "num_stages": 1}, "(56, 4096, 3584, 64, 8)": {"BLOCK_SIZE_M": 32, "BLOCK_SIZE_N": 64, "BLOCK_SIZE_K": 64, "GROUP_SIZE_M": 8, "SPLIT_K": 4, "A_load_order": 2, "meta_evict_policy": "", "atomic_mode": "relaxed", "num_warps": 4, "num_ctas": 1, "num_stages": 1}, "(64, 1536, 4096, 64, 8)": {"BLOCK_SIZE_M": 32, "BLOCK_SIZE_N": 64, "BLOCK_SIZE_K": 64, "GROUP_SIZE_M": 8, "SPLIT_K": 8, "A_load_order": 2, "meta_evict_policy": "", "atomic_mode": "relaxed", "num_warps": 4, "num_ctas": 1, "num_stages": 1}, "(64, 4096, 1024, 64, 8)": {"BLOCK_SIZE_M": 32, "BLOCK_SIZE_N": 64, "BLOCK_SIZE_K": 64, "GROUP_SIZE_M": 8, "SPLIT_K": 4, "A_load_order": 2, "meta_evict_policy": "", "atomic_mode": "relaxed", "num_warps": 4, "num_ctas": 1, "num_stages": 1}, "(64, 7168, 4096, 64, 8)": {"BLOCK_SIZE_M": 32, "BLOCK_SIZE_N": 64, "BLOCK_SIZE_K": 64, "GROUP_SIZE_M": 8, "SPLIT_K": 4, "A_load_order": 2, "meta_evict_policy": "", "atomic_mode": "relaxed", "num_warps": 4, "num_ctas": 1, "num_stages": 1}, "(64, 4096, 3584, 64, 8)": {"BLOCK_SIZE_M": 32, "BLOCK_SIZE_N": 64, "BLOCK_SIZE_K": 64, "GROUP_SIZE_M": 8, "SPLIT_K": 4, "A_load_order": 2, "meta_evict_policy": "", "atomic_mode": "relaxed", "num_warps": 4, "num_ctas": 1, "num_stages": 1}, "(64, 6144, 4096, 4096, 1)": {"BLOCK_SIZE_M": 32, "BLOCK_SIZE_N": 32, "BLOCK_SIZE_K": 256, "GROUP_SIZE_M": 8, "SPLIT_K": 1, "A_load_order": 2, "meta_evict_policy": "", "atomic_mode": "relaxed", "num_warps": 4, "num_ctas": 1, "num_stages": 4}, "(64, 4096, 4096, 4096, 1)": {"BLOCK_SIZE_M": 32, "BLOCK_SIZE_N": 64, "BLOCK_SIZE_K": 256, "GROUP_SIZE_M": 8, "SPLIT_K": 1, "A_load_order": 2, "meta_evict_policy": "", "atomic_mode": "relaxed", "num_warps": 4, "num_ctas": 1, "num_stages": 5}, "(64, 28672, 4096, 4096, 1)": {"BLOCK_SIZE_M": 32, "BLOCK_SIZE_N": 128, "BLOCK_SIZE_K": 128, "GROUP_SIZE_M": 8, "SPLIT_K": 1, "A_load_order": 0, "meta_evict_policy": "", "atomic_mode": "relaxed", "num_warps": 4, "num_ctas": 1, "num_stages": 5}, "(64, 4096, 14336, 14336, 1)": {"BLOCK_SIZE_M": 32, "BLOCK_SIZE_N": 128, "BLOCK_SIZE_K": 256, "GROUP_SIZE_M": 8, "SPLIT_K": 2, "A_load_order": 2, "meta_evict_policy": "", "atomic_mode": "relaxed", "num_warps": 4, "num_ctas": 1, "num_stages": 5}, "(32, 6144, 4096, 4096, 1)": {"BLOCK_SIZE_M": 32, "BLOCK_SIZE_N": 64, "BLOCK_SIZE_K": 256, "GROUP_SIZE_M": 8, "SPLIT_K": 1, "A_load_order": 2, "meta_evict_policy": "", "atomic_mode": "relaxed", "num_warps": 4, "num_ctas": 1, "num_stages": 5}, "(32, 4096, 4096, 4096, 1)": {"BLOCK_SIZE_M": 32, "BLOCK_SIZE_N": 32, "BLOCK_SIZE_K": 256, "GROUP_SIZE_M": 8, "SPLIT_K": 1, "A_load_order": 2, "meta_evict_policy": "", "atomic_mode": "relaxed", "num_warps": 4, "num_ctas": 1, "num_stages": 5}, "(32, 28672, 4096, 4096, 1)": {"BLOCK_SIZE_M": 32, "BLOCK_SIZE_N": 32, "BLOCK_SIZE_K": 256, "GROUP_SIZE_M": 8, "SPLIT_K": 1, "A_load_order": 2, "meta_evict_policy": "", "atomic_mode": "relaxed", "num_warps": 4, "num_ctas": 1, "num_stages": 2}, "(32, 4096, 14336, 14336, 1)": {"BLOCK_SIZE_M": 32, "BLOCK_SIZE_N": 32, "BLOCK_SIZE_K": 256, "GROUP_SIZE_M": 8, "SPLIT_K": 2, "A_load_order": 2, "meta_evict_policy": "", "atomic_mode": "relaxed", "num_warps": 4, "num_ctas": 1, "num_stages": 4}, "(16, 6144, 4096, 4096, 1)": {"BLOCK_SIZE_M": 16, "BLOCK_SIZE_N": 64, "BLOCK_SIZE_K": 128, "GROUP_SIZE_M": 8, "SPLIT_K": 4, "A_load_order": 0, "meta_evict_policy": "", "atomic_mode": "relaxed", "num_warps": 4, "num_ctas": 1, "num_stages": 4}, "(16, 4096, 4096, 4096, 1)": {"BLOCK_SIZE_M": 16, "BLOCK_SIZE_N": 64, "BLOCK_SIZE_K": 128, "GROUP_SIZE_M": 8, "SPLIT_K": 4, "A_load_order": 0, "meta_evict_policy": "", "atomic_mode": "relaxed", "num_warps": 4, "num_ctas": 1, "num_stages": 4}, "(16, 28672, 4096, 4096, 1)": {"BLOCK_SIZE_M": 16, "BLOCK_SIZE_N": 64, "BLOCK_SIZE_K": 256, "GROUP_SIZE_M": 8, "SPLIT_K": 8, "A_load_order": 0, "meta_evict_policy": "", "atomic_mode": "relaxed", "num_warps": 4, "num_ctas": 1, "num_stages": 4}, "(16, 4096, 14336, 14336, 1)": {"BLOCK_SIZE_M": 16, "BLOCK_SIZE_N": 64, "BLOCK_SIZE_K": 256, "GROUP_SIZE_M": 8, "SPLIT_K": 4, "A_load_order": 2, "meta_evict_policy": "", "atomic_mode": "relaxed", "num_warps": 4, "num_ctas": 1, "num_stages": 4}, "(8, 6144, 4096, 4096, 1)": {"BLOCK_SIZE_M": 16, "BLOCK_SIZE_N": 64, "BLOCK_SIZE_K": 128, "GROUP_SIZE_M": 8, "SPLIT_K": 4, "A_load_order": 0, "meta_evict_policy": "", "atomic_mode": "relaxed", "num_warps": 4, "num_ctas": 1, "num_stages": 4}, "(8, 4096, 4096, 4096, 1)": {"BLOCK_SIZE_M": 16, "BLOCK_SIZE_N": 64, "BLOCK_SIZE_K": 128, "GROUP_SIZE_M": 8, "SPLIT_K": 4, "A_load_order": 2, "meta_evict_policy": "", "atomic_mode": "relaxed", "num_warps": 4, "num_ctas": 1, "num_stages": 4}, "(8, 28672, 4096, 4096, 1)": {"BLOCK_SIZE_M": 16, "BLOCK_SIZE_N": 64, "BLOCK_SIZE_K": 256, "GROUP_SIZE_M": 8, "SPLIT_K": 8, "A_load_order": 0, "meta_evict_policy": "", "atomic_mode": "relaxed", "num_warps": 4, "num_ctas": 1, "num_stages": 2}, "(8, 4096, 14336, 14336, 1)": {"BLOCK_SIZE_M": 16, "BLOCK_SIZE_N": 64, "BLOCK_SIZE_K": 256, "GROUP_SIZE_M": 8, "SPLIT_K": 4, "A_load_order": 0, "meta_evict_policy": "", "atomic_mode": "relaxed", "num_warps": 4, "num_ctas": 1, "num_stages": 4}, "(4, 6144, 4096, 4096, 1)": {"BLOCK_SIZE_M": 16, "BLOCK_SIZE_N": 64, "BLOCK_SIZE_K": 128, "GROUP_SIZE_M": 8, "SPLIT_K": 8, "A_load_order": 0, "meta_evict_policy": "", "atomic_mode": "relaxed", "num_warps": 4, "num_ctas": 1, "num_stages": 2}, "(4, 4096, 4096, 4096, 1)": {"BLOCK_SIZE_M": 16, "BLOCK_SIZE_N": 64, "BLOCK_SIZE_K": 128, "GROUP_SIZE_M": 8, "SPLIT_K": 4, "A_load_order": 0, "meta_evict_policy": "", "atomic_mode": "relaxed", "num_warps": 4, "num_ctas": 1, "num_stages": 4}, "(4, 28672, 4096, 4096, 1)": {"BLOCK_SIZE_M": 16, "BLOCK_SIZE_N": 64, "BLOCK_SIZE_K": 256, "GROUP_SIZE_M": 8, "SPLIT_K": 8, "A_load_order": 0, "meta_evict_policy": "", "atomic_mode": "relaxed", "num_warps": 4, "num_ctas": 1, "num_stages": 2}, "(4, 4096, 14336, 14336, 1)": {"BLOCK_SIZE_M": 16, "BLOCK_SIZE_N": 64, "BLOCK_SIZE_K": 256, "GROUP_SIZE_M": 8, "SPLIT_K": 8, "A_load_order": 2, "meta_evict_policy": "", "atomic_mode": "relaxed", "num_warps": 4, "num_ctas": 1, "num_stages": 2}, "(2, 6144, 4096, 4096, 1)": {"BLOCK_SIZE_M": 16, "BLOCK_SIZE_N": 64, "BLOCK_SIZE_K": 128, "GROUP_SIZE_M": 8, "SPLIT_K": 8, "A_load_order": 0, "meta_evict_policy": "", "atomic_mode": "relaxed", "num_warps": 4, "num_ctas": 1, "num_stages": 2}, "(2, 4096, 4096, 4096, 1)": {"BLOCK_SIZE_M": 16, "BLOCK_SIZE_N": 64, "BLOCK_SIZE_K": 128, "GROUP_SIZE_M": 8, "SPLIT_K": 4, "A_load_order": 0, "meta_evict_policy": "", "atomic_mode": "relaxed", "num_warps": 4, "num_ctas": 1, "num_stages": 4}, "(2, 28672, 4096, 4096, 1)": {"BLOCK_SIZE_M": 16, "BLOCK_SIZE_N": 64, "BLOCK_SIZE_K": 256, "GROUP_SIZE_M": 8, "SPLIT_K": 8, "A_load_order": 2, "meta_evict_policy": "", "atomic_mode": "relaxed", "num_warps": 4, "num_ctas": 1, "num_stages": 2}, "(2, 4096, 14336, 14336, 1)": {"BLOCK_SIZE_M": 16, "BLOCK_SIZE_N": 64, "BLOCK_SIZE_K": 256, "GROUP_SIZE_M": 8, "SPLIT_K": 8, "A_load_order": 2, "meta_evict_policy": "", "atomic_mode": "relaxed", "num_warps": 4, "num_ctas": 1, "num_stages": 2}, "(64, 4608, 3584, 3584, 1)": {"BLOCK_SIZE_M": 32, "BLOCK_SIZE_N": 128, "BLOCK_SIZE_K": 256, "GROUP_SIZE_M": 8, "SPLIT_K": 1, "A_load_order": 0, "meta_evict_policy": "", "atomic_mode": "relaxed", "num_warps": 4, "num_ctas": 1, "num_stages": 5}, "(64, 3584, 3584, 3584, 1)": {"BLOCK_SIZE_M": 32, "BLOCK_SIZE_N": 64, "BLOCK_SIZE_K": 256, "GROUP_SIZE_M": 8, "SPLIT_K": 1, "A_load_order": 2, "meta_evict_policy": "", "atomic_mode": "relaxed", "num_warps": 4, "num_ctas": 1, "num_stages": 5}, "(64, 37888, 3584, 3584, 1)": {"BLOCK_SIZE_M": 32, "BLOCK_SIZE_N": 64, "BLOCK_SIZE_K": 128, "GROUP_SIZE_M": 8, "SPLIT_K": 1, "A_load_order": 2, "meta_evict_policy": "", "atomic_mode": "relaxed", "num_warps": 4, "num_ctas": 1, "num_stages": 4}, "(64, 3584, 18944, 18944, 1)": {"BLOCK_SIZE_M": 32, "BLOCK_SIZE_N": 128, "BLOCK_SIZE_K": 256, "GROUP_SIZE_M": 8, "SPLIT_K": 2, "A_load_order": 2, "meta_evict_policy": "", "atomic_mode": "relaxed", "num_warps": 4, "num_ctas": 1, "num_stages": 5}, "(32, 4608, 3584, 3584, 1)": {"BLOCK_SIZE_M": 32, "BLOCK_SIZE_N": 64, "BLOCK_SIZE_K": 256, "GROUP_SIZE_M": 8, "SPLIT_K": 1, "A_load_order": 2, "meta_evict_policy": "", "atomic_mode": "relaxed", "num_warps": 4, "num_ctas": 1, "num_stages": 5}, "(32, 3584, 3584, 3584, 1)": {"BLOCK_SIZE_M": 32, "BLOCK_SIZE_N": 32, "BLOCK_SIZE_K": 256, "GROUP_SIZE_M": 8, "SPLIT_K": 1, "A_load_order": 0, "meta_evict_policy": "", "atomic_mode": "relaxed", "num_warps": 4, "num_ctas": 1, "num_stages": 5}, "(32, 37888, 3584, 3584, 1)": {"BLOCK_SIZE_M": 32, "BLOCK_SIZE_N": 128, "BLOCK_SIZE_K": 256, "GROUP_SIZE_M": 8, "SPLIT_K": 1, "A_load_order": 2, "meta_evict_policy": "", "atomic_mode": "relaxed", "num_warps": 4, "num_ctas": 1, "num_stages": 2}, "(32, 3584, 18944, 18944, 1)": {"BLOCK_SIZE_M": 32, "BLOCK_SIZE_N": 64, "BLOCK_SIZE_K": 256, "GROUP_SIZE_M": 8, "SPLIT_K": 2, "A_load_order": 2, "meta_evict_policy": "", "atomic_mode": "relaxed", "num_warps": 4, "num_ctas": 1, "num_stages": 5}, "(16, 4608, 3584, 3584, 1)": {"BLOCK_SIZE_M": 16, "BLOCK_SIZE_N": 64, "BLOCK_SIZE_K": 128, "GROUP_SIZE_M": 8, "SPLIT_K": 4, "A_load_order": 0, "meta_evict_policy": "", "atomic_mode": "relaxed", "num_warps": 4, "num_ctas": 1, "num_stages": 4}, "(16, 3584, 3584, 3584, 1)": {"BLOCK_SIZE_M": 16, "BLOCK_SIZE_N": 64, "BLOCK_SIZE_K": 128, "GROUP_SIZE_M": 8, "SPLIT_K": 4, "A_load_order": 2, "meta_evict_policy": "", "atomic_mode": "relaxed", "num_warps": 4, "num_ctas": 1, "num_stages": 5}, "(16, 37888, 3584, 3584, 1)": {"BLOCK_SIZE_M": 16, "BLOCK_SIZE_N": 64, "BLOCK_SIZE_K": 256, "GROUP_SIZE_M": 8, "SPLIT_K": 2, "A_load_order": 2, "meta_evict_policy": "", "atomic_mode": "relaxed", "num_warps": 4, "num_ctas": 1, "num_stages": 2}, "(16, 3584, 18944, 18944, 1)": {"BLOCK_SIZE_M": 16, "BLOCK_SIZE_N": 64, "BLOCK_SIZE_K": 128, "GROUP_SIZE_M": 8, "SPLIT_K": 4, "A_load_order": 2, "meta_evict_policy": "", "atomic_mode": "relaxed", "num_warps": 4, "num_ctas": 1, "num_stages": 5}, "(8, 4608, 3584, 3584, 1)": {"BLOCK_SIZE_M": 16, "BLOCK_SIZE_N": 64, "BLOCK_SIZE_K": 128, "GROUP_SIZE_M": 8, "SPLIT_K": 4, "A_load_order": 0, "meta_evict_policy": "", "atomic_mode": "relaxed", "num_warps": 4, "num_ctas": 1, "num_stages": 4}, "(8, 3584, 3584, 3584, 1)": {"BLOCK_SIZE_M": 16, "BLOCK_SIZE_N": 64, "BLOCK_SIZE_K": 128, "GROUP_SIZE_M": 8, "SPLIT_K": 4, "A_load_order": 2, "meta_evict_policy": "", "atomic_mode": "relaxed", "num_warps": 4, "num_ctas": 1, "num_stages": 4}, "(8, 37888, 3584, 3584, 1)": {"BLOCK_SIZE_M": 16, "BLOCK_SIZE_N": 64, "BLOCK_SIZE_K": 256, "GROUP_SIZE_M": 8, "SPLIT_K": 2, "A_load_order": 0, "meta_evict_policy": "", "atomic_mode": "relaxed", "num_warps": 4, "num_ctas": 1, "num_stages": 2}, "(8, 3584, 18944, 18944, 1)": {"BLOCK_SIZE_M": 16, "BLOCK_SIZE_N": 64, "BLOCK_SIZE_K": 128, "GROUP_SIZE_M": 8, "SPLIT_K": 4, "A_load_order": 0, "meta_evict_policy": "", "atomic_mode": "relaxed", "num_warps": 4, "num_ctas": 1, "num_stages": 5}, "(4, 4608, 3584, 3584, 1)": {"BLOCK_SIZE_M": 16, "BLOCK_SIZE_N": 64, "BLOCK_SIZE_K": 128, "GROUP_SIZE_M": 8, "SPLIT_K": 4, "A_load_order": 0, "meta_evict_policy": "", "atomic_mode": "relaxed", "num_warps": 4, "num_ctas": 1, "num_stages": 4}, "(4, 3584, 3584, 3584, 1)": {"BLOCK_SIZE_M": 16, "BLOCK_SIZE_N": 64, "BLOCK_SIZE_K": 128, "GROUP_SIZE_M": 8, "SPLIT_K": 4, "A_load_order": 2, "meta_evict_policy": "", "atomic_mode": "relaxed", "num_warps": 4, "num_ctas": 1, "num_stages": 4}, "(4, 37888, 3584, 3584, 1)": {"BLOCK_SIZE_M": 16, "BLOCK_SIZE_N": 64, "BLOCK_SIZE_K": 256, "GROUP_SIZE_M": 8, "SPLIT_K": 2, "A_load_order": 2, "meta_evict_policy": "", "atomic_mode": "relaxed", "num_warps": 4, "num_ctas": 1, "num_stages": 2}, "(4, 3584, 18944, 18944, 1)": {"BLOCK_SIZE_M": 16, "BLOCK_SIZE_N": 64, "BLOCK_SIZE_K": 128, "GROUP_SIZE_M": 8, "SPLIT_K": 4, "A_load_order": 0, "meta_evict_policy": "", "atomic_mode": "relaxed", "num_warps": 4, "num_ctas": 1, "num_stages": 5}, "(2, 4608, 3584, 3584, 1)": {"BLOCK_SIZE_M": 16, "BLOCK_SIZE_N": 64, "BLOCK_SIZE_K": 128, "GROUP_SIZE_M": 8, "SPLIT_K": 4, "A_load_order": 0, "meta_evict_policy": "", "atomic_mode": "relaxed", "num_warps": 4, "num_ctas": 1, "num_stages": 4}, "(2, 3584, 3584, 3584, 1)": {"BLOCK_SIZE_M": 16, "BLOCK_SIZE_N": 64, "BLOCK_SIZE_K": 128, "GROUP_SIZE_M": 8, "SPLIT_K": 4, "A_load_order": 2, "meta_evict_policy": "", "atomic_mode": "relaxed", "num_warps": 4, "num_ctas": 1, "num_stages": 4}, "(2, 37888, 3584, 3584, 1)": {"BLOCK_SIZE_M": 16, "BLOCK_SIZE_N": 64, "BLOCK_SIZE_K": 256, "GROUP_SIZE_M": 8, "SPLIT_K": 2, "A_load_order": 2, "meta_evict_policy": "", "atomic_mode": "relaxed", "num_warps": 4, "num_ctas": 1, "num_stages": 2}, "(2, 3584, 18944, 18944, 1)": {"BLOCK_SIZE_M": 16, "BLOCK_SIZE_N": 64, "BLOCK_SIZE_K": 128, "GROUP_SIZE_M": 8, "SPLIT_K": 4, "A_load_order": 2, "meta_evict_policy": "", "atomic_mode": "relaxed", "num_warps": 4, "num_ctas": 1, "num_stages": 5}, "(64, 5120, 3072, 3072, 1)": {"BLOCK_SIZE_M": 32, "BLOCK_SIZE_N": 128, "BLOCK_SIZE_K": 256, "GROUP_SIZE_M": 8, "SPLIT_K": 1, "A_load_order": 0, "meta_evict_policy": "", "atomic_mode": "relaxed", "num_warps": 4, "num_ctas": 1, "num_stages": 5}, "(64, 3072, 3072, 3072, 1)": {"BLOCK_SIZE_M": 32, "BLOCK_SIZE_N": 64, "BLOCK_SIZE_K": 256, "GROUP_SIZE_M": 8, "SPLIT_K": 1, "A_load_order": 2, "meta_evict_policy": "", "atomic_mode": "relaxed", "num_warps": 4, "num_ctas": 1, "num_stages": 5}, "(64, 16384, 3072, 3072, 1)": {"BLOCK_SIZE_M": 32, "BLOCK_SIZE_N": 128, "BLOCK_SIZE_K": 128, "GROUP_SIZE_M": 8, "SPLIT_K": 1, "A_load_order": 2, "meta_evict_policy": "", "atomic_mode": "relaxed", "num_warps": 4, "num_ctas": 1, "num_stages": 5}, "(64, 3072, 8192, 8192, 1)": {"BLOCK_SIZE_M": 32, "BLOCK_SIZE_N": 32, "BLOCK_SIZE_K": 256, "GROUP_SIZE_M": 8, "SPLIT_K": 2, "A_load_order": 2, "meta_evict_policy": "", "atomic_mode": "relaxed", "num_warps": 4, "num_ctas": 1, "num_stages": 4}, "(32, 5120, 3072, 3072, 1)": {"BLOCK_SIZE_M": 32, "BLOCK_SIZE_N": 64, "BLOCK_SIZE_K": 256, "GROUP_SIZE_M": 8, "SPLIT_K": 1, "A_load_order": 2, "meta_evict_policy": "", "atomic_mode": "relaxed", "num_warps": 4, "num_ctas": 1, "num_stages": 5}, "(32, 3072, 3072, 3072, 1)": {"BLOCK_SIZE_M": 32, "BLOCK_SIZE_N": 32, "BLOCK_SIZE_K": 256, "GROUP_SIZE_M": 8, "SPLIT_K": 1, "A_load_order": 0, "meta_evict_policy": "", "atomic_mode": "relaxed", "num_warps": 4, "num_ctas": 1, "num_stages": 5}, "(32, 16384, 3072, 3072, 1)": {"BLOCK_SIZE_M": 32, "BLOCK_SIZE_N": 128, "BLOCK_SIZE_K": 256, "GROUP_SIZE_M": 8, "SPLIT_K": 1, "A_load_order": 0, "meta_evict_policy": "", "atomic_mode": "relaxed", "num_warps": 4, "num_ctas": 1, "num_stages": 4}, "(32, 3072, 8192, 8192, 1)": {"BLOCK_SIZE_M": 32, "BLOCK_SIZE_N": 32, "BLOCK_SIZE_K": 256, "GROUP_SIZE_M": 8, "SPLIT_K": 1, "A_load_order": 2, "meta_evict_policy": "", "atomic_mode": "relaxed", "num_warps": 4, "num_ctas": 1, "num_stages": 5}, "(16, 5120, 3072, 3072, 1)": {"BLOCK_SIZE_M": 16, "BLOCK_SIZE_N": 32, "BLOCK_SIZE_K": 256, "GROUP_SIZE_M": 8, "SPLIT_K": 4, "A_load_order": 0, "meta_evict_policy": "", "atomic_mode": "relaxed", "num_warps": 4, "num_ctas": 1, "num_stages": 2}, "(16, 3072, 3072, 3072, 1)": {"BLOCK_SIZE_M": 16, "BLOCK_SIZE_N": 32, "BLOCK_SIZE_K": 128, "GROUP_SIZE_M": 8, "SPLIT_K": 4, "A_load_order": 0, "meta_evict_policy": "", "atomic_mode": "relaxed", "num_warps": 4, "num_ctas": 1, "num_stages": 4}, "(16, 16384, 3072, 3072, 1)": {"BLOCK_SIZE_M": 16, "BLOCK_SIZE_N": 64, "BLOCK_SIZE_K": 256, "GROUP_SIZE_M": 8, "SPLIT_K": 2, "A_load_order": 0, "meta_evict_policy": "", "atomic_mode": "relaxed", "num_warps": 4, "num_ctas": 1, "num_stages": 2}, "(16, 3072, 8192, 8192, 1)": {"BLOCK_SIZE_M": 16, "BLOCK_SIZE_N": 64, "BLOCK_SIZE_K": 256, "GROUP_SIZE_M": 8, "SPLIT_K": 8, "A_load_order": 0, "meta_evict_policy": "", "atomic_mode": "relaxed", "num_warps": 4, "num_ctas": 1, "num_stages": 4}, "(8, 5120, 3072, 3072, 1)": {"BLOCK_SIZE_M": 16, "BLOCK_SIZE_N": 64, "BLOCK_SIZE_K": 128, "GROUP_SIZE_M": 8, "SPLIT_K": 8, "A_load_order": 0, "meta_evict_policy": "", "atomic_mode": "relaxed", "num_warps": 4, "num_ctas": 1, "num_stages": 2}, "(8, 3072, 3072, 3072, 1)": {"BLOCK_SIZE_M": 16, "BLOCK_SIZE_N": 64, "BLOCK_SIZE_K": 128, "GROUP_SIZE_M": 8, "SPLIT_K": 8, "A_load_order": 0, "meta_evict_policy": "", "atomic_mode": "relaxed", "num_warps": 4, "num_ctas": 1, "num_stages": 5}, "(8, 16384, 3072, 3072, 1)": {"BLOCK_SIZE_M": 16, "BLOCK_SIZE_N": 64, "BLOCK_SIZE_K": 256, "GROUP_SIZE_M": 8, "SPLIT_K": 2, "A_load_order": 2, "meta_evict_policy": "", "atomic_mode": "relaxed", "num_warps": 4, "num_ctas": 1, "num_stages": 2}, "(8, 3072, 8192, 8192, 1)": {"BLOCK_SIZE_M": 16, "BLOCK_SIZE_N": 64, "BLOCK_SIZE_K": 128, "GROUP_SIZE_M": 8, "SPLIT_K": 16, "A_load_order": 0, "meta_evict_policy": "", "atomic_mode": "relaxed", "num_warps": 4, "num_ctas": 1, "num_stages": 2}, "(4, 5120, 3072, 3072, 1)": {"BLOCK_SIZE_M": 16, "BLOCK_SIZE_N": 64, "BLOCK_SIZE_K": 128, "GROUP_SIZE_M": 8, "SPLIT_K": 8, "A_load_order": 2, "meta_evict_policy": "", "atomic_mode": "relaxed", "num_warps": 4, "num_ctas": 1, "num_stages": 2}, "(4, 3072, 3072, 3072, 1)": {"BLOCK_SIZE_M": 16, "BLOCK_SIZE_N": 64, "BLOCK_SIZE_K": 128, "GROUP_SIZE_M": 8, "SPLIT_K": 8, "A_load_order": 0, "meta_evict_policy": "", "atomic_mode": "relaxed", "num_warps": 4, "num_ctas": 1, "num_stages": 5}, "(4, 16384, 3072, 3072, 1)": {"BLOCK_SIZE_M": 16, "BLOCK_SIZE_N": 64, "BLOCK_SIZE_K": 256, "GROUP_SIZE_M": 8, "SPLIT_K": 2, "A_load_order": 0, "meta_evict_policy": "", "atomic_mode": "relaxed", "num_warps": 4, "num_ctas": 1, "num_stages": 2}, "(4, 3072, 8192, 8192, 1)": {"BLOCK_SIZE_M": 16, "BLOCK_SIZE_N": 64, "BLOCK_SIZE_K": 128, "GROUP_SIZE_M": 8, "SPLIT_K": 16, "A_load_order": 0, "meta_evict_policy": "", "atomic_mode": "relaxed", "num_warps": 4, "num_ctas": 1, "num_stages": 4}, "(2, 5120, 3072, 3072, 1)": {"BLOCK_SIZE_M": 16, "BLOCK_SIZE_N": 64, "BLOCK_SIZE_K": 128, "GROUP_SIZE_M": 8, "SPLIT_K": 8, "A_load_order": 0, "meta_evict_policy": "", "atomic_mode": "relaxed", "num_warps": 4, "num_ctas": 1, "num_stages": 2}, "(2, 3072, 3072, 3072, 1)": {"BLOCK_SIZE_M": 16, "BLOCK_SIZE_N": 64, "BLOCK_SIZE_K": 128, "GROUP_SIZE_M": 8, "SPLIT_K": 8, "A_load_order": 0, "meta_evict_policy": "", "atomic_mode": "relaxed", "num_warps": 4, "num_ctas": 1, "num_stages": 5}, "(2, 16384, 3072, 3072, 1)": {"BLOCK_SIZE_M": 16, "BLOCK_SIZE_N": 64, "BLOCK_SIZE_K": 256, "GROUP_SIZE_M": 8, "SPLIT_K": 2, "A_load_order": 2, "meta_evict_policy": "", "atomic_mode": "relaxed", "num_warps": 4, "num_ctas": 1, "num_stages": 2}, "(2, 3072, 8192, 8192, 1)": {"BLOCK_SIZE_M": 16, "BLOCK_SIZE_N": 64, "BLOCK_SIZE_K": 128, "GROUP_SIZE_M": 8, "SPLIT_K": 16, "A_load_order": 0, "meta_evict_policy": "", "atomic_mode": "relaxed", "num_warps": 4, "num_ctas": 1, "num_stages": 4}, "(4, 1024, 4096, 64, 8)": {"BLOCK_SIZE_M": 16, "BLOCK_SIZE_N": 64, "BLOCK_SIZE_K": 64, "GROUP_SIZE_M": 8, "SPLIT_K": 16, "A_load_order": 0, "meta_evict_policy": "", "atomic_mode": "relaxed", "num_warps": 4, "num_ctas": 1, "num_stages": 4}, "(8, 1024, 4096, 64, 8)": {"BLOCK_SIZE_M": 16, "BLOCK_SIZE_N": 64, "BLOCK_SIZE_K": 64, "GROUP_SIZE_M": 8, "SPLIT_K": 16, "A_load_order": 0, "meta_evict_policy": "", "atomic_mode": "relaxed", "num_warps": 4, "num_ctas": 1, "num_stages": 4}, "(16, 1024, 4096, 64, 8)": {"BLOCK_SIZE_M": 16, "BLOCK_SIZE_N": 64, "BLOCK_SIZE_K": 64, "GROUP_SIZE_M": 8, "SPLIT_K": 16, "A_load_order": 0, "meta_evict_policy": "", "atomic_mode": "relaxed", "num_warps": 4, "num_ctas": 1, "num_stages": 4}, "(32, 1024, 4096, 64, 8)": {"BLOCK_SIZE_M": 32, "BLOCK_SIZE_N": 32, "BLOCK_SIZE_K": 64, "GROUP_SIZE_M": 8, "SPLIT_K": 8, "A_load_order": 2, "meta_evict_policy": "", "atomic_mode": "relaxed", "num_warps": 4, "num_ctas": 1, "num_stages": 1}, "(64, 1024, 4096, 64, 8)": {"BLOCK_SIZE_M": 32, "BLOCK_SIZE_N": 32, "BLOCK_SIZE_K": 64, "GROUP_SIZE_M": 8, "SPLIT_K": 8, "A_load_order": 2, "meta_evict_policy": "", "atomic_mode": "relaxed", "num_warps": 4, "num_ctas": 1, "num_stages": 1}, "(4, 3072, 3072, 64, 8)": {"BLOCK_SIZE_M": 16, "BLOCK_SIZE_N": 128, "BLOCK_SIZE_K": 64, "GROUP_SIZE_M": 8, "SPLIT_K": 16, "A_load_order": 0, "meta_evict_policy": "", "atomic_mode": "relaxed", "num_warps": 8, "num_ctas": 1, "num_stages": 1}, "(4, 1024, 3072, 64, 8)": {"BLOCK_SIZE_M": 16, "BLOCK_SIZE_N": 32, "BLOCK_SIZE_K": 64, "GROUP_SIZE_M": 8, "SPLIT_K": 16, "A_load_order": 2, "meta_evict_policy": "", "atomic_mode": "relaxed", "num_warps": 4, "num_ctas": 1, "num_stages": 1}, "(4, 8192, 3072, 64, 8)": {"BLOCK_SIZE_M": 16, "BLOCK_SIZE_N": 64, "BLOCK_SIZE_K": 64, "GROUP_SIZE_M": 8, "SPLIT_K": 8, "A_load_order": 0, "meta_evict_policy": "", "atomic_mode": "relaxed", "num_warps": 4, "num_ctas": 1, "num_stages": 1}, "(4, 3072, 8192, 64, 8)": {"BLOCK_SIZE_M": 16, "BLOCK_SIZE_N": 128, "BLOCK_SIZE_K": 64, "GROUP_SIZE_M": 8, "SPLIT_K": 16, "A_load_order": 0, "meta_evict_policy": "", "atomic_mode": "relaxed", "num_warps": 8, "num_ctas": 1, "num_stages": 1}, "(8, 3072, 3072, 64, 8)": {"BLOCK_SIZE_M": 16, "BLOCK_SIZE_N": 128, "BLOCK_SIZE_K": 64, "GROUP_SIZE_M": 8, "SPLIT_K": 16, "A_load_order": 0, "meta_evict_policy": "", "atomic_mode": "relaxed", "num_warps": 8, "num_ctas": 1, "num_stages": 1}, "(8, 1024, 3072, 64, 8)": {"BLOCK_SIZE_M": 16, "BLOCK_SIZE_N": 32, "BLOCK_SIZE_K": 64, "GROUP_SIZE_M": 8, "SPLIT_K": 16, "A_load_order": 2, "meta_evict_policy": "", "atomic_mode": "relaxed", "num_warps": 4, "num_ctas": 1, "num_stages": 1}, "(8, 8192, 3072, 64, 8)": {"BLOCK_SIZE_M": 16, "BLOCK_SIZE_N": 64, "BLOCK_SIZE_K": 64, "GROUP_SIZE_M": 8, "SPLIT_K": 8, "A_load_order": 0, "meta_evict_policy": "", "atomic_mode": "relaxed", "num_warps": 4, "num_ctas": 1, "num_stages": 1}, "(8, 3072, 8192, 64, 8)": {"BLOCK_SIZE_M": 16, "BLOCK_SIZE_N": 128, "BLOCK_SIZE_K": 64, "GROUP_SIZE_M": 8, "SPLIT_K": 16, "A_load_order": 0, "meta_evict_policy": "", "atomic_mode": "relaxed", "num_warps": 8, "num_ctas": 1, "num_stages": 1}, "(16, 3072, 3072, 64, 8)": {"BLOCK_SIZE_M": 16, "BLOCK_SIZE_N": 128, "BLOCK_SIZE_K": 64, "GROUP_SIZE_M": 8, "SPLIT_K": 16, "A_load_order": 0, "meta_evict_policy": "", "atomic_mode": "relaxed", "num_warps": 8, "num_ctas": 1, "num_stages": 1}, "(16, 1024, 3072, 64, 8)": {"BLOCK_SIZE_M": 16, "BLOCK_SIZE_N": 32, "BLOCK_SIZE_K": 64, "GROUP_SIZE_M": 8, "SPLIT_K": 16, "A_load_order": 2, "meta_evict_policy": "", "atomic_mode": "relaxed", "num_warps": 4, "num_ctas": 1, "num_stages": 1}, "(16, 8192, 3072, 64, 8)": {"BLOCK_SIZE_M": 16, "BLOCK_SIZE_N": 128, "BLOCK_SIZE_K": 32, "GROUP_SIZE_M": 8, "SPLIT_K": 8, "A_load_order": 0, "meta_evict_policy": "", "atomic_mode": "relaxed", "num_warps": 8, "num_ctas": 1, "num_stages": 1}, "(16, 3072, 8192, 64, 8)": {"BLOCK_SIZE_M": 16, "BLOCK_SIZE_N": 128, "BLOCK_SIZE_K": 64, "GROUP_SIZE_M": 8, "SPLIT_K": 16, "A_load_order": 0, "meta_evict_policy": "", "atomic_mode": "relaxed", "num_warps": 8, "num_ctas": 1, "num_stages": 1}, "(32, 3072, 3072, 64, 8)": {"BLOCK_SIZE_M": 32, "BLOCK_SIZE_N": 32, "BLOCK_SIZE_K": 64, "GROUP_SIZE_M": 8, "SPLIT_K": 8, "A_load_order": 2, "meta_evict_policy": "", "atomic_mode": "relaxed", "num_warps": 4, "num_ctas": 1, "num_stages": 1}, "(32, 1024, 3072, 64, 8)": {"BLOCK_SIZE_M": 32, "BLOCK_SIZE_N": 32, "BLOCK_SIZE_K": 64, "GROUP_SIZE_M": 8, "SPLIT_K": 8, "A_load_order": 2, "meta_evict_policy": "", "atomic_mode": "relaxed", "num_warps": 4, "num_ctas": 1, "num_stages": 1}, "(32, 8192, 3072, 64, 8)": {"BLOCK_SIZE_M": 32, "BLOCK_SIZE_N": 64, "BLOCK_SIZE_K": 64, "GROUP_SIZE_M": 8, "SPLIT_K": 4, "A_load_order": 2, "meta_evict_policy": "", "atomic_mode": "relaxed", "num_warps": 4, "num_ctas": 1, "num_stages": 1}, "(32, 3072, 8192, 64, 8)": {"BLOCK_SIZE_M": 32, "BLOCK_SIZE_N": 32, "BLOCK_SIZE_K": 64, "GROUP_SIZE_M": 8, "SPLIT_K": 8, "A_load_order": 2, "meta_evict_policy": "", "atomic_mode": "relaxed", "num_warps": 4, "num_ctas": 1, "num_stages": 1}, "(64, 3072, 3072, 64, 8)": {"BLOCK_SIZE_M": 32, "BLOCK_SIZE_N": 32, "BLOCK_SIZE_K": 64, "GROUP_SIZE_M": 8, "SPLIT_K": 4, "A_load_order": 2, "meta_evict_policy": "", "atomic_mode": "relaxed", "num_warps": 4, "num_ctas": 1, "num_stages": 1}, "(64, 1024, 3072, 64, 8)": {"BLOCK_SIZE_M": 32, "BLOCK_SIZE_N": 32, "BLOCK_SIZE_K": 64, "GROUP_SIZE_M": 8, "SPLIT_K": 8, "A_load_order": 2, "meta_evict_policy": "", "atomic_mode": "relaxed", "num_warps": 4, "num_ctas": 1, "num_stages": 1}, "(64, 8192, 3072, 64, 8)": {"BLOCK_SIZE_M": 32, "BLOCK_SIZE_N": 64, "BLOCK_SIZE_K": 64, "GROUP_SIZE_M": 8, "SPLIT_K": 2, "A_load_order": 2, "meta_evict_policy": "", "atomic_mode": "relaxed", "num_warps": 4, "num_ctas": 1, "num_stages": 1}, "(64, 3072, 8192, 64, 8)": {"BLOCK_SIZE_M": 32, "BLOCK_SIZE_N": 64, "BLOCK_SIZE_K": 64, "GROUP_SIZE_M": 8, "SPLIT_K": 4, "A_load_order": 0, "meta_evict_policy": "", "atomic_mode": "relaxed", "num_warps": 4, "num_ctas": 1, "num_stages": 4}, "(16, 4096, 4096, 128, 8)": {"BLOCK_SIZE_M": 16, "BLOCK_SIZE_N": 64, "BLOCK_SIZE_K": 128, "GROUP_SIZE_M": 8, "SPLIT_K": 8, "A_load_order": 0, "meta_evict_policy": "", "atomic_mode": "relaxed", "num_warps": 4, "num_ctas": 1, "num_stages": 1}, "(16, 1024, 4096, 128, 8)": {"BLOCK_SIZE_M": 16, "BLOCK_SIZE_N": 32, "BLOCK_SIZE_K": 128, "GROUP_SIZE_M": 8, "SPLIT_K": 16, "A_load_order": 2, "meta_evict_policy": "", "atomic_mode": "relaxed", "num_warps": 4, "num_ctas": 1, "num_stages": 1}, "(16, 14336, 4096, 128, 8)": {"BLOCK_SIZE_M": 16, "BLOCK_SIZE_N": 64, "BLOCK_SIZE_K": 128, "GROUP_SIZE_M": 8, "SPLIT_K": 8, "A_load_order": 0, "meta_evict_policy": "", "atomic_mode": "relaxed", "num_warps": 4, "num_ctas": 1, "num_stages": 1}, "(16, 4096, 14336, 128, 8)": {"BLOCK_SIZE_M": 16, "BLOCK_SIZE_N": 64, "BLOCK_SIZE_K": 128, "GROUP_SIZE_M": 8, "SPLIT_K": 8, "A_load_order": 0, "meta_evict_policy": "", "atomic_mode": "relaxed", "num_warps": 4, "num_ctas": 1, "num_stages": 1}, "(32, 4096, 4096, 128, 8)": {"BLOCK_SIZE_M": 32, "BLOCK_SIZE_N": 64, "BLOCK_SIZE_K": 64, "GROUP_SIZE_M": 8, "SPLIT_K": 8, "A_load_order": 0, "meta_evict_policy": "", "atomic_mode": "relaxed", "num_warps": 8, "num_ctas": 1, "num_stages": 1}, "(32, 1024, 4096, 128, 8)": {"BLOCK_SIZE_M": 32, "BLOCK_SIZE_N": 32, "BLOCK_SIZE_K": 128, "GROUP_SIZE_M": 8, "SPLIT_K": 8, "A_load_order": 2, "meta_evict_policy": "", "atomic_mode": "relaxed", "num_warps": 4, "num_ctas": 1, "num_stages": 1}, "(32, 14336, 4096, 128, 8)": {"BLOCK_SIZE_M": 32, "BLOCK_SIZE_N": 32, "BLOCK_SIZE_K": 64, "GROUP_SIZE_M": 8, "SPLIT_K": 2, "A_load_order": 2, "meta_evict_policy": "", "atomic_mode": "relaxed", "num_warps": 4, "num_ctas": 1, "num_stages": 1}, "(32, 4096, 14336, 128, 8)": {"BLOCK_SIZE_M": 32, "BLOCK_SIZE_N": 64, "BLOCK_SIZE_K": 64, "GROUP_SIZE_M": 8, "SPLIT_K": 8, "A_load_order": 2, "meta_evict_policy": "", "atomic_mode": "relaxed", "num_warps": 4, "num_ctas": 1, "num_stages": 1}, "(4, 512, 3584, 64, 8)": {"BLOCK_SIZE_M": 16, "BLOCK_SIZE_N": 32, "BLOCK_SIZE_K": 32, "GROUP_SIZE_M": 8, "SPLIT_K": 16, "A_load_order": 0, "meta_evict_policy": "", "atomic_mode": "relaxed", "num_warps": 4, "num_ctas": 1, "num_stages": 1}, "(4, 18944, 3584, 64, 8)": {"BLOCK_SIZE_M": 16, "BLOCK_SIZE_N": 64, "BLOCK_SIZE_K": 32, "GROUP_SIZE_M": 8, "SPLIT_K": 4, "A_load_order": 2, "meta_evict_policy": "", "atomic_mode": "relaxed", "num_warps": 4, "num_ctas": 1, "num_stages": 1}, "(8, 512, 3584, 64, 8)": {"BLOCK_SIZE_M": 16, "BLOCK_SIZE_N": 32, "BLOCK_SIZE_K": 32, "GROUP_SIZE_M": 8, "SPLIT_K": 16, "A_load_order": 0, "meta_evict_policy": "", "atomic_mode": "relaxed", "num_warps": 4, "num_ctas": 1, "num_stages": 1}, "(8, 18944, 3584, 64, 8)": {"BLOCK_SIZE_M": 16, "BLOCK_SIZE_N": 64, "BLOCK_SIZE_K": 32, "GROUP_SIZE_M": 8, "SPLIT_K": 4, "A_load_order": 2, "meta_evict_policy": "", "atomic_mode": "relaxed", "num_warps": 4, "num_ctas": 1, "num_stages": 1}, "(16, 512, 3584, 64, 8)": {"BLOCK_SIZE_M": 16, "BLOCK_SIZE_N": 32, "BLOCK_SIZE_K": 32, "GROUP_SIZE_M": 8, "SPLIT_K": 16, "A_load_order": 2, "meta_evict_policy": "", "atomic_mode": "relaxed", "num_warps": 8, "num_ctas": 1, "num_stages": 1}, "(16, 18944, 3584, 64, 8)": {"BLOCK_SIZE_M": 16, "BLOCK_SIZE_N": 64, "BLOCK_SIZE_K": 32, "GROUP_SIZE_M": 8, "SPLIT_K": 4, "A_load_order": 2, "meta_evict_policy": "", "atomic_mode": "relaxed", "num_warps": 4, "num_ctas": 1, "num_stages": 1}, "(32, 512, 3584, 64, 8)": {"BLOCK_SIZE_M": 32, "BLOCK_SIZE_N": 32, "BLOCK_SIZE_K": 64, "GROUP_SIZE_M": 8, "SPLIT_K": 8, "A_load_order": 0, "meta_evict_policy": "", "atomic_mode": "relaxed", "num_warps": 4, "num_ctas": 1, "num_stages": 4}, "(32, 18944, 3584, 64, 8)": {"BLOCK_SIZE_M": 32, "BLOCK_SIZE_N": 32, "BLOCK_SIZE_K": 64, "GROUP_SIZE_M": 8, "SPLIT_K": 2, "A_load_order": 0, "meta_evict_policy": "", "atomic_mode": "relaxed", "num_warps": 4, "num_ctas": 1, "num_stages": 1}, "(64, 512, 3584, 64, 8)": {"BLOCK_SIZE_M": 32, "BLOCK_SIZE_N": 32, "BLOCK_SIZE_K": 64, "GROUP_SIZE_M": 8, "SPLIT_K": 8, "A_load_order": 2, "meta_evict_policy": "", "atomic_mode": "relaxed", "num_warps": 4, "num_ctas": 1, "num_stages": 1}, "(64, 18944, 3584, 64, 8)": {"BLOCK_SIZE_M": 32, "BLOCK_SIZE_N": 64, "BLOCK_SIZE_K": 64, "GROUP_SIZE_M": 8, "SPLIT_K": 4, "A_load_order": 2, "meta_evict_policy": "", "atomic_mode": "relaxed", "num_warps": 4, "num_ctas": 1, "num_stages": 1}, "(4, 256, 2048, 64, 8)": {"BLOCK_SIZE_M": 16, "BLOCK_SIZE_N": 32, "BLOCK_SIZE_K": 64, "GROUP_SIZE_M": 8, "SPLIT_K": 16, "A_load_order": 0, "meta_evict_policy": "", "atomic_mode": "relaxed", "num_warps": 4, "num_ctas": 1, "num_stages": 5}, "(4, 11008, 2048, 64, 8)": {"BLOCK_SIZE_M": 16, "BLOCK_SIZE_N": 128, "BLOCK_SIZE_K": 64, "GROUP_SIZE_M": 8, "SPLIT_K": 4, "A_load_order": 0, "meta_evict_policy": "", "atomic_mode": "relaxed", "num_warps": 8, "num_ctas": 1, "num_stages": 1}, "(4, 2048, 11008, 64, 8)": {"BLOCK_SIZE_M": 16, "BLOCK_SIZE_N": 32, "BLOCK_SIZE_K": 32, "GROUP_SIZE_M": 8, "SPLIT_K": 8, "A_load_order": 0, "meta_evict_policy": "", "atomic_mode": "relaxed", "num_warps": 4, "num_ctas": 1, "num_stages": 1}, "(8, 256, 2048, 64, 8)": {"BLOCK_SIZE_M": 16, "BLOCK_SIZE_N": 32, "BLOCK_SIZE_K": 64, "GROUP_SIZE_M": 8, "SPLIT_K": 16, "A_load_order": 2, "meta_evict_policy": "", "atomic_mode": "relaxed", "num_warps": 4, "num_ctas": 1, "num_stages": 4}, "(8, 11008, 2048, 64, 8)": {"BLOCK_SIZE_M": 16, "BLOCK_SIZE_N": 128, "BLOCK_SIZE_K": 64, "GROUP_SIZE_M": 8, "SPLIT_K": 4, "A_load_order": 0, "meta_evict_policy": "", "atomic_mode": "relaxed", "num_warps": 8, "num_ctas": 1, "num_stages": 1}, "(8, 2048, 11008, 64, 8)": {"BLOCK_SIZE_M": 16, "BLOCK_SIZE_N": 32, "BLOCK_SIZE_K": 32, "GROUP_SIZE_M": 8, "SPLIT_K": 8, "A_load_order": 0, "meta_evict_policy": "", "atomic_mode": "relaxed", "num_warps": 4, "num_ctas": 1, "num_stages": 1}, "(16, 256, 2048, 64, 8)": {"BLOCK_SIZE_M": 16, "BLOCK_SIZE_N": 32, "BLOCK_SIZE_K": 64, "GROUP_SIZE_M": 8, "SPLIT_K": 16, "A_load_order": 0, "meta_evict_policy": "", "atomic_mode": "relaxed", "num_warps": 4, "num_ctas": 1, "num_stages": 4}, "(16, 11008, 2048, 64, 8)": {"BLOCK_SIZE_M": 16, "BLOCK_SIZE_N": 128, "BLOCK_SIZE_K": 64, "GROUP_SIZE_M": 8, "SPLIT_K": 4, "A_load_order": 0, "meta_evict_policy": "", "atomic_mode": "relaxed", "num_warps": 8, "num_ctas": 1, "num_stages": 1}, "(16, 2048, 11008, 64, 8)": {"BLOCK_SIZE_M": 16, "BLOCK_SIZE_N": 32, "BLOCK_SIZE_K": 32, "GROUP_SIZE_M": 8, "SPLIT_K": 8, "A_load_order": 0, "meta_evict_policy": "", "atomic_mode": "relaxed", "num_warps": 4, "num_ctas": 1, "num_stages": 1}, "(32, 256, 2048, 64, 8)": {"BLOCK_SIZE_M": 16, "BLOCK_SIZE_N": 32, "BLOCK_SIZE_K": 64, "GROUP_SIZE_M": 8, "SPLIT_K": 8, "A_load_order": 0, "meta_evict_policy": "", "atomic_mode": "relaxed", "num_warps": 4, "num_ctas": 1, "num_stages": 4}, "(32, 11008, 2048, 64, 8)": {"BLOCK_SIZE_M": 32, "BLOCK_SIZE_N": 32, "BLOCK_SIZE_K": 64, "GROUP_SIZE_M": 8, "SPLIT_K": 2, "A_load_order": 2, "meta_evict_policy": "", "atomic_mode": "relaxed", "num_warps": 4, "num_ctas": 1, "num_stages": 1}, "(32, 2048, 11008, 64, 8)": {"BLOCK_SIZE_M": 32, "BLOCK_SIZE_N": 32, "BLOCK_SIZE_K": 32, "GROUP_SIZE_M": 8, "SPLIT_K": 8, "A_load_order": 0, "meta_evict_policy": "", "atomic_mode": "relaxed", "num_warps": 4, "num_ctas": 1, "num_stages": 4}, "(64, 256, 2048, 64, 8)": {"BLOCK_SIZE_M": 32, "BLOCK_SIZE_N": 32, "BLOCK_SIZE_K": 64, "GROUP_SIZE_M": 8, "SPLIT_K": 8, "A_load_order": 2, "meta_evict_policy": "", "atomic_mode": "relaxed", "num_warps": 4, "num_ctas": 1, "num_stages": 1}, "(64, 11008, 2048, 64, 8)": {"BLOCK_SIZE_M": 32, "BLOCK_SIZE_N": 64, "BLOCK_SIZE_K": 64, "GROUP_SIZE_M": 8, "SPLIT_K": 4, "A_load_order": 2, "meta_evict_policy": "", "atomic_mode": "relaxed", "num_warps": 4, "num_ctas": 1, "num_stages": 1}, "(64, 2048, 11008, 64, 8)": {"BLOCK_SIZE_M": 32, "BLOCK_SIZE_N": 64, "BLOCK_SIZE_K": 64, "GROUP_SIZE_M": 8, "SPLIT_K": 4, "A_load_order": 0, "meta_evict_policy": "", "atomic_mode": "relaxed", "num_warps": 4, "num_ctas": 1, "num_stages": 5}}, "GEMM": {"(1024, 6144, 4096, 64, 8)": {"BLOCK_SIZE_M": 128, "BLOCK_SIZE_N": 64, "BLOCK_SIZE_K": 64, "GROUP_SIZE_M": 8, "A_load_order": 2, "meta_evict_policy": "", "num_warps": 4, "num_ctas": 1, "num_stages": 4}, "(1024, 4096, 4096, 64, 8)": {"BLOCK_SIZE_M": 128, "BLOCK_SIZE_N": 64, "BLOCK_SIZE_K": 32, "GROUP_SIZE_M": 8, "A_load_order": 0, "meta_evict_policy": "", "num_warps": 4, "num_ctas": 1, "num_stages": 5}, "(1024, 28672, 4096, 64, 8)": {"BLOCK_SIZE_M": 128, "BLOCK_SIZE_N": 128, "BLOCK_SIZE_K": 64, "GROUP_SIZE_M": 8, "A_load_order": 0, "meta_evict_policy": "", "num_warps": 8, "num_ctas": 1, "num_stages": 1}, "(1024, 4096, 14336, 64, 8)": {"BLOCK_SIZE_M": 128, "BLOCK_SIZE_N": 64, "BLOCK_SIZE_K": 32, "GROUP_SIZE_M": 8, "A_load_order": 0, "meta_evict_policy": "", "num_warps": 4, "num_ctas": 1, "num_stages": 4}, "(72, 6144, 4096, 64, 8)": {"BLOCK_SIZE_M": 64, "BLOCK_SIZE_N": 32, "BLOCK_SIZE_K": 64, "GROUP_SIZE_M": 8, "A_load_order": 2, "meta_evict_policy": "", "num_warps": 8, "num_ctas": 1, "num_stages": 1}, "(72, 4096, 4096, 64, 8)": {"BLOCK_SIZE_M": 64, "BLOCK_SIZE_N": 32, "BLOCK_SIZE_K": 64, "GROUP_SIZE_M": 8, "A_load_order": 2, "meta_evict_policy": "", "num_warps": 8, "num_ctas": 1, "num_stages": 1}, "(72, 28672, 4096, 64, 8)": {"BLOCK_SIZE_M": 64, "BLOCK_SIZE_N": 64, "BLOCK_SIZE_K": 64, "GROUP_SIZE_M": 8, "A_load_order": 2, "meta_evict_policy": "", "num_warps": 4, "num_ctas": 1, "num_stages": 1}, "(72, 4096, 14336, 64, 8)": {"BLOCK_SIZE_M": 64, "BLOCK_SIZE_N": 32, "BLOCK_SIZE_K": 64, "GROUP_SIZE_M": 8, "A_load_order": 2, "meta_evict_policy": "", "num_warps": 8, "num_ctas": 1, "num_stages": 1}, "(80, 6144, 4096, 64, 8)": {"BLOCK_SIZE_M": 64, "BLOCK_SIZE_N": 32, "BLOCK_SIZE_K": 64, "GROUP_SIZE_M": 8, "A_load_order": 2, "meta_evict_policy": "", "num_warps": 8, "num_ctas": 1, "num_stages": 1}, "(80, 4096, 4096, 64, 8)": {"BLOCK_SIZE_M": 64, "BLOCK_SIZE_N": 32, "BLOCK_SIZE_K": 64, "GROUP_SIZE_M": 8, "A_load_order": 2, "meta_evict_policy": "", "num_warps": 8, "num_ctas": 1, "num_stages": 1}, "(80, 28672, 4096, 64, 8)": {"BLOCK_SIZE_M": 64, "BLOCK_SIZE_N": 64, "BLOCK_SIZE_K": 64, "GROUP_SIZE_M": 8, "A_load_order": 2, "meta_evict_policy": "", "num_warps": 4, "num_ctas": 1, "num_stages": 1}, "(80, 4096, 14336, 64, 8)": {"BLOCK_SIZE_M": 64, "BLOCK_SIZE_N": 32, "BLOCK_SIZE_K": 64, "GROUP_SIZE_M": 8, "A_load_order": 2, "meta_evict_policy": "", "num_warps": 8, "num_ctas": 1, "num_stages": 1}, "(88, 6144, 4096, 64, 8)": {"BLOCK_SIZE_M": 64, "BLOCK_SIZE_N": 32, "BLOCK_SIZE_K": 64, "GROUP_SIZE_M": 8, "A_load_order": 2, "meta_evict_policy": "", "num_warps": 8, "num_ctas": 1, "num_stages": 1}, "(88, 4096, 4096, 64, 8)": {"BLOCK_SIZE_M": 64, "BLOCK_SIZE_N": 32, "BLOCK_SIZE_K": 64, "GROUP_SIZE_M": 8, "A_load_order": 2, "meta_evict_policy": "", "num_warps": 8, "num_ctas": 1, "num_stages": 1}, "(88, 28672, 4096, 64, 8)": {"BLOCK_SIZE_M": 64, "BLOCK_SIZE_N": 64, "BLOCK_SIZE_K": 64, "GROUP_SIZE_M": 8, "A_load_order": 2, "meta_evict_policy": "", "num_warps": 4, "num_ctas": 1, "num_stages": 1}, "(88, 4096, 14336, 64, 8)": {"BLOCK_SIZE_M": 64, "BLOCK_SIZE_N": 32, "BLOCK_SIZE_K": 64, "GROUP_SIZE_M": 8, "A_load_order": 2, "meta_evict_policy": "", "num_warps": 8, "num_ctas": 1, "num_stages": 1}, "(96, 6144, 4096, 64, 8)": {"BLOCK_SIZE_M": 64, "BLOCK_SIZE_N": 32, "BLOCK_SIZE_K": 64, "GROUP_SIZE_M": 8, "A_load_order": 2, "meta_evict_policy": "", "num_warps": 8, "num_ctas": 1, "num_stages": 1}, "(96, 4096, 4096, 64, 8)": {"BLOCK_SIZE_M": 64, "BLOCK_SIZE_N": 32, "BLOCK_SIZE_K": 64, "GROUP_SIZE_M": 8, "A_load_order": 2, "meta_evict_policy": "", "num_warps": 8, "num_ctas": 1, "num_stages": 1}, "(96, 28672, 4096, 64, 8)": {"BLOCK_SIZE_M": 64, "BLOCK_SIZE_N": 64, "BLOCK_SIZE_K": 64, "GROUP_SIZE_M": 8, "A_load_order": 2, "meta_evict_policy": "", "num_warps": 4, "num_ctas": 1, "num_stages": 1}, "(96, 4096, 14336, 64, 8)": {"BLOCK_SIZE_M": 64, "BLOCK_SIZE_N": 32, "BLOCK_SIZE_K": 64, "GROUP_SIZE_M": 8, "A_load_order": 2, "meta_evict_policy": "", "num_warps": 8, "num_ctas": 1, "num_stages": 1}, "(104, 6144, 4096, 64, 8)": {"BLOCK_SIZE_M": 64, "BLOCK_SIZE_N": 32, "BLOCK_SIZE_K": 64, "GROUP_SIZE_M": 8, "A_load_order": 2, "meta_evict_policy": "", "num_warps": 8, "num_ctas": 1, "num_stages": 1}, "(104, 4096, 4096, 64, 8)": {"BLOCK_SIZE_M": 64, "BLOCK_SIZE_N": 32, "BLOCK_SIZE_K": 64, "GROUP_SIZE_M": 8, "A_load_order": 2, "meta_evict_policy": "", "num_warps": 8, "num_ctas": 1, "num_stages": 1}, "(104, 28672, 4096, 64, 8)": {"BLOCK_SIZE_M": 64, "BLOCK_SIZE_N": 64, "BLOCK_SIZE_K": 64, "GROUP_SIZE_M": 8, "A_load_order": 2, "meta_evict_policy": "", "num_warps": 4, "num_ctas": 1, "num_stages": 1}, "(104, 4096, 14336, 64, 8)": {"BLOCK_SIZE_M": 64, "BLOCK_SIZE_N": 32, "BLOCK_SIZE_K": 64, "GROUP_SIZE_M": 8, "A_load_order": 2, "meta_evict_policy": "", "num_warps": 8, "num_ctas": 1, "num_stages": 1}, "(112, 6144, 4096, 64, 8)": {"BLOCK_SIZE_M": 64, "BLOCK_SIZE_N": 32, "BLOCK_SIZE_K": 64, "GROUP_SIZE_M": 8, "A_load_order": 2, "meta_evict_policy": "", "num_warps": 8, "num_ctas": 1, "num_stages": 1}, "(112, 4096, 4096, 64, 8)": {"BLOCK_SIZE_M": 64, "BLOCK_SIZE_N": 32, "BLOCK_SIZE_K": 64, "GROUP_SIZE_M": 8, "A_load_order": 2, "meta_evict_policy": "", "num_warps": 8, "num_ctas": 1, "num_stages": 1}, "(112, 28672, 4096, 64, 8)": {"BLOCK_SIZE_M": 64, "BLOCK_SIZE_N": 64, "BLOCK_SIZE_K": 64, "GROUP_SIZE_M": 8, "A_load_order": 2, "meta_evict_policy": "", "num_warps": 4, "num_ctas": 1, "num_stages": 1}, "(112, 4096, 14336, 64, 8)": {"BLOCK_SIZE_M": 64, "BLOCK_SIZE_N": 32, "BLOCK_SIZE_K": 64, "GROUP_SIZE_M": 8, "A_load_order": 2, "meta_evict_policy": "", "num_warps": 8, "num_ctas": 1, "num_stages": 1}, "(120, 6144, 4096, 64, 8)": {"BLOCK_SIZE_M": 64, "BLOCK_SIZE_N": 32, "BLOCK_SIZE_K": 64, "GROUP_SIZE_M": 8, "A_load_order": 2, "meta_evict_policy": "", "num_warps": 8, "num_ctas": 1, "num_stages": 1}, "(120, 4096, 4096, 64, 8)": {"BLOCK_SIZE_M": 64, "BLOCK_SIZE_N": 32, "BLOCK_SIZE_K": 64, "GROUP_SIZE_M": 8, "A_load_order": 2, "meta_evict_policy": "", "num_warps": 8, "num_ctas": 1, "num_stages": 1}, "(120, 28672, 4096, 64, 8)": {"BLOCK_SIZE_M": 64, "BLOCK_SIZE_N": 64, "BLOCK_SIZE_K": 64, "GROUP_SIZE_M": 8, "A_load_order": 2, "meta_evict_policy": "", "num_warps": 4, "num_ctas": 1, "num_stages": 1}, "(120, 4096, 14336, 64, 8)": {"BLOCK_SIZE_M": 64, "BLOCK_SIZE_N": 32, "BLOCK_SIZE_K": 64, "GROUP_SIZE_M": 8, "A_load_order": 2, "meta_evict_policy": "", "num_warps": 8, "num_ctas": 1, "num_stages": 1}, "(128, 6144, 4096, 64, 8)": {"BLOCK_SIZE_M": 64, "BLOCK_SIZE_N": 32, "BLOCK_SIZE_K": 64, "GROUP_SIZE_M": 8, "A_load_order": 2, "meta_evict_policy": "", "num_warps": 8, "num_ctas": 1, "num_stages": 1}, "(128, 4096, 4096, 64, 8)": {"BLOCK_SIZE_M": 64, "BLOCK_SIZE_N": 32, "BLOCK_SIZE_K": 64, "GROUP_SIZE_M": 8, "A_load_order": 2, "meta_evict_policy": "", "num_warps": 8, "num_ctas": 1, "num_stages": 1}, "(128, 28672, 4096, 64, 8)": {"BLOCK_SIZE_M": 64, "BLOCK_SIZE_N": 64, "BLOCK_SIZE_K": 64, "GROUP_SIZE_M": 8, "A_load_order": 2, "meta_evict_policy": "", "num_warps": 4, "num_ctas": 1, "num_stages": 1}, "(128, 4096, 14336, 64, 8)": {"BLOCK_SIZE_M": 64, "BLOCK_SIZE_N": 32, "BLOCK_SIZE_K": 64, "GROUP_SIZE_M": 8, "A_load_order": 2, "meta_evict_policy": "", "num_warps": 8, "num_ctas": 1, "num_stages": 1}, "(136, 6144, 4096, 64, 8)": {"BLOCK_SIZE_M": 64, "BLOCK_SIZE_N": 64, "BLOCK_SIZE_K": 64, "GROUP_SIZE_M": 8, "A_load_order": 2, "meta_evict_policy": "", "num_warps": 8, "num_ctas": 1, "num_stages": 1}, "(136, 4096, 4096, 64, 8)": {"BLOCK_SIZE_M": 64, "BLOCK_SIZE_N": 64, "BLOCK_SIZE_K": 64, "GROUP_SIZE_M": 8, "A_load_order": 2, "meta_evict_policy": "", "num_warps": 8, "num_ctas": 1, "num_stages": 1}, "(136, 28672, 4096, 64, 8)": {"BLOCK_SIZE_M": 64, "BLOCK_SIZE_N": 256, "BLOCK_SIZE_K": 32, "GROUP_SIZE_M": 8, "A_load_order": 2, "meta_evict_policy": "", "num_warps": 4, "num_ctas": 1, "num_stages": 1}, "(136, 4096, 14336, 64, 8)": {"BLOCK_SIZE_M": 64, "BLOCK_SIZE_N": 64, "BLOCK_SIZE_K": 64, "GROUP_SIZE_M": 8, "A_load_order": 2, "meta_evict_policy": "", "num_warps": 8, "num_ctas": 1, "num_stages": 1}, "(144, 6144, 4096, 64, 8)": {"BLOCK_SIZE_M": 64, "BLOCK_SIZE_N": 64, "BLOCK_SIZE_K": 64, "GROUP_SIZE_M": 8, "A_load_order": 2, "meta_evict_policy": "", "num_warps": 8, "num_ctas": 1, "num_stages": 1}, "(144, 4096, 4096, 64, 8)": {"BLOCK_SIZE_M": 64, "BLOCK_SIZE_N": 64, "BLOCK_SIZE_K": 64, "GROUP_SIZE_M": 8, "A_load_order": 2, "meta_evict_policy": "", "num_warps": 8, "num_ctas": 1, "num_stages": 1}, "(144, 28672, 4096, 64, 8)": {"BLOCK_SIZE_M": 64, "BLOCK_SIZE_N": 256, "BLOCK_SIZE_K": 32, "GROUP_SIZE_M": 8, "A_load_order": 2, "meta_evict_policy": "", "num_warps": 4, "num_ctas": 1, "num_stages": 1}, "(144, 4096, 14336, 64, 8)": {"BLOCK_SIZE_M": 64, "BLOCK_SIZE_N": 64, "BLOCK_SIZE_K": 64, "GROUP_SIZE_M": 8, "A_load_order": 2, "meta_evict_policy": "", "num_warps": 8, "num_ctas": 1, "num_stages": 1}, "(152, 6144, 4096, 64, 8)": {"BLOCK_SIZE_M": 64, "BLOCK_SIZE_N": 64, "BLOCK_SIZE_K": 64, "GROUP_SIZE_M": 8, "A_load_order": 2, "meta_evict_policy": "", "num_warps": 8, "num_ctas": 1, "num_stages": 1}, "(152, 4096, 4096, 64, 8)": {"BLOCK_SIZE_M": 64, "BLOCK_SIZE_N": 64, "BLOCK_SIZE_K": 64, "GROUP_SIZE_M": 8, "A_load_order": 2, "meta_evict_policy": "", "num_warps": 8, "num_ctas": 1, "num_stages": 1}, "(152, 28672, 4096, 64, 8)": {"BLOCK_SIZE_M": 64, "BLOCK_SIZE_N": 256, "BLOCK_SIZE_K": 32, "GROUP_SIZE_M": 8, "A_load_order": 2, "meta_evict_policy": "", "num_warps": 4, "num_ctas": 1, "num_stages": 1}, "(152, 4096, 14336, 64, 8)": {"BLOCK_SIZE_M": 64, "BLOCK_SIZE_N": 64, "BLOCK_SIZE_K": 64, "GROUP_SIZE_M": 8, "A_load_order": 2, "meta_evict_policy": "", "num_warps": 8, "num_ctas": 1, "num_stages": 1}, "(160, 6144, 4096, 64, 8)": {"BLOCK_SIZE_M": 64, "BLOCK_SIZE_N": 64, "BLOCK_SIZE_K": 64, "GROUP_SIZE_M": 8, "A_load_order": 2, "meta_evict_policy": "", "num_warps": 8, "num_ctas": 1, "num_stages": 1}, "(160, 4096, 4096, 64, 8)": {"BLOCK_SIZE_M": 64, "BLOCK_SIZE_N": 64, "BLOCK_SIZE_K": 64, "GROUP_SIZE_M": 8, "A_load_order": 2, "meta_evict_policy": "", "num_warps": 8, "num_ctas": 1, "num_stages": 1}, "(160, 28672, 4096, 64, 8)": {"BLOCK_SIZE_M": 64, "BLOCK_SIZE_N": 256, "BLOCK_SIZE_K": 32, "GROUP_SIZE_M": 8, "A_load_order": 2, "meta_evict_policy": "", "num_warps": 4, "num_ctas": 1, "num_stages": 1}, "(160, 4096, 14336, 64, 8)": {"BLOCK_SIZE_M": 64, "BLOCK_SIZE_N": 64, "BLOCK_SIZE_K": 64, "GROUP_SIZE_M": 8, "A_load_order": 2, "meta_evict_policy": "", "num_warps": 8, "num_ctas": 1, "num_stages": 1}, "(72, 6144, 4096, 64, 2)": {"BLOCK_SIZE_M": 64, "BLOCK_SIZE_N": 32, "BLOCK_SIZE_K": 64, "GROUP_SIZE_M": 8, "A_load_order": 2, "meta_evict_policy": "", "num_warps": 8, "num_ctas": 1, "num_stages": 1}, "(72, 4096, 4096, 64, 2)": {"BLOCK_SIZE_M": 64, "BLOCK_SIZE_N": 32, "BLOCK_SIZE_K": 64, "GROUP_SIZE_M": 8, "A_load_order": 2, "meta_evict_policy": "", "num_warps": 8, "num_ctas": 1, "num_stages": 1}, "(72, 28672, 4096, 64, 2)": {"BLOCK_SIZE_M": 64, "BLOCK_SIZE_N": 64, "BLOCK_SIZE_K": 64, "GROUP_SIZE_M": 8, "A_load_order": 2, "meta_evict_policy": "", "num_warps": 4, "num_ctas": 1, "num_stages": 1}, "(72, 4096, 14336, 64, 2)": {"BLOCK_SIZE_M": 64, "BLOCK_SIZE_N": 32, "BLOCK_SIZE_K": 64, "GROUP_SIZE_M": 8, "A_load_order": 2, "meta_evict_policy": "", "num_warps": 8, "num_ctas": 1, "num_stages": 1}, "(80, 6144, 4096, 64, 2)": {"BLOCK_SIZE_M": 64, "BLOCK_SIZE_N": 32, "BLOCK_SIZE_K": 64, "GROUP_SIZE_M": 8, "A_load_order": 2, "meta_evict_policy": "", "num_warps": 8, "num_ctas": 1, "num_stages": 1}, "(80, 4096, 4096, 64, 2)": {"BLOCK_SIZE_M": 64, "BLOCK_SIZE_N": 32, "BLOCK_SIZE_K": 64, "GROUP_SIZE_M": 8, "A_load_order": 2, "meta_evict_policy": "", "num_warps": 8, "num_ctas": 1, "num_stages": 1}, "(80, 28672, 4096, 64, 2)": {"BLOCK_SIZE_M": 64, "BLOCK_SIZE_N": 64, "BLOCK_SIZE_K": 64, "GROUP_SIZE_M": 8, "A_load_order": 2, "meta_evict_policy": "", "num_warps": 4, "num_ctas": 1, "num_stages": 1}, "(80, 4096, 14336, 64, 2)": {"BLOCK_SIZE_M": 64, "BLOCK_SIZE_N": 32, "BLOCK_SIZE_K": 64, "GROUP_SIZE_M": 8, "A_load_order": 2, "meta_evict_policy": "", "num_warps": 8, "num_ctas": 1, "num_stages": 1}, "(88, 6144, 4096, 64, 2)": {"BLOCK_SIZE_M": 64, "BLOCK_SIZE_N": 32, "BLOCK_SIZE_K": 64, "GROUP_SIZE_M": 8, "A_load_order": 2, "meta_evict_policy": "", "num_warps": 8, "num_ctas": 1, "num_stages": 1}, "(88, 4096, 4096, 64, 2)": {"BLOCK_SIZE_M": 64, "BLOCK_SIZE_N": 32, "BLOCK_SIZE_K": 64, "GROUP_SIZE_M": 8, "A_load_order": 2, "meta_evict_policy": "", "num_warps": 8, "num_ctas": 1, "num_stages": 1}, "(88, 28672, 4096, 64, 2)": {"BLOCK_SIZE_M": 64, "BLOCK_SIZE_N": 64, "BLOCK_SIZE_K": 64, "GROUP_SIZE_M": 8, "A_load_order": 2, "meta_evict_policy": "", "num_warps": 4, "num_ctas": 1, "num_stages": 1}, "(88, 4096, 14336, 64, 2)": {"BLOCK_SIZE_M": 64, "BLOCK_SIZE_N": 32, "BLOCK_SIZE_K": 64, "GROUP_SIZE_M": 8, "A_load_order": 2, "meta_evict_policy": "", "num_warps": 8, "num_ctas": 1, "num_stages": 1}, "(96, 6144, 4096, 64, 2)": {"BLOCK_SIZE_M": 64, "BLOCK_SIZE_N": 32, "BLOCK_SIZE_K": 64, "GROUP_SIZE_M": 8, "A_load_order": 2, "meta_evict_policy": "", "num_warps": 8, "num_ctas": 1, "num_stages": 1}, "(96, 4096, 4096, 64, 2)": {"BLOCK_SIZE_M": 64, "BLOCK_SIZE_N": 32, "BLOCK_SIZE_K": 64, "GROUP_SIZE_M": 8, "A_load_order": 2, "meta_evict_policy": "", "num_warps": 8, "num_ctas": 1, "num_stages": 1}, "(96, 28672, 4096, 64, 2)": {"BLOCK_SIZE_M": 64, "BLOCK_SIZE_N": 64, "BLOCK_SIZE_K": 64, "GROUP_SIZE_M": 8, "A_load_order": 2, "meta_evict_policy": "", "num_warps": 4, "num_ctas": 1, "num_stages": 1}, "(96, 4096, 14336, 64, 2)": {"BLOCK_SIZE_M": 64, "BLOCK_SIZE_N": 32, "BLOCK_SIZE_K": 64, "GROUP_SIZE_M": 8, "A_load_order": 2, "meta_evict_policy": "", "num_warps": 8, "num_ctas": 1, "num_stages": 1}, "(104, 6144, 4096, 64, 2)": {"BLOCK_SIZE_M": 64, "BLOCK_SIZE_N": 32, "BLOCK_SIZE_K": 64, "GROUP_SIZE_M": 8, "A_load_order": 2, "meta_evict_policy": "", "num_warps": 8, "num_ctas": 1, "num_stages": 1}, "(104, 4096, 4096, 64, 2)": {"BLOCK_SIZE_M": 64, "BLOCK_SIZE_N": 32, "BLOCK_SIZE_K": 64, "GROUP_SIZE_M": 8, "A_load_order": 2, "meta_evict_policy": "", "num_warps": 8, "num_ctas": 1, "num_stages": 1}, "(104, 28672, 4096, 64, 2)": {"BLOCK_SIZE_M": 64, "BLOCK_SIZE_N": 64, "BLOCK_SIZE_K": 64, "GROUP_SIZE_M": 8, "A_load_order": 2, "meta_evict_policy": "", "num_warps": 4, "num_ctas": 1, "num_stages": 1}, "(104, 4096, 14336, 64, 2)": {"BLOCK_SIZE_M": 64, "BLOCK_SIZE_N": 32, "BLOCK_SIZE_K": 64, "GROUP_SIZE_M": 8, "A_load_order": 2, "meta_evict_policy": "", "num_warps": 8, "num_ctas": 1, "num_stages": 1}, "(112, 6144, 4096, 64, 2)": {"BLOCK_SIZE_M": 64, "BLOCK_SIZE_N": 32, "BLOCK_SIZE_K": 64, "GROUP_SIZE_M": 8, "A_load_order": 2, "meta_evict_policy": "", "num_warps": 8, "num_ctas": 1, "num_stages": 1}, "(112, 4096, 4096, 64, 2)": {"BLOCK_SIZE_M": 64, "BLOCK_SIZE_N": 32, "BLOCK_SIZE_K": 64, "GROUP_SIZE_M": 8, "A_load_order": 2, "meta_evict_policy": "", "num_warps": 8, "num_ctas": 1, "num_stages": 1}, "(112, 28672, 4096, 64, 2)": {"BLOCK_SIZE_M": 64, "BLOCK_SIZE_N": 64, "BLOCK_SIZE_K": 64, "GROUP_SIZE_M": 8, "A_load_order": 2, "meta_evict_policy": "", "num_warps": 4, "num_ctas": 1, "num_stages": 1}, "(112, 4096, 14336, 64, 2)": {"BLOCK_SIZE_M": 64, "BLOCK_SIZE_N": 32, "BLOCK_SIZE_K": 64, "GROUP_SIZE_M": 8, "A_load_order": 2, "meta_evict_policy": "", "num_warps": 8, "num_ctas": 1, "num_stages": 1}, "(120, 6144, 4096, 64, 2)": {"BLOCK_SIZE_M": 64, "BLOCK_SIZE_N": 32, "BLOCK_SIZE_K": 64, "GROUP_SIZE_M": 8, "A_load_order": 2, "meta_evict_policy": "", "num_warps": 8, "num_ctas": 1, "num_stages": 1}, "(120, 4096, 4096, 64, 2)": {"BLOCK_SIZE_M": 64, "BLOCK_SIZE_N": 32, "BLOCK_SIZE_K": 64, "GROUP_SIZE_M": 8, "A_load_order": 2, "meta_evict_policy": "", "num_warps": 8, "num_ctas": 1, "num_stages": 1}, "(120, 28672, 4096, 64, 2)": {"BLOCK_SIZE_M": 64, "BLOCK_SIZE_N": 64, "BLOCK_SIZE_K": 64, "GROUP_SIZE_M": 8, "A_load_order": 2, "meta_evict_policy": "", "num_warps": 4, "num_ctas": 1, "num_stages": 1}, "(120, 4096, 14336, 64, 2)": {"BLOCK_SIZE_M": 64, "BLOCK_SIZE_N": 32, "BLOCK_SIZE_K": 64, "GROUP_SIZE_M": 8, "A_load_order": 2, "meta_evict_policy": "", "num_warps": 8, "num_ctas": 1, "num_stages": 1}, "(128, 6144, 4096, 64, 2)": {"BLOCK_SIZE_M": 64, "BLOCK_SIZE_N": 32, "BLOCK_SIZE_K": 64, "GROUP_SIZE_M": 8, "A_load_order": 2, "meta_evict_policy": "", "num_warps": 8, "num_ctas": 1, "num_stages": 1}, "(128, 4096, 4096, 64, 2)": {"BLOCK_SIZE_M": 64, "BLOCK_SIZE_N": 32, "BLOCK_SIZE_K": 64, "GROUP_SIZE_M": 8, "A_load_order": 2, "meta_evict_policy": "", "num_warps": 8, "num_ctas": 1, "num_stages": 1}, "(128, 28672, 4096, 64, 2)": {"BLOCK_SIZE_M": 64, "BLOCK_SIZE_N": 64, "BLOCK_SIZE_K": 64, "GROUP_SIZE_M": 8, "A_load_order": 2, "meta_evict_policy": "", "num_warps": 4, "num_ctas": 1, "num_stages": 5}, "(128, 4096, 14336, 64, 2)": {"BLOCK_SIZE_M": 64, "BLOCK_SIZE_N": 32, "BLOCK_SIZE_K": 64, "GROUP_SIZE_M": 8, "A_load_order": 2, "meta_evict_policy": "", "num_warps": 8, "num_ctas": 1, "num_stages": 1}, "(136, 6144, 4096, 64, 2)": {"BLOCK_SIZE_M": 64, "BLOCK_SIZE_N": 32, "BLOCK_SIZE_K": 64, "GROUP_SIZE_M": 8, "A_load_order": 0, "meta_evict_policy": "", "num_warps": 4, "num_ctas": 1, "num_stages": 1}, "(136, 4096, 4096, 64, 2)": {"BLOCK_SIZE_M": 64, "BLOCK_SIZE_N": 32, "BLOCK_SIZE_K": 64, "GROUP_SIZE_M": 8, "A_load_order": 2, "meta_evict_policy": "", "num_warps": 8, "num_ctas": 1, "num_stages": 1}, "(136, 28672, 4096, 64, 2)": {"BLOCK_SIZE_M": 64, "BLOCK_SIZE_N": 64, "BLOCK_SIZE_K": 64, "GROUP_SIZE_M": 8, "A_load_order": 2, "meta_evict_policy": "", "num_warps": 4, "num_ctas": 1, "num_stages": 1}, "(136, 4096, 14336, 64, 2)": {"BLOCK_SIZE_M": 64, "BLOCK_SIZE_N": 32, "BLOCK_SIZE_K": 64, "GROUP_SIZE_M": 8, "A_load_order": 2, "meta_evict_policy": "", "num_warps": 8, "num_ctas": 1, "num_stages": 1}, "(144, 6144, 4096, 64, 2)": {"BLOCK_SIZE_M": 64, "BLOCK_SIZE_N": 32, "BLOCK_SIZE_K": 64, "GROUP_SIZE_M": 8, "A_load_order": 0, "meta_evict_policy": "", "num_warps": 4, "num_ctas": 1, "num_stages": 1}, "(144, 4096, 4096, 64, 2)": {"BLOCK_SIZE_M": 64, "BLOCK_SIZE_N": 32, "BLOCK_SIZE_K": 64, "GROUP_SIZE_M": 8, "A_load_order": 2, "meta_evict_policy": "", "num_warps": 8, "num_ctas": 1, "num_stages": 1}, "(144, 28672, 4096, 64, 2)": {"BLOCK_SIZE_M": 64, "BLOCK_SIZE_N": 64, "BLOCK_SIZE_K": 64, "GROUP_SIZE_M": 8, "A_load_order": 2, "meta_evict_policy": "", "num_warps": 4, "num_ctas": 1, "num_stages": 1}, "(144, 4096, 14336, 64, 2)": {"BLOCK_SIZE_M": 64, "BLOCK_SIZE_N": 32, "BLOCK_SIZE_K": 64, "GROUP_SIZE_M": 8, "A_load_order": 2, "meta_evict_policy": "", "num_warps": 8, "num_ctas": 1, "num_stages": 1}, "(152, 6144, 4096, 64, 2)": {"BLOCK_SIZE_M": 64, "BLOCK_SIZE_N": 32, "BLOCK_SIZE_K": 64, "GROUP_SIZE_M": 8, "A_load_order": 0, "meta_evict_policy": "", "num_warps": 4, "num_ctas": 1, "num_stages": 5}, "(152, 4096, 4096, 64, 2)": {"BLOCK_SIZE_M": 64, "BLOCK_SIZE_N": 32, "BLOCK_SIZE_K": 64, "GROUP_SIZE_M": 8, "A_load_order": 2, "meta_evict_policy": "", "num_warps": 8, "num_ctas": 1, "num_stages": 1}, "(152, 28672, 4096, 64, 2)": {"BLOCK_SIZE_M": 64, "BLOCK_SIZE_N": 64, "BLOCK_SIZE_K": 64, "GROUP_SIZE_M": 8, "A_load_order": 2, "meta_evict_policy": "", "num_warps": 4, "num_ctas": 1, "num_stages": 1}, "(152, 4096, 14336, 64, 2)": {"BLOCK_SIZE_M": 64, "BLOCK_SIZE_N": 32, "BLOCK_SIZE_K": 64, "GROUP_SIZE_M": 8, "A_load_order": 2, "meta_evict_policy": "", "num_warps": 8, "num_ctas": 1, "num_stages": 1}, "(160, 6144, 4096, 64, 2)": {"BLOCK_SIZE_M": 64, "BLOCK_SIZE_N": 32, "BLOCK_SIZE_K": 64, "GROUP_SIZE_M": 8, "A_load_order": 0, "meta_evict_policy": "", "num_warps": 4, "num_ctas": 1, "num_stages": 4}, "(160, 4096, 4096, 64, 2)": {"BLOCK_SIZE_M": 64, "BLOCK_SIZE_N": 32, "BLOCK_SIZE_K": 64, "GROUP_SIZE_M": 8, "A_load_order": 2, "meta_evict_policy": "", "num_warps": 8, "num_ctas": 1, "num_stages": 1}, "(160, 28672, 4096, 64, 2)": {"BLOCK_SIZE_M": 64, "BLOCK_SIZE_N": 64, "BLOCK_SIZE_K": 64, "GROUP_SIZE_M": 8, "A_load_order": 2, "meta_evict_policy": "", "num_warps": 4, "num_ctas": 1, "num_stages": 1}, "(160, 4096, 14336, 64, 2)": {"BLOCK_SIZE_M": 64, "BLOCK_SIZE_N": 32, "BLOCK_SIZE_K": 64, "GROUP_SIZE_M": 8, "A_load_order": 2, "meta_evict_policy": "", "num_warps": 8, "num_ctas": 1, "num_stages": 1}, "(1024, 6144, 4096, 64, 2)": {"BLOCK_SIZE_M": 128, "BLOCK_SIZE_N": 64, "BLOCK_SIZE_K": 64, "GROUP_SIZE_M": 8, "A_load_order": 2, "meta_evict_policy": "", "num_warps": 4, "num_ctas": 1, "num_stages": 4}, "(1024, 4096, 4096, 64, 2)": {"BLOCK_SIZE_M": 128, "BLOCK_SIZE_N": 128, "BLOCK_SIZE_K": 64, "GROUP_SIZE_M": 8, "A_load_order": 2, "meta_evict_policy": "", "num_warps": 4, "num_ctas": 1, "num_stages": 5}, "(1024, 28672, 4096, 64, 2)": {"BLOCK_SIZE_M": 128, "BLOCK_SIZE_N": 64, "BLOCK_SIZE_K": 64, "GROUP_SIZE_M": 8, "A_load_order": 2, "meta_evict_policy": "", "num_warps": 4, "num_ctas": 1, "num_stages": 4}, "(1024, 4096, 14336, 64, 2)": {"BLOCK_SIZE_M": 128, "BLOCK_SIZE_N": 128, "BLOCK_SIZE_K": 64, "GROUP_SIZE_M": 8, "A_load_order": 2, "meta_evict_policy": "", "num_warps": 4, "num_ctas": 1, "num_stages": 5}, "(32768, 6144, 4096, 64, 8)": {"BLOCK_SIZE_M": 128, "BLOCK_SIZE_N": 64, "BLOCK_SIZE_K": 64, "GROUP_SIZE_M": 8, "A_load_order": 2, "meta_evict_policy": "", "num_warps": 4, "num_ctas": 1, "num_stages": 4}, "(32768, 4096, 4096, 64, 8)": {"BLOCK_SIZE_M": 128, "BLOCK_SIZE_N": 64, "BLOCK_SIZE_K": 64, "GROUP_SIZE_M": 8, "A_load_order": 2, "meta_evict_policy": "", "num_warps": 4, "num_ctas": 1, "num_stages": 4}, "(32768, 28672, 4096, 64, 8)": {"BLOCK_SIZE_M": 128, "BLOCK_SIZE_N": 64, "BLOCK_SIZE_K": 64, "GROUP_SIZE_M": 8, "A_load_order": 2, "meta_evict_policy": "", "num_warps": 4, "num_ctas": 1, "num_stages": 4}, "(32768, 4096, 14336, 64, 8)": {"BLOCK_SIZE_M": 128, "BLOCK_SIZE_N": 64, "BLOCK_SIZE_K": 64, "GROUP_SIZE_M": 8, "A_load_order": 2, "meta_evict_policy": "", "num_warps": 4, "num_ctas": 1, "num_stages": 4}, "(32768, 6144, 4096, 64, 2)": {"BLOCK_SIZE_M": 128, "BLOCK_SIZE_N": 64, "BLOCK_SIZE_K": 64, "GROUP_SIZE_M": 8, "A_load_order": 2, "meta_evict_policy": "", "num_warps": 4, "num_ctas": 1, "num_stages": 4}, "(32768, 4096, 4096, 64, 2)": {"BLOCK_SIZE_M": 128, "BLOCK_SIZE_N": 64, "BLOCK_SIZE_K": 64, "GROUP_SIZE_M": 8, "A_load_order": 0, "meta_evict_policy": "", "num_warps": 4, "num_ctas": 1, "num_stages": 4}, "(32768, 28672, 4096, 64, 2)": {"BLOCK_SIZE_M": 128, "BLOCK_SIZE_N": 64, "BLOCK_SIZE_K": 64, "GROUP_SIZE_M": 8, "A_load_order": 2, "meta_evict_policy": "", "num_warps": 4, "num_ctas": 1, "num_stages": 4}, "(32768, 4096, 14336, 64, 2)": {"BLOCK_SIZE_M": 128, "BLOCK_SIZE_N": 64, "BLOCK_SIZE_K": 64, "GROUP_SIZE_M": 8, "A_load_order": 2, "meta_evict_policy": "", "num_warps": 4, "num_ctas": 1, "num_stages": 4}, "(72, 4608, 3584, 64, 8)": {"BLOCK_SIZE_M": 64, "BLOCK_SIZE_N": 32, "BLOCK_SIZE_K": 64, "GROUP_SIZE_M": 8, "A_load_order": 2, "meta_evict_policy": "", "num_warps": 8, "num_ctas": 1, "num_stages": 1}, "(72, 3584, 3584, 64, 8)": {"BLOCK_SIZE_M": 64, "BLOCK_SIZE_N": 32, "BLOCK_SIZE_K": 64, "GROUP_SIZE_M": 8, "A_load_order": 2, "meta_evict_policy": "", "num_warps": 8, "num_ctas": 1, "num_stages": 1}, "(72, 37888, 3584, 64, 8)": {"BLOCK_SIZE_M": 64, "BLOCK_SIZE_N": 64, "BLOCK_SIZE_K": 64, "GROUP_SIZE_M": 8, "A_load_order": 0, "meta_evict_policy": "", "num_warps": 4, "num_ctas": 1, "num_stages": 4}, "(72, 3584, 18944, 64, 8)": {"BLOCK_SIZE_M": 64, "BLOCK_SIZE_N": 32, "BLOCK_SIZE_K": 64, "GROUP_SIZE_M": 8, "A_load_order": 2, "meta_evict_policy": "", "num_warps": 8, "num_ctas": 1, "num_stages": 1}, "(80, 4608, 3584, 64, 8)": {"BLOCK_SIZE_M": 64, "BLOCK_SIZE_N": 32, "BLOCK_SIZE_K": 64, "GROUP_SIZE_M": 8, "A_load_order": 2, "meta_evict_policy": "", "num_warps": 8, "num_ctas": 1, "num_stages": 1}, "(80, 3584, 3584, 64, 8)": {"BLOCK_SIZE_M": 64, "BLOCK_SIZE_N": 32, "BLOCK_SIZE_K": 64, "GROUP_SIZE_M": 8, "A_load_order": 2, "meta_evict_policy": "", "num_warps": 8, "num_ctas": 1, "num_stages": 1}, "(80, 37888, 3584, 64, 8)": {"BLOCK_SIZE_M": 64, "BLOCK_SIZE_N": 64, "BLOCK_SIZE_K": 64, "GROUP_SIZE_M": 8, "A_load_order": 0, "meta_evict_policy": "", "num_warps": 4, "num_ctas": 1, "num_stages": 4}, "(80, 3584, 18944, 64, 8)": {"BLOCK_SIZE_M": 64, "BLOCK_SIZE_N": 32, "BLOCK_SIZE_K": 64, "GROUP_SIZE_M": 8, "A_load_order": 2, "meta_evict_policy": "", "num_warps": 8, "num_ctas": 1, "num_stages": 1}, "(88, 4608, 3584, 64, 8)": {"BLOCK_SIZE_M": 64, "BLOCK_SIZE_N": 32, "BLOCK_SIZE_K": 64, "GROUP_SIZE_M": 8, "A_load_order": 2, "meta_evict_policy": "", "num_warps": 8, "num_ctas": 1, "num_stages": 1}, "(88, 3584, 3584, 64, 8)": {"BLOCK_SIZE_M": 64, "BLOCK_SIZE_N": 32, "BLOCK_SIZE_K": 64, "GROUP_SIZE_M": 8, "A_load_order": 2, "meta_evict_policy": "", "num_warps": 8, "num_ctas": 1, "num_stages": 1}, "(88, 37888, 3584, 64, 8)": {"BLOCK_SIZE_M": 64, "BLOCK_SIZE_N": 64, "BLOCK_SIZE_K": 64, "GROUP_SIZE_M": 8, "A_load_order": 0, "meta_evict_policy": "", "num_warps": 4, "num_ctas": 1, "num_stages": 4}, "(88, 3584, 18944, 64, 8)": {"BLOCK_SIZE_M": 64, "BLOCK_SIZE_N": 32, "BLOCK_SIZE_K": 64, "GROUP_SIZE_M": 8, "A_load_order": 2, "meta_evict_policy": "", "num_warps": 8, "num_ctas": 1, "num_stages": 1}, "(96, 4608, 3584, 64, 8)": {"BLOCK_SIZE_M": 64, "BLOCK_SIZE_N": 32, "BLOCK_SIZE_K": 64, "GROUP_SIZE_M": 8, "A_load_order": 2, "meta_evict_policy": "", "num_warps": 8, "num_ctas": 1, "num_stages": 1}, "(96, 3584, 3584, 64, 8)": {"BLOCK_SIZE_M": 64, "BLOCK_SIZE_N": 32, "BLOCK_SIZE_K": 64, "GROUP_SIZE_M": 8, "A_load_order": 2, "meta_evict_policy": "", "num_warps": 8, "num_ctas": 1, "num_stages": 1}, "(96, 37888, 3584, 64, 8)": {"BLOCK_SIZE_M": 64, "BLOCK_SIZE_N": 64, "BLOCK_SIZE_K": 64, "GROUP_SIZE_M": 8, "A_load_order": 0, "meta_evict_policy": "", "num_warps": 4, "num_ctas": 1, "num_stages": 4}, "(96, 3584, 18944, 64, 8)": {"BLOCK_SIZE_M": 64, "BLOCK_SIZE_N": 32, "BLOCK_SIZE_K": 64, "GROUP_SIZE_M": 8, "A_load_order": 2, "meta_evict_policy": "", "num_warps": 8, "num_ctas": 1, "num_stages": 1}, "(104, 4608, 3584, 64, 8)": {"BLOCK_SIZE_M": 64, "BLOCK_SIZE_N": 32, "BLOCK_SIZE_K": 64, "GROUP_SIZE_M": 8, "A_load_order": 2, "meta_evict_policy": "", "num_warps": 8, "num_ctas": 1, "num_stages": 1}, "(104, 3584, 3584, 64, 8)": {"BLOCK_SIZE_M": 64, "BLOCK_SIZE_N": 32, "BLOCK_SIZE_K": 64, "GROUP_SIZE_M": 8, "A_load_order": 2, "meta_evict_policy": "", "num_warps": 8, "num_ctas": 1, "num_stages": 1}, "(104, 37888, 3584, 64, 8)": {"BLOCK_SIZE_M": 64, "BLOCK_SIZE_N": 64, "BLOCK_SIZE_K": 64, "GROUP_SIZE_M": 8, "A_load_order": 0, "meta_evict_policy": "", "num_warps": 4, "num_ctas": 1, "num_stages": 4}, "(104, 3584, 18944, 64, 8)": {"BLOCK_SIZE_M": 64, "BLOCK_SIZE_N": 32, "BLOCK_SIZE_K": 64, "GROUP_SIZE_M": 8, "A_load_order": 2, "meta_evict_policy": "", "num_warps": 8, "num_ctas": 1, "num_stages": 1}, "(112, 4608, 3584, 64, 8)": {"BLOCK_SIZE_M": 64, "BLOCK_SIZE_N": 32, "BLOCK_SIZE_K": 64, "GROUP_SIZE_M": 8, "A_load_order": 2, "meta_evict_policy": "", "num_warps": 8, "num_ctas": 1, "num_stages": 1}, "(112, 3584, 3584, 64, 8)": {"BLOCK_SIZE_M": 64, "BLOCK_SIZE_N": 32, "BLOCK_SIZE_K": 64, "GROUP_SIZE_M": 8, "A_load_order": 2, "meta_evict_policy": "", "num_warps": 8, "num_ctas": 1, "num_stages": 1}, "(112, 37888, 3584, 64, 8)": {"BLOCK_SIZE_M": 64, "BLOCK_SIZE_N": 64, "BLOCK_SIZE_K": 64, "GROUP_SIZE_M": 8, "A_load_order": 0, "meta_evict_policy": "", "num_warps": 4, "num_ctas": 1, "num_stages": 4}, "(112, 3584, 18944, 64, 8)": {"BLOCK_SIZE_M": 64, "BLOCK_SIZE_N": 32, "BLOCK_SIZE_K": 64, "GROUP_SIZE_M": 8, "A_load_order": 2, "meta_evict_policy": "", "num_warps": 8, "num_ctas": 1, "num_stages": 1}, "(120, 4608, 3584, 64, 8)": {"BLOCK_SIZE_M": 64, "BLOCK_SIZE_N": 32, "BLOCK_SIZE_K": 64, "GROUP_SIZE_M": 8, "A_load_order": 2, "meta_evict_policy": "", "num_warps": 8, "num_ctas": 1, "num_stages": 1}, "(120, 3584, 3584, 64, 8)": {"BLOCK_SIZE_M": 64, "BLOCK_SIZE_N": 32, "BLOCK_SIZE_K": 64, "GROUP_SIZE_M": 8, "A_load_order": 2, "meta_evict_policy": "", "num_warps": 8, "num_ctas": 1, "num_stages": 1}, "(120, 37888, 3584, 64, 8)": {"BLOCK_SIZE_M": 64, "BLOCK_SIZE_N": 64, "BLOCK_SIZE_K": 64, "GROUP_SIZE_M": 8, "A_load_order": 0, "meta_evict_policy": "", "num_warps": 4, "num_ctas": 1, "num_stages": 4}, "(120, 3584, 18944, 64, 8)": {"BLOCK_SIZE_M": 64, "BLOCK_SIZE_N": 32, "BLOCK_SIZE_K": 64, "GROUP_SIZE_M": 8, "A_load_order": 2, "meta_evict_policy": "", "num_warps": 8, "num_ctas": 1, "num_stages": 1}, "(128, 4608, 3584, 64, 8)": {"BLOCK_SIZE_M": 64, "BLOCK_SIZE_N": 32, "BLOCK_SIZE_K": 64, "GROUP_SIZE_M": 8, "A_load_order": 2, "meta_evict_policy": "", "num_warps": 8, "num_ctas": 1, "num_stages": 1}, "(128, 3584, 3584, 64, 8)": {"BLOCK_SIZE_M": 64, "BLOCK_SIZE_N": 32, "BLOCK_SIZE_K": 64, "GROUP_SIZE_M": 8, "A_load_order": 2, "meta_evict_policy": "", "num_warps": 8, "num_ctas": 1, "num_stages": 1}, "(128, 37888, 3584, 64, 8)": {"BLOCK_SIZE_M": 64, "BLOCK_SIZE_N": 64, "BLOCK_SIZE_K": 64, "GROUP_SIZE_M": 8, "A_load_order": 0, "meta_evict_policy": "", "num_warps": 4, "num_ctas": 1, "num_stages": 4}, "(128, 3584, 18944, 64, 8)": {"BLOCK_SIZE_M": 64, "BLOCK_SIZE_N": 32, "BLOCK_SIZE_K": 64, "GROUP_SIZE_M": 8, "A_load_order": 2, "meta_evict_policy": "", "num_warps": 8, "num_ctas": 1, "num_stages": 1}, "(136, 4608, 3584, 64, 8)": {"BLOCK_SIZE_M": 64, "BLOCK_SIZE_N": 32, "BLOCK_SIZE_K": 64, "GROUP_SIZE_M": 8, "A_load_order": 2, "meta_evict_policy": "", "num_warps": 4, "num_ctas": 1, "num_stages": 1}, "(136, 3584, 3584, 64, 8)": {"BLOCK_SIZE_M": 64, "BLOCK_SIZE_N": 32, "BLOCK_SIZE_K": 64, "GROUP_SIZE_M": 8, "A_load_order": 2, "meta_evict_policy": "", "num_warps": 8, "num_ctas": 1, "num_stages": 1}, "(136, 37888, 3584, 64, 8)": {"BLOCK_SIZE_M": 64, "BLOCK_SIZE_N": 64, "BLOCK_SIZE_K": 64, "GROUP_SIZE_M": 8, "A_load_order": 2, "meta_evict_policy": "", "num_warps": 4, "num_ctas": 1, "num_stages": 1}, "(136, 3584, 18944, 64, 8)": {"BLOCK_SIZE_M": 64, "BLOCK_SIZE_N": 32, "BLOCK_SIZE_K": 64, "GROUP_SIZE_M": 8, "A_load_order": 2, "meta_evict_policy": "", "num_warps": 8, "num_ctas": 1, "num_stages": 1}, "(144, 4608, 3584, 64, 8)": {"BLOCK_SIZE_M": 64, "BLOCK_SIZE_N": 32, "BLOCK_SIZE_K": 64, "GROUP_SIZE_M": 8, "A_load_order": 2, "meta_evict_policy": "", "num_warps": 4, "num_ctas": 1, "num_stages": 1}, "(144, 3584, 3584, 64, 8)": {"BLOCK_SIZE_M": 64, "BLOCK_SIZE_N": 32, "BLOCK_SIZE_K": 64, "GROUP_SIZE_M": 8, "A_load_order": 2, "meta_evict_policy": "", "num_warps": 8, "num_ctas": 1, "num_stages": 1}, "(144, 37888, 3584, 64, 8)": {"BLOCK_SIZE_M": 64, "BLOCK_SIZE_N": 64, "BLOCK_SIZE_K": 64, "GROUP_SIZE_M": 8, "A_load_order": 2, "meta_evict_policy": "", "num_warps": 4, "num_ctas": 1, "num_stages": 1}, "(144, 3584, 18944, 64, 8)": {"BLOCK_SIZE_M": 64, "BLOCK_SIZE_N": 32, "BLOCK_SIZE_K": 64, "GROUP_SIZE_M": 8, "A_load_order": 2, "meta_evict_policy": "", "num_warps": 8, "num_ctas": 1, "num_stages": 1}, "(152, 4608, 3584, 64, 8)": {"BLOCK_SIZE_M": 64, "BLOCK_SIZE_N": 32, "BLOCK_SIZE_K": 64, "GROUP_SIZE_M": 8, "A_load_order": 2, "meta_evict_policy": "", "num_warps": 4, "num_ctas": 1, "num_stages": 1}, "(152, 3584, 3584, 64, 8)": {"BLOCK_SIZE_M": 64, "BLOCK_SIZE_N": 32, "BLOCK_SIZE_K": 64, "GROUP_SIZE_M": 8, "A_load_order": 2, "meta_evict_policy": "", "num_warps": 8, "num_ctas": 1, "num_stages": 1}, "(152, 37888, 3584, 64, 8)": {"BLOCK_SIZE_M": 64, "BLOCK_SIZE_N": 64, "BLOCK_SIZE_K": 64, "GROUP_SIZE_M": 8, "A_load_order": 2, "meta_evict_policy": "", "num_warps": 4, "num_ctas": 1, "num_stages": 1}, "(152, 3584, 18944, 64, 8)": {"BLOCK_SIZE_M": 64, "BLOCK_SIZE_N": 32, "BLOCK_SIZE_K": 64, "GROUP_SIZE_M": 8, "A_load_order": 2, "meta_evict_policy": "", "num_warps": 8, "num_ctas": 1, "num_stages": 1}, "(160, 4608, 3584, 64, 8)": {"BLOCK_SIZE_M": 64, "BLOCK_SIZE_N": 32, "BLOCK_SIZE_K": 64, "GROUP_SIZE_M": 8, "A_load_order": 2, "meta_evict_policy": "", "num_warps": 4, "num_ctas": 1, "num_stages": 1}, "(160, 3584, 3584, 64, 8)": {"BLOCK_SIZE_M": 64, "BLOCK_SIZE_N": 32, "BLOCK_SIZE_K": 64, "GROUP_SIZE_M": 8, "A_load_order": 2, "meta_evict_policy": "", "num_warps": 4, "num_ctas": 1, "num_stages": 1}, "(160, 37888, 3584, 64, 8)": {"BLOCK_SIZE_M": 64, "BLOCK_SIZE_N": 64, "BLOCK_SIZE_K": 64, "GROUP_SIZE_M": 8, "A_load_order": 2, "meta_evict_policy": "", "num_warps": 4, "num_ctas": 1, "num_stages": 1}, "(160, 3584, 18944, 64, 8)": {"BLOCK_SIZE_M": 64, "BLOCK_SIZE_N": 32, "BLOCK_SIZE_K": 64, "GROUP_SIZE_M": 8, "A_load_order": 2, "meta_evict_policy": "", "num_warps": 4, "num_ctas": 1, "num_stages": 1}, "(1024, 4608, 3584, 64, 8)": {"BLOCK_SIZE_M": 128, "BLOCK_SIZE_N": 64, "BLOCK_SIZE_K": 64, "GROUP_SIZE_M": 8, "A_load_order": 2, "meta_evict_policy": "", "num_warps": 4, "num_ctas": 1, "num_stages": 4}, "(1024, 3584, 3584, 64, 8)": {"BLOCK_SIZE_M": 128, "BLOCK_SIZE_N": 64, "BLOCK_SIZE_K": 32, "GROUP_SIZE_M": 8, "A_load_order": 0, "meta_evict_policy": "", "num_warps": 4, "num_ctas": 1, "num_stages": 5}, "(1024, 37888, 3584, 64, 8)": {"BLOCK_SIZE_M": 128, "BLOCK_SIZE_N": 64, "BLOCK_SIZE_K": 64, "GROUP_SIZE_M": 8, "A_load_order": 2, "meta_evict_policy": "", "num_warps": 4, "num_ctas": 1, "num_stages": 4}, "(1024, 3584, 18944, 64, 8)": {"BLOCK_SIZE_M": 128, "BLOCK_SIZE_N": 64, "BLOCK_SIZE_K": 32, "GROUP_SIZE_M": 8, "A_load_order": 0, "meta_evict_policy": "", "num_warps": 4, "num_ctas": 1, "num_stages": 5}, "(72, 4608, 3584, 64, 2)": {"BLOCK_SIZE_M": 64, "BLOCK_SIZE_N": 32, "BLOCK_SIZE_K": 64, "GROUP_SIZE_M": 8, "A_load_order": 2, "meta_evict_policy": "", "num_warps": 8, "num_ctas": 1, "num_stages": 1}, "(72, 3584, 3584, 64, 2)": {"BLOCK_SIZE_M": 64, "BLOCK_SIZE_N": 32, "BLOCK_SIZE_K": 64, "GROUP_SIZE_M": 8, "A_load_order": 2, "meta_evict_policy": "", "num_warps": 8, "num_ctas": 1, "num_stages": 1}, "(72, 37888, 3584, 64, 2)": {"BLOCK_SIZE_M": 64, "BLOCK_SIZE_N": 64, "BLOCK_SIZE_K": 64, "GROUP_SIZE_M": 8, "A_load_order": 0, "meta_evict_policy": "", "num_warps": 8, "num_ctas": 1, "num_stages": 1}, "(72, 3584, 18944, 64, 2)": {"BLOCK_SIZE_M": 64, "BLOCK_SIZE_N": 32, "BLOCK_SIZE_K": 64, "GROUP_SIZE_M": 8, "A_load_order": 2, "meta_evict_policy": "", "num_warps": 8, "num_ctas": 1, "num_stages": 1}, "(80, 4608, 3584, 64, 2)": {"BLOCK_SIZE_M": 64, "BLOCK_SIZE_N": 32, "BLOCK_SIZE_K": 64, "GROUP_SIZE_M": 8, "A_load_order": 2, "meta_evict_policy": "", "num_warps": 4, "num_ctas": 1, "num_stages": 1}, "(80, 3584, 3584, 64, 2)": {"BLOCK_SIZE_M": 64, "BLOCK_SIZE_N": 32, "BLOCK_SIZE_K": 64, "GROUP_SIZE_M": 8, "A_load_order": 2, "meta_evict_policy": "", "num_warps": 8, "num_ctas": 1, "num_stages": 1}, "(80, 37888, 3584, 64, 2)": {"BLOCK_SIZE_M": 64, "BLOCK_SIZE_N": 64, "BLOCK_SIZE_K": 64, "GROUP_SIZE_M": 8, "A_load_order": 0, "meta_evict_policy": "", "num_warps": 8, "num_ctas": 1, "num_stages": 1}, "(80, 3584, 18944, 64, 2)": {"BLOCK_SIZE_M": 64, "BLOCK_SIZE_N": 32, "BLOCK_SIZE_K": 64, "GROUP_SIZE_M": 8, "A_load_order": 2, "meta_evict_policy": "", "num_warps": 8, "num_ctas": 1, "num_stages": 1}, "(88, 4608, 3584, 64, 2)": {"BLOCK_SIZE_M": 64, "BLOCK_SIZE_N": 32, "BLOCK_SIZE_K": 64, "GROUP_SIZE_M": 8, "A_load_order": 2, "meta_evict_policy": "", "num_warps": 8, "num_ctas": 1, "num_stages": 1}, "(88, 3584, 3584, 64, 2)": {"BLOCK_SIZE_M": 64, "BLOCK_SIZE_N": 32, "BLOCK_SIZE_K": 64, "GROUP_SIZE_M": 8, "A_load_order": 2, "meta_evict_policy": "", "num_warps": 8, "num_ctas": 1, "num_stages": 1}, "(88, 37888, 3584, 64, 2)": {"BLOCK_SIZE_M": 64, "BLOCK_SIZE_N": 64, "BLOCK_SIZE_K": 64, "GROUP_SIZE_M": 8, "A_load_order": 0, "meta_evict_policy": "", "num_warps": 8, "num_ctas": 1, "num_stages": 1}, "(88, 3584, 18944, 64, 2)": {"BLOCK_SIZE_M": 64, "BLOCK_SIZE_N": 32, "BLOCK_SIZE_K": 64, "GROUP_SIZE_M": 8, "A_load_order": 2, "meta_evict_policy": "", "num_warps": 8, "num_ctas": 1, "num_stages": 1}, "(96, 4608, 3584, 64, 2)": {"BLOCK_SIZE_M": 64, "BLOCK_SIZE_N": 32, "BLOCK_SIZE_K": 64, "GROUP_SIZE_M": 8, "A_load_order": 2, "meta_evict_policy": "", "num_warps": 8, "num_ctas": 1, "num_stages": 1}, "(96, 3584, 3584, 64, 2)": {"BLOCK_SIZE_M": 64, "BLOCK_SIZE_N": 32, "BLOCK_SIZE_K": 64, "GROUP_SIZE_M": 8, "A_load_order": 2, "meta_evict_policy": "", "num_warps": 8, "num_ctas": 1, "num_stages": 1}, "(96, 37888, 3584, 64, 2)": {"BLOCK_SIZE_M": 64, "BLOCK_SIZE_N": 64, "BLOCK_SIZE_K": 64, "GROUP_SIZE_M": 8, "A_load_order": 0, "meta_evict_policy": "", "num_warps": 8, "num_ctas": 1, "num_stages": 1}, "(96, 3584, 18944, 64, 2)": {"BLOCK_SIZE_M": 64, "BLOCK_SIZE_N": 32, "BLOCK_SIZE_K": 64, "GROUP_SIZE_M": 8, "A_load_order": 2, "meta_evict_policy": "", "num_warps": 8, "num_ctas": 1, "num_stages": 1}, "(104, 4608, 3584, 64, 2)": {"BLOCK_SIZE_M": 64, "BLOCK_SIZE_N": 32, "BLOCK_SIZE_K": 64, "GROUP_SIZE_M": 8, "A_load_order": 2, "meta_evict_policy": "", "num_warps": 8, "num_ctas": 1, "num_stages": 1}, "(104, 3584, 3584, 64, 2)": {"BLOCK_SIZE_M": 64, "BLOCK_SIZE_N": 32, "BLOCK_SIZE_K": 64, "GROUP_SIZE_M": 8, "A_load_order": 2, "meta_evict_policy": "", "num_warps": 8, "num_ctas": 1, "num_stages": 1}, "(104, 37888, 3584, 64, 2)": {"BLOCK_SIZE_M": 64, "BLOCK_SIZE_N": 64, "BLOCK_SIZE_K": 64, "GROUP_SIZE_M": 8, "A_load_order": 0, "meta_evict_policy": "", "num_warps": 8, "num_ctas": 1, "num_stages": 1}, "(104, 3584, 18944, 64, 2)": {"BLOCK_SIZE_M": 64, "BLOCK_SIZE_N": 32, "BLOCK_SIZE_K": 64, "GROUP_SIZE_M": 8, "A_load_order": 2, "meta_evict_policy": "", "num_warps": 8, "num_ctas": 1, "num_stages": 1}, "(112, 4608, 3584, 64, 2)": {"BLOCK_SIZE_M": 64, "BLOCK_SIZE_N": 32, "BLOCK_SIZE_K": 64, "GROUP_SIZE_M": 8, "A_load_order": 2, "meta_evict_policy": "", "num_warps": 8, "num_ctas": 1, "num_stages": 1}, "(112, 3584, 3584, 64, 2)": {"BLOCK_SIZE_M": 64, "BLOCK_SIZE_N": 32, "BLOCK_SIZE_K": 64, "GROUP_SIZE_M": 8, "A_load_order": 2, "meta_evict_policy": "", "num_warps": 8, "num_ctas": 1, "num_stages": 1}, "(112, 37888, 3584, 64, 2)": {"BLOCK_SIZE_M": 64, "BLOCK_SIZE_N": 64, "BLOCK_SIZE_K": 64, "GROUP_SIZE_M": 8, "A_load_order": 0, "meta_evict_policy": "", "num_warps": 8, "num_ctas": 1, "num_stages": 1}, "(112, 3584, 18944, 64, 2)": {"BLOCK_SIZE_M": 64, "BLOCK_SIZE_N": 32, "BLOCK_SIZE_K": 64, "GROUP_SIZE_M": 8, "A_load_order": 2, "meta_evict_policy": "", "num_warps": 8, "num_ctas": 1, "num_stages": 1}, "(120, 4608, 3584, 64, 2)": {"BLOCK_SIZE_M": 64, "BLOCK_SIZE_N": 32, "BLOCK_SIZE_K": 64, "GROUP_SIZE_M": 8, "A_load_order": 2, "meta_evict_policy": "", "num_warps": 8, "num_ctas": 1, "num_stages": 1}, "(120, 3584, 3584, 64, 2)": {"BLOCK_SIZE_M": 64, "BLOCK_SIZE_N": 32, "BLOCK_SIZE_K": 64, "GROUP_SIZE_M": 8, "A_load_order": 2, "meta_evict_policy": "", "num_warps": 8, "num_ctas": 1, "num_stages": 1}, "(120, 37888, 3584, 64, 2)": {"BLOCK_SIZE_M": 64, "BLOCK_SIZE_N": 64, "BLOCK_SIZE_K": 64, "GROUP_SIZE_M": 8, "A_load_order": 0, "meta_evict_policy": "", "num_warps": 8, "num_ctas": 1, "num_stages": 1}, "(120, 3584, 18944, 64, 2)": {"BLOCK_SIZE_M": 64, "BLOCK_SIZE_N": 32, "BLOCK_SIZE_K": 64, "GROUP_SIZE_M": 8, "A_load_order": 2, "meta_evict_policy": "", "num_warps": 8, "num_ctas": 1, "num_stages": 1}, "(128, 4608, 3584, 64, 2)": {"BLOCK_SIZE_M": 64, "BLOCK_SIZE_N": 32, "BLOCK_SIZE_K": 64, "GROUP_SIZE_M": 8, "A_load_order": 2, "meta_evict_policy": "", "num_warps": 8, "num_ctas": 1, "num_stages": 1}, "(128, 3584, 3584, 64, 2)": {"BLOCK_SIZE_M": 64, "BLOCK_SIZE_N": 32, "BLOCK_SIZE_K": 64, "GROUP_SIZE_M": 8, "A_load_order": 2, "meta_evict_policy": "", "num_warps": 8, "num_ctas": 1, "num_stages": 1}, "(128, 37888, 3584, 64, 2)": {"BLOCK_SIZE_M": 64, "BLOCK_SIZE_N": 64, "BLOCK_SIZE_K": 64, "GROUP_SIZE_M": 8, "A_load_order": 0, "meta_evict_policy": "", "num_warps": 8, "num_ctas": 1, "num_stages": 1}, "(128, 3584, 18944, 64, 2)": {"BLOCK_SIZE_M": 64, "BLOCK_SIZE_N": 32, "BLOCK_SIZE_K": 64, "GROUP_SIZE_M": 8, "A_load_order": 2, "meta_evict_policy": "", "num_warps": 8, "num_ctas": 1, "num_stages": 1}, "(136, 4608, 3584, 64, 2)": {"BLOCK_SIZE_M": 64, "BLOCK_SIZE_N": 64, "BLOCK_SIZE_K": 64, "GROUP_SIZE_M": 8, "A_load_order": 2, "meta_evict_policy": "", "num_warps": 8, "num_ctas": 1, "num_stages": 1}, "(136, 3584, 3584, 64, 2)": {"BLOCK_SIZE_M": 64, "BLOCK_SIZE_N": 32, "BLOCK_SIZE_K": 64, "GROUP_SIZE_M": 8, "A_load_order": 2, "meta_evict_policy": "", "num_warps": 8, "num_ctas": 1, "num_stages": 1}, "(136, 37888, 3584, 64, 2)": {"BLOCK_SIZE_M": 64, "BLOCK_SIZE_N": 64, "BLOCK_SIZE_K": 64, "GROUP_SIZE_M": 8, "A_load_order": 2, "meta_evict_policy": "", "num_warps": 4, "num_ctas": 1, "num_stages": 1}, "(136, 3584, 18944, 64, 2)": {"BLOCK_SIZE_M": 64, "BLOCK_SIZE_N": 32, "BLOCK_SIZE_K": 64, "GROUP_SIZE_M": 8, "A_load_order": 2, "meta_evict_policy": "", "num_warps": 8, "num_ctas": 1, "num_stages": 1}, "(144, 4608, 3584, 64, 2)": {"BLOCK_SIZE_M": 64, "BLOCK_SIZE_N": 64, "BLOCK_SIZE_K": 64, "GROUP_SIZE_M": 8, "A_load_order": 2, "meta_evict_policy": "", "num_warps": 8, "num_ctas": 1, "num_stages": 1}, "(144, 3584, 3584, 64, 2)": {"BLOCK_SIZE_M": 64, "BLOCK_SIZE_N": 32, "BLOCK_SIZE_K": 64, "GROUP_SIZE_M": 8, "A_load_order": 2, "meta_evict_policy": "", "num_warps": 8, "num_ctas": 1, "num_stages": 1}, "(144, 37888, 3584, 64, 2)": {"BLOCK_SIZE_M": 64, "BLOCK_SIZE_N": 64, "BLOCK_SIZE_K": 64, "GROUP_SIZE_M": 8, "A_load_order": 2, "meta_evict_policy": "", "num_warps": 4, "num_ctas": 1, "num_stages": 1}, "(144, 3584, 18944, 64, 2)": {"BLOCK_SIZE_M": 64, "BLOCK_SIZE_N": 32, "BLOCK_SIZE_K": 64, "GROUP_SIZE_M": 8, "A_load_order": 2, "meta_evict_policy": "", "num_warps": 8, "num_ctas": 1, "num_stages": 1}, "(152, 4608, 3584, 64, 2)": {"BLOCK_SIZE_M": 64, "BLOCK_SIZE_N": 64, "BLOCK_SIZE_K": 64, "GROUP_SIZE_M": 8, "A_load_order": 2, "meta_evict_policy": "", "num_warps": 8, "num_ctas": 1, "num_stages": 1}, "(152, 3584, 3584, 64, 2)": {"BLOCK_SIZE_M": 64, "BLOCK_SIZE_N": 32, "BLOCK_SIZE_K": 64, "GROUP_SIZE_M": 8, "A_load_order": 2, "meta_evict_policy": "", "num_warps": 8, "num_ctas": 1, "num_stages": 1}, "(152, 37888, 3584, 64, 2)": {"BLOCK_SIZE_M": 64, "BLOCK_SIZE_N": 64, "BLOCK_SIZE_K": 64, "GROUP_SIZE_M": 8, "A_load_order": 2, "meta_evict_policy": "", "num_warps": 4, "num_ctas": 1, "num_stages": 4}, "(152, 3584, 18944, 64, 2)": {"BLOCK_SIZE_M": 64, "BLOCK_SIZE_N": 32, "BLOCK_SIZE_K": 64, "GROUP_SIZE_M": 8, "A_load_order": 2, "meta_evict_policy": "", "num_warps": 8, "num_ctas": 1, "num_stages": 1}, "(160, 4608, 3584, 64, 2)": {"BLOCK_SIZE_M": 64, "BLOCK_SIZE_N": 64, "BLOCK_SIZE_K": 64, "GROUP_SIZE_M": 8, "A_load_order": 2, "meta_evict_policy": "", "num_warps": 8, "num_ctas": 1, "num_stages": 1}, "(160, 3584, 3584, 64, 2)": {"BLOCK_SIZE_M": 64, "BLOCK_SIZE_N": 32, "BLOCK_SIZE_K": 64, "GROUP_SIZE_M": 8, "A_load_order": 2, "meta_evict_policy": "", "num_warps": 8, "num_ctas": 1, "num_stages": 1}, "(160, 37888, 3584, 64, 2)": {"BLOCK_SIZE_M": 64, "BLOCK_SIZE_N": 64, "BLOCK_SIZE_K": 64, "GROUP_SIZE_M": 8, "A_load_order": 2, "meta_evict_policy": "", "num_warps": 4, "num_ctas": 1, "num_stages": 5}, "(160, 3584, 18944, 64, 2)": {"BLOCK_SIZE_M": 64, "BLOCK_SIZE_N": 32, "BLOCK_SIZE_K": 64, "GROUP_SIZE_M": 8, "A_load_order": 2, "meta_evict_policy": "", "num_warps": 8, "num_ctas": 1, "num_stages": 1}, "(1024, 4608, 3584, 64, 2)": {"BLOCK_SIZE_M": 128, "BLOCK_SIZE_N": 64, "BLOCK_SIZE_K": 64, "GROUP_SIZE_M": 8, "A_load_order": 0, "meta_evict_policy": "", "num_warps": 4, "num_ctas": 1, "num_stages": 1}, "(1024, 3584, 3584, 64, 2)": {"BLOCK_SIZE_M": 128, "BLOCK_SIZE_N": 128, "BLOCK_SIZE_K": 64, "GROUP_SIZE_M": 8, "A_load_order": 2, "meta_evict_policy": "", "num_warps": 4, "num_ctas": 1, "num_stages": 4}, "(1024, 37888, 3584, 64, 2)": {"BLOCK_SIZE_M": 128, "BLOCK_SIZE_N": 64, "BLOCK_SIZE_K": 64, "GROUP_SIZE_M": 8, "A_load_order": 2, "meta_evict_policy": "", "num_warps": 4, "num_ctas": 1, "num_stages": 4}, "(1024, 3584, 18944, 64, 2)": {"BLOCK_SIZE_M": 128, "BLOCK_SIZE_N": 128, "BLOCK_SIZE_K": 64, "GROUP_SIZE_M": 8, "A_load_order": 2, "meta_evict_policy": "", "num_warps": 4, "num_ctas": 1, "num_stages": 4}, "(32768, 4608, 3584, 64, 8)": {"BLOCK_SIZE_M": 128, "BLOCK_SIZE_N": 64, "BLOCK_SIZE_K": 64, "GROUP_SIZE_M": 8, "A_load_order": 2, "meta_evict_policy": "", "num_warps": 4, "num_ctas": 1, "num_stages": 4}, "(32768, 3584, 3584, 64, 8)": {"BLOCK_SIZE_M": 128, "BLOCK_SIZE_N": 64, "BLOCK_SIZE_K": 64, "GROUP_SIZE_M": 8, "A_load_order": 2, "meta_evict_policy": "", "num_warps": 4, "num_ctas": 1, "num_stages": 4}, "(32768, 37888, 3584, 64, 8)": {"BLOCK_SIZE_M": 128, "BLOCK_SIZE_N": 128, "BLOCK_SIZE_K": 64, "GROUP_SIZE_M": 8, "A_load_order": 0, "meta_evict_policy": "", "num_warps": 8, "num_ctas": 1, "num_stages": 1}, "(32768, 3584, 18944, 64, 8)": {"BLOCK_SIZE_M": 128, "BLOCK_SIZE_N": 128, "BLOCK_SIZE_K": 64, "GROUP_SIZE_M": 8, "A_load_order": 0, "meta_evict_policy": "", "num_warps": 8, "num_ctas": 1, "num_stages": 5}, "(32768, 4608, 3584, 64, 2)": {"BLOCK_SIZE_M": 128, "BLOCK_SIZE_N": 64, "BLOCK_SIZE_K": 64, "GROUP_SIZE_M": 8, "A_load_order": 2, "meta_evict_policy": "", "num_warps": 4, "num_ctas": 1, "num_stages": 4}, "(32768, 3584, 3584, 64, 2)": {"BLOCK_SIZE_M": 128, "BLOCK_SIZE_N": 64, "BLOCK_SIZE_K": 64, "GROUP_SIZE_M": 8, "A_load_order": 2, "meta_evict_policy": "", "num_warps": 4, "num_ctas": 1, "num_stages": 4}, "(32768, 37888, 3584, 64, 2)": {"BLOCK_SIZE_M": 128, "BLOCK_SIZE_N": 64, "BLOCK_SIZE_K": 64, "GROUP_SIZE_M": 8, "A_load_order": 2, "meta_evict_policy": "", "num_warps": 4, "num_ctas": 1, "num_stages": 4}, "(32768, 3584, 18944, 64, 2)": {"BLOCK_SIZE_M": 128, "BLOCK_SIZE_N": 64, "BLOCK_SIZE_K": 64, "GROUP_SIZE_M": 8, "A_load_order": 0, "meta_evict_policy": "", "num_warps": 4, "num_ctas": 1, "num_stages": 4}, "(8192, 6144, 4096, 64, 8)": {"BLOCK_SIZE_M": 128, "BLOCK_SIZE_N": 64, "BLOCK_SIZE_K": 64, "GROUP_SIZE_M": 8, "A_load_order": 2, "meta_evict_policy": "", "num_warps": 4, "num_ctas": 1, "num_stages": 4}, "(8192, 4096, 4096, 64, 8)": {"BLOCK_SIZE_M": 128, "BLOCK_SIZE_N": 64, "BLOCK_SIZE_K": 64, "GROUP_SIZE_M": 8, "A_load_order": 2, "meta_evict_policy": "", "num_warps": 4, "num_ctas": 1, "num_stages": 4}, "(8192, 28672, 4096, 64, 8)": {"BLOCK_SIZE_M": 128, "BLOCK_SIZE_N": 64, "BLOCK_SIZE_K": 64, "GROUP_SIZE_M": 8, "A_load_order": 2, "meta_evict_policy": "", "num_warps": 4, "num_ctas": 1, "num_stages": 4}, "(8192, 4096, 14336, 64, 8)": {"BLOCK_SIZE_M": 128, "BLOCK_SIZE_N": 64, "BLOCK_SIZE_K": 64, "GROUP_SIZE_M": 8, "A_load_order": 2, "meta_evict_policy": "", "num_warps": 4, "num_ctas": 1, "num_stages": 4}, "(16384, 6144, 4096, 64, 8)": {"BLOCK_SIZE_M": 128, "BLOCK_SIZE_N": 64, "BLOCK_SIZE_K": 64, "GROUP_SIZE_M": 8, "A_load_order": 2, "meta_evict_policy": "", "num_warps": 4, "num_ctas": 1, "num_stages": 4}, "(16384, 4096, 4096, 64, 8)": {"BLOCK_SIZE_M": 128, "BLOCK_SIZE_N": 64, "BLOCK_SIZE_K": 64, "GROUP_SIZE_M": 8, "A_load_order": 2, "meta_evict_policy": "", "num_warps": 4, "num_ctas": 1, "num_stages": 4}, "(16384, 28672, 4096, 64, 8)": {"BLOCK_SIZE_M": 128, "BLOCK_SIZE_N": 128, "BLOCK_SIZE_K": 64, "GROUP_SIZE_M": 8, "A_load_order": 0, "meta_evict_policy": "", "num_warps": 8, "num_ctas": 1, "num_stages": 1}, "(16384, 4096, 14336, 64, 8)": {"BLOCK_SIZE_M": 128, "BLOCK_SIZE_N": 64, "BLOCK_SIZE_K": 64, "GROUP_SIZE_M": 8, "A_load_order": 2, "meta_evict_policy": "", "num_warps": 4, "num_ctas": 1, "num_stages": 4}, "(8192, 4608, 3584, 64, 8)": {"BLOCK_SIZE_M": 128, "BLOCK_SIZE_N": 64, "BLOCK_SIZE_K": 64, "GROUP_SIZE_M": 8, "A_load_order": 2, "meta_evict_policy": "", "num_warps": 4, "num_ctas": 1, "num_stages": 4}, "(8192, 3584, 3584, 64, 8)": {"BLOCK_SIZE_M": 128, "BLOCK_SIZE_N": 64, "BLOCK_SIZE_K": 64, "GROUP_SIZE_M": 8, "A_load_order": 2, "meta_evict_policy": "", "num_warps": 4, "num_ctas": 1, "num_stages": 4}, "(8192, 37888, 3584, 64, 8)": {"BLOCK_SIZE_M": 128, "BLOCK_SIZE_N": 64, "BLOCK_SIZE_K": 64, "GROUP_SIZE_M": 8, "A_load_order": 2, "meta_evict_policy": "", "num_warps": 4, "num_ctas": 1, "num_stages": 4}, "(8192, 3584, 18944, 64, 8)": {"BLOCK_SIZE_M": 128, "BLOCK_SIZE_N": 128, "BLOCK_SIZE_K": 64, "GROUP_SIZE_M": 8, "A_load_order": 0, "meta_evict_policy": "", "num_warps": 8, "num_ctas": 1, "num_stages": 5}, "(16384, 4608, 3584, 64, 8)": {"BLOCK_SIZE_M": 128, "BLOCK_SIZE_N": 64, "BLOCK_SIZE_K": 64, "GROUP_SIZE_M": 8, "A_load_order": 2, "meta_evict_policy": "", "num_warps": 4, "num_ctas": 1, "num_stages": 4}, "(16384, 3584, 3584, 64, 8)": {"BLOCK_SIZE_M": 128, "BLOCK_SIZE_N": 64, "BLOCK_SIZE_K": 64, "GROUP_SIZE_M": 8, "A_load_order": 2, "meta_evict_policy": "", "num_warps": 4, "num_ctas": 1, "num_stages": 4}, "(16384, 37888, 3584, 64, 8)": {"BLOCK_SIZE_M": 128, "BLOCK_SIZE_N": 128, "BLOCK_SIZE_K": 64, "GROUP_SIZE_M": 8, "A_load_order": 0, "meta_evict_policy": "", "num_warps": 8, "num_ctas": 1, "num_stages": 1}, "(16384, 3584, 18944, 64, 8)": {"BLOCK_SIZE_M": 128, "BLOCK_SIZE_N": 128, "BLOCK_SIZE_K": 64, "GROUP_SIZE_M": 8, "A_load_order": 0, "meta_evict_policy": "", "num_warps": 8, "num_ctas": 1, "num_stages": 4}, "(72, 6144, 2048, 64, 8)": {"BLOCK_SIZE_M": 64, "BLOCK_SIZE_N": 32, "BLOCK_SIZE_K": 64, "GROUP_SIZE_M": 8, "A_load_order": 2, "meta_evict_policy": "", "num_warps": 4, "num_ctas": 1, "num_stages": 1}, "(72, 2048, 2048, 64, 8)": {"BLOCK_SIZE_M": 64, "BLOCK_SIZE_N": 32, "BLOCK_SIZE_K": 64, "GROUP_SIZE_M": 8, "A_load_order": 2, "meta_evict_policy": "", "num_warps": 8, "num_ctas": 1, "num_stages": 1}, "(72, 11264, 2048, 64, 8)": {"BLOCK_SIZE_M": 64, "BLOCK_SIZE_N": 64, "BLOCK_SIZE_K": 64, "GROUP_SIZE_M": 8, "A_load_order": 2, "meta_evict_policy": "", "num_warps": 4, "num_ctas": 1, "num_stages": 1}, "(72, 2048, 5632, 64, 8)": {"BLOCK_SIZE_M": 64, "BLOCK_SIZE_N": 32, "BLOCK_SIZE_K": 64, "GROUP_SIZE_M": 8, "A_load_order": 2, "meta_evict_policy": "", "num_warps": 8, "num_ctas": 1, "num_stages": 1}, "(80, 6144, 2048, 64, 8)": {"BLOCK_SIZE_M": 64, "BLOCK_SIZE_N": 32, "BLOCK_SIZE_K": 64, "GROUP_SIZE_M": 8, "A_load_order": 2, "meta_evict_policy": "", "num_warps": 4, "num_ctas": 1, "num_stages": 1}, "(80, 2048, 2048, 64, 8)": {"BLOCK_SIZE_M": 64, "BLOCK_SIZE_N": 32, "BLOCK_SIZE_K": 64, "GROUP_SIZE_M": 8, "A_load_order": 2, "meta_evict_policy": "", "num_warps": 8, "num_ctas": 1, "num_stages": 1}, "(80, 11264, 2048, 64, 8)": {"BLOCK_SIZE_M": 64, "BLOCK_SIZE_N": 64, "BLOCK_SIZE_K": 64, "GROUP_SIZE_M": 8, "A_load_order": 2, "meta_evict_policy": "", "num_warps": 4, "num_ctas": 1, "num_stages": 1}, "(80, 2048, 5632, 64, 8)": {"BLOCK_SIZE_M": 64, "BLOCK_SIZE_N": 32, "BLOCK_SIZE_K": 64, "GROUP_SIZE_M": 8, "A_load_order": 2, "meta_evict_policy": "", "num_warps": 8, "num_ctas": 1, "num_stages": 1}, "(88, 6144, 2048, 64, 8)": {"BLOCK_SIZE_M": 64, "BLOCK_SIZE_N": 32, "BLOCK_SIZE_K": 64, "GROUP_SIZE_M": 8, "A_load_order": 2, "meta_evict_policy": "", "num_warps": 4, "num_ctas": 1, "num_stages": 1}, "(88, 2048, 2048, 64, 8)": {"BLOCK_SIZE_M": 64, "BLOCK_SIZE_N": 32, "BLOCK_SIZE_K": 64, "GROUP_SIZE_M": 8, "A_load_order": 2, "meta_evict_policy": "", "num_warps": 8, "num_ctas": 1, "num_stages": 1}, "(88, 11264, 2048, 64, 8)": {"BLOCK_SIZE_M": 64, "BLOCK_SIZE_N": 64, "BLOCK_SIZE_K": 64, "GROUP_SIZE_M": 8, "A_load_order": 2, "meta_evict_policy": "", "num_warps": 4, "num_ctas": 1, "num_stages": 1}, "(88, 2048, 5632, 64, 8)": {"BLOCK_SIZE_M": 64, "BLOCK_SIZE_N": 32, "BLOCK_SIZE_K": 64, "GROUP_SIZE_M": 8, "A_load_order": 2, "meta_evict_policy": "", "num_warps": 8, "num_ctas": 1, "num_stages": 1}, "(96, 6144, 2048, 64, 8)": {"BLOCK_SIZE_M": 64, "BLOCK_SIZE_N": 32, "BLOCK_SIZE_K": 64, "GROUP_SIZE_M": 8, "A_load_order": 2, "meta_evict_policy": "", "num_warps": 4, "num_ctas": 1, "num_stages": 1}, "(96, 2048, 2048, 64, 8)": {"BLOCK_SIZE_M": 64, "BLOCK_SIZE_N": 32, "BLOCK_SIZE_K": 64, "GROUP_SIZE_M": 8, "A_load_order": 2, "meta_evict_policy": "", "num_warps": 8, "num_ctas": 1, "num_stages": 1}, "(96, 11264, 2048, 64, 8)": {"BLOCK_SIZE_M": 64, "BLOCK_SIZE_N": 64, "BLOCK_SIZE_K": 64, "GROUP_SIZE_M": 8, "A_load_order": 2, "meta_evict_policy": "", "num_warps": 4, "num_ctas": 1, "num_stages": 1}, "(96, 2048, 5632, 64, 8)": {"BLOCK_SIZE_M": 64, "BLOCK_SIZE_N": 32, "BLOCK_SIZE_K": 64, "GROUP_SIZE_M": 8, "A_load_order": 2, "meta_evict_policy": "", "num_warps": 8, "num_ctas": 1, "num_stages": 1}, "(104, 6144, 2048, 64, 8)": {"BLOCK_SIZE_M": 64, "BLOCK_SIZE_N": 32, "BLOCK_SIZE_K": 64, "GROUP_SIZE_M": 8, "A_load_order": 2, "meta_evict_policy": "", "num_warps": 4, "num_ctas": 1, "num_stages": 1}, "(104, 2048, 2048, 64, 8)": {"BLOCK_SIZE_M": 64, "BLOCK_SIZE_N": 32, "BLOCK_SIZE_K": 64, "GROUP_SIZE_M": 8, "A_load_order": 2, "meta_evict_policy": "", "num_warps": 8, "num_ctas": 1, "num_stages": 1}, "(104, 11264, 2048, 64, 8)": {"BLOCK_SIZE_M": 64, "BLOCK_SIZE_N": 64, "BLOCK_SIZE_K": 64, "GROUP_SIZE_M": 8, "A_load_order": 2, "meta_evict_policy": "", "num_warps": 4, "num_ctas": 1, "num_stages": 1}, "(104, 2048, 5632, 64, 8)": {"BLOCK_SIZE_M": 64, "BLOCK_SIZE_N": 32, "BLOCK_SIZE_K": 64, "GROUP_SIZE_M": 8, "A_load_order": 2, "meta_evict_policy": "", "num_warps": 8, "num_ctas": 1, "num_stages": 1}, "(112, 6144, 2048, 64, 8)": {"BLOCK_SIZE_M": 64, "BLOCK_SIZE_N": 32, "BLOCK_SIZE_K": 64, "GROUP_SIZE_M": 8, "A_load_order": 2, "meta_evict_policy": "", "num_warps": 4, "num_ctas": 1, "num_stages": 1}, "(112, 2048, 2048, 64, 8)": {"BLOCK_SIZE_M": 64, "BLOCK_SIZE_N": 32, "BLOCK_SIZE_K": 64, "GROUP_SIZE_M": 8, "A_load_order": 2, "meta_evict_policy": "", "num_warps": 8, "num_ctas": 1, "num_stages": 1}, "(112, 11264, 2048, 64, 8)": {"BLOCK_SIZE_M": 64, "BLOCK_SIZE_N": 64, "BLOCK_SIZE_K": 64, "GROUP_SIZE_M": 8, "A_load_order": 2, "meta_evict_policy": "", "num_warps": 4, "num_ctas": 1, "num_stages": 1}, "(112, 2048, 5632, 64, 8)": {"BLOCK_SIZE_M": 64, "BLOCK_SIZE_N": 32, "BLOCK_SIZE_K": 64, "GROUP_SIZE_M": 8, "A_load_order": 2, "meta_evict_policy": "", "num_warps": 8, "num_ctas": 1, "num_stages": 1}, "(120, 6144, 2048, 64, 8)": {"BLOCK_SIZE_M": 64, "BLOCK_SIZE_N": 32, "BLOCK_SIZE_K": 64, "GROUP_SIZE_M": 8, "A_load_order": 2, "meta_evict_policy": "", "num_warps": 4, "num_ctas": 1, "num_stages": 1}, "(120, 2048, 2048, 64, 8)": {"BLOCK_SIZE_M": 64, "BLOCK_SIZE_N": 32, "BLOCK_SIZE_K": 64, "GROUP_SIZE_M": 8, "A_load_order": 2, "meta_evict_policy": "", "num_warps": 8, "num_ctas": 1, "num_stages": 1}, "(120, 11264, 2048, 64, 8)": {"BLOCK_SIZE_M": 64, "BLOCK_SIZE_N": 64, "BLOCK_SIZE_K": 64, "GROUP_SIZE_M": 8, "A_load_order": 2, "meta_evict_policy": "", "num_warps": 4, "num_ctas": 1, "num_stages": 1}, "(120, 2048, 5632, 64, 8)": {"BLOCK_SIZE_M": 64, "BLOCK_SIZE_N": 32, "BLOCK_SIZE_K": 64, "GROUP_SIZE_M": 8, "A_load_order": 2, "meta_evict_policy": "", "num_warps": 8, "num_ctas": 1, "num_stages": 1}, "(128, 6144, 2048, 64, 8)": {"BLOCK_SIZE_M": 64, "BLOCK_SIZE_N": 32, "BLOCK_SIZE_K": 64, "GROUP_SIZE_M": 8, "A_load_order": 2, "meta_evict_policy": "", "num_warps": 4, "num_ctas": 1, "num_stages": 1}, "(128, 2048, 2048, 64, 8)": {"BLOCK_SIZE_M": 64, "BLOCK_SIZE_N": 32, "BLOCK_SIZE_K": 64, "GROUP_SIZE_M": 8, "A_load_order": 2, "meta_evict_policy": "", "num_warps": 8, "num_ctas": 1, "num_stages": 1}, "(128, 11264, 2048, 64, 8)": {"BLOCK_SIZE_M": 64, "BLOCK_SIZE_N": 64, "BLOCK_SIZE_K": 64, "GROUP_SIZE_M": 8, "A_load_order": 2, "meta_evict_policy": "", "num_warps": 4, "num_ctas": 1, "num_stages": 1}, "(128, 2048, 5632, 64, 8)": {"BLOCK_SIZE_M": 64, "BLOCK_SIZE_N": 32, "BLOCK_SIZE_K": 64, "GROUP_SIZE_M": 8, "A_load_order": 2, "meta_evict_policy": "", "num_warps": 8, "num_ctas": 1, "num_stages": 1}, "(136, 6144, 2048, 64, 8)": {"BLOCK_SIZE_M": 64, "BLOCK_SIZE_N": 64, "BLOCK_SIZE_K": 64, "GROUP_SIZE_M": 8, "A_load_order": 2, "meta_evict_policy": "", "num_warps": 4, "num_ctas": 1, "num_stages": 1}, "(136, 2048, 2048, 64, 8)": {"BLOCK_SIZE_M": 64, "BLOCK_SIZE_N": 32, "BLOCK_SIZE_K": 64, "GROUP_SIZE_M": 8, "A_load_order": 2, "meta_evict_policy": "", "num_warps": 8, "num_ctas": 1, "num_stages": 1}, "(136, 11264, 2048, 64, 8)": {"BLOCK_SIZE_M": 64, "BLOCK_SIZE_N": 64, "BLOCK_SIZE_K": 64, "GROUP_SIZE_M": 8, "A_load_order": 0, "meta_evict_policy": "", "num_warps": 4, "num_ctas": 1, "num_stages": 4}, "(136, 2048, 5632, 64, 8)": {"BLOCK_SIZE_M": 64, "BLOCK_SIZE_N": 32, "BLOCK_SIZE_K": 64, "GROUP_SIZE_M": 8, "A_load_order": 2, "meta_evict_policy": "", "num_warps": 8, "num_ctas": 1, "num_stages": 1}, "(144, 6144, 2048, 64, 8)": {"BLOCK_SIZE_M": 64, "BLOCK_SIZE_N": 64, "BLOCK_SIZE_K": 64, "GROUP_SIZE_M": 8, "A_load_order": 2, "meta_evict_policy": "", "num_warps": 4, "num_ctas": 1, "num_stages": 1}, "(144, 2048, 2048, 64, 8)": {"BLOCK_SIZE_M": 64, "BLOCK_SIZE_N": 32, "BLOCK_SIZE_K": 64, "GROUP_SIZE_M": 8, "A_load_order": 2, "meta_evict_policy": "", "num_warps": 8, "num_ctas": 1, "num_stages": 1}, "(144, 11264, 2048, 64, 8)": {"BLOCK_SIZE_M": 64, "BLOCK_SIZE_N": 64, "BLOCK_SIZE_K": 64, "GROUP_SIZE_M": 8, "A_load_order": 0, "meta_evict_policy": "", "num_warps": 4, "num_ctas": 1, "num_stages": 4}, "(144, 2048, 5632, 64, 8)": {"BLOCK_SIZE_M": 64, "BLOCK_SIZE_N": 32, "BLOCK_SIZE_K": 64, "GROUP_SIZE_M": 8, "A_load_order": 2, "meta_evict_policy": "", "num_warps": 8, "num_ctas": 1, "num_stages": 1}, "(152, 6144, 2048, 64, 8)": {"BLOCK_SIZE_M": 64, "BLOCK_SIZE_N": 64, "BLOCK_SIZE_K": 64, "GROUP_SIZE_M": 8, "A_load_order": 2, "meta_evict_policy": "", "num_warps": 4, "num_ctas": 1, "num_stages": 1}, "(152, 2048, 2048, 64, 8)": {"BLOCK_SIZE_M": 64, "BLOCK_SIZE_N": 32, "BLOCK_SIZE_K": 64, "GROUP_SIZE_M": 8, "A_load_order": 2, "meta_evict_policy": "", "num_warps": 8, "num_ctas": 1, "num_stages": 1}, "(152, 11264, 2048, 64, 8)": {"BLOCK_SIZE_M": 64, "BLOCK_SIZE_N": 64, "BLOCK_SIZE_K": 64, "GROUP_SIZE_M": 8, "A_load_order": 0, "meta_evict_policy": "", "num_warps": 4, "num_ctas": 1, "num_stages": 4}, "(152, 2048, 5632, 64, 8)": {"BLOCK_SIZE_M": 64, "BLOCK_SIZE_N": 32, "BLOCK_SIZE_K": 64, "GROUP_SIZE_M": 8, "A_load_order": 2, "meta_evict_policy": "", "num_warps": 8, "num_ctas": 1, "num_stages": 1}, "(160, 6144, 2048, 64, 8)": {"BLOCK_SIZE_M": 64, "BLOCK_SIZE_N": 64, "BLOCK_SIZE_K": 64, "GROUP_SIZE_M": 8, "A_load_order": 2, "meta_evict_policy": "", "num_warps": 4, "num_ctas": 1, "num_stages": 1}, "(160, 2048, 2048, 64, 8)": {"BLOCK_SIZE_M": 64, "BLOCK_SIZE_N": 32, "BLOCK_SIZE_K": 64, "GROUP_SIZE_M": 8, "A_load_order": 2, "meta_evict_policy": "", "num_warps": 8, "num_ctas": 1, "num_stages": 1}, "(160, 11264, 2048, 64, 8)": {"BLOCK_SIZE_M": 64, "BLOCK_SIZE_N": 64, "BLOCK_SIZE_K": 64, "GROUP_SIZE_M": 8, "A_load_order": 0, "meta_evict_policy": "", "num_warps": 4, "num_ctas": 1, "num_stages": 4}, "(160, 2048, 5632, 64, 8)": {"BLOCK_SIZE_M": 64, "BLOCK_SIZE_N": 32, "BLOCK_SIZE_K": 64, "GROUP_SIZE_M": 8, "A_load_order": 2, "meta_evict_policy": "", "num_warps": 8, "num_ctas": 1, "num_stages": 1}, "(1024, 6144, 2048, 64, 8)": {"BLOCK_SIZE_M": 128, "BLOCK_SIZE_N": 128, "BLOCK_SIZE_K": 64, "GROUP_SIZE_M": 8, "A_load_order": 0, "meta_evict_policy": "", "num_warps": 8, "num_ctas": 1, "num_stages": 4}, "(1024, 2048, 2048, 64, 8)": {"BLOCK_SIZE_M": 128, "BLOCK_SIZE_N": 64, "BLOCK_SIZE_K": 64, "GROUP_SIZE_M": 8, "A_load_order": 2, "meta_evict_policy": "", "num_warps": 4, "num_ctas": 1, "num_stages": 4}, "(1024, 11264, 2048, 64, 8)": {"BLOCK_SIZE_M": 128, "BLOCK_SIZE_N": 64, "BLOCK_SIZE_K": 64, "GROUP_SIZE_M": 8, "A_load_order": 2, "meta_evict_policy": "", "num_warps": 4, "num_ctas": 1, "num_stages": 4}, "(1024, 2048, 5632, 64, 8)": {"BLOCK_SIZE_M": 128, "BLOCK_SIZE_N": 64, "BLOCK_SIZE_K": 64, "GROUP_SIZE_M": 8, "A_load_order": 2, "meta_evict_policy": "", "num_warps": 4, "num_ctas": 1, "num_stages": 4}, "(8192, 6144, 2048, 64, 8)": {"BLOCK_SIZE_M": 128, "BLOCK_SIZE_N": 128, "BLOCK_SIZE_K": 64, "GROUP_SIZE_M": 8, "A_load_order": 0, "meta_evict_policy": "", "num_warps": 8, "num_ctas": 1, "num_stages": 4}, "(8192, 2048, 2048, 64, 8)": {"BLOCK_SIZE_M": 128, "BLOCK_SIZE_N": 128, "BLOCK_SIZE_K": 64, "GROUP_SIZE_M": 8, "A_load_order": 0, "meta_evict_policy": "", "num_warps": 8, "num_ctas": 1, "num_stages": 5}, "(8192, 11264, 2048, 64, 8)": {"BLOCK_SIZE_M": 128, "BLOCK_SIZE_N": 128, "BLOCK_SIZE_K": 64, "GROUP_SIZE_M": 8, "A_load_order": 0, "meta_evict_policy": "", "num_warps": 8, "num_ctas": 1, "num_stages": 4}, "(8192, 2048, 5632, 64, 8)": {"BLOCK_SIZE_M": 128, "BLOCK_SIZE_N": 128, "BLOCK_SIZE_K": 64, "GROUP_SIZE_M": 8, "A_load_order": 0, "meta_evict_policy": "", "num_warps": 8, "num_ctas": 1, "num_stages": 4}, "(16384, 6144, 2048, 64, 8)": {"BLOCK_SIZE_M": 128, "BLOCK_SIZE_N": 128, "BLOCK_SIZE_K": 64, "GROUP_SIZE_M": 8, "A_load_order": 0, "meta_evict_policy": "", "num_warps": 8, "num_ctas": 1, "num_stages": 5}, "(16384, 2048, 2048, 64, 8)": {"BLOCK_SIZE_M": 128, "BLOCK_SIZE_N": 128, "BLOCK_SIZE_K": 64, "GROUP_SIZE_M": 8, "A_load_order": 0, "meta_evict_policy": "", "num_warps": 8, "num_ctas": 1, "num_stages": 4}, "(16384, 11264, 2048, 64, 8)": {"BLOCK_SIZE_M": 128, "BLOCK_SIZE_N": 128, "BLOCK_SIZE_K": 64, "GROUP_SIZE_M": 8, "A_load_order": 0, "meta_evict_policy": "", "num_warps": 8, "num_ctas": 1, "num_stages": 4}, "(16384, 2048, 5632, 64, 8)": {"BLOCK_SIZE_M": 128, "BLOCK_SIZE_N": 128, "BLOCK_SIZE_K": 64, "GROUP_SIZE_M": 8, "A_load_order": 0, "meta_evict_policy": "", "num_warps": 8, "num_ctas": 1, "num_stages": 4}, "(32768, 6144, 2048, 64, 8)": {"BLOCK_SIZE_M": 128, "BLOCK_SIZE_N": 128, "BLOCK_SIZE_K": 64, "GROUP_SIZE_M": 8, "A_load_order": 0, "meta_evict_policy": "", "num_warps": 8, "num_ctas": 1, "num_stages": 5}, "(32768, 2048, 2048, 64, 8)": {"BLOCK_SIZE_M": 128, "BLOCK_SIZE_N": 128, "BLOCK_SIZE_K": 64, "GROUP_SIZE_M": 8, "A_load_order": 0, "meta_evict_policy": "", "num_warps": 8, "num_ctas": 1, "num_stages": 4}, "(32768, 11264, 2048, 64, 8)": {"BLOCK_SIZE_M": 128, "BLOCK_SIZE_N": 128, "BLOCK_SIZE_K": 64, "GROUP_SIZE_M": 8, "A_load_order": 0, "meta_evict_policy": "", "num_warps": 8, "num_ctas": 1, "num_stages": 4}, "(32768, 2048, 5632, 64, 8)": {"BLOCK_SIZE_M": 128, "BLOCK_SIZE_N": 128, "BLOCK_SIZE_K": 64, "GROUP_SIZE_M": 8, "A_load_order": 0, "meta_evict_policy": "", "num_warps": 8, "num_ctas": 1, "num_stages": 4}, "(2048, 6144, 4096, 64, 8)": {"BLOCK_SIZE_M": 128, "BLOCK_SIZE_N": 128, "BLOCK_SIZE_K": 64, "GROUP_SIZE_M": 8, "A_load_order": 2, "meta_evict_policy": "", "num_warps": 8, "num_ctas": 1, "num_stages": 1}, "(2048, 4096, 4096, 64, 8)": {"BLOCK_SIZE_M": 128, "BLOCK_SIZE_N": 128, "BLOCK_SIZE_K": 64, "GROUP_SIZE_M": 8, "A_load_order": 2, "meta_evict_policy": "", "num_warps": 8, "num_ctas": 1, "num_stages": 1}, "(2048, 28672, 4096, 64, 8)": {"BLOCK_SIZE_M": 128, "BLOCK_SIZE_N": 128, "BLOCK_SIZE_K": 64, "GROUP_SIZE_M": 8, "A_load_order": 2, "meta_evict_policy": "", "num_warps": 8, "num_ctas": 1, "num_stages": 1}, "(2048, 4096, 14336, 64, 8)": {"BLOCK_SIZE_M": 128, "BLOCK_SIZE_N": 128, "BLOCK_SIZE_K": 64, "GROUP_SIZE_M": 8, "A_load_order": 2, "meta_evict_policy": "", "num_warps": 8, "num_ctas": 1, "num_stages": 1}, "(4096, 6144, 4096, 64, 8)": {"BLOCK_SIZE_M": 128, "BLOCK_SIZE_N": 128, "BLOCK_SIZE_K": 64, "GROUP_SIZE_M": 8, "A_load_order": 2, "meta_evict_policy": "", "num_warps": 8, "num_ctas": 1, "num_stages": 1}, "(4096, 4096, 4096, 64, 8)": {"BLOCK_SIZE_M": 128, "BLOCK_SIZE_N": 128, "BLOCK_SIZE_K": 64, "GROUP_SIZE_M": 8, "A_load_order": 2, "meta_evict_policy": "", "num_warps": 8, "num_ctas": 1, "num_stages": 1}, "(4096, 28672, 4096, 64, 8)": {"BLOCK_SIZE_M": 128, "BLOCK_SIZE_N": 128, "BLOCK_SIZE_K": 64, "GROUP_SIZE_M": 8, "A_load_order": 2, "meta_evict_policy": "", "num_warps": 8, "num_ctas": 1, "num_stages": 1}, "(4096, 4096, 14336, 64, 8)": {"BLOCK_SIZE_M": 128, "BLOCK_SIZE_N": 128, "BLOCK_SIZE_K": 64, "GROUP_SIZE_M": 8, "A_load_order": 0, "meta_evict_policy": "", "num_warps": 8, "num_ctas": 1, "num_stages": 4}, "(72, 3072, 4096, 64, 8)": {"BLOCK_SIZE_M": 64, "BLOCK_SIZE_N": 32, "BLOCK_SIZE_K": 64, "GROUP_SIZE_M": 8, "A_load_order": 2, "meta_evict_policy": "", "num_warps": 8, "num_ctas": 1, "num_stages": 1}, "(72, 4096, 2048, 64, 8)": {"BLOCK_SIZE_M": 64, "BLOCK_SIZE_N": 32, "BLOCK_SIZE_K": 64, "GROUP_SIZE_M": 8, "A_load_order": 2, "meta_evict_policy": "", "num_warps": 8, "num_ctas": 1, "num_stages": 1}, "(72, 14336, 4096, 64, 8)": {"BLOCK_SIZE_M": 64, "BLOCK_SIZE_N": 64, "BLOCK_SIZE_K": 64, "GROUP_SIZE_M": 8, "A_load_order": 2, "meta_evict_policy": "", "num_warps": 4, "num_ctas": 1, "num_stages": 1}, "(72, 4096, 7168, 64, 8)": {"BLOCK_SIZE_M": 64, "BLOCK_SIZE_N": 32, "BLOCK_SIZE_K": 64, "GROUP_SIZE_M": 8, "A_load_order": 2, "meta_evict_policy": "", "num_warps": 8, "num_ctas": 1, "num_stages": 1}, "(80, 3072, 4096, 64, 8)": {"BLOCK_SIZE_M": 64, "BLOCK_SIZE_N": 32, "BLOCK_SIZE_K": 64, "GROUP_SIZE_M": 8, "A_load_order": 2, "meta_evict_policy": "", "num_warps": 8, "num_ctas": 1, "num_stages": 1}, "(80, 4096, 2048, 64, 8)": {"BLOCK_SIZE_M": 64, "BLOCK_SIZE_N": 32, "BLOCK_SIZE_K": 64, "GROUP_SIZE_M": 8, "A_load_order": 2, "meta_evict_policy": "", "num_warps": 8, "num_ctas": 1, "num_stages": 1}, "(80, 14336, 4096, 64, 8)": {"BLOCK_SIZE_M": 64, "BLOCK_SIZE_N": 64, "BLOCK_SIZE_K": 64, "GROUP_SIZE_M": 8, "A_load_order": 2, "meta_evict_policy": "", "num_warps": 4, "num_ctas": 1, "num_stages": 1}, "(80, 4096, 7168, 64, 8)": {"BLOCK_SIZE_M": 64, "BLOCK_SIZE_N": 32, "BLOCK_SIZE_K": 64, "GROUP_SIZE_M": 8, "A_load_order": 2, "meta_evict_policy": "", "num_warps": 8, "num_ctas": 1, "num_stages": 1}, "(88, 3072, 4096, 64, 8)": {"BLOCK_SIZE_M": 64, "BLOCK_SIZE_N": 32, "BLOCK_SIZE_K": 64, "GROUP_SIZE_M": 8, "A_load_order": 2, "meta_evict_policy": "", "num_warps": 8, "num_ctas": 1, "num_stages": 1}, "(88, 4096, 2048, 64, 8)": {"BLOCK_SIZE_M": 64, "BLOCK_SIZE_N": 32, "BLOCK_SIZE_K": 64, "GROUP_SIZE_M": 8, "A_load_order": 2, "meta_evict_policy": "", "num_warps": 8, "num_ctas": 1, "num_stages": 1}, "(88, 14336, 4096, 64, 8)": {"BLOCK_SIZE_M": 64, "BLOCK_SIZE_N": 64, "BLOCK_SIZE_K": 64, "GROUP_SIZE_M": 8, "A_load_order": 2, "meta_evict_policy": "", "num_warps": 4, "num_ctas": 1, "num_stages": 1}, "(88, 4096, 7168, 64, 8)": {"BLOCK_SIZE_M": 64, "BLOCK_SIZE_N": 32, "BLOCK_SIZE_K": 64, "GROUP_SIZE_M": 8, "A_load_order": 2, "meta_evict_policy": "", "num_warps": 8, "num_ctas": 1, "num_stages": 1}, "(96, 3072, 4096, 64, 8)": {"BLOCK_SIZE_M": 64, "BLOCK_SIZE_N": 32, "BLOCK_SIZE_K": 64, "GROUP_SIZE_M": 8, "A_load_order": 2, "meta_evict_policy": "", "num_warps": 8, "num_ctas": 1, "num_stages": 1}, "(96, 4096, 2048, 64, 8)": {"BLOCK_SIZE_M": 64, "BLOCK_SIZE_N": 32, "BLOCK_SIZE_K": 64, "GROUP_SIZE_M": 8, "A_load_order": 2, "meta_evict_policy": "", "num_warps": 8, "num_ctas": 1, "num_stages": 1}, "(96, 14336, 4096, 64, 8)": {"BLOCK_SIZE_M": 64, "BLOCK_SIZE_N": 64, "BLOCK_SIZE_K": 64, "GROUP_SIZE_M": 8, "A_load_order": 2, "meta_evict_policy": "", "num_warps": 4, "num_ctas": 1, "num_stages": 1}, "(96, 4096, 7168, 64, 8)": {"BLOCK_SIZE_M": 64, "BLOCK_SIZE_N": 32, "BLOCK_SIZE_K": 64, "GROUP_SIZE_M": 8, "A_load_order": 2, "meta_evict_policy": "", "num_warps": 8, "num_ctas": 1, "num_stages": 1}, "(104, 3072, 4096, 64, 8)": {"BLOCK_SIZE_M": 64, "BLOCK_SIZE_N": 32, "BLOCK_SIZE_K": 64, "GROUP_SIZE_M": 8, "A_load_order": 2, "meta_evict_policy": "", "num_warps": 8, "num_ctas": 1, "num_stages": 1}, "(104, 4096, 2048, 64, 8)": {"BLOCK_SIZE_M": 64, "BLOCK_SIZE_N": 32, "BLOCK_SIZE_K": 64, "GROUP_SIZE_M": 8, "A_load_order": 2, "meta_evict_policy": "", "num_warps": 8, "num_ctas": 1, "num_stages": 1}, "(104, 14336, 4096, 64, 8)": {"BLOCK_SIZE_M": 64, "BLOCK_SIZE_N": 64, "BLOCK_SIZE_K": 64, "GROUP_SIZE_M": 8, "A_load_order": 2, "meta_evict_policy": "", "num_warps": 4, "num_ctas": 1, "num_stages": 1}, "(104, 4096, 7168, 64, 8)": {"BLOCK_SIZE_M": 64, "BLOCK_SIZE_N": 32, "BLOCK_SIZE_K": 64, "GROUP_SIZE_M": 8, "A_load_order": 2, "meta_evict_policy": "", "num_warps": 8, "num_ctas": 1, "num_stages": 1}, "(112, 3072, 4096, 64, 8)": {"BLOCK_SIZE_M": 64, "BLOCK_SIZE_N": 32, "BLOCK_SIZE_K": 64, "GROUP_SIZE_M": 8, "A_load_order": 2, "meta_evict_policy": "", "num_warps": 8, "num_ctas": 1, "num_stages": 1}, "(112, 4096, 2048, 64, 8)": {"BLOCK_SIZE_M": 64, "BLOCK_SIZE_N": 32, "BLOCK_SIZE_K": 64, "GROUP_SIZE_M": 8, "A_load_order": 2, "meta_evict_policy": "", "num_warps": 8, "num_ctas": 1, "num_stages": 1}, "(112, 14336, 4096, 64, 8)": {"BLOCK_SIZE_M": 64, "BLOCK_SIZE_N": 64, "BLOCK_SIZE_K": 64, "GROUP_SIZE_M": 8, "A_load_order": 2, "meta_evict_policy": "", "num_warps": 4, "num_ctas": 1, "num_stages": 1}, "(112, 4096, 7168, 64, 8)": {"BLOCK_SIZE_M": 64, "BLOCK_SIZE_N": 32, "BLOCK_SIZE_K": 64, "GROUP_SIZE_M": 8, "A_load_order": 2, "meta_evict_policy": "", "num_warps": 8, "num_ctas": 1, "num_stages": 1}, "(120, 3072, 4096, 64, 8)": {"BLOCK_SIZE_M": 64, "BLOCK_SIZE_N": 32, "BLOCK_SIZE_K": 64, "GROUP_SIZE_M": 8, "A_load_order": 2, "meta_evict_policy": "", "num_warps": 8, "num_ctas": 1, "num_stages": 1}, "(120, 4096, 2048, 64, 8)": {"BLOCK_SIZE_M": 64, "BLOCK_SIZE_N": 32, "BLOCK_SIZE_K": 64, "GROUP_SIZE_M": 8, "A_load_order": 2, "meta_evict_policy": "", "num_warps": 8, "num_ctas": 1, "num_stages": 1}, "(120, 14336, 4096, 64, 8)": {"BLOCK_SIZE_M": 64, "BLOCK_SIZE_N": 64, "BLOCK_SIZE_K": 64, "GROUP_SIZE_M": 8, "A_load_order": 2, "meta_evict_policy": "", "num_warps": 4, "num_ctas": 1, "num_stages": 1}, "(120, 4096, 7168, 64, 8)": {"BLOCK_SIZE_M": 64, "BLOCK_SIZE_N": 32, "BLOCK_SIZE_K": 64, "GROUP_SIZE_M": 8, "A_load_order": 2, "meta_evict_policy": "", "num_warps": 8, "num_ctas": 1, "num_stages": 1}, "(128, 3072, 4096, 64, 8)": {"BLOCK_SIZE_M": 64, "BLOCK_SIZE_N": 32, "BLOCK_SIZE_K": 64, "GROUP_SIZE_M": 8, "A_load_order": 2, "meta_evict_policy": "", "num_warps": 8, "num_ctas": 1, "num_stages": 1}, "(128, 4096, 2048, 64, 8)": {"BLOCK_SIZE_M": 64, "BLOCK_SIZE_N": 32, "BLOCK_SIZE_K": 64, "GROUP_SIZE_M": 8, "A_load_order": 2, "meta_evict_policy": "", "num_warps": 8, "num_ctas": 1, "num_stages": 1}, "(128, 14336, 4096, 64, 8)": {"BLOCK_SIZE_M": 64, "BLOCK_SIZE_N": 64, "BLOCK_SIZE_K": 64, "GROUP_SIZE_M": 8, "A_load_order": 2, "meta_evict_policy": "", "num_warps": 4, "num_ctas": 1, "num_stages": 1}, "(128, 4096, 7168, 64, 8)": {"BLOCK_SIZE_M": 64, "BLOCK_SIZE_N": 32, "BLOCK_SIZE_K": 64, "GROUP_SIZE_M": 8, "A_load_order": 2, "meta_evict_policy": "", "num_warps": 8, "num_ctas": 1, "num_stages": 1}, "(136, 3072, 4096, 64, 8)": {"BLOCK_SIZE_M": 64, "BLOCK_SIZE_N": 64, "BLOCK_SIZE_K": 64, "GROUP_SIZE_M": 8, "A_load_order": 2, "meta_evict_policy": "", "num_warps": 8, "num_ctas": 1, "num_stages": 1}, "(136, 4096, 2048, 64, 8)": {"BLOCK_SIZE_M": 64, "BLOCK_SIZE_N": 64, "BLOCK_SIZE_K": 64, "GROUP_SIZE_M": 8, "A_load_order": 2, "meta_evict_policy": "", "num_warps": 8, "num_ctas": 1, "num_stages": 1}, "(136, 14336, 4096, 64, 8)": {"BLOCK_SIZE_M": 64, "BLOCK_SIZE_N": 128, "BLOCK_SIZE_K": 64, "GROUP_SIZE_M": 8, "A_load_order": 0, "meta_evict_policy": "", "num_warps": 8, "num_ctas": 1, "num_stages": 1}, "(136, 4096, 7168, 64, 8)": {"BLOCK_SIZE_M": 64, "BLOCK_SIZE_N": 32, "BLOCK_SIZE_K": 64, "GROUP_SIZE_M": 8, "A_load_order": 2, "meta_evict_policy": "", "num_warps": 4, "num_ctas": 1, "num_stages": 1}, "(144, 3072, 4096, 64, 8)": {"BLOCK_SIZE_M": 64, "BLOCK_SIZE_N": 64, "BLOCK_SIZE_K": 64, "GROUP_SIZE_M": 8, "A_load_order": 2, "meta_evict_policy": "", "num_warps": 8, "num_ctas": 1, "num_stages": 1}, "(144, 4096, 2048, 64, 8)": {"BLOCK_SIZE_M": 64, "BLOCK_SIZE_N": 64, "BLOCK_SIZE_K": 64, "GROUP_SIZE_M": 8, "A_load_order": 2, "meta_evict_policy": "", "num_warps": 8, "num_ctas": 1, "num_stages": 1}, "(144, 14336, 4096, 64, 8)": {"BLOCK_SIZE_M": 64, "BLOCK_SIZE_N": 128, "BLOCK_SIZE_K": 64, "GROUP_SIZE_M": 8, "A_load_order": 0, "meta_evict_policy": "", "num_warps": 8, "num_ctas": 1, "num_stages": 1}, "(144, 4096, 7168, 64, 8)": {"BLOCK_SIZE_M": 64, "BLOCK_SIZE_N": 32, "BLOCK_SIZE_K": 64, "GROUP_SIZE_M": 8, "A_load_order": 2, "meta_evict_policy": "", "num_warps": 4, "num_ctas": 1, "num_stages": 1}, "(152, 3072, 4096, 64, 8)": {"BLOCK_SIZE_M": 64, "BLOCK_SIZE_N": 64, "BLOCK_SIZE_K": 64, "GROUP_SIZE_M": 8, "A_load_order": 2, "meta_evict_policy": "", "num_warps": 8, "num_ctas": 1, "num_stages": 1}, "(152, 4096, 2048, 64, 8)": {"BLOCK_SIZE_M": 64, "BLOCK_SIZE_N": 64, "BLOCK_SIZE_K": 64, "GROUP_SIZE_M": 8, "A_load_order": 2, "meta_evict_policy": "", "num_warps": 8, "num_ctas": 1, "num_stages": 1}, "(152, 14336, 4096, 64, 8)": {"BLOCK_SIZE_M": 64, "BLOCK_SIZE_N": 128, "BLOCK_SIZE_K": 64, "GROUP_SIZE_M": 8, "A_load_order": 0, "meta_evict_policy": "", "num_warps": 8, "num_ctas": 1, "num_stages": 1}, "(152, 4096, 7168, 64, 8)": {"BLOCK_SIZE_M": 64, "BLOCK_SIZE_N": 64, "BLOCK_SIZE_K": 64, "GROUP_SIZE_M": 8, "A_load_order": 2, "meta_evict_policy": "", "num_warps": 8, "num_ctas": 1, "num_stages": 1}, "(160, 3072, 4096, 64, 8)": {"BLOCK_SIZE_M": 64, "BLOCK_SIZE_N": 64, "BLOCK_SIZE_K": 64, "GROUP_SIZE_M": 8, "A_load_order": 2, "meta_evict_policy": "", "num_warps": 8, "num_ctas": 1, "num_stages": 1}, "(160, 4096, 2048, 64, 8)": {"BLOCK_SIZE_M": 64, "BLOCK_SIZE_N": 64, "BLOCK_SIZE_K": 64, "GROUP_SIZE_M": 8, "A_load_order": 2, "meta_evict_policy": "", "num_warps": 8, "num_ctas": 1, "num_stages": 1}, "(160, 14336, 4096, 64, 8)": {"BLOCK_SIZE_M": 64, "BLOCK_SIZE_N": 128, "BLOCK_SIZE_K": 64, "GROUP_SIZE_M": 8, "A_load_order": 0, "meta_evict_policy": "", "num_warps": 8, "num_ctas": 1, "num_stages": 1}, "(160, 4096, 7168, 64, 8)": {"BLOCK_SIZE_M": 64, "BLOCK_SIZE_N": 64, "BLOCK_SIZE_K": 64, "GROUP_SIZE_M": 8, "A_load_order": 2, "meta_evict_policy": "", "num_warps": 8, "num_ctas": 1, "num_stages": 1}, "(72, 1536, 4096, 64, 8)": {"BLOCK_SIZE_M": 64, "BLOCK_SIZE_N": 32, "BLOCK_SIZE_K": 64, "GROUP_SIZE_M": 8, "A_load_order": 2, "meta_evict_policy": "", "num_warps": 8, "num_ctas": 1, "num_stages": 1}, "(72, 4096, 1024, 64, 8)": {"BLOCK_SIZE_M": 64, "BLOCK_SIZE_N": 32, "BLOCK_SIZE_K": 64, "GROUP_SIZE_M": 8, "A_load_order": 2, "meta_evict_policy": "", "num_warps": 8, "num_ctas": 1, "num_stages": 1}, "(72, 7168, 4096, 64, 8)": {"BLOCK_SIZE_M": 64, "BLOCK_SIZE_N": 64, "BLOCK_SIZE_K": 64, "GROUP_SIZE_M": 8, "A_load_order": 2, "meta_evict_policy": "", "num_warps": 8, "num_ctas": 1, "num_stages": 1}, "(72, 4096, 3584, 64, 8)": {"BLOCK_SIZE_M": 64, "BLOCK_SIZE_N": 32, "BLOCK_SIZE_K": 64, "GROUP_SIZE_M": 8, "A_load_order": 2, "meta_evict_policy": "", "num_warps": 8, "num_ctas": 1, "num_stages": 1}, "(80, 1536, 4096, 64, 8)": {"BLOCK_SIZE_M": 64, "BLOCK_SIZE_N": 32, "BLOCK_SIZE_K": 64, "GROUP_SIZE_M": 8, "A_load_order": 2, "meta_evict_policy": "", "num_warps": 8, "num_ctas": 1, "num_stages": 1}, "(80, 4096, 1024, 64, 8)": {"BLOCK_SIZE_M": 64, "BLOCK_SIZE_N": 32, "BLOCK_SIZE_K": 64, "GROUP_SIZE_M": 8, "A_load_order": 2, "meta_evict_policy": "", "num_warps": 8, "num_ctas": 1, "num_stages": 1}, "(80, 7168, 4096, 64, 8)": {"BLOCK_SIZE_M": 64, "BLOCK_SIZE_N": 64, "BLOCK_SIZE_K": 64, "GROUP_SIZE_M": 8, "A_load_order": 2, "meta_evict_policy": "", "num_warps": 8, "num_ctas": 1, "num_stages": 1}, "(80, 4096, 3584, 64, 8)": {"BLOCK_SIZE_M": 64, "BLOCK_SIZE_N": 32, "BLOCK_SIZE_K": 64, "GROUP_SIZE_M": 8, "A_load_order": 2, "meta_evict_policy": "", "num_warps": 8, "num_ctas": 1, "num_stages": 1}, "(88, 1536, 4096, 64, 8)": {"BLOCK_SIZE_M": 64, "BLOCK_SIZE_N": 32, "BLOCK_SIZE_K": 64, "GROUP_SIZE_M": 8, "A_load_order": 2, "meta_evict_policy": "", "num_warps": 8, "num_ctas": 1, "num_stages": 1}, "(88, 4096, 1024, 64, 8)": {"BLOCK_SIZE_M": 64, "BLOCK_SIZE_N": 32, "BLOCK_SIZE_K": 64, "GROUP_SIZE_M": 8, "A_load_order": 2, "meta_evict_policy": "", "num_warps": 8, "num_ctas": 1, "num_stages": 1}, "(88, 7168, 4096, 64, 8)": {"BLOCK_SIZE_M": 64, "BLOCK_SIZE_N": 64, "BLOCK_SIZE_K": 64, "GROUP_SIZE_M": 8, "A_load_order": 2, "meta_evict_policy": "", "num_warps": 8, "num_ctas": 1, "num_stages": 1}, "(88, 4096, 3584, 64, 8)": {"BLOCK_SIZE_M": 64, "BLOCK_SIZE_N": 32, "BLOCK_SIZE_K": 64, "GROUP_SIZE_M": 8, "A_load_order": 2, "meta_evict_policy": "", "num_warps": 8, "num_ctas": 1, "num_stages": 1}, "(96, 1536, 4096, 64, 8)": {"BLOCK_SIZE_M": 64, "BLOCK_SIZE_N": 32, "BLOCK_SIZE_K": 64, "GROUP_SIZE_M": 8, "A_load_order": 2, "meta_evict_policy": "", "num_warps": 8, "num_ctas": 1, "num_stages": 1}, "(96, 4096, 1024, 64, 8)": {"BLOCK_SIZE_M": 64, "BLOCK_SIZE_N": 32, "BLOCK_SIZE_K": 64, "GROUP_SIZE_M": 8, "A_load_order": 2, "meta_evict_policy": "", "num_warps": 8, "num_ctas": 1, "num_stages": 1}, "(96, 7168, 4096, 64, 8)": {"BLOCK_SIZE_M": 64, "BLOCK_SIZE_N": 64, "BLOCK_SIZE_K": 64, "GROUP_SIZE_M": 8, "A_load_order": 2, "meta_evict_policy": "", "num_warps": 8, "num_ctas": 1, "num_stages": 1}, "(96, 4096, 3584, 64, 8)": {"BLOCK_SIZE_M": 64, "BLOCK_SIZE_N": 32, "BLOCK_SIZE_K": 64, "GROUP_SIZE_M": 8, "A_load_order": 2, "meta_evict_policy": "", "num_warps": 8, "num_ctas": 1, "num_stages": 1}, "(104, 1536, 4096, 64, 8)": {"BLOCK_SIZE_M": 64, "BLOCK_SIZE_N": 32, "BLOCK_SIZE_K": 64, "GROUP_SIZE_M": 8, "A_load_order": 2, "meta_evict_policy": "", "num_warps": 8, "num_ctas": 1, "num_stages": 1}, "(104, 4096, 1024, 64, 8)": {"BLOCK_SIZE_M": 64, "BLOCK_SIZE_N": 32, "BLOCK_SIZE_K": 64, "GROUP_SIZE_M": 8, "A_load_order": 2, "meta_evict_policy": "", "num_warps": 8, "num_ctas": 1, "num_stages": 1}, "(104, 7168, 4096, 64, 8)": {"BLOCK_SIZE_M": 64, "BLOCK_SIZE_N": 64, "BLOCK_SIZE_K": 64, "GROUP_SIZE_M": 8, "A_load_order": 2, "meta_evict_policy": "", "num_warps": 8, "num_ctas": 1, "num_stages": 1}, "(104, 4096, 3584, 64, 8)": {"BLOCK_SIZE_M": 64, "BLOCK_SIZE_N": 32, "BLOCK_SIZE_K": 64, "GROUP_SIZE_M": 8, "A_load_order": 2, "meta_evict_policy": "", "num_warps": 8, "num_ctas": 1, "num_stages": 1}, "(112, 1536, 4096, 64, 8)": {"BLOCK_SIZE_M": 64, "BLOCK_SIZE_N": 32, "BLOCK_SIZE_K": 64, "GROUP_SIZE_M": 8, "A_load_order": 2, "meta_evict_policy": "", "num_warps": 8, "num_ctas": 1, "num_stages": 1}, "(112, 4096, 1024, 64, 8)": {"BLOCK_SIZE_M": 64, "BLOCK_SIZE_N": 32, "BLOCK_SIZE_K": 64, "GROUP_SIZE_M": 8, "A_load_order": 2, "meta_evict_policy": "", "num_warps": 8, "num_ctas": 1, "num_stages": 1}, "(112, 7168, 4096, 64, 8)": {"BLOCK_SIZE_M": 64, "BLOCK_SIZE_N": 64, "BLOCK_SIZE_K": 64, "GROUP_SIZE_M": 8, "A_load_order": 2, "meta_evict_policy": "", "num_warps": 8, "num_ctas": 1, "num_stages": 1}, "(112, 4096, 3584, 64, 8)": {"BLOCK_SIZE_M": 64, "BLOCK_SIZE_N": 32, "BLOCK_SIZE_K": 64, "GROUP_SIZE_M": 8, "A_load_order": 2, "meta_evict_policy": "", "num_warps": 8, "num_ctas": 1, "num_stages": 1}, "(120, 1536, 4096, 64, 8)": {"BLOCK_SIZE_M": 64, "BLOCK_SIZE_N": 32, "BLOCK_SIZE_K": 64, "GROUP_SIZE_M": 8, "A_load_order": 2, "meta_evict_policy": "", "num_warps": 8, "num_ctas": 1, "num_stages": 1}, "(120, 4096, 1024, 64, 8)": {"BLOCK_SIZE_M": 64, "BLOCK_SIZE_N": 32, "BLOCK_SIZE_K": 64, "GROUP_SIZE_M": 8, "A_load_order": 2, "meta_evict_policy": "", "num_warps": 8, "num_ctas": 1, "num_stages": 1}, "(120, 7168, 4096, 64, 8)": {"BLOCK_SIZE_M": 64, "BLOCK_SIZE_N": 64, "BLOCK_SIZE_K": 64, "GROUP_SIZE_M": 8, "A_load_order": 2, "meta_evict_policy": "", "num_warps": 8, "num_ctas": 1, "num_stages": 1}, "(120, 4096, 3584, 64, 8)": {"BLOCK_SIZE_M": 64, "BLOCK_SIZE_N": 32, "BLOCK_SIZE_K": 64, "GROUP_SIZE_M": 8, "A_load_order": 2, "meta_evict_policy": "", "num_warps": 8, "num_ctas": 1, "num_stages": 1}, "(128, 1536, 4096, 64, 8)": {"BLOCK_SIZE_M": 64, "BLOCK_SIZE_N": 32, "BLOCK_SIZE_K": 64, "GROUP_SIZE_M": 8, "A_load_order": 2, "meta_evict_policy": "", "num_warps": 8, "num_ctas": 1, "num_stages": 1}, "(128, 4096, 1024, 64, 8)": {"BLOCK_SIZE_M": 64, "BLOCK_SIZE_N": 32, "BLOCK_SIZE_K": 64, "GROUP_SIZE_M": 8, "A_load_order": 2, "meta_evict_policy": "", "num_warps": 8, "num_ctas": 1, "num_stages": 1}, "(128, 7168, 4096, 64, 8)": {"BLOCK_SIZE_M": 64, "BLOCK_SIZE_N": 64, "BLOCK_SIZE_K": 64, "GROUP_SIZE_M": 8, "A_load_order": 2, "meta_evict_policy": "", "num_warps": 8, "num_ctas": 1, "num_stages": 1}, "(128, 4096, 3584, 64, 8)": {"BLOCK_SIZE_M": 64, "BLOCK_SIZE_N": 32, "BLOCK_SIZE_K": 64, "GROUP_SIZE_M": 8, "A_load_order": 2, "meta_evict_policy": "", "num_warps": 8, "num_ctas": 1, "num_stages": 1}, "(136, 1536, 4096, 64, 8)": {"BLOCK_SIZE_M": 64, "BLOCK_SIZE_N": 32, "BLOCK_SIZE_K": 64, "GROUP_SIZE_M": 8, "A_load_order": 2, "meta_evict_policy": "", "num_warps": 8, "num_ctas": 1, "num_stages": 1}, "(136, 4096, 1024, 64, 8)": {"BLOCK_SIZE_M": 64, "BLOCK_SIZE_N": 64, "BLOCK_SIZE_K": 64, "GROUP_SIZE_M": 8, "A_load_order": 2, "meta_evict_policy": "", "num_warps": 8, "num_ctas": 1, "num_stages": 1}, "(136, 7168, 4096, 64, 8)": {"BLOCK_SIZE_M": 64, "BLOCK_SIZE_N": 64, "BLOCK_SIZE_K": 64, "GROUP_SIZE_M": 8, "A_load_order": 2, "meta_evict_policy": "", "num_warps": 8, "num_ctas": 1, "num_stages": 1}, "(136, 4096, 3584, 64, 8)": {"BLOCK_SIZE_M": 64, "BLOCK_SIZE_N": 64, "BLOCK_SIZE_K": 64, "GROUP_SIZE_M": 8, "A_load_order": 2, "meta_evict_policy": "", "num_warps": 8, "num_ctas": 1, "num_stages": 1}, "(144, 1536, 4096, 64, 8)": {"BLOCK_SIZE_M": 64, "BLOCK_SIZE_N": 32, "BLOCK_SIZE_K": 64, "GROUP_SIZE_M": 8, "A_load_order": 2, "meta_evict_policy": "", "num_warps": 8, "num_ctas": 1, "num_stages": 1}, "(144, 4096, 1024, 64, 8)": {"BLOCK_SIZE_M": 64, "BLOCK_SIZE_N": 64, "BLOCK_SIZE_K": 64, "GROUP_SIZE_M": 8, "A_load_order": 2, "meta_evict_policy": "", "num_warps": 8, "num_ctas": 1, "num_stages": 1}, "(144, 7168, 4096, 64, 8)": {"BLOCK_SIZE_M": 64, "BLOCK_SIZE_N": 64, "BLOCK_SIZE_K": 64, "GROUP_SIZE_M": 8, "A_load_order": 2, "meta_evict_policy": "", "num_warps": 8, "num_ctas": 1, "num_stages": 1}, "(144, 4096, 3584, 64, 8)": {"BLOCK_SIZE_M": 64, "BLOCK_SIZE_N": 64, "BLOCK_SIZE_K": 64, "GROUP_SIZE_M": 8, "A_load_order": 2, "meta_evict_policy": "", "num_warps": 8, "num_ctas": 1, "num_stages": 1}, "(152, 1536, 4096, 64, 8)": {"BLOCK_SIZE_M": 64, "BLOCK_SIZE_N": 32, "BLOCK_SIZE_K": 64, "GROUP_SIZE_M": 8, "A_load_order": 2, "meta_evict_policy": "", "num_warps": 8, "num_ctas": 1, "num_stages": 1}, "(152, 4096, 1024, 64, 8)": {"BLOCK_SIZE_M": 64, "BLOCK_SIZE_N": 64, "BLOCK_SIZE_K": 64, "GROUP_SIZE_M": 8, "A_load_order": 2, "meta_evict_policy": "", "num_warps": 8, "num_ctas": 1, "num_stages": 1}, "(152, 7168, 4096, 64, 8)": {"BLOCK_SIZE_M": 64, "BLOCK_SIZE_N": 64, "BLOCK_SIZE_K": 64, "GROUP_SIZE_M": 8, "A_load_order": 2, "meta_evict_policy": "", "num_warps": 8, "num_ctas": 1, "num_stages": 1}, "(152, 4096, 3584, 64, 8)": {"BLOCK_SIZE_M": 64, "BLOCK_SIZE_N": 64, "BLOCK_SIZE_K": 64, "GROUP_SIZE_M": 8, "A_load_order": 2, "meta_evict_policy": "", "num_warps": 8, "num_ctas": 1, "num_stages": 1}, "(160, 1536, 4096, 64, 8)": {"BLOCK_SIZE_M": 64, "BLOCK_SIZE_N": 32, "BLOCK_SIZE_K": 64, "GROUP_SIZE_M": 8, "A_load_order": 2, "meta_evict_policy": "", "num_warps": 8, "num_ctas": 1, "num_stages": 1}, "(160, 4096, 1024, 64, 8)": {"BLOCK_SIZE_M": 64, "BLOCK_SIZE_N": 64, "BLOCK_SIZE_K": 64, "GROUP_SIZE_M": 8, "A_load_order": 2, "meta_evict_policy": "", "num_warps": 8, "num_ctas": 1, "num_stages": 1}, "(160, 7168, 4096, 64, 8)": {"BLOCK_SIZE_M": 64, "BLOCK_SIZE_N": 64, "BLOCK_SIZE_K": 64, "GROUP_SIZE_M": 8, "A_load_order": 2, "meta_evict_policy": "", "num_warps": 8, "num_ctas": 1, "num_stages": 1}, "(160, 4096, 3584, 64, 8)": {"BLOCK_SIZE_M": 64, "BLOCK_SIZE_N": 64, "BLOCK_SIZE_K": 64, "GROUP_SIZE_M": 8, "A_load_order": 2, "meta_evict_policy": "", "num_warps": 8, "num_ctas": 1, "num_stages": 1}, "(256, 6144, 4096, 64, 8)": {"BLOCK_SIZE_M": 64, "BLOCK_SIZE_N": 64, "BLOCK_SIZE_K": 64, "GROUP_SIZE_M": 8, "A_load_order": 2, "meta_evict_policy": "", "num_warps": 8, "num_ctas": 1, "num_stages": 1}, "(256, 4096, 4096, 64, 8)": {"BLOCK_SIZE_M": 64, "BLOCK_SIZE_N": 64, "BLOCK_SIZE_K": 64, "GROUP_SIZE_M": 8, "A_load_order": 2, "meta_evict_policy": "", "num_warps": 8, "num_ctas": 1, "num_stages": 1}, "(256, 28672, 4096, 64, 8)": {"BLOCK_SIZE_M": 64, "BLOCK_SIZE_N": 256, "BLOCK_SIZE_K": 32, "GROUP_SIZE_M": 8, "A_load_order": 2, "meta_evict_policy": "", "num_warps": 4, "num_ctas": 1, "num_stages": 1}, "(256, 4096, 14336, 64, 8)": {"BLOCK_SIZE_M": 64, "BLOCK_SIZE_N": 64, "BLOCK_SIZE_K": 64, "GROUP_SIZE_M": 8, "A_load_order": 2, "meta_evict_policy": "", "num_warps": 8, "num_ctas": 1, "num_stages": 1}, "(256, 6144, 4096, 64, 2)": {"BLOCK_SIZE_M": 64, "BLOCK_SIZE_N": 32, "BLOCK_SIZE_K": 64, "GROUP_SIZE_M": 8, "A_load_order": 0, "meta_evict_policy": "", "num_warps": 4, "num_ctas": 1, "num_stages": 4}, "(256, 4096, 4096, 64, 2)": {"BLOCK_SIZE_M": 64, "BLOCK_SIZE_N": 32, "BLOCK_SIZE_K": 64, "GROUP_SIZE_M": 8, "A_load_order": 2, "meta_evict_policy": "", "num_warps": 8, "num_ctas": 1, "num_stages": 1}, "(256, 28672, 4096, 64, 2)": {"BLOCK_SIZE_M": 64, "BLOCK_SIZE_N": 64, "BLOCK_SIZE_K": 64, "GROUP_SIZE_M": 8, "A_load_order": 2, "meta_evict_policy": "", "num_warps": 4, "num_ctas": 1, "num_stages": 1}, "(256, 4096, 14336, 64, 2)": {"BLOCK_SIZE_M": 64, "BLOCK_SIZE_N": 32, "BLOCK_SIZE_K": 64, "GROUP_SIZE_M": 8, "A_load_order": 2, "meta_evict_policy": "", "num_warps": 8, "num_ctas": 1, "num_stages": 1}, "(256, 4608, 3584, 64, 8)": {"BLOCK_SIZE_M": 64, "BLOCK_SIZE_N": 32, "BLOCK_SIZE_K": 64, "GROUP_SIZE_M": 8, "A_load_order": 2, "meta_evict_policy": "", "num_warps": 4, "num_ctas": 1, "num_stages": 1}, "(256, 3584, 3584, 64, 8)": {"BLOCK_SIZE_M": 64, "BLOCK_SIZE_N": 32, "BLOCK_SIZE_K": 64, "GROUP_SIZE_M": 8, "A_load_order": 2, "meta_evict_policy": "", "num_warps": 4, "num_ctas": 1, "num_stages": 1}, "(256, 37888, 3584, 64, 8)": {"BLOCK_SIZE_M": 64, "BLOCK_SIZE_N": 64, "BLOCK_SIZE_K": 64, "GROUP_SIZE_M": 8, "A_load_order": 2, "meta_evict_policy": "", "num_warps": 4, "num_ctas": 1, "num_stages": 1}, "(256, 3584, 18944, 64, 8)": {"BLOCK_SIZE_M": 64, "BLOCK_SIZE_N": 32, "BLOCK_SIZE_K": 64, "GROUP_SIZE_M": 8, "A_load_order": 2, "meta_evict_policy": "", "num_warps": 4, "num_ctas": 1, "num_stages": 1}, "(256, 4608, 3584, 64, 2)": {"BLOCK_SIZE_M": 64, "BLOCK_SIZE_N": 64, "BLOCK_SIZE_K": 64, "GROUP_SIZE_M": 8, "A_load_order": 2, "meta_evict_policy": "", "num_warps": 8, "num_ctas": 1, "num_stages": 1}, "(256, 3584, 3584, 64, 2)": {"BLOCK_SIZE_M": 64, "BLOCK_SIZE_N": 32, "BLOCK_SIZE_K": 64, "GROUP_SIZE_M": 8, "A_load_order": 2, "meta_evict_policy": "", "num_warps": 8, "num_ctas": 1, "num_stages": 1}, "(256, 37888, 3584, 64, 2)": {"BLOCK_SIZE_M": 64, "BLOCK_SIZE_N": 64, "BLOCK_SIZE_K": 64, "GROUP_SIZE_M": 8, "A_load_order": 2, "meta_evict_policy": "", "num_warps": 4, "num_ctas": 1, "num_stages": 5}, "(256, 3584, 18944, 64, 2)": {"BLOCK_SIZE_M": 64, "BLOCK_SIZE_N": 32, "BLOCK_SIZE_K": 64, "GROUP_SIZE_M": 8, "A_load_order": 2, "meta_evict_policy": "", "num_warps": 8, "num_ctas": 1, "num_stages": 1}, "(256, 6144, 2048, 64, 8)": {"BLOCK_SIZE_M": 64, "BLOCK_SIZE_N": 64, "BLOCK_SIZE_K": 64, "GROUP_SIZE_M": 8, "A_load_order": 2, "meta_evict_policy": "", "num_warps": 4, "num_ctas": 1, "num_stages": 1}, "(256, 2048, 2048, 64, 8)": {"BLOCK_SIZE_M": 64, "BLOCK_SIZE_N": 32, "BLOCK_SIZE_K": 64, "GROUP_SIZE_M": 8, "A_load_order": 2, "meta_evict_policy": "", "num_warps": 8, "num_ctas": 1, "num_stages": 1}, "(256, 11264, 2048, 64, 8)": {"BLOCK_SIZE_M": 64, "BLOCK_SIZE_N": 64, "BLOCK_SIZE_K": 64, "GROUP_SIZE_M": 8, "A_load_order": 0, "meta_evict_policy": "", "num_warps": 4, "num_ctas": 1, "num_stages": 4}, "(256, 2048, 5632, 64, 8)": {"BLOCK_SIZE_M": 64, "BLOCK_SIZE_N": 32, "BLOCK_SIZE_K": 64, "GROUP_SIZE_M": 8, "A_load_order": 2, "meta_evict_policy": "", "num_warps": 8, "num_ctas": 1, "num_stages": 1}, "(256, 3072, 4096, 64, 8)": {"BLOCK_SIZE_M": 64, "BLOCK_SIZE_N": 64, "BLOCK_SIZE_K": 64, "GROUP_SIZE_M": 8, "A_load_order": 2, "meta_evict_policy": "", "num_warps": 8, "num_ctas": 1, "num_stages": 1}, "(256, 4096, 2048, 64, 8)": {"BLOCK_SIZE_M": 64, "BLOCK_SIZE_N": 64, "BLOCK_SIZE_K": 64, "GROUP_SIZE_M": 8, "A_load_order": 2, "meta_evict_policy": "", "num_warps": 8, "num_ctas": 1, "num_stages": 1}, "(256, 14336, 4096, 64, 8)": {"BLOCK_SIZE_M": 64, "BLOCK_SIZE_N": 128, "BLOCK_SIZE_K": 64, "GROUP_SIZE_M": 8, "A_load_order": 0, "meta_evict_policy": "", "num_warps": 8, "num_ctas": 1, "num_stages": 1}, "(256, 4096, 7168, 64, 8)": {"BLOCK_SIZE_M": 64, "BLOCK_SIZE_N": 64, "BLOCK_SIZE_K": 64, "GROUP_SIZE_M": 8, "A_load_order": 2, "meta_evict_policy": "", "num_warps": 8, "num_ctas": 1, "num_stages": 1}, "(256, 1536, 4096, 64, 8)": {"BLOCK_SIZE_M": 64, "BLOCK_SIZE_N": 32, "BLOCK_SIZE_K": 64, "GROUP_SIZE_M": 8, "A_load_order": 2, "meta_evict_policy": "", "num_warps": 8, "num_ctas": 1, "num_stages": 1}, "(256, 4096, 1024, 64, 8)": {"BLOCK_SIZE_M": 64, "BLOCK_SIZE_N": 64, "BLOCK_SIZE_K": 64, "GROUP_SIZE_M": 8, "A_load_order": 2, "meta_evict_policy": "", "num_warps": 8, "num_ctas": 1, "num_stages": 1}, "(256, 7168, 4096, 64, 8)": {"BLOCK_SIZE_M": 64, "BLOCK_SIZE_N": 64, "BLOCK_SIZE_K": 64, "GROUP_SIZE_M": 8, "A_load_order": 2, "meta_evict_policy": "", "num_warps": 8, "num_ctas": 1, "num_stages": 1}, "(256, 4096, 3584, 64, 8)": {"BLOCK_SIZE_M": 64, "BLOCK_SIZE_N": 64, "BLOCK_SIZE_K": 64, "GROUP_SIZE_M": 8, "A_load_order": 2, "meta_evict_policy": "", "num_warps": 8, "num_ctas": 1, "num_stages": 1}, "(4096, 6144, 4096, 4096, 1)": {"BLOCK_SIZE_M": 128, "BLOCK_SIZE_N": 256, "BLOCK_SIZE_K": 64, "GROUP_SIZE_M": 8, "A_load_order": 0, "meta_evict_policy": "", "num_warps": 8, "num_ctas": 1, "num_stages": 5}, "(4096, 4096, 4096, 4096, 1)": {"BLOCK_SIZE_M": 128, "BLOCK_SIZE_N": 128, "BLOCK_SIZE_K": 128, "GROUP_SIZE_M": 8, "A_load_order": 0, "meta_evict_policy": "", "num_warps": 8, "num_ctas": 1, "num_stages": 5}, "(4096, 28672, 4096, 4096, 1)": {"BLOCK_SIZE_M": 128, "BLOCK_SIZE_N": 256, "BLOCK_SIZE_K": 64, "GROUP_SIZE_M": 8, "A_load_order": 0, "meta_evict_policy": "", "num_warps": 8, "num_ctas": 1, "num_stages": 5}, "(4096, 4096, 14336, 14336, 1)": {"BLOCK_SIZE_M": 128, "BLOCK_SIZE_N": 128, "BLOCK_SIZE_K": 128, "GROUP_SIZE_M": 8, "A_load_order": 0, "meta_evict_policy": "", "num_warps": 8, "num_ctas": 1, "num_stages": 5}, "(256, 6144, 4096, 4096, 1)": {"BLOCK_SIZE_M": 64, "BLOCK_SIZE_N": 64, "BLOCK_SIZE_K": 128, "GROUP_SIZE_M": 8, "A_load_order": 2, "meta_evict_policy": "", "num_warps": 4, "num_ctas": 1, "num_stages": 4}, "(256, 4096, 4096, 4096, 1)": {"BLOCK_SIZE_M": 64, "BLOCK_SIZE_N": 64, "BLOCK_SIZE_K": 128, "GROUP_SIZE_M": 8, "A_load_order": 2, "meta_evict_policy": "", "num_warps": 4, "num_ctas": 1, "num_stages": 5}, "(256, 28672, 4096, 4096, 1)": {"BLOCK_SIZE_M": 64, "BLOCK_SIZE_N": 128, "BLOCK_SIZE_K": 128, "GROUP_SIZE_M": 8, "A_load_order": 0, "meta_evict_policy": "", "num_warps": 4, "num_ctas": 1, "num_stages": 4}, "(256, 4096, 14336, 14336, 1)": {"BLOCK_SIZE_M": 64, "BLOCK_SIZE_N": 64, "BLOCK_SIZE_K": 128, "GROUP_SIZE_M": 8, "A_load_order": 2, "meta_evict_policy": "", "num_warps": 4, "num_ctas": 1, "num_stages": 5}, "(128, 6144, 4096, 4096, 1)": {"BLOCK_SIZE_M": 64, "BLOCK_SIZE_N": 32, "BLOCK_SIZE_K": 128, "GROUP_SIZE_M": 8, "A_load_order": 2, "meta_evict_policy": "", "num_warps": 4, "num_ctas": 1, "num_stages": 5}, "(128, 4096, 4096, 4096, 1)": {"BLOCK_SIZE_M": 64, "BLOCK_SIZE_N": 64, "BLOCK_SIZE_K": 256, "GROUP_SIZE_M": 8, "A_load_order": 2, "meta_evict_policy": "", "num_warps": 4, "num_ctas": 1, "num_stages": 5}, "(128, 28672, 4096, 4096, 1)": {"BLOCK_SIZE_M": 64, "BLOCK_SIZE_N": 128, "BLOCK_SIZE_K": 128, "GROUP_SIZE_M": 8, "A_load_order": 2, "meta_evict_policy": "", "num_warps": 4, "num_ctas": 1, "num_stages": 4}, "(128, 4096, 14336, 14336, 1)": {"BLOCK_SIZE_M": 64, "BLOCK_SIZE_N": 64, "BLOCK_SIZE_K": 256, "GROUP_SIZE_M": 8, "A_load_order": 2, "meta_evict_policy": "", "num_warps": 4, "num_ctas": 1, "num_stages": 5}, "(512, 6144, 4096, 4096, 1)": {"BLOCK_SIZE_M": 128, "BLOCK_SIZE_N": 128, "BLOCK_SIZE_K": 64, "GROUP_SIZE_M": 8, "A_load_order": 2, "meta_evict_policy": "", "num_warps": 4, "num_ctas": 1, "num_stages": 5}, "(512, 4096, 4096, 4096, 1)": {"BLOCK_SIZE_M": 128, "BLOCK_SIZE_N": 128, "BLOCK_SIZE_K": 128, "GROUP_SIZE_M": 8, "A_load_order": 2, "meta_evict_policy": "", "num_warps": 4, "num_ctas": 1, "num_stages": 5}, "(512, 28672, 4096, 4096, 1)": {"BLOCK_SIZE_M": 128, "BLOCK_SIZE_N": 128, "BLOCK_SIZE_K": 128, "GROUP_SIZE_M": 8, "A_load_order": 2, "meta_evict_policy": "", "num_warps": 4, "num_ctas": 1, "num_stages": 5}, "(512, 4096, 14336, 14336, 1)": {"BLOCK_SIZE_M": 128, "BLOCK_SIZE_N": 128, "BLOCK_SIZE_K": 128, "GROUP_SIZE_M": 8, "A_load_order": 2, "meta_evict_policy": "", "num_warps": 8, "num_ctas": 1, "num_stages": 5}, "(1024, 6144, 4096, 4096, 1)": {"BLOCK_SIZE_M": 128, "BLOCK_SIZE_N": 128, "BLOCK_SIZE_K": 128, "GROUP_SIZE_M": 8, "A_load_order": 2, "meta_evict_policy": "", "num_warps": 8, "num_ctas": 1, "num_stages": 5}, "(1024, 4096, 4096, 4096, 1)": {"BLOCK_SIZE_M": 128, "BLOCK_SIZE_N": 256, "BLOCK_SIZE_K": 64, "GROUP_SIZE_M": 8, "A_load_order": 2, "meta_evict_policy": "", "num_warps": 8, "num_ctas": 1, "num_stages": 5}, "(1024, 28672, 4096, 4096, 1)": {"BLOCK_SIZE_M": 128, "BLOCK_SIZE_N": 256, "BLOCK_SIZE_K": 64, "GROUP_SIZE_M": 8, "A_load_order": 0, "meta_evict_policy": "", "num_warps": 8, "num_ctas": 1, "num_stages": 5}, "(1024, 4096, 14336, 14336, 1)": {"BLOCK_SIZE_M": 128, "BLOCK_SIZE_N": 256, "BLOCK_SIZE_K": 64, "GROUP_SIZE_M": 8, "A_load_order": 2, "meta_evict_policy": "", "num_warps": 8, "num_ctas": 1, "num_stages": 5}, "(2048, 6144, 4096, 4096, 1)": {"BLOCK_SIZE_M": 128, "BLOCK_SIZE_N": 128, "BLOCK_SIZE_K": 128, "GROUP_SIZE_M": 8, "A_load_order": 2, "meta_evict_policy": "", "num_warps": 8, "num_ctas": 1, "num_stages": 5}, "(2048, 4096, 4096, 4096, 1)": {"BLOCK_SIZE_M": 128, "BLOCK_SIZE_N": 256, "BLOCK_SIZE_K": 64, "GROUP_SIZE_M": 8, "A_load_order": 0, "meta_evict_policy": "", "num_warps": 8, "num_ctas": 1, "num_stages": 5}, "(2048, 28672, 4096, 4096, 1)": {"BLOCK_SIZE_M": 128, "BLOCK_SIZE_N": 256, "BLOCK_SIZE_K": 64, "GROUP_SIZE_M": 8, "A_load_order": 0, "meta_evict_policy": "", "num_warps": 8, "num_ctas": 1, "num_stages": 5}, "(2048, 4096, 14336, 14336, 1)": {"BLOCK_SIZE_M": 128, "BLOCK_SIZE_N": 256, "BLOCK_SIZE_K": 64, "GROUP_SIZE_M": 8, "A_load_order": 0, "meta_evict_policy": "", "num_warps": 8, "num_ctas": 1, "num_stages": 5}, "(4096, 4608, 3584, 3584, 1)": {"BLOCK_SIZE_M": 128, "BLOCK_SIZE_N": 128, "BLOCK_SIZE_K": 128, "GROUP_SIZE_M": 8, "A_load_order": 2, "meta_evict_policy": "", "num_warps": 8, "num_ctas": 1, "num_stages": 5}, "(4096, 3584, 3584, 3584, 1)": {"BLOCK_SIZE_M": 128, "BLOCK_SIZE_N": 256, "BLOCK_SIZE_K": 64, "GROUP_SIZE_M": 8, "A_load_order": 2, "meta_evict_policy": "", "num_warps": 8, "num_ctas": 1, "num_stages": 5}, "(4096, 37888, 3584, 3584, 1)": {"BLOCK_SIZE_M": 128, "BLOCK_SIZE_N": 256, "BLOCK_SIZE_K": 64, "GROUP_SIZE_M": 8, "A_load_order": 0, "meta_evict_policy": "", "num_warps": 8, "num_ctas": 1, "num_stages": 5}, "(4096, 3584, 18944, 18944, 1)": {"BLOCK_SIZE_M": 128, "BLOCK_SIZE_N": 256, "BLOCK_SIZE_K": 64, "GROUP_SIZE_M": 8, "A_load_order": 0, "meta_evict_policy": "", "num_warps": 8, "num_ctas": 1, "num_stages": 5}, "(256, 4608, 3584, 3584, 1)": {"BLOCK_SIZE_M": 64, "BLOCK_SIZE_N": 128, "BLOCK_SIZE_K": 128, "GROUP_SIZE_M": 8, "A_load_order": 2, "meta_evict_policy": "", "num_warps": 4, "num_ctas": 1, "num_stages": 4}, "(256, 3584, 3584, 3584, 1)": {"BLOCK_SIZE_M": 64, "BLOCK_SIZE_N": 64, "BLOCK_SIZE_K": 128, "GROUP_SIZE_M": 8, "A_load_order": 2, "meta_evict_policy": "", "num_warps": 4, "num_ctas": 1, "num_stages": 5}, "(256, 37888, 3584, 3584, 1)": {"BLOCK_SIZE_M": 64, "BLOCK_SIZE_N": 128, "BLOCK_SIZE_K": 128, "GROUP_SIZE_M": 8, "A_load_order": 2, "meta_evict_policy": "", "num_warps": 4, "num_ctas": 1, "num_stages": 4}, "(256, 3584, 18944, 18944, 1)": {"BLOCK_SIZE_M": 64, "BLOCK_SIZE_N": 64, "BLOCK_SIZE_K": 128, "GROUP_SIZE_M": 8, "A_load_order": 2, "meta_evict_policy": "", "num_warps": 4, "num_ctas": 1, "num_stages": 5}, "(128, 4608, 3584, 3584, 1)": {"BLOCK_SIZE_M": 64, "BLOCK_SIZE_N": 64, "BLOCK_SIZE_K": 128, "GROUP_SIZE_M": 8, "A_load_order": 2, "meta_evict_policy": "", "num_warps": 4, "num_ctas": 1, "num_stages": 5}, "(128, 3584, 3584, 3584, 1)": {"BLOCK_SIZE_M": 64, "BLOCK_SIZE_N": 64, "BLOCK_SIZE_K": 256, "GROUP_SIZE_M": 8, "A_load_order": 0, "meta_evict_policy": "", "num_warps": 4, "num_ctas": 1, "num_stages": 5}, "(128, 37888, 3584, 3584, 1)": {"BLOCK_SIZE_M": 64, "BLOCK_SIZE_N": 64, "BLOCK_SIZE_K": 128, "GROUP_SIZE_M": 8, "A_load_order": 2, "meta_evict_policy": "", "num_warps": 4, "num_ctas": 1, "num_stages": 4}, "(128, 3584, 18944, 18944, 1)": {"BLOCK_SIZE_M": 64, "BLOCK_SIZE_N": 64, "BLOCK_SIZE_K": 256, "GROUP_SIZE_M": 8, "A_load_order": 2, "meta_evict_policy": "", "num_warps": 4, "num_ctas": 1, "num_stages": 5}, "(512, 4608, 3584, 3584, 1)": {"BLOCK_SIZE_M": 128, "BLOCK_SIZE_N": 128, "BLOCK_SIZE_K": 128, "GROUP_SIZE_M": 8, "A_load_order": 2, "meta_evict_policy": "", "num_warps": 8, "num_ctas": 1, "num_stages": 5}, "(512, 3584, 3584, 3584, 1)": {"BLOCK_SIZE_M": 128, "BLOCK_SIZE_N": 128, "BLOCK_SIZE_K": 128, "GROUP_SIZE_M": 8, "A_load_order": 2, "meta_evict_policy": "", "num_warps": 8, "num_ctas": 1, "num_stages": 5}, "(512, 37888, 3584, 3584, 1)": {"BLOCK_SIZE_M": 128, "BLOCK_SIZE_N": 128, "BLOCK_SIZE_K": 128, "GROUP_SIZE_M": 8, "A_load_order": 0, "meta_evict_policy": "", "num_warps": 4, "num_ctas": 1, "num_stages": 5}, "(512, 3584, 18944, 18944, 1)": {"BLOCK_SIZE_M": 128, "BLOCK_SIZE_N": 128, "BLOCK_SIZE_K": 128, "GROUP_SIZE_M": 8, "A_load_order": 2, "meta_evict_policy": "", "num_warps": 8, "num_ctas": 1, "num_stages": 5}, "(1024, 4608, 3584, 3584, 1)": {"BLOCK_SIZE_M": 128, "BLOCK_SIZE_N": 256, "BLOCK_SIZE_K": 64, "GROUP_SIZE_M": 8, "A_load_order": 2, "meta_evict_policy": "", "num_warps": 8, "num_ctas": 1, "num_stages": 5}, "(1024, 3584, 3584, 3584, 1)": {"BLOCK_SIZE_M": 128, "BLOCK_SIZE_N": 256, "BLOCK_SIZE_K": 64, "GROUP_SIZE_M": 8, "A_load_order": 0, "meta_evict_policy": "", "num_warps": 8, "num_ctas": 1, "num_stages": 5}, "(1024, 37888, 3584, 3584, 1)": {"BLOCK_SIZE_M": 128, "BLOCK_SIZE_N": 256, "BLOCK_SIZE_K": 64, "GROUP_SIZE_M": 8, "A_load_order": 0, "meta_evict_policy": "", "num_warps": 8, "num_ctas": 1, "num_stages": 5}, "(1024, 3584, 18944, 18944, 1)": {"BLOCK_SIZE_M": 128, "BLOCK_SIZE_N": 256, "BLOCK_SIZE_K": 64, "GROUP_SIZE_M": 8, "A_load_order": 0, "meta_evict_policy": "", "num_warps": 8, "num_ctas": 1, "num_stages": 5}, "(2048, 4608, 3584, 3584, 1)": {"BLOCK_SIZE_M": 128, "BLOCK_SIZE_N": 256, "BLOCK_SIZE_K": 64, "GROUP_SIZE_M": 8, "A_load_order": 0, "meta_evict_policy": "", "num_warps": 8, "num_ctas": 1, "num_stages": 5}, "(2048, 3584, 3584, 3584, 1)": {"BLOCK_SIZE_M": 128, "BLOCK_SIZE_N": 128, "BLOCK_SIZE_K": 128, "GROUP_SIZE_M": 8, "A_load_order": 2, "meta_evict_policy": "", "num_warps": 8, "num_ctas": 1, "num_stages": 5}, "(2048, 37888, 3584, 3584, 1)": {"BLOCK_SIZE_M": 128, "BLOCK_SIZE_N": 256, "BLOCK_SIZE_K": 64, "GROUP_SIZE_M": 8, "A_load_order": 2, "meta_evict_policy": "", "num_warps": 8, "num_ctas": 1, "num_stages": 5}, "(2048, 3584, 18944, 18944, 1)": {"BLOCK_SIZE_M": 128, "BLOCK_SIZE_N": 128, "BLOCK_SIZE_K": 128, "GROUP_SIZE_M": 8, "A_load_order": 0, "meta_evict_policy": "", "num_warps": 8, "num_ctas": 1, "num_stages": 5}, "(4096, 5120, 3072, 3072, 1)": {"BLOCK_SIZE_M": 128, "BLOCK_SIZE_N": 256, "BLOCK_SIZE_K": 64, "GROUP_SIZE_M": 8, "A_load_order": 0, "meta_evict_policy": "", "num_warps": 8, "num_ctas": 1, "num_stages": 5}, "(4096, 3072, 3072, 3072, 1)": {"BLOCK_SIZE_M": 128, "BLOCK_SIZE_N": 128, "BLOCK_SIZE_K": 128, "GROUP_SIZE_M": 8, "A_load_order": 2, "meta_evict_policy": "", "num_warps": 8, "num_ctas": 1, "num_stages": 5}, "(4096, 16384, 3072, 3072, 1)": {"BLOCK_SIZE_M": 128, "BLOCK_SIZE_N": 256, "BLOCK_SIZE_K": 64, "GROUP_SIZE_M": 8, "A_load_order": 0, "meta_evict_policy": "", "num_warps": 8, "num_ctas": 1, "num_stages": 5}, "(4096, 3072, 8192, 8192, 1)": {"BLOCK_SIZE_M": 128, "BLOCK_SIZE_N": 128, "BLOCK_SIZE_K": 128, "GROUP_SIZE_M": 8, "A_load_order": 0, "meta_evict_policy": "", "num_warps": 8, "num_ctas": 1, "num_stages": 5}, "(256, 5120, 3072, 3072, 1)": {"BLOCK_SIZE_M": 64, "BLOCK_SIZE_N": 64, "BLOCK_SIZE_K": 128, "GROUP_SIZE_M": 8, "A_load_order": 0, "meta_evict_policy": "", "num_warps": 4, "num_ctas": 1, "num_stages": 4}, "(256, 3072, 3072, 3072, 1)": {"BLOCK_SIZE_M": 64, "BLOCK_SIZE_N": 64, "BLOCK_SIZE_K": 128, "GROUP_SIZE_M": 8, "A_load_order": 2, "meta_evict_policy": "", "num_warps": 4, "num_ctas": 1, "num_stages": 5}, "(256, 16384, 3072, 3072, 1)": {"BLOCK_SIZE_M": 64, "BLOCK_SIZE_N": 128, "BLOCK_SIZE_K": 128, "GROUP_SIZE_M": 8, "A_load_order": 0, "meta_evict_policy": "", "num_warps": 4, "num_ctas": 1, "num_stages": 4}, "(256, 3072, 8192, 8192, 1)": {"BLOCK_SIZE_M": 64, "BLOCK_SIZE_N": 64, "BLOCK_SIZE_K": 128, "GROUP_SIZE_M": 8, "A_load_order": 2, "meta_evict_policy": "", "num_warps": 4, "num_ctas": 1, "num_stages": 5}, "(128, 5120, 3072, 3072, 1)": {"BLOCK_SIZE_M": 64, "BLOCK_SIZE_N": 64, "BLOCK_SIZE_K": 128, "GROUP_SIZE_M": 8, "A_load_order": 2, "meta_evict_policy": "", "num_warps": 4, "num_ctas": 1, "num_stages": 5}, "(128, 3072, 3072, 3072, 1)": {"BLOCK_SIZE_M": 64, "BLOCK_SIZE_N": 64, "BLOCK_SIZE_K": 256, "GROUP_SIZE_M": 8, "A_load_order": 2, "meta_evict_policy": "", "num_warps": 4, "num_ctas": 1, "num_stages": 5}, "(128, 16384, 3072, 3072, 1)": {"BLOCK_SIZE_M": 64, "BLOCK_SIZE_N": 128, "BLOCK_SIZE_K": 128, "GROUP_SIZE_M": 8, "A_load_order": 2, "meta_evict_policy": "", "num_warps": 4, "num_ctas": 1, "num_stages": 4}, "(128, 3072, 8192, 8192, 1)": {"BLOCK_SIZE_M": 64, "BLOCK_SIZE_N": 64, "BLOCK_SIZE_K": 256, "GROUP_SIZE_M": 8, "A_load_order": 2, "meta_evict_policy": "", "num_warps": 4, "num_ctas": 1, "num_stages": 5}, "(512, 5120, 3072, 3072, 1)": {"BLOCK_SIZE_M": 128, "BLOCK_SIZE_N": 256, "BLOCK_SIZE_K": 64, "GROUP_SIZE_M": 8, "A_load_order": 2, "meta_evict_policy": "", "num_warps": 8, "num_ctas": 1, "num_stages": 5}, "(512, 3072, 3072, 3072, 1)": {"BLOCK_SIZE_M": 128, "BLOCK_SIZE_N": 128, "BLOCK_SIZE_K": 128, "GROUP_SIZE_M": 8, "A_load_order": 2, "meta_evict_policy": "", "num_warps": 8, "num_ctas": 1, "num_stages": 5}, "(512, 16384, 3072, 3072, 1)": {"BLOCK_SIZE_M": 128, "BLOCK_SIZE_N": 256, "BLOCK_SIZE_K": 64, "GROUP_SIZE_M": 8, "A_load_order": 0, "meta_evict_policy": "", "num_warps": 8, "num_ctas": 1, "num_stages": 5}, "(512, 3072, 8192, 8192, 1)": {"BLOCK_SIZE_M": 128, "BLOCK_SIZE_N": 128, "BLOCK_SIZE_K": 128, "GROUP_SIZE_M": 8, "A_load_order": 2, "meta_evict_policy": "", "num_warps": 8, "num_ctas": 1, "num_stages": 5}, "(1024, 5120, 3072, 3072, 1)": {"BLOCK_SIZE_M": 128, "BLOCK_SIZE_N": 128, "BLOCK_SIZE_K": 64, "GROUP_SIZE_M": 8, "A_load_order": 0, "meta_evict_policy": "", "num_warps": 4, "num_ctas": 1, "num_stages": 4}, "(1024, 3072, 3072, 3072, 1)": {"BLOCK_SIZE_M": 128, "BLOCK_SIZE_N": 256, "BLOCK_SIZE_K": 64, "GROUP_SIZE_M": 8, "A_load_order": 2, "meta_evict_policy": "", "num_warps": 8, "num_ctas": 1, "num_stages": 5}, "(1024, 16384, 3072, 3072, 1)": {"BLOCK_SIZE_M": 128, "BLOCK_SIZE_N": 128, "BLOCK_SIZE_K": 128, "GROUP_SIZE_M": 8, "A_load_order": 2, "meta_evict_policy": "", "num_warps": 8, "num_ctas": 1, "num_stages": 5}, "(1024, 3072, 8192, 8192, 1)": {"BLOCK_SIZE_M": 128, "BLOCK_SIZE_N": 256, "BLOCK_SIZE_K": 64, "GROUP_SIZE_M": 8, "A_load_order": 2, "meta_evict_policy": "", "num_warps": 8, "num_ctas": 1, "num_stages": 5}, "(2048, 5120, 3072, 3072, 1)": {"BLOCK_SIZE_M": 128, "BLOCK_SIZE_N": 256, "BLOCK_SIZE_K": 64, "GROUP_SIZE_M": 8, "A_load_order": 0, "meta_evict_policy": "", "num_warps": 8, "num_ctas": 1, "num_stages": 5}, "(2048, 3072, 3072, 3072, 1)": {"BLOCK_SIZE_M": 128, "BLOCK_SIZE_N": 128, "BLOCK_SIZE_K": 128, "GROUP_SIZE_M": 8, "A_load_order": 2, "meta_evict_policy": "", "num_warps": 8, "num_ctas": 1, "num_stages": 5}, "(2048, 16384, 3072, 3072, 1)": {"BLOCK_SIZE_M": 128, "BLOCK_SIZE_N": 256, "BLOCK_SIZE_K": 64, "GROUP_SIZE_M": 8, "A_load_order": 0, "meta_evict_policy": "", "num_warps": 8, "num_ctas": 1, "num_stages": 5}, "(2048, 3072, 8192, 8192, 1)": {"BLOCK_SIZE_M": 128, "BLOCK_SIZE_N": 128, "BLOCK_SIZE_K": 128, "GROUP_SIZE_M": 8, "A_load_order": 2, "meta_evict_policy": "", "num_warps": 8, "num_ctas": 1, "num_stages": 5}, "(128, 1024, 4096, 64, 8)": {"BLOCK_SIZE_M": 64, "BLOCK_SIZE_N": 32, "BLOCK_SIZE_K": 64, "GROUP_SIZE_M": 8, "A_load_order": 2, "meta_evict_policy": "", "num_warps": 8, "num_ctas": 1, "num_stages": 1}, "(256, 1024, 4096, 64, 8)": {"BLOCK_SIZE_M": 64, "BLOCK_SIZE_N": 32, "BLOCK_SIZE_K": 64, "GROUP_SIZE_M": 8, "A_load_order": 2, "meta_evict_policy": "", "num_warps": 8, "num_ctas": 1, "num_stages": 1}, "(512, 4096, 4096, 64, 8)": {"BLOCK_SIZE_M": 64, "BLOCK_SIZE_N": 64, "BLOCK_SIZE_K": 64, "GROUP_SIZE_M": 8, "A_load_order": 2, "meta_evict_policy": "", "num_warps": 4, "num_ctas": 1, "num_stages": 1}, "(512, 1024, 4096, 64, 8)": {"BLOCK_SIZE_M": 64, "BLOCK_SIZE_N": 32, "BLOCK_SIZE_K": 64, "GROUP_SIZE_M": 8, "A_load_order": 2, "meta_evict_policy": "", "num_warps": 8, "num_ctas": 1, "num_stages": 1}, "(512, 14336, 4096, 64, 8)": {"BLOCK_SIZE_M": 64, "BLOCK_SIZE_N": 64, "BLOCK_SIZE_K": 64, "GROUP_SIZE_M": 8, "A_load_order": 2, "meta_evict_policy": "", "num_warps": 4, "num_ctas": 1, "num_stages": 1}, "(512, 4096, 14336, 64, 8)": {"BLOCK_SIZE_M": 64, "BLOCK_SIZE_N": 64, "BLOCK_SIZE_K": 64, "GROUP_SIZE_M": 8, "A_load_order": 2, "meta_evict_policy": "", "num_warps": 4, "num_ctas": 1, "num_stages": 1}, "(1024, 1024, 4096, 64, 8)": {"BLOCK_SIZE_M": 64, "BLOCK_SIZE_N": 32, "BLOCK_SIZE_K": 64, "GROUP_SIZE_M": 8, "A_load_order": 2, "meta_evict_policy": "", "num_warps": 4, "num_ctas": 1, "num_stages": 1}, "(1024, 14336, 4096, 64, 8)": {"BLOCK_SIZE_M": 64, "BLOCK_SIZE_N": 64, "BLOCK_SIZE_K": 64, "GROUP_SIZE_M": 8, "A_load_order": 2, "meta_evict_policy": "", "num_warps": 4, "num_ctas": 1, "num_stages": 1}, "(128, 3072, 3072, 64, 8)": {"BLOCK_SIZE_M": 64, "BLOCK_SIZE_N": 32, "BLOCK_SIZE_K": 64, "GROUP_SIZE_M": 8, "A_load_order": 2, "meta_evict_policy": "", "num_warps": 8, "num_ctas": 1, "num_stages": 1}, "(128, 1024, 3072, 64, 8)": {"BLOCK_SIZE_M": 64, "BLOCK_SIZE_N": 32, "BLOCK_SIZE_K": 64, "GROUP_SIZE_M": 8, "A_load_order": 2, "meta_evict_policy": "", "num_warps": 8, "num_ctas": 1, "num_stages": 1}, "(128, 8192, 3072, 64, 8)": {"BLOCK_SIZE_M": 64, "BLOCK_SIZE_N": 32, "BLOCK_SIZE_K": 64, "GROUP_SIZE_M": 8, "A_load_order": 2, "meta_evict_policy": "", "num_warps": 4, "num_ctas": 1, "num_stages": 1}, "(128, 3072, 8192, 64, 8)": {"BLOCK_SIZE_M": 64, "BLOCK_SIZE_N": 32, "BLOCK_SIZE_K": 64, "GROUP_SIZE_M": 8, "A_load_order": 2, "meta_evict_policy": "", "num_warps": 8, "num_ctas": 1, "num_stages": 1}, "(256, 3072, 3072, 64, 8)": {"BLOCK_SIZE_M": 64, "BLOCK_SIZE_N": 32, "BLOCK_SIZE_K": 64, "GROUP_SIZE_M": 8, "A_load_order": 2, "meta_evict_policy": "", "num_warps": 8, "num_ctas": 1, "num_stages": 1}, "(256, 1024, 3072, 64, 8)": {"BLOCK_SIZE_M": 64, "BLOCK_SIZE_N": 32, "BLOCK_SIZE_K": 64, "GROUP_SIZE_M": 8, "A_load_order": 2, "meta_evict_policy": "", "num_warps": 8, "num_ctas": 1, "num_stages": 1}, "(256, 8192, 3072, 64, 8)": {"BLOCK_SIZE_M": 64, "BLOCK_SIZE_N": 64, "BLOCK_SIZE_K": 64, "GROUP_SIZE_M": 8, "A_load_order": 2, "meta_evict_policy": "", "num_warps": 4, "num_ctas": 1, "num_stages": 1}, "(256, 3072, 8192, 64, 8)": {"BLOCK_SIZE_M": 64, "BLOCK_SIZE_N": 32, "BLOCK_SIZE_K": 64, "GROUP_SIZE_M": 8, "A_load_order": 2, "meta_evict_policy": "", "num_warps": 8, "num_ctas": 1, "num_stages": 1}, "(512, 3072, 3072, 64, 8)": {"BLOCK_SIZE_M": 64, "BLOCK_SIZE_N": 64, "BLOCK_SIZE_K": 64, "GROUP_SIZE_M": 8, "A_load_order": 2, "meta_evict_policy": "", "num_warps": 4, "num_ctas": 1, "num_stages": 1}, "(512, 1024, 3072, 64, 8)": {"BLOCK_SIZE_M": 64, "BLOCK_SIZE_N": 32, "BLOCK_SIZE_K": 64, "GROUP_SIZE_M": 8, "A_load_order": 2, "meta_evict_policy": "", "num_warps": 8, "num_ctas": 1, "num_stages": 1}, "(512, 8192, 3072, 64, 8)": {"BLOCK_SIZE_M": 64, "BLOCK_SIZE_N": 64, "BLOCK_SIZE_K": 64, "GROUP_SIZE_M": 8, "A_load_order": 2, "meta_evict_policy": "", "num_warps": 4, "num_ctas": 1, "num_stages": 1}, "(512, 3072, 8192, 64, 8)": {"BLOCK_SIZE_M": 64, "BLOCK_SIZE_N": 64, "BLOCK_SIZE_K": 64, "GROUP_SIZE_M": 8, "A_load_order": 2, "meta_evict_policy": "", "num_warps": 4, "num_ctas": 1, "num_stages": 1}, "(1024, 3072, 3072, 64, 8)": {"BLOCK_SIZE_M": 64, "BLOCK_SIZE_N": 64, "BLOCK_SIZE_K": 32, "GROUP_SIZE_M": 8, "A_load_order": 2, "meta_evict_policy": "", "num_warps": 4, "num_ctas": 1, "num_stages": 5}, "(1024, 1024, 3072, 64, 8)": {"BLOCK_SIZE_M": 64, "BLOCK_SIZE_N": 32, "BLOCK_SIZE_K": 64, "GROUP_SIZE_M": 8, "A_load_order": 2, "meta_evict_policy": "", "num_warps": 4, "num_ctas": 1, "num_stages": 1}, "(1024, 8192, 3072, 64, 8)": {"BLOCK_SIZE_M": 64, "BLOCK_SIZE_N": 64, "BLOCK_SIZE_K": 64, "GROUP_SIZE_M": 8, "A_load_order": 2, "meta_evict_policy": "", "num_warps": 4, "num_ctas": 1, "num_stages": 1}, "(1024, 3072, 8192, 64, 8)": {"BLOCK_SIZE_M": 64, "BLOCK_SIZE_N": 64, "BLOCK_SIZE_K": 32, "GROUP_SIZE_M": 8, "A_load_order": 2, "meta_evict_policy": "", "num_warps": 4, "num_ctas": 1, "num_stages": 5}, "(128, 512, 3584, 64, 8)": {"BLOCK_SIZE_M": 64, "BLOCK_SIZE_N": 32, "BLOCK_SIZE_K": 64, "GROUP_SIZE_M": 8, "A_load_order": 2, "meta_evict_policy": "", "num_warps": 8, "num_ctas": 1, "num_stages": 1}, "(128, 18944, 3584, 64, 8)": {"BLOCK_SIZE_M": 64, "BLOCK_SIZE_N": 64, "BLOCK_SIZE_K": 64, "GROUP_SIZE_M": 8, "A_load_order": 0, "meta_evict_policy": "", "num_warps": 4, "num_ctas": 1, "num_stages": 4}, "(256, 512, 3584, 64, 8)": {"BLOCK_SIZE_M": 64, "BLOCK_SIZE_N": 32, "BLOCK_SIZE_K": 64, "GROUP_SIZE_M": 8, "A_load_order": 2, "meta_evict_policy": "", "num_warps": 8, "num_ctas": 1, "num_stages": 1}, "(256, 18944, 3584, 64, 8)": {"BLOCK_SIZE_M": 64, "BLOCK_SIZE_N": 64, "BLOCK_SIZE_K": 64, "GROUP_SIZE_M": 8, "A_load_order": 0, "meta_evict_policy": "", "num_warps": 4, "num_ctas": 1, "num_stages": 4}, "(512, 3584, 3584, 64, 8)": {"BLOCK_SIZE_M": 64, "BLOCK_SIZE_N": 64, "BLOCK_SIZE_K": 64, "GROUP_SIZE_M": 8, "A_load_order": 2, "meta_evict_policy": "", "num_warps": 4, "num_ctas": 1, "num_stages": 1}, "(512, 512, 3584, 64, 8)": {"BLOCK_SIZE_M": 64, "BLOCK_SIZE_N": 32, "BLOCK_SIZE_K": 64, "GROUP_SIZE_M": 8, "A_load_order": 2, "meta_evict_policy": "", "num_warps": 8, "num_ctas": 1, "num_stages": 1}, "(512, 18944, 3584, 64, 8)": {"BLOCK_SIZE_M": 64, "BLOCK_SIZE_N": 64, "BLOCK_SIZE_K": 64, "GROUP_SIZE_M": 8, "A_load_order": 2, "meta_evict_policy": "", "num_warps": 4, "num_ctas": 1, "num_stages": 1}, "(512, 3584, 18944, 64, 8)": {"BLOCK_SIZE_M": 64, "BLOCK_SIZE_N": 64, "BLOCK_SIZE_K": 64, "GROUP_SIZE_M": 8, "A_load_order": 2, "meta_evict_policy": "", "num_warps": 4, "num_ctas": 1, "num_stages": 1}, "(1024, 512, 3584, 64, 8)": {"BLOCK_SIZE_M": 64, "BLOCK_SIZE_N": 32, "BLOCK_SIZE_K": 64, "GROUP_SIZE_M": 8, "A_load_order": 2, "meta_evict_policy": "", "num_warps": 8, "num_ctas": 1, "num_stages": 1}, "(1024, 18944, 3584, 64, 8)": {"BLOCK_SIZE_M": 64, "BLOCK_SIZE_N": 64, "BLOCK_SIZE_K": 64, "GROUP_SIZE_M": 8, "A_load_order": 2, "meta_evict_policy": "", "num_warps": 4, "num_ctas": 1, "num_stages": 1}, "(128, 256, 2048, 64, 8)": {"BLOCK_SIZE_M": 64, "BLOCK_SIZE_N": 32, "BLOCK_SIZE_K": 64, "GROUP_SIZE_M": 8, "A_load_order": 2, "meta_evict_policy": "", "num_warps": 8, "num_ctas": 1, "num_stages": 1}, "(128, 11008, 2048, 64, 8)": {"BLOCK_SIZE_M": 64, "BLOCK_SIZE_N": 64, "BLOCK_SIZE_K": 64, "GROUP_SIZE_M": 8, "A_load_order": 2, "meta_evict_policy": "", "num_warps": 4, "num_ctas": 1, "num_stages": 1}, "(128, 2048, 11008, 64, 8)": {"BLOCK_SIZE_M": 64, "BLOCK_SIZE_N": 32, "BLOCK_SIZE_K": 64, "GROUP_SIZE_M": 8, "A_load_order": 2, "meta_evict_policy": "", "num_warps": 8, "num_ctas": 1, "num_stages": 1}, "(256, 256, 2048, 64, 8)": {"BLOCK_SIZE_M": 64, "BLOCK_SIZE_N": 32, "BLOCK_SIZE_K": 64, "GROUP_SIZE_M": 8, "A_load_order": 2, "meta_evict_policy": "", "num_warps": 8, "num_ctas": 1, "num_stages": 1}, "(256, 11008, 2048, 64, 8)": {"BLOCK_SIZE_M": 64, "BLOCK_SIZE_N": 64, "BLOCK_SIZE_K": 32, "GROUP_SIZE_M": 8, "A_load_order": 2, "meta_evict_policy": "", "num_warps": 4, "num_ctas": 1, "num_stages": 4}, "(256, 2048, 11008, 64, 8)": {"BLOCK_SIZE_M": 64, "BLOCK_SIZE_N": 32, "BLOCK_SIZE_K": 64, "GROUP_SIZE_M": 8, "A_load_order": 2, "meta_evict_policy": "", "num_warps": 8, "num_ctas": 1, "num_stages": 1}, "(512, 2048, 2048, 64, 8)": {"BLOCK_SIZE_M": 64, "BLOCK_SIZE_N": 32, "BLOCK_SIZE_K": 64, "GROUP_SIZE_M": 8, "A_load_order": 2, "meta_evict_policy": "", "num_warps": 4, "num_ctas": 1, "num_stages": 1}, "(512, 256, 2048, 64, 8)": {"BLOCK_SIZE_M": 64, "BLOCK_SIZE_N": 32, "BLOCK_SIZE_K": 64, "GROUP_SIZE_M": 8, "A_load_order": 2, "meta_evict_policy": "", "num_warps": 8, "num_ctas": 1, "num_stages": 1}, "(512, 11008, 2048, 64, 8)": {"BLOCK_SIZE_M": 64, "BLOCK_SIZE_N": 64, "BLOCK_SIZE_K": 64, "GROUP_SIZE_M": 8, "A_load_order": 2, "meta_evict_policy": "", "num_warps": 4, "num_ctas": 1, "num_stages": 1}, "(512, 2048, 11008, 64, 8)": {"BLOCK_SIZE_M": 64, "BLOCK_SIZE_N": 32, "BLOCK_SIZE_K": 64, "GROUP_SIZE_M": 8, "A_load_order": 2, "meta_evict_policy": "", "num_warps": 4, "num_ctas": 1, "num_stages": 1}, "(1024, 256, 2048, 64, 8)": {"BLOCK_SIZE_M": 64, "BLOCK_SIZE_N": 32, "BLOCK_SIZE_K": 64, "GROUP_SIZE_M": 8, "A_load_order": 2, "meta_evict_policy": "", "num_warps": 8, "num_ctas": 1, "num_stages": 1}, "(1024, 11008, 2048, 64, 8)": {"BLOCK_SIZE_M": 64, "BLOCK_SIZE_N": 64, "BLOCK_SIZE_K": 64, "GROUP_SIZE_M": 8, "A_load_order": 2, "meta_evict_policy": "", "num_warps": 4, "num_ctas": 1, "num_stages": 1}, "(1024, 2048, 11008, 64, 8)": {"BLOCK_SIZE_M": 64, "BLOCK_SIZE_N": 64, "BLOCK_SIZE_K": 64, "GROUP_SIZE_M": 8, "A_load_order": 2, "meta_evict_policy": "", "num_warps": 4, "num_ctas": 1, "num_stages": 1}}}