gemlite/configs/mi300x.json
{"GEMV": {}, "GEMV_REVSPLITK": {"(1, 4096, 4096, 128, 8, 104)": {"BLOCK_SIZE_M": 1, "BLOCK_SIZE_N": 64, "BLOCK_SIZE_K": 32, "A_load_order": 0, "dot_prod_mode": 0, "waves_per_eu": 0, "num_warps": 1, "num_ctas": 1, "num_stages": 2, "num_buffers_warp_spec": 0, "num_consumer_groups": 0, "reg_dec_producer": 0, "reg_inc_consumer": 0}, "(1, 4096, 1024, 128, 8, 104)": {"BLOCK_SIZE_M": 1, "BLOCK_SIZE_N": 256, "BLOCK_SIZE_K": 64, "A_load_order": 0, "dot_prod_mode": 0, "waves_per_eu": 2, "num_warps": 2, "num_ctas": 1, "num_stages": 1, "num_buffers_warp_spec": 0, "num_consumer_groups": 0, "reg_dec_producer": 0, "reg_inc_consumer": 0}, "(1, 1024, 4096, 128, 8, 104)": {"BLOCK_SIZE_M": 1, "BLOCK_SIZE_N": 256, "BLOCK_SIZE_K": 64, "A_load_order": 0, "dot_prod_mode": 0, "waves_per_eu": 2, "num_warps": 4, "num_ctas": 1, "num_stages": 2, "num_buffers_warp_spec": 0, "num_consumer_groups": 0, "reg_dec_producer": 0, "reg_inc_consumer": 0}, "(1, 6144, 4096, 128, 8, 104)": {"BLOCK_SIZE_M": 1, "BLOCK_SIZE_N": 64, "BLOCK_SIZE_K": 64, "A_load_order": 0, "dot_prod_mode": 0, "waves_per_eu": 2, "num_warps": 1, "num_ctas": 1, "num_stages": 1, "num_buffers_warp_spec": 0, "num_consumer_groups": 0, "reg_dec_producer": 0, "reg_inc_consumer": 0}, "(1, 4096, 14336, 128, 8, 104)": {"BLOCK_SIZE_M": 1, "BLOCK_SIZE_N": 1024, "BLOCK_SIZE_K": 32, "A_load_order": 0, "dot_prod_mode": 0, "waves_per_eu": 4, "num_warps": 4, "num_ctas": 1, "num_stages": 1, "num_buffers_warp_spec": 0, "num_consumer_groups": 0, "reg_dec_producer": 0, "reg_inc_consumer": 0}, "(1, 28672, 4096, 128, 8, 104)": {"BLOCK_SIZE_M": 1, "BLOCK_SIZE_N": 512, "BLOCK_SIZE_K": 32, "A_load_order": 0, "dot_prod_mode": 0, "waves_per_eu": 0, "num_warps": 2, "num_ctas": 1, "num_stages": 2, "num_buffers_warp_spec": 0, "num_consumer_groups": 0, "reg_dec_producer": 0, "reg_inc_consumer": 0}, "(1, 37888, 3584, 128, 8, 104)": {"BLOCK_SIZE_M": 1, "BLOCK_SIZE_N": 1024, "BLOCK_SIZE_K": 32, "A_load_order": 0, "dot_prod_mode": 0, "waves_per_eu": 0, "num_warps": 4, "num_ctas": 1, "num_stages": 1, "num_buffers_warp_spec": 0, "num_consumer_groups": 0, "reg_dec_producer": 0, "reg_inc_consumer": 0}, "(1, 3584, 18944, 128, 8, 104)": {"BLOCK_SIZE_M": 1, "BLOCK_SIZE_N": 256, "BLOCK_SIZE_K": 32, "A_load_order": 0, "dot_prod_mode": 0, "waves_per_eu": 0, "num_warps": 1, "num_ctas": 1, "num_stages": 1, "num_buffers_warp_spec": 0, "num_consumer_groups": 0, "reg_dec_producer": 0, "reg_inc_consumer": 0}, "(1, 4608, 3584, 128, 8, 104)": {"BLOCK_SIZE_M": 1, "BLOCK_SIZE_N": 64, "BLOCK_SIZE_K": 64, "A_load_order": 0, "dot_prod_mode": 0, "waves_per_eu": 0, "num_warps": 2, "num_ctas": 1, "num_stages": 1, "num_buffers_warp_spec": 0, "num_consumer_groups": 0, "reg_dec_producer": 0, "reg_inc_consumer": 0}, "(1, 3584, 3584, 128, 8, 104)": {"BLOCK_SIZE_M": 1, "BLOCK_SIZE_N": 128, "BLOCK_SIZE_K": 32, "A_load_order": 0, "dot_prod_mode": 0, "waves_per_eu": 0, "num_warps": 2, "num_ctas": 1, "num_stages": 2, "num_buffers_warp_spec": 0, "num_consumer_groups": 0, "reg_dec_producer": 0, "reg_inc_consumer": 0}, "(1, 16384, 3072, 128, 8, 104)": {"BLOCK_SIZE_M": 1, "BLOCK_SIZE_N": 512, "BLOCK_SIZE_K": 8, "A_load_order": 0, "dot_prod_mode": 0, "waves_per_eu": 0, "num_warps": 2, "num_ctas": 1, "num_stages": 1, "num_buffers_warp_spec": 0, "num_consumer_groups": 0, "reg_dec_producer": 0, "reg_inc_consumer": 0}, "(1, 3072, 8192, 128, 8, 104)": {"BLOCK_SIZE_M": 1, "BLOCK_SIZE_N": 128, "BLOCK_SIZE_K": 32, "A_load_order": 0, "dot_prod_mode": 0, "waves_per_eu": 2, "num_warps": 1, "num_ctas": 1, "num_stages": 1, "num_buffers_warp_spec": 0, "num_consumer_groups": 0, "reg_dec_producer": 0, "reg_inc_consumer": 0}, "(1, 5120, 3072, 128, 8, 104)": {"BLOCK_SIZE_M": 1, "BLOCK_SIZE_N": 64, "BLOCK_SIZE_K": 16, "A_load_order": 0, "dot_prod_mode": 0, "waves_per_eu": 0, "num_warps": 1, "num_ctas": 1, "num_stages": 1, "num_buffers_warp_spec": 0, "num_consumer_groups": 0, "reg_dec_producer": 0, "reg_inc_consumer": 0}, "(1, 16384, 3072, 64, 8, 104)": {"BLOCK_SIZE_M": 1, "BLOCK_SIZE_N": 512, "BLOCK_SIZE_K": 8, "A_load_order": 0, "dot_prod_mode": 0, "waves_per_eu": 0, "num_warps": 2, "num_ctas": 1, "num_stages": 2, "num_buffers_warp_spec": 0, "num_consumer_groups": 0, "reg_dec_producer": 0, "reg_inc_consumer": 0}, "(1, 28672, 4096, 64, 8, 104)": {"BLOCK_SIZE_M": 1, "BLOCK_SIZE_N": 1024, "BLOCK_SIZE_K": 32, "A_load_order": 0, "dot_prod_mode": 0, "waves_per_eu": 2, "num_warps": 4, "num_ctas": 1, "num_stages": 1, "num_buffers_warp_spec": 0, "num_consumer_groups": 0, "reg_dec_producer": 0, "reg_inc_consumer": 0}, "(1, 4096, 14336, 64, 8, 104)": {"BLOCK_SIZE_M": 1, "BLOCK_SIZE_N": 1024, "BLOCK_SIZE_K": 32, "A_load_order": 0, "dot_prod_mode": 0, "waves_per_eu": 4, "num_warps": 4, "num_ctas": 1, "num_stages": 1, "num_buffers_warp_spec": 0, "num_consumer_groups": 0, "reg_dec_producer": 0, "reg_inc_consumer": 0}, "(1, 4096, 14336, 32, 8, 104)": {"BLOCK_SIZE_M": 1, "BLOCK_SIZE_N": 256, "BLOCK_SIZE_K": 16, "A_load_order": 0, "dot_prod_mode": 0, "waves_per_eu": 2, "num_warps": 1, "num_ctas": 1, "num_stages": 1, "num_buffers_warp_spec": 0, "num_consumer_groups": 0, "reg_dec_producer": 0, "reg_inc_consumer": 0}, "(1, 4096, 1024, 32, 8, 104)": {"BLOCK_SIZE_M": 1, "BLOCK_SIZE_N": 64, "BLOCK_SIZE_K": 16, "A_load_order": 0, "dot_prod_mode": 0, "waves_per_eu": 2, "num_warps": 4, "num_ctas": 1, "num_stages": 2, "num_buffers_warp_spec": 0, "num_consumer_groups": 0, "reg_dec_producer": 0, "reg_inc_consumer": 0}, "(1, 1024, 4096, 32, 8, 104)": {"BLOCK_SIZE_M": 1, "BLOCK_SIZE_N": 64, "BLOCK_SIZE_K": 8, "A_load_order": 0, "dot_prod_mode": 0, "waves_per_eu": 0, "num_warps": 1, "num_ctas": 1, "num_stages": 1, "num_buffers_warp_spec": 0, "num_consumer_groups": 0, "reg_dec_producer": 0, "reg_inc_consumer": 0}, "(1, 3072, 3072, 128, 8, 104)": {"BLOCK_SIZE_M": 1, "BLOCK_SIZE_N": 256, "BLOCK_SIZE_K": 8, "A_load_order": 0, "dot_prod_mode": 0, "waves_per_eu": 4, "num_warps": 4, "num_ctas": 1, "num_stages": 2, "num_buffers_warp_spec": 0, "num_consumer_groups": 0, "reg_dec_producer": 0, "reg_inc_consumer": 0}, "(1, 3584, 3584, 64, 8, 104)": {"BLOCK_SIZE_M": 1, "BLOCK_SIZE_N": 256, "BLOCK_SIZE_K": 8, "A_load_order": 0, "dot_prod_mode": 0, "waves_per_eu": 2, "num_warps": 4, "num_ctas": 1, "num_stages": 1, "num_buffers_warp_spec": 0, "num_consumer_groups": 0, "reg_dec_producer": 0, "reg_inc_consumer": 0}, "(1, 4608, 3584, 64, 8, 104)": {"BLOCK_SIZE_M": 1, "BLOCK_SIZE_N": 64, "BLOCK_SIZE_K": 32, "A_load_order": 0, "dot_prod_mode": 0, "waves_per_eu": 2, "num_warps": 4, "num_ctas": 1, "num_stages": 1, "num_buffers_warp_spec": 0, "num_consumer_groups": 0, "reg_dec_producer": 0, "reg_inc_consumer": 0}, "(1, 3584, 18944, 64, 8, 104)": {"BLOCK_SIZE_M": 1, "BLOCK_SIZE_N": 256, "BLOCK_SIZE_K": 32, "A_load_order": 0, "dot_prod_mode": 0, "waves_per_eu": 4, "num_warps": 1, "num_ctas": 1, "num_stages": 1, "num_buffers_warp_spec": 0, "num_consumer_groups": 0, "reg_dec_producer": 0, "reg_inc_consumer": 0}, "(1, 37888, 3584, 64, 8, 104)": {"BLOCK_SIZE_M": 1, "BLOCK_SIZE_N": 1024, "BLOCK_SIZE_K": 32, "A_load_order": 0, "dot_prod_mode": 0, "waves_per_eu": 2, "num_warps": 4, "num_ctas": 1, "num_stages": 2, "num_buffers_warp_spec": 0, "num_consumer_groups": 0, "reg_dec_producer": 0, "reg_inc_consumer": 0}, "(1, 14336, 4096, 128, 8, 104)": {"BLOCK_SIZE_M": 1, "BLOCK_SIZE_N": 1024, "BLOCK_SIZE_K": 32, "A_load_order": 0, "dot_prod_mode": 0, "waves_per_eu": 0, "num_warps": 4, "num_ctas": 1, "num_stages": 1, "num_buffers_warp_spec": 0, "num_consumer_groups": 0, "reg_dec_producer": 0, "reg_inc_consumer": 0}}, "GEMV_SPLITK": {"(1, 4096, 4096, 4096, 1, 408)": {"BLOCK_SIZE_M": 1, "BLOCK_SIZE_N": 2, "BLOCK_SIZE_K": 4096, "GROUP_SIZE_M": 8, "SPLIT_K": 1, "A_load_order": 0, "dot_prod_mode": 0, "waves_per_eu": 2, "num_warps": 4, "num_ctas": 1, "num_stages": 1, "num_buffers_warp_spec": 0, "num_consumer_groups": 0, "reg_dec_producer": 0, "reg_inc_consumer": 0}, "(1, 4096, 1024, 1024, 1, 408)": {"BLOCK_SIZE_M": 1, "BLOCK_SIZE_N": 4, "BLOCK_SIZE_K": 1024, "GROUP_SIZE_M": 8, "SPLIT_K": 1, "A_load_order": 0, "dot_prod_mode": 0, "waves_per_eu": 4, "num_warps": 4, "num_ctas": 1, "num_stages": 2, "num_buffers_warp_spec": 0, "num_consumer_groups": 0, "reg_dec_producer": 0, "reg_inc_consumer": 0}, "(1, 1024, 4096, 4096, 1, 408)": {"BLOCK_SIZE_M": 1, "BLOCK_SIZE_N": 8, "BLOCK_SIZE_K": 2048, "GROUP_SIZE_M": 8, "SPLIT_K": 1, "A_load_order": 0, "dot_prod_mode": 0, "waves_per_eu": 0, "num_warps": 4, "num_ctas": 1, "num_stages": 1, "num_buffers_warp_spec": 0, "num_consumer_groups": 0, "reg_dec_producer": 0, "reg_inc_consumer": 0}, "(1, 6144, 4096, 4096, 1, 408)": {"BLOCK_SIZE_M": 1, "BLOCK_SIZE_N": 2, "BLOCK_SIZE_K": 4096, "GROUP_SIZE_M": 8, "SPLIT_K": 1, "A_load_order": 0, "dot_prod_mode": 0, "waves_per_eu": 2, "num_warps": 4, "num_ctas": 1, "num_stages": 1, "num_buffers_warp_spec": 0, "num_consumer_groups": 0, "reg_dec_producer": 0, "reg_inc_consumer": 0}, "(1, 4096, 14336, 14336, 1, 408)": {"BLOCK_SIZE_M": 1, "BLOCK_SIZE_N": 8, "BLOCK_SIZE_K": 1024, "GROUP_SIZE_M": 8, "SPLIT_K": 1, "A_load_order": 0, "dot_prod_mode": 0, "waves_per_eu": 2, "num_warps": 4, "num_ctas": 1, "num_stages": 2, "num_buffers_warp_spec": 0, "num_consumer_groups": 0, "reg_dec_producer": 0, "reg_inc_consumer": 0}, "(1, 28672, 4096, 4096, 1, 408)": {"BLOCK_SIZE_M": 1, "BLOCK_SIZE_N": 1, "BLOCK_SIZE_K": 4096, "GROUP_SIZE_M": 8, "SPLIT_K": 1, "A_load_order": 0, "dot_prod_mode": 0, "waves_per_eu": 0, "num_warps": 4, "num_ctas": 1, "num_stages": 2, "num_buffers_warp_spec": 0, "num_consumer_groups": 0, "reg_dec_producer": 0, "reg_inc_consumer": 0}, "(1, 37888, 3584, 3584, 1, 408)": {"BLOCK_SIZE_M": 1, "BLOCK_SIZE_N": 4, "BLOCK_SIZE_K": 512, "GROUP_SIZE_M": 8, "SPLIT_K": 1, "A_load_order": 0, "dot_prod_mode": 0, "waves_per_eu": 2, "num_warps": 4, "num_ctas": 1, "num_stages": 1, "num_buffers_warp_spec": 0, "num_consumer_groups": 0, "reg_dec_producer": 0, "reg_inc_consumer": 0}, "(1, 3584, 18944, 18944, 1, 408)": {"BLOCK_SIZE_M": 1, "BLOCK_SIZE_N": 4, "BLOCK_SIZE_K": 512, "GROUP_SIZE_M": 8, "SPLIT_K": 1, "A_load_order": 0, "dot_prod_mode": 0, "waves_per_eu": 2, "num_warps": 4, "num_ctas": 1, "num_stages": 2, "num_buffers_warp_spec": 0, "num_consumer_groups": 0, "reg_dec_producer": 0, "reg_inc_consumer": 0}, "(1, 4608, 3584, 3584, 1, 408)": {"BLOCK_SIZE_M": 1, "BLOCK_SIZE_N": 4, "BLOCK_SIZE_K": 512, "GROUP_SIZE_M": 8, "SPLIT_K": 1, "A_load_order": 0, "dot_prod_mode": 0, "waves_per_eu": 0, "num_warps": 4, "num_ctas": 1, "num_stages": 1, "num_buffers_warp_spec": 0, "num_consumer_groups": 0, "reg_dec_producer": 0, "reg_inc_consumer": 0}, "(1, 3584, 3584, 3584, 1, 408)": {"BLOCK_SIZE_M": 1, "BLOCK_SIZE_N": 2, "BLOCK_SIZE_K": 512, "GROUP_SIZE_M": 8, "SPLIT_K": 1, "A_load_order": 0, "dot_prod_mode": 0, "waves_per_eu": 0, "num_warps": 4, "num_ctas": 1, "num_stages": 2, "num_buffers_warp_spec": 0, "num_consumer_groups": 0, "reg_dec_producer": 0, "reg_inc_consumer": 0}, "(1, 16384, 3072, 3072, 1, 408)": {"BLOCK_SIZE_M": 1, "BLOCK_SIZE_N": 16, "BLOCK_SIZE_K": 128, "GROUP_SIZE_M": 8, "SPLIT_K": 1, "A_load_order": 0, "dot_prod_mode": 0, "waves_per_eu": 2, "num_warps": 4, "num_ctas": 1, "num_stages": 2, "num_buffers_warp_spec": 0, "num_consumer_groups": 0, "reg_dec_producer": 0, "reg_inc_consumer": 0}, "(1, 3072, 8192, 8192, 1, 408)": {"BLOCK_SIZE_M": 1, "BLOCK_SIZE_N": 2, "BLOCK_SIZE_K": 4096, "GROUP_SIZE_M": 8, "SPLIT_K": 1, "A_load_order": 0, "dot_prod_mode": 0, "waves_per_eu": 2, "num_warps": 4, "num_ctas": 1, "num_stages": 1, "num_buffers_warp_spec": 0, "num_consumer_groups": 0, "reg_dec_producer": 0, "reg_inc_consumer": 0}, "(1, 5120, 3072, 3072, 1, 408)": {"BLOCK_SIZE_M": 1, "BLOCK_SIZE_N": 8, "BLOCK_SIZE_K": 1024, "GROUP_SIZE_M": 8, "SPLIT_K": 1, "A_load_order": 0, "dot_prod_mode": 0, "waves_per_eu": 2, "num_warps": 4, "num_ctas": 1, "num_stages": 1, "num_buffers_warp_spec": 0, "num_consumer_groups": 0, "reg_dec_producer": 0, "reg_inc_consumer": 0}, "(1, 3072, 3072, 3072, 1, 408)": {"BLOCK_SIZE_M": 1, "BLOCK_SIZE_N": 4, "BLOCK_SIZE_K": 512, "GROUP_SIZE_M": 8, "SPLIT_K": 1, "A_load_order": 0, "dot_prod_mode": 0, "waves_per_eu": 0, "num_warps": 4, "num_ctas": 1, "num_stages": 2, "num_buffers_warp_spec": 0, "num_consumer_groups": 0, "reg_dec_producer": 0, "reg_inc_consumer": 0}, "(1, 512, 512, 512, 1, 408)": {"BLOCK_SIZE_M": 1, "BLOCK_SIZE_N": 32, "BLOCK_SIZE_K": 256, "GROUP_SIZE_M": 8, "SPLIT_K": 1, "A_load_order": 0, "dot_prod_mode": 0, "waves_per_eu": 2, "num_warps": 4, "num_ctas": 1, "num_stages": 2, "num_buffers_warp_spec": 0, "num_consumer_groups": 0, "reg_dec_producer": 0, "reg_inc_consumer": 0}, "(1, 4608, 3584, 3584, 1, 108)": {"BLOCK_SIZE_M": 1, "BLOCK_SIZE_N": 8, "BLOCK_SIZE_K": 512, "GROUP_SIZE_M": 8, "SPLIT_K": 1, "A_load_order": 0, "dot_prod_mode": 0, "waves_per_eu": 4, "num_warps": 4, "num_ctas": 1, "num_stages": 1, "num_buffers_warp_spec": 0, "num_consumer_groups": 0, "reg_dec_producer": 0, "reg_inc_consumer": 0}, "(1, 4096, 4096, 4096, 1, 1208)": {"BLOCK_SIZE_M": 1, "BLOCK_SIZE_N": 4, "BLOCK_SIZE_K": 2048, "GROUP_SIZE_M": 8, "SPLIT_K": 1, "A_load_order": 0, "dot_prod_mode": 0, "waves_per_eu": 2, "num_warps": 4, "num_ctas": 1, "num_stages": 2, "num_buffers_warp_spec": 0, "num_consumer_groups": 0, "reg_dec_producer": 0, "reg_inc_consumer": 0}, "(1, 6144, 4096, 4096, 1, 1208)": {"BLOCK_SIZE_M": 1, "BLOCK_SIZE_N": 4, "BLOCK_SIZE_K": 512, "GROUP_SIZE_M": 8, "SPLIT_K": 1, "A_load_order": 0, "dot_prod_mode": 0, "waves_per_eu": 2, "num_warps": 4, "num_ctas": 1, "num_stages": 2, "num_buffers_warp_spec": 0, "num_consumer_groups": 0, "reg_dec_producer": 0, "reg_inc_consumer": 0}, "(1, 4096, 14336, 14336, 1, 1208)": {"BLOCK_SIZE_M": 1, "BLOCK_SIZE_N": 8, "BLOCK_SIZE_K": 2048, "GROUP_SIZE_M": 8, "SPLIT_K": 1, "A_load_order": 0, "dot_prod_mode": 0, "waves_per_eu": 0, "num_warps": 4, "num_ctas": 1, "num_stages": 2, "num_buffers_warp_spec": 0, "num_consumer_groups": 0, "reg_dec_producer": 0, "reg_inc_consumer": 0}, "(1, 28672, 4096, 4096, 1, 1208)": {"BLOCK_SIZE_M": 1, "BLOCK_SIZE_N": 1, "BLOCK_SIZE_K": 4096, "GROUP_SIZE_M": 8, "SPLIT_K": 1, "A_load_order": 0, "dot_prod_mode": 0, "waves_per_eu": 0, "num_warps": 4, "num_ctas": 1, "num_stages": 1, "num_buffers_warp_spec": 0, "num_consumer_groups": 0, "reg_dec_producer": 0, "reg_inc_consumer": 0}, "(1, 14336, 4096, 4096, 1, 408)": {"BLOCK_SIZE_M": 1, "BLOCK_SIZE_N": 32, "BLOCK_SIZE_K": 512, "GROUP_SIZE_M": 8, "SPLIT_K": 1, "A_load_order": 0, "dot_prod_mode": 0, "waves_per_eu": 0, "num_warps": 4, "num_ctas": 1, "num_stages": 1, "num_buffers_warp_spec": 0, "num_consumer_groups": 0, "reg_dec_producer": 0, "reg_inc_consumer": 0}, "(1, 1024, 4096, 4096, 1, 1208)": {"BLOCK_SIZE_M": 1, "BLOCK_SIZE_N": 1, "BLOCK_SIZE_K": 2048, "GROUP_SIZE_M": 8, "SPLIT_K": 1, "A_load_order": 0, "dot_prod_mode": 0, "waves_per_eu": 4, "num_warps": 4, "num_ctas": 1, "num_stages": 1, "num_buffers_warp_spec": 0, "num_consumer_groups": 0, "reg_dec_producer": 0, "reg_inc_consumer": 0}, "(1, 14336, 4096, 4096, 1, 1208)": {"BLOCK_SIZE_M": 1, "BLOCK_SIZE_N": 8, "BLOCK_SIZE_K": 256, "GROUP_SIZE_M": 8, "SPLIT_K": 1, "A_load_order": 0, "dot_prod_mode": 0, "waves_per_eu": 2, "num_warps": 4, "num_ctas": 1, "num_stages": 1, "num_buffers_warp_spec": 0, "num_consumer_groups": 0, "reg_dec_producer": 0, "reg_inc_consumer": 0}}, "GEMM_SPLITK": {"(8, 4096, 4096, 4096, 1, 408)": {"BLOCK_SIZE_M": 16, "BLOCK_SIZE_N": 64, "BLOCK_SIZE_K": 512, "GROUP_SIZE_M": 8, "SPLIT_K": 1, "A_load_order": 0, "waves_per_eu": 4, "matrix_instr_nonkdim": 16, "num_warps": 4, "num_ctas": 1, "num_stages": 1, "num_buffers_warp_spec": 0, "num_consumer_groups": 0, "reg_dec_producer": 0, "reg_inc_consumer": 0}, "(16, 4096, 4096, 4096, 1, 408)": {"BLOCK_SIZE_M": 16, "BLOCK_SIZE_N": 64, "BLOCK_SIZE_K": 512, "GROUP_SIZE_M": 8, "SPLIT_K": 1, "A_load_order": 0, "waves_per_eu": 4, "matrix_instr_nonkdim": 16, "num_warps": 4, "num_ctas": 1, "num_stages": 1, "num_buffers_warp_spec": 0, "num_consumer_groups": 0, "reg_dec_producer": 0, "reg_inc_consumer": 0}, "(32, 4096, 4096, 4096, 1, 408)": {"BLOCK_SIZE_M": 32, "BLOCK_SIZE_N": 32, "BLOCK_SIZE_K": 512, "GROUP_SIZE_M": 8, "SPLIT_K": 1, "A_load_order": 0, "waves_per_eu": 4, "matrix_instr_nonkdim": 16, "num_warps": 8, "num_ctas": 1, "num_stages": 2, "num_buffers_warp_spec": 0, "num_consumer_groups": 0, "reg_dec_producer": 0, "reg_inc_consumer": 0}, "(64, 4096, 4096, 4096, 1, 408)": {"BLOCK_SIZE_M": 64, "BLOCK_SIZE_N": 32, "BLOCK_SIZE_K": 256, "GROUP_SIZE_M": 8, "SPLIT_K": 1, "A_load_order": 0, "waves_per_eu": 4, "matrix_instr_nonkdim": 16, "num_warps": 8, "num_ctas": 1, "num_stages": 2, "num_buffers_warp_spec": 0, "num_consumer_groups": 0, "reg_dec_producer": 0, "reg_inc_consumer": 0}, "(4, 28672, 4096, 4096, 1, 408)": {"BLOCK_SIZE_M": 16, "BLOCK_SIZE_N": 128, "BLOCK_SIZE_K": 64, "GROUP_SIZE_M": 8, "SPLIT_K": 16, "A_load_order": 0, "waves_per_eu": 4, "matrix_instr_nonkdim": 16, "num_warps": 4, "num_ctas": 1, "num_stages": 2, "num_buffers_warp_spec": 0, "num_consumer_groups": 0, "reg_dec_producer": 0, "reg_inc_consumer": 0}, "(8, 28672, 4096, 4096, 1, 408)": {"BLOCK_SIZE_M": 16, "BLOCK_SIZE_N": 128, "BLOCK_SIZE_K": 64, "GROUP_SIZE_M": 8, "SPLIT_K": 8, "A_load_order": 0, "waves_per_eu": 2, "matrix_instr_nonkdim": 16, "num_warps": 4, "num_ctas": 1, "num_stages": 2, "num_buffers_warp_spec": 0, "num_consumer_groups": 0, "reg_dec_producer": 0, "reg_inc_consumer": 0}, "(16, 28672, 4096, 4096, 1, 408)": {"BLOCK_SIZE_M": 16, "BLOCK_SIZE_N": 128, "BLOCK_SIZE_K": 64, "GROUP_SIZE_M": 8, "SPLIT_K": 4, "A_load_order": 0, "waves_per_eu": 2, "matrix_instr_nonkdim": 16, "num_warps": 8, "num_ctas": 1, "num_stages": 2, "num_buffers_warp_spec": 0, "num_consumer_groups": 0, "reg_dec_producer": 0, "reg_inc_consumer": 0}, "(32, 28672, 4096, 4096, 1, 408)": {"BLOCK_SIZE_M": 16, "BLOCK_SIZE_N": 64, "BLOCK_SIZE_K": 256, "GROUP_SIZE_M": 8, "SPLIT_K": 1, "A_load_order": 0, "waves_per_eu": 0, "matrix_instr_nonkdim": 16, "num_warps": 4, "num_ctas": 1, "num_stages": 2, "num_buffers_warp_spec": 0, "num_consumer_groups": 0, "reg_dec_producer": 0, "reg_inc_consumer": 0}, "(64, 28672, 4096, 4096, 1, 408)": {"BLOCK_SIZE_M": 64, "BLOCK_SIZE_N": 64, "BLOCK_SIZE_K": 256, "GROUP_SIZE_M": 8, "SPLIT_K": 1, "A_load_order": 0, "waves_per_eu": 2, "matrix_instr_nonkdim": 16, "num_warps": 8, "num_ctas": 1, "num_stages": 2, "num_buffers_warp_spec": 0, "num_consumer_groups": 0, "reg_dec_producer": 0, "reg_inc_consumer": 0}, "(8, 4096, 14336, 14336, 1, 408)": {"BLOCK_SIZE_M": 16, "BLOCK_SIZE_N": 64, "BLOCK_SIZE_K": 256, "GROUP_SIZE_M": 8, "SPLIT_K": 8, "A_load_order": 0, "waves_per_eu": 0, "matrix_instr_nonkdim": 16, "num_warps": 4, "num_ctas": 1, "num_stages": 2, "num_buffers_warp_spec": 0, "num_consumer_groups": 0, "reg_dec_producer": 0, "reg_inc_consumer": 0}, "(16, 4096, 14336, 14336, 1, 408)": {"BLOCK_SIZE_M": 16, "BLOCK_SIZE_N": 64, "BLOCK_SIZE_K": 256, "GROUP_SIZE_M": 8, "SPLIT_K": 8, "A_load_order": 0, "waves_per_eu": 4, "matrix_instr_nonkdim": 16, "num_warps": 4, "num_ctas": 1, "num_stages": 2, "num_buffers_warp_spec": 0, "num_consumer_groups": 0, "reg_dec_producer": 0, "reg_inc_consumer": 0}, "(32, 4096, 14336, 14336, 1, 408)": {"BLOCK_SIZE_M": 32, "BLOCK_SIZE_N": 64, "BLOCK_SIZE_K": 128, "GROUP_SIZE_M": 8, "SPLIT_K": 4, "A_load_order": 0, "waves_per_eu": 2, "matrix_instr_nonkdim": 16, "num_warps": 8, "num_ctas": 1, "num_stages": 2, "num_buffers_warp_spec": 0, "num_consumer_groups": 0, "reg_dec_producer": 0, "reg_inc_consumer": 0}, "(8, 6144, 4096, 4096, 1, 408)": {"BLOCK_SIZE_M": 16, "BLOCK_SIZE_N": 32, "BLOCK_SIZE_K": 512, "GROUP_SIZE_M": 8, "SPLIT_K": 1, "A_load_order": 0, "waves_per_eu": 2, "matrix_instr_nonkdim": 16, "num_warps": 4, "num_ctas": 1, "num_stages": 2, "num_buffers_warp_spec": 0, "num_consumer_groups": 0, "reg_dec_producer": 0, "reg_inc_consumer": 0}, "(16, 6144, 4096, 4096, 1, 408)": {"BLOCK_SIZE_M": 16, "BLOCK_SIZE_N": 32, "BLOCK_SIZE_K": 512, "GROUP_SIZE_M": 8, "SPLIT_K": 1, "A_load_order": 0, "waves_per_eu": 2, "matrix_instr_nonkdim": 16, "num_warps": 4, "num_ctas": 1, "num_stages": 2, "num_buffers_warp_spec": 0, "num_consumer_groups": 0, "reg_dec_producer": 0, "reg_inc_consumer": 0}, "(32, 6144, 4096, 4096, 1, 408)": {"BLOCK_SIZE_M": 32, "BLOCK_SIZE_N": 32, "BLOCK_SIZE_K": 512, "GROUP_SIZE_M": 8, "SPLIT_K": 1, "A_load_order": 0, "waves_per_eu": 2, "matrix_instr_nonkdim": 16, "num_warps": 8, "num_ctas": 1, "num_stages": 2, "num_buffers_warp_spec": 0, "num_consumer_groups": 0, "reg_dec_producer": 0, "reg_inc_consumer": 0}, "(8, 37888, 3584, 3584, 1, 408)": {"BLOCK_SIZE_M": 16, "BLOCK_SIZE_N": 64, "BLOCK_SIZE_K": 256, "GROUP_SIZE_M": 8, "SPLIT_K": 1, "A_load_order": 0, "waves_per_eu": 4, "matrix_instr_nonkdim": 16, "num_warps": 4, "num_ctas": 1, "num_stages": 2, "num_buffers_warp_spec": 0, "num_consumer_groups": 0, "reg_dec_producer": 0, "reg_inc_consumer": 0}, "(16, 37888, 3584, 3584, 1, 408)": {"BLOCK_SIZE_M": 16, "BLOCK_SIZE_N": 64, "BLOCK_SIZE_K": 256, "GROUP_SIZE_M": 8, "SPLIT_K": 1, "A_load_order": 0, "waves_per_eu": 2, "matrix_instr_nonkdim": 16, "num_warps": 4, "num_ctas": 1, "num_stages": 2, "num_buffers_warp_spec": 0, "num_consumer_groups": 0, "reg_dec_producer": 0, "reg_inc_consumer": 0}, "(8, 37888, 3584, 128, 8, 104)": {"BLOCK_SIZE_M": 16, "BLOCK_SIZE_N": 64, "BLOCK_SIZE_K": 128, "GROUP_SIZE_M": 8, "SPLIT_K": 4, "A_load_order": 0, "waves_per_eu": 4, "matrix_instr_nonkdim": 16, "num_warps": 4, "num_ctas": 1, "num_stages": 1, "num_buffers_warp_spec": 0, "num_consumer_groups": 0, "reg_dec_producer": 0, "reg_inc_consumer": 0}, "(16, 37888, 3584, 128, 8, 104)": {"BLOCK_SIZE_M": 16, "BLOCK_SIZE_N": 64, "BLOCK_SIZE_K": 128, "GROUP_SIZE_M": 8, "SPLIT_K": 4, "A_load_order": 0, "waves_per_eu": 4, "matrix_instr_nonkdim": 16, "num_warps": 4, "num_ctas": 1, "num_stages": 1, "num_buffers_warp_spec": 0, "num_consumer_groups": 0, "reg_dec_producer": 0, "reg_inc_consumer": 0}, "(32, 37888, 3584, 128, 8, 104)": {"BLOCK_SIZE_M": 32, "BLOCK_SIZE_N": 64, "BLOCK_SIZE_K": 128, "GROUP_SIZE_M": 8, "SPLIT_K": 1, "A_load_order": 0, "waves_per_eu": 0, "matrix_instr_nonkdim": 16, "num_warps": 4, "num_ctas": 1, "num_stages": 1, "num_buffers_warp_spec": 0, "num_consumer_groups": 0, "reg_dec_producer": 0, "reg_inc_consumer": 0}, "(32, 4608, 3584, 128, 8, 104)": {"BLOCK_SIZE_M": 32, "BLOCK_SIZE_N": 64, "BLOCK_SIZE_K": 128, "GROUP_SIZE_M": 8, "SPLIT_K": 4, "A_load_order": 0, "waves_per_eu": 0, "matrix_instr_nonkdim": 16, "num_warps": 8, "num_ctas": 1, "num_stages": 1, "num_buffers_warp_spec": 0, "num_consumer_groups": 0, "reg_dec_producer": 0, "reg_inc_consumer": 0}, "(64, 4608, 3584, 128, 8, 104)": {"BLOCK_SIZE_M": 64, "BLOCK_SIZE_N": 32, "BLOCK_SIZE_K": 128, "GROUP_SIZE_M": 8, "SPLIT_K": 4, "A_load_order": 0, "waves_per_eu": 4, "matrix_instr_nonkdim": 16, "num_warps": 4, "num_ctas": 1, "num_stages": 1, "num_buffers_warp_spec": 0, "num_consumer_groups": 0, "reg_dec_producer": 0, "reg_inc_consumer": 0}, "(8, 16384, 3072, 128, 8, 104)": {"BLOCK_SIZE_M": 16, "BLOCK_SIZE_N": 64, "BLOCK_SIZE_K": 128, "GROUP_SIZE_M": 8, "SPLIT_K": 2, "A_load_order": 0, "waves_per_eu": 4, "matrix_instr_nonkdim": 16, "num_warps": 4, "num_ctas": 1, "num_stages": 1, "num_buffers_warp_spec": 0, "num_consumer_groups": 0, "reg_dec_producer": 0, "reg_inc_consumer": 0}, "(16, 16384, 3072, 128, 8, 104)": {"BLOCK_SIZE_M": 16, "BLOCK_SIZE_N": 64, "BLOCK_SIZE_K": 128, "GROUP_SIZE_M": 8, "SPLIT_K": 2, "A_load_order": 0, "waves_per_eu": 4, "matrix_instr_nonkdim": 16, "num_warps": 4, "num_ctas": 1, "num_stages": 1, "num_buffers_warp_spec": 0, "num_consumer_groups": 0, "reg_dec_producer": 0, "reg_inc_consumer": 0}, "(32, 16384, 3072, 128, 8, 104)": {"BLOCK_SIZE_M": 32, "BLOCK_SIZE_N": 64, "BLOCK_SIZE_K": 128, "GROUP_SIZE_M": 8, "SPLIT_K": 2, "A_load_order": 0, "waves_per_eu": 0, "matrix_instr_nonkdim": 16, "num_warps": 4, "num_ctas": 1, "num_stages": 1, "num_buffers_warp_spec": 0, "num_consumer_groups": 0, "reg_dec_producer": 0, "reg_inc_consumer": 0}, "(32, 16384, 3072, 64, 8, 104)": {"BLOCK_SIZE_M": 32, "BLOCK_SIZE_N": 64, "BLOCK_SIZE_K": 64, "GROUP_SIZE_M": 8, "SPLIT_K": 2, "A_load_order": 0, "waves_per_eu": 2, "matrix_instr_nonkdim": 16, "num_warps": 4, "num_ctas": 1, "num_stages": 1, "num_buffers_warp_spec": 0, "num_consumer_groups": 0, "reg_dec_producer": 0, "reg_inc_consumer": 0}, "(32, 37888, 3584, 64, 8, 104)": {"BLOCK_SIZE_M": 32, "BLOCK_SIZE_N": 64, "BLOCK_SIZE_K": 64, "GROUP_SIZE_M": 8, "SPLIT_K": 1, "A_load_order": 0, "waves_per_eu": 0, "matrix_instr_nonkdim": 16, "num_warps": 4, "num_ctas": 1, "num_stages": 2, "num_buffers_warp_spec": 0, "num_consumer_groups": 0, "reg_dec_producer": 0, "reg_inc_consumer": 0}, "(4, 4096, 4096, 4096, 1, 408)": {"BLOCK_SIZE_M": 16, "BLOCK_SIZE_N": 32, "BLOCK_SIZE_K": 512, "GROUP_SIZE_M": 8, "SPLIT_K": 1, "A_load_order": 0, "waves_per_eu": 0, "matrix_instr_nonkdim": 16, "num_warps": 8, "num_ctas": 1, "num_stages": 2, "num_buffers_warp_spec": 0, "num_consumer_groups": 0, "reg_dec_producer": 0, "reg_inc_consumer": 0}, "(4, 6144, 4096, 4096, 1, 408)": {"BLOCK_SIZE_M": 16, "BLOCK_SIZE_N": 64, "BLOCK_SIZE_K": 512, "GROUP_SIZE_M": 8, "SPLIT_K": 1, "A_load_order": 0, "waves_per_eu": 4, "matrix_instr_nonkdim": 16, "num_warps": 4, "num_ctas": 1, "num_stages": 1, "num_buffers_warp_spec": 0, "num_consumer_groups": 0, "reg_dec_producer": 0, "reg_inc_consumer": 0}, "(64, 6144, 4096, 4096, 1, 408)": {"BLOCK_SIZE_M": 64, "BLOCK_SIZE_N": 32, "BLOCK_SIZE_K": 256, "GROUP_SIZE_M": 8, "SPLIT_K": 1, "A_load_order": 0, "waves_per_eu": 4, "matrix_instr_nonkdim": 16, "num_warps": 8, "num_ctas": 1, "num_stages": 2, "num_buffers_warp_spec": 0, "num_consumer_groups": 0, "reg_dec_producer": 0, "reg_inc_consumer": 0}, "(4, 4096, 14336, 14336, 1, 408)": {"BLOCK_SIZE_M": 16, "BLOCK_SIZE_N": 128, "BLOCK_SIZE_K": 128, "GROUP_SIZE_M": 8, "SPLIT_K": 8, "A_load_order": 0, "waves_per_eu": 0, "matrix_instr_nonkdim": 16, "num_warps": 8, "num_ctas": 1, "num_stages": 2, "num_buffers_warp_spec": 0, "num_consumer_groups": 0, "reg_dec_producer": 0, "reg_inc_consumer": 0}, "(64, 4096, 14336, 14336, 1, 408)": {"BLOCK_SIZE_M": 32, "BLOCK_SIZE_N": 32, "BLOCK_SIZE_K": 512, "GROUP_SIZE_M": 8, "SPLIT_K": 1, "A_load_order": 0, "waves_per_eu": 2, "matrix_instr_nonkdim": 16, "num_warps": 4, "num_ctas": 1, "num_stages": 2, "num_buffers_warp_spec": 0, "num_consumer_groups": 0, "reg_dec_producer": 0, "reg_inc_consumer": 0}, "(4, 3584, 3584, 3584, 1, 408)": {"BLOCK_SIZE_M": 16, "BLOCK_SIZE_N": 32, "BLOCK_SIZE_K": 512, "GROUP_SIZE_M": 8, "SPLIT_K": 1, "A_load_order": 0, "waves_per_eu": 0, "matrix_instr_nonkdim": 16, "num_warps": 4, "num_ctas": 1, "num_stages": 2, "num_buffers_warp_spec": 0, "num_consumer_groups": 0, "reg_dec_producer": 0, "reg_inc_consumer": 0}, "(8, 3584, 3584, 3584, 1, 408)": {"BLOCK_SIZE_M": 16, "BLOCK_SIZE_N": 32, "BLOCK_SIZE_K": 512, "GROUP_SIZE_M": 8, "SPLIT_K": 1, "A_load_order": 0, "waves_per_eu": 4, "matrix_instr_nonkdim": 16, "num_warps": 4, "num_ctas": 1, "num_stages": 1, "num_buffers_warp_spec": 0, "num_consumer_groups": 0, "reg_dec_producer": 0, "reg_inc_consumer": 0}, "(16, 3584, 3584, 3584, 1, 408)": {"BLOCK_SIZE_M": 16, "BLOCK_SIZE_N": 64, "BLOCK_SIZE_K": 512, "GROUP_SIZE_M": 8, "SPLIT_K": 1, "A_load_order": 0, "waves_per_eu": 2, "matrix_instr_nonkdim": 16, "num_warps": 4, "num_ctas": 1, "num_stages": 1, "num_buffers_warp_spec": 0, "num_consumer_groups": 0, "reg_dec_producer": 0, "reg_inc_consumer": 0}, "(32, 3584, 3584, 3584, 1, 408)": {"BLOCK_SIZE_M": 32, "BLOCK_SIZE_N": 32, "BLOCK_SIZE_K": 512, "GROUP_SIZE_M": 8, "SPLIT_K": 1, "A_load_order": 0, "waves_per_eu": 0, "matrix_instr_nonkdim": 16, "num_warps": 8, "num_ctas": 1, "num_stages": 2, "num_buffers_warp_spec": 0, "num_consumer_groups": 0, "reg_dec_producer": 0, "reg_inc_consumer": 0}, "(64, 3584, 3584, 3584, 1, 408)": {"BLOCK_SIZE_M": 64, "BLOCK_SIZE_N": 32, "BLOCK_SIZE_K": 256, "GROUP_SIZE_M": 8, "SPLIT_K": 1, "A_load_order": 0, "waves_per_eu": 2, "matrix_instr_nonkdim": 16, "num_warps": 8, "num_ctas": 1, "num_stages": 2, "num_buffers_warp_spec": 0, "num_consumer_groups": 0, "reg_dec_producer": 0, "reg_inc_consumer": 0}, "(4, 4608, 3584, 3584, 1, 408)": {"BLOCK_SIZE_M": 16, "BLOCK_SIZE_N": 32, "BLOCK_SIZE_K": 512, "GROUP_SIZE_M": 8, "SPLIT_K": 1, "A_load_order": 0, "waves_per_eu": 4, "matrix_instr_nonkdim": 16, "num_warps": 4, "num_ctas": 1, "num_stages": 1, "num_buffers_warp_spec": 0, "num_consumer_groups": 0, "reg_dec_producer": 0, "reg_inc_consumer": 0}, "(8, 4608, 3584, 3584, 1, 408)": {"BLOCK_SIZE_M": 16, "BLOCK_SIZE_N": 32, "BLOCK_SIZE_K": 256, "GROUP_SIZE_M": 8, "SPLIT_K": 1, "A_load_order": 0, "waves_per_eu": 4, "matrix_instr_nonkdim": 16, "num_warps": 4, "num_ctas": 1, "num_stages": 2, "num_buffers_warp_spec": 0, "num_consumer_groups": 0, "reg_dec_producer": 0, "reg_inc_consumer": 0}, "(16, 4608, 3584, 3584, 1, 408)": {"BLOCK_SIZE_M": 16, "BLOCK_SIZE_N": 32, "BLOCK_SIZE_K": 256, "GROUP_SIZE_M": 8, "SPLIT_K": 1, "A_load_order": 0, "waves_per_eu": 4, "matrix_instr_nonkdim": 16, "num_warps": 4, "num_ctas": 1, "num_stages": 2, "num_buffers_warp_spec": 0, "num_consumer_groups": 0, "reg_dec_producer": 0, "reg_inc_consumer": 0}, "(32, 4608, 3584, 3584, 1, 408)": {"BLOCK_SIZE_M": 32, "BLOCK_SIZE_N": 32, "BLOCK_SIZE_K": 512, "GROUP_SIZE_M": 8, "SPLIT_K": 1, "A_load_order": 0, "waves_per_eu": 4, "matrix_instr_nonkdim": 16, "num_warps": 8, "num_ctas": 1, "num_stages": 2, "num_buffers_warp_spec": 0, "num_consumer_groups": 0, "reg_dec_producer": 0, "reg_inc_consumer": 0}, "(64, 4608, 3584, 3584, 1, 408)": {"BLOCK_SIZE_M": 32, "BLOCK_SIZE_N": 64, "BLOCK_SIZE_K": 256, "GROUP_SIZE_M": 8, "SPLIT_K": 1, "A_load_order": 0, "waves_per_eu": 4, "matrix_instr_nonkdim": 16, "num_warps": 8, "num_ctas": 1, "num_stages": 2, "num_buffers_warp_spec": 0, "num_consumer_groups": 0, "reg_dec_producer": 0, "reg_inc_consumer": 0}, "(4, 3584, 18944, 18944, 1, 408)": {"BLOCK_SIZE_M": 16, "BLOCK_SIZE_N": 32, "BLOCK_SIZE_K": 128, "GROUP_SIZE_M": 8, "SPLIT_K": 4, "A_load_order": 0, "waves_per_eu": 0, "matrix_instr_nonkdim": 16, "num_warps": 4, "num_ctas": 1, "num_stages": 2, "num_buffers_warp_spec": 0, "num_consumer_groups": 0, "reg_dec_producer": 0, "reg_inc_consumer": 0}, "(8, 3584, 18944, 18944, 1, 408)": {"BLOCK_SIZE_M": 16, "BLOCK_SIZE_N": 128, "BLOCK_SIZE_K": 64, "GROUP_SIZE_M": 8, "SPLIT_K": 8, "A_load_order": 0, "waves_per_eu": 0, "matrix_instr_nonkdim": 16, "num_warps": 8, "num_ctas": 1, "num_stages": 2, "num_buffers_warp_spec": 0, "num_consumer_groups": 0, "reg_dec_producer": 0, "reg_inc_consumer": 0}, "(16, 3584, 18944, 18944, 1, 408)": {"BLOCK_SIZE_M": 16, "BLOCK_SIZE_N": 64, "BLOCK_SIZE_K": 64, "GROUP_SIZE_M": 8, "SPLIT_K": 8, "A_load_order": 0, "waves_per_eu": 0, "matrix_instr_nonkdim": 16, "num_warps": 4, "num_ctas": 1, "num_stages": 2, "num_buffers_warp_spec": 0, "num_consumer_groups": 0, "reg_dec_producer": 0, "reg_inc_consumer": 0}, "(32, 3584, 18944, 18944, 1, 408)": {"BLOCK_SIZE_M": 32, "BLOCK_SIZE_N": 64, "BLOCK_SIZE_K": 128, "GROUP_SIZE_M": 8, "SPLIT_K": 4, "A_load_order": 0, "waves_per_eu": 4, "matrix_instr_nonkdim": 16, "num_warps": 8, "num_ctas": 1, "num_stages": 2, "num_buffers_warp_spec": 0, "num_consumer_groups": 0, "reg_dec_producer": 0, "reg_inc_consumer": 0}, "(64, 3584, 18944, 18944, 1, 408)": {"BLOCK_SIZE_M": 64, "BLOCK_SIZE_N": 64, "BLOCK_SIZE_K": 128, "GROUP_SIZE_M": 8, "SPLIT_K": 4, "A_load_order": 0, "waves_per_eu": 0, "matrix_instr_nonkdim": 16, "num_warps": 8, "num_ctas": 1, "num_stages": 2, "num_buffers_warp_spec": 0, "num_consumer_groups": 0, "reg_dec_producer": 0, "reg_inc_consumer": 0}, "(4, 37888, 3584, 3584, 1, 408)": {"BLOCK_SIZE_M": 16, "BLOCK_SIZE_N": 64, "BLOCK_SIZE_K": 256, "GROUP_SIZE_M": 8, "SPLIT_K": 1, "A_load_order": 0, "waves_per_eu": 4, "matrix_instr_nonkdim": 16, "num_warps": 4, "num_ctas": 1, "num_stages": 2, "num_buffers_warp_spec": 0, "num_consumer_groups": 0, "reg_dec_producer": 0, "reg_inc_consumer": 0}, "(32, 37888, 3584, 3584, 1, 408)": {"BLOCK_SIZE_M": 32, "BLOCK_SIZE_N": 64, "BLOCK_SIZE_K": 256, "GROUP_SIZE_M": 8, "SPLIT_K": 1, "A_load_order": 0, "waves_per_eu": 2, "matrix_instr_nonkdim": 16, "num_warps": 4, "num_ctas": 1, "num_stages": 2, "num_buffers_warp_spec": 0, "num_consumer_groups": 0, "reg_dec_producer": 0, "reg_inc_consumer": 0}, "(64, 37888, 3584, 3584, 1, 408)": {"BLOCK_SIZE_M": 64, "BLOCK_SIZE_N": 64, "BLOCK_SIZE_K": 256, "GROUP_SIZE_M": 8, "SPLIT_K": 1, "A_load_order": 0, "waves_per_eu": 2, "matrix_instr_nonkdim": 16, "num_warps": 4, "num_ctas": 1, "num_stages": 2, "num_buffers_warp_spec": 0, "num_consumer_groups": 0, "reg_dec_producer": 0, "reg_inc_consumer": 0}, "(4, 3072, 3072, 3072, 1, 408)": {"BLOCK_SIZE_M": 16, "BLOCK_SIZE_N": 32, "BLOCK_SIZE_K": 512, "GROUP_SIZE_M": 8, "SPLIT_K": 1, "A_load_order": 0, "waves_per_eu": 2, "matrix_instr_nonkdim": 16, "num_warps": 4, "num_ctas": 1, "num_stages": 2, "num_buffers_warp_spec": 0, "num_consumer_groups": 0, "reg_dec_producer": 0, "reg_inc_consumer": 0}, "(8, 3072, 3072, 3072, 1, 408)": {"BLOCK_SIZE_M": 16, "BLOCK_SIZE_N": 64, "BLOCK_SIZE_K": 512, "GROUP_SIZE_M": 8, "SPLIT_K": 1, "A_load_order": 0, "waves_per_eu": 2, "matrix_instr_nonkdim": 16, "num_warps": 4, "num_ctas": 1, "num_stages": 1, "num_buffers_warp_spec": 0, "num_consumer_groups": 0, "reg_dec_producer": 0, "reg_inc_consumer": 0}, "(16, 3072, 3072, 3072, 1, 408)": {"BLOCK_SIZE_M": 16, "BLOCK_SIZE_N": 32, "BLOCK_SIZE_K": 256, "GROUP_SIZE_M": 8, "SPLIT_K": 1, "A_load_order": 0, "waves_per_eu": 4, "matrix_instr_nonkdim": 16, "num_warps": 4, "num_ctas": 1, "num_stages": 2, "num_buffers_warp_spec": 0, "num_consumer_groups": 0, "reg_dec_producer": 0, "reg_inc_consumer": 0}, "(32, 3072, 3072, 3072, 1, 408)": {"BLOCK_SIZE_M": 32, "BLOCK_SIZE_N": 32, "BLOCK_SIZE_K": 512, "GROUP_SIZE_M": 8, "SPLIT_K": 1, "A_load_order": 0, "waves_per_eu": 2, "matrix_instr_nonkdim": 16, "num_warps": 4, "num_ctas": 1, "num_stages": 2, "num_buffers_warp_spec": 0, "num_consumer_groups": 0, "reg_dec_producer": 0, "reg_inc_consumer": 0}, "(64, 3072, 3072, 3072, 1, 408)": {"BLOCK_SIZE_M": 32, "BLOCK_SIZE_N": 32, "BLOCK_SIZE_K": 256, "GROUP_SIZE_M": 8, "SPLIT_K": 1, "A_load_order": 0, "waves_per_eu": 2, "matrix_instr_nonkdim": 16, "num_warps": 8, "num_ctas": 1, "num_stages": 2, "num_buffers_warp_spec": 0, "num_consumer_groups": 0, "reg_dec_producer": 0, "reg_inc_consumer": 0}, "(4, 5120, 3072, 3072, 1, 408)": {"BLOCK_SIZE_M": 16, "BLOCK_SIZE_N": 64, "BLOCK_SIZE_K": 512, "GROUP_SIZE_M": 8, "SPLIT_K": 1, "A_load_order": 0, "waves_per_eu": 2, "matrix_instr_nonkdim": 16, "num_warps": 4, "num_ctas": 1, "num_stages": 1, "num_buffers_warp_spec": 0, "num_consumer_groups": 0, "reg_dec_producer": 0, "reg_inc_consumer": 0}, "(8, 5120, 3072, 3072, 1, 408)": {"BLOCK_SIZE_M": 16, "BLOCK_SIZE_N": 64, "BLOCK_SIZE_K": 512, "GROUP_SIZE_M": 8, "SPLIT_K": 1, "A_load_order": 0, "waves_per_eu": 4, "matrix_instr_nonkdim": 16, "num_warps": 4, "num_ctas": 1, "num_stages": 1, "num_buffers_warp_spec": 0, "num_consumer_groups": 0, "reg_dec_producer": 0, "reg_inc_consumer": 0}, "(16, 5120, 3072, 3072, 1, 408)": {"BLOCK_SIZE_M": 16, "BLOCK_SIZE_N": 32, "BLOCK_SIZE_K": 512, "GROUP_SIZE_M": 8, "SPLIT_K": 1, "A_load_order": 0, "waves_per_eu": 2, "matrix_instr_nonkdim": 16, "num_warps": 4, "num_ctas": 1, "num_stages": 2, "num_buffers_warp_spec": 0, "num_consumer_groups": 0, "reg_dec_producer": 0, "reg_inc_consumer": 0}, "(32, 5120, 3072, 3072, 1, 408)": {"BLOCK_SIZE_M": 32, "BLOCK_SIZE_N": 32, "BLOCK_SIZE_K": 512, "GROUP_SIZE_M": 8, "SPLIT_K": 1, "A_load_order": 0, "waves_per_eu": 2, "matrix_instr_nonkdim": 16, "num_warps": 8, "num_ctas": 1, "num_stages": 2, "num_buffers_warp_spec": 0, "num_consumer_groups": 0, "reg_dec_producer": 0, "reg_inc_consumer": 0}, "(64, 5120, 3072, 3072, 1, 408)": {"BLOCK_SIZE_M": 64, "BLOCK_SIZE_N": 32, "BLOCK_SIZE_K": 256, "GROUP_SIZE_M": 8, "SPLIT_K": 1, "A_load_order": 0, "waves_per_eu": 2, "matrix_instr_nonkdim": 16, "num_warps": 8, "num_ctas": 1, "num_stages": 2, "num_buffers_warp_spec": 0, "num_consumer_groups": 0, "reg_dec_producer": 0, "reg_inc_consumer": 0}, "(4, 3072, 8192, 8192, 1, 408)": {"BLOCK_SIZE_M": 16, "BLOCK_SIZE_N": 64, "BLOCK_SIZE_K": 128, "GROUP_SIZE_M": 8, "SPLIT_K": 16, "A_load_order": 0, "waves_per_eu": 4, "matrix_instr_nonkdim": 16, "num_warps": 4, "num_ctas": 1, "num_stages": 2, "num_buffers_warp_spec": 0, "num_consumer_groups": 0, "reg_dec_producer": 0, "reg_inc_consumer": 0}, "(8, 3072, 8192, 8192, 1, 408)": {"BLOCK_SIZE_M": 16, "BLOCK_SIZE_N": 128, "BLOCK_SIZE_K": 256, "GROUP_SIZE_M": 8, "SPLIT_K": 16, "A_load_order": 0, "waves_per_eu": 2, "matrix_instr_nonkdim": 16, "num_warps": 8, "num_ctas": 1, "num_stages": 1, "num_buffers_warp_spec": 0, "num_consumer_groups": 0, "reg_dec_producer": 0, "reg_inc_consumer": 0}, "(16, 3072, 8192, 8192, 1, 408)": {"BLOCK_SIZE_M": 16, "BLOCK_SIZE_N": 128, "BLOCK_SIZE_K": 128, "GROUP_SIZE_M": 8, "SPLIT_K": 8, "A_load_order": 0, "waves_per_eu": 4, "matrix_instr_nonkdim": 16, "num_warps": 8, "num_ctas": 1, "num_stages": 2, "num_buffers_warp_spec": 0, "num_consumer_groups": 0, "reg_dec_producer": 0, "reg_inc_consumer": 0}, "(32, 3072, 8192, 8192, 1, 408)": {"BLOCK_SIZE_M": 32, "BLOCK_SIZE_N": 64, "BLOCK_SIZE_K": 256, "GROUP_SIZE_M": 8, "SPLIT_K": 4, "A_load_order": 0, "waves_per_eu": 2, "matrix_instr_nonkdim": 16, "num_warps": 8, "num_ctas": 1, "num_stages": 2, "num_buffers_warp_spec": 0, "num_consumer_groups": 0, "reg_dec_producer": 0, "reg_inc_consumer": 0}, "(64, 3072, 8192, 8192, 1, 408)": {"BLOCK_SIZE_M": 32, "BLOCK_SIZE_N": 32, "BLOCK_SIZE_K": 512, "GROUP_SIZE_M": 8, "SPLIT_K": 1, "A_load_order": 0, "waves_per_eu": 2, "matrix_instr_nonkdim": 16, "num_warps": 4, "num_ctas": 1, "num_stages": 2, "num_buffers_warp_spec": 0, "num_consumer_groups": 0, "reg_dec_producer": 0, "reg_inc_consumer": 0}, "(4, 16384, 3072, 3072, 1, 408)": {"BLOCK_SIZE_M": 16, "BLOCK_SIZE_N": 64, "BLOCK_SIZE_K": 512, "GROUP_SIZE_M": 8, "SPLIT_K": 1, "A_load_order": 0, "waves_per_eu": 0, "matrix_instr_nonkdim": 16, "num_warps": 4, "num_ctas": 1, "num_stages": 1, "num_buffers_warp_spec": 0, "num_consumer_groups": 0, "reg_dec_producer": 0, "reg_inc_consumer": 0}, "(8, 16384, 3072, 3072, 1, 408)": {"BLOCK_SIZE_M": 16, "BLOCK_SIZE_N": 64, "BLOCK_SIZE_K": 512, "GROUP_SIZE_M": 8, "SPLIT_K": 1, "A_load_order": 0, "waves_per_eu": 2, "matrix_instr_nonkdim": 16, "num_warps": 4, "num_ctas": 1, "num_stages": 1, "num_buffers_warp_spec": 0, "num_consumer_groups": 0, "reg_dec_producer": 0, "reg_inc_consumer": 0}, "(16, 16384, 3072, 3072, 1, 408)": {"BLOCK_SIZE_M": 16, "BLOCK_SIZE_N": 64, "BLOCK_SIZE_K": 512, "GROUP_SIZE_M": 8, "SPLIT_K": 1, "A_load_order": 0, "waves_per_eu": 4, "matrix_instr_nonkdim": 16, "num_warps": 4, "num_ctas": 1, "num_stages": 1, "num_buffers_warp_spec": 0, "num_consumer_groups": 0, "reg_dec_producer": 0, "reg_inc_consumer": 0}, "(32, 16384, 3072, 3072, 1, 408)": {"BLOCK_SIZE_M": 32, "BLOCK_SIZE_N": 64, "BLOCK_SIZE_K": 256, "GROUP_SIZE_M": 8, "SPLIT_K": 1, "A_load_order": 0, "waves_per_eu": 2, "matrix_instr_nonkdim": 16, "num_warps": 8, "num_ctas": 1, "num_stages": 2, "num_buffers_warp_spec": 0, "num_consumer_groups": 0, "reg_dec_producer": 0, "reg_inc_consumer": 0}, "(64, 16384, 3072, 3072, 1, 408)": {"BLOCK_SIZE_M": 64, "BLOCK_SIZE_N": 64, "BLOCK_SIZE_K": 128, "GROUP_SIZE_M": 8, "SPLIT_K": 1, "A_load_order": 0, "waves_per_eu": 4, "matrix_instr_nonkdim": 16, "num_warps": 8, "num_ctas": 1, "num_stages": 2, "num_buffers_warp_spec": 0, "num_consumer_groups": 0, "reg_dec_producer": 0, "reg_inc_consumer": 0}, "(4, 4096, 4096, 128, 8, 104)": {"BLOCK_SIZE_M": 16, "BLOCK_SIZE_N": 64, "BLOCK_SIZE_K": 128, "GROUP_SIZE_M": 8, "SPLIT_K": 16, "A_load_order": 0, "waves_per_eu": 4, "matrix_instr_nonkdim": 16, "num_warps": 4, "num_ctas": 1, "num_stages": 1, "num_buffers_warp_spec": 0, "num_consumer_groups": 0, "reg_dec_producer": 0, "reg_inc_consumer": 0}, "(8, 4096, 4096, 128, 8, 104)": {"BLOCK_SIZE_M": 16, "BLOCK_SIZE_N": 64, "BLOCK_SIZE_K": 128, "GROUP_SIZE_M": 8, "SPLIT_K": 16, "A_load_order": 0, "waves_per_eu": 2, "matrix_instr_nonkdim": 16, "num_warps": 4, "num_ctas": 1, "num_stages": 1, "num_buffers_warp_spec": 0, "num_consumer_groups": 0, "reg_dec_producer": 0, "reg_inc_consumer": 0}, "(16, 4096, 4096, 128, 8, 104)": {"BLOCK_SIZE_M": 16, "BLOCK_SIZE_N": 64, "BLOCK_SIZE_K": 64, "GROUP_SIZE_M": 8, "SPLIT_K": 8, "A_load_order": 0, "waves_per_eu": 2, "matrix_instr_nonkdim": 16, "num_warps": 4, "num_ctas": 1, "num_stages": 1, "num_buffers_warp_spec": 0, "num_consumer_groups": 0, "reg_dec_producer": 0, "reg_inc_consumer": 0}, "(32, 4096, 4096, 128, 8, 104)": {"BLOCK_SIZE_M": 32, "BLOCK_SIZE_N": 32, "BLOCK_SIZE_K": 128, "GROUP_SIZE_M": 8, "SPLIT_K": 4, "A_load_order": 0, "waves_per_eu": 4, "matrix_instr_nonkdim": 16, "num_warps": 4, "num_ctas": 1, "num_stages": 1, "num_buffers_warp_spec": 0, "num_consumer_groups": 0, "reg_dec_producer": 0, "reg_inc_consumer": 0}, "(64, 4096, 4096, 128, 8, 104)": {"BLOCK_SIZE_M": 64, "BLOCK_SIZE_N": 32, "BLOCK_SIZE_K": 128, "GROUP_SIZE_M": 8, "SPLIT_K": 4, "A_load_order": 0, "waves_per_eu": 2, "matrix_instr_nonkdim": 16, "num_warps": 4, "num_ctas": 1, "num_stages": 1, "num_buffers_warp_spec": 0, "num_consumer_groups": 0, "reg_dec_producer": 0, "reg_inc_consumer": 0}, "(4, 6144, 4096, 128, 8, 104)": {"BLOCK_SIZE_M": 16, "BLOCK_SIZE_N": 64, "BLOCK_SIZE_K": 128, "GROUP_SIZE_M": 8, "SPLIT_K": 8, "A_load_order": 0, "waves_per_eu": 2, "matrix_instr_nonkdim": 16, "num_warps": 4, "num_ctas": 1, "num_stages": 1, "num_buffers_warp_spec": 0, "num_consumer_groups": 0, "reg_dec_producer": 0, "reg_inc_consumer": 0}, "(8, 6144, 4096, 128, 8, 104)": {"BLOCK_SIZE_M": 16, "BLOCK_SIZE_N": 64, "BLOCK_SIZE_K": 128, "GROUP_SIZE_M": 8, "SPLIT_K": 8, "A_load_order": 0, "waves_per_eu": 4, "matrix_instr_nonkdim": 16, "num_warps": 4, "num_ctas": 1, "num_stages": 1, "num_buffers_warp_spec": 0, "num_consumer_groups": 0, "reg_dec_producer": 0, "reg_inc_consumer": 0}, "(16, 6144, 4096, 128, 8, 104)": {"BLOCK_SIZE_M": 16, "BLOCK_SIZE_N": 64, "BLOCK_SIZE_K": 128, "GROUP_SIZE_M": 8, "SPLIT_K": 16, "A_load_order": 0, "waves_per_eu": 4, "matrix_instr_nonkdim": 16, "num_warps": 4, "num_ctas": 1, "num_stages": 1, "num_buffers_warp_spec": 0, "num_consumer_groups": 0, "reg_dec_producer": 0, "reg_inc_consumer": 0}, "(32, 6144, 4096, 128, 8, 104)": {"BLOCK_SIZE_M": 32, "BLOCK_SIZE_N": 64, "BLOCK_SIZE_K": 128, "GROUP_SIZE_M": 8, "SPLIT_K": 8, "A_load_order": 0, "waves_per_eu": 2, "matrix_instr_nonkdim": 16, "num_warps": 8, "num_ctas": 1, "num_stages": 1, "num_buffers_warp_spec": 0, "num_consumer_groups": 0, "reg_dec_producer": 0, "reg_inc_consumer": 0}, "(64, 6144, 4096, 128, 8, 104)": {"BLOCK_SIZE_M": 64, "BLOCK_SIZE_N": 64, "BLOCK_SIZE_K": 128, "GROUP_SIZE_M": 8, "SPLIT_K": 4, "A_load_order": 0, "waves_per_eu": 2, "matrix_instr_nonkdim": 16, "num_warps": 4, "num_ctas": 1, "num_stages": 1, "num_buffers_warp_spec": 0, "num_consumer_groups": 0, "reg_dec_producer": 0, "reg_inc_consumer": 0}, "(4, 4096, 14336, 128, 8, 104)": {"BLOCK_SIZE_M": 16, "BLOCK_SIZE_N": 128, "BLOCK_SIZE_K": 64, "GROUP_SIZE_M": 8, "SPLIT_K": 16, "A_load_order": 0, "waves_per_eu": 2, "matrix_instr_nonkdim": 16, "num_warps": 8, "num_ctas": 1, "num_stages": 1, "num_buffers_warp_spec": 0, "num_consumer_groups": 0, "reg_dec_producer": 0, "reg_inc_consumer": 0}, "(8, 4096, 14336, 128, 8, 104)": {"BLOCK_SIZE_M": 16, "BLOCK_SIZE_N": 64, "BLOCK_SIZE_K": 128, "GROUP_SIZE_M": 8, "SPLIT_K": 8, "A_load_order": 0, "waves_per_eu": 4, "matrix_instr_nonkdim": 16, "num_warps": 4, "num_ctas": 1, "num_stages": 1, "num_buffers_warp_spec": 0, "num_consumer_groups": 0, "reg_dec_producer": 0, "reg_inc_consumer": 0}, "(16, 4096, 14336, 128, 8, 104)": {"BLOCK_SIZE_M": 16, "BLOCK_SIZE_N": 128, "BLOCK_SIZE_K": 64, "GROUP_SIZE_M": 8, "SPLIT_K": 16, "A_load_order": 0, "waves_per_eu": 2, "matrix_instr_nonkdim": 16, "num_warps": 8, "num_ctas": 1, "num_stages": 1, "num_buffers_warp_spec": 0, "num_consumer_groups": 0, "reg_dec_producer": 0, "reg_inc_consumer": 0}, "(32, 4096, 14336, 128, 8, 104)": {"BLOCK_SIZE_M": 32, "BLOCK_SIZE_N": 64, "BLOCK_SIZE_K": 128, "GROUP_SIZE_M": 8, "SPLIT_K": 8, "A_load_order": 0, "waves_per_eu": 4, "matrix_instr_nonkdim": 16, "num_warps": 4, "num_ctas": 1, "num_stages": 1, "num_buffers_warp_spec": 0, "num_consumer_groups": 0, "reg_dec_producer": 0, "reg_inc_consumer": 0}, "(64, 4096, 14336, 128, 8, 104)": {"BLOCK_SIZE_M": 64, "BLOCK_SIZE_N": 64, "BLOCK_SIZE_K": 64, "GROUP_SIZE_M": 8, "SPLIT_K": 8, "A_load_order": 0, "waves_per_eu": 2, "matrix_instr_nonkdim": 16, "num_warps": 4, "num_ctas": 1, "num_stages": 1, "num_buffers_warp_spec": 0, "num_consumer_groups": 0, "reg_dec_producer": 0, "reg_inc_consumer": 0}, "(4, 28672, 4096, 128, 8, 104)": {"BLOCK_SIZE_M": 16, "BLOCK_SIZE_N": 64, "BLOCK_SIZE_K": 128, "GROUP_SIZE_M": 8, "SPLIT_K": 8, "A_load_order": 0, "waves_per_eu": 4, "matrix_instr_nonkdim": 16, "num_warps": 4, "num_ctas": 1, "num_stages": 1, "num_buffers_warp_spec": 0, "num_consumer_groups": 0, "reg_dec_producer": 0, "reg_inc_consumer": 0}, "(8, 28672, 4096, 128, 8, 104)": {"BLOCK_SIZE_M": 16, "BLOCK_SIZE_N": 64, "BLOCK_SIZE_K": 128, "GROUP_SIZE_M": 8, "SPLIT_K": 8, "A_load_order": 0, "waves_per_eu": 2, "matrix_instr_nonkdim": 16, "num_warps": 4, "num_ctas": 1, "num_stages": 1, "num_buffers_warp_spec": 0, "num_consumer_groups": 0, "reg_dec_producer": 0, "reg_inc_consumer": 0}, "(16, 28672, 4096, 128, 8, 104)": {"BLOCK_SIZE_M": 16, "BLOCK_SIZE_N": 64, "BLOCK_SIZE_K": 128, "GROUP_SIZE_M": 8, "SPLIT_K": 8, "A_load_order": 0, "waves_per_eu": 4, "matrix_instr_nonkdim": 16, "num_warps": 4, "num_ctas": 1, "num_stages": 1, "num_buffers_warp_spec": 0, "num_consumer_groups": 0, "reg_dec_producer": 0, "reg_inc_consumer": 0}, "(32, 28672, 4096, 128, 8, 104)": {"BLOCK_SIZE_M": 32, "BLOCK_SIZE_N": 64, "BLOCK_SIZE_K": 128, "GROUP_SIZE_M": 8, "SPLIT_K": 2, "A_load_order": 0, "waves_per_eu": 2, "matrix_instr_nonkdim": 16, "num_warps": 4, "num_ctas": 1, "num_stages": 1, "num_buffers_warp_spec": 0, "num_consumer_groups": 0, "reg_dec_producer": 0, "reg_inc_consumer": 0}, "(64, 28672, 4096, 128, 8, 104)": {"BLOCK_SIZE_M": 64, "BLOCK_SIZE_N": 64, "BLOCK_SIZE_K": 128, "GROUP_SIZE_M": 8, "SPLIT_K": 2, "A_load_order": 0, "waves_per_eu": 2, "matrix_instr_nonkdim": 16, "num_warps": 4, "num_ctas": 1, "num_stages": 1, "num_buffers_warp_spec": 0, "num_consumer_groups": 0, "reg_dec_producer": 0, "reg_inc_consumer": 0}, "(4, 3584, 3584, 128, 8, 104)": {"BLOCK_SIZE_M": 16, "BLOCK_SIZE_N": 64, "BLOCK_SIZE_K": 32, "GROUP_SIZE_M": 8, "SPLIT_K": 16, "A_load_order": 0, "waves_per_eu": 4, "matrix_instr_nonkdim": 16, "num_warps": 4, "num_ctas": 1, "num_stages": 2, "num_buffers_warp_spec": 0, "num_consumer_groups": 0, "reg_dec_producer": 0, "reg_inc_consumer": 0}, "(8, 3584, 3584, 128, 8, 104)": {"BLOCK_SIZE_M": 16, "BLOCK_SIZE_N": 64, "BLOCK_SIZE_K": 32, "GROUP_SIZE_M": 8, "SPLIT_K": 16, "A_load_order": 0, "waves_per_eu": 2, "matrix_instr_nonkdim": 16, "num_warps": 4, "num_ctas": 1, "num_stages": 1, "num_buffers_warp_spec": 0, "num_consumer_groups": 0, "reg_dec_producer": 0, "reg_inc_consumer": 0}, "(16, 3584, 3584, 128, 8, 104)": {"BLOCK_SIZE_M": 16, "BLOCK_SIZE_N": 64, "BLOCK_SIZE_K": 64, "GROUP_SIZE_M": 8, "SPLIT_K": 8, "A_load_order": 0, "waves_per_eu": 4, "matrix_instr_nonkdim": 16, "num_warps": 4, "num_ctas": 1, "num_stages": 2, "num_buffers_warp_spec": 0, "num_consumer_groups": 0, "reg_dec_producer": 0, "reg_inc_consumer": 0}, "(32, 3584, 3584, 128, 8, 104)": {"BLOCK_SIZE_M": 32, "BLOCK_SIZE_N": 32, "BLOCK_SIZE_K": 128, "GROUP_SIZE_M": 8, "SPLIT_K": 4, "A_load_order": 0, "waves_per_eu": 2, "matrix_instr_nonkdim": 16, "num_warps": 4, "num_ctas": 1, "num_stages": 1, "num_buffers_warp_spec": 0, "num_consumer_groups": 0, "reg_dec_producer": 0, "reg_inc_consumer": 0}, "(64, 3584, 3584, 128, 8, 104)": {"BLOCK_SIZE_M": 64, "BLOCK_SIZE_N": 32, "BLOCK_SIZE_K": 128, "GROUP_SIZE_M": 8, "SPLIT_K": 4, "A_load_order": 0, "waves_per_eu": 4, "matrix_instr_nonkdim": 16, "num_warps": 4, "num_ctas": 1, "num_stages": 1, "num_buffers_warp_spec": 0, "num_consumer_groups": 0, "reg_dec_producer": 0, "reg_inc_consumer": 0}, "(4, 4608, 3584, 128, 8, 104)": {"BLOCK_SIZE_M": 16, "BLOCK_SIZE_N": 64, "BLOCK_SIZE_K": 32, "GROUP_SIZE_M": 8, "SPLIT_K": 8, "A_load_order": 0, "waves_per_eu": 2, "matrix_instr_nonkdim": 16, "num_warps": 4, "num_ctas": 1, "num_stages": 1, "num_buffers_warp_spec": 0, "num_consumer_groups": 0, "reg_dec_producer": 0, "reg_inc_consumer": 0}, "(8, 4608, 3584, 128, 8, 104)": {"BLOCK_SIZE_M": 16, "BLOCK_SIZE_N": 64, "BLOCK_SIZE_K": 64, "GROUP_SIZE_M": 8, "SPLIT_K": 8, "A_load_order": 0, "waves_per_eu": 4, "matrix_instr_nonkdim": 16, "num_warps": 4, "num_ctas": 1, "num_stages": 1, "num_buffers_warp_spec": 0, "num_consumer_groups": 0, "reg_dec_producer": 0, "reg_inc_consumer": 0}, "(16, 4608, 3584, 128, 8, 104)": {"BLOCK_SIZE_M": 16, "BLOCK_SIZE_N": 64, "BLOCK_SIZE_K": 128, "GROUP_SIZE_M": 8, "SPLIT_K": 4, "A_load_order": 0, "waves_per_eu": 2, "matrix_instr_nonkdim": 16, "num_warps": 4, "num_ctas": 1, "num_stages": 1, "num_buffers_warp_spec": 0, "num_consumer_groups": 0, "reg_dec_producer": 0, "reg_inc_consumer": 0}, "(4, 3584, 18944, 128, 8, 104)": {"BLOCK_SIZE_M": 16, "BLOCK_SIZE_N": 64, "BLOCK_SIZE_K": 32, "GROUP_SIZE_M": 8, "SPLIT_K": 16, "A_load_order": 0, "waves_per_eu": 2, "matrix_instr_nonkdim": 16, "num_warps": 4, "num_ctas": 1, "num_stages": 1, "num_buffers_warp_spec": 0, "num_consumer_groups": 0, "reg_dec_producer": 0, "reg_inc_consumer": 0}, "(8, 3584, 18944, 128, 8, 104)": {"BLOCK_SIZE_M": 16, "BLOCK_SIZE_N": 64, "BLOCK_SIZE_K": 32, "GROUP_SIZE_M": 8, "SPLIT_K": 16, "A_load_order": 0, "waves_per_eu": 4, "matrix_instr_nonkdim": 16, "num_warps": 4, "num_ctas": 1, "num_stages": 1, "num_buffers_warp_spec": 0, "num_consumer_groups": 0, "reg_dec_producer": 0, "reg_inc_consumer": 0}, "(16, 3584, 18944, 128, 8, 104)": {"BLOCK_SIZE_M": 16, "BLOCK_SIZE_N": 64, "BLOCK_SIZE_K": 32, "GROUP_SIZE_M": 8, "SPLIT_K": 16, "A_load_order": 0, "waves_per_eu": 2, "matrix_instr_nonkdim": 16, "num_warps": 4, "num_ctas": 1, "num_stages": 1, "num_buffers_warp_spec": 0, "num_consumer_groups": 0, "reg_dec_producer": 0, "reg_inc_consumer": 0}, "(32, 3584, 18944, 128, 8, 104)": {"BLOCK_SIZE_M": 32, "BLOCK_SIZE_N": 32, "BLOCK_SIZE_K": 64, "GROUP_SIZE_M": 8, "SPLIT_K": 8, "A_load_order": 0, "waves_per_eu": 0, "matrix_instr_nonkdim": 16, "num_warps": 4, "num_ctas": 1, "num_stages": 2, "num_buffers_warp_spec": 0, "num_consumer_groups": 0, "reg_dec_producer": 0, "reg_inc_consumer": 0}, "(64, 3584, 18944, 128, 8, 104)": {"BLOCK_SIZE_M": 64, "BLOCK_SIZE_N": 32, "BLOCK_SIZE_K": 64, "GROUP_SIZE_M": 8, "SPLIT_K": 8, "A_load_order": 0, "waves_per_eu": 2, "matrix_instr_nonkdim": 16, "num_warps": 4, "num_ctas": 1, "num_stages": 1, "num_buffers_warp_spec": 0, "num_consumer_groups": 0, "reg_dec_producer": 0, "reg_inc_consumer": 0}, "(4, 37888, 3584, 128, 8, 104)": {"BLOCK_SIZE_M": 16, "BLOCK_SIZE_N": 64, "BLOCK_SIZE_K": 128, "GROUP_SIZE_M": 8, "SPLIT_K": 4, "A_load_order": 0, "waves_per_eu": 0, "matrix_instr_nonkdim": 16, "num_warps": 4, "num_ctas": 1, "num_stages": 1, "num_buffers_warp_spec": 0, "num_consumer_groups": 0, "reg_dec_producer": 0, "reg_inc_consumer": 0}, "(64, 37888, 3584, 128, 8, 104)": {"BLOCK_SIZE_M": 64, "BLOCK_SIZE_N": 64, "BLOCK_SIZE_K": 128, "GROUP_SIZE_M": 8, "SPLIT_K": 1, "A_load_order": 0, "waves_per_eu": 2, "matrix_instr_nonkdim": 16, "num_warps": 4, "num_ctas": 1, "num_stages": 1, "num_buffers_warp_spec": 0, "num_consumer_groups": 0, "reg_dec_producer": 0, "reg_inc_consumer": 0}, "(4, 3072, 3072, 128, 8, 104)": {"BLOCK_SIZE_M": 16, "BLOCK_SIZE_N": 64, "BLOCK_SIZE_K": 64, "GROUP_SIZE_M": 8, "SPLIT_K": 16, "A_load_order": 0, "waves_per_eu": 4, "matrix_instr_nonkdim": 16, "num_warps": 4, "num_ctas": 1, "num_stages": 2, "num_buffers_warp_spec": 0, "num_consumer_groups": 0, "reg_dec_producer": 0, "reg_inc_consumer": 0}, "(8, 3072, 3072, 128, 8, 104)": {"BLOCK_SIZE_M": 16, "BLOCK_SIZE_N": 64, "BLOCK_SIZE_K": 64, "GROUP_SIZE_M": 8, "SPLIT_K": 16, "A_load_order": 0, "waves_per_eu": 4, "matrix_instr_nonkdim": 16, "num_warps": 4, "num_ctas": 1, "num_stages": 2, "num_buffers_warp_spec": 0, "num_consumer_groups": 0, "reg_dec_producer": 0, "reg_inc_consumer": 0}, "(16, 3072, 3072, 128, 8, 104)": {"BLOCK_SIZE_M": 16, "BLOCK_SIZE_N": 64, "BLOCK_SIZE_K": 64, "GROUP_SIZE_M": 8, "SPLIT_K": 16, "A_load_order": 0, "waves_per_eu": 2, "matrix_instr_nonkdim": 16, "num_warps": 4, "num_ctas": 1, "num_stages": 1, "num_buffers_warp_spec": 0, "num_consumer_groups": 0, "reg_dec_producer": 0, "reg_inc_consumer": 0}, "(32, 3072, 3072, 128, 8, 104)": {"BLOCK_SIZE_M": 32, "BLOCK_SIZE_N": 32, "BLOCK_SIZE_K": 128, "GROUP_SIZE_M": 8, "SPLIT_K": 8, "A_load_order": 0, "waves_per_eu": 4, "matrix_instr_nonkdim": 16, "num_warps": 4, "num_ctas": 1, "num_stages": 1, "num_buffers_warp_spec": 0, "num_consumer_groups": 0, "reg_dec_producer": 0, "reg_inc_consumer": 0}, "(64, 3072, 3072, 128, 8, 104)": {"BLOCK_SIZE_M": 64, "BLOCK_SIZE_N": 32, "BLOCK_SIZE_K": 128, "GROUP_SIZE_M": 8, "SPLIT_K": 8, "A_load_order": 0, "waves_per_eu": 2, "matrix_instr_nonkdim": 16, "num_warps": 8, "num_ctas": 1, "num_stages": 1, "num_buffers_warp_spec": 0, "num_consumer_groups": 0, "reg_dec_producer": 0, "reg_inc_consumer": 0}, "(4, 5120, 3072, 128, 8, 104)": {"BLOCK_SIZE_M": 16, "BLOCK_SIZE_N": 64, "BLOCK_SIZE_K": 64, "GROUP_SIZE_M": 8, "SPLIT_K": 16, "A_load_order": 0, "waves_per_eu": 0, "matrix_instr_nonkdim": 16, "num_warps": 4, "num_ctas": 1, "num_stages": 2, "num_buffers_warp_spec": 0, "num_consumer_groups": 0, "reg_dec_producer": 0, "reg_inc_consumer": 0}, "(8, 5120, 3072, 128, 8, 104)": {"BLOCK_SIZE_M": 16, "BLOCK_SIZE_N": 64, "BLOCK_SIZE_K": 128, "GROUP_SIZE_M": 8, "SPLIT_K": 8, "A_load_order": 0, "waves_per_eu": 2, "matrix_instr_nonkdim": 16, "num_warps": 4, "num_ctas": 1, "num_stages": 1, "num_buffers_warp_spec": 0, "num_consumer_groups": 0, "reg_dec_producer": 0, "reg_inc_consumer": 0}, "(16, 5120, 3072, 128, 8, 104)": {"BLOCK_SIZE_M": 16, "BLOCK_SIZE_N": 64, "BLOCK_SIZE_K": 128, "GROUP_SIZE_M": 8, "SPLIT_K": 8, "A_load_order": 0, "waves_per_eu": 4, "matrix_instr_nonkdim": 16, "num_warps": 4, "num_ctas": 1, "num_stages": 1, "num_buffers_warp_spec": 0, "num_consumer_groups": 0, "reg_dec_producer": 0, "reg_inc_consumer": 0}, "(32, 5120, 3072, 128, 8, 104)": {"BLOCK_SIZE_M": 32, "BLOCK_SIZE_N": 32, "BLOCK_SIZE_K": 128, "GROUP_SIZE_M": 8, "SPLIT_K": 8, "A_load_order": 0, "waves_per_eu": 2, "matrix_instr_nonkdim": 16, "num_warps": 4, "num_ctas": 1, "num_stages": 1, "num_buffers_warp_spec": 0, "num_consumer_groups": 0, "reg_dec_producer": 0, "reg_inc_consumer": 0}, "(64, 5120, 3072, 128, 8, 104)": {"BLOCK_SIZE_M": 64, "BLOCK_SIZE_N": 64, "BLOCK_SIZE_K": 128, "GROUP_SIZE_M": 8, "SPLIT_K": 4, "A_load_order": 0, "waves_per_eu": 2, "matrix_instr_nonkdim": 16, "num_warps": 4, "num_ctas": 1, "num_stages": 1, "num_buffers_warp_spec": 0, "num_consumer_groups": 0, "reg_dec_producer": 0, "reg_inc_consumer": 0}, "(4, 3072, 8192, 128, 8, 104)": {"BLOCK_SIZE_M": 16, "BLOCK_SIZE_N": 64, "BLOCK_SIZE_K": 128, "GROUP_SIZE_M": 8, "SPLIT_K": 16, "A_load_order": 0, "waves_per_eu": 2, "matrix_instr_nonkdim": 16, "num_warps": 4, "num_ctas": 1, "num_stages": 1, "num_buffers_warp_spec": 0, "num_consumer_groups": 0, "reg_dec_producer": 0, "reg_inc_consumer": 0}, "(8, 3072, 8192, 128, 8, 104)": {"BLOCK_SIZE_M": 16, "BLOCK_SIZE_N": 64, "BLOCK_SIZE_K": 128, "GROUP_SIZE_M": 8, "SPLIT_K": 16, "A_load_order": 0, "waves_per_eu": 4, "matrix_instr_nonkdim": 16, "num_warps": 4, "num_ctas": 1, "num_stages": 1, "num_buffers_warp_spec": 0, "num_consumer_groups": 0, "reg_dec_producer": 0, "reg_inc_consumer": 0}, "(16, 3072, 8192, 128, 8, 104)": {"BLOCK_SIZE_M": 16, "BLOCK_SIZE_N": 64, "BLOCK_SIZE_K": 128, "GROUP_SIZE_M": 8, "SPLIT_K": 16, "A_load_order": 0, "waves_per_eu": 4, "matrix_instr_nonkdim": 16, "num_warps": 4, "num_ctas": 1, "num_stages": 1, "num_buffers_warp_spec": 0, "num_consumer_groups": 0, "reg_dec_producer": 0, "reg_inc_consumer": 0}, "(32, 3072, 8192, 128, 8, 104)": {"BLOCK_SIZE_M": 32, "BLOCK_SIZE_N": 32, "BLOCK_SIZE_K": 128, "GROUP_SIZE_M": 8, "SPLIT_K": 8, "A_load_order": 0, "waves_per_eu": 2, "matrix_instr_nonkdim": 16, "num_warps": 4, "num_ctas": 1, "num_stages": 1, "num_buffers_warp_spec": 0, "num_consumer_groups": 0, "reg_dec_producer": 0, "reg_inc_consumer": 0}, "(64, 3072, 8192, 128, 8, 104)": {"BLOCK_SIZE_M": 64, "BLOCK_SIZE_N": 64, "BLOCK_SIZE_K": 128, "GROUP_SIZE_M": 8, "SPLIT_K": 8, "A_load_order": 0, "waves_per_eu": 2, "matrix_instr_nonkdim": 16, "num_warps": 4, "num_ctas": 1, "num_stages": 1, "num_buffers_warp_spec": 0, "num_consumer_groups": 0, "reg_dec_producer": 0, "reg_inc_consumer": 0}, "(4, 16384, 3072, 128, 8, 104)": {"BLOCK_SIZE_M": 16, "BLOCK_SIZE_N": 64, "BLOCK_SIZE_K": 128, "GROUP_SIZE_M": 8, "SPLIT_K": 8, "A_load_order": 0, "waves_per_eu": 0, "matrix_instr_nonkdim": 16, "num_warps": 4, "num_ctas": 1, "num_stages": 1, "num_buffers_warp_spec": 0, "num_consumer_groups": 0, "reg_dec_producer": 0, "reg_inc_consumer": 0}, "(64, 16384, 3072, 128, 8, 104)": {"BLOCK_SIZE_M": 64, "BLOCK_SIZE_N": 32, "BLOCK_SIZE_K": 128, "GROUP_SIZE_M": 8, "SPLIT_K": 1, "A_load_order": 0, "waves_per_eu": 4, "matrix_instr_nonkdim": 16, "num_warps": 4, "num_ctas": 1, "num_stages": 1, "num_buffers_warp_spec": 0, "num_consumer_groups": 0, "reg_dec_producer": 0, "reg_inc_consumer": 0}, "(4, 4096, 4096, 64, 8, 104)": {"BLOCK_SIZE_M": 16, "BLOCK_SIZE_N": 64, "BLOCK_SIZE_K": 64, "GROUP_SIZE_M": 8, "SPLIT_K": 16, "A_load_order": 0, "waves_per_eu": 4, "matrix_instr_nonkdim": 16, "num_warps": 4, "num_ctas": 1, "num_stages": 1, "num_buffers_warp_spec": 0, "num_consumer_groups": 0, "reg_dec_producer": 0, "reg_inc_consumer": 0}, "(8, 4096, 4096, 64, 8, 104)": {"BLOCK_SIZE_M": 16, "BLOCK_SIZE_N": 64, "BLOCK_SIZE_K": 64, "GROUP_SIZE_M": 8, "SPLIT_K": 16, "A_load_order": 0, "waves_per_eu": 4, "matrix_instr_nonkdim": 16, "num_warps": 4, "num_ctas": 1, "num_stages": 1, "num_buffers_warp_spec": 0, "num_consumer_groups": 0, "reg_dec_producer": 0, "reg_inc_consumer": 0}, "(16, 4096, 4096, 64, 8, 104)": {"BLOCK_SIZE_M": 16, "BLOCK_SIZE_N": 64, "BLOCK_SIZE_K": 64, "GROUP_SIZE_M": 8, "SPLIT_K": 8, "A_load_order": 0, "waves_per_eu": 4, "matrix_instr_nonkdim": 16, "num_warps": 4, "num_ctas": 1, "num_stages": 2, "num_buffers_warp_spec": 0, "num_consumer_groups": 0, "reg_dec_producer": 0, "reg_inc_consumer": 0}, "(32, 4096, 4096, 64, 8, 104)": {"BLOCK_SIZE_M": 32, "BLOCK_SIZE_N": 64, "BLOCK_SIZE_K": 64, "GROUP_SIZE_M": 8, "SPLIT_K": 8, "A_load_order": 0, "waves_per_eu": 4, "matrix_instr_nonkdim": 16, "num_warps": 8, "num_ctas": 1, "num_stages": 1, "num_buffers_warp_spec": 0, "num_consumer_groups": 0, "reg_dec_producer": 0, "reg_inc_consumer": 0}, "(64, 4096, 4096, 64, 8, 104)": {"BLOCK_SIZE_M": 64, "BLOCK_SIZE_N": 64, "BLOCK_SIZE_K": 64, "GROUP_SIZE_M": 8, "SPLIT_K": 4, "A_load_order": 0, "waves_per_eu": 0, "matrix_instr_nonkdim": 16, "num_warps": 8, "num_ctas": 1, "num_stages": 2, "num_buffers_warp_spec": 0, "num_consumer_groups": 0, "reg_dec_producer": 0, "reg_inc_consumer": 0}, "(4, 6144, 4096, 64, 8, 104)": {"BLOCK_SIZE_M": 16, "BLOCK_SIZE_N": 64, "BLOCK_SIZE_K": 64, "GROUP_SIZE_M": 8, "SPLIT_K": 8, "A_load_order": 0, "waves_per_eu": 2, "matrix_instr_nonkdim": 16, "num_warps": 4, "num_ctas": 1, "num_stages": 1, "num_buffers_warp_spec": 0, "num_consumer_groups": 0, "reg_dec_producer": 0, "reg_inc_consumer": 0}, "(8, 6144, 4096, 64, 8, 104)": {"BLOCK_SIZE_M": 16, "BLOCK_SIZE_N": 64, "BLOCK_SIZE_K": 64, "GROUP_SIZE_M": 8, "SPLIT_K": 8, "A_load_order": 0, "waves_per_eu": 2, "matrix_instr_nonkdim": 16, "num_warps": 4, "num_ctas": 1, "num_stages": 1, "num_buffers_warp_spec": 0, "num_consumer_groups": 0, "reg_dec_producer": 0, "reg_inc_consumer": 0}, "(16, 6144, 4096, 64, 8, 104)": {"BLOCK_SIZE_M": 16, "BLOCK_SIZE_N": 64, "BLOCK_SIZE_K": 64, "GROUP_SIZE_M": 8, "SPLIT_K": 16, "A_load_order": 0, "waves_per_eu": 4, "matrix_instr_nonkdim": 16, "num_warps": 4, "num_ctas": 1, "num_stages": 1, "num_buffers_warp_spec": 0, "num_consumer_groups": 0, "reg_dec_producer": 0, "reg_inc_consumer": 0}, "(32, 6144, 4096, 64, 8, 104)": {"BLOCK_SIZE_M": 32, "BLOCK_SIZE_N": 64, "BLOCK_SIZE_K": 64, "GROUP_SIZE_M": 8, "SPLIT_K": 8, "A_load_order": 0, "waves_per_eu": 4, "matrix_instr_nonkdim": 16, "num_warps": 8, "num_ctas": 1, "num_stages": 1, "num_buffers_warp_spec": 0, "num_consumer_groups": 0, "reg_dec_producer": 0, "reg_inc_consumer": 0}, "(64, 6144, 4096, 64, 8, 104)": {"BLOCK_SIZE_M": 64, "BLOCK_SIZE_N": 64, "BLOCK_SIZE_K": 64, "GROUP_SIZE_M": 8, "SPLIT_K": 4, "A_load_order": 0, "waves_per_eu": 4, "matrix_instr_nonkdim": 16, "num_warps": 4, "num_ctas": 1, "num_stages": 1, "num_buffers_warp_spec": 0, "num_consumer_groups": 0, "reg_dec_producer": 0, "reg_inc_consumer": 0}, "(4, 4096, 14336, 64, 8, 104)": {"BLOCK_SIZE_M": 16, "BLOCK_SIZE_N": 128, "BLOCK_SIZE_K": 64, "GROUP_SIZE_M": 8, "SPLIT_K": 16, "A_load_order": 0, "waves_per_eu": 4, "matrix_instr_nonkdim": 16, "num_warps": 8, "num_ctas": 1, "num_stages": 1, "num_buffers_warp_spec": 0, "num_consumer_groups": 0, "reg_dec_producer": 0, "reg_inc_consumer": 0}, "(8, 4096, 14336, 64, 8, 104)": {"BLOCK_SIZE_M": 16, "BLOCK_SIZE_N": 128, "BLOCK_SIZE_K": 64, "GROUP_SIZE_M": 8, "SPLIT_K": 16, "A_load_order": 0, "waves_per_eu": 0, "matrix_instr_nonkdim": 16, "num_warps": 8, "num_ctas": 1, "num_stages": 1, "num_buffers_warp_spec": 0, "num_consumer_groups": 0, "reg_dec_producer": 0, "reg_inc_consumer": 0}, "(16, 4096, 14336, 64, 8, 104)": {"BLOCK_SIZE_M": 16, "BLOCK_SIZE_N": 128, "BLOCK_SIZE_K": 64, "GROUP_SIZE_M": 8, "SPLIT_K": 16, "A_load_order": 0, "waves_per_eu": 4, "matrix_instr_nonkdim": 16, "num_warps": 8, "num_ctas": 1, "num_stages": 1, "num_buffers_warp_spec": 0, "num_consumer_groups": 0, "reg_dec_producer": 0, "reg_inc_consumer": 0}, "(32, 4096, 14336, 64, 8, 104)": {"BLOCK_SIZE_M": 32, "BLOCK_SIZE_N": 64, "BLOCK_SIZE_K": 64, "GROUP_SIZE_M": 8, "SPLIT_K": 8, "A_load_order": 0, "waves_per_eu": 2, "matrix_instr_nonkdim": 16, "num_warps": 4, "num_ctas": 1, "num_stages": 2, "num_buffers_warp_spec": 0, "num_consumer_groups": 0, "reg_dec_producer": 0, "reg_inc_consumer": 0}, "(64, 4096, 14336, 64, 8, 104)": {"BLOCK_SIZE_M": 64, "BLOCK_SIZE_N": 64, "BLOCK_SIZE_K": 64, "GROUP_SIZE_M": 8, "SPLIT_K": 8, "A_load_order": 0, "waves_per_eu": 4, "matrix_instr_nonkdim": 16, "num_warps": 4, "num_ctas": 1, "num_stages": 1, "num_buffers_warp_spec": 0, "num_consumer_groups": 0, "reg_dec_producer": 0, "reg_inc_consumer": 0}, "(4, 28672, 4096, 64, 8, 104)": {"BLOCK_SIZE_M": 16, "BLOCK_SIZE_N": 128, "BLOCK_SIZE_K": 64, "GROUP_SIZE_M": 8, "SPLIT_K": 16, "A_load_order": 0, "waves_per_eu": 2, "matrix_instr_nonkdim": 16, "num_warps": 4, "num_ctas": 1, "num_stages": 1, "num_buffers_warp_spec": 0, "num_consumer_groups": 0, "reg_dec_producer": 0, "reg_inc_consumer": 0}, "(8, 28672, 4096, 64, 8, 104)": {"BLOCK_SIZE_M": 16, "BLOCK_SIZE_N": 128, "BLOCK_SIZE_K": 64, "GROUP_SIZE_M": 8, "SPLIT_K": 16, "A_load_order": 0, "waves_per_eu": 4, "matrix_instr_nonkdim": 16, "num_warps": 4, "num_ctas": 1, "num_stages": 1, "num_buffers_warp_spec": 0, "num_consumer_groups": 0, "reg_dec_producer": 0, "reg_inc_consumer": 0}, "(16, 28672, 4096, 64, 8, 104)": {"BLOCK_SIZE_M": 16, "BLOCK_SIZE_N": 64, "BLOCK_SIZE_K": 64, "GROUP_SIZE_M": 8, "SPLIT_K": 8, "A_load_order": 0, "waves_per_eu": 4, "matrix_instr_nonkdim": 16, "num_warps": 4, "num_ctas": 1, "num_stages": 2, "num_buffers_warp_spec": 0, "num_consumer_groups": 0, "reg_dec_producer": 0, "reg_inc_consumer": 0}, "(32, 28672, 4096, 64, 8, 104)": {"BLOCK_SIZE_M": 32, "BLOCK_SIZE_N": 64, "BLOCK_SIZE_K": 64, "GROUP_SIZE_M": 8, "SPLIT_K": 2, "A_load_order": 0, "waves_per_eu": 2, "matrix_instr_nonkdim": 16, "num_warps": 4, "num_ctas": 1, "num_stages": 1, "num_buffers_warp_spec": 0, "num_consumer_groups": 0, "reg_dec_producer": 0, "reg_inc_consumer": 0}, "(64, 28672, 4096, 64, 8, 104)": {"BLOCK_SIZE_M": 64, "BLOCK_SIZE_N": 64, "BLOCK_SIZE_K": 64, "GROUP_SIZE_M": 8, "SPLIT_K": 2, "A_load_order": 0, "waves_per_eu": 4, "matrix_instr_nonkdim": 16, "num_warps": 4, "num_ctas": 1, "num_stages": 1, "num_buffers_warp_spec": 0, "num_consumer_groups": 0, "reg_dec_producer": 0, "reg_inc_consumer": 0}, "(4, 3584, 3584, 64, 8, 104)": {"BLOCK_SIZE_M": 16, "BLOCK_SIZE_N": 128, "BLOCK_SIZE_K": 32, "GROUP_SIZE_M": 8, "SPLIT_K": 8, "A_load_order": 0, "waves_per_eu": 0, "matrix_instr_nonkdim": 16, "num_warps": 8, "num_ctas": 1, "num_stages": 2, "num_buffers_warp_spec": 0, "num_consumer_groups": 0, "reg_dec_producer": 0, "reg_inc_consumer": 0}, "(8, 3584, 3584, 64, 8, 104)": {"BLOCK_SIZE_M": 16, "BLOCK_SIZE_N": 64, "BLOCK_SIZE_K": 32, "GROUP_SIZE_M": 8, "SPLIT_K": 16, "A_load_order": 0, "waves_per_eu": 2, "matrix_instr_nonkdim": 16, "num_warps": 4, "num_ctas": 1, "num_stages": 1, "num_buffers_warp_spec": 0, "num_consumer_groups": 0, "reg_dec_producer": 0, "reg_inc_consumer": 0}, "(16, 3584, 3584, 64, 8, 104)": {"BLOCK_SIZE_M": 16, "BLOCK_SIZE_N": 128, "BLOCK_SIZE_K": 32, "GROUP_SIZE_M": 8, "SPLIT_K": 16, "A_load_order": 0, "waves_per_eu": 2, "matrix_instr_nonkdim": 16, "num_warps": 8, "num_ctas": 1, "num_stages": 1, "num_buffers_warp_spec": 0, "num_consumer_groups": 0, "reg_dec_producer": 0, "reg_inc_consumer": 0}, "(32, 3584, 3584, 64, 8, 104)": {"BLOCK_SIZE_M": 32, "BLOCK_SIZE_N": 32, "BLOCK_SIZE_K": 64, "GROUP_SIZE_M": 8, "SPLIT_K": 8, "A_load_order": 0, "waves_per_eu": 2, "matrix_instr_nonkdim": 16, "num_warps": 4, "num_ctas": 1, "num_stages": 1, "num_buffers_warp_spec": 0, "num_consumer_groups": 0, "reg_dec_producer": 0, "reg_inc_consumer": 0}, "(64, 3584, 3584, 64, 8, 104)": {"BLOCK_SIZE_M": 64, "BLOCK_SIZE_N": 32, "BLOCK_SIZE_K": 64, "GROUP_SIZE_M": 8, "SPLIT_K": 8, "A_load_order": 0, "waves_per_eu": 4, "matrix_instr_nonkdim": 16, "num_warps": 8, "num_ctas": 1, "num_stages": 1, "num_buffers_warp_spec": 0, "num_consumer_groups": 0, "reg_dec_producer": 0, "reg_inc_consumer": 0}, "(4, 4608, 3584, 64, 8, 104)": {"BLOCK_SIZE_M": 16, "BLOCK_SIZE_N": 64, "BLOCK_SIZE_K": 32, "GROUP_SIZE_M": 8, "SPLIT_K": 16, "A_load_order": 0, "waves_per_eu": 4, "matrix_instr_nonkdim": 16, "num_warps": 4, "num_ctas": 1, "num_stages": 1, "num_buffers_warp_spec": 0, "num_consumer_groups": 0, "reg_dec_producer": 0, "reg_inc_consumer": 0}, "(8, 4608, 3584, 64, 8, 104)": {"BLOCK_SIZE_M": 16, "BLOCK_SIZE_N": 256, "BLOCK_SIZE_K": 32, "GROUP_SIZE_M": 8, "SPLIT_K": 16, "A_load_order": 0, "waves_per_eu": 2, "matrix_instr_nonkdim": 16, "num_warps": 8, "num_ctas": 1, "num_stages": 1, "num_buffers_warp_spec": 0, "num_consumer_groups": 0, "reg_dec_producer": 0, "reg_inc_consumer": 0}, "(16, 4608, 3584, 64, 8, 104)": {"BLOCK_SIZE_M": 16, "BLOCK_SIZE_N": 64, "BLOCK_SIZE_K": 64, "GROUP_SIZE_M": 8, "SPLIT_K": 4, "A_load_order": 0, "waves_per_eu": 4, "matrix_instr_nonkdim": 16, "num_warps": 4, "num_ctas": 1, "num_stages": 1, "num_buffers_warp_spec": 0, "num_consumer_groups": 0, "reg_dec_producer": 0, "reg_inc_consumer": 0}, "(32, 4608, 3584, 64, 8, 104)": {"BLOCK_SIZE_M": 32, "BLOCK_SIZE_N": 64, "BLOCK_SIZE_K": 64, "GROUP_SIZE_M": 8, "SPLIT_K": 4, "A_load_order": 0, "waves_per_eu": 4, "matrix_instr_nonkdim": 16, "num_warps": 8, "num_ctas": 1, "num_stages": 2, "num_buffers_warp_spec": 0, "num_consumer_groups": 0, "reg_dec_producer": 0, "reg_inc_consumer": 0}, "(64, 4608, 3584, 64, 8, 104)": {"BLOCK_SIZE_M": 64, "BLOCK_SIZE_N": 32, "BLOCK_SIZE_K": 64, "GROUP_SIZE_M": 8, "SPLIT_K": 4, "A_load_order": 0, "waves_per_eu": 4, "matrix_instr_nonkdim": 16, "num_warps": 4, "num_ctas": 1, "num_stages": 1, "num_buffers_warp_spec": 0, "num_consumer_groups": 0, "reg_dec_producer": 0, "reg_inc_consumer": 0}, "(4, 3584, 18944, 64, 8, 104)": {"BLOCK_SIZE_M": 16, "BLOCK_SIZE_N": 64, "BLOCK_SIZE_K": 32, "GROUP_SIZE_M": 8, "SPLIT_K": 16, "A_load_order": 0, "waves_per_eu": 2, "matrix_instr_nonkdim": 16, "num_warps": 4, "num_ctas": 1, "num_stages": 1, "num_buffers_warp_spec": 0, "num_consumer_groups": 0, "reg_dec_producer": 0, "reg_inc_consumer": 0}, "(8, 3584, 18944, 64, 8, 104)": {"BLOCK_SIZE_M": 16, "BLOCK_SIZE_N": 64, "BLOCK_SIZE_K": 32, "GROUP_SIZE_M": 8, "SPLIT_K": 16, "A_load_order": 0, "waves_per_eu": 4, "matrix_instr_nonkdim": 16, "num_warps": 4, "num_ctas": 1, "num_stages": 1, "num_buffers_warp_spec": 0, "num_consumer_groups": 0, "reg_dec_producer": 0, "reg_inc_consumer": 0}, "(16, 3584, 18944, 64, 8, 104)": {"BLOCK_SIZE_M": 16, "BLOCK_SIZE_N": 64, "BLOCK_SIZE_K": 32, "GROUP_SIZE_M": 8, "SPLIT_K": 16, "A_load_order": 0, "waves_per_eu": 2, "matrix_instr_nonkdim": 16, "num_warps": 4, "num_ctas": 1, "num_stages": 1, "num_buffers_warp_spec": 0, "num_consumer_groups": 0, "reg_dec_producer": 0, "reg_inc_consumer": 0}, "(32, 3584, 18944, 64, 8, 104)": {"BLOCK_SIZE_M": 32, "BLOCK_SIZE_N": 32, "BLOCK_SIZE_K": 64, "GROUP_SIZE_M": 8, "SPLIT_K": 8, "A_load_order": 0, "waves_per_eu": 0, "matrix_instr_nonkdim": 16, "num_warps": 4, "num_ctas": 1, "num_stages": 2, "num_buffers_warp_spec": 0, "num_consumer_groups": 0, "reg_dec_producer": 0, "reg_inc_consumer": 0}, "(64, 3584, 18944, 64, 8, 104)": {"BLOCK_SIZE_M": 64, "BLOCK_SIZE_N": 32, "BLOCK_SIZE_K": 64, "GROUP_SIZE_M": 8, "SPLIT_K": 8, "A_load_order": 0, "waves_per_eu": 2, "matrix_instr_nonkdim": 16, "num_warps": 4, "num_ctas": 1, "num_stages": 1, "num_buffers_warp_spec": 0, "num_consumer_groups": 0, "reg_dec_producer": 0, "reg_inc_consumer": 0}, "(4, 37888, 3584, 64, 8, 104)": {"BLOCK_SIZE_M": 16, "BLOCK_SIZE_N": 128, "BLOCK_SIZE_K": 64, "GROUP_SIZE_M": 8, "SPLIT_K": 8, "A_load_order": 0, "waves_per_eu": 4, "matrix_instr_nonkdim": 16, "num_warps": 4, "num_ctas": 1, "num_stages": 1, "num_buffers_warp_spec": 0, "num_consumer_groups": 0, "reg_dec_producer": 0, "reg_inc_consumer": 0}, "(8, 37888, 3584, 64, 8, 104)": {"BLOCK_SIZE_M": 16, "BLOCK_SIZE_N": 128, "BLOCK_SIZE_K": 64, "GROUP_SIZE_M": 8, "SPLIT_K": 8, "A_load_order": 0, "waves_per_eu": 0, "matrix_instr_nonkdim": 16, "num_warps": 4, "num_ctas": 1, "num_stages": 1, "num_buffers_warp_spec": 0, "num_consumer_groups": 0, "reg_dec_producer": 0, "reg_inc_consumer": 0}, "(16, 37888, 3584, 64, 8, 104)": {"BLOCK_SIZE_M": 16, "BLOCK_SIZE_N": 128, "BLOCK_SIZE_K": 64, "GROUP_SIZE_M": 8, "SPLIT_K": 4, "A_load_order": 0, "waves_per_eu": 4, "matrix_instr_nonkdim": 16, "num_warps": 4, "num_ctas": 1, "num_stages": 1, "num_buffers_warp_spec": 0, "num_consumer_groups": 0, "reg_dec_producer": 0, "reg_inc_consumer": 0}, "(64, 37888, 3584, 64, 8, 104)": {"BLOCK_SIZE_M": 64, "BLOCK_SIZE_N": 64, "BLOCK_SIZE_K": 64, "GROUP_SIZE_M": 8, "SPLIT_K": 1, "A_load_order": 0, "waves_per_eu": 2, "matrix_instr_nonkdim": 16, "num_warps": 4, "num_ctas": 1, "num_stages": 2, "num_buffers_warp_spec": 0, "num_consumer_groups": 0, "reg_dec_producer": 0, "reg_inc_consumer": 0}, "(4, 3072, 3072, 64, 8, 104)": {"BLOCK_SIZE_M": 16, "BLOCK_SIZE_N": 128, "BLOCK_SIZE_K": 64, "GROUP_SIZE_M": 8, "SPLIT_K": 16, "A_load_order": 0, "waves_per_eu": 2, "matrix_instr_nonkdim": 16, "num_warps": 8, "num_ctas": 1, "num_stages": 1, "num_buffers_warp_spec": 0, "num_consumer_groups": 0, "reg_dec_producer": 0, "reg_inc_consumer": 0}, "(8, 3072, 3072, 64, 8, 104)": {"BLOCK_SIZE_M": 16, "BLOCK_SIZE_N": 64, "BLOCK_SIZE_K": 32, "GROUP_SIZE_M": 8, "SPLIT_K": 16, "A_load_order": 0, "waves_per_eu": 0, "matrix_instr_nonkdim": 16, "num_warps": 4, "num_ctas": 1, "num_stages": 2, "num_buffers_warp_spec": 0, "num_consumer_groups": 0, "reg_dec_producer": 0, "reg_inc_consumer": 0}, "(16, 3072, 3072, 64, 8, 104)": {"BLOCK_SIZE_M": 16, "BLOCK_SIZE_N": 64, "BLOCK_SIZE_K": 64, "GROUP_SIZE_M": 8, "SPLIT_K": 16, "A_load_order": 0, "waves_per_eu": 0, "matrix_instr_nonkdim": 16, "num_warps": 4, "num_ctas": 1, "num_stages": 2, "num_buffers_warp_spec": 0, "num_consumer_groups": 0, "reg_dec_producer": 0, "reg_inc_consumer": 0}, "(32, 3072, 3072, 64, 8, 104)": {"BLOCK_SIZE_M": 32, "BLOCK_SIZE_N": 32, "BLOCK_SIZE_K": 64, "GROUP_SIZE_M": 8, "SPLIT_K": 8, "A_load_order": 0, "waves_per_eu": 4, "matrix_instr_nonkdim": 16, "num_warps": 4, "num_ctas": 1, "num_stages": 1, "num_buffers_warp_spec": 0, "num_consumer_groups": 0, "reg_dec_producer": 0, "reg_inc_consumer": 0}, "(64, 3072, 3072, 64, 8, 104)": {"BLOCK_SIZE_M": 64, "BLOCK_SIZE_N": 32, "BLOCK_SIZE_K": 64, "GROUP_SIZE_M": 8, "SPLIT_K": 4, "A_load_order": 0, "waves_per_eu": 4, "matrix_instr_nonkdim": 16, "num_warps": 4, "num_ctas": 1, "num_stages": 2, "num_buffers_warp_spec": 0, "num_consumer_groups": 0, "reg_dec_producer": 0, "reg_inc_consumer": 0}, "(4, 5120, 3072, 64, 8, 104)": {"BLOCK_SIZE_M": 16, "BLOCK_SIZE_N": 64, "BLOCK_SIZE_K": 64, "GROUP_SIZE_M": 8, "SPLIT_K": 16, "A_load_order": 0, "waves_per_eu": 2, "matrix_instr_nonkdim": 16, "num_warps": 4, "num_ctas": 1, "num_stages": 2, "num_buffers_warp_spec": 0, "num_consumer_groups": 0, "reg_dec_producer": 0, "reg_inc_consumer": 0}, "(8, 5120, 3072, 64, 8, 104)": {"BLOCK_SIZE_M": 16, "BLOCK_SIZE_N": 64, "BLOCK_SIZE_K": 64, "GROUP_SIZE_M": 8, "SPLIT_K": 8, "A_load_order": 0, "waves_per_eu": 4, "matrix_instr_nonkdim": 16, "num_warps": 4, "num_ctas": 1, "num_stages": 1, "num_buffers_warp_spec": 0, "num_consumer_groups": 0, "reg_dec_producer": 0, "reg_inc_consumer": 0}, "(16, 5120, 3072, 64, 8, 104)": {"BLOCK_SIZE_M": 16, "BLOCK_SIZE_N": 64, "BLOCK_SIZE_K": 64, "GROUP_SIZE_M": 8, "SPLIT_K": 8, "A_load_order": 0, "waves_per_eu": 0, "matrix_instr_nonkdim": 16, "num_warps": 4, "num_ctas": 1, "num_stages": 1, "num_buffers_warp_spec": 0, "num_consumer_groups": 0, "reg_dec_producer": 0, "reg_inc_consumer": 0}, "(32, 5120, 3072, 64, 8, 104)": {"BLOCK_SIZE_M": 32, "BLOCK_SIZE_N": 32, "BLOCK_SIZE_K": 64, "GROUP_SIZE_M": 8, "SPLIT_K": 8, "A_load_order": 0, "waves_per_eu": 4, "matrix_instr_nonkdim": 16, "num_warps": 4, "num_ctas": 1, "num_stages": 2, "num_buffers_warp_spec": 0, "num_consumer_groups": 0, "reg_dec_producer": 0, "reg_inc_consumer": 0}, "(64, 5120, 3072, 64, 8, 104)": {"BLOCK_SIZE_M": 64, "BLOCK_SIZE_N": 64, "BLOCK_SIZE_K": 64, "GROUP_SIZE_M": 8, "SPLIT_K": 4, "A_load_order": 0, "waves_per_eu": 2, "matrix_instr_nonkdim": 16, "num_warps": 4, "num_ctas": 1, "num_stages": 2, "num_buffers_warp_spec": 0, "num_consumer_groups": 0, "reg_dec_producer": 0, "reg_inc_consumer": 0}, "(4, 3072, 8192, 64, 8, 104)": {"BLOCK_SIZE_M": 16, "BLOCK_SIZE_N": 64, "BLOCK_SIZE_K": 64, "GROUP_SIZE_M": 8, "SPLIT_K": 16, "A_load_order": 0, "waves_per_eu": 2, "matrix_instr_nonkdim": 16, "num_warps": 4, "num_ctas": 1, "num_stages": 1, "num_buffers_warp_spec": 0, "num_consumer_groups": 0, "reg_dec_producer": 0, "reg_inc_consumer": 0}, "(8, 3072, 8192, 64, 8, 104)": {"BLOCK_SIZE_M": 16, "BLOCK_SIZE_N": 64, "BLOCK_SIZE_K": 64, "GROUP_SIZE_M": 8, "SPLIT_K": 16, "A_load_order": 0, "waves_per_eu": 2, "matrix_instr_nonkdim": 16, "num_warps": 4, "num_ctas": 1, "num_stages": 1, "num_buffers_warp_spec": 0, "num_consumer_groups": 0, "reg_dec_producer": 0, "reg_inc_consumer": 0}, "(16, 3072, 8192, 64, 8, 104)": {"BLOCK_SIZE_M": 16, "BLOCK_SIZE_N": 64, "BLOCK_SIZE_K": 64, "GROUP_SIZE_M": 8, "SPLIT_K": 16, "A_load_order": 0, "waves_per_eu": 2, "matrix_instr_nonkdim": 16, "num_warps": 4, "num_ctas": 1, "num_stages": 1, "num_buffers_warp_spec": 0, "num_consumer_groups": 0, "reg_dec_producer": 0, "reg_inc_consumer": 0}, "(32, 3072, 8192, 64, 8, 104)": {"BLOCK_SIZE_M": 32, "BLOCK_SIZE_N": 32, "BLOCK_SIZE_K": 64, "GROUP_SIZE_M": 8, "SPLIT_K": 8, "A_load_order": 0, "waves_per_eu": 2, "matrix_instr_nonkdim": 16, "num_warps": 4, "num_ctas": 1, "num_stages": 1, "num_buffers_warp_spec": 0, "num_consumer_groups": 0, "reg_dec_producer": 0, "reg_inc_consumer": 0}, "(64, 3072, 8192, 64, 8, 104)": {"BLOCK_SIZE_M": 64, "BLOCK_SIZE_N": 64, "BLOCK_SIZE_K": 64, "GROUP_SIZE_M": 8, "SPLIT_K": 8, "A_load_order": 0, "waves_per_eu": 4, "matrix_instr_nonkdim": 16, "num_warps": 4, "num_ctas": 1, "num_stages": 1, "num_buffers_warp_spec": 0, "num_consumer_groups": 0, "reg_dec_producer": 0, "reg_inc_consumer": 0}, "(4, 16384, 3072, 64, 8, 104)": {"BLOCK_SIZE_M": 16, "BLOCK_SIZE_N": 64, "BLOCK_SIZE_K": 64, "GROUP_SIZE_M": 8, "SPLIT_K": 8, "A_load_order": 0, "waves_per_eu": 4, "matrix_instr_nonkdim": 16, "num_warps": 4, "num_ctas": 1, "num_stages": 2, "num_buffers_warp_spec": 0, "num_consumer_groups": 0, "reg_dec_producer": 0, "reg_inc_consumer": 0}, "(8, 16384, 3072, 64, 8, 104)": {"BLOCK_SIZE_M": 16, "BLOCK_SIZE_N": 128, "BLOCK_SIZE_K": 64, "GROUP_SIZE_M": 8, "SPLIT_K": 4, "A_load_order": 0, "waves_per_eu": 0, "matrix_instr_nonkdim": 16, "num_warps": 8, "num_ctas": 1, "num_stages": 1, "num_buffers_warp_spec": 0, "num_consumer_groups": 0, "reg_dec_producer": 0, "reg_inc_consumer": 0}, "(16, 16384, 3072, 64, 8, 104)": {"BLOCK_SIZE_M": 16, "BLOCK_SIZE_N": 128, "BLOCK_SIZE_K": 64, "GROUP_SIZE_M": 8, "SPLIT_K": 4, "A_load_order": 0, "waves_per_eu": 4, "matrix_instr_nonkdim": 16, "num_warps": 8, "num_ctas": 1, "num_stages": 1, "num_buffers_warp_spec": 0, "num_consumer_groups": 0, "reg_dec_producer": 0, "reg_inc_consumer": 0}, "(64, 16384, 3072, 64, 8, 104)": {"BLOCK_SIZE_M": 64, "BLOCK_SIZE_N": 64, "BLOCK_SIZE_K": 64, "GROUP_SIZE_M": 8, "SPLIT_K": 1, "A_load_order": 0, "waves_per_eu": 0, "matrix_instr_nonkdim": 16, "num_warps": 8, "num_ctas": 1, "num_stages": 2, "num_buffers_warp_spec": 0, "num_consumer_groups": 0, "reg_dec_producer": 0, "reg_inc_consumer": 0}, "(48, 6144, 4096, 128, 8, 104)": {"BLOCK_SIZE_M": 64, "BLOCK_SIZE_N": 64, "BLOCK_SIZE_K": 128, "GROUP_SIZE_M": 8, "SPLIT_K": 4, "A_load_order": 0, "waves_per_eu": 2, "matrix_instr_nonkdim": 16, "num_warps": 4, "num_ctas": 1, "num_stages": 1, "num_buffers_warp_spec": 0, "num_consumer_groups": 0, "reg_dec_producer": 0, "reg_inc_consumer": 0}, "(48, 4096, 4096, 128, 8, 104)": {"BLOCK_SIZE_M": 64, "BLOCK_SIZE_N": 32, "BLOCK_SIZE_K": 128, "GROUP_SIZE_M": 8, "SPLIT_K": 4, "A_load_order": 0, "waves_per_eu": 2, "matrix_instr_nonkdim": 16, "num_warps": 4, "num_ctas": 1, "num_stages": 1, "num_buffers_warp_spec": 0, "num_consumer_groups": 0, "reg_dec_producer": 0, "reg_inc_consumer": 0}, "(48, 28672, 4096, 128, 8, 104)": {"BLOCK_SIZE_M": 64, "BLOCK_SIZE_N": 64, "BLOCK_SIZE_K": 64, "GROUP_SIZE_M": 8, "SPLIT_K": 2, "A_load_order": 0, "waves_per_eu": 4, "matrix_instr_nonkdim": 16, "num_warps": 4, "num_ctas": 1, "num_stages": 1, "num_buffers_warp_spec": 0, "num_consumer_groups": 0, "reg_dec_producer": 0, "reg_inc_consumer": 0}, "(48, 4096, 14336, 128, 8, 104)": {"BLOCK_SIZE_M": 64, "BLOCK_SIZE_N": 64, "BLOCK_SIZE_K": 64, "GROUP_SIZE_M": 8, "SPLIT_K": 8, "A_load_order": 0, "waves_per_eu": 2, "matrix_instr_nonkdim": 16, "num_warps": 4, "num_ctas": 1, "num_stages": 1, "num_buffers_warp_spec": 0, "num_consumer_groups": 0, "reg_dec_producer": 0, "reg_inc_consumer": 0}, "(24, 6144, 4096, 128, 8, 104)": {"BLOCK_SIZE_M": 32, "BLOCK_SIZE_N": 64, "BLOCK_SIZE_K": 128, "GROUP_SIZE_M": 8, "SPLIT_K": 8, "A_load_order": 0, "waves_per_eu": 2, "matrix_instr_nonkdim": 16, "num_warps": 4, "num_ctas": 1, "num_stages": 1, "num_buffers_warp_spec": 0, "num_consumer_groups": 0, "reg_dec_producer": 0, "reg_inc_consumer": 0}, "(24, 4096, 4096, 128, 8, 104)": {"BLOCK_SIZE_M": 32, "BLOCK_SIZE_N": 64, "BLOCK_SIZE_K": 128, "GROUP_SIZE_M": 8, "SPLIT_K": 8, "A_load_order": 0, "waves_per_eu": 0, "matrix_instr_nonkdim": 16, "num_warps": 8, "num_ctas": 1, "num_stages": 1, "num_buffers_warp_spec": 0, "num_consumer_groups": 0, "reg_dec_producer": 0, "reg_inc_consumer": 0}, "(24, 28672, 4096, 128, 8, 104)": {"BLOCK_SIZE_M": 32, "BLOCK_SIZE_N": 64, "BLOCK_SIZE_K": 128, "GROUP_SIZE_M": 8, "SPLIT_K": 2, "A_load_order": 0, "waves_per_eu": 4, "matrix_instr_nonkdim": 16, "num_warps": 4, "num_ctas": 1, "num_stages": 1, "num_buffers_warp_spec": 0, "num_consumer_groups": 0, "reg_dec_producer": 0, "reg_inc_consumer": 0}, "(24, 4096, 14336, 128, 8, 104)": {"BLOCK_SIZE_M": 32, "BLOCK_SIZE_N": 64, "BLOCK_SIZE_K": 128, "GROUP_SIZE_M": 8, "SPLIT_K": 8, "A_load_order": 0, "waves_per_eu": 4, "matrix_instr_nonkdim": 16, "num_warps": 4, "num_ctas": 1, "num_stages": 1, "num_buffers_warp_spec": 0, "num_consumer_groups": 0, "reg_dec_producer": 0, "reg_inc_consumer": 0}, "(2, 6144, 4096, 128, 8, 104)": {"BLOCK_SIZE_M": 16, "BLOCK_SIZE_N": 64, "BLOCK_SIZE_K": 128, "GROUP_SIZE_M": 8, "SPLIT_K": 8, "A_load_order": 0, "waves_per_eu": 2, "matrix_instr_nonkdim": 16, "num_warps": 4, "num_ctas": 1, "num_stages": 1, "num_buffers_warp_spec": 0, "num_consumer_groups": 0, "reg_dec_producer": 0, "reg_inc_consumer": 0}, "(2, 4096, 4096, 128, 8, 104)": {"BLOCK_SIZE_M": 16, "BLOCK_SIZE_N": 64, "BLOCK_SIZE_K": 128, "GROUP_SIZE_M": 8, "SPLIT_K": 16, "A_load_order": 0, "waves_per_eu": 4, "matrix_instr_nonkdim": 16, "num_warps": 4, "num_ctas": 1, "num_stages": 1, "num_buffers_warp_spec": 0, "num_consumer_groups": 0, "reg_dec_producer": 0, "reg_inc_consumer": 0}, "(2, 28672, 4096, 128, 8, 104)": {"BLOCK_SIZE_M": 16, "BLOCK_SIZE_N": 64, "BLOCK_SIZE_K": 128, "GROUP_SIZE_M": 8, "SPLIT_K": 8, "A_load_order": 0, "waves_per_eu": 2, "matrix_instr_nonkdim": 16, "num_warps": 4, "num_ctas": 1, "num_stages": 1, "num_buffers_warp_spec": 0, "num_consumer_groups": 0, "reg_dec_producer": 0, "reg_inc_consumer": 0}, "(2, 4096, 14336, 128, 8, 104)": {"BLOCK_SIZE_M": 16, "BLOCK_SIZE_N": 128, "BLOCK_SIZE_K": 64, "GROUP_SIZE_M": 8, "SPLIT_K": 16, "A_load_order": 0, "waves_per_eu": 0, "matrix_instr_nonkdim": 16, "num_warps": 8, "num_ctas": 1, "num_stages": 1, "num_buffers_warp_spec": 0, "num_consumer_groups": 0, "reg_dec_producer": 0, "reg_inc_consumer": 0}, "(48, 4096, 4096, 4096, 1, 408)": {"BLOCK_SIZE_M": 64, "BLOCK_SIZE_N": 32, "BLOCK_SIZE_K": 256, "GROUP_SIZE_M": 8, "SPLIT_K": 1, "A_load_order": 0, "waves_per_eu": 0, "matrix_instr_nonkdim": 16, "num_warps": 8, "num_ctas": 1, "num_stages": 2, "num_buffers_warp_spec": 0, "num_consumer_groups": 0, "reg_dec_producer": 0, "reg_inc_consumer": 0}, "(48, 6144, 4096, 4096, 1, 408)": {"BLOCK_SIZE_M": 64, "BLOCK_SIZE_N": 32, "BLOCK_SIZE_K": 256, "GROUP_SIZE_M": 8, "SPLIT_K": 1, "A_load_order": 0, "waves_per_eu": 0, "matrix_instr_nonkdim": 16, "num_warps": 8, "num_ctas": 1, "num_stages": 2, "num_buffers_warp_spec": 0, "num_consumer_groups": 0, "reg_dec_producer": 0, "reg_inc_consumer": 0}, "(48, 4096, 14336, 14336, 1, 408)": {"BLOCK_SIZE_M": 32, "BLOCK_SIZE_N": 32, "BLOCK_SIZE_K": 512, "GROUP_SIZE_M": 8, "SPLIT_K": 1, "A_load_order": 0, "waves_per_eu": 2, "matrix_instr_nonkdim": 16, "num_warps": 4, "num_ctas": 1, "num_stages": 2, "num_buffers_warp_spec": 0, "num_consumer_groups": 0, "reg_dec_producer": 0, "reg_inc_consumer": 0}, "(48, 28672, 4096, 4096, 1, 408)": {"BLOCK_SIZE_M": 32, "BLOCK_SIZE_N": 64, "BLOCK_SIZE_K": 512, "GROUP_SIZE_M": 8, "SPLIT_K": 1, "A_load_order": 0, "waves_per_eu": 2, "matrix_instr_nonkdim": 16, "num_warps": 4, "num_ctas": 1, "num_stages": 1, "num_buffers_warp_spec": 0, "num_consumer_groups": 0, "reg_dec_producer": 0, "reg_inc_consumer": 0}, "(24, 4096, 4096, 4096, 1, 408)": {"BLOCK_SIZE_M": 32, "BLOCK_SIZE_N": 32, "BLOCK_SIZE_K": 512, "GROUP_SIZE_M": 8, "SPLIT_K": 1, "A_load_order": 0, "waves_per_eu": 0, "matrix_instr_nonkdim": 16, "num_warps": 8, "num_ctas": 1, "num_stages": 2, "num_buffers_warp_spec": 0, "num_consumer_groups": 0, "reg_dec_producer": 0, "reg_inc_consumer": 0}, "(24, 6144, 4096, 4096, 1, 408)": {"BLOCK_SIZE_M": 32, "BLOCK_SIZE_N": 32, "BLOCK_SIZE_K": 512, "GROUP_SIZE_M": 8, "SPLIT_K": 1, "A_load_order": 0, "waves_per_eu": 4, "matrix_instr_nonkdim": 16, "num_warps": 8, "num_ctas": 1, "num_stages": 2, "num_buffers_warp_spec": 0, "num_consumer_groups": 0, "reg_dec_producer": 0, "reg_inc_consumer": 0}, "(24, 4096, 14336, 14336, 1, 408)": {"BLOCK_SIZE_M": 32, "BLOCK_SIZE_N": 64, "BLOCK_SIZE_K": 256, "GROUP_SIZE_M": 8, "SPLIT_K": 4, "A_load_order": 0, "waves_per_eu": 2, "matrix_instr_nonkdim": 16, "num_warps": 8, "num_ctas": 1, "num_stages": 1, "num_buffers_warp_spec": 0, "num_consumer_groups": 0, "reg_dec_producer": 0, "reg_inc_consumer": 0}, "(24, 28672, 4096, 4096, 1, 408)": {"BLOCK_SIZE_M": 16, "BLOCK_SIZE_N": 64, "BLOCK_SIZE_K": 256, "GROUP_SIZE_M": 8, "SPLIT_K": 4, "A_load_order": 0, "waves_per_eu": 2, "matrix_instr_nonkdim": 16, "num_warps": 4, "num_ctas": 1, "num_stages": 1, "num_buffers_warp_spec": 0, "num_consumer_groups": 0, "reg_dec_producer": 0, "reg_inc_consumer": 0}, "(2, 4096, 4096, 4096, 1, 408)": {"BLOCK_SIZE_M": 16, "BLOCK_SIZE_N": 64, "BLOCK_SIZE_K": 512, "GROUP_SIZE_M": 8, "SPLIT_K": 8, "A_load_order": 0, "waves_per_eu": 4, "matrix_instr_nonkdim": 16, "num_warps": 4, "num_ctas": 1, "num_stages": 1, "num_buffers_warp_spec": 0, "num_consumer_groups": 0, "reg_dec_producer": 0, "reg_inc_consumer": 0}, "(2, 6144, 4096, 4096, 1, 408)": {"BLOCK_SIZE_M": 16, "BLOCK_SIZE_N": 64, "BLOCK_SIZE_K": 512, "GROUP_SIZE_M": 8, "SPLIT_K": 1, "A_load_order": 0, "waves_per_eu": 4, "matrix_instr_nonkdim": 16, "num_warps": 4, "num_ctas": 1, "num_stages": 1, "num_buffers_warp_spec": 0, "num_consumer_groups": 0, "reg_dec_producer": 0, "reg_inc_consumer": 0}, "(2, 4096, 14336, 14336, 1, 408)": {"BLOCK_SIZE_M": 16, "BLOCK_SIZE_N": 128, "BLOCK_SIZE_K": 128, "GROUP_SIZE_M": 8, "SPLIT_K": 16, "A_load_order": 0, "waves_per_eu": 2, "matrix_instr_nonkdim": 16, "num_warps": 8, "num_ctas": 1, "num_stages": 1, "num_buffers_warp_spec": 0, "num_consumer_groups": 0, "reg_dec_producer": 0, "reg_inc_consumer": 0}, "(2, 28672, 4096, 4096, 1, 408)": {"BLOCK_SIZE_M": 16, "BLOCK_SIZE_N": 128, "BLOCK_SIZE_K": 64, "GROUP_SIZE_M": 8, "SPLIT_K": 16, "A_load_order": 0, "waves_per_eu": 2, "matrix_instr_nonkdim": 16, "num_warps": 4, "num_ctas": 1, "num_stages": 2, "num_buffers_warp_spec": 0, "num_consumer_groups": 0, "reg_dec_producer": 0, "reg_inc_consumer": 0}, "(64, 4096, 4096, 4096, 1, 1208)": {"BLOCK_SIZE_M": 64, "BLOCK_SIZE_N": 32, "BLOCK_SIZE_K": 256, "GROUP_SIZE_M": 8, "SPLIT_K": 1, "A_load_order": 0, "waves_per_eu": 4, "matrix_instr_nonkdim": 16, "num_warps": 8, "num_ctas": 1, "num_stages": 2, "num_buffers_warp_spec": 0, "num_consumer_groups": 0, "reg_dec_producer": 0, "reg_inc_consumer": 0}, "(64, 6144, 4096, 4096, 1, 1208)": {"BLOCK_SIZE_M": 64, "BLOCK_SIZE_N": 32, "BLOCK_SIZE_K": 256, "GROUP_SIZE_M": 8, "SPLIT_K": 1, "A_load_order": 0, "waves_per_eu": 0, "matrix_instr_nonkdim": 16, "num_warps": 8, "num_ctas": 1, "num_stages": 2, "num_buffers_warp_spec": 0, "num_consumer_groups": 0, "reg_dec_producer": 0, "reg_inc_consumer": 0}, "(64, 4096, 14336, 14336, 1, 1208)": {"BLOCK_SIZE_M": 64, "BLOCK_SIZE_N": 32, "BLOCK_SIZE_K": 256, "GROUP_SIZE_M": 8, "SPLIT_K": 2, "A_load_order": 0, "waves_per_eu": 0, "matrix_instr_nonkdim": 16, "num_warps": 4, "num_ctas": 1, "num_stages": 2, "num_buffers_warp_spec": 0, "num_consumer_groups": 0, "reg_dec_producer": 0, "reg_inc_consumer": 0}, "(64, 28672, 4096, 4096, 1, 1208)": {"BLOCK_SIZE_M": 32, "BLOCK_SIZE_N": 64, "BLOCK_SIZE_K": 256, "GROUP_SIZE_M": 8, "SPLIT_K": 1, "A_load_order": 0, "waves_per_eu": 2, "matrix_instr_nonkdim": 16, "num_warps": 4, "num_ctas": 1, "num_stages": 1, "num_buffers_warp_spec": 0, "num_consumer_groups": 0, "reg_dec_producer": 0, "reg_inc_consumer": 0}, "(32, 4096, 4096, 4096, 1, 1208)": {"BLOCK_SIZE_M": 32, "BLOCK_SIZE_N": 32, "BLOCK_SIZE_K": 512, "GROUP_SIZE_M": 8, "SPLIT_K": 1, "A_load_order": 0, "waves_per_eu": 0, "matrix_instr_nonkdim": 16, "num_warps": 8, "num_ctas": 1, "num_stages": 2, "num_buffers_warp_spec": 0, "num_consumer_groups": 0, "reg_dec_producer": 0, "reg_inc_consumer": 0}, "(32, 6144, 4096, 4096, 1, 1208)": {"BLOCK_SIZE_M": 32, "BLOCK_SIZE_N": 32, "BLOCK_SIZE_K": 512, "GROUP_SIZE_M": 8, "SPLIT_K": 1, "A_load_order": 0, "waves_per_eu": 2, "matrix_instr_nonkdim": 16, "num_warps": 8, "num_ctas": 1, "num_stages": 2, "num_buffers_warp_spec": 0, "num_consumer_groups": 0, "reg_dec_producer": 0, "reg_inc_consumer": 0}, "(32, 4096, 14336, 14336, 1, 1208)": {"BLOCK_SIZE_M": 32, "BLOCK_SIZE_N": 64, "BLOCK_SIZE_K": 256, "GROUP_SIZE_M": 8, "SPLIT_K": 4, "A_load_order": 0, "waves_per_eu": 4, "matrix_instr_nonkdim": 16, "num_warps": 8, "num_ctas": 1, "num_stages": 1, "num_buffers_warp_spec": 0, "num_consumer_groups": 0, "reg_dec_producer": 0, "reg_inc_consumer": 0}, "(32, 28672, 4096, 4096, 1, 1208)": {"BLOCK_SIZE_M": 16, "BLOCK_SIZE_N": 64, "BLOCK_SIZE_K": 256, "GROUP_SIZE_M": 8, "SPLIT_K": 1, "A_load_order": 0, "waves_per_eu": 0, "matrix_instr_nonkdim": 16, "num_warps": 4, "num_ctas": 1, "num_stages": 2, "num_buffers_warp_spec": 0, "num_consumer_groups": 0, "reg_dec_producer": 0, "reg_inc_consumer": 0}, "(16, 4096, 4096, 4096, 1, 1208)": {"BLOCK_SIZE_M": 16, "BLOCK_SIZE_N": 64, "BLOCK_SIZE_K": 512, "GROUP_SIZE_M": 8, "SPLIT_K": 1, "A_load_order": 0, "waves_per_eu": 2, "matrix_instr_nonkdim": 16, "num_warps": 4, "num_ctas": 1, "num_stages": 1, "num_buffers_warp_spec": 0, "num_consumer_groups": 0, "reg_dec_producer": 0, "reg_inc_consumer": 0}, "(8, 4096, 4096, 4096, 1, 1208)": {"BLOCK_SIZE_M": 16, "BLOCK_SIZE_N": 64, "BLOCK_SIZE_K": 128, "GROUP_SIZE_M": 8, "SPLIT_K": 8, "A_load_order": 0, "waves_per_eu": 2, "matrix_instr_nonkdim": 16, "num_warps": 4, "num_ctas": 1, "num_stages": 2, "num_buffers_warp_spec": 0, "num_consumer_groups": 0, "reg_dec_producer": 0, "reg_inc_consumer": 0}, "(4, 4096, 4096, 4096, 1, 1208)": {"BLOCK_SIZE_M": 16, "BLOCK_SIZE_N": 64, "BLOCK_SIZE_K": 512, "GROUP_SIZE_M": 8, "SPLIT_K": 1, "A_load_order": 0, "waves_per_eu": 4, "matrix_instr_nonkdim": 16, "num_warps": 4, "num_ctas": 1, "num_stages": 1, "num_buffers_warp_spec": 0, "num_consumer_groups": 0, "reg_dec_producer": 0, "reg_inc_consumer": 0}, "(16, 6144, 4096, 4096, 1, 1208)": {"BLOCK_SIZE_M": 16, "BLOCK_SIZE_N": 64, "BLOCK_SIZE_K": 512, "GROUP_SIZE_M": 8, "SPLIT_K": 1, "A_load_order": 0, "waves_per_eu": 4, "matrix_instr_nonkdim": 16, "num_warps": 4, "num_ctas": 1, "num_stages": 1, "num_buffers_warp_spec": 0, "num_consumer_groups": 0, "reg_dec_producer": 0, "reg_inc_consumer": 0}, "(8, 6144, 4096, 4096, 1, 1208)": {"BLOCK_SIZE_M": 16, "BLOCK_SIZE_N": 64, "BLOCK_SIZE_K": 512, "GROUP_SIZE_M": 8, "SPLIT_K": 1, "A_load_order": 0, "waves_per_eu": 4, "matrix_instr_nonkdim": 16, "num_warps": 4, "num_ctas": 1, "num_stages": 1, "num_buffers_warp_spec": 0, "num_consumer_groups": 0, "reg_dec_producer": 0, "reg_inc_consumer": 0}, "(4, 6144, 4096, 4096, 1, 1208)": {"BLOCK_SIZE_M": 16, "BLOCK_SIZE_N": 64, "BLOCK_SIZE_K": 512, "GROUP_SIZE_M": 8, "SPLIT_K": 1, "A_load_order": 0, "waves_per_eu": 2, "matrix_instr_nonkdim": 16, "num_warps": 4, "num_ctas": 1, "num_stages": 1, "num_buffers_warp_spec": 0, "num_consumer_groups": 0, "reg_dec_producer": 0, "reg_inc_consumer": 0}, "(16, 4096, 14336, 14336, 1, 1208)": {"BLOCK_SIZE_M": 16, "BLOCK_SIZE_N": 128, "BLOCK_SIZE_K": 128, "GROUP_SIZE_M": 8, "SPLIT_K": 8, "A_load_order": 0, "waves_per_eu": 4, "matrix_instr_nonkdim": 16, "num_warps": 8, "num_ctas": 1, "num_stages": 2, "num_buffers_warp_spec": 0, "num_consumer_groups": 0, "reg_dec_producer": 0, "reg_inc_consumer": 0}, "(8, 4096, 14336, 14336, 1, 1208)": {"BLOCK_SIZE_M": 16, "BLOCK_SIZE_N": 128, "BLOCK_SIZE_K": 128, "GROUP_SIZE_M": 8, "SPLIT_K": 8, "A_load_order": 0, "waves_per_eu": 4, "matrix_instr_nonkdim": 16, "num_warps": 8, "num_ctas": 1, "num_stages": 2, "num_buffers_warp_spec": 0, "num_consumer_groups": 0, "reg_dec_producer": 0, "reg_inc_consumer": 0}, "(4, 4096, 14336, 14336, 1, 1208)": {"BLOCK_SIZE_M": 16, "BLOCK_SIZE_N": 128, "BLOCK_SIZE_K": 128, "GROUP_SIZE_M": 8, "SPLIT_K": 8, "A_load_order": 0, "waves_per_eu": 0, "matrix_instr_nonkdim": 16, "num_warps": 8, "num_ctas": 1, "num_stages": 2, "num_buffers_warp_spec": 0, "num_consumer_groups": 0, "reg_dec_producer": 0, "reg_inc_consumer": 0}, "(16, 28672, 4096, 4096, 1, 1208)": {"BLOCK_SIZE_M": 16, "BLOCK_SIZE_N": 128, "BLOCK_SIZE_K": 64, "GROUP_SIZE_M": 8, "SPLIT_K": 4, "A_load_order": 0, "waves_per_eu": 2, "matrix_instr_nonkdim": 16, "num_warps": 8, "num_ctas": 1, "num_stages": 2, "num_buffers_warp_spec": 0, "num_consumer_groups": 0, "reg_dec_producer": 0, "reg_inc_consumer": 0}, "(8, 28672, 4096, 4096, 1, 1208)": {"BLOCK_SIZE_M": 16, "BLOCK_SIZE_N": 128, "BLOCK_SIZE_K": 64, "GROUP_SIZE_M": 8, "SPLIT_K": 16, "A_load_order": 0, "waves_per_eu": 0, "matrix_instr_nonkdim": 16, "num_warps": 8, "num_ctas": 1, "num_stages": 2, "num_buffers_warp_spec": 0, "num_consumer_groups": 0, "reg_dec_producer": 0, "reg_inc_consumer": 0}, "(4, 28672, 4096, 4096, 1, 1208)": {"BLOCK_SIZE_M": 16, "BLOCK_SIZE_N": 128, "BLOCK_SIZE_K": 64, "GROUP_SIZE_M": 8, "SPLIT_K": 16, "A_load_order": 0, "waves_per_eu": 0, "matrix_instr_nonkdim": 16, "num_warps": 4, "num_ctas": 1, "num_stages": 2, "num_buffers_warp_spec": 0, "num_consumer_groups": 0, "reg_dec_producer": 0, "reg_inc_consumer": 0}, "(48, 4096, 4096, 4096, 1, 1208)": {"BLOCK_SIZE_M": 64, "BLOCK_SIZE_N": 32, "BLOCK_SIZE_K": 256, "GROUP_SIZE_M": 8, "SPLIT_K": 1, "A_load_order": 0, "waves_per_eu": 4, "matrix_instr_nonkdim": 16, "num_warps": 8, "num_ctas": 1, "num_stages": 2, "num_buffers_warp_spec": 0, "num_consumer_groups": 0, "reg_dec_producer": 0, "reg_inc_consumer": 0}, "(24, 4096, 4096, 4096, 1, 1208)": {"BLOCK_SIZE_M": 32, "BLOCK_SIZE_N": 32, "BLOCK_SIZE_K": 512, "GROUP_SIZE_M": 8, "SPLIT_K": 1, "A_load_order": 0, "waves_per_eu": 2, "matrix_instr_nonkdim": 16, "num_warps": 8, "num_ctas": 1, "num_stages": 2, "num_buffers_warp_spec": 0, "num_consumer_groups": 0, "reg_dec_producer": 0, "reg_inc_consumer": 0}, "(2, 4096, 4096, 4096, 1, 1208)": {"BLOCK_SIZE_M": 16, "BLOCK_SIZE_N": 64, "BLOCK_SIZE_K": 512, "GROUP_SIZE_M": 8, "SPLIT_K": 1, "A_load_order": 0, "waves_per_eu": 4, "matrix_instr_nonkdim": 16, "num_warps": 4, "num_ctas": 1, "num_stages": 1, "num_buffers_warp_spec": 0, "num_consumer_groups": 0, "reg_dec_producer": 0, "reg_inc_consumer": 0}, "(48, 6144, 4096, 4096, 1, 1208)": {"BLOCK_SIZE_M": 64, "BLOCK_SIZE_N": 32, "BLOCK_SIZE_K": 256, "GROUP_SIZE_M": 8, "SPLIT_K": 1, "A_load_order": 0, "waves_per_eu": 0, "matrix_instr_nonkdim": 16, "num_warps": 8, "num_ctas": 1, "num_stages": 2, "num_buffers_warp_spec": 0, "num_consumer_groups": 0, "reg_dec_producer": 0, "reg_inc_consumer": 0}, "(24, 6144, 4096, 4096, 1, 1208)": {"BLOCK_SIZE_M": 32, "BLOCK_SIZE_N": 32, "BLOCK_SIZE_K": 512, "GROUP_SIZE_M": 8, "SPLIT_K": 1, "A_load_order": 0, "waves_per_eu": 2, "matrix_instr_nonkdim": 16, "num_warps": 8, "num_ctas": 1, "num_stages": 2, "num_buffers_warp_spec": 0, "num_consumer_groups": 0, "reg_dec_producer": 0, "reg_inc_consumer": 0}, "(2, 6144, 4096, 4096, 1, 1208)": {"BLOCK_SIZE_M": 16, "BLOCK_SIZE_N": 64, "BLOCK_SIZE_K": 512, "GROUP_SIZE_M": 8, "SPLIT_K": 1, "A_load_order": 0, "waves_per_eu": 4, "matrix_instr_nonkdim": 16, "num_warps": 4, "num_ctas": 1, "num_stages": 1, "num_buffers_warp_spec": 0, "num_consumer_groups": 0, "reg_dec_producer": 0, "reg_inc_consumer": 0}, "(48, 4096, 14336, 14336, 1, 1208)": {"BLOCK_SIZE_M": 64, "BLOCK_SIZE_N": 64, "BLOCK_SIZE_K": 256, "GROUP_SIZE_M": 8, "SPLIT_K": 4, "A_load_order": 0, "waves_per_eu": 2, "matrix_instr_nonkdim": 16, "num_warps": 4, "num_ctas": 1, "num_stages": 1, "num_buffers_warp_spec": 0, "num_consumer_groups": 0, "reg_dec_producer": 0, "reg_inc_consumer": 0}, "(24, 4096, 14336, 14336, 1, 1208)": {"BLOCK_SIZE_M": 32, "BLOCK_SIZE_N": 64, "BLOCK_SIZE_K": 128, "GROUP_SIZE_M": 8, "SPLIT_K": 4, "A_load_order": 0, "waves_per_eu": 2, "matrix_instr_nonkdim": 16, "num_warps": 8, "num_ctas": 1, "num_stages": 2, "num_buffers_warp_spec": 0, "num_consumer_groups": 0, "reg_dec_producer": 0, "reg_inc_consumer": 0}, "(2, 4096, 14336, 14336, 1, 1208)": {"BLOCK_SIZE_M": 16, "BLOCK_SIZE_N": 128, "BLOCK_SIZE_K": 128, "GROUP_SIZE_M": 8, "SPLIT_K": 16, "A_load_order": 0, "waves_per_eu": 2, "matrix_instr_nonkdim": 16, "num_warps": 8, "num_ctas": 1, "num_stages": 2, "num_buffers_warp_spec": 0, "num_consumer_groups": 0, "reg_dec_producer": 0, "reg_inc_consumer": 0}, "(48, 28672, 4096, 4096, 1, 1208)": {"BLOCK_SIZE_M": 32, "BLOCK_SIZE_N": 64, "BLOCK_SIZE_K": 256, "GROUP_SIZE_M": 8, "SPLIT_K": 1, "A_load_order": 0, "waves_per_eu": 4, "matrix_instr_nonkdim": 16, "num_warps": 4, "num_ctas": 1, "num_stages": 1, "num_buffers_warp_spec": 0, "num_consumer_groups": 0, "reg_dec_producer": 0, "reg_inc_consumer": 0}, "(24, 28672, 4096, 4096, 1, 1208)": {"BLOCK_SIZE_M": 16, "BLOCK_SIZE_N": 64, "BLOCK_SIZE_K": 256, "GROUP_SIZE_M": 8, "SPLIT_K": 1, "A_load_order": 0, "waves_per_eu": 4, "matrix_instr_nonkdim": 16, "num_warps": 4, "num_ctas": 1, "num_stages": 2, "num_buffers_warp_spec": 0, "num_consumer_groups": 0, "reg_dec_producer": 0, "reg_inc_consumer": 0}, "(2, 28672, 4096, 4096, 1, 1208)": {"BLOCK_SIZE_M": 16, "BLOCK_SIZE_N": 128, "BLOCK_SIZE_K": 64, "GROUP_SIZE_M": 8, "SPLIT_K": 16, "A_load_order": 0, "waves_per_eu": 4, "matrix_instr_nonkdim": 16, "num_warps": 4, "num_ctas": 1, "num_stages": 2, "num_buffers_warp_spec": 0, "num_consumer_groups": 0, "reg_dec_producer": 0, "reg_inc_consumer": 0}, "(48, 3584, 3584, 3584, 1, 408)": {"BLOCK_SIZE_M": 64, "BLOCK_SIZE_N": 64, "BLOCK_SIZE_K": 256, "GROUP_SIZE_M": 8, "SPLIT_K": 1, "A_load_order": 0, "waves_per_eu": 0, "matrix_instr_nonkdim": 16, "num_warps": 8, "num_ctas": 1, "num_stages": 2, "num_buffers_warp_spec": 0, "num_consumer_groups": 0, "reg_dec_producer": 0, "reg_inc_consumer": 0}, "(24, 3584, 3584, 3584, 1, 408)": {"BLOCK_SIZE_M": 32, "BLOCK_SIZE_N": 32, "BLOCK_SIZE_K": 256, "GROUP_SIZE_M": 8, "SPLIT_K": 1, "A_load_order": 0, "waves_per_eu": 0, "matrix_instr_nonkdim": 16, "num_warps": 4, "num_ctas": 1, "num_stages": 2, "num_buffers_warp_spec": 0, "num_consumer_groups": 0, "reg_dec_producer": 0, "reg_inc_consumer": 0}, "(2, 3584, 3584, 3584, 1, 408)": {"BLOCK_SIZE_M": 16, "BLOCK_SIZE_N": 32, "BLOCK_SIZE_K": 512, "GROUP_SIZE_M": 8, "SPLIT_K": 1, "A_load_order": 0, "waves_per_eu": 0, "matrix_instr_nonkdim": 16, "num_warps": 4, "num_ctas": 1, "num_stages": 1, "num_buffers_warp_spec": 0, "num_consumer_groups": 0, "reg_dec_producer": 0, "reg_inc_consumer": 0}, "(48, 4608, 3584, 3584, 1, 408)": {"BLOCK_SIZE_M": 32, "BLOCK_SIZE_N": 32, "BLOCK_SIZE_K": 256, "GROUP_SIZE_M": 8, "SPLIT_K": 1, "A_load_order": 0, "waves_per_eu": 4, "matrix_instr_nonkdim": 16, "num_warps": 4, "num_ctas": 1, "num_stages": 2, "num_buffers_warp_spec": 0, "num_consumer_groups": 0, "reg_dec_producer": 0, "reg_inc_consumer": 0}, "(24, 4608, 3584, 3584, 1, 408)": {"BLOCK_SIZE_M": 32, "BLOCK_SIZE_N": 32, "BLOCK_SIZE_K": 512, "GROUP_SIZE_M": 8, "SPLIT_K": 1, "A_load_order": 0, "waves_per_eu": 2, "matrix_instr_nonkdim": 16, "num_warps": 8, "num_ctas": 1, "num_stages": 1, "num_buffers_warp_spec": 0, "num_consumer_groups": 0, "reg_dec_producer": 0, "reg_inc_consumer": 0}, "(2, 4608, 3584, 3584, 1, 408)": {"BLOCK_SIZE_M": 16, "BLOCK_SIZE_N": 32, "BLOCK_SIZE_K": 512, "GROUP_SIZE_M": 8, "SPLIT_K": 1, "A_load_order": 0, "waves_per_eu": 2, "matrix_instr_nonkdim": 16, "num_warps": 4, "num_ctas": 1, "num_stages": 2, "num_buffers_warp_spec": 0, "num_consumer_groups": 0, "reg_dec_producer": 0, "reg_inc_consumer": 0}, "(48, 3584, 18944, 18944, 1, 408)": {"BLOCK_SIZE_M": 64, "BLOCK_SIZE_N": 64, "BLOCK_SIZE_K": 128, "GROUP_SIZE_M": 8, "SPLIT_K": 4, "A_load_order": 0, "waves_per_eu": 4, "matrix_instr_nonkdim": 16, "num_warps": 8, "num_ctas": 1, "num_stages": 2, "num_buffers_warp_spec": 0, "num_consumer_groups": 0, "reg_dec_producer": 0, "reg_inc_consumer": 0}, "(24, 3584, 18944, 18944, 1, 408)": {"BLOCK_SIZE_M": 32, "BLOCK_SIZE_N": 64, "BLOCK_SIZE_K": 128, "GROUP_SIZE_M": 8, "SPLIT_K": 4, "A_load_order": 0, "waves_per_eu": 4, "matrix_instr_nonkdim": 16, "num_warps": 8, "num_ctas": 1, "num_stages": 2, "num_buffers_warp_spec": 0, "num_consumer_groups": 0, "reg_dec_producer": 0, "reg_inc_consumer": 0}, "(2, 3584, 18944, 18944, 1, 408)": {"BLOCK_SIZE_M": 16, "BLOCK_SIZE_N": 32, "BLOCK_SIZE_K": 64, "GROUP_SIZE_M": 8, "SPLIT_K": 8, "A_load_order": 0, "waves_per_eu": 4, "matrix_instr_nonkdim": 16, "num_warps": 4, "num_ctas": 1, "num_stages": 2, "num_buffers_warp_spec": 0, "num_consumer_groups": 0, "reg_dec_producer": 0, "reg_inc_consumer": 0}, "(48, 37888, 3584, 3584, 1, 408)": {"BLOCK_SIZE_M": 64, "BLOCK_SIZE_N": 64, "BLOCK_SIZE_K": 256, "GROUP_SIZE_M": 8, "SPLIT_K": 1, "A_load_order": 0, "waves_per_eu": 2, "matrix_instr_nonkdim": 16, "num_warps": 4, "num_ctas": 1, "num_stages": 2, "num_buffers_warp_spec": 0, "num_consumer_groups": 0, "reg_dec_producer": 0, "reg_inc_consumer": 0}, "(24, 37888, 3584, 3584, 1, 408)": {"BLOCK_SIZE_M": 32, "BLOCK_SIZE_N": 64, "BLOCK_SIZE_K": 256, "GROUP_SIZE_M": 8, "SPLIT_K": 1, "A_load_order": 0, "waves_per_eu": 4, "matrix_instr_nonkdim": 16, "num_warps": 4, "num_ctas": 1, "num_stages": 2, "num_buffers_warp_spec": 0, "num_consumer_groups": 0, "reg_dec_producer": 0, "reg_inc_consumer": 0}, "(2, 37888, 3584, 3584, 1, 408)": {"BLOCK_SIZE_M": 16, "BLOCK_SIZE_N": 64, "BLOCK_SIZE_K": 256, "GROUP_SIZE_M": 8, "SPLIT_K": 1, "A_load_order": 0, "waves_per_eu": 4, "matrix_instr_nonkdim": 16, "num_warps": 4, "num_ctas": 1, "num_stages": 2, "num_buffers_warp_spec": 0, "num_consumer_groups": 0, "reg_dec_producer": 0, "reg_inc_consumer": 0}, "(48, 3584, 3584, 128, 8, 104)": {"BLOCK_SIZE_M": 64, "BLOCK_SIZE_N": 32, "BLOCK_SIZE_K": 128, "GROUP_SIZE_M": 8, "SPLIT_K": 4, "A_load_order": 0, "waves_per_eu": 2, "matrix_instr_nonkdim": 16, "num_warps": 4, "num_ctas": 1, "num_stages": 1, "num_buffers_warp_spec": 0, "num_consumer_groups": 0, "reg_dec_producer": 0, "reg_inc_consumer": 0}, "(24, 3584, 3584, 128, 8, 104)": {"BLOCK_SIZE_M": 32, "BLOCK_SIZE_N": 64, "BLOCK_SIZE_K": 64, "GROUP_SIZE_M": 8, "SPLIT_K": 8, "A_load_order": 0, "waves_per_eu": 4, "matrix_instr_nonkdim": 16, "num_warps": 8, "num_ctas": 1, "num_stages": 2, "num_buffers_warp_spec": 0, "num_consumer_groups": 0, "reg_dec_producer": 0, "reg_inc_consumer": 0}, "(2, 3584, 3584, 128, 8, 104)": {"BLOCK_SIZE_M": 16, "BLOCK_SIZE_N": 64, "BLOCK_SIZE_K": 32, "GROUP_SIZE_M": 8, "SPLIT_K": 16, "A_load_order": 0, "waves_per_eu": 4, "matrix_instr_nonkdim": 16, "num_warps": 4, "num_ctas": 1, "num_stages": 1, "num_buffers_warp_spec": 0, "num_consumer_groups": 0, "reg_dec_producer": 0, "reg_inc_consumer": 0}, "(48, 4608, 3584, 128, 8, 104)": {"BLOCK_SIZE_M": 64, "BLOCK_SIZE_N": 32, "BLOCK_SIZE_K": 128, "GROUP_SIZE_M": 8, "SPLIT_K": 4, "A_load_order": 0, "waves_per_eu": 4, "matrix_instr_nonkdim": 16, "num_warps": 4, "num_ctas": 1, "num_stages": 1, "num_buffers_warp_spec": 0, "num_consumer_groups": 0, "reg_dec_producer": 0, "reg_inc_consumer": 0}, "(24, 4608, 3584, 128, 8, 104)": {"BLOCK_SIZE_M": 32, "BLOCK_SIZE_N": 64, "BLOCK_SIZE_K": 128, "GROUP_SIZE_M": 8, "SPLIT_K": 4, "A_load_order": 0, "waves_per_eu": 4, "matrix_instr_nonkdim": 16, "num_warps": 8, "num_ctas": 1, "num_stages": 1, "num_buffers_warp_spec": 0, "num_consumer_groups": 0, "reg_dec_producer": 0, "reg_inc_consumer": 0}, "(2, 4608, 3584, 128, 8, 104)": {"BLOCK_SIZE_M": 16, "BLOCK_SIZE_N": 64, "BLOCK_SIZE_K": 32, "GROUP_SIZE_M": 8, "SPLIT_K": 8, "A_load_order": 0, "waves_per_eu": 0, "matrix_instr_nonkdim": 16, "num_warps": 4, "num_ctas": 1, "num_stages": 2, "num_buffers_warp_spec": 0, "num_consumer_groups": 0, "reg_dec_producer": 0, "reg_inc_consumer": 0}, "(48, 3584, 18944, 128, 8, 104)": {"BLOCK_SIZE_M": 64, "BLOCK_SIZE_N": 32, "BLOCK_SIZE_K": 64, "GROUP_SIZE_M": 8, "SPLIT_K": 8, "A_load_order": 0, "waves_per_eu": 2, "matrix_instr_nonkdim": 16, "num_warps": 4, "num_ctas": 1, "num_stages": 1, "num_buffers_warp_spec": 0, "num_consumer_groups": 0, "reg_dec_producer": 0, "reg_inc_consumer": 0}, "(24, 3584, 18944, 128, 8, 104)": {"BLOCK_SIZE_M": 32, "BLOCK_SIZE_N": 64, "BLOCK_SIZE_K": 32, "GROUP_SIZE_M": 8, "SPLIT_K": 16, "A_load_order": 0, "waves_per_eu": 2, "matrix_instr_nonkdim": 16, "num_warps": 4, "num_ctas": 1, "num_stages": 1, "num_buffers_warp_spec": 0, "num_consumer_groups": 0, "reg_dec_producer": 0, "reg_inc_consumer": 0}, "(2, 3584, 18944, 128, 8, 104)": {"BLOCK_SIZE_M": 16, "BLOCK_SIZE_N": 64, "BLOCK_SIZE_K": 32, "GROUP_SIZE_M": 8, "SPLIT_K": 16, "A_load_order": 0, "waves_per_eu": 0, "matrix_instr_nonkdim": 16, "num_warps": 4, "num_ctas": 1, "num_stages": 1, "num_buffers_warp_spec": 0, "num_consumer_groups": 0, "reg_dec_producer": 0, "reg_inc_consumer": 0}, "(48, 37888, 3584, 128, 8, 104)": {"BLOCK_SIZE_M": 64, "BLOCK_SIZE_N": 64, "BLOCK_SIZE_K": 128, "GROUP_SIZE_M": 8, "SPLIT_K": 1, "A_load_order": 0, "waves_per_eu": 2, "matrix_instr_nonkdim": 16, "num_warps": 4, "num_ctas": 1, "num_stages": 1, "num_buffers_warp_spec": 0, "num_consumer_groups": 0, "reg_dec_producer": 0, "reg_inc_consumer": 0}, "(24, 37888, 3584, 128, 8, 104)": {"BLOCK_SIZE_M": 32, "BLOCK_SIZE_N": 64, "BLOCK_SIZE_K": 128, "GROUP_SIZE_M": 8, "SPLIT_K": 2, "A_load_order": 0, "waves_per_eu": 4, "matrix_instr_nonkdim": 16, "num_warps": 4, "num_ctas": 1, "num_stages": 1, "num_buffers_warp_spec": 0, "num_consumer_groups": 0, "reg_dec_producer": 0, "reg_inc_consumer": 0}, "(2, 37888, 3584, 128, 8, 104)": {"BLOCK_SIZE_M": 16, "BLOCK_SIZE_N": 64, "BLOCK_SIZE_K": 128, "GROUP_SIZE_M": 8, "SPLIT_K": 4, "A_load_order": 0, "waves_per_eu": 4, "matrix_instr_nonkdim": 16, "num_warps": 4, "num_ctas": 1, "num_stages": 1, "num_buffers_warp_spec": 0, "num_consumer_groups": 0, "reg_dec_producer": 0, "reg_inc_consumer": 0}, "(48, 3584, 3584, 64, 8, 104)": {"BLOCK_SIZE_M": 64, "BLOCK_SIZE_N": 64, "BLOCK_SIZE_K": 64, "GROUP_SIZE_M": 8, "SPLIT_K": 4, "A_load_order": 0, "waves_per_eu": 0, "matrix_instr_nonkdim": 16, "num_warps": 8, "num_ctas": 1, "num_stages": 2, "num_buffers_warp_spec": 0, "num_consumer_groups": 0, "reg_dec_producer": 0, "reg_inc_consumer": 0}, "(24, 3584, 3584, 64, 8, 104)": {"BLOCK_SIZE_M": 32, "BLOCK_SIZE_N": 32, "BLOCK_SIZE_K": 64, "GROUP_SIZE_M": 8, "SPLIT_K": 4, "A_load_order": 0, "waves_per_eu": 2, "matrix_instr_nonkdim": 16, "num_warps": 4, "num_ctas": 1, "num_stages": 2, "num_buffers_warp_spec": 0, "num_consumer_groups": 0, "reg_dec_producer": 0, "reg_inc_consumer": 0}, "(2, 3584, 3584, 64, 8, 104)": {"BLOCK_SIZE_M": 16, "BLOCK_SIZE_N": 64, "BLOCK_SIZE_K": 32, "GROUP_SIZE_M": 8, "SPLIT_K": 16, "A_load_order": 0, "waves_per_eu": 4, "matrix_instr_nonkdim": 16, "num_warps": 4, "num_ctas": 1, "num_stages": 1, "num_buffers_warp_spec": 0, "num_consumer_groups": 0, "reg_dec_producer": 0, "reg_inc_consumer": 0}, "(48, 4608, 3584, 64, 8, 104)": {"BLOCK_SIZE_M": 64, "BLOCK_SIZE_N": 32, "BLOCK_SIZE_K": 64, "GROUP_SIZE_M": 8, "SPLIT_K": 4, "A_load_order": 0, "waves_per_eu": 2, "matrix_instr_nonkdim": 16, "num_warps": 4, "num_ctas": 1, "num_stages": 1, "num_buffers_warp_spec": 0, "num_consumer_groups": 0, "reg_dec_producer": 0, "reg_inc_consumer": 0}, "(24, 4608, 3584, 64, 8, 104)": {"BLOCK_SIZE_M": 32, "BLOCK_SIZE_N": 64, "BLOCK_SIZE_K": 64, "GROUP_SIZE_M": 8, "SPLIT_K": 4, "A_load_order": 0, "waves_per_eu": 4, "matrix_instr_nonkdim": 16, "num_warps": 4, "num_ctas": 1, "num_stages": 2, "num_buffers_warp_spec": 0, "num_consumer_groups": 0, "reg_dec_producer": 0, "reg_inc_consumer": 0}, "(2, 4608, 3584, 64, 8, 104)": {"BLOCK_SIZE_M": 16, "BLOCK_SIZE_N": 256, "BLOCK_SIZE_K": 32, "GROUP_SIZE_M": 8, "SPLIT_K": 16, "A_load_order": 0, "waves_per_eu": 0, "matrix_instr_nonkdim": 16, "num_warps": 8, "num_ctas": 1, "num_stages": 1, "num_buffers_warp_spec": 0, "num_consumer_groups": 0, "reg_dec_producer": 0, "reg_inc_consumer": 0}, "(48, 3584, 18944, 64, 8, 104)": {"BLOCK_SIZE_M": 64, "BLOCK_SIZE_N": 32, "BLOCK_SIZE_K": 64, "GROUP_SIZE_M": 8, "SPLIT_K": 8, "A_load_order": 0, "waves_per_eu": 4, "matrix_instr_nonkdim": 16, "num_warps": 4, "num_ctas": 1, "num_stages": 1, "num_buffers_warp_spec": 0, "num_consumer_groups": 0, "reg_dec_producer": 0, "reg_inc_consumer": 0}, "(24, 3584, 18944, 64, 8, 104)": {"BLOCK_SIZE_M": 32, "BLOCK_SIZE_N": 64, "BLOCK_SIZE_K": 32, "GROUP_SIZE_M": 8, "SPLIT_K": 16, "A_load_order": 0, "waves_per_eu": 2, "matrix_instr_nonkdim": 16, "num_warps": 4, "num_ctas": 1, "num_stages": 1, "num_buffers_warp_spec": 0, "num_consumer_groups": 0, "reg_dec_producer": 0, "reg_inc_consumer": 0}, "(2, 3584, 18944, 64, 8, 104)": {"BLOCK_SIZE_M": 16, "BLOCK_SIZE_N": 64, "BLOCK_SIZE_K": 32, "GROUP_SIZE_M": 8, "SPLIT_K": 16, "A_load_order": 0, "waves_per_eu": 4, "matrix_instr_nonkdim": 16, "num_warps": 4, "num_ctas": 1, "num_stages": 1, "num_buffers_warp_spec": 0, "num_consumer_groups": 0, "reg_dec_producer": 0, "reg_inc_consumer": 0}, "(48, 37888, 3584, 64, 8, 104)": {"BLOCK_SIZE_M": 64, "BLOCK_SIZE_N": 128, "BLOCK_SIZE_K": 64, "GROUP_SIZE_M": 8, "SPLIT_K": 2, "A_load_order": 0, "waves_per_eu": 2, "matrix_instr_nonkdim": 16, "num_warps": 4, "num_ctas": 1, "num_stages": 1, "num_buffers_warp_spec": 0, "num_consumer_groups": 0, "reg_dec_producer": 0, "reg_inc_consumer": 0}, "(24, 37888, 3584, 64, 8, 104)": {"BLOCK_SIZE_M": 32, "BLOCK_SIZE_N": 64, "BLOCK_SIZE_K": 64, "GROUP_SIZE_M": 8, "SPLIT_K": 8, "A_load_order": 0, "waves_per_eu": 4, "matrix_instr_nonkdim": 16, "num_warps": 4, "num_ctas": 1, "num_stages": 1, "num_buffers_warp_spec": 0, "num_consumer_groups": 0, "reg_dec_producer": 0, "reg_inc_consumer": 0}, "(2, 37888, 3584, 64, 8, 104)": {"BLOCK_SIZE_M": 16, "BLOCK_SIZE_N": 64, "BLOCK_SIZE_K": 64, "GROUP_SIZE_M": 8, "SPLIT_K": 8, "A_load_order": 0, "waves_per_eu": 0, "matrix_instr_nonkdim": 16, "num_warps": 4, "num_ctas": 1, "num_stages": 1, "num_buffers_warp_spec": 0, "num_consumer_groups": 0, "reg_dec_producer": 0, "reg_inc_consumer": 0}, "(48, 1024, 4096, 128, 8, 104)": {"BLOCK_SIZE_M": 32, "BLOCK_SIZE_N": 32, "BLOCK_SIZE_K": 128, "GROUP_SIZE_M": 8, "SPLIT_K": 8, "A_load_order": 0, "waves_per_eu": 2, "matrix_instr_nonkdim": 16, "num_warps": 4, "num_ctas": 1, "num_stages": 1, "num_buffers_warp_spec": 0, "num_consumer_groups": 0, "reg_dec_producer": 0, "reg_inc_consumer": 0}, "(48, 14336, 4096, 128, 8, 104)": {"BLOCK_SIZE_M": 64, "BLOCK_SIZE_N": 32, "BLOCK_SIZE_K": 64, "GROUP_SIZE_M": 8, "SPLIT_K": 2, "A_load_order": 0, "waves_per_eu": 2, "matrix_instr_nonkdim": 16, "num_warps": 4, "num_ctas": 1, "num_stages": 1, "num_buffers_warp_spec": 0, "num_consumer_groups": 0, "reg_dec_producer": 0, "reg_inc_consumer": 0}, "(48, 1024, 4096, 4096, 1, 408)": {"BLOCK_SIZE_M": 32, "BLOCK_SIZE_N": 32, "BLOCK_SIZE_K": 512, "GROUP_SIZE_M": 8, "SPLIT_K": 1, "A_load_order": 0, "waves_per_eu": 4, "matrix_instr_nonkdim": 16, "num_warps": 8, "num_ctas": 1, "num_stages": 2, "num_buffers_warp_spec": 0, "num_consumer_groups": 0, "reg_dec_producer": 0, "reg_inc_consumer": 0}, "(48, 14336, 4096, 4096, 1, 408)": {"BLOCK_SIZE_M": 64, "BLOCK_SIZE_N": 64, "BLOCK_SIZE_K": 256, "GROUP_SIZE_M": 8, "SPLIT_K": 1, "A_load_order": 0, "waves_per_eu": 2, "matrix_instr_nonkdim": 16, "num_warps": 8, "num_ctas": 1, "num_stages": 2, "num_buffers_warp_spec": 0, "num_consumer_groups": 0, "reg_dec_producer": 0, "reg_inc_consumer": 0}, "(48, 1024, 4096, 4096, 1, 1208)": {"BLOCK_SIZE_M": 64, "BLOCK_SIZE_N": 32, "BLOCK_SIZE_K": 256, "GROUP_SIZE_M": 8, "SPLIT_K": 8, "A_load_order": 0, "waves_per_eu": 2, "matrix_instr_nonkdim": 16, "num_warps": 8, "num_ctas": 1, "num_stages": 2, "num_buffers_warp_spec": 0, "num_consumer_groups": 0, "reg_dec_producer": 0, "reg_inc_consumer": 0}, "(48, 14336, 4096, 4096, 1, 1208)": {"BLOCK_SIZE_M": 64, "BLOCK_SIZE_N": 64, "BLOCK_SIZE_K": 128, "GROUP_SIZE_M": 8, "SPLIT_K": 1, "A_load_order": 0, "waves_per_eu": 4, "matrix_instr_nonkdim": 16, "num_warps": 8, "num_ctas": 1, "num_stages": 2, "num_buffers_warp_spec": 0, "num_consumer_groups": 0, "reg_dec_producer": 0, "reg_inc_consumer": 0}}, "GEMM": {"(128, 4096, 4096, 4096, 1, 408)": {"BLOCK_SIZE_M": 64, "BLOCK_SIZE_N": 64, "BLOCK_SIZE_K": 256, "GROUP_SIZE_M": 8, "A_load_order": 0, "waves_per_eu": 0, "matrix_instr_nonkdim": 16, "num_warps": 8, "num_ctas": 1, "num_stages": 2, "num_buffers_warp_spec": 0, "num_consumer_groups": 0, "reg_dec_producer": 0, "reg_inc_consumer": 0}, "(256, 4096, 4096, 4096, 1, 408)": {"BLOCK_SIZE_M": 64, "BLOCK_SIZE_N": 64, "BLOCK_SIZE_K": 128, "GROUP_SIZE_M": 8, "A_load_order": 0, "waves_per_eu": 0, "matrix_instr_nonkdim": 16, "num_warps": 8, "num_ctas": 1, "num_stages": 2, "num_buffers_warp_spec": 0, "num_consumer_groups": 0, "reg_dec_producer": 0, "reg_inc_consumer": 0}, "(512, 4096, 4096, 4096, 1, 408)": {"BLOCK_SIZE_M": 128, "BLOCK_SIZE_N": 64, "BLOCK_SIZE_K": 128, "GROUP_SIZE_M": 8, "A_load_order": 0, "waves_per_eu": 0, "matrix_instr_nonkdim": 16, "num_warps": 8, "num_ctas": 1, "num_stages": 2, "num_buffers_warp_spec": 0, "num_consumer_groups": 0, "reg_dec_producer": 0, "reg_inc_consumer": 0}, "(1024, 4096, 4096, 4096, 1, 408)": {"BLOCK_SIZE_M": 128, "BLOCK_SIZE_N": 128, "BLOCK_SIZE_K": 128, "GROUP_SIZE_M": 8, "A_load_order": 0, "waves_per_eu": 0, "matrix_instr_nonkdim": 16, "num_warps": 8, "num_ctas": 1, "num_stages": 2, "num_buffers_warp_spec": 0, "num_consumer_groups": 0, "reg_dec_producer": 0, "reg_inc_consumer": 0}, "(2048, 4096, 4096, 4096, 1, 408)": {"BLOCK_SIZE_M": 128, "BLOCK_SIZE_N": 128, "BLOCK_SIZE_K": 128, "GROUP_SIZE_M": 8, "A_load_order": 0, "waves_per_eu": 2, "matrix_instr_nonkdim": 16, "num_warps": 4, "num_ctas": 1, "num_stages": 2, "num_buffers_warp_spec": 0, "num_consumer_groups": 0, "reg_dec_producer": 0, "reg_inc_consumer": 0}, "(128, 6144, 4096, 4096, 1, 408)": {"BLOCK_SIZE_M": 64, "BLOCK_SIZE_N": 64, "BLOCK_SIZE_K": 256, "GROUP_SIZE_M": 8, "A_load_order": 0, "waves_per_eu": 4, "matrix_instr_nonkdim": 16, "num_warps": 8, "num_ctas": 1, "num_stages": 2, "num_buffers_warp_spec": 0, "num_consumer_groups": 0, "reg_dec_producer": 0, "reg_inc_consumer": 0}, "(256, 6144, 4096, 4096, 1, 408)": {"BLOCK_SIZE_M": 128, "BLOCK_SIZE_N": 64, "BLOCK_SIZE_K": 128, "GROUP_SIZE_M": 8, "A_load_order": 0, "waves_per_eu": 0, "matrix_instr_nonkdim": 16, "num_warps": 8, "num_ctas": 1, "num_stages": 2, "num_buffers_warp_spec": 0, "num_consumer_groups": 0, "reg_dec_producer": 0, "reg_inc_consumer": 0}, "(512, 6144, 4096, 4096, 1, 408)": {"BLOCK_SIZE_M": 128, "BLOCK_SIZE_N": 128, "BLOCK_SIZE_K": 128, "GROUP_SIZE_M": 8, "A_load_order": 0, "waves_per_eu": 0, "matrix_instr_nonkdim": 16, "num_warps": 8, "num_ctas": 1, "num_stages": 2, "num_buffers_warp_spec": 0, "num_consumer_groups": 0, "reg_dec_producer": 0, "reg_inc_consumer": 0}, "(1024, 6144, 4096, 4096, 1, 408)": {"BLOCK_SIZE_M": 128, "BLOCK_SIZE_N": 128, "BLOCK_SIZE_K": 128, "GROUP_SIZE_M": 8, "A_load_order": 0, "waves_per_eu": 0, "matrix_instr_nonkdim": 16, "num_warps": 4, "num_ctas": 1, "num_stages": 2, "num_buffers_warp_spec": 0, "num_consumer_groups": 0, "reg_dec_producer": 0, "reg_inc_consumer": 0}, "(1024, 4096, 14336, 14336, 1, 408)": {"BLOCK_SIZE_M": 128, "BLOCK_SIZE_N": 128, "BLOCK_SIZE_K": 128, "GROUP_SIZE_M": 8, "A_load_order": 0, "waves_per_eu": 0, "matrix_instr_nonkdim": 16, "num_warps": 8, "num_ctas": 1, "num_stages": 2, "num_buffers_warp_spec": 0, "num_consumer_groups": 0, "reg_dec_producer": 0, "reg_inc_consumer": 0}, "(1024, 28672, 4096, 4096, 1, 408)": {"BLOCK_SIZE_M": 128, "BLOCK_SIZE_N": 128, "BLOCK_SIZE_K": 128, "GROUP_SIZE_M": 8, "A_load_order": 0, "waves_per_eu": 2, "matrix_instr_nonkdim": 16, "num_warps": 4, "num_ctas": 1, "num_stages": 2, "num_buffers_warp_spec": 0, "num_consumer_groups": 0, "reg_dec_producer": 0, "reg_inc_consumer": 0}, "(128, 37888, 3584, 3584, 1, 408)": {"BLOCK_SIZE_M": 128, "BLOCK_SIZE_N": 64, "BLOCK_SIZE_K": 256, "GROUP_SIZE_M": 8, "A_load_order": 0, "waves_per_eu": 0, "matrix_instr_nonkdim": 16, "num_warps": 8, "num_ctas": 1, "num_stages": 1, "num_buffers_warp_spec": 0, "num_consumer_groups": 0, "reg_dec_producer": 0, "reg_inc_consumer": 0}, "(256, 37888, 3584, 3584, 1, 408)": {"BLOCK_SIZE_M": 128, "BLOCK_SIZE_N": 128, "BLOCK_SIZE_K": 128, "GROUP_SIZE_M": 8, "A_load_order": 0, "waves_per_eu": 0, "matrix_instr_nonkdim": 16, "num_warps": 8, "num_ctas": 1, "num_stages": 2, "num_buffers_warp_spec": 0, "num_consumer_groups": 0, "reg_dec_producer": 0, "reg_inc_consumer": 0}, "(512, 37888, 3584, 3584, 1, 408)": {"BLOCK_SIZE_M": 256, "BLOCK_SIZE_N": 128, "BLOCK_SIZE_K": 128, "GROUP_SIZE_M": 8, "A_load_order": 0, "waves_per_eu": 4, "matrix_instr_nonkdim": 16, "num_warps": 8, "num_ctas": 1, "num_stages": 1, "num_buffers_warp_spec": 0, "num_consumer_groups": 0, "reg_dec_producer": 0, "reg_inc_consumer": 0}, "(1024, 37888, 3584, 3584, 1, 408)": {"BLOCK_SIZE_M": 256, "BLOCK_SIZE_N": 128, "BLOCK_SIZE_K": 128, "GROUP_SIZE_M": 8, "A_load_order": 0, "waves_per_eu": 2, "matrix_instr_nonkdim": 16, "num_warps": 8, "num_ctas": 1, "num_stages": 1, "num_buffers_warp_spec": 0, "num_consumer_groups": 0, "reg_dec_producer": 0, "reg_inc_consumer": 0}, "(128, 3584, 18944, 18944, 1, 408)": {"BLOCK_SIZE_M": 64, "BLOCK_SIZE_N": 32, "BLOCK_SIZE_K": 256, "GROUP_SIZE_M": 8, "A_load_order": 0, "waves_per_eu": 2, "matrix_instr_nonkdim": 16, "num_warps": 8, "num_ctas": 1, "num_stages": 2, "num_buffers_warp_spec": 0, "num_consumer_groups": 0, "reg_dec_producer": 0, "reg_inc_consumer": 0}, "(256, 3584, 18944, 18944, 1, 408)": {"BLOCK_SIZE_M": 64, "BLOCK_SIZE_N": 64, "BLOCK_SIZE_K": 256, "GROUP_SIZE_M": 8, "A_load_order": 0, "waves_per_eu": 4, "matrix_instr_nonkdim": 16, "num_warps": 8, "num_ctas": 1, "num_stages": 2, "num_buffers_warp_spec": 0, "num_consumer_groups": 0, "reg_dec_producer": 0, "reg_inc_consumer": 0}, "(512, 3584, 18944, 18944, 1, 408)": {"BLOCK_SIZE_M": 64, "BLOCK_SIZE_N": 64, "BLOCK_SIZE_K": 256, "GROUP_SIZE_M": 8, "A_load_order": 0, "waves_per_eu": 0, "matrix_instr_nonkdim": 16, "num_warps": 4, "num_ctas": 1, "num_stages": 2, "num_buffers_warp_spec": 0, "num_consumer_groups": 0, "reg_dec_producer": 0, "reg_inc_consumer": 0}, "(1024, 3584, 18944, 18944, 1, 408)": {"BLOCK_SIZE_M": 64, "BLOCK_SIZE_N": 128, "BLOCK_SIZE_K": 128, "GROUP_SIZE_M": 8, "A_load_order": 0, "waves_per_eu": 4, "matrix_instr_nonkdim": 16, "num_warps": 4, "num_ctas": 1, "num_stages": 2, "num_buffers_warp_spec": 0, "num_consumer_groups": 0, "reg_dec_producer": 0, "reg_inc_consumer": 0}, "(128, 4608, 3584, 3584, 1, 408)": {"BLOCK_SIZE_M": 64, "BLOCK_SIZE_N": 64, "BLOCK_SIZE_K": 256, "GROUP_SIZE_M": 8, "A_load_order": 0, "waves_per_eu": 4, "matrix_instr_nonkdim": 16, "num_warps": 8, "num_ctas": 1, "num_stages": 2, "num_buffers_warp_spec": 0, "num_consumer_groups": 0, "reg_dec_producer": 0, "reg_inc_consumer": 0}, "(256, 4608, 3584, 3584, 1, 408)": {"BLOCK_SIZE_M": 64, "BLOCK_SIZE_N": 64, "BLOCK_SIZE_K": 128, "GROUP_SIZE_M": 8, "A_load_order": 0, "waves_per_eu": 2, "matrix_instr_nonkdim": 16, "num_warps": 8, "num_ctas": 1, "num_stages": 2, "num_buffers_warp_spec": 0, "num_consumer_groups": 0, "reg_dec_producer": 0, "reg_inc_consumer": 0}, "(512, 4608, 3584, 3584, 1, 408)": {"BLOCK_SIZE_M": 128, "BLOCK_SIZE_N": 32, "BLOCK_SIZE_K": 128, "GROUP_SIZE_M": 8, "A_load_order": 0, "waves_per_eu": 4, "matrix_instr_nonkdim": 16, "num_warps": 4, "num_ctas": 1, "num_stages": 2, "num_buffers_warp_spec": 0, "num_consumer_groups": 0, "reg_dec_producer": 0, "reg_inc_consumer": 0}, "(1024, 4608, 3584, 3584, 1, 408)": {"BLOCK_SIZE_M": 128, "BLOCK_SIZE_N": 128, "BLOCK_SIZE_K": 128, "GROUP_SIZE_M": 8, "A_load_order": 0, "waves_per_eu": 2, "matrix_instr_nonkdim": 16, "num_warps": 8, "num_ctas": 1, "num_stages": 2, "num_buffers_warp_spec": 0, "num_consumer_groups": 0, "reg_dec_producer": 0, "reg_inc_consumer": 0}, "(128, 3584, 3584, 3584, 1, 408)": {"BLOCK_SIZE_M": 64, "BLOCK_SIZE_N": 64, "BLOCK_SIZE_K": 256, "GROUP_SIZE_M": 8, "A_load_order": 0, "waves_per_eu": 0, "matrix_instr_nonkdim": 16, "num_warps": 8, "num_ctas": 1, "num_stages": 2, "num_buffers_warp_spec": 0, "num_consumer_groups": 0, "reg_dec_producer": 0, "reg_inc_consumer": 0}, "(256, 3584, 3584, 3584, 1, 408)": {"BLOCK_SIZE_M": 64, "BLOCK_SIZE_N": 64, "BLOCK_SIZE_K": 128, "GROUP_SIZE_M": 8, "A_load_order": 0, "waves_per_eu": 4, "matrix_instr_nonkdim": 16, "num_warps": 8, "num_ctas": 1, "num_stages": 2, "num_buffers_warp_spec": 0, "num_consumer_groups": 0, "reg_dec_producer": 0, "reg_inc_consumer": 0}, "(1024, 3584, 3584, 3584, 1, 408)": {"BLOCK_SIZE_M": 128, "BLOCK_SIZE_N": 128, "BLOCK_SIZE_K": 128, "GROUP_SIZE_M": 8, "A_load_order": 0, "waves_per_eu": 2, "matrix_instr_nonkdim": 16, "num_warps": 8, "num_ctas": 1, "num_stages": 2, "num_buffers_warp_spec": 0, "num_consumer_groups": 0, "reg_dec_producer": 0, "reg_inc_consumer": 0}, "(128, 3072, 3072, 3072, 1, 408)": {"BLOCK_SIZE_M": 64, "BLOCK_SIZE_N": 32, "BLOCK_SIZE_K": 256, "GROUP_SIZE_M": 8, "A_load_order": 0, "waves_per_eu": 2, "matrix_instr_nonkdim": 16, "num_warps": 8, "num_ctas": 1, "num_stages": 2, "num_buffers_warp_spec": 0, "num_consumer_groups": 0, "reg_dec_producer": 0, "reg_inc_consumer": 0}, "(256, 3072, 3072, 3072, 1, 408)": {"BLOCK_SIZE_M": 64, "BLOCK_SIZE_N": 64, "BLOCK_SIZE_K": 128, "GROUP_SIZE_M": 8, "A_load_order": 0, "waves_per_eu": 4, "matrix_instr_nonkdim": 16, "num_warps": 8, "num_ctas": 1, "num_stages": 2, "num_buffers_warp_spec": 0, "num_consumer_groups": 0, "reg_dec_producer": 0, "reg_inc_consumer": 0}, "(2048, 6144, 4096, 4096, 1, 408)": {"BLOCK_SIZE_M": 256, "BLOCK_SIZE_N": 128, "BLOCK_SIZE_K": 128, "GROUP_SIZE_M": 8, "A_load_order": 0, "waves_per_eu": 4, "matrix_instr_nonkdim": 16, "num_warps": 8, "num_ctas": 1, "num_stages": 1, "num_buffers_warp_spec": 0, "num_consumer_groups": 0, "reg_dec_producer": 0, "reg_inc_consumer": 0}, "(128, 4096, 14336, 14336, 1, 408)": {"BLOCK_SIZE_M": 64, "BLOCK_SIZE_N": 32, "BLOCK_SIZE_K": 256, "GROUP_SIZE_M": 8, "A_load_order": 0, "waves_per_eu": 2, "matrix_instr_nonkdim": 16, "num_warps": 8, "num_ctas": 1, "num_stages": 2, "num_buffers_warp_spec": 0, "num_consumer_groups": 0, "reg_dec_producer": 0, "reg_inc_consumer": 0}, "(256, 4096, 14336, 14336, 1, 408)": {"BLOCK_SIZE_M": 64, "BLOCK_SIZE_N": 64, "BLOCK_SIZE_K": 256, "GROUP_SIZE_M": 8, "A_load_order": 0, "waves_per_eu": 2, "matrix_instr_nonkdim": 16, "num_warps": 8, "num_ctas": 1, "num_stages": 2, "num_buffers_warp_spec": 0, "num_consumer_groups": 0, "reg_dec_producer": 0, "reg_inc_consumer": 0}, "(512, 4096, 14336, 14336, 1, 408)": {"BLOCK_SIZE_M": 64, "BLOCK_SIZE_N": 64, "BLOCK_SIZE_K": 256, "GROUP_SIZE_M": 8, "A_load_order": 0, "waves_per_eu": 0, "matrix_instr_nonkdim": 16, "num_warps": 4, "num_ctas": 1, "num_stages": 2, "num_buffers_warp_spec": 0, "num_consumer_groups": 0, "reg_dec_producer": 0, "reg_inc_consumer": 0}, "(2048, 4096, 14336, 14336, 1, 408)": {"BLOCK_SIZE_M": 128, "BLOCK_SIZE_N": 128, "BLOCK_SIZE_K": 128, "GROUP_SIZE_M": 8, "A_load_order": 0, "waves_per_eu": 2, "matrix_instr_nonkdim": 16, "num_warps": 4, "num_ctas": 1, "num_stages": 2, "num_buffers_warp_spec": 0, "num_consumer_groups": 0, "reg_dec_producer": 0, "reg_inc_consumer": 0}, "(128, 28672, 4096, 4096, 1, 408)": {"BLOCK_SIZE_M": 64, "BLOCK_SIZE_N": 64, "BLOCK_SIZE_K": 256, "GROUP_SIZE_M": 8, "A_load_order": 0, "waves_per_eu": 2, "matrix_instr_nonkdim": 16, "num_warps": 4, "num_ctas": 1, "num_stages": 1, "num_buffers_warp_spec": 0, "num_consumer_groups": 0, "reg_dec_producer": 0, "reg_inc_consumer": 0}, "(256, 28672, 4096, 4096, 1, 408)": {"BLOCK_SIZE_M": 128, "BLOCK_SIZE_N": 128, "BLOCK_SIZE_K": 128, "GROUP_SIZE_M": 8, "A_load_order": 0, "waves_per_eu": 0, "matrix_instr_nonkdim": 16, "num_warps": 8, "num_ctas": 1, "num_stages": 2, "num_buffers_warp_spec": 0, "num_consumer_groups": 0, "reg_dec_producer": 0, "reg_inc_consumer": 0}, "(512, 28672, 4096, 4096, 1, 408)": {"BLOCK_SIZE_M": 128, "BLOCK_SIZE_N": 128, "BLOCK_SIZE_K": 128, "GROUP_SIZE_M": 8, "A_load_order": 0, "waves_per_eu": 0, "matrix_instr_nonkdim": 16, "num_warps": 8, "num_ctas": 1, "num_stages": 2, "num_buffers_warp_spec": 0, "num_consumer_groups": 0, "reg_dec_producer": 0, "reg_inc_consumer": 0}, "(2048, 28672, 4096, 4096, 1, 408)": {"BLOCK_SIZE_M": 256, "BLOCK_SIZE_N": 128, "BLOCK_SIZE_K": 128, "GROUP_SIZE_M": 8, "A_load_order": 0, "waves_per_eu": 4, "matrix_instr_nonkdim": 16, "num_warps": 8, "num_ctas": 1, "num_stages": 1, "num_buffers_warp_spec": 0, "num_consumer_groups": 0, "reg_dec_producer": 0, "reg_inc_consumer": 0}, "(512, 3584, 3584, 3584, 1, 408)": {"BLOCK_SIZE_M": 128, "BLOCK_SIZE_N": 64, "BLOCK_SIZE_K": 128, "GROUP_SIZE_M": 8, "A_load_order": 0, "waves_per_eu": 4, "matrix_instr_nonkdim": 16, "num_warps": 8, "num_ctas": 1, "num_stages": 2, "num_buffers_warp_spec": 0, "num_consumer_groups": 0, "reg_dec_producer": 0, "reg_inc_consumer": 0}, "(2048, 3584, 3584, 3584, 1, 408)": {"BLOCK_SIZE_M": 128, "BLOCK_SIZE_N": 128, "BLOCK_SIZE_K": 64, "GROUP_SIZE_M": 8, "A_load_order": 0, "waves_per_eu": 2, "matrix_instr_nonkdim": 16, "num_warps": 4, "num_ctas": 1, "num_stages": 2, "num_buffers_warp_spec": 0, "num_consumer_groups": 0, "reg_dec_producer": 0, "reg_inc_consumer": 0}, "(2048, 4608, 3584, 3584, 1, 408)": {"BLOCK_SIZE_M": 128, "BLOCK_SIZE_N": 128, "BLOCK_SIZE_K": 128, "GROUP_SIZE_M": 8, "A_load_order": 0, "waves_per_eu": 2, "matrix_instr_nonkdim": 16, "num_warps": 4, "num_ctas": 1, "num_stages": 1, "num_buffers_warp_spec": 0, "num_consumer_groups": 0, "reg_dec_producer": 0, "reg_inc_consumer": 0}, "(2048, 3584, 18944, 18944, 1, 408)": {"BLOCK_SIZE_M": 128, "BLOCK_SIZE_N": 128, "BLOCK_SIZE_K": 128, "GROUP_SIZE_M": 8, "A_load_order": 0, "waves_per_eu": 2, "matrix_instr_nonkdim": 16, "num_warps": 4, "num_ctas": 1, "num_stages": 2, "num_buffers_warp_spec": 0, "num_consumer_groups": 0, "reg_dec_producer": 0, "reg_inc_consumer": 0}, "(2048, 37888, 3584, 3584, 1, 408)": {"BLOCK_SIZE_M": 256, "BLOCK_SIZE_N": 128, "BLOCK_SIZE_K": 128, "GROUP_SIZE_M": 8, "A_load_order": 0, "waves_per_eu": 4, "matrix_instr_nonkdim": 16, "num_warps": 8, "num_ctas": 1, "num_stages": 1, "num_buffers_warp_spec": 0, "num_consumer_groups": 0, "reg_dec_producer": 0, "reg_inc_consumer": 0}, "(512, 3072, 3072, 3072, 1, 408)": {"BLOCK_SIZE_M": 128, "BLOCK_SIZE_N": 64, "BLOCK_SIZE_K": 128, "GROUP_SIZE_M": 8, "A_load_order": 0, "waves_per_eu": 4, "matrix_instr_nonkdim": 16, "num_warps": 8, "num_ctas": 1, "num_stages": 2, "num_buffers_warp_spec": 0, "num_consumer_groups": 0, "reg_dec_producer": 0, "reg_inc_consumer": 0}, "(1024, 3072, 3072, 3072, 1, 408)": {"BLOCK_SIZE_M": 128, "BLOCK_SIZE_N": 128, "BLOCK_SIZE_K": 128, "GROUP_SIZE_M": 8, "A_load_order": 0, "waves_per_eu": 0, "matrix_instr_nonkdim": 16, "num_warps": 8, "num_ctas": 1, "num_stages": 2, "num_buffers_warp_spec": 0, "num_consumer_groups": 0, "reg_dec_producer": 0, "reg_inc_consumer": 0}, "(2048, 3072, 3072, 3072, 1, 408)": {"BLOCK_SIZE_M": 128, "BLOCK_SIZE_N": 128, "BLOCK_SIZE_K": 128, "GROUP_SIZE_M": 8, "A_load_order": 0, "waves_per_eu": 2, "matrix_instr_nonkdim": 16, "num_warps": 4, "num_ctas": 1, "num_stages": 1, "num_buffers_warp_spec": 0, "num_consumer_groups": 0, "reg_dec_producer": 0, "reg_inc_consumer": 0}, "(128, 5120, 3072, 3072, 1, 408)": {"BLOCK_SIZE_M": 64, "BLOCK_SIZE_N": 64, "BLOCK_SIZE_K": 256, "GROUP_SIZE_M": 8, "A_load_order": 0, "waves_per_eu": 4, "matrix_instr_nonkdim": 16, "num_warps": 8, "num_ctas": 1, "num_stages": 2, "num_buffers_warp_spec": 0, "num_consumer_groups": 0, "reg_dec_producer": 0, "reg_inc_consumer": 0}, "(256, 5120, 3072, 3072, 1, 408)": {"BLOCK_SIZE_M": 128, "BLOCK_SIZE_N": 64, "BLOCK_SIZE_K": 128, "GROUP_SIZE_M": 8, "A_load_order": 0, "waves_per_eu": 2, "matrix_instr_nonkdim": 16, "num_warps": 8, "num_ctas": 1, "num_stages": 2, "num_buffers_warp_spec": 0, "num_consumer_groups": 0, "reg_dec_producer": 0, "reg_inc_consumer": 0}, "(512, 5120, 3072, 3072, 1, 408)": {"BLOCK_SIZE_M": 128, "BLOCK_SIZE_N": 128, "BLOCK_SIZE_K": 128, "GROUP_SIZE_M": 8, "A_load_order": 0, "waves_per_eu": 2, "matrix_instr_nonkdim": 16, "num_warps": 8, "num_ctas": 1, "num_stages": 2, "num_buffers_warp_spec": 0, "num_consumer_groups": 0, "reg_dec_producer": 0, "reg_inc_consumer": 0}, "(1024, 5120, 3072, 3072, 1, 408)": {"BLOCK_SIZE_M": 128, "BLOCK_SIZE_N": 128, "BLOCK_SIZE_K": 128, "GROUP_SIZE_M": 8, "A_load_order": 0, "waves_per_eu": 2, "matrix_instr_nonkdim": 16, "num_warps": 4, "num_ctas": 1, "num_stages": 1, "num_buffers_warp_spec": 0, "num_consumer_groups": 0, "reg_dec_producer": 0, "reg_inc_consumer": 0}, "(2048, 5120, 3072, 3072, 1, 408)": {"BLOCK_SIZE_M": 128, "BLOCK_SIZE_N": 256, "BLOCK_SIZE_K": 128, "GROUP_SIZE_M": 8, "A_load_order": 0, "waves_per_eu": 2, "matrix_instr_nonkdim": 16, "num_warps": 4, "num_ctas": 1, "num_stages": 1, "num_buffers_warp_spec": 0, "num_consumer_groups": 0, "reg_dec_producer": 0, "reg_inc_consumer": 0}, "(128, 3072, 8192, 8192, 1, 408)": {"BLOCK_SIZE_M": 64, "BLOCK_SIZE_N": 32, "BLOCK_SIZE_K": 256, "GROUP_SIZE_M": 8, "A_load_order": 0, "waves_per_eu": 0, "matrix_instr_nonkdim": 16, "num_warps": 8, "num_ctas": 1, "num_stages": 2, "num_buffers_warp_spec": 0, "num_consumer_groups": 0, "reg_dec_producer": 0, "reg_inc_consumer": 0}, "(256, 3072, 8192, 8192, 1, 408)": {"BLOCK_SIZE_M": 64, "BLOCK_SIZE_N": 64, "BLOCK_SIZE_K": 256, "GROUP_SIZE_M": 8, "A_load_order": 0, "waves_per_eu": 4, "matrix_instr_nonkdim": 16, "num_warps": 8, "num_ctas": 1, "num_stages": 2, "num_buffers_warp_spec": 0, "num_consumer_groups": 0, "reg_dec_producer": 0, "reg_inc_consumer": 0}, "(512, 3072, 8192, 8192, 1, 408)": {"BLOCK_SIZE_M": 128, "BLOCK_SIZE_N": 64, "BLOCK_SIZE_K": 128, "GROUP_SIZE_M": 8, "A_load_order": 0, "waves_per_eu": 4, "matrix_instr_nonkdim": 16, "num_warps": 8, "num_ctas": 1, "num_stages": 2, "num_buffers_warp_spec": 0, "num_consumer_groups": 0, "reg_dec_producer": 0, "reg_inc_consumer": 0}, "(1024, 3072, 8192, 8192, 1, 408)": {"BLOCK_SIZE_M": 128, "BLOCK_SIZE_N": 128, "BLOCK_SIZE_K": 128, "GROUP_SIZE_M": 8, "A_load_order": 0, "waves_per_eu": 4, "matrix_instr_nonkdim": 16, "num_warps": 8, "num_ctas": 1, "num_stages": 2, "num_buffers_warp_spec": 0, "num_consumer_groups": 0, "reg_dec_producer": 0, "reg_inc_consumer": 0}, "(2048, 3072, 8192, 8192, 1, 408)": {"BLOCK_SIZE_M": 128, "BLOCK_SIZE_N": 128, "BLOCK_SIZE_K": 128, "GROUP_SIZE_M": 8, "A_load_order": 0, "waves_per_eu": 2, "matrix_instr_nonkdim": 16, "num_warps": 4, "num_ctas": 1, "num_stages": 2, "num_buffers_warp_spec": 0, "num_consumer_groups": 0, "reg_dec_producer": 0, "reg_inc_consumer": 0}, "(128, 16384, 3072, 3072, 1, 408)": {"BLOCK_SIZE_M": 64, "BLOCK_SIZE_N": 64, "BLOCK_SIZE_K": 128, "GROUP_SIZE_M": 8, "A_load_order": 0, "waves_per_eu": 0, "matrix_instr_nonkdim": 16, "num_warps": 8, "num_ctas": 1, "num_stages": 1, "num_buffers_warp_spec": 0, "num_consumer_groups": 0, "reg_dec_producer": 0, "reg_inc_consumer": 0}, "(256, 16384, 3072, 3072, 1, 408)": {"BLOCK_SIZE_M": 128, "BLOCK_SIZE_N": 128, "BLOCK_SIZE_K": 128, "GROUP_SIZE_M": 8, "A_load_order": 0, "waves_per_eu": 2, "matrix_instr_nonkdim": 16, "num_warps": 4, "num_ctas": 1, "num_stages": 2, "num_buffers_warp_spec": 0, "num_consumer_groups": 0, "reg_dec_producer": 0, "reg_inc_consumer": 0}, "(512, 16384, 3072, 3072, 1, 408)": {"BLOCK_SIZE_M": 128, "BLOCK_SIZE_N": 128, "BLOCK_SIZE_K": 128, "GROUP_SIZE_M": 8, "A_load_order": 0, "waves_per_eu": 0, "matrix_instr_nonkdim": 16, "num_warps": 4, "num_ctas": 1, "num_stages": 2, "num_buffers_warp_spec": 0, "num_consumer_groups": 0, "reg_dec_producer": 0, "reg_inc_consumer": 0}, "(1024, 16384, 3072, 3072, 1, 408)": {"BLOCK_SIZE_M": 256, "BLOCK_SIZE_N": 128, "BLOCK_SIZE_K": 128, "GROUP_SIZE_M": 8, "A_load_order": 0, "waves_per_eu": 4, "matrix_instr_nonkdim": 16, "num_warps": 8, "num_ctas": 1, "num_stages": 1, "num_buffers_warp_spec": 0, "num_consumer_groups": 0, "reg_dec_producer": 0, "reg_inc_consumer": 0}, "(2048, 16384, 3072, 3072, 1, 408)": {"BLOCK_SIZE_M": 128, "BLOCK_SIZE_N": 128, "BLOCK_SIZE_K": 128, "GROUP_SIZE_M": 8, "A_load_order": 0, "waves_per_eu": 0, "matrix_instr_nonkdim": 16, "num_warps": 8, "num_ctas": 1, "num_stages": 2, "num_buffers_warp_spec": 0, "num_consumer_groups": 0, "reg_dec_producer": 0, "reg_inc_consumer": 0}, "(128, 4096, 4096, 128, 8, 104)": {"BLOCK_SIZE_M": 64, "BLOCK_SIZE_N": 32, "BLOCK_SIZE_K": 64, "GROUP_SIZE_M": 8, "A_load_order": 0, "waves_per_eu": 0, "matrix_instr_nonkdim": 16, "num_warps": 4, "num_ctas": 1, "num_stages": 2, "num_buffers_warp_spec": 0, "num_consumer_groups": 0, "reg_dec_producer": 0, "reg_inc_consumer": 0}, "(256, 4096, 4096, 128, 8, 104)": {"BLOCK_SIZE_M": 64, "BLOCK_SIZE_N": 32, "BLOCK_SIZE_K": 128, "GROUP_SIZE_M": 8, "A_load_order": 0, "waves_per_eu": 0, "matrix_instr_nonkdim": 16, "num_warps": 4, "num_ctas": 1, "num_stages": 1, "num_buffers_warp_spec": 0, "num_consumer_groups": 0, "reg_dec_producer": 0, "reg_inc_consumer": 0}, "(512, 4096, 4096, 128, 8, 104)": {"BLOCK_SIZE_M": 128, "BLOCK_SIZE_N": 32, "BLOCK_SIZE_K": 128, "GROUP_SIZE_M": 8, "A_load_order": 0, "waves_per_eu": 2, "matrix_instr_nonkdim": 16, "num_warps": 4, "num_ctas": 1, "num_stages": 1, "num_buffers_warp_spec": 0, "num_consumer_groups": 0, "reg_dec_producer": 0, "reg_inc_consumer": 0}, "(1024, 4096, 4096, 128, 8, 104)": {"BLOCK_SIZE_M": 128, "BLOCK_SIZE_N": 64, "BLOCK_SIZE_K": 64, "GROUP_SIZE_M": 8, "A_load_order": 0, "waves_per_eu": 4, "matrix_instr_nonkdim": 16, "num_warps": 4, "num_ctas": 1, "num_stages": 1, "num_buffers_warp_spec": 0, "num_consumer_groups": 0, "reg_dec_producer": 0, "reg_inc_consumer": 0}, "(2048, 4096, 4096, 128, 8, 104)": {"BLOCK_SIZE_M": 256, "BLOCK_SIZE_N": 64, "BLOCK_SIZE_K": 64, "GROUP_SIZE_M": 8, "A_load_order": 0, "waves_per_eu": 2, "matrix_instr_nonkdim": 16, "num_warps": 4, "num_ctas": 1, "num_stages": 1, "num_buffers_warp_spec": 0, "num_consumer_groups": 0, "reg_dec_producer": 0, "reg_inc_consumer": 0}, "(128, 6144, 4096, 128, 8, 104)": {"BLOCK_SIZE_M": 64, "BLOCK_SIZE_N": 64, "BLOCK_SIZE_K": 64, "GROUP_SIZE_M": 8, "A_load_order": 0, "waves_per_eu": 0, "matrix_instr_nonkdim": 16, "num_warps": 8, "num_ctas": 1, "num_stages": 2, "num_buffers_warp_spec": 0, "num_consumer_groups": 0, "reg_dec_producer": 0, "reg_inc_consumer": 0}, "(512, 6144, 4096, 128, 8, 104)": {"BLOCK_SIZE_M": 128, "BLOCK_SIZE_N": 64, "BLOCK_SIZE_K": 64, "GROUP_SIZE_M": 8, "A_load_order": 0, "waves_per_eu": 4, "matrix_instr_nonkdim": 16, "num_warps": 4, "num_ctas": 1, "num_stages": 1, "num_buffers_warp_spec": 0, "num_consumer_groups": 0, "reg_dec_producer": 0, "reg_inc_consumer": 0}, "(1024, 6144, 4096, 128, 8, 104)": {"BLOCK_SIZE_M": 256, "BLOCK_SIZE_N": 64, "BLOCK_SIZE_K": 64, "GROUP_SIZE_M": 8, "A_load_order": 0, "waves_per_eu": 2, "matrix_instr_nonkdim": 16, "num_warps": 4, "num_ctas": 1, "num_stages": 1, "num_buffers_warp_spec": 0, "num_consumer_groups": 0, "reg_dec_producer": 0, "reg_inc_consumer": 0}, "(128, 28672, 4096, 128, 8, 104)": {"BLOCK_SIZE_M": 128, "BLOCK_SIZE_N": 128, "BLOCK_SIZE_K": 32, "GROUP_SIZE_M": 8, "A_load_order": 0, "waves_per_eu": 0, "matrix_instr_nonkdim": 16, "num_warps": 8, "num_ctas": 1, "num_stages": 2, "num_buffers_warp_spec": 0, "num_consumer_groups": 0, "reg_dec_producer": 0, "reg_inc_consumer": 0}, "(256, 28672, 4096, 128, 8, 104)": {"BLOCK_SIZE_M": 256, "BLOCK_SIZE_N": 64, "BLOCK_SIZE_K": 64, "GROUP_SIZE_M": 8, "A_load_order": 0, "waves_per_eu": 2, "matrix_instr_nonkdim": 16, "num_warps": 4, "num_ctas": 1, "num_stages": 1, "num_buffers_warp_spec": 0, "num_consumer_groups": 0, "reg_dec_producer": 0, "reg_inc_consumer": 0}, "(512, 28672, 4096, 128, 8, 104)": {"BLOCK_SIZE_M": 256, "BLOCK_SIZE_N": 128, "BLOCK_SIZE_K": 32, "GROUP_SIZE_M": 8, "A_load_order": 0, "waves_per_eu": 2, "matrix_instr_nonkdim": 16, "num_warps": 4, "num_ctas": 1, "num_stages": 1, "num_buffers_warp_spec": 0, "num_consumer_groups": 0, "reg_dec_producer": 0, "reg_inc_consumer": 0}, "(256, 6144, 4096, 128, 8, 104)": {"BLOCK_SIZE_M": 64, "BLOCK_SIZE_N": 32, "BLOCK_SIZE_K": 128, "GROUP_SIZE_M": 8, "A_load_order": 0, "waves_per_eu": 2, "matrix_instr_nonkdim": 16, "num_warps": 4, "num_ctas": 1, "num_stages": 1, "num_buffers_warp_spec": 0, "num_consumer_groups": 0, "reg_dec_producer": 0, "reg_inc_consumer": 0}, "(2048, 6144, 4096, 128, 8, 104)": {"BLOCK_SIZE_M": 256, "BLOCK_SIZE_N": 128, "BLOCK_SIZE_K": 32, "GROUP_SIZE_M": 8, "A_load_order": 0, "waves_per_eu": 2, "matrix_instr_nonkdim": 16, "num_warps": 4, "num_ctas": 1, "num_stages": 1, "num_buffers_warp_spec": 0, "num_consumer_groups": 0, "reg_dec_producer": 0, "reg_inc_consumer": 0}, "(128, 4096, 14336, 128, 8, 104)": {"BLOCK_SIZE_M": 64, "BLOCK_SIZE_N": 32, "BLOCK_SIZE_K": 64, "GROUP_SIZE_M": 8, "A_load_order": 0, "waves_per_eu": 2, "matrix_instr_nonkdim": 16, "num_warps": 4, "num_ctas": 1, "num_stages": 2, "num_buffers_warp_spec": 0, "num_consumer_groups": 0, "reg_dec_producer": 0, "reg_inc_consumer": 0}, "(256, 4096, 14336, 128, 8, 104)": {"BLOCK_SIZE_M": 128, "BLOCK_SIZE_N": 32, "BLOCK_SIZE_K": 64, "GROUP_SIZE_M": 8, "A_load_order": 0, "waves_per_eu": 0, "matrix_instr_nonkdim": 16, "num_warps": 8, "num_ctas": 1, "num_stages": 2, "num_buffers_warp_spec": 0, "num_consumer_groups": 0, "reg_dec_producer": 0, "reg_inc_consumer": 0}, "(512, 4096, 14336, 128, 8, 104)": {"BLOCK_SIZE_M": 128, "BLOCK_SIZE_N": 32, "BLOCK_SIZE_K": 128, "GROUP_SIZE_M": 8, "A_load_order": 0, "waves_per_eu": 4, "matrix_instr_nonkdim": 16, "num_warps": 4, "num_ctas": 1, "num_stages": 1, "num_buffers_warp_spec": 0, "num_consumer_groups": 0, "reg_dec_producer": 0, "reg_inc_consumer": 0}, "(1024, 4096, 14336, 128, 8, 104)": {"BLOCK_SIZE_M": 128, "BLOCK_SIZE_N": 64, "BLOCK_SIZE_K": 64, "GROUP_SIZE_M": 8, "A_load_order": 0, "waves_per_eu": 4, "matrix_instr_nonkdim": 16, "num_warps": 4, "num_ctas": 1, "num_stages": 1, "num_buffers_warp_spec": 0, "num_consumer_groups": 0, "reg_dec_producer": 0, "reg_inc_consumer": 0}, "(2048, 4096, 14336, 128, 8, 104)": {"BLOCK_SIZE_M": 256, "BLOCK_SIZE_N": 64, "BLOCK_SIZE_K": 64, "GROUP_SIZE_M": 8, "A_load_order": 0, "waves_per_eu": 0, "matrix_instr_nonkdim": 16, "num_warps": 8, "num_ctas": 1, "num_stages": 1, "num_buffers_warp_spec": 0, "num_consumer_groups": 0, "reg_dec_producer": 0, "reg_inc_consumer": 0}, "(1024, 28672, 4096, 128, 8, 104)": {"BLOCK_SIZE_M": 256, "BLOCK_SIZE_N": 128, "BLOCK_SIZE_K": 32, "GROUP_SIZE_M": 8, "A_load_order": 0, "waves_per_eu": 2, "matrix_instr_nonkdim": 16, "num_warps": 8, "num_ctas": 1, "num_stages": 1, "num_buffers_warp_spec": 0, "num_consumer_groups": 0, "reg_dec_producer": 0, "reg_inc_consumer": 0}, "(2048, 28672, 4096, 128, 8, 104)": {"BLOCK_SIZE_M": 256, "BLOCK_SIZE_N": 128, "BLOCK_SIZE_K": 32, "GROUP_SIZE_M": 8, "A_load_order": 0, "waves_per_eu": 2, "matrix_instr_nonkdim": 16, "num_warps": 4, "num_ctas": 1, "num_stages": 1, "num_buffers_warp_spec": 0, "num_consumer_groups": 0, "reg_dec_producer": 0, "reg_inc_consumer": 0}, "(128, 3584, 3584, 128, 8, 104)": {"BLOCK_SIZE_M": 64, "BLOCK_SIZE_N": 32, "BLOCK_SIZE_K": 64, "GROUP_SIZE_M": 8, "A_load_order": 0, "waves_per_eu": 0, "matrix_instr_nonkdim": 16, "num_warps": 4, "num_ctas": 1, "num_stages": 2, "num_buffers_warp_spec": 0, "num_consumer_groups": 0, "reg_dec_producer": 0, "reg_inc_consumer": 0}, "(256, 3584, 3584, 128, 8, 104)": {"BLOCK_SIZE_M": 128, "BLOCK_SIZE_N": 32, "BLOCK_SIZE_K": 64, "GROUP_SIZE_M": 8, "A_load_order": 0, "waves_per_eu": 0, "matrix_instr_nonkdim": 16, "num_warps": 8, "num_ctas": 1, "num_stages": 2, "num_buffers_warp_spec": 0, "num_consumer_groups": 0, "reg_dec_producer": 0, "reg_inc_consumer": 0}, "(512, 3584, 3584, 128, 8, 104)": {"BLOCK_SIZE_M": 64, "BLOCK_SIZE_N": 32, "BLOCK_SIZE_K": 128, "GROUP_SIZE_M": 8, "A_load_order": 0, "waves_per_eu": 4, "matrix_instr_nonkdim": 16, "num_warps": 4, "num_ctas": 1, "num_stages": 1, "num_buffers_warp_spec": 0, "num_consumer_groups": 0, "reg_dec_producer": 0, "reg_inc_consumer": 0}, "(1024, 3584, 3584, 128, 8, 104)": {"BLOCK_SIZE_M": 128, "BLOCK_SIZE_N": 64, "BLOCK_SIZE_K": 64, "GROUP_SIZE_M": 8, "A_load_order": 0, "waves_per_eu": 4, "matrix_instr_nonkdim": 16, "num_warps": 4, "num_ctas": 1, "num_stages": 1, "num_buffers_warp_spec": 0, "num_consumer_groups": 0, "reg_dec_producer": 0, "reg_inc_consumer": 0}, "(2048, 3584, 3584, 128, 8, 104)": {"BLOCK_SIZE_M": 128, "BLOCK_SIZE_N": 64, "BLOCK_SIZE_K": 64, "GROUP_SIZE_M": 8, "A_load_order": 0, "waves_per_eu": 4, "matrix_instr_nonkdim": 16, "num_warps": 4, "num_ctas": 1, "num_stages": 1, "num_buffers_warp_spec": 0, "num_consumer_groups": 0, "reg_dec_producer": 0, "reg_inc_consumer": 0}, "(128, 4608, 3584, 128, 8, 104)": {"BLOCK_SIZE_M": 64, "BLOCK_SIZE_N": 32, "BLOCK_SIZE_K": 64, "GROUP_SIZE_M": 8, "A_load_order": 0, "waves_per_eu": 0, "matrix_instr_nonkdim": 16, "num_warps": 4, "num_ctas": 1, "num_stages": 2, "num_buffers_warp_spec": 0, "num_consumer_groups": 0, "reg_dec_producer": 0, "reg_inc_consumer": 0}, "(256, 4608, 3584, 128, 8, 104)": {"BLOCK_SIZE_M": 128, "BLOCK_SIZE_N": 32, "BLOCK_SIZE_K": 64, "GROUP_SIZE_M": 8, "A_load_order": 0, "waves_per_eu": 2, "matrix_instr_nonkdim": 16, "num_warps": 8, "num_ctas": 1, "num_stages": 2, "num_buffers_warp_spec": 0, "num_consumer_groups": 0, "reg_dec_producer": 0, "reg_inc_consumer": 0}, "(512, 4608, 3584, 128, 8, 104)": {"BLOCK_SIZE_M": 128, "BLOCK_SIZE_N": 32, "BLOCK_SIZE_K": 64, "GROUP_SIZE_M": 8, "A_load_order": 0, "waves_per_eu": 4, "matrix_instr_nonkdim": 16, "num_warps": 4, "num_ctas": 1, "num_stages": 2, "num_buffers_warp_spec": 0, "num_consumer_groups": 0, "reg_dec_producer": 0, "reg_inc_consumer": 0}, "(1024, 4608, 3584, 128, 8, 104)": {"BLOCK_SIZE_M": 128, "BLOCK_SIZE_N": 64, "BLOCK_SIZE_K": 64, "GROUP_SIZE_M": 8, "A_load_order": 0, "waves_per_eu": 4, "matrix_instr_nonkdim": 16, "num_warps": 4, "num_ctas": 1, "num_stages": 1, "num_buffers_warp_spec": 0, "num_consumer_groups": 0, "reg_dec_producer": 0, "reg_inc_consumer": 0}, "(2048, 4608, 3584, 128, 8, 104)": {"BLOCK_SIZE_M": 256, "BLOCK_SIZE_N": 64, "BLOCK_SIZE_K": 64, "GROUP_SIZE_M": 8, "A_load_order": 0, "waves_per_eu": 2, "matrix_instr_nonkdim": 16, "num_warps": 4, "num_ctas": 1, "num_stages": 1, "num_buffers_warp_spec": 0, "num_consumer_groups": 0, "reg_dec_producer": 0, "reg_inc_consumer": 0}, "(128, 3584, 18944, 128, 8, 104)": {"BLOCK_SIZE_M": 64, "BLOCK_SIZE_N": 32, "BLOCK_SIZE_K": 64, "GROUP_SIZE_M": 8, "A_load_order": 0, "waves_per_eu": 0, "matrix_instr_nonkdim": 16, "num_warps": 4, "num_ctas": 1, "num_stages": 2, "num_buffers_warp_spec": 0, "num_consumer_groups": 0, "reg_dec_producer": 0, "reg_inc_consumer": 0}, "(256, 3584, 18944, 128, 8, 104)": {"BLOCK_SIZE_M": 128, "BLOCK_SIZE_N": 32, "BLOCK_SIZE_K": 64, "GROUP_SIZE_M": 8, "A_load_order": 0, "waves_per_eu": 0, "matrix_instr_nonkdim": 16, "num_warps": 8, "num_ctas": 1, "num_stages": 2, "num_buffers_warp_spec": 0, "num_consumer_groups": 0, "reg_dec_producer": 0, "reg_inc_consumer": 0}, "(512, 3584, 18944, 128, 8, 104)": {"BLOCK_SIZE_M": 64, "BLOCK_SIZE_N": 32, "BLOCK_SIZE_K": 128, "GROUP_SIZE_M": 8, "A_load_order": 0, "waves_per_eu": 4, "matrix_instr_nonkdim": 16, "num_warps": 4, "num_ctas": 1, "num_stages": 1, "num_buffers_warp_spec": 0, "num_consumer_groups": 0, "reg_dec_producer": 0, "reg_inc_consumer": 0}, "(1024, 3584, 18944, 128, 8, 104)": {"BLOCK_SIZE_M": 128, "BLOCK_SIZE_N": 64, "BLOCK_SIZE_K": 64, "GROUP_SIZE_M": 8, "A_load_order": 0, "waves_per_eu": 4, "matrix_instr_nonkdim": 16, "num_warps": 4, "num_ctas": 1, "num_stages": 1, "num_buffers_warp_spec": 0, "num_consumer_groups": 0, "reg_dec_producer": 0, "reg_inc_consumer": 0}, "(2048, 3584, 18944, 128, 8, 104)": {"BLOCK_SIZE_M": 128, "BLOCK_SIZE_N": 64, "BLOCK_SIZE_K": 64, "GROUP_SIZE_M": 8, "A_load_order": 0, "waves_per_eu": 4, "matrix_instr_nonkdim": 16, "num_warps": 4, "num_ctas": 1, "num_stages": 1, "num_buffers_warp_spec": 0, "num_consumer_groups": 0, "reg_dec_producer": 0, "reg_inc_consumer": 0}, "(128, 37888, 3584, 128, 8, 104)": {"BLOCK_SIZE_M": 128, "BLOCK_SIZE_N": 128, "BLOCK_SIZE_K": 32, "GROUP_SIZE_M": 8, "A_load_order": 0, "waves_per_eu": 4, "matrix_instr_nonkdim": 16, "num_warps": 8, "num_ctas": 1, "num_stages": 2, "num_buffers_warp_spec": 0, "num_consumer_groups": 0, "reg_dec_producer": 0, "reg_inc_consumer": 0}, "(256, 37888, 3584, 128, 8, 104)": {"BLOCK_SIZE_M": 256, "BLOCK_SIZE_N": 64, "BLOCK_SIZE_K": 64, "GROUP_SIZE_M": 8, "A_load_order": 0, "waves_per_eu": 2, "matrix_instr_nonkdim": 16, "num_warps": 4, "num_ctas": 1, "num_stages": 1, "num_buffers_warp_spec": 0, "num_consumer_groups": 0, "reg_dec_producer": 0, "reg_inc_consumer": 0}, "(512, 37888, 3584, 128, 8, 104)": {"BLOCK_SIZE_M": 256, "BLOCK_SIZE_N": 128, "BLOCK_SIZE_K": 32, "GROUP_SIZE_M": 8, "A_load_order": 0, "waves_per_eu": 2, "matrix_instr_nonkdim": 16, "num_warps": 4, "num_ctas": 1, "num_stages": 1, "num_buffers_warp_spec": 0, "num_consumer_groups": 0, "reg_dec_producer": 0, "reg_inc_consumer": 0}, "(1024, 37888, 3584, 128, 8, 104)": {"BLOCK_SIZE_M": 256, "BLOCK_SIZE_N": 128, "BLOCK_SIZE_K": 32, "GROUP_SIZE_M": 8, "A_load_order": 0, "waves_per_eu": 2, "matrix_instr_nonkdim": 16, "num_warps": 4, "num_ctas": 1, "num_stages": 1, "num_buffers_warp_spec": 0, "num_consumer_groups": 0, "reg_dec_producer": 0, "reg_inc_consumer": 0}, "(2048, 37888, 3584, 128, 8, 104)": {"BLOCK_SIZE_M": 256, "BLOCK_SIZE_N": 128, "BLOCK_SIZE_K": 32, "GROUP_SIZE_M": 8, "A_load_order": 0, "waves_per_eu": 2, "matrix_instr_nonkdim": 16, "num_warps": 4, "num_ctas": 1, "num_stages": 1, "num_buffers_warp_spec": 0, "num_consumer_groups": 0, "reg_dec_producer": 0, "reg_inc_consumer": 0}, "(128, 3072, 3072, 128, 8, 104)": {"BLOCK_SIZE_M": 64, "BLOCK_SIZE_N": 32, "BLOCK_SIZE_K": 64, "GROUP_SIZE_M": 8, "A_load_order": 0, "waves_per_eu": 0, "matrix_instr_nonkdim": 16, "num_warps": 8, "num_ctas": 1, "num_stages": 2, "num_buffers_warp_spec": 0, "num_consumer_groups": 0, "reg_dec_producer": 0, "reg_inc_consumer": 0}, "(256, 3072, 3072, 128, 8, 104)": {"BLOCK_SIZE_M": 64, "BLOCK_SIZE_N": 64, "BLOCK_SIZE_K": 64, "GROUP_SIZE_M": 8, "A_load_order": 0, "waves_per_eu": 0, "matrix_instr_nonkdim": 16, "num_warps": 8, "num_ctas": 1, "num_stages": 2, "num_buffers_warp_spec": 0, "num_consumer_groups": 0, "reg_dec_producer": 0, "reg_inc_consumer": 0}, "(512, 3072, 3072, 128, 8, 104)": {"BLOCK_SIZE_M": 64, "BLOCK_SIZE_N": 32, "BLOCK_SIZE_K": 64, "GROUP_SIZE_M": 8, "A_load_order": 0, "waves_per_eu": 4, "matrix_instr_nonkdim": 16, "num_warps": 4, "num_ctas": 1, "num_stages": 1, "num_buffers_warp_spec": 0, "num_consumer_groups": 0, "reg_dec_producer": 0, "reg_inc_consumer": 0}, "(1024, 3072, 3072, 128, 8, 104)": {"BLOCK_SIZE_M": 128, "BLOCK_SIZE_N": 64, "BLOCK_SIZE_K": 64, "GROUP_SIZE_M": 8, "A_load_order": 0, "waves_per_eu": 4, "matrix_instr_nonkdim": 16, "num_warps": 4, "num_ctas": 1, "num_stages": 1, "num_buffers_warp_spec": 0, "num_consumer_groups": 0, "reg_dec_producer": 0, "reg_inc_consumer": 0}, "(2048, 3072, 3072, 128, 8, 104)": {"BLOCK_SIZE_M": 128, "BLOCK_SIZE_N": 64, "BLOCK_SIZE_K": 64, "GROUP_SIZE_M": 8, "A_load_order": 0, "waves_per_eu": 2, "matrix_instr_nonkdim": 16, "num_warps": 4, "num_ctas": 1, "num_stages": 1, "num_buffers_warp_spec": 0, "num_consumer_groups": 0, "reg_dec_producer": 0, "reg_inc_consumer": 0}, "(128, 5120, 3072, 128, 8, 104)": {"BLOCK_SIZE_M": 64, "BLOCK_SIZE_N": 64, "BLOCK_SIZE_K": 64, "GROUP_SIZE_M": 8, "A_load_order": 0, "waves_per_eu": 0, "matrix_instr_nonkdim": 16, "num_warps": 8, "num_ctas": 1, "num_stages": 2, "num_buffers_warp_spec": 0, "num_consumer_groups": 0, "reg_dec_producer": 0, "reg_inc_consumer": 0}, "(256, 5120, 3072, 128, 8, 104)": {"BLOCK_SIZE_M": 64, "BLOCK_SIZE_N": 32, "BLOCK_SIZE_K": 64, "GROUP_SIZE_M": 8, "A_load_order": 0, "waves_per_eu": 2, "matrix_instr_nonkdim": 16, "num_warps": 4, "num_ctas": 1, "num_stages": 1, "num_buffers_warp_spec": 0, "num_consumer_groups": 0, "reg_dec_producer": 0, "reg_inc_consumer": 0}, "(512, 5120, 3072, 128, 8, 104)": {"BLOCK_SIZE_M": 128, "BLOCK_SIZE_N": 64, "BLOCK_SIZE_K": 64, "GROUP_SIZE_M": 8, "A_load_order": 0, "waves_per_eu": 4, "matrix_instr_nonkdim": 16, "num_warps": 4, "num_ctas": 1, "num_stages": 1, "num_buffers_warp_spec": 0, "num_consumer_groups": 0, "reg_dec_producer": 0, "reg_inc_consumer": 0}, "(1024, 5120, 3072, 128, 8, 104)": {"BLOCK_SIZE_M": 256, "BLOCK_SIZE_N": 64, "BLOCK_SIZE_K": 64, "GROUP_SIZE_M": 8, "A_load_order": 0, "waves_per_eu": 2, "matrix_instr_nonkdim": 16, "num_warps": 4, "num_ctas": 1, "num_stages": 1, "num_buffers_warp_spec": 0, "num_consumer_groups": 0, "reg_dec_producer": 0, "reg_inc_consumer": 0}, "(2048, 5120, 3072, 128, 8, 104)": {"BLOCK_SIZE_M": 256, "BLOCK_SIZE_N": 128, "BLOCK_SIZE_K": 32, "GROUP_SIZE_M": 8, "A_load_order": 0, "waves_per_eu": 2, "matrix_instr_nonkdim": 16, "num_warps": 4, "num_ctas": 1, "num_stages": 1, "num_buffers_warp_spec": 0, "num_consumer_groups": 0, "reg_dec_producer": 0, "reg_inc_consumer": 0}, "(128, 3072, 8192, 128, 8, 104)": {"BLOCK_SIZE_M": 64, "BLOCK_SIZE_N": 32, "BLOCK_SIZE_K": 64, "GROUP_SIZE_M": 8, "A_load_order": 0, "waves_per_eu": 0, "matrix_instr_nonkdim": 16, "num_warps": 4, "num_ctas": 1, "num_stages": 2, "num_buffers_warp_spec": 0, "num_consumer_groups": 0, "reg_dec_producer": 0, "reg_inc_consumer": 0}, "(256, 3072, 8192, 128, 8, 104)": {"BLOCK_SIZE_M": 128, "BLOCK_SIZE_N": 32, "BLOCK_SIZE_K": 64, "GROUP_SIZE_M": 8, "A_load_order": 0, "waves_per_eu": 0, "matrix_instr_nonkdim": 16, "num_warps": 8, "num_ctas": 1, "num_stages": 2, "num_buffers_warp_spec": 0, "num_consumer_groups": 0, "reg_dec_producer": 0, "reg_inc_consumer": 0}, "(512, 3072, 8192, 128, 8, 104)": {"BLOCK_SIZE_M": 64, "BLOCK_SIZE_N": 32, "BLOCK_SIZE_K": 128, "GROUP_SIZE_M": 8, "A_load_order": 0, "waves_per_eu": 4, "matrix_instr_nonkdim": 16, "num_warps": 4, "num_ctas": 1, "num_stages": 1, "num_buffers_warp_spec": 0, "num_consumer_groups": 0, "reg_dec_producer": 0, "reg_inc_consumer": 0}, "(1024, 3072, 8192, 128, 8, 104)": {"BLOCK_SIZE_M": 128, "BLOCK_SIZE_N": 64, "BLOCK_SIZE_K": 64, "GROUP_SIZE_M": 8, "A_load_order": 0, "waves_per_eu": 4, "matrix_instr_nonkdim": 16, "num_warps": 4, "num_ctas": 1, "num_stages": 1, "num_buffers_warp_spec": 0, "num_consumer_groups": 0, "reg_dec_producer": 0, "reg_inc_consumer": 0}, "(2048, 3072, 8192, 128, 8, 104)": {"BLOCK_SIZE_M": 128, "BLOCK_SIZE_N": 64, "BLOCK_SIZE_K": 64, "GROUP_SIZE_M": 8, "A_load_order": 0, "waves_per_eu": 4, "matrix_instr_nonkdim": 16, "num_warps": 4, "num_ctas": 1, "num_stages": 1, "num_buffers_warp_spec": 0, "num_consumer_groups": 0, "reg_dec_producer": 0, "reg_inc_consumer": 0}, "(128, 16384, 3072, 128, 8, 104)": {"BLOCK_SIZE_M": 128, "BLOCK_SIZE_N": 32, "BLOCK_SIZE_K": 64, "GROUP_SIZE_M": 8, "A_load_order": 0, "waves_per_eu": 4, "matrix_instr_nonkdim": 16, "num_warps": 4, "num_ctas": 1, "num_stages": 2, "num_buffers_warp_spec": 0, "num_consumer_groups": 0, "reg_dec_producer": 0, "reg_inc_consumer": 0}, "(256, 16384, 3072, 128, 8, 104)": {"BLOCK_SIZE_M": 128, "BLOCK_SIZE_N": 64, "BLOCK_SIZE_K": 64, "GROUP_SIZE_M": 8, "A_load_order": 0, "waves_per_eu": 4, "matrix_instr_nonkdim": 16, "num_warps": 4, "num_ctas": 1, "num_stages": 1, "num_buffers_warp_spec": 0, "num_consumer_groups": 0, "reg_dec_producer": 0, "reg_inc_consumer": 0}, "(512, 16384, 3072, 128, 8, 104)": {"BLOCK_SIZE_M": 256, "BLOCK_SIZE_N": 64, "BLOCK_SIZE_K": 64, "GROUP_SIZE_M": 8, "A_load_order": 0, "waves_per_eu": 2, "matrix_instr_nonkdim": 16, "num_warps": 4, "num_ctas": 1, "num_stages": 1, "num_buffers_warp_spec": 0, "num_consumer_groups": 0, "reg_dec_producer": 0, "reg_inc_consumer": 0}, "(1024, 16384, 3072, 128, 8, 104)": {"BLOCK_SIZE_M": 256, "BLOCK_SIZE_N": 128, "BLOCK_SIZE_K": 32, "GROUP_SIZE_M": 8, "A_load_order": 0, "waves_per_eu": 2, "matrix_instr_nonkdim": 16, "num_warps": 4, "num_ctas": 1, "num_stages": 1, "num_buffers_warp_spec": 0, "num_consumer_groups": 0, "reg_dec_producer": 0, "reg_inc_consumer": 0}, "(2048, 16384, 3072, 128, 8, 104)": {"BLOCK_SIZE_M": 256, "BLOCK_SIZE_N": 128, "BLOCK_SIZE_K": 32, "GROUP_SIZE_M": 8, "A_load_order": 0, "waves_per_eu": 2, "matrix_instr_nonkdim": 16, "num_warps": 4, "num_ctas": 1, "num_stages": 1, "num_buffers_warp_spec": 0, "num_consumer_groups": 0, "reg_dec_producer": 0, "reg_inc_consumer": 0}, "(128, 4096, 4096, 64, 8, 104)": {"BLOCK_SIZE_M": 64, "BLOCK_SIZE_N": 32, "BLOCK_SIZE_K": 64, "GROUP_SIZE_M": 8, "A_load_order": 0, "waves_per_eu": 0, "matrix_instr_nonkdim": 16, "num_warps": 4, "num_ctas": 1, "num_stages": 2, "num_buffers_warp_spec": 0, "num_consumer_groups": 0, "reg_dec_producer": 0, "reg_inc_consumer": 0}, "(256, 4096, 4096, 64, 8, 104)": {"BLOCK_SIZE_M": 64, "BLOCK_SIZE_N": 64, "BLOCK_SIZE_K": 64, "GROUP_SIZE_M": 8, "A_load_order": 0, "waves_per_eu": 2, "matrix_instr_nonkdim": 16, "num_warps": 8, "num_ctas": 1, "num_stages": 2, "num_buffers_warp_spec": 0, "num_consumer_groups": 0, "reg_dec_producer": 0, "reg_inc_consumer": 0}, "(512, 4096, 4096, 64, 8, 104)": {"BLOCK_SIZE_M": 128, "BLOCK_SIZE_N": 32, "BLOCK_SIZE_K": 64, "GROUP_SIZE_M": 8, "A_load_order": 0, "waves_per_eu": 0, "matrix_instr_nonkdim": 16, "num_warps": 8, "num_ctas": 1, "num_stages": 1, "num_buffers_warp_spec": 0, "num_consumer_groups": 0, "reg_dec_producer": 0, "reg_inc_consumer": 0}, "(1024, 4096, 4096, 64, 8, 104)": {"BLOCK_SIZE_M": 128, "BLOCK_SIZE_N": 64, "BLOCK_SIZE_K": 64, "GROUP_SIZE_M": 8, "A_load_order": 0, "waves_per_eu": 4, "matrix_instr_nonkdim": 16, "num_warps": 4, "num_ctas": 1, "num_stages": 1, "num_buffers_warp_spec": 0, "num_consumer_groups": 0, "reg_dec_producer": 0, "reg_inc_consumer": 0}, "(2048, 4096, 4096, 64, 8, 104)": {"BLOCK_SIZE_M": 256, "BLOCK_SIZE_N": 64, "BLOCK_SIZE_K": 64, "GROUP_SIZE_M": 8, "A_load_order": 0, "waves_per_eu": 2, "matrix_instr_nonkdim": 16, "num_warps": 4, "num_ctas": 1, "num_stages": 1, "num_buffers_warp_spec": 0, "num_consumer_groups": 0, "reg_dec_producer": 0, "reg_inc_consumer": 0}, "(128, 6144, 4096, 64, 8, 104)": {"BLOCK_SIZE_M": 64, "BLOCK_SIZE_N": 64, "BLOCK_SIZE_K": 64, "GROUP_SIZE_M": 8, "A_load_order": 0, "waves_per_eu": 0, "matrix_instr_nonkdim": 16, "num_warps": 8, "num_ctas": 1, "num_stages": 2, "num_buffers_warp_spec": 0, "num_consumer_groups": 0, "reg_dec_producer": 0, "reg_inc_consumer": 0}, "(256, 6144, 4096, 64, 8, 104)": {"BLOCK_SIZE_M": 64, "BLOCK_SIZE_N": 32, "BLOCK_SIZE_K": 64, "GROUP_SIZE_M": 8, "A_load_order": 0, "waves_per_eu": 4, "matrix_instr_nonkdim": 16, "num_warps": 4, "num_ctas": 1, "num_stages": 1, "num_buffers_warp_spec": 0, "num_consumer_groups": 0, "reg_dec_producer": 0, "reg_inc_consumer": 0}, "(512, 6144, 4096, 64, 8, 104)": {"BLOCK_SIZE_M": 128, "BLOCK_SIZE_N": 64, "BLOCK_SIZE_K": 64, "GROUP_SIZE_M": 8, "A_load_order": 0, "waves_per_eu": 4, "matrix_instr_nonkdim": 16, "num_warps": 4, "num_ctas": 1, "num_stages": 1, "num_buffers_warp_spec": 0, "num_consumer_groups": 0, "reg_dec_producer": 0, "reg_inc_consumer": 0}, "(1024, 6144, 4096, 64, 8, 104)": {"BLOCK_SIZE_M": 128, "BLOCK_SIZE_N": 64, "BLOCK_SIZE_K": 64, "GROUP_SIZE_M": 8, "A_load_order": 0, "waves_per_eu": 4, "matrix_instr_nonkdim": 16, "num_warps": 4, "num_ctas": 1, "num_stages": 1, "num_buffers_warp_spec": 0, "num_consumer_groups": 0, "reg_dec_producer": 0, "reg_inc_consumer": 0}, "(2048, 6144, 4096, 64, 8, 104)": {"BLOCK_SIZE_M": 256, "BLOCK_SIZE_N": 128, "BLOCK_SIZE_K": 32, "GROUP_SIZE_M": 8, "A_load_order": 0, "waves_per_eu": 2, "matrix_instr_nonkdim": 16, "num_warps": 4, "num_ctas": 1, "num_stages": 1, "num_buffers_warp_spec": 0, "num_consumer_groups": 0, "reg_dec_producer": 0, "reg_inc_consumer": 0}, "(128, 4096, 14336, 64, 8, 104)": {"BLOCK_SIZE_M": 64, "BLOCK_SIZE_N": 32, "BLOCK_SIZE_K": 64, "GROUP_SIZE_M": 8, "A_load_order": 0, "waves_per_eu": 4, "matrix_instr_nonkdim": 16, "num_warps": 4, "num_ctas": 1, "num_stages": 2, "num_buffers_warp_spec": 0, "num_consumer_groups": 0, "reg_dec_producer": 0, "reg_inc_consumer": 0}, "(256, 4096, 14336, 64, 8, 104)": {"BLOCK_SIZE_M": 64, "BLOCK_SIZE_N": 64, "BLOCK_SIZE_K": 64, "GROUP_SIZE_M": 8, "A_load_order": 0, "waves_per_eu": 4, "matrix_instr_nonkdim": 16, "num_warps": 8, "num_ctas": 1, "num_stages": 2, "num_buffers_warp_spec": 0, "num_consumer_groups": 0, "reg_dec_producer": 0, "reg_inc_consumer": 0}, "(512, 4096, 14336, 64, 8, 104)": {"BLOCK_SIZE_M": 128, "BLOCK_SIZE_N": 32, "BLOCK_SIZE_K": 64, "GROUP_SIZE_M": 8, "A_load_order": 0, "waves_per_eu": 4, "matrix_instr_nonkdim": 16, "num_warps": 4, "num_ctas": 1, "num_stages": 1, "num_buffers_warp_spec": 0, "num_consumer_groups": 0, "reg_dec_producer": 0, "reg_inc_consumer": 0}, "(1024, 4096, 14336, 64, 8, 104)": {"BLOCK_SIZE_M": 128, "BLOCK_SIZE_N": 64, "BLOCK_SIZE_K": 64, "GROUP_SIZE_M": 8, "A_load_order": 0, "waves_per_eu": 4, "matrix_instr_nonkdim": 16, "num_warps": 4, "num_ctas": 1, "num_stages": 1, "num_buffers_warp_spec": 0, "num_consumer_groups": 0, "reg_dec_producer": 0, "reg_inc_consumer": 0}, "(2048, 4096, 14336, 64, 8, 104)": {"BLOCK_SIZE_M": 256, "BLOCK_SIZE_N": 64, "BLOCK_SIZE_K": 64, "GROUP_SIZE_M": 8, "A_load_order": 0, "waves_per_eu": 4, "matrix_instr_nonkdim": 16, "num_warps": 8, "num_ctas": 1, "num_stages": 1, "num_buffers_warp_spec": 0, "num_consumer_groups": 0, "reg_dec_producer": 0, "reg_inc_consumer": 0}, "(128, 28672, 4096, 64, 8, 104)": {"BLOCK_SIZE_M": 128, "BLOCK_SIZE_N": 64, "BLOCK_SIZE_K": 64, "GROUP_SIZE_M": 8, "A_load_order": 0, "waves_per_eu": 4, "matrix_instr_nonkdim": 16, "num_warps": 4, "num_ctas": 1, "num_stages": 1, "num_buffers_warp_spec": 0, "num_consumer_groups": 0, "reg_dec_producer": 0, "reg_inc_consumer": 0}, "(256, 28672, 4096, 64, 8, 104)": {"BLOCK_SIZE_M": 256, "BLOCK_SIZE_N": 64, "BLOCK_SIZE_K": 64, "GROUP_SIZE_M": 8, "A_load_order": 0, "waves_per_eu": 2, "matrix_instr_nonkdim": 16, "num_warps": 4, "num_ctas": 1, "num_stages": 1, "num_buffers_warp_spec": 0, "num_consumer_groups": 0, "reg_dec_producer": 0, "reg_inc_consumer": 0}, "(512, 28672, 4096, 64, 8, 104)": {"BLOCK_SIZE_M": 256, "BLOCK_SIZE_N": 128, "BLOCK_SIZE_K": 32, "GROUP_SIZE_M": 8, "A_load_order": 0, "waves_per_eu": 2, "matrix_instr_nonkdim": 16, "num_warps": 4, "num_ctas": 1, "num_stages": 1, "num_buffers_warp_spec": 0, "num_consumer_groups": 0, "reg_dec_producer": 0, "reg_inc_consumer": 0}, "(1024, 28672, 4096, 64, 8, 104)": {"BLOCK_SIZE_M": 256, "BLOCK_SIZE_N": 128, "BLOCK_SIZE_K": 32, "GROUP_SIZE_M": 8, "A_load_order": 0, "waves_per_eu": 4, "matrix_instr_nonkdim": 16, "num_warps": 8, "num_ctas": 1, "num_stages": 1, "num_buffers_warp_spec": 0, "num_consumer_groups": 0, "reg_dec_producer": 0, "reg_inc_consumer": 0}, "(2048, 28672, 4096, 64, 8, 104)": {"BLOCK_SIZE_M": 256, "BLOCK_SIZE_N": 128, "BLOCK_SIZE_K": 32, "GROUP_SIZE_M": 8, "A_load_order": 0, "waves_per_eu": 2, "matrix_instr_nonkdim": 16, "num_warps": 4, "num_ctas": 1, "num_stages": 1, "num_buffers_warp_spec": 0, "num_consumer_groups": 0, "reg_dec_producer": 0, "reg_inc_consumer": 0}, "(128, 3584, 3584, 64, 8, 104)": {"BLOCK_SIZE_M": 64, "BLOCK_SIZE_N": 32, "BLOCK_SIZE_K": 64, "GROUP_SIZE_M": 8, "A_load_order": 0, "waves_per_eu": 0, "matrix_instr_nonkdim": 16, "num_warps": 4, "num_ctas": 1, "num_stages": 2, "num_buffers_warp_spec": 0, "num_consumer_groups": 0, "reg_dec_producer": 0, "reg_inc_consumer": 0}, "(256, 3584, 3584, 64, 8, 104)": {"BLOCK_SIZE_M": 128, "BLOCK_SIZE_N": 32, "BLOCK_SIZE_K": 64, "GROUP_SIZE_M": 8, "A_load_order": 0, "waves_per_eu": 4, "matrix_instr_nonkdim": 16, "num_warps": 8, "num_ctas": 1, "num_stages": 2, "num_buffers_warp_spec": 0, "num_consumer_groups": 0, "reg_dec_producer": 0, "reg_inc_consumer": 0}, "(512, 3584, 3584, 64, 8, 104)": {"BLOCK_SIZE_M": 64, "BLOCK_SIZE_N": 32, "BLOCK_SIZE_K": 64, "GROUP_SIZE_M": 8, "A_load_order": 0, "waves_per_eu": 4, "matrix_instr_nonkdim": 16, "num_warps": 4, "num_ctas": 1, "num_stages": 1, "num_buffers_warp_spec": 0, "num_consumer_groups": 0, "reg_dec_producer": 0, "reg_inc_consumer": 0}, "(1024, 3584, 3584, 64, 8, 104)": {"BLOCK_SIZE_M": 128, "BLOCK_SIZE_N": 64, "BLOCK_SIZE_K": 64, "GROUP_SIZE_M": 8, "A_load_order": 0, "waves_per_eu": 4, "matrix_instr_nonkdim": 16, "num_warps": 4, "num_ctas": 1, "num_stages": 1, "num_buffers_warp_spec": 0, "num_consumer_groups": 0, "reg_dec_producer": 0, "reg_inc_consumer": 0}, "(2048, 3584, 3584, 64, 8, 104)": {"BLOCK_SIZE_M": 128, "BLOCK_SIZE_N": 64, "BLOCK_SIZE_K": 64, "GROUP_SIZE_M": 8, "A_load_order": 0, "waves_per_eu": 4, "matrix_instr_nonkdim": 16, "num_warps": 4, "num_ctas": 1, "num_stages": 1, "num_buffers_warp_spec": 0, "num_consumer_groups": 0, "reg_dec_producer": 0, "reg_inc_consumer": 0}, "(128, 4608, 3584, 64, 8, 104)": {"BLOCK_SIZE_M": 64, "BLOCK_SIZE_N": 32, "BLOCK_SIZE_K": 64, "GROUP_SIZE_M": 8, "A_load_order": 0, "waves_per_eu": 0, "matrix_instr_nonkdim": 16, "num_warps": 4, "num_ctas": 1, "num_stages": 2, "num_buffers_warp_spec": 0, "num_consumer_groups": 0, "reg_dec_producer": 0, "reg_inc_consumer": 0}, "(256, 4608, 3584, 64, 8, 104)": {"BLOCK_SIZE_M": 64, "BLOCK_SIZE_N": 64, "BLOCK_SIZE_K": 64, "GROUP_SIZE_M": 8, "A_load_order": 0, "waves_per_eu": 4, "matrix_instr_nonkdim": 16, "num_warps": 8, "num_ctas": 1, "num_stages": 2, "num_buffers_warp_spec": 0, "num_consumer_groups": 0, "reg_dec_producer": 0, "reg_inc_consumer": 0}, "(512, 4608, 3584, 64, 8, 104)": {"BLOCK_SIZE_M": 128, "BLOCK_SIZE_N": 32, "BLOCK_SIZE_K": 64, "GROUP_SIZE_M": 8, "A_load_order": 0, "waves_per_eu": 2, "matrix_instr_nonkdim": 16, "num_warps": 4, "num_ctas": 1, "num_stages": 2, "num_buffers_warp_spec": 0, "num_consumer_groups": 0, "reg_dec_producer": 0, "reg_inc_consumer": 0}, "(1024, 4608, 3584, 64, 8, 104)": {"BLOCK_SIZE_M": 128, "BLOCK_SIZE_N": 64, "BLOCK_SIZE_K": 64, "GROUP_SIZE_M": 8, "A_load_order": 0, "waves_per_eu": 4, "matrix_instr_nonkdim": 16, "num_warps": 4, "num_ctas": 1, "num_stages": 1, "num_buffers_warp_spec": 0, "num_consumer_groups": 0, "reg_dec_producer": 0, "reg_inc_consumer": 0}, "(2048, 4608, 3584, 64, 8, 104)": {"BLOCK_SIZE_M": 256, "BLOCK_SIZE_N": 64, "BLOCK_SIZE_K": 64, "GROUP_SIZE_M": 8, "A_load_order": 0, "waves_per_eu": 2, "matrix_instr_nonkdim": 16, "num_warps": 4, "num_ctas": 1, "num_stages": 1, "num_buffers_warp_spec": 0, "num_consumer_groups": 0, "reg_dec_producer": 0, "reg_inc_consumer": 0}, "(128, 3584, 18944, 64, 8, 104)": {"BLOCK_SIZE_M": 64, "BLOCK_SIZE_N": 32, "BLOCK_SIZE_K": 64, "GROUP_SIZE_M": 8, "A_load_order": 0, "waves_per_eu": 0, "matrix_instr_nonkdim": 16, "num_warps": 4, "num_ctas": 1, "num_stages": 2, "num_buffers_warp_spec": 0, "num_consumer_groups": 0, "reg_dec_producer": 0, "reg_inc_consumer": 0}, "(256, 3584, 18944, 64, 8, 104)": {"BLOCK_SIZE_M": 128, "BLOCK_SIZE_N": 32, "BLOCK_SIZE_K": 64, "GROUP_SIZE_M": 8, "A_load_order": 0, "waves_per_eu": 4, "matrix_instr_nonkdim": 16, "num_warps": 8, "num_ctas": 1, "num_stages": 2, "num_buffers_warp_spec": 0, "num_consumer_groups": 0, "reg_dec_producer": 0, "reg_inc_consumer": 0}, "(512, 3584, 18944, 64, 8, 104)": {"BLOCK_SIZE_M": 64, "BLOCK_SIZE_N": 32, "BLOCK_SIZE_K": 64, "GROUP_SIZE_M": 8, "A_load_order": 0, "waves_per_eu": 2, "matrix_instr_nonkdim": 16, "num_warps": 4, "num_ctas": 1, "num_stages": 1, "num_buffers_warp_spec": 0, "num_consumer_groups": 0, "reg_dec_producer": 0, "reg_inc_consumer": 0}, "(1024, 3584, 18944, 64, 8, 104)": {"BLOCK_SIZE_M": 128, "BLOCK_SIZE_N": 64, "BLOCK_SIZE_K": 64, "GROUP_SIZE_M": 8, "A_load_order": 0, "waves_per_eu": 4, "matrix_instr_nonkdim": 16, "num_warps": 4, "num_ctas": 1, "num_stages": 1, "num_buffers_warp_spec": 0, "num_consumer_groups": 0, "reg_dec_producer": 0, "reg_inc_consumer": 0}, "(2048, 3584, 18944, 64, 8, 104)": {"BLOCK_SIZE_M": 128, "BLOCK_SIZE_N": 64, "BLOCK_SIZE_K": 64, "GROUP_SIZE_M": 8, "A_load_order": 0, "waves_per_eu": 4, "matrix_instr_nonkdim": 16, "num_warps": 4, "num_ctas": 1, "num_stages": 1, "num_buffers_warp_spec": 0, "num_consumer_groups": 0, "reg_dec_producer": 0, "reg_inc_consumer": 0}, "(128, 37888, 3584, 64, 8, 104)": {"BLOCK_SIZE_M": 128, "BLOCK_SIZE_N": 64, "BLOCK_SIZE_K": 64, "GROUP_SIZE_M": 8, "A_load_order": 0, "waves_per_eu": 4, "matrix_instr_nonkdim": 16, "num_warps": 4, "num_ctas": 1, "num_stages": 1, "num_buffers_warp_spec": 0, "num_consumer_groups": 0, "reg_dec_producer": 0, "reg_inc_consumer": 0}, "(256, 37888, 3584, 64, 8, 104)": {"BLOCK_SIZE_M": 256, "BLOCK_SIZE_N": 64, "BLOCK_SIZE_K": 64, "GROUP_SIZE_M": 8, "A_load_order": 0, "waves_per_eu": 2, "matrix_instr_nonkdim": 16, "num_warps": 4, "num_ctas": 1, "num_stages": 1, "num_buffers_warp_spec": 0, "num_consumer_groups": 0, "reg_dec_producer": 0, "reg_inc_consumer": 0}, "(512, 37888, 3584, 64, 8, 104)": {"BLOCK_SIZE_M": 256, "BLOCK_SIZE_N": 128, "BLOCK_SIZE_K": 32, "GROUP_SIZE_M": 8, "A_load_order": 0, "waves_per_eu": 2, "matrix_instr_nonkdim": 16, "num_warps": 4, "num_ctas": 1, "num_stages": 1, "num_buffers_warp_spec": 0, "num_consumer_groups": 0, "reg_dec_producer": 0, "reg_inc_consumer": 0}, "(1024, 37888, 3584, 64, 8, 104)": {"BLOCK_SIZE_M": 256, "BLOCK_SIZE_N": 128, "BLOCK_SIZE_K": 32, "GROUP_SIZE_M": 8, "A_load_order": 0, "waves_per_eu": 2, "matrix_instr_nonkdim": 16, "num_warps": 4, "num_ctas": 1, "num_stages": 1, "num_buffers_warp_spec": 0, "num_consumer_groups": 0, "reg_dec_producer": 0, "reg_inc_consumer": 0}, "(2048, 37888, 3584, 64, 8, 104)": {"BLOCK_SIZE_M": 256, "BLOCK_SIZE_N": 128, "BLOCK_SIZE_K": 32, "GROUP_SIZE_M": 8, "A_load_order": 0, "waves_per_eu": 2, "matrix_instr_nonkdim": 16, "num_warps": 4, "num_ctas": 1, "num_stages": 1, "num_buffers_warp_spec": 0, "num_consumer_groups": 0, "reg_dec_producer": 0, "reg_inc_consumer": 0}, "(128, 3072, 3072, 64, 8, 104)": {"BLOCK_SIZE_M": 64, "BLOCK_SIZE_N": 32, "BLOCK_SIZE_K": 64, "GROUP_SIZE_M": 8, "A_load_order": 0, "waves_per_eu": 0, "matrix_instr_nonkdim": 16, "num_warps": 8, "num_ctas": 1, "num_stages": 2, "num_buffers_warp_spec": 0, "num_consumer_groups": 0, "reg_dec_producer": 0, "reg_inc_consumer": 0}, "(256, 3072, 3072, 64, 8, 104)": {"BLOCK_SIZE_M": 64, "BLOCK_SIZE_N": 64, "BLOCK_SIZE_K": 64, "GROUP_SIZE_M": 8, "A_load_order": 0, "waves_per_eu": 0, "matrix_instr_nonkdim": 16, "num_warps": 8, "num_ctas": 1, "num_stages": 2, "num_buffers_warp_spec": 0, "num_consumer_groups": 0, "reg_dec_producer": 0, "reg_inc_consumer": 0}, "(512, 3072, 3072, 64, 8, 104)": {"BLOCK_SIZE_M": 64, "BLOCK_SIZE_N": 32, "BLOCK_SIZE_K": 64, "GROUP_SIZE_M": 8, "A_load_order": 0, "waves_per_eu": 2, "matrix_instr_nonkdim": 16, "num_warps": 4, "num_ctas": 1, "num_stages": 1, "num_buffers_warp_spec": 0, "num_consumer_groups": 0, "reg_dec_producer": 0, "reg_inc_consumer": 0}, "(1024, 3072, 3072, 64, 8, 104)": {"BLOCK_SIZE_M": 128, "BLOCK_SIZE_N": 64, "BLOCK_SIZE_K": 64, "GROUP_SIZE_M": 8, "A_load_order": 0, "waves_per_eu": 4, "matrix_instr_nonkdim": 16, "num_warps": 4, "num_ctas": 1, "num_stages": 1, "num_buffers_warp_spec": 0, "num_consumer_groups": 0, "reg_dec_producer": 0, "reg_inc_consumer": 0}, "(2048, 3072, 3072, 64, 8, 104)": {"BLOCK_SIZE_M": 128, "BLOCK_SIZE_N": 64, "BLOCK_SIZE_K": 64, "GROUP_SIZE_M": 8, "A_load_order": 0, "waves_per_eu": 4, "matrix_instr_nonkdim": 16, "num_warps": 4, "num_ctas": 1, "num_stages": 1, "num_buffers_warp_spec": 0, "num_consumer_groups": 0, "reg_dec_producer": 0, "reg_inc_consumer": 0}, "(128, 5120, 3072, 64, 8, 104)": {"BLOCK_SIZE_M": 64, "BLOCK_SIZE_N": 64, "BLOCK_SIZE_K": 64, "GROUP_SIZE_M": 8, "A_load_order": 0, "waves_per_eu": 0, "matrix_instr_nonkdim": 16, "num_warps": 8, "num_ctas": 1, "num_stages": 2, "num_buffers_warp_spec": 0, "num_consumer_groups": 0, "reg_dec_producer": 0, "reg_inc_consumer": 0}, "(256, 5120, 3072, 64, 8, 104)": {"BLOCK_SIZE_M": 64, "BLOCK_SIZE_N": 32, "BLOCK_SIZE_K": 64, "GROUP_SIZE_M": 8, "A_load_order": 0, "waves_per_eu": 2, "matrix_instr_nonkdim": 16, "num_warps": 4, "num_ctas": 1, "num_stages": 1, "num_buffers_warp_spec": 0, "num_consumer_groups": 0, "reg_dec_producer": 0, "reg_inc_consumer": 0}, "(512, 5120, 3072, 64, 8, 104)": {"BLOCK_SIZE_M": 128, "BLOCK_SIZE_N": 64, "BLOCK_SIZE_K": 64, "GROUP_SIZE_M": 8, "A_load_order": 0, "waves_per_eu": 4, "matrix_instr_nonkdim": 16, "num_warps": 4, "num_ctas": 1, "num_stages": 1, "num_buffers_warp_spec": 0, "num_consumer_groups": 0, "reg_dec_producer": 0, "reg_inc_consumer": 0}, "(1024, 5120, 3072, 64, 8, 104)": {"BLOCK_SIZE_M": 256, "BLOCK_SIZE_N": 64, "BLOCK_SIZE_K": 64, "GROUP_SIZE_M": 8, "A_load_order": 0, "waves_per_eu": 2, "matrix_instr_nonkdim": 16, "num_warps": 4, "num_ctas": 1, "num_stages": 1, "num_buffers_warp_spec": 0, "num_consumer_groups": 0, "reg_dec_producer": 0, "reg_inc_consumer": 0}, "(2048, 5120, 3072, 64, 8, 104)": {"BLOCK_SIZE_M": 256, "BLOCK_SIZE_N": 128, "BLOCK_SIZE_K": 32, "GROUP_SIZE_M": 8, "A_load_order": 0, "waves_per_eu": 2, "matrix_instr_nonkdim": 16, "num_warps": 4, "num_ctas": 1, "num_stages": 1, "num_buffers_warp_spec": 0, "num_consumer_groups": 0, "reg_dec_producer": 0, "reg_inc_consumer": 0}, "(128, 3072, 8192, 64, 8, 104)": {"BLOCK_SIZE_M": 64, "BLOCK_SIZE_N": 32, "BLOCK_SIZE_K": 64, "GROUP_SIZE_M": 8, "A_load_order": 0, "waves_per_eu": 0, "matrix_instr_nonkdim": 16, "num_warps": 4, "num_ctas": 1, "num_stages": 2, "num_buffers_warp_spec": 0, "num_consumer_groups": 0, "reg_dec_producer": 0, "reg_inc_consumer": 0}, "(256, 3072, 8192, 64, 8, 104)": {"BLOCK_SIZE_M": 128, "BLOCK_SIZE_N": 32, "BLOCK_SIZE_K": 64, "GROUP_SIZE_M": 8, "A_load_order": 0, "waves_per_eu": 4, "matrix_instr_nonkdim": 16, "num_warps": 8, "num_ctas": 1, "num_stages": 2, "num_buffers_warp_spec": 0, "num_consumer_groups": 0, "reg_dec_producer": 0, "reg_inc_consumer": 0}, "(512, 3072, 8192, 64, 8, 104)": {"BLOCK_SIZE_M": 64, "BLOCK_SIZE_N": 32, "BLOCK_SIZE_K": 64, "GROUP_SIZE_M": 8, "A_load_order": 0, "waves_per_eu": 0, "matrix_instr_nonkdim": 16, "num_warps": 4, "num_ctas": 1, "num_stages": 2, "num_buffers_warp_spec": 0, "num_consumer_groups": 0, "reg_dec_producer": 0, "reg_inc_consumer": 0}, "(1024, 3072, 8192, 64, 8, 104)": {"BLOCK_SIZE_M": 128, "BLOCK_SIZE_N": 64, "BLOCK_SIZE_K": 32, "GROUP_SIZE_M": 8, "A_load_order": 0, "waves_per_eu": 0, "matrix_instr_nonkdim": 16, "num_warps": 4, "num_ctas": 1, "num_stages": 2, "num_buffers_warp_spec": 0, "num_consumer_groups": 0, "reg_dec_producer": 0, "reg_inc_consumer": 0}, "(2048, 3072, 8192, 64, 8, 104)": {"BLOCK_SIZE_M": 128, "BLOCK_SIZE_N": 64, "BLOCK_SIZE_K": 64, "GROUP_SIZE_M": 8, "A_load_order": 0, "waves_per_eu": 4, "matrix_instr_nonkdim": 16, "num_warps": 4, "num_ctas": 1, "num_stages": 1, "num_buffers_warp_spec": 0, "num_consumer_groups": 0, "reg_dec_producer": 0, "reg_inc_consumer": 0}, "(128, 16384, 3072, 64, 8, 104)": {"BLOCK_SIZE_M": 128, "BLOCK_SIZE_N": 32, "BLOCK_SIZE_K": 64, "GROUP_SIZE_M": 8, "A_load_order": 0, "waves_per_eu": 4, "matrix_instr_nonkdim": 16, "num_warps": 4, "num_ctas": 1, "num_stages": 2, "num_buffers_warp_spec": 0, "num_consumer_groups": 0, "reg_dec_producer": 0, "reg_inc_consumer": 0}, "(256, 16384, 3072, 64, 8, 104)": {"BLOCK_SIZE_M": 128, "BLOCK_SIZE_N": 64, "BLOCK_SIZE_K": 64, "GROUP_SIZE_M": 8, "A_load_order": 0, "waves_per_eu": 4, "matrix_instr_nonkdim": 16, "num_warps": 4, "num_ctas": 1, "num_stages": 1, "num_buffers_warp_spec": 0, "num_consumer_groups": 0, "reg_dec_producer": 0, "reg_inc_consumer": 0}, "(512, 16384, 3072, 64, 8, 104)": {"BLOCK_SIZE_M": 256, "BLOCK_SIZE_N": 64, "BLOCK_SIZE_K": 64, "GROUP_SIZE_M": 8, "A_load_order": 0, "waves_per_eu": 2, "matrix_instr_nonkdim": 16, "num_warps": 4, "num_ctas": 1, "num_stages": 1, "num_buffers_warp_spec": 0, "num_consumer_groups": 0, "reg_dec_producer": 0, "reg_inc_consumer": 0}, "(1024, 16384, 3072, 64, 8, 104)": {"BLOCK_SIZE_M": 256, "BLOCK_SIZE_N": 128, "BLOCK_SIZE_K": 32, "GROUP_SIZE_M": 8, "A_load_order": 0, "waves_per_eu": 2, "matrix_instr_nonkdim": 16, "num_warps": 4, "num_ctas": 1, "num_stages": 1, "num_buffers_warp_spec": 0, "num_consumer_groups": 0, "reg_dec_producer": 0, "reg_inc_consumer": 0}, "(2048, 16384, 3072, 64, 8, 104)": {"BLOCK_SIZE_M": 256, "BLOCK_SIZE_N": 128, "BLOCK_SIZE_K": 32, "GROUP_SIZE_M": 8, "A_load_order": 0, "waves_per_eu": 2, "matrix_instr_nonkdim": 16, "num_warps": 4, "num_ctas": 1, "num_stages": 1, "num_buffers_warp_spec": 0, "num_consumer_groups": 0, "reg_dec_producer": 0, "reg_inc_consumer": 0}, "(4096, 6144, 4096, 128, 8, 104)": {"BLOCK_SIZE_M": 128, "BLOCK_SIZE_N": 64, "BLOCK_SIZE_K": 64, "GROUP_SIZE_M": 8, "A_load_order": 0, "waves_per_eu": 4, "matrix_instr_nonkdim": 16, "num_warps": 4, "num_ctas": 1, "num_stages": 1, "num_buffers_warp_spec": 0, "num_consumer_groups": 0, "reg_dec_producer": 0, "reg_inc_consumer": 0}, "(4096, 4096, 4096, 128, 8, 104)": {"BLOCK_SIZE_M": 256, "BLOCK_SIZE_N": 128, "BLOCK_SIZE_K": 32, "GROUP_SIZE_M": 8, "A_load_order": 0, "waves_per_eu": 2, "matrix_instr_nonkdim": 16, "num_warps": 4, "num_ctas": 1, "num_stages": 1, "num_buffers_warp_spec": 0, "num_consumer_groups": 0, "reg_dec_producer": 0, "reg_inc_consumer": 0}, "(4096, 28672, 4096, 128, 8, 104)": {"BLOCK_SIZE_M": 256, "BLOCK_SIZE_N": 128, "BLOCK_SIZE_K": 32, "GROUP_SIZE_M": 8, "A_load_order": 0, "waves_per_eu": 2, "matrix_instr_nonkdim": 16, "num_warps": 4, "num_ctas": 1, "num_stages": 1, "num_buffers_warp_spec": 0, "num_consumer_groups": 0, "reg_dec_producer": 0, "reg_inc_consumer": 0}, "(4096, 4096, 14336, 128, 8, 104)": {"BLOCK_SIZE_M": 256, "BLOCK_SIZE_N": 128, "BLOCK_SIZE_K": 32, "GROUP_SIZE_M": 8, "A_load_order": 0, "waves_per_eu": 2, "matrix_instr_nonkdim": 16, "num_warps": 4, "num_ctas": 1, "num_stages": 1, "num_buffers_warp_spec": 0, "num_consumer_groups": 0, "reg_dec_producer": 0, "reg_inc_consumer": 0}, "(192, 6144, 4096, 128, 8, 104)": {"BLOCK_SIZE_M": 64, "BLOCK_SIZE_N": 64, "BLOCK_SIZE_K": 64, "GROUP_SIZE_M": 8, "A_load_order": 0, "waves_per_eu": 4, "matrix_instr_nonkdim": 16, "num_warps": 8, "num_ctas": 1, "num_stages": 2, "num_buffers_warp_spec": 0, "num_consumer_groups": 0, "reg_dec_producer": 0, "reg_inc_consumer": 0}, "(192, 4096, 4096, 128, 8, 104)": {"BLOCK_SIZE_M": 64, "BLOCK_SIZE_N": 32, "BLOCK_SIZE_K": 128, "GROUP_SIZE_M": 8, "A_load_order": 0, "waves_per_eu": 0, "matrix_instr_nonkdim": 16, "num_warps": 4, "num_ctas": 1, "num_stages": 1, "num_buffers_warp_spec": 0, "num_consumer_groups": 0, "reg_dec_producer": 0, "reg_inc_consumer": 0}, "(192, 28672, 4096, 128, 8, 104)": {"BLOCK_SIZE_M": 128, "BLOCK_SIZE_N": 64, "BLOCK_SIZE_K": 64, "GROUP_SIZE_M": 8, "A_load_order": 0, "waves_per_eu": 4, "matrix_instr_nonkdim": 16, "num_warps": 4, "num_ctas": 1, "num_stages": 1, "num_buffers_warp_spec": 0, "num_consumer_groups": 0, "reg_dec_producer": 0, "reg_inc_consumer": 0}, "(192, 4096, 14336, 128, 8, 104)": {"BLOCK_SIZE_M": 64, "BLOCK_SIZE_N": 64, "BLOCK_SIZE_K": 64, "GROUP_SIZE_M": 8, "A_load_order": 0, "waves_per_eu": 0, "matrix_instr_nonkdim": 16, "num_warps": 8, "num_ctas": 1, "num_stages": 2, "num_buffers_warp_spec": 0, "num_consumer_groups": 0, "reg_dec_producer": 0, "reg_inc_consumer": 0}, "(96, 6144, 4096, 128, 8, 104)": {"BLOCK_SIZE_M": 128, "BLOCK_SIZE_N": 32, "BLOCK_SIZE_K": 64, "GROUP_SIZE_M": 8, "A_load_order": 0, "waves_per_eu": 0, "matrix_instr_nonkdim": 16, "num_warps": 8, "num_ctas": 1, "num_stages": 2, "num_buffers_warp_spec": 0, "num_consumer_groups": 0, "reg_dec_producer": 0, "reg_inc_consumer": 0}, "(96, 4096, 4096, 128, 8, 104)": {"BLOCK_SIZE_M": 64, "BLOCK_SIZE_N": 32, "BLOCK_SIZE_K": 64, "GROUP_SIZE_M": 8, "A_load_order": 0, "waves_per_eu": 0, "matrix_instr_nonkdim": 16, "num_warps": 4, "num_ctas": 1, "num_stages": 2, "num_buffers_warp_spec": 0, "num_consumer_groups": 0, "reg_dec_producer": 0, "reg_inc_consumer": 0}, "(96, 28672, 4096, 128, 8, 104)": {"BLOCK_SIZE_M": 128, "BLOCK_SIZE_N": 64, "BLOCK_SIZE_K": 64, "GROUP_SIZE_M": 8, "A_load_order": 0, "waves_per_eu": 4, "matrix_instr_nonkdim": 16, "num_warps": 4, "num_ctas": 1, "num_stages": 1, "num_buffers_warp_spec": 0, "num_consumer_groups": 0, "reg_dec_producer": 0, "reg_inc_consumer": 0}, "(96, 4096, 14336, 128, 8, 104)": {"BLOCK_SIZE_M": 64, "BLOCK_SIZE_N": 32, "BLOCK_SIZE_K": 64, "GROUP_SIZE_M": 8, "A_load_order": 0, "waves_per_eu": 2, "matrix_instr_nonkdim": 16, "num_warps": 4, "num_ctas": 1, "num_stages": 2, "num_buffers_warp_spec": 0, "num_consumer_groups": 0, "reg_dec_producer": 0, "reg_inc_consumer": 0}, "(3072, 4096, 4096, 4096, 1, 408)": {"BLOCK_SIZE_M": 128, "BLOCK_SIZE_N": 128, "BLOCK_SIZE_K": 128, "GROUP_SIZE_M": 8, "A_load_order": 0, "waves_per_eu": 4, "matrix_instr_nonkdim": 16, "num_warps": 8, "num_ctas": 1, "num_stages": 2, "num_buffers_warp_spec": 0, "num_consumer_groups": 0, "reg_dec_producer": 0, "reg_inc_consumer": 0}, "(1536, 4096, 4096, 4096, 1, 408)": {"BLOCK_SIZE_M": 128, "BLOCK_SIZE_N": 128, "BLOCK_SIZE_K": 128, "GROUP_SIZE_M": 8, "A_load_order": 0, "waves_per_eu": 2, "matrix_instr_nonkdim": 16, "num_warps": 4, "num_ctas": 1, "num_stages": 1, "num_buffers_warp_spec": 0, "num_consumer_groups": 0, "reg_dec_producer": 0, "reg_inc_consumer": 0}, "(3072, 6144, 4096, 4096, 1, 408)": {"BLOCK_SIZE_M": 128, "BLOCK_SIZE_N": 128, "BLOCK_SIZE_K": 128, "GROUP_SIZE_M": 8, "A_load_order": 0, "waves_per_eu": 0, "matrix_instr_nonkdim": 16, "num_warps": 4, "num_ctas": 1, "num_stages": 2, "num_buffers_warp_spec": 0, "num_consumer_groups": 0, "reg_dec_producer": 0, "reg_inc_consumer": 0}, "(1536, 6144, 4096, 4096, 1, 408)": {"BLOCK_SIZE_M": 128, "BLOCK_SIZE_N": 128, "BLOCK_SIZE_K": 128, "GROUP_SIZE_M": 8, "A_load_order": 0, "waves_per_eu": 2, "matrix_instr_nonkdim": 16, "num_warps": 4, "num_ctas": 1, "num_stages": 2, "num_buffers_warp_spec": 0, "num_consumer_groups": 0, "reg_dec_producer": 0, "reg_inc_consumer": 0}, "(3072, 4096, 14336, 14336, 1, 408)": {"BLOCK_SIZE_M": 128, "BLOCK_SIZE_N": 128, "BLOCK_SIZE_K": 128, "GROUP_SIZE_M": 8, "A_load_order": 0, "waves_per_eu": 2, "matrix_instr_nonkdim": 16, "num_warps": 8, "num_ctas": 1, "num_stages": 2, "num_buffers_warp_spec": 0, "num_consumer_groups": 0, "reg_dec_producer": 0, "reg_inc_consumer": 0}, "(1536, 4096, 14336, 14336, 1, 408)": {"BLOCK_SIZE_M": 128, "BLOCK_SIZE_N": 128, "BLOCK_SIZE_K": 128, "GROUP_SIZE_M": 8, "A_load_order": 0, "waves_per_eu": 0, "matrix_instr_nonkdim": 16, "num_warps": 4, "num_ctas": 1, "num_stages": 2, "num_buffers_warp_spec": 0, "num_consumer_groups": 0, "reg_dec_producer": 0, "reg_inc_consumer": 0}, "(3072, 28672, 4096, 4096, 1, 408)": {"BLOCK_SIZE_M": 256, "BLOCK_SIZE_N": 128, "BLOCK_SIZE_K": 128, "GROUP_SIZE_M": 8, "A_load_order": 0, "waves_per_eu": 0, "matrix_instr_nonkdim": 16, "num_warps": 8, "num_ctas": 1, "num_stages": 1, "num_buffers_warp_spec": 0, "num_consumer_groups": 0, "reg_dec_producer": 0, "reg_inc_consumer": 0}, "(1536, 28672, 4096, 4096, 1, 408)": {"BLOCK_SIZE_M": 256, "BLOCK_SIZE_N": 128, "BLOCK_SIZE_K": 128, "GROUP_SIZE_M": 8, "A_load_order": 0, "waves_per_eu": 2, "matrix_instr_nonkdim": 16, "num_warps": 8, "num_ctas": 1, "num_stages": 1, "num_buffers_warp_spec": 0, "num_consumer_groups": 0, "reg_dec_producer": 0, "reg_inc_consumer": 0}, "(768, 4096, 4096, 4096, 1, 408)": {"BLOCK_SIZE_M": 128, "BLOCK_SIZE_N": 128, "BLOCK_SIZE_K": 128, "GROUP_SIZE_M": 8, "A_load_order": 0, "waves_per_eu": 4, "matrix_instr_nonkdim": 16, "num_warps": 8, "num_ctas": 1, "num_stages": 2, "num_buffers_warp_spec": 0, "num_consumer_groups": 0, "reg_dec_producer": 0, "reg_inc_consumer": 0}, "(384, 4096, 4096, 4096, 1, 408)": {"BLOCK_SIZE_M": 128, "BLOCK_SIZE_N": 64, "BLOCK_SIZE_K": 128, "GROUP_SIZE_M": 8, "A_load_order": 0, "waves_per_eu": 4, "matrix_instr_nonkdim": 16, "num_warps": 8, "num_ctas": 1, "num_stages": 2, "num_buffers_warp_spec": 0, "num_consumer_groups": 0, "reg_dec_producer": 0, "reg_inc_consumer": 0}, "(192, 4096, 4096, 4096, 1, 408)": {"BLOCK_SIZE_M": 64, "BLOCK_SIZE_N": 64, "BLOCK_SIZE_K": 128, "GROUP_SIZE_M": 8, "A_load_order": 0, "waves_per_eu": 4, "matrix_instr_nonkdim": 16, "num_warps": 8, "num_ctas": 1, "num_stages": 2, "num_buffers_warp_spec": 0, "num_consumer_groups": 0, "reg_dec_producer": 0, "reg_inc_consumer": 0}, "(768, 6144, 4096, 4096, 1, 408)": {"BLOCK_SIZE_M": 128, "BLOCK_SIZE_N": 128, "BLOCK_SIZE_K": 128, "GROUP_SIZE_M": 8, "A_load_order": 0, "waves_per_eu": 4, "matrix_instr_nonkdim": 16, "num_warps": 8, "num_ctas": 1, "num_stages": 2, "num_buffers_warp_spec": 0, "num_consumer_groups": 0, "reg_dec_producer": 0, "reg_inc_consumer": 0}, "(384, 6144, 4096, 4096, 1, 408)": {"BLOCK_SIZE_M": 128, "BLOCK_SIZE_N": 64, "BLOCK_SIZE_K": 128, "GROUP_SIZE_M": 8, "A_load_order": 0, "waves_per_eu": 0, "matrix_instr_nonkdim": 16, "num_warps": 8, "num_ctas": 1, "num_stages": 2, "num_buffers_warp_spec": 0, "num_consumer_groups": 0, "reg_dec_producer": 0, "reg_inc_consumer": 0}, "(192, 6144, 4096, 4096, 1, 408)": {"BLOCK_SIZE_M": 64, "BLOCK_SIZE_N": 64, "BLOCK_SIZE_K": 128, "GROUP_SIZE_M": 8, "A_load_order": 0, "waves_per_eu": 4, "matrix_instr_nonkdim": 16, "num_warps": 8, "num_ctas": 1, "num_stages": 2, "num_buffers_warp_spec": 0, "num_consumer_groups": 0, "reg_dec_producer": 0, "reg_inc_consumer": 0}, "(768, 4096, 14336, 14336, 1, 408)": {"BLOCK_SIZE_M": 128, "BLOCK_SIZE_N": 128, "BLOCK_SIZE_K": 128, "GROUP_SIZE_M": 8, "A_load_order": 0, "waves_per_eu": 2, "matrix_instr_nonkdim": 16, "num_warps": 8, "num_ctas": 1, "num_stages": 2, "num_buffers_warp_spec": 0, "num_consumer_groups": 0, "reg_dec_producer": 0, "reg_inc_consumer": 0}, "(384, 4096, 14336, 14336, 1, 408)": {"BLOCK_SIZE_M": 128, "BLOCK_SIZE_N": 64, "BLOCK_SIZE_K": 128, "GROUP_SIZE_M": 8, "A_load_order": 0, "waves_per_eu": 2, "matrix_instr_nonkdim": 16, "num_warps": 8, "num_ctas": 1, "num_stages": 2, "num_buffers_warp_spec": 0, "num_consumer_groups": 0, "reg_dec_producer": 0, "reg_inc_consumer": 0}, "(192, 4096, 14336, 14336, 1, 408)": {"BLOCK_SIZE_M": 64, "BLOCK_SIZE_N": 64, "BLOCK_SIZE_K": 256, "GROUP_SIZE_M": 8, "A_load_order": 0, "waves_per_eu": 4, "matrix_instr_nonkdim": 16, "num_warps": 8, "num_ctas": 1, "num_stages": 2, "num_buffers_warp_spec": 0, "num_consumer_groups": 0, "reg_dec_producer": 0, "reg_inc_consumer": 0}, "(768, 28672, 4096, 4096, 1, 408)": {"BLOCK_SIZE_M": 128, "BLOCK_SIZE_N": 128, "BLOCK_SIZE_K": 128, "GROUP_SIZE_M": 8, "A_load_order": 0, "waves_per_eu": 2, "matrix_instr_nonkdim": 16, "num_warps": 8, "num_ctas": 1, "num_stages": 2, "num_buffers_warp_spec": 0, "num_consumer_groups": 0, "reg_dec_producer": 0, "reg_inc_consumer": 0}, "(384, 28672, 4096, 4096, 1, 408)": {"BLOCK_SIZE_M": 128, "BLOCK_SIZE_N": 64, "BLOCK_SIZE_K": 128, "GROUP_SIZE_M": 8, "A_load_order": 0, "waves_per_eu": 4, "matrix_instr_nonkdim": 16, "num_warps": 8, "num_ctas": 1, "num_stages": 2, "num_buffers_warp_spec": 0, "num_consumer_groups": 0, "reg_dec_producer": 0, "reg_inc_consumer": 0}, "(192, 28672, 4096, 4096, 1, 408)": {"BLOCK_SIZE_M": 64, "BLOCK_SIZE_N": 64, "BLOCK_SIZE_K": 256, "GROUP_SIZE_M": 8, "A_load_order": 0, "waves_per_eu": 2, "matrix_instr_nonkdim": 16, "num_warps": 8, "num_ctas": 1, "num_stages": 2, "num_buffers_warp_spec": 0, "num_consumer_groups": 0, "reg_dec_producer": 0, "reg_inc_consumer": 0}, "(96, 4096, 4096, 4096, 1, 408)": {"BLOCK_SIZE_M": 64, "BLOCK_SIZE_N": 64, "BLOCK_SIZE_K": 256, "GROUP_SIZE_M": 8, "A_load_order": 0, "waves_per_eu": 4, "matrix_instr_nonkdim": 16, "num_warps": 8, "num_ctas": 1, "num_stages": 2, "num_buffers_warp_spec": 0, "num_consumer_groups": 0, "reg_dec_producer": 0, "reg_inc_consumer": 0}, "(96, 6144, 4096, 4096, 1, 408)": {"BLOCK_SIZE_M": 128, "BLOCK_SIZE_N": 32, "BLOCK_SIZE_K": 128, "GROUP_SIZE_M": 8, "A_load_order": 0, "waves_per_eu": 0, "matrix_instr_nonkdim": 16, "num_warps": 8, "num_ctas": 1, "num_stages": 2, "num_buffers_warp_spec": 0, "num_consumer_groups": 0, "reg_dec_producer": 0, "reg_inc_consumer": 0}, "(96, 4096, 14336, 14336, 1, 408)": {"BLOCK_SIZE_M": 64, "BLOCK_SIZE_N": 32, "BLOCK_SIZE_K": 256, "GROUP_SIZE_M": 8, "A_load_order": 0, "waves_per_eu": 4, "matrix_instr_nonkdim": 16, "num_warps": 8, "num_ctas": 1, "num_stages": 2, "num_buffers_warp_spec": 0, "num_consumer_groups": 0, "reg_dec_producer": 0, "reg_inc_consumer": 0}, "(96, 28672, 4096, 4096, 1, 408)": {"BLOCK_SIZE_M": 64, "BLOCK_SIZE_N": 64, "BLOCK_SIZE_K": 512, "GROUP_SIZE_M": 8, "A_load_order": 0, "waves_per_eu": 2, "matrix_instr_nonkdim": 16, "num_warps": 4, "num_ctas": 1, "num_stages": 1, "num_buffers_warp_spec": 0, "num_consumer_groups": 0, "reg_dec_producer": 0, "reg_inc_consumer": 0}, "(4096, 4096, 4096, 4096, 1, 408)": {"BLOCK_SIZE_M": 128, "BLOCK_SIZE_N": 256, "BLOCK_SIZE_K": 128, "GROUP_SIZE_M": 8, "A_load_order": 0, "waves_per_eu": 2, "matrix_instr_nonkdim": 16, "num_warps": 4, "num_ctas": 1, "num_stages": 1, "num_buffers_warp_spec": 0, "num_consumer_groups": 0, "reg_dec_producer": 0, "reg_inc_consumer": 0}, "(4096, 6144, 4096, 4096, 1, 408)": {"BLOCK_SIZE_M": 128, "BLOCK_SIZE_N": 128, "BLOCK_SIZE_K": 128, "GROUP_SIZE_M": 8, "A_load_order": 0, "waves_per_eu": 0, "matrix_instr_nonkdim": 16, "num_warps": 4, "num_ctas": 1, "num_stages": 2, "num_buffers_warp_spec": 0, "num_consumer_groups": 0, "reg_dec_producer": 0, "reg_inc_consumer": 0}, "(4096, 4096, 14336, 14336, 1, 408)": {"BLOCK_SIZE_M": 256, "BLOCK_SIZE_N": 128, "BLOCK_SIZE_K": 128, "GROUP_SIZE_M": 8, "A_load_order": 0, "waves_per_eu": 4, "matrix_instr_nonkdim": 16, "num_warps": 8, "num_ctas": 1, "num_stages": 1, "num_buffers_warp_spec": 0, "num_consumer_groups": 0, "reg_dec_producer": 0, "reg_inc_consumer": 0}, "(4096, 28672, 4096, 4096, 1, 408)": {"BLOCK_SIZE_M": 256, "BLOCK_SIZE_N": 128, "BLOCK_SIZE_K": 128, "GROUP_SIZE_M": 8, "A_load_order": 0, "waves_per_eu": 0, "matrix_instr_nonkdim": 16, "num_warps": 8, "num_ctas": 1, "num_stages": 1, "num_buffers_warp_spec": 0, "num_consumer_groups": 0, "reg_dec_producer": 0, "reg_inc_consumer": 0}, "(1024, 4096, 4096, 4096, 1, 1208)": {"BLOCK_SIZE_M": 128, "BLOCK_SIZE_N": 128, "BLOCK_SIZE_K": 128, "GROUP_SIZE_M": 8, "A_load_order": 0, "waves_per_eu": 0, "matrix_instr_nonkdim": 16, "num_warps": 8, "num_ctas": 1, "num_stages": 2, "num_buffers_warp_spec": 0, "num_consumer_groups": 0, "reg_dec_producer": 0, "reg_inc_consumer": 0}, "(1024, 6144, 4096, 4096, 1, 1208)": {"BLOCK_SIZE_M": 128, "BLOCK_SIZE_N": 128, "BLOCK_SIZE_K": 128, "GROUP_SIZE_M": 8, "A_load_order": 0, "waves_per_eu": 0, "matrix_instr_nonkdim": 16, "num_warps": 4, "num_ctas": 1, "num_stages": 1, "num_buffers_warp_spec": 0, "num_consumer_groups": 0, "reg_dec_producer": 0, "reg_inc_consumer": 0}, "(1024, 4096, 14336, 14336, 1, 1208)": {"BLOCK_SIZE_M": 64, "BLOCK_SIZE_N": 128, "BLOCK_SIZE_K": 128, "GROUP_SIZE_M": 8, "A_load_order": 0, "waves_per_eu": 0, "matrix_instr_nonkdim": 16, "num_warps": 4, "num_ctas": 1, "num_stages": 2, "num_buffers_warp_spec": 0, "num_consumer_groups": 0, "reg_dec_producer": 0, "reg_inc_consumer": 0}, "(1024, 28672, 4096, 4096, 1, 1208)": {"BLOCK_SIZE_M": 128, "BLOCK_SIZE_N": 128, "BLOCK_SIZE_K": 128, "GROUP_SIZE_M": 8, "A_load_order": 0, "waves_per_eu": 0, "matrix_instr_nonkdim": 16, "num_warps": 4, "num_ctas": 1, "num_stages": 1, "num_buffers_warp_spec": 0, "num_consumer_groups": 0, "reg_dec_producer": 0, "reg_inc_consumer": 0}, "(128, 4096, 4096, 4096, 1, 1208)": {"BLOCK_SIZE_M": 64, "BLOCK_SIZE_N": 64, "BLOCK_SIZE_K": 256, "GROUP_SIZE_M": 8, "A_load_order": 0, "waves_per_eu": 4, "matrix_instr_nonkdim": 16, "num_warps": 8, "num_ctas": 1, "num_stages": 2, "num_buffers_warp_spec": 0, "num_consumer_groups": 0, "reg_dec_producer": 0, "reg_inc_consumer": 0}, "(128, 6144, 4096, 4096, 1, 1208)": {"BLOCK_SIZE_M": 64, "BLOCK_SIZE_N": 64, "BLOCK_SIZE_K": 256, "GROUP_SIZE_M": 8, "A_load_order": 0, "waves_per_eu": 4, "matrix_instr_nonkdim": 16, "num_warps": 8, "num_ctas": 1, "num_stages": 2, "num_buffers_warp_spec": 0, "num_consumer_groups": 0, "reg_dec_producer": 0, "reg_inc_consumer": 0}, "(128, 4096, 14336, 14336, 1, 1208)": {"BLOCK_SIZE_M": 64, "BLOCK_SIZE_N": 32, "BLOCK_SIZE_K": 256, "GROUP_SIZE_M": 8, "A_load_order": 0, "waves_per_eu": 2, "matrix_instr_nonkdim": 16, "num_warps": 8, "num_ctas": 1, "num_stages": 2, "num_buffers_warp_spec": 0, "num_consumer_groups": 0, "reg_dec_producer": 0, "reg_inc_consumer": 0}, "(128, 28672, 4096, 4096, 1, 1208)": {"BLOCK_SIZE_M": 64, "BLOCK_SIZE_N": 64, "BLOCK_SIZE_K": 256, "GROUP_SIZE_M": 8, "A_load_order": 0, "waves_per_eu": 4, "matrix_instr_nonkdim": 16, "num_warps": 8, "num_ctas": 1, "num_stages": 2, "num_buffers_warp_spec": 0, "num_consumer_groups": 0, "reg_dec_producer": 0, "reg_inc_consumer": 0}, "(256, 4096, 4096, 4096, 1, 1208)": {"BLOCK_SIZE_M": 64, "BLOCK_SIZE_N": 64, "BLOCK_SIZE_K": 256, "GROUP_SIZE_M": 8, "A_load_order": 0, "waves_per_eu": 4, "matrix_instr_nonkdim": 16, "num_warps": 8, "num_ctas": 1, "num_stages": 2, "num_buffers_warp_spec": 0, "num_consumer_groups": 0, "reg_dec_producer": 0, "reg_inc_consumer": 0}, "(256, 6144, 4096, 4096, 1, 1208)": {"BLOCK_SIZE_M": 128, "BLOCK_SIZE_N": 64, "BLOCK_SIZE_K": 128, "GROUP_SIZE_M": 8, "A_load_order": 0, "waves_per_eu": 2, "matrix_instr_nonkdim": 16, "num_warps": 8, "num_ctas": 1, "num_stages": 2, "num_buffers_warp_spec": 0, "num_consumer_groups": 0, "reg_dec_producer": 0, "reg_inc_consumer": 0}, "(256, 4096, 14336, 14336, 1, 1208)": {"BLOCK_SIZE_M": 64, "BLOCK_SIZE_N": 64, "BLOCK_SIZE_K": 256, "GROUP_SIZE_M": 8, "A_load_order": 0, "waves_per_eu": 0, "matrix_instr_nonkdim": 16, "num_warps": 8, "num_ctas": 1, "num_stages": 2, "num_buffers_warp_spec": 0, "num_consumer_groups": 0, "reg_dec_producer": 0, "reg_inc_consumer": 0}, "(256, 28672, 4096, 4096, 1, 1208)": {"BLOCK_SIZE_M": 128, "BLOCK_SIZE_N": 64, "BLOCK_SIZE_K": 128, "GROUP_SIZE_M": 8, "A_load_order": 0, "waves_per_eu": 0, "matrix_instr_nonkdim": 16, "num_warps": 4, "num_ctas": 1, "num_stages": 1, "num_buffers_warp_spec": 0, "num_consumer_groups": 0, "reg_dec_producer": 0, "reg_inc_consumer": 0}, "(512, 4096, 4096, 4096, 1, 1208)": {"BLOCK_SIZE_M": 128, "BLOCK_SIZE_N": 64, "BLOCK_SIZE_K": 128, "GROUP_SIZE_M": 8, "A_load_order": 0, "waves_per_eu": 2, "matrix_instr_nonkdim": 16, "num_warps": 8, "num_ctas": 1, "num_stages": 2, "num_buffers_warp_spec": 0, "num_consumer_groups": 0, "reg_dec_producer": 0, "reg_inc_consumer": 0}, "(512, 6144, 4096, 4096, 1, 1208)": {"BLOCK_SIZE_M": 128, "BLOCK_SIZE_N": 128, "BLOCK_SIZE_K": 128, "GROUP_SIZE_M": 8, "A_load_order": 0, "waves_per_eu": 4, "matrix_instr_nonkdim": 16, "num_warps": 8, "num_ctas": 1, "num_stages": 2, "num_buffers_warp_spec": 0, "num_consumer_groups": 0, "reg_dec_producer": 0, "reg_inc_consumer": 0}, "(512, 4096, 14336, 14336, 1, 1208)": {"BLOCK_SIZE_M": 64, "BLOCK_SIZE_N": 64, "BLOCK_SIZE_K": 256, "GROUP_SIZE_M": 8, "A_load_order": 0, "waves_per_eu": 0, "matrix_instr_nonkdim": 16, "num_warps": 4, "num_ctas": 1, "num_stages": 2, "num_buffers_warp_spec": 0, "num_consumer_groups": 0, "reg_dec_producer": 0, "reg_inc_consumer": 0}, "(512, 28672, 4096, 4096, 1, 1208)": {"BLOCK_SIZE_M": 128, "BLOCK_SIZE_N": 128, "BLOCK_SIZE_K": 128, "GROUP_SIZE_M": 8, "A_load_order": 0, "waves_per_eu": 4, "matrix_instr_nonkdim": 16, "num_warps": 8, "num_ctas": 1, "num_stages": 2, "num_buffers_warp_spec": 0, "num_consumer_groups": 0, "reg_dec_producer": 0, "reg_inc_consumer": 0}, "(4096, 4096, 4096, 4096, 1, 1208)": {"BLOCK_SIZE_M": 128, "BLOCK_SIZE_N": 256, "BLOCK_SIZE_K": 128, "GROUP_SIZE_M": 8, "A_load_order": 0, "waves_per_eu": 2, "matrix_instr_nonkdim": 16, "num_warps": 4, "num_ctas": 1, "num_stages": 1, "num_buffers_warp_spec": 0, "num_consumer_groups": 0, "reg_dec_producer": 0, "reg_inc_consumer": 0}, "(4096, 6144, 4096, 4096, 1, 1208)": {"BLOCK_SIZE_M": 128, "BLOCK_SIZE_N": 128, "BLOCK_SIZE_K": 128, "GROUP_SIZE_M": 8, "A_load_order": 0, "waves_per_eu": 0, "matrix_instr_nonkdim": 16, "num_warps": 4, "num_ctas": 1, "num_stages": 2, "num_buffers_warp_spec": 0, "num_consumer_groups": 0, "reg_dec_producer": 0, "reg_inc_consumer": 0}, "(4096, 4096, 14336, 14336, 1, 1208)": {"BLOCK_SIZE_M": 256, "BLOCK_SIZE_N": 128, "BLOCK_SIZE_K": 128, "GROUP_SIZE_M": 8, "A_load_order": 0, "waves_per_eu": 4, "matrix_instr_nonkdim": 16, "num_warps": 8, "num_ctas": 1, "num_stages": 1, "num_buffers_warp_spec": 0, "num_consumer_groups": 0, "reg_dec_producer": 0, "reg_inc_consumer": 0}, "(4096, 28672, 4096, 4096, 1, 1208)": {"BLOCK_SIZE_M": 256, "BLOCK_SIZE_N": 128, "BLOCK_SIZE_K": 128, "GROUP_SIZE_M": 8, "A_load_order": 0, "waves_per_eu": 4, "matrix_instr_nonkdim": 16, "num_warps": 8, "num_ctas": 1, "num_stages": 1, "num_buffers_warp_spec": 0, "num_consumer_groups": 0, "reg_dec_producer": 0, "reg_inc_consumer": 0}, "(2048, 4096, 4096, 4096, 1, 1208)": {"BLOCK_SIZE_M": 128, "BLOCK_SIZE_N": 128, "BLOCK_SIZE_K": 128, "GROUP_SIZE_M": 8, "A_load_order": 0, "waves_per_eu": 0, "matrix_instr_nonkdim": 16, "num_warps": 4, "num_ctas": 1, "num_stages": 2, "num_buffers_warp_spec": 0, "num_consumer_groups": 0, "reg_dec_producer": 0, "reg_inc_consumer": 0}, "(2048, 6144, 4096, 4096, 1, 1208)": {"BLOCK_SIZE_M": 128, "BLOCK_SIZE_N": 128, "BLOCK_SIZE_K": 128, "GROUP_SIZE_M": 8, "A_load_order": 0, "waves_per_eu": 0, "matrix_instr_nonkdim": 16, "num_warps": 8, "num_ctas": 1, "num_stages": 2, "num_buffers_warp_spec": 0, "num_consumer_groups": 0, "reg_dec_producer": 0, "reg_inc_consumer": 0}, "(2048, 4096, 14336, 14336, 1, 1208)": {"BLOCK_SIZE_M": 128, "BLOCK_SIZE_N": 128, "BLOCK_SIZE_K": 128, "GROUP_SIZE_M": 8, "A_load_order": 0, "waves_per_eu": 0, "matrix_instr_nonkdim": 16, "num_warps": 4, "num_ctas": 1, "num_stages": 2, "num_buffers_warp_spec": 0, "num_consumer_groups": 0, "reg_dec_producer": 0, "reg_inc_consumer": 0}, "(2048, 28672, 4096, 4096, 1, 1208)": {"BLOCK_SIZE_M": 256, "BLOCK_SIZE_N": 128, "BLOCK_SIZE_K": 128, "GROUP_SIZE_M": 8, "A_load_order": 0, "waves_per_eu": 2, "matrix_instr_nonkdim": 16, "num_warps": 4, "num_ctas": 1, "num_stages": 1, "num_buffers_warp_spec": 0, "num_consumer_groups": 0, "reg_dec_producer": 0, "reg_inc_consumer": 0}, "(3072, 4096, 4096, 4096, 1, 1208)": {"BLOCK_SIZE_M": 128, "BLOCK_SIZE_N": 128, "BLOCK_SIZE_K": 128, "GROUP_SIZE_M": 8, "A_load_order": 0, "waves_per_eu": 4, "matrix_instr_nonkdim": 16, "num_warps": 8, "num_ctas": 1, "num_stages": 2, "num_buffers_warp_spec": 0, "num_consumer_groups": 0, "reg_dec_producer": 0, "reg_inc_consumer": 0}, "(1536, 4096, 4096, 4096, 1, 1208)": {"BLOCK_SIZE_M": 128, "BLOCK_SIZE_N": 128, "BLOCK_SIZE_K": 128, "GROUP_SIZE_M": 8, "A_load_order": 0, "waves_per_eu": 0, "matrix_instr_nonkdim": 16, "num_warps": 4, "num_ctas": 1, "num_stages": 2, "num_buffers_warp_spec": 0, "num_consumer_groups": 0, "reg_dec_producer": 0, "reg_inc_consumer": 0}, "(768, 4096, 4096, 4096, 1, 1208)": {"BLOCK_SIZE_M": 128, "BLOCK_SIZE_N": 128, "BLOCK_SIZE_K": 128, "GROUP_SIZE_M": 8, "A_load_order": 0, "waves_per_eu": 2, "matrix_instr_nonkdim": 16, "num_warps": 8, "num_ctas": 1, "num_stages": 2, "num_buffers_warp_spec": 0, "num_consumer_groups": 0, "reg_dec_producer": 0, "reg_inc_consumer": 0}, "(384, 4096, 4096, 4096, 1, 1208)": {"BLOCK_SIZE_M": 128, "BLOCK_SIZE_N": 64, "BLOCK_SIZE_K": 128, "GROUP_SIZE_M": 8, "A_load_order": 0, "waves_per_eu": 0, "matrix_instr_nonkdim": 16, "num_warps": 8, "num_ctas": 1, "num_stages": 2, "num_buffers_warp_spec": 0, "num_consumer_groups": 0, "reg_dec_producer": 0, "reg_inc_consumer": 0}, "(192, 4096, 4096, 4096, 1, 1208)": {"BLOCK_SIZE_M": 64, "BLOCK_SIZE_N": 64, "BLOCK_SIZE_K": 256, "GROUP_SIZE_M": 8, "A_load_order": 0, "waves_per_eu": 4, "matrix_instr_nonkdim": 16, "num_warps": 8, "num_ctas": 1, "num_stages": 2, "num_buffers_warp_spec": 0, "num_consumer_groups": 0, "reg_dec_producer": 0, "reg_inc_consumer": 0}, "(96, 4096, 4096, 4096, 1, 1208)": {"BLOCK_SIZE_M": 64, "BLOCK_SIZE_N": 64, "BLOCK_SIZE_K": 256, "GROUP_SIZE_M": 8, "A_load_order": 0, "waves_per_eu": 4, "matrix_instr_nonkdim": 16, "num_warps": 8, "num_ctas": 1, "num_stages": 2, "num_buffers_warp_spec": 0, "num_consumer_groups": 0, "reg_dec_producer": 0, "reg_inc_consumer": 0}, "(3072, 6144, 4096, 4096, 1, 1208)": {"BLOCK_SIZE_M": 256, "BLOCK_SIZE_N": 128, "BLOCK_SIZE_K": 128, "GROUP_SIZE_M": 8, "A_load_order": 0, "waves_per_eu": 2, "matrix_instr_nonkdim": 16, "num_warps": 4, "num_ctas": 1, "num_stages": 1, "num_buffers_warp_spec": 0, "num_consumer_groups": 0, "reg_dec_producer": 0, "reg_inc_consumer": 0}, "(1536, 6144, 4096, 4096, 1, 1208)": {"BLOCK_SIZE_M": 128, "BLOCK_SIZE_N": 128, "BLOCK_SIZE_K": 128, "GROUP_SIZE_M": 8, "A_load_order": 0, "waves_per_eu": 0, "matrix_instr_nonkdim": 16, "num_warps": 4, "num_ctas": 1, "num_stages": 2, "num_buffers_warp_spec": 0, "num_consumer_groups": 0, "reg_dec_producer": 0, "reg_inc_consumer": 0}, "(768, 6144, 4096, 4096, 1, 1208)": {"BLOCK_SIZE_M": 128, "BLOCK_SIZE_N": 128, "BLOCK_SIZE_K": 128, "GROUP_SIZE_M": 8, "A_load_order": 0, "waves_per_eu": 0, "matrix_instr_nonkdim": 16, "num_warps": 8, "num_ctas": 1, "num_stages": 2, "num_buffers_warp_spec": 0, "num_consumer_groups": 0, "reg_dec_producer": 0, "reg_inc_consumer": 0}, "(384, 6144, 4096, 4096, 1, 1208)": {"BLOCK_SIZE_M": 128, "BLOCK_SIZE_N": 64, "BLOCK_SIZE_K": 128, "GROUP_SIZE_M": 8, "A_load_order": 0, "waves_per_eu": 2, "matrix_instr_nonkdim": 16, "num_warps": 8, "num_ctas": 1, "num_stages": 2, "num_buffers_warp_spec": 0, "num_consumer_groups": 0, "reg_dec_producer": 0, "reg_inc_consumer": 0}, "(192, 6144, 4096, 4096, 1, 1208)": {"BLOCK_SIZE_M": 64, "BLOCK_SIZE_N": 64, "BLOCK_SIZE_K": 128, "GROUP_SIZE_M": 8, "A_load_order": 0, "waves_per_eu": 0, "matrix_instr_nonkdim": 16, "num_warps": 8, "num_ctas": 1, "num_stages": 2, "num_buffers_warp_spec": 0, "num_consumer_groups": 0, "reg_dec_producer": 0, "reg_inc_consumer": 0}, "(96, 6144, 4096, 4096, 1, 1208)": {"BLOCK_SIZE_M": 64, "BLOCK_SIZE_N": 64, "BLOCK_SIZE_K": 256, "GROUP_SIZE_M": 8, "A_load_order": 0, "waves_per_eu": 4, "matrix_instr_nonkdim": 16, "num_warps": 8, "num_ctas": 1, "num_stages": 2, "num_buffers_warp_spec": 0, "num_consumer_groups": 0, "reg_dec_producer": 0, "reg_inc_consumer": 0}, "(3072, 4096, 14336, 14336, 1, 1208)": {"BLOCK_SIZE_M": 128, "BLOCK_SIZE_N": 128, "BLOCK_SIZE_K": 128, "GROUP_SIZE_M": 8, "A_load_order": 0, "waves_per_eu": 0, "matrix_instr_nonkdim": 16, "num_warps": 4, "num_ctas": 1, "num_stages": 1, "num_buffers_warp_spec": 0, "num_consumer_groups": 0, "reg_dec_producer": 0, "reg_inc_consumer": 0}, "(1536, 4096, 14336, 14336, 1, 1208)": {"BLOCK_SIZE_M": 128, "BLOCK_SIZE_N": 128, "BLOCK_SIZE_K": 128, "GROUP_SIZE_M": 8, "A_load_order": 0, "waves_per_eu": 0, "matrix_instr_nonkdim": 16, "num_warps": 4, "num_ctas": 1, "num_stages": 2, "num_buffers_warp_spec": 0, "num_consumer_groups": 0, "reg_dec_producer": 0, "reg_inc_consumer": 0}, "(768, 4096, 14336, 14336, 1, 1208)": {"BLOCK_SIZE_M": 128, "BLOCK_SIZE_N": 128, "BLOCK_SIZE_K": 128, "GROUP_SIZE_M": 8, "A_load_order": 0, "waves_per_eu": 2, "matrix_instr_nonkdim": 16, "num_warps": 8, "num_ctas": 1, "num_stages": 2, "num_buffers_warp_spec": 0, "num_consumer_groups": 0, "reg_dec_producer": 0, "reg_inc_consumer": 0}, "(384, 4096, 14336, 14336, 1, 1208)": {"BLOCK_SIZE_M": 128, "BLOCK_SIZE_N": 64, "BLOCK_SIZE_K": 128, "GROUP_SIZE_M": 8, "A_load_order": 0, "waves_per_eu": 0, "matrix_instr_nonkdim": 16, "num_warps": 8, "num_ctas": 1, "num_stages": 2, "num_buffers_warp_spec": 0, "num_consumer_groups": 0, "reg_dec_producer": 0, "reg_inc_consumer": 0}, "(192, 4096, 14336, 14336, 1, 1208)": {"BLOCK_SIZE_M": 64, "BLOCK_SIZE_N": 64, "BLOCK_SIZE_K": 256, "GROUP_SIZE_M": 8, "A_load_order": 0, "waves_per_eu": 2, "matrix_instr_nonkdim": 16, "num_warps": 8, "num_ctas": 1, "num_stages": 2, "num_buffers_warp_spec": 0, "num_consumer_groups": 0, "reg_dec_producer": 0, "reg_inc_consumer": 0}, "(96, 4096, 14336, 14336, 1, 1208)": {"BLOCK_SIZE_M": 64, "BLOCK_SIZE_N": 32, "BLOCK_SIZE_K": 256, "GROUP_SIZE_M": 8, "A_load_order": 0, "waves_per_eu": 2, "matrix_instr_nonkdim": 16, "num_warps": 8, "num_ctas": 1, "num_stages": 2, "num_buffers_warp_spec": 0, "num_consumer_groups": 0, "reg_dec_producer": 0, "reg_inc_consumer": 0}, "(3072, 28672, 4096, 4096, 1, 1208)": {"BLOCK_SIZE_M": 256, "BLOCK_SIZE_N": 128, "BLOCK_SIZE_K": 128, "GROUP_SIZE_M": 8, "A_load_order": 0, "waves_per_eu": 4, "matrix_instr_nonkdim": 16, "num_warps": 8, "num_ctas": 1, "num_stages": 1, "num_buffers_warp_spec": 0, "num_consumer_groups": 0, "reg_dec_producer": 0, "reg_inc_consumer": 0}, "(1536, 28672, 4096, 4096, 1, 1208)": {"BLOCK_SIZE_M": 128, "BLOCK_SIZE_N": 128, "BLOCK_SIZE_K": 128, "GROUP_SIZE_M": 8, "A_load_order": 0, "waves_per_eu": 0, "matrix_instr_nonkdim": 16, "num_warps": 4, "num_ctas": 1, "num_stages": 1, "num_buffers_warp_spec": 0, "num_consumer_groups": 0, "reg_dec_producer": 0, "reg_inc_consumer": 0}, "(768, 28672, 4096, 4096, 1, 1208)": {"BLOCK_SIZE_M": 128, "BLOCK_SIZE_N": 128, "BLOCK_SIZE_K": 128, "GROUP_SIZE_M": 8, "A_load_order": 0, "waves_per_eu": 0, "matrix_instr_nonkdim": 16, "num_warps": 4, "num_ctas": 1, "num_stages": 1, "num_buffers_warp_spec": 0, "num_consumer_groups": 0, "reg_dec_producer": 0, "reg_inc_consumer": 0}, "(384, 28672, 4096, 4096, 1, 1208)": {"BLOCK_SIZE_M": 128, "BLOCK_SIZE_N": 128, "BLOCK_SIZE_K": 128, "GROUP_SIZE_M": 8, "A_load_order": 0, "waves_per_eu": 0, "matrix_instr_nonkdim": 16, "num_warps": 4, "num_ctas": 1, "num_stages": 1, "num_buffers_warp_spec": 0, "num_consumer_groups": 0, "reg_dec_producer": 0, "reg_inc_consumer": 0}, "(192, 28672, 4096, 4096, 1, 1208)": {"BLOCK_SIZE_M": 128, "BLOCK_SIZE_N": 128, "BLOCK_SIZE_K": 128, "GROUP_SIZE_M": 8, "A_load_order": 0, "waves_per_eu": 0, "matrix_instr_nonkdim": 16, "num_warps": 4, "num_ctas": 1, "num_stages": 2, "num_buffers_warp_spec": 0, "num_consumer_groups": 0, "reg_dec_producer": 0, "reg_inc_consumer": 0}, "(96, 28672, 4096, 4096, 1, 1208)": {"BLOCK_SIZE_M": 64, "BLOCK_SIZE_N": 64, "BLOCK_SIZE_K": 256, "GROUP_SIZE_M": 8, "A_load_order": 0, "waves_per_eu": 2, "matrix_instr_nonkdim": 16, "num_warps": 8, "num_ctas": 1, "num_stages": 2, "num_buffers_warp_spec": 0, "num_consumer_groups": 0, "reg_dec_producer": 0, "reg_inc_consumer": 0}, "(4096, 3584, 3584, 3584, 1, 408)": {"BLOCK_SIZE_M": 256, "BLOCK_SIZE_N": 256, "BLOCK_SIZE_K": 64, "GROUP_SIZE_M": 8, "A_load_order": 0, "waves_per_eu": 0, "matrix_instr_nonkdim": 16, "num_warps": 8, "num_ctas": 1, "num_stages": 2, "num_buffers_warp_spec": 0, "num_consumer_groups": 0, "reg_dec_producer": 0, "reg_inc_consumer": 0}, "(4096, 4608, 3584, 3584, 1, 408)": {"BLOCK_SIZE_M": 128, "BLOCK_SIZE_N": 256, "BLOCK_SIZE_K": 64, "GROUP_SIZE_M": 8, "A_load_order": 0, "waves_per_eu": 2, "matrix_instr_nonkdim": 16, "num_warps": 4, "num_ctas": 1, "num_stages": 2, "num_buffers_warp_spec": 0, "num_consumer_groups": 0, "reg_dec_producer": 0, "reg_inc_consumer": 0}, "(4096, 3584, 18944, 18944, 1, 408)": {"BLOCK_SIZE_M": 256, "BLOCK_SIZE_N": 128, "BLOCK_SIZE_K": 128, "GROUP_SIZE_M": 8, "A_load_order": 0, "waves_per_eu": 4, "matrix_instr_nonkdim": 16, "num_warps": 8, "num_ctas": 1, "num_stages": 1, "num_buffers_warp_spec": 0, "num_consumer_groups": 0, "reg_dec_producer": 0, "reg_inc_consumer": 0}, "(4096, 37888, 3584, 3584, 1, 408)": {"BLOCK_SIZE_M": 256, "BLOCK_SIZE_N": 128, "BLOCK_SIZE_K": 128, "GROUP_SIZE_M": 8, "A_load_order": 0, "waves_per_eu": 2, "matrix_instr_nonkdim": 16, "num_warps": 8, "num_ctas": 1, "num_stages": 1, "num_buffers_warp_spec": 0, "num_consumer_groups": 0, "reg_dec_producer": 0, "reg_inc_consumer": 0}, "(3072, 3584, 3584, 3584, 1, 408)": {"BLOCK_SIZE_M": 256, "BLOCK_SIZE_N": 128, "BLOCK_SIZE_K": 64, "GROUP_SIZE_M": 8, "A_load_order": 0, "waves_per_eu": 2, "matrix_instr_nonkdim": 16, "num_warps": 4, "num_ctas": 1, "num_stages": 2, "num_buffers_warp_spec": 0, "num_consumer_groups": 0, "reg_dec_producer": 0, "reg_inc_consumer": 0}, "(1536, 3584, 3584, 3584, 1, 408)": {"BLOCK_SIZE_M": 128, "BLOCK_SIZE_N": 128, "BLOCK_SIZE_K": 64, "GROUP_SIZE_M": 8, "A_load_order": 0, "waves_per_eu": 2, "matrix_instr_nonkdim": 16, "num_warps": 4, "num_ctas": 1, "num_stages": 2, "num_buffers_warp_spec": 0, "num_consumer_groups": 0, "reg_dec_producer": 0, "reg_inc_consumer": 0}, "(768, 3584, 3584, 3584, 1, 408)": {"BLOCK_SIZE_M": 128, "BLOCK_SIZE_N": 128, "BLOCK_SIZE_K": 128, "GROUP_SIZE_M": 8, "A_load_order": 0, "waves_per_eu": 4, "matrix_instr_nonkdim": 16, "num_warps": 8, "num_ctas": 1, "num_stages": 2, "num_buffers_warp_spec": 0, "num_consumer_groups": 0, "reg_dec_producer": 0, "reg_inc_consumer": 0}, "(384, 3584, 3584, 3584, 1, 408)": {"BLOCK_SIZE_M": 128, "BLOCK_SIZE_N": 64, "BLOCK_SIZE_K": 128, "GROUP_SIZE_M": 8, "A_load_order": 0, "waves_per_eu": 2, "matrix_instr_nonkdim": 16, "num_warps": 8, "num_ctas": 1, "num_stages": 2, "num_buffers_warp_spec": 0, "num_consumer_groups": 0, "reg_dec_producer": 0, "reg_inc_consumer": 0}, "(192, 3584, 3584, 3584, 1, 408)": {"BLOCK_SIZE_M": 64, "BLOCK_SIZE_N": 64, "BLOCK_SIZE_K": 128, "GROUP_SIZE_M": 8, "A_load_order": 0, "waves_per_eu": 2, "matrix_instr_nonkdim": 16, "num_warps": 8, "num_ctas": 1, "num_stages": 2, "num_buffers_warp_spec": 0, "num_consumer_groups": 0, "reg_dec_producer": 0, "reg_inc_consumer": 0}, "(96, 3584, 3584, 3584, 1, 408)": {"BLOCK_SIZE_M": 64, "BLOCK_SIZE_N": 64, "BLOCK_SIZE_K": 256, "GROUP_SIZE_M": 8, "A_load_order": 0, "waves_per_eu": 0, "matrix_instr_nonkdim": 16, "num_warps": 8, "num_ctas": 1, "num_stages": 2, "num_buffers_warp_spec": 0, "num_consumer_groups": 0, "reg_dec_producer": 0, "reg_inc_consumer": 0}, "(3072, 4608, 3584, 3584, 1, 408)": {"BLOCK_SIZE_M": 256, "BLOCK_SIZE_N": 256, "BLOCK_SIZE_K": 64, "GROUP_SIZE_M": 8, "A_load_order": 0, "waves_per_eu": 2, "matrix_instr_nonkdim": 16, "num_warps": 8, "num_ctas": 1, "num_stages": 2, "num_buffers_warp_spec": 0, "num_consumer_groups": 0, "reg_dec_producer": 0, "reg_inc_consumer": 0}, "(1536, 4608, 3584, 3584, 1, 408)": {"BLOCK_SIZE_M": 128, "BLOCK_SIZE_N": 128, "BLOCK_SIZE_K": 128, "GROUP_SIZE_M": 8, "A_load_order": 0, "waves_per_eu": 2, "matrix_instr_nonkdim": 16, "num_warps": 4, "num_ctas": 1, "num_stages": 1, "num_buffers_warp_spec": 0, "num_consumer_groups": 0, "reg_dec_producer": 0, "reg_inc_consumer": 0}, "(768, 4608, 3584, 3584, 1, 408)": {"BLOCK_SIZE_M": 128, "BLOCK_SIZE_N": 128, "BLOCK_SIZE_K": 128, "GROUP_SIZE_M": 8, "A_load_order": 0, "waves_per_eu": 0, "matrix_instr_nonkdim": 16, "num_warps": 8, "num_ctas": 1, "num_stages": 2, "num_buffers_warp_spec": 0, "num_consumer_groups": 0, "reg_dec_producer": 0, "reg_inc_consumer": 0}, "(384, 4608, 3584, 3584, 1, 408)": {"BLOCK_SIZE_M": 128, "BLOCK_SIZE_N": 64, "BLOCK_SIZE_K": 128, "GROUP_SIZE_M": 8, "A_load_order": 0, "waves_per_eu": 2, "matrix_instr_nonkdim": 16, "num_warps": 8, "num_ctas": 1, "num_stages": 2, "num_buffers_warp_spec": 0, "num_consumer_groups": 0, "reg_dec_producer": 0, "reg_inc_consumer": 0}, "(192, 4608, 3584, 3584, 1, 408)": {"BLOCK_SIZE_M": 64, "BLOCK_SIZE_N": 64, "BLOCK_SIZE_K": 128, "GROUP_SIZE_M": 8, "A_load_order": 0, "waves_per_eu": 0, "matrix_instr_nonkdim": 16, "num_warps": 8, "num_ctas": 1, "num_stages": 2, "num_buffers_warp_spec": 0, "num_consumer_groups": 0, "reg_dec_producer": 0, "reg_inc_consumer": 0}, "(96, 4608, 3584, 3584, 1, 408)": {"BLOCK_SIZE_M": 64, "BLOCK_SIZE_N": 64, "BLOCK_SIZE_K": 256, "GROUP_SIZE_M": 8, "A_load_order": 0, "waves_per_eu": 4, "matrix_instr_nonkdim": 16, "num_warps": 8, "num_ctas": 1, "num_stages": 2, "num_buffers_warp_spec": 0, "num_consumer_groups": 0, "reg_dec_producer": 0, "reg_inc_consumer": 0}, "(3072, 3584, 18944, 18944, 1, 408)": {"BLOCK_SIZE_M": 128, "BLOCK_SIZE_N": 128, "BLOCK_SIZE_K": 128, "GROUP_SIZE_M": 8, "A_load_order": 0, "waves_per_eu": 2, "matrix_instr_nonkdim": 16, "num_warps": 4, "num_ctas": 1, "num_stages": 1, "num_buffers_warp_spec": 0, "num_consumer_groups": 0, "reg_dec_producer": 0, "reg_inc_consumer": 0}, "(1536, 3584, 18944, 18944, 1, 408)": {"BLOCK_SIZE_M": 128, "BLOCK_SIZE_N": 128, "BLOCK_SIZE_K": 128, "GROUP_SIZE_M": 8, "A_load_order": 0, "waves_per_eu": 0, "matrix_instr_nonkdim": 16, "num_warps": 4, "num_ctas": 1, "num_stages": 2, "num_buffers_warp_spec": 0, "num_consumer_groups": 0, "reg_dec_producer": 0, "reg_inc_consumer": 0}, "(768, 3584, 18944, 18944, 1, 408)": {"BLOCK_SIZE_M": 128, "BLOCK_SIZE_N": 128, "BLOCK_SIZE_K": 128, "GROUP_SIZE_M": 8, "A_load_order": 0, "waves_per_eu": 2, "matrix_instr_nonkdim": 16, "num_warps": 8, "num_ctas": 1, "num_stages": 2, "num_buffers_warp_spec": 0, "num_consumer_groups": 0, "reg_dec_producer": 0, "reg_inc_consumer": 0}, "(384, 3584, 18944, 18944, 1, 408)": {"BLOCK_SIZE_M": 64, "BLOCK_SIZE_N": 64, "BLOCK_SIZE_K": 256, "GROUP_SIZE_M": 8, "A_load_order": 0, "waves_per_eu": 0, "matrix_instr_nonkdim": 16, "num_warps": 4, "num_ctas": 1, "num_stages": 2, "num_buffers_warp_spec": 0, "num_consumer_groups": 0, "reg_dec_producer": 0, "reg_inc_consumer": 0}, "(192, 3584, 18944, 18944, 1, 408)": {"BLOCK_SIZE_M": 64, "BLOCK_SIZE_N": 64, "BLOCK_SIZE_K": 256, "GROUP_SIZE_M": 8, "A_load_order": 0, "waves_per_eu": 4, "matrix_instr_nonkdim": 16, "num_warps": 8, "num_ctas": 1, "num_stages": 2, "num_buffers_warp_spec": 0, "num_consumer_groups": 0, "reg_dec_producer": 0, "reg_inc_consumer": 0}, "(96, 3584, 18944, 18944, 1, 408)": {"BLOCK_SIZE_M": 64, "BLOCK_SIZE_N": 32, "BLOCK_SIZE_K": 256, "GROUP_SIZE_M": 8, "A_load_order": 0, "waves_per_eu": 2, "matrix_instr_nonkdim": 16, "num_warps": 8, "num_ctas": 1, "num_stages": 2, "num_buffers_warp_spec": 0, "num_consumer_groups": 0, "reg_dec_producer": 0, "reg_inc_consumer": 0}, "(3072, 37888, 3584, 3584, 1, 408)": {"BLOCK_SIZE_M": 256, "BLOCK_SIZE_N": 128, "BLOCK_SIZE_K": 128, "GROUP_SIZE_M": 8, "A_load_order": 0, "waves_per_eu": 4, "matrix_instr_nonkdim": 16, "num_warps": 8, "num_ctas": 1, "num_stages": 1, "num_buffers_warp_spec": 0, "num_consumer_groups": 0, "reg_dec_producer": 0, "reg_inc_consumer": 0}, "(1536, 37888, 3584, 3584, 1, 408)": {"BLOCK_SIZE_M": 256, "BLOCK_SIZE_N": 128, "BLOCK_SIZE_K": 128, "GROUP_SIZE_M": 8, "A_load_order": 0, "waves_per_eu": 4, "matrix_instr_nonkdim": 16, "num_warps": 8, "num_ctas": 1, "num_stages": 1, "num_buffers_warp_spec": 0, "num_consumer_groups": 0, "reg_dec_producer": 0, "reg_inc_consumer": 0}, "(768, 37888, 3584, 3584, 1, 408)": {"BLOCK_SIZE_M": 256, "BLOCK_SIZE_N": 128, "BLOCK_SIZE_K": 128, "GROUP_SIZE_M": 8, "A_load_order": 0, "waves_per_eu": 2, "matrix_instr_nonkdim": 16, "num_warps": 8, "num_ctas": 1, "num_stages": 1, "num_buffers_warp_spec": 0, "num_consumer_groups": 0, "reg_dec_producer": 0, "reg_inc_consumer": 0}, "(384, 37888, 3584, 3584, 1, 408)": {"BLOCK_SIZE_M": 128, "BLOCK_SIZE_N": 128, "BLOCK_SIZE_K": 128, "GROUP_SIZE_M": 8, "A_load_order": 0, "waves_per_eu": 4, "matrix_instr_nonkdim": 16, "num_warps": 8, "num_ctas": 1, "num_stages": 2, "num_buffers_warp_spec": 0, "num_consumer_groups": 0, "reg_dec_producer": 0, "reg_inc_consumer": 0}, "(192, 37888, 3584, 3584, 1, 408)": {"BLOCK_SIZE_M": 128, "BLOCK_SIZE_N": 128, "BLOCK_SIZE_K": 128, "GROUP_SIZE_M": 8, "A_load_order": 0, "waves_per_eu": 4, "matrix_instr_nonkdim": 16, "num_warps": 8, "num_ctas": 1, "num_stages": 2, "num_buffers_warp_spec": 0, "num_consumer_groups": 0, "reg_dec_producer": 0, "reg_inc_consumer": 0}, "(96, 37888, 3584, 3584, 1, 408)": {"BLOCK_SIZE_M": 128, "BLOCK_SIZE_N": 128, "BLOCK_SIZE_K": 128, "GROUP_SIZE_M": 8, "A_load_order": 0, "waves_per_eu": 4, "matrix_instr_nonkdim": 16, "num_warps": 8, "num_ctas": 1, "num_stages": 2, "num_buffers_warp_spec": 0, "num_consumer_groups": 0, "reg_dec_producer": 0, "reg_inc_consumer": 0}, "(4096, 3584, 3584, 128, 8, 104)": {"BLOCK_SIZE_M": 256, "BLOCK_SIZE_N": 128, "BLOCK_SIZE_K": 32, "GROUP_SIZE_M": 8, "A_load_order": 0, "waves_per_eu": 2, "matrix_instr_nonkdim": 16, "num_warps": 4, "num_ctas": 1, "num_stages": 1, "num_buffers_warp_spec": 0, "num_consumer_groups": 0, "reg_dec_producer": 0, "reg_inc_consumer": 0}, "(3072, 3584, 3584, 128, 8, 104)": {"BLOCK_SIZE_M": 256, "BLOCK_SIZE_N": 128, "BLOCK_SIZE_K": 32, "GROUP_SIZE_M": 8, "A_load_order": 0, "waves_per_eu": 2, "matrix_instr_nonkdim": 16, "num_warps": 4, "num_ctas": 1, "num_stages": 1, "num_buffers_warp_spec": 0, "num_consumer_groups": 0, "reg_dec_producer": 0, "reg_inc_consumer": 0}, "(1536, 3584, 3584, 128, 8, 104)": {"BLOCK_SIZE_M": 256, "BLOCK_SIZE_N": 64, "BLOCK_SIZE_K": 64, "GROUP_SIZE_M": 8, "A_load_order": 0, "waves_per_eu": 2, "matrix_instr_nonkdim": 16, "num_warps": 4, "num_ctas": 1, "num_stages": 1, "num_buffers_warp_spec": 0, "num_consumer_groups": 0, "reg_dec_producer": 0, "reg_inc_consumer": 0}, "(768, 3584, 3584, 128, 8, 104)": {"BLOCK_SIZE_M": 128, "BLOCK_SIZE_N": 64, "BLOCK_SIZE_K": 64, "GROUP_SIZE_M": 8, "A_load_order": 0, "waves_per_eu": 4, "matrix_instr_nonkdim": 16, "num_warps": 4, "num_ctas": 1, "num_stages": 1, "num_buffers_warp_spec": 0, "num_consumer_groups": 0, "reg_dec_producer": 0, "reg_inc_consumer": 0}, "(384, 3584, 3584, 128, 8, 104)": {"BLOCK_SIZE_M": 64, "BLOCK_SIZE_N": 32, "BLOCK_SIZE_K": 128, "GROUP_SIZE_M": 8, "A_load_order": 0, "waves_per_eu": 4, "matrix_instr_nonkdim": 16, "num_warps": 4, "num_ctas": 1, "num_stages": 1, "num_buffers_warp_spec": 0, "num_consumer_groups": 0, "reg_dec_producer": 0, "reg_inc_consumer": 0}, "(192, 3584, 3584, 128, 8, 104)": {"BLOCK_SIZE_M": 64, "BLOCK_SIZE_N": 32, "BLOCK_SIZE_K": 64, "GROUP_SIZE_M": 8, "A_load_order": 0, "waves_per_eu": 2, "matrix_instr_nonkdim": 16, "num_warps": 4, "num_ctas": 1, "num_stages": 2, "num_buffers_warp_spec": 0, "num_consumer_groups": 0, "reg_dec_producer": 0, "reg_inc_consumer": 0}, "(96, 3584, 3584, 128, 8, 104)": {"BLOCK_SIZE_M": 64, "BLOCK_SIZE_N": 32, "BLOCK_SIZE_K": 64, "GROUP_SIZE_M": 8, "A_load_order": 0, "waves_per_eu": 0, "matrix_instr_nonkdim": 16, "num_warps": 4, "num_ctas": 1, "num_stages": 2, "num_buffers_warp_spec": 0, "num_consumer_groups": 0, "reg_dec_producer": 0, "reg_inc_consumer": 0}, "(4096, 4608, 3584, 128, 8, 104)": {"BLOCK_SIZE_M": 256, "BLOCK_SIZE_N": 128, "BLOCK_SIZE_K": 32, "GROUP_SIZE_M": 8, "A_load_order": 0, "waves_per_eu": 2, "matrix_instr_nonkdim": 16, "num_warps": 4, "num_ctas": 1, "num_stages": 1, "num_buffers_warp_spec": 0, "num_consumer_groups": 0, "reg_dec_producer": 0, "reg_inc_consumer": 0}, "(3072, 4608, 3584, 128, 8, 104)": {"BLOCK_SIZE_M": 256, "BLOCK_SIZE_N": 128, "BLOCK_SIZE_K": 32, "GROUP_SIZE_M": 8, "A_load_order": 0, "waves_per_eu": 2, "matrix_instr_nonkdim": 16, "num_warps": 4, "num_ctas": 1, "num_stages": 1, "num_buffers_warp_spec": 0, "num_consumer_groups": 0, "reg_dec_producer": 0, "reg_inc_consumer": 0}, "(1536, 4608, 3584, 128, 8, 104)": {"BLOCK_SIZE_M": 128, "BLOCK_SIZE_N": 64, "BLOCK_SIZE_K": 64, "GROUP_SIZE_M": 8, "A_load_order": 0, "waves_per_eu": 4, "matrix_instr_nonkdim": 16, "num_warps": 4, "num_ctas": 1, "num_stages": 1, "num_buffers_warp_spec": 0, "num_consumer_groups": 0, "reg_dec_producer": 0, "reg_inc_consumer": 0}, "(768, 4608, 3584, 128, 8, 104)": {"BLOCK_SIZE_M": 128, "BLOCK_SIZE_N": 64, "BLOCK_SIZE_K": 64, "GROUP_SIZE_M": 8, "A_load_order": 0, "waves_per_eu": 4, "matrix_instr_nonkdim": 16, "num_warps": 4, "num_ctas": 1, "num_stages": 1, "num_buffers_warp_spec": 0, "num_consumer_groups": 0, "reg_dec_producer": 0, "reg_inc_consumer": 0}, "(384, 4608, 3584, 128, 8, 104)": {"BLOCK_SIZE_M": 64, "BLOCK_SIZE_N": 32, "BLOCK_SIZE_K": 128, "GROUP_SIZE_M": 8, "A_load_order": 0, "waves_per_eu": 4, "matrix_instr_nonkdim": 16, "num_warps": 4, "num_ctas": 1, "num_stages": 1, "num_buffers_warp_spec": 0, "num_consumer_groups": 0, "reg_dec_producer": 0, "reg_inc_consumer": 0}, "(192, 4608, 3584, 128, 8, 104)": {"BLOCK_SIZE_M": 64, "BLOCK_SIZE_N": 64, "BLOCK_SIZE_K": 64, "GROUP_SIZE_M": 8, "A_load_order": 0, "waves_per_eu": 0, "matrix_instr_nonkdim": 16, "num_warps": 8, "num_ctas": 1, "num_stages": 2, "num_buffers_warp_spec": 0, "num_consumer_groups": 0, "reg_dec_producer": 0, "reg_inc_consumer": 0}, "(96, 4608, 3584, 128, 8, 104)": {"BLOCK_SIZE_M": 64, "BLOCK_SIZE_N": 32, "BLOCK_SIZE_K": 64, "GROUP_SIZE_M": 8, "A_load_order": 0, "waves_per_eu": 0, "matrix_instr_nonkdim": 16, "num_warps": 4, "num_ctas": 1, "num_stages": 2, "num_buffers_warp_spec": 0, "num_consumer_groups": 0, "reg_dec_producer": 0, "reg_inc_consumer": 0}, "(4096, 3584, 18944, 128, 8, 104)": {"BLOCK_SIZE_M": 256, "BLOCK_SIZE_N": 128, "BLOCK_SIZE_K": 32, "GROUP_SIZE_M": 8, "A_load_order": 0, "waves_per_eu": 2, "matrix_instr_nonkdim": 16, "num_warps": 4, "num_ctas": 1, "num_stages": 1, "num_buffers_warp_spec": 0, "num_consumer_groups": 0, "reg_dec_producer": 0, "reg_inc_consumer": 0}, "(3072, 3584, 18944, 128, 8, 104)": {"BLOCK_SIZE_M": 128, "BLOCK_SIZE_N": 64, "BLOCK_SIZE_K": 64, "GROUP_SIZE_M": 8, "A_load_order": 0, "waves_per_eu": 4, "matrix_instr_nonkdim": 16, "num_warps": 4, "num_ctas": 1, "num_stages": 1, "num_buffers_warp_spec": 0, "num_consumer_groups": 0, "reg_dec_producer": 0, "reg_inc_consumer": 0}, "(1536, 3584, 18944, 128, 8, 104)": {"BLOCK_SIZE_M": 128, "BLOCK_SIZE_N": 64, "BLOCK_SIZE_K": 64, "GROUP_SIZE_M": 8, "A_load_order": 0, "waves_per_eu": 4, "matrix_instr_nonkdim": 16, "num_warps": 4, "num_ctas": 1, "num_stages": 1, "num_buffers_warp_spec": 0, "num_consumer_groups": 0, "reg_dec_producer": 0, "reg_inc_consumer": 0}, "(768, 3584, 18944, 128, 8, 104)": {"BLOCK_SIZE_M": 128, "BLOCK_SIZE_N": 64, "BLOCK_SIZE_K": 64, "GROUP_SIZE_M": 8, "A_load_order": 0, "waves_per_eu": 0, "matrix_instr_nonkdim": 16, "num_warps": 4, "num_ctas": 1, "num_stages": 1, "num_buffers_warp_spec": 0, "num_consumer_groups": 0, "reg_dec_producer": 0, "reg_inc_consumer": 0}, "(384, 3584, 18944, 128, 8, 104)": {"BLOCK_SIZE_M": 64, "BLOCK_SIZE_N": 32, "BLOCK_SIZE_K": 128, "GROUP_SIZE_M": 8, "A_load_order": 0, "waves_per_eu": 4, "matrix_instr_nonkdim": 16, "num_warps": 4, "num_ctas": 1, "num_stages": 1, "num_buffers_warp_spec": 0, "num_consumer_groups": 0, "reg_dec_producer": 0, "reg_inc_consumer": 0}, "(192, 3584, 18944, 128, 8, 104)": {"BLOCK_SIZE_M": 64, "BLOCK_SIZE_N": 64, "BLOCK_SIZE_K": 64, "GROUP_SIZE_M": 8, "A_load_order": 0, "waves_per_eu": 0, "matrix_instr_nonkdim": 16, "num_warps": 8, "num_ctas": 1, "num_stages": 2, "num_buffers_warp_spec": 0, "num_consumer_groups": 0, "reg_dec_producer": 0, "reg_inc_consumer": 0}, "(96, 3584, 18944, 128, 8, 104)": {"BLOCK_SIZE_M": 64, "BLOCK_SIZE_N": 32, "BLOCK_SIZE_K": 64, "GROUP_SIZE_M": 8, "A_load_order": 0, "waves_per_eu": 0, "matrix_instr_nonkdim": 16, "num_warps": 4, "num_ctas": 1, "num_stages": 2, "num_buffers_warp_spec": 0, "num_consumer_groups": 0, "reg_dec_producer": 0, "reg_inc_consumer": 0}, "(4096, 37888, 3584, 128, 8, 104)": {"BLOCK_SIZE_M": 256, "BLOCK_SIZE_N": 128, "BLOCK_SIZE_K": 32, "GROUP_SIZE_M": 8, "A_load_order": 0, "waves_per_eu": 2, "matrix_instr_nonkdim": 16, "num_warps": 4, "num_ctas": 1, "num_stages": 1, "num_buffers_warp_spec": 0, "num_consumer_groups": 0, "reg_dec_producer": 0, "reg_inc_consumer": 0}, "(3072, 37888, 3584, 128, 8, 104)": {"BLOCK_SIZE_M": 256, "BLOCK_SIZE_N": 128, "BLOCK_SIZE_K": 32, "GROUP_SIZE_M": 8, "A_load_order": 0, "waves_per_eu": 2, "matrix_instr_nonkdim": 16, "num_warps": 4, "num_ctas": 1, "num_stages": 1, "num_buffers_warp_spec": 0, "num_consumer_groups": 0, "reg_dec_producer": 0, "reg_inc_consumer": 0}, "(1536, 37888, 3584, 128, 8, 104)": {"BLOCK_SIZE_M": 256, "BLOCK_SIZE_N": 128, "BLOCK_SIZE_K": 32, "GROUP_SIZE_M": 8, "A_load_order": 0, "waves_per_eu": 2, "matrix_instr_nonkdim": 16, "num_warps": 4, "num_ctas": 1, "num_stages": 1, "num_buffers_warp_spec": 0, "num_consumer_groups": 0, "reg_dec_producer": 0, "reg_inc_consumer": 0}, "(768, 37888, 3584, 128, 8, 104)": {"BLOCK_SIZE_M": 256, "BLOCK_SIZE_N": 128, "BLOCK_SIZE_K": 32, "GROUP_SIZE_M": 8, "A_load_order": 0, "waves_per_eu": 0, "matrix_instr_nonkdim": 16, "num_warps": 8, "num_ctas": 1, "num_stages": 1, "num_buffers_warp_spec": 0, "num_consumer_groups": 0, "reg_dec_producer": 0, "reg_inc_consumer": 0}, "(384, 37888, 3584, 128, 8, 104)": {"BLOCK_SIZE_M": 256, "BLOCK_SIZE_N": 128, "BLOCK_SIZE_K": 32, "GROUP_SIZE_M": 8, "A_load_order": 0, "waves_per_eu": 2, "matrix_instr_nonkdim": 16, "num_warps": 4, "num_ctas": 1, "num_stages": 1, "num_buffers_warp_spec": 0, "num_consumer_groups": 0, "reg_dec_producer": 0, "reg_inc_consumer": 0}, "(192, 37888, 3584, 128, 8, 104)": {"BLOCK_SIZE_M": 256, "BLOCK_SIZE_N": 64, "BLOCK_SIZE_K": 64, "GROUP_SIZE_M": 8, "A_load_order": 0, "waves_per_eu": 2, "matrix_instr_nonkdim": 16, "num_warps": 4, "num_ctas": 1, "num_stages": 1, "num_buffers_warp_spec": 0, "num_consumer_groups": 0, "reg_dec_producer": 0, "reg_inc_consumer": 0}, "(96, 37888, 3584, 128, 8, 104)": {"BLOCK_SIZE_M": 128, "BLOCK_SIZE_N": 64, "BLOCK_SIZE_K": 64, "GROUP_SIZE_M": 8, "A_load_order": 0, "waves_per_eu": 2, "matrix_instr_nonkdim": 16, "num_warps": 4, "num_ctas": 1, "num_stages": 1, "num_buffers_warp_spec": 0, "num_consumer_groups": 0, "reg_dec_producer": 0, "reg_inc_consumer": 0}, "(4096, 3584, 3584, 64, 8, 104)": {"BLOCK_SIZE_M": 256, "BLOCK_SIZE_N": 128, "BLOCK_SIZE_K": 32, "GROUP_SIZE_M": 8, "A_load_order": 0, "waves_per_eu": 2, "matrix_instr_nonkdim": 16, "num_warps": 4, "num_ctas": 1, "num_stages": 1, "num_buffers_warp_spec": 0, "num_consumer_groups": 0, "reg_dec_producer": 0, "reg_inc_consumer": 0}, "(3072, 3584, 3584, 64, 8, 104)": {"BLOCK_SIZE_M": 256, "BLOCK_SIZE_N": 128, "BLOCK_SIZE_K": 32, "GROUP_SIZE_M": 8, "A_load_order": 0, "waves_per_eu": 2, "matrix_instr_nonkdim": 16, "num_warps": 4, "num_ctas": 1, "num_stages": 1, "num_buffers_warp_spec": 0, "num_consumer_groups": 0, "reg_dec_producer": 0, "reg_inc_consumer": 0}, "(1536, 3584, 3584, 64, 8, 104)": {"BLOCK_SIZE_M": 256, "BLOCK_SIZE_N": 64, "BLOCK_SIZE_K": 64, "GROUP_SIZE_M": 8, "A_load_order": 0, "waves_per_eu": 2, "matrix_instr_nonkdim": 16, "num_warps": 4, "num_ctas": 1, "num_stages": 1, "num_buffers_warp_spec": 0, "num_consumer_groups": 0, "reg_dec_producer": 0, "reg_inc_consumer": 0}, "(768, 3584, 3584, 64, 8, 104)": {"BLOCK_SIZE_M": 128, "BLOCK_SIZE_N": 64, "BLOCK_SIZE_K": 64, "GROUP_SIZE_M": 8, "A_load_order": 0, "waves_per_eu": 4, "matrix_instr_nonkdim": 16, "num_warps": 4, "num_ctas": 1, "num_stages": 1, "num_buffers_warp_spec": 0, "num_consumer_groups": 0, "reg_dec_producer": 0, "reg_inc_consumer": 0}, "(384, 3584, 3584, 64, 8, 104)": {"BLOCK_SIZE_M": 64, "BLOCK_SIZE_N": 32, "BLOCK_SIZE_K": 64, "GROUP_SIZE_M": 8, "A_load_order": 0, "waves_per_eu": 4, "matrix_instr_nonkdim": 16, "num_warps": 4, "num_ctas": 1, "num_stages": 1, "num_buffers_warp_spec": 0, "num_consumer_groups": 0, "reg_dec_producer": 0, "reg_inc_consumer": 0}, "(192, 3584, 3584, 64, 8, 104)": {"BLOCK_SIZE_M": 64, "BLOCK_SIZE_N": 64, "BLOCK_SIZE_K": 64, "GROUP_SIZE_M": 8, "A_load_order": 0, "waves_per_eu": 0, "matrix_instr_nonkdim": 16, "num_warps": 8, "num_ctas": 1, "num_stages": 2, "num_buffers_warp_spec": 0, "num_consumer_groups": 0, "reg_dec_producer": 0, "reg_inc_consumer": 0}, "(96, 3584, 3584, 64, 8, 104)": {"BLOCK_SIZE_M": 64, "BLOCK_SIZE_N": 32, "BLOCK_SIZE_K": 64, "GROUP_SIZE_M": 8, "A_load_order": 0, "waves_per_eu": 0, "matrix_instr_nonkdim": 16, "num_warps": 4, "num_ctas": 1, "num_stages": 2, "num_buffers_warp_spec": 0, "num_consumer_groups": 0, "reg_dec_producer": 0, "reg_inc_consumer": 0}, "(4096, 4608, 3584, 64, 8, 104)": {"BLOCK_SIZE_M": 256, "BLOCK_SIZE_N": 128, "BLOCK_SIZE_K": 32, "GROUP_SIZE_M": 8, "A_load_order": 0, "waves_per_eu": 2, "matrix_instr_nonkdim": 16, "num_warps": 4, "num_ctas": 1, "num_stages": 1, "num_buffers_warp_spec": 0, "num_consumer_groups": 0, "reg_dec_producer": 0, "reg_inc_consumer": 0}, "(3072, 4608, 3584, 64, 8, 104)": {"BLOCK_SIZE_M": 256, "BLOCK_SIZE_N": 128, "BLOCK_SIZE_K": 32, "GROUP_SIZE_M": 8, "A_load_order": 0, "waves_per_eu": 2, "matrix_instr_nonkdim": 16, "num_warps": 4, "num_ctas": 1, "num_stages": 1, "num_buffers_warp_spec": 0, "num_consumer_groups": 0, "reg_dec_producer": 0, "reg_inc_consumer": 0}, "(1536, 4608, 3584, 64, 8, 104)": {"BLOCK_SIZE_M": 128, "BLOCK_SIZE_N": 64, "BLOCK_SIZE_K": 64, "GROUP_SIZE_M": 8, "A_load_order": 0, "waves_per_eu": 2, "matrix_instr_nonkdim": 16, "num_warps": 4, "num_ctas": 1, "num_stages": 1, "num_buffers_warp_spec": 0, "num_consumer_groups": 0, "reg_dec_producer": 0, "reg_inc_consumer": 0}, "(768, 4608, 3584, 64, 8, 104)": {"BLOCK_SIZE_M": 128, "BLOCK_SIZE_N": 64, "BLOCK_SIZE_K": 64, "GROUP_SIZE_M": 8, "A_load_order": 0, "waves_per_eu": 4, "matrix_instr_nonkdim": 16, "num_warps": 4, "num_ctas": 1, "num_stages": 1, "num_buffers_warp_spec": 0, "num_consumer_groups": 0, "reg_dec_producer": 0, "reg_inc_consumer": 0}, "(384, 4608, 3584, 64, 8, 104)": {"BLOCK_SIZE_M": 64, "BLOCK_SIZE_N": 32, "BLOCK_SIZE_K": 64, "GROUP_SIZE_M": 8, "A_load_order": 0, "waves_per_eu": 4, "matrix_instr_nonkdim": 16, "num_warps": 4, "num_ctas": 1, "num_stages": 2, "num_buffers_warp_spec": 0, "num_consumer_groups": 0, "reg_dec_producer": 0, "reg_inc_consumer": 0}, "(192, 4608, 3584, 64, 8, 104)": {"BLOCK_SIZE_M": 64, "BLOCK_SIZE_N": 64, "BLOCK_SIZE_K": 64, "GROUP_SIZE_M": 8, "A_load_order": 0, "waves_per_eu": 0, "matrix_instr_nonkdim": 16, "num_warps": 8, "num_ctas": 1, "num_stages": 2, "num_buffers_warp_spec": 0, "num_consumer_groups": 0, "reg_dec_producer": 0, "reg_inc_consumer": 0}, "(96, 4608, 3584, 64, 8, 104)": {"BLOCK_SIZE_M": 64, "BLOCK_SIZE_N": 32, "BLOCK_SIZE_K": 64, "GROUP_SIZE_M": 8, "A_load_order": 0, "waves_per_eu": 0, "matrix_instr_nonkdim": 16, "num_warps": 4, "num_ctas": 1, "num_stages": 2, "num_buffers_warp_spec": 0, "num_consumer_groups": 0, "reg_dec_producer": 0, "reg_inc_consumer": 0}, "(4096, 3584, 18944, 64, 8, 104)": {"BLOCK_SIZE_M": 256, "BLOCK_SIZE_N": 128, "BLOCK_SIZE_K": 32, "GROUP_SIZE_M": 8, "A_load_order": 0, "waves_per_eu": 2, "matrix_instr_nonkdim": 16, "num_warps": 4, "num_ctas": 1, "num_stages": 1, "num_buffers_warp_spec": 0, "num_consumer_groups": 0, "reg_dec_producer": 0, "reg_inc_consumer": 0}, "(3072, 3584, 18944, 64, 8, 104)": {"BLOCK_SIZE_M": 128, "BLOCK_SIZE_N": 64, "BLOCK_SIZE_K": 64, "GROUP_SIZE_M": 8, "A_load_order": 0, "waves_per_eu": 4, "matrix_instr_nonkdim": 16, "num_warps": 4, "num_ctas": 1, "num_stages": 1, "num_buffers_warp_spec": 0, "num_consumer_groups": 0, "reg_dec_producer": 0, "reg_inc_consumer": 0}, "(1536, 3584, 18944, 64, 8, 104)": {"BLOCK_SIZE_M": 128, "BLOCK_SIZE_N": 64, "BLOCK_SIZE_K": 64, "GROUP_SIZE_M": 8, "A_load_order": 0, "waves_per_eu": 4, "matrix_instr_nonkdim": 16, "num_warps": 4, "num_ctas": 1, "num_stages": 1, "num_buffers_warp_spec": 0, "num_consumer_groups": 0, "reg_dec_producer": 0, "reg_inc_consumer": 0}, "(768, 3584, 18944, 64, 8, 104)": {"BLOCK_SIZE_M": 128, "BLOCK_SIZE_N": 64, "BLOCK_SIZE_K": 64, "GROUP_SIZE_M": 8, "A_load_order": 0, "waves_per_eu": 4, "matrix_instr_nonkdim": 16, "num_warps": 4, "num_ctas": 1, "num_stages": 1, "num_buffers_warp_spec": 0, "num_consumer_groups": 0, "reg_dec_producer": 0, "reg_inc_consumer": 0}, "(384, 3584, 18944, 64, 8, 104)": {"BLOCK_SIZE_M": 64, "BLOCK_SIZE_N": 32, "BLOCK_SIZE_K": 64, "GROUP_SIZE_M": 8, "A_load_order": 0, "waves_per_eu": 4, "matrix_instr_nonkdim": 16, "num_warps": 4, "num_ctas": 1, "num_stages": 1, "num_buffers_warp_spec": 0, "num_consumer_groups": 0, "reg_dec_producer": 0, "reg_inc_consumer": 0}, "(192, 3584, 18944, 64, 8, 104)": {"BLOCK_SIZE_M": 64, "BLOCK_SIZE_N": 64, "BLOCK_SIZE_K": 64, "GROUP_SIZE_M": 8, "A_load_order": 0, "waves_per_eu": 0, "matrix_instr_nonkdim": 16, "num_warps": 8, "num_ctas": 1, "num_stages": 2, "num_buffers_warp_spec": 0, "num_consumer_groups": 0, "reg_dec_producer": 0, "reg_inc_consumer": 0}, "(96, 3584, 18944, 64, 8, 104)": {"BLOCK_SIZE_M": 64, "BLOCK_SIZE_N": 32, "BLOCK_SIZE_K": 64, "GROUP_SIZE_M": 8, "A_load_order": 0, "waves_per_eu": 0, "matrix_instr_nonkdim": 16, "num_warps": 4, "num_ctas": 1, "num_stages": 2, "num_buffers_warp_spec": 0, "num_consumer_groups": 0, "reg_dec_producer": 0, "reg_inc_consumer": 0}, "(4096, 37888, 3584, 64, 8, 104)": {"BLOCK_SIZE_M": 256, "BLOCK_SIZE_N": 128, "BLOCK_SIZE_K": 32, "GROUP_SIZE_M": 8, "A_load_order": 0, "waves_per_eu": 2, "matrix_instr_nonkdim": 16, "num_warps": 4, "num_ctas": 1, "num_stages": 1, "num_buffers_warp_spec": 0, "num_consumer_groups": 0, "reg_dec_producer": 0, "reg_inc_consumer": 0}, "(3072, 37888, 3584, 64, 8, 104)": {"BLOCK_SIZE_M": 256, "BLOCK_SIZE_N": 128, "BLOCK_SIZE_K": 32, "GROUP_SIZE_M": 8, "A_load_order": 0, "waves_per_eu": 2, "matrix_instr_nonkdim": 16, "num_warps": 4, "num_ctas": 1, "num_stages": 1, "num_buffers_warp_spec": 0, "num_consumer_groups": 0, "reg_dec_producer": 0, "reg_inc_consumer": 0}, "(1536, 37888, 3584, 64, 8, 104)": {"BLOCK_SIZE_M": 256, "BLOCK_SIZE_N": 128, "BLOCK_SIZE_K": 32, "GROUP_SIZE_M": 8, "A_load_order": 0, "waves_per_eu": 2, "matrix_instr_nonkdim": 16, "num_warps": 4, "num_ctas": 1, "num_stages": 1, "num_buffers_warp_spec": 0, "num_consumer_groups": 0, "reg_dec_producer": 0, "reg_inc_consumer": 0}, "(768, 37888, 3584, 64, 8, 104)": {"BLOCK_SIZE_M": 256, "BLOCK_SIZE_N": 64, "BLOCK_SIZE_K": 64, "GROUP_SIZE_M": 8, "A_load_order": 0, "waves_per_eu": 2, "matrix_instr_nonkdim": 16, "num_warps": 4, "num_ctas": 1, "num_stages": 1, "num_buffers_warp_spec": 0, "num_consumer_groups": 0, "reg_dec_producer": 0, "reg_inc_consumer": 0}, "(384, 37888, 3584, 64, 8, 104)": {"BLOCK_SIZE_M": 256, "BLOCK_SIZE_N": 128, "BLOCK_SIZE_K": 32, "GROUP_SIZE_M": 8, "A_load_order": 0, "waves_per_eu": 2, "matrix_instr_nonkdim": 16, "num_warps": 4, "num_ctas": 1, "num_stages": 1, "num_buffers_warp_spec": 0, "num_consumer_groups": 0, "reg_dec_producer": 0, "reg_inc_consumer": 0}, "(192, 37888, 3584, 64, 8, 104)": {"BLOCK_SIZE_M": 256, "BLOCK_SIZE_N": 64, "BLOCK_SIZE_K": 64, "GROUP_SIZE_M": 8, "A_load_order": 0, "waves_per_eu": 2, "matrix_instr_nonkdim": 16, "num_warps": 4, "num_ctas": 1, "num_stages": 1, "num_buffers_warp_spec": 0, "num_consumer_groups": 0, "reg_dec_producer": 0, "reg_inc_consumer": 0}, "(96, 37888, 3584, 64, 8, 104)": {"BLOCK_SIZE_M": 128, "BLOCK_SIZE_N": 64, "BLOCK_SIZE_K": 64, "GROUP_SIZE_M": 8, "A_load_order": 0, "waves_per_eu": 4, "matrix_instr_nonkdim": 16, "num_warps": 4, "num_ctas": 1, "num_stages": 1, "num_buffers_warp_spec": 0, "num_consumer_groups": 0, "reg_dec_producer": 0, "reg_inc_consumer": 0}}}